{
    "total": 3,
    "page": 0,
    "records": [
      {
        "range": "144.80.0.0/16",
        "id": "IUP",
        "name": "Indiana University of Pennsylvania",
        "country": "US",
        "org": "IUP-1-Z",
        "status": "ALLOCATION",
        "tech": null,
        "maintainer": null,
        "admin": {
          "id": "TOYCO-ARIN",
          "name": "Cody Toy",
          "email": "catoy@iup.edu",
          "address": "US, PA, Indiana, G20 Stright Hall\\n210 S 10th ST, 15705",
          "country": "US",
          "phone": "+1-724-762-6686",
          "fax": "",
          "created": "2021-10-15",
          "updated": "2021-10-15",
          "source": "arin",
          "raw": "POCHandle:      TOYCO-ARIN\\nIsRole:         N\\nLastName:       Toy\\nFirstName:      Cody\\nStreet:         G20 Stright Hall\\nStreet:         210 S 10th ST\\nCity:           Indiana\\nState/Prov:     PA\\nCountry:        US\\nPostalCode:     15705\\nRegDate:        2021-10-15\\nUpdated:        2021-10-15\\nOfficePhone:    +1-724-357-1213\\nMobilePhone:    +1-724-762-6686\\nMailbox:        catoy@iup.edu\\nSource:         ARIN\\n"
        },
        "abuse": {
          "id": "ROUMF-ARIN",
          "name": "Jonathan Roumfort",
          "email": "roumfort@iup.edu",
          "address": "US, PA, Indiana, G19 Stright Hall\\n210 South 10th Street, 15705",
          "country": "US",
          "phone": "",
          "fax": "",
          "created": "2021-06-02",
          "updated": "2022-06-02",
          "source": "arin",
          "raw": "POCHandle:      ROUMF-ARIN\\nIsRole:         N\\nLastName:       Roumfort\\nFirstName:      Jonathan\\nStreet:         G19 Stright Hall\\nStreet:         210 South 10th Street\\nCity:           Indiana\\nState/Prov:     PA\\nCountry:        US\\nPostalCode:     15705\\nRegDate:        2021-06-02\\nUpdated:        2022-06-02\\nOfficePhone:    +1-724-357-4718\\nMailbox:        roumfort@iup.edu\\nSource:         ARIN\\n"
        },
        "created": "1990-11-20",
        "updated": "2022-03-31",
        "source": "arin",
        "raw": "NetHandle:      NET-144-80-0-0-1\nOrgID:          IUP-1-Z\nParent:         NET-144-0-0-0-0\nNetName:        IUP\nNetRange:       144.80.0.0 - 144.80.255.255\nNetType:        allocation\nOriginAS:       62989\nRegDate:        1990-11-20\nUpdated:        2022-03-31\nSource:         ARIN\n\n\nOrgID:          IUP-1-Z\nOrgName:        Indiana University of Pennsylvania\nCanAllocate:    \nStreet:         Computer Center\nStreet:         Stright Hall\nCity:           Indiana\nState/Prov:     PA\nCountry:        US\nPostalCode:     15705-1087\nRegDate:        2022-03-15\nUpdated:        2022-03-15\nOrgAbuseHandle: ROUMF-ARIN\nOrgAbuseHandle: TOYCO-ARIN\nOrgAdminHandle: TOYCO-ARIN\nOrgNOCHandle:   ROUMF-ARIN\nOrgNOCHandle:   TOYCO-ARIN\nOrgTechHandle:  ROUMF-ARIN\nOrgTechHandle:  TOYCO-ARIN\nSource:         ARIN\n\n\nPOCHandle:      TOYCO-ARIN\nIsRole:         N\nLastName:       Toy\nFirstName:      Cody\nStreet:         G20 Stright Hall\nStreet:         210 S 10th ST\nCity:           Indiana\nState/Prov:     PA\nCountry:        US\nPostalCode:     15705\nRegDate:        2021-10-15\nUpdated:        2021-10-15\nOfficePhone:    +1-724-357-1213\nMobilePhone:    +1-724-762-6686\nMailbox:        catoy@iup.edu\nSource:         ARIN\n\n\nPOCHandle:      ROUMF-ARIN\nIsRole:         N\nLastName:       Roumfort\nFirstName:      Jonathan\nStreet:         G19 Stright Hall\nStreet:         210 South 10th Street\nCity:           Indiana\nState/Prov:     PA\nCountry:        US\nPostalCode:     15705\nRegDate:        2021-06-02\nUpdated:        2022-06-02\nOfficePhone:    +1-724-357-4718\nMailbox:        roumfort@iup.edu\nSource:         ARIN\n",
        "domain": "iup.edu"
      },
      {
        "range": "204.108.176.0/23",
        "id": "IUP-PASSHE",
        "name": "Indiana University of Pennsylvania",
        "country": "US",
        "org": "IUP-1",
        "status": "ALLOCATION",
        "tech": null,
        "maintainer": null,
        "admin": {
          "id": "TOYCO-ARIN",
          "name": "Cody Toy",
          "email": "catoy@iup.edu",
          "address": "US, PA, Indiana, G20 Stright Hall\\n210 S 10th ST, 15705",
          "country": "US",
          "phone": "+1-724-762-6686",
          "fax": "",
          "created": "2021-10-15",
          "updated": "2021-10-15",
          "source": "arin",
          "raw": "POCHandle:      TOYCO-ARIN\\nIsRole:         N\\nLastName:       Toy\\nFirstName:      Cody\\nStreet:         G20 Stright Hall\\nStreet:         210 S 10th ST\\nCity:           Indiana\\nState/Prov:     PA\\nCountry:        US\\nPostalCode:     15705\\nRegDate:        2021-10-15\\nUpdated:        2021-10-15\\nOfficePhone:    +1-724-357-1213\\nMobilePhone:    +1-724-762-6686\\nMailbox:        catoy@iup.edu\\nSource:         ARIN\\n"
        },
        "abuse": {
          "id": "ROUMF-ARIN",
          "name": "Jonathan Roumfort",
          "email": "roumfort@iup.edu",
          "address": "US, PA, Indiana, G19 Stright Hall\\n210 South 10th Street, 15705",
          "country": "US",
          "phone": "",
          "fax": "",
          "created": "2021-06-02",
          "updated": "2022-06-02",
          "source": "arin",
          "raw": "POCHandle:      ROUMF-ARIN\\nIsRole:         N\\nLastName:       Roumfort\\nFirstName:      Jonathan\\nStreet:         G19 Stright Hall\\nStreet:         210 South 10th Street\\nCity:           Indiana\\nState/Prov:     PA\\nCountry:        US\\nPostalCode:     15705\\nRegDate:        2021-06-02\\nUpdated:        2022-06-02\\nOfficePhone:    +1-724-357-4718\\nMailbox:        roumfort@iup.edu\\nSource:         ARIN\\n"
        },
        "created": "1994-10-06",
        "updated": "2021-12-14",
        "source": "arin",
        "raw": "NetHandle:      NET-204-108-176-0-1\nOrgID:          IUP-1\nParent:         NET-204-0-0-0-0\nNetName:        IUP-PASSHE\nNetRange:       204.108.176.0 - 204.108.177.255\nNetType:        allocation\nOriginAS:       62989\nRegDate:        1994-10-06\nUpdated:        2021-12-14\nSource:         ARIN\n\n\nOrgID:          IUP-1\nOrgName:        Indiana University of Pennsylvania\nCanAllocate:    \nStreet:         Computer Center\nStreet:         Stright Hall\nCity:           Indiana\nState/Prov:     PA\nCountry:        US\nPostalCode:     15705-1087\nRegDate:        1992-03-20\nUpdated:        2021-11-15\nOrgAbuseHandle: ROUMF-ARIN\nOrgAbuseHandle: TOYCO-ARIN\nOrgAdminHandle: TOYCO-ARIN\nOrgNOCHandle:   ROUMF-ARIN\nOrgNOCHandle:   TOYCO-ARIN\nOrgTechHandle:  ROUMF-ARIN\nOrgTechHandle:  TOYCO-ARIN\nSource:         ARIN\n\n\nPOCHandle:      TOYCO-ARIN\nIsRole:         N\nLastName:       Toy\nFirstName:      Cody\nStreet:         G20 Stright Hall\nStreet:         210 S 10th ST\nCity:           Indiana\nState/Prov:     PA\nCountry:        US\nPostalCode:     15705\nRegDate:        2021-10-15\nUpdated:        2021-10-15\nOfficePhone:    +1-724-357-1213\nMobilePhone:    +1-724-762-6686\nMailbox:        catoy@iup.edu\nSource:         ARIN\n\n\nPOCHandle:      ROUMF-ARIN\nIsRole:         N\nLastName:       Roumfort\nFirstName:      Jonathan\nStreet:         G19 Stright Hall\nStreet:         210 South 10th Street\nCity:           Indiana\nState/Prov:     PA\nCountry:        US\nPostalCode:     15705\nRegDate:        2021-06-02\nUpdated:        2022-06-02\nOfficePhone:    +1-724-357-4718\nMailbox:        roumfort@iup.edu\nSource:         ARIN\n",
        "domain": "iup.edu"
      },
      {
        "range": "192.231.220.0/24",
        "id": "IUP-DMZ",
        "name": "Indiana University of Pennsylvania",
        "country": "US",
        "org": "IUP-1-Z",
        "status": "ALLOCATION",
        "tech": null,
        "maintainer": null,
        "admin": {
          "id": "TOYCO-ARIN",
          "name": "Cody Toy",
          "email": "catoy@iup.edu",
          "address": "US, PA, Indiana, G20 Stright Hall\\n210 S 10th ST, 15705",
          "country": "US",
          "phone": "+1-724-762-6686",
          "fax": "",
          "created": "2021-10-15",
          "updated": "2021-10-15",
          "source": "arin",
          "raw": "POCHandle:      TOYCO-ARIN\\nIsRole:         N\\nLastName:       Toy\\nFirstName:      Cody\\nStreet:         G20 Stright Hall\\nStreet:         210 S 10th ST\\nCity:           Indiana\\nState/Prov:     PA\\nCountry:        US\\nPostalCode:     15705\\nRegDate:        2021-10-15\\nUpdated:        2021-10-15\\nOfficePhone:    +1-724-357-1213\\nMobilePhone:    +1-724-762-6686\\nMailbox:        catoy@iup.edu\\nSource:         ARIN\\n"
        },
        "abuse": {
          "id": "ROUMF-ARIN",
          "name": "Jonathan Roumfort",
          "email": "roumfort@iup.edu",
          "address": "US, PA, Indiana, G19 Stright Hall\\n210 South 10th Street, 15705",
          "country": "US",
          "phone": "",
          "fax": "",
          "created": "2021-06-02",
          "updated": "2022-06-02",
          "source": "arin",
          "raw": "POCHandle:      ROUMF-ARIN\\nIsRole:         N\\nLastName:       Roumfort\\nFirstName:      Jonathan\\nStreet:         G19 Stright Hall\\nStreet:         210 South 10th Street\\nCity:           Indiana\\nState/Prov:     PA\\nCountry:        US\\nPostalCode:     15705\\nRegDate:        2021-06-02\\nUpdated:        2022-06-02\\nOfficePhone:    +1-724-357-4718\\nMailbox:        roumfort@iup.edu\\nSource:         ARIN\\n"
        },
        "created": "1992-10-22",
        "updated": "2022-03-31",
        "source": "arin",
        "raw": "NetHandle:      NET-192-231-220-0-1\nOrgID:          IUP-1-Z\nParent:         NET-192-0-0-0-0\nNetName:        IUP-DMZ\nNetRange:       192.231.220.0 - 192.231.220.255\nNetType:        allocation\nOriginAS:       62989\nRegDate:        1992-10-22\nUpdated:        2022-03-31\nSource:         ARIN\n\n\nOrgID:          IUP-1-Z\nOrgName:        Indiana University of Pennsylvania\nCanAllocate:    \nStreet:         Computer Center\nStreet:         Stright Hall\nCity:           Indiana\nState/Prov:     PA\nCountry:        US\nPostalCode:     15705-1087\nRegDate:        2022-03-15\nUpdated:        2022-03-15\nOrgAbuseHandle: ROUMF-ARIN\nOrgAbuseHandle: TOYCO-ARIN\nOrgAdminHandle: TOYCO-ARIN\nOrgNOCHandle:   ROUMF-ARIN\nOrgNOCHandle:   TOYCO-ARIN\nOrgTechHandle:  ROUMF-ARIN\nOrgTechHandle:  TOYCO-ARIN\nSource:         ARIN\n\n\nPOCHandle:      TOYCO-ARIN\nIsRole:         N\nLastName:       Toy\nFirstName:      Cody\nStreet:         G20 Stright Hall\nStreet:         210 S 10th ST\nCity:           Indiana\nState/Prov:     PA\nCountry:        US\nPostalCode:     15705\nRegDate:        2021-10-15\nUpdated:        2021-10-15\nOfficePhone:    +1-724-357-1213\nMobilePhone:    +1-724-762-6686\nMailbox:        catoy@iup.edu\nSource:         ARIN\n\n\nPOCHandle:      ROUMF-ARIN\nIsRole:         N\nLastName:       Roumfort\nFirstName:      Jonathan\nStreet:         G19 Stright Hall\nStreet:         210 South 10th Street\nCity:           Indiana\nState/Prov:     PA\nCountry:        US\nPostalCode:     15705\nRegDate:        2021-06-02\nUpdated:        2022-06-02\nOfficePhone:    +1-724-357-4718\nMailbox:        roumfort@iup.edu\nSource:         ARIN\n",
        "domain": "iup.edu"
      }
    ],
    "net": "iup.edu"
  }