{
    "total": 1,
    "page": 0,
    "records": [
      {
        "id": "PEAK",
        "name": "PEAK 10",
        "address": null,
        "country": "US",
        "admin": {
          "id": "DTR20-ARIN",
          "name": "Devon True",
          "email": "devon.true@flexential.com",
          "address": "US, NC, Charlotte, 600 Forest Point Circle, Suite 100, 28273",
          "country": "US",
          "phone": "",
          "fax": "",
          "created": "2005-07-29",
          "updated": "2022-05-20",
          "source": "arin",
          "raw": "POCHandle:      DTR20-ARIN\\nIsRole:         N\\nLastName:       True\\nFirstName:      Devon\\nStreet:         600 Forest Point Circle, Suite 100\\nCity:           Charlotte\\nState/Prov:     NC\\nCountry:        US\\nPostalCode:     28273\\nRegDate:        2005-07-29\\nUpdated:        2022-05-20\\nOfficePhone:    +1-833-264-3539\\nMailbox:        devon.true@flexential.com\\nSource:         ARIN\\n"
        },
        "abuse": {
          "id": "ZP76-ARIN",
          "name": "Abuse",
          "email": "abuse@flexential.com",
          "address": "US, NC, Charlotte, 600 Forest Point Circle, Suite 100, 28273",
          "country": "US",
          "phone": "",
          "fax": "",
          "created": "2001-09-18",
          "updated": "2022-05-20",
          "source": "arin",
          "raw": "POCHandle:      ZP76-ARIN\\nIsRole:         Y\\nLastName:       Abuse\\nFirstName:      \\nStreet:         600 Forest Point Circle, Suite 100\\nCity:           Charlotte\\nState/Prov:     NC\\nCountry:        US\\nPostalCode:     28273\\nRegDate:        2001-09-18\\nUpdated:        2022-05-20\\nOfficePhone:    +1-833-264-3539\\nMailbox:        abuse@flexential.com\\nSource:         ARIN\\n"
        },
        "tech": {
          "id": "NETWO1470-ARIN",
          "name": "Network Engineering",
          "email": "dl-arin@flexential.com",
          "address": "US, NC, Charlotte, 600 Forest Point Circle, Suite 100, 28273",
          "country": "US",
          "phone": "",
          "fax": "",
          "created": "2006-12-13",
          "updated": "2022-05-20",
          "source": "arin",
          "raw": "POCHandle:      NETWO1470-ARIN\\nIsRole:         Y\\nLastName:       Network Engineering\\nFirstName:      \\nStreet:         600 Forest Point Circle, Suite 100\\nCity:           Charlotte\\nState/Prov:     NC\\nCountry:        US\\nPostalCode:     28273\\nRegDate:        2006-12-13\\nUpdated:        2022-05-20\\nOfficePhone:    +1-833-264-3539\\nMailbox:        dl-arin@flexential.com\\nSource:         ARIN\\n"
        },
        "maintainer": {
          "id": "ZP63-ARIN",
          "name": "Support",
          "email": "support@flexential.com",
          "address": "US, NC, Charlotte, 600 Forest Point Circle, Suite 100, 28273",
          "country": "US",
          "phone": "",
          "fax": "",
          "created": "2001-05-16",
          "updated": "2022-05-20",
          "source": "arin",
          "raw": "POCHandle:      ZP63-ARIN\\nIsRole:         Y\\nLastName:       Support\\nFirstName:      \\nStreet:         600 Forest Point Circle, Suite 100\\nCity:           Charlotte\\nState/Prov:     NC\\nCountry:        US\\nPostalCode:     28273\\nRegDate:        2001-05-16\\nUpdated:        2022-05-20\\nOfficePhone:    +1-833-264-3539\\nMailbox:        support@flexential.com\\nSource:         ARIN\\n"
        },
        "created": "2013-02-22",
        "updated": "2019-05-17",
        "source": "arin",
        "raw": "OrgID:          PEAK\nOrgName:        PEAK 10\nCanAllocate:    \nStreet:         8910 LENOX POINTE DR\nStreet:         BLDG MAIN FLR 1 RM ACCESS\nCity:           CHARLOTTE\nState/Prov:     NC\nCountry:        US\nPostalCode:     28273\nRegDate:        2013-02-22\nUpdated:        2019-05-17\nOrgAbuseHandle: ZP76-ARIN\nOrgAdminHandle: DTR20-ARIN\nOrgNOCHandle:   ZP63-ARIN\nOrgTechHandle:  NETWO1470-ARIN\nSource:         ARIN\n\n\nPOCHandle:      DTR20-ARIN\nIsRole:         N\nLastName:       True\nFirstName:      Devon\nStreet:         600 Forest Point Circle, Suite 100\nCity:           Charlotte\nState/Prov:     NC\nCountry:        US\nPostalCode:     28273\nRegDate:        2005-07-29\nUpdated:        2022-05-20\nOfficePhone:    +1-833-264-3539\nMailbox:        devon.true@flexential.com\nSource:         ARIN\n\n\nPOCHandle:      ZP76-ARIN\nIsRole:         Y\nLastName:       Abuse\nFirstName:      \nStreet:         600 Forest Point Circle, Suite 100\nCity:           Charlotte\nState/Prov:     NC\nCountry:        US\nPostalCode:     28273\nRegDate:        2001-09-18\nUpdated:        2022-05-20\nOfficePhone:    +1-833-264-3539\nMailbox:        abuse@flexential.com\nSource:         ARIN\n\n\nPOCHandle:      ZP63-ARIN\nIsRole:         Y\nLastName:       Support\nFirstName:      \nStreet:         600 Forest Point Circle, Suite 100\nCity:           Charlotte\nState/Prov:     NC\nCountry:        US\nPostalCode:     28273\nRegDate:        2001-05-16\nUpdated:        2022-05-20\nOfficePhone:    +1-833-264-3539\nMailbox:        support@flexential.com\nSource:         ARIN\n\n\nPOCHandle:      NETWO1470-ARIN\nIsRole:         Y\nLastName:       Network Engineering\nFirstName:      \nStreet:         600 Forest Point Circle, Suite 100\nCity:           Charlotte\nState/Prov:     NC\nCountry:        US\nPostalCode:     28273\nRegDate:        2006-12-13\nUpdated:        2022-05-20\nOfficePhone:    +1-833-264-3539\nMailbox:        dl-arin@flexential.com\nSource:         ARIN\n"
      }
    ],
    "org": "PEAK"
  }