[{"id": "SOFTECH-MNT", "name": "Softech SRL\\nStr. Frunzisului, Nr 29 Corp B, Et 1,\\nCluj-Napoca, Cluj, Romania RO-400664", "admin_id": "SL12950-RIPE", "tech_id": "SL12950-RIPE", "org_id": "ORG-SS940-RIPE", "created": "2019-02-18", "updated": "2019-02-18", "source": "ripe", "raw": "mntner:         SOFTECH-MNT\\ndescr:          Softech SRL\\ndescr:          Str. Frunzisului, Nr 29 Corp B, Et 1,\\ndescr:          Cluj-Napoca, Cluj, Romania RO-400664\\nadmin-c:        SL12950-RIPE\\ntech-c:         SL12950-RIPE\\norg:            ORG-SS940-RIPE\\nupd-to:         cs-it@codespring.ro\\nmnt-nfy:        cs-it@codespring.ro\\nauth:           MD5-PW\\nauth:           PGPKEY-7FD0A168\\nnotify:         cs-it@codespring.ro\\nmnt-by:         SOFTECH-MNT\\ncreated:        2019-02-18T08:20:13Z\\nlast-modified:  2019-02-18T08:20:13Z\\nsource:         RIPE"}, {"id": "VOITH-MNT", "name": "Voith Digital Solutions GmbH", "admin_id": "VRA8-RIPE", "tech_id": "VRA8-RIPE", "org_id": "ORG-VDSG3-RIPE", "created": "2009-07-17", "updated": "2017-11-20", "source": "ripe", "raw": "mntner:         VOITH-MNT\\norg:            ORG-VDSG3-RIPE\\ndescr:          Voith Digital Solutions GmbH\\ntech-c:         VRA8-RIPE\\nadmin-c:        VRA8-RIPE\\nupd-to:         dsgidn@voith.com\\nauth:           MD5-PW\\nauth:           SSO\\nauth:           SSO\\nmnt-by:         TSBS-MNT\\nmnt-by:         VOITH-MNT\\nmnt-by:         DTAG-NIC\\ncreated:        2009-07-17T08:23:02Z\\nlast-modified:  2017-11-20T14:01:52Z\\nsource:         RIPE"}, {"id": "SMART-TECH-MNT", "name": "Smart Technology Centre (PTY) LTD", "admin_id": "RM17505-RIPE", "tech_id": "RM17505-RIPE", "org_id": "ORG-STCL5-RIPE", "created": "2015-09-10", "updated": "2017-10-31", "source": "ripe", "raw": "mntner:         SMART-TECH-MNT\\ndescr:          Smart Technology Centre (PTY) LTD\\nadmin-c:        RM17505-RIPE\\ntech-c:         RM17505-RIPE\\nupd-to:         helpdesk@stc.za.com\\norg:            ORG-STCL5-RIPE\\nauth:           MD5-PW\\nauth:           SSO\\nmnt-by:         SMART-TECH-MNT\\ncreated:        2015-09-10T09:31:52Z\\nlast-modified:  2017-10-31T06:16:28Z\\nsource:         RIPE"}, {"id": "FIBERSPACE-MNT", "name": "S.C FIBERSPACE ROMANIA S.R.L", "admin_id": "LOG-RIPE", "tech_id": "LOG-RIPE", "org_id": "ORG-SFRS2-RIPE", "created": "2009-07-01", "updated": "2015-07-02", "source": "ripe", "raw": "mntner:         FIBERSPACE-MNT\\ndescr:          S.C FIBERSPACE ROMANIA S.R.L\\nadmin-c:        LOG-RIPE\\ntech-c:         LOG-RIPE\\norg:            ORG-SFRS2-RIPE\\nupd-to:         logic@thinknet.ro\\nauth:           MD5-PW\\nauth:           PGPKEY-92960A90\\nmnt-by:         FIBERSPACE-MNT\\ncreated:        2009-07-01T17:05:34Z\\nlast-modified:  2015-07-02T13:00:30Z\\nsource:         RIPE"}, {"id": "INCDFP-MNT", "name": "Institutul National de\\nCercetare Dezvoltare pentru\\nFizica Pamantului - INCDFP RA\\nCalugareni 12 Magurele ILFOV 077125 Romania RO", "admin_id": "VI544-RIPE", "tech_id": "SRU253-RIPE\\nAD430-RIPE", "org_id": "ORG-INdC1-RIPE", "created": "2009-06-08", "updated": "2019-02-28", "source": "ripe", "raw": "mntner:         INCDFP-MNT\\ndescr:          Institutul National de\\ndescr:          Cercetare Dezvoltare pentru\\ndescr:          Fizica Pamantului - INCDFP RA\\ndescr:          Calugareni 12 Magurele ILFOV 077125 Romania RO\\nadmin-c:        VI544-RIPE\\ntech-c:         SRU253-RIPE\\ntech-c:         AD430-RIPE\\norg:            ORG-INdC1-RIPE\\nupd-to:         viorel@infp.ro\\nmnt-nfy:        viorel@infp.ro\\nauth:           PGPKEY-7FD0A168\\nauth:           SSO\\nauth:           MD5-PW\\nnotify:         viorel@infp.ro\\nmnt-by:         INCDFP-MNT\\ncreated:        2009-06-08T05:15:14Z\\nlast-modified:  2019-02-28T12:03:13Z\\nsource:         RIPE"}, {"id": "SYNAPTIC-MNT", "name": "SYNAPTIC SYSTEMS SRL\\nStr. Putul cu Plopi nr. 18\\nBucuresti Bucuresti\\nRomania RO", "admin_id": "CD3665-RIPE", "tech_id": "CD3665-RIPE", "org_id": "ORG-SSS28-RIPE", "created": "2009-05-06", "updated": "2019-07-05", "source": "ripe", "raw": "mntner:         SYNAPTIC-MNT\\ndescr:          SYNAPTIC SYSTEMS SRL\\ndescr:          Str. Putul cu Plopi nr. 18\\ndescr:          Bucuresti Bucuresti\\ndescr:          Romania RO\\nadmin-c:        CD3665-RIPE\\ntech-c:         CD3665-RIPE\\norg:            ORG-SSS28-RIPE\\nupd-to:         costica.desaga@synaptic-systems.ro\\nmnt-nfy:        costica.desaga@synaptic-systems.ro\\nauth:           PGPKEY-7FD0A168\\nauth:           MD5-PW\\nnotify:         costica.desaga@synaptic-systems.ro\\nmnt-by:         SYNAPTIC-MNT\\ncreated:        2009-05-06T13:57:23Z\\nlast-modified:  2019-07-05T02:57:24Z\\nsource:         RIPE"}, {"id": "KABELPLUS-MNT", "name": "PP Kabel-Plus", "admin_id": "JVV52-RIPE", "tech_id": "JVV52-RIPE", "org_id": "ORG-PK8-RIPE", "created": "2006-01-18", "updated": "2018-12-27", "source": "ripe", "raw": "mntner:         KABELPLUS-MNT\\ndescr:          PP Kabel-Plus\\norg:            ORG-PK8-RIPE\\nadmin-c:        JVV52-RIPE\\ntech-c:         JVV52-RIPE\\nupd-to:         cabelplus@mail.ru\\nauth:           SSO\\nmnt-by:         KABELPLUS-MNT\\ncreated:        2006-01-18T16:50:55Z\\nlast-modified:  2018-12-27T11:36:12Z\\nsource:         RIPE"}, {"id": "BLUEMATRIX-MNT", "name": "BlueMatrix Research LTD\\n81 Rivington Street\\nLondon United Kingdom", "admin_id": "SH12741-RIPE", "tech_id": "SH12741-RIPE", "org_id": "ORG-BRL5-RIPE", "created": "2015-02-16", "updated": "2017-05-25", "source": "ripe", "raw": "mntner:         BLUEMATRIX-MNT\\ndescr:          BlueMatrix Research LTD\\ndescr:          81 Rivington Street\\ndescr:          London United Kingdom\\nadmin-c:        SH12741-RIPE\\ntech-c:         SH12741-RIPE\\norg:            ORG-BRL5-RIPE\\nupd-to:         skye.hauptman@bluematrix.com\\nmnt-nfy:        skye.hauptman@bluematrix.com\\nauth:           MD5-PW\\nauth:           SSO\\nauth:           PGPKEY-7FD0A168\\nnotify:         skye.hauptman@bluematrix.com\\nmnt-by:         BLUEMATRIX-MNT\\ncreated:        2015-02-16T10:02:45Z\\nlast-modified:  2017-05-25T12:47:24Z\\nsource:         RIPE"}, {"id": "LUKSUS-MNT", "name": "PPHU \"LUKSus\" Grzegorz Wloch\\nul. Boguminska 20\\n44-351 Turza Slaska\\nPoland", "admin_id": "GREG5-RIPE", "tech_id": "MARO3-RIPE", "org_id": "ORG-PGW1-RIPE", "created": "2006-06-13", "updated": "2016-04-08", "source": "ripe", "raw": "mntner:         LUKSUS-MNT\\ndescr:          PPHU \"LUKSus\" Grzegorz Wloch\\ndescr:          ul. Boguminska 20\\ndescr:          44-351 Turza Slaska\\ndescr:          Poland\\norg:            ORG-PGW1-RIPE\\nadmin-c:        GREG5-RIPE\\ntech-c:         MARO3-RIPE\\nupd-to:         hostmaster@luksus.net.pl\\nmnt-nfy:        hostmaster@luksus.net.pl\\nauth:           MD5-PW\\nauth:           SSO\\nmnt-by:         IPARTNERS-MNT\\nmnt-by:         LUKSUS-MNT\\ncreated:        2006-06-13T09:03:24Z\\nlast-modified:  2016-04-08T14:01:36Z\\nsource:         RIPE"}, {"id": "RTC-TELECOM-MNT", "name": "SC RTC TELECOM SRL\\nStr. Cernauti, Bl. 17A, Et.3, Ap.8\\nTimisoara, Timis\\nRomania", "admin_id": "RTH5-RIPE", "tech_id": "RTH5-RIPE", "org_id": "ORG-SRTS1-RIPE", "created": "2005-10-06", "updated": "2007-05-03", "source": "ripe", "raw": "mntner:         RTC-TELECOM-MNT\\ndescr:          SC RTC TELECOM SRL\\ndescr:          Str. Cernauti, Bl. 17A, Et.3, Ap.8\\ndescr:          Timisoara, Timis\\ndescr:          Romania\\nadmin-c:        RTH5-RIPE\\ntech-c:         RTH5-RIPE\\nupd-to:         hostmaster@rtctelecom.ro\\norg:            ORG-SRTS1-RIPE\\nremarks:        MD5 passwords older than November 2011 were removed from this maintainer, see: https://www.ripe.net/removed2011pw\\nmnt-by:         RTC-TELECOM-MNT\\ncreated:        2005-10-06T05:03:50Z\\nlast-modified:  2007-05-03T09:02:56Z\\nsource:         RIPE"}, {"id": "MNT-NETCOM-R", "name": "\"NetCom-R\" LLC", "admin_id": "DT6296-RIPE", "tech_id": "DT6296-RIPE", "org_id": "ORG-LA676-RIPE", "created": "2009-06-16", "updated": "2018-05-18", "source": "ripe", "raw": "mntner:         MNT-NETCOM-R\\nnotify:         noc@netcom-r.com\\ntech-c:         DT6296-RIPE\\norg:            ORG-LA676-RIPE\\ndescr:          \"NetCom-R\" LLC\\nadmin-c:        DT6296-RIPE\\nupd-to:         noc@netcom-r.com\\nauth:           MD5-PW\\nauth:           SSO\\nauth:           SSO\\nauth:           SSO\\nauth:           SSO\\nauth:           SSO\\nauth:           SSO\\nmnt-by:         MNT-NETCOM-R\\ncreated:        2009-06-16T14:15:40Z\\nlast-modified:  2018-05-18T08:28:05Z\\nsource:         RIPE"}, {"id": "SKYBELLL-MNT", "name": "maintainer for Skybelll", "admin_id": "YB287-RIPE", "tech_id": "YB287-RIPE", "org_id": "ORG-SL87-RIPE", "created": "2005-11-08", "updated": "2006-02-01", "source": "ripe", "raw": "mntner:         SKYBELLL-MNT\\ndescr:          maintainer for Skybelll\\norg:            ORG-SL87-RIPE\\nadmin-c:        YB287-RIPE\\ntech-c:         YB287-RIPE\\nupd-to:         yashar@skybell.az\\nmnt-nfy:        yashar@skybell.az\\nremarks:        MD5 passwords older than November 2011 were removed from this maintainer, see: https://www.ripe.net/removed2011pw\\nmnt-by:         SKYBELLL-MNT\\ncreated:        2005-11-08T14:33:56Z\\nlast-modified:  2006-02-01T14:21:56Z\\nsource:         RIPE"}, {"id": "FENIXVT-MNT", "name": "Private Enterprise Firma Fenix VT", "admin_id": "TEVO-RIPE", "tech_id": "DMSH-RIPE", "org_id": "ORG-PFV1-RIPE", "created": "2007-11-26", "updated": "2017-04-07", "source": "ripe", "raw": "mntner:         FENIXVT-MNT\\ndescr:          Private Enterprise Firma Fenix VT\\norg:            ORG-PFV1-RIPE\\nadmin-c:        TEVO-RIPE\\ntech-c:         DMSH-RIPE\\nupd-to:         info@fenix-vt.net\\nmnt-nfy:        info@fenix-vt.net\\nauth:           MD5-PW\\nauth:           SSO\\nnotify:         noc@fenix-vt.net\\nmnt-by:         FENIXVT-MNT\\ncreated:        2007-11-26T15:40:48Z\\nlast-modified:  2017-04-07T07:10:55Z\\nsource:         RIPE"}, {"id": "COR-MNT", "name": "SC COSMETICS ORIFLAME ROMANIA SRL\\nHoria Macelariu 61-81\\nBucuresti Sector 1\\nRomania RO", "admin_id": "AC11004-RIPE", "tech_id": "AC11004-RIPE", "org_id": "ORG-SCOR1-RIPE", "created": "2008-07-28", "updated": "2008-07-28", "source": "ripe", "raw": "mntner:         COR-MNT\\ndescr:          SC COSMETICS ORIFLAME ROMANIA SRL\\ndescr:          Horia Macelariu 61-81\\ndescr:          Bucuresti Sector 1\\ndescr:          Romania RO\\nadmin-c:        AC11004-RIPE\\ntech-c:         AC11004-RIPE\\norg:            ORG-SCOR1-RIPE\\nupd-to:         adrian.calinescu@oriflame.ro\\nmnt-nfy:        adrian.calinescu@oriflame.ro\\nauth:           PGPKEY-7FD0A168\\nremarks:        MD5 passwords older than November 2011 were removed from this maintainer, see: https://www.ripe.net/removed2011pw\\nnotify:         adrian.calinescu@oriflame.ro\\nmnt-by:         COR-MNT\\ncreated:        2008-07-28T12:05:14Z\\nlast-modified:  2008-07-28T12:05:14Z\\nsource:         RIPE"}, {"id": "LEVIRA-MNT", "name": "AS Levira Maintainer", "admin_id": "LAC60-RIPE", "tech_id": "LNA33-RIPE", "org_id": "ORG-AL152-RIPE", "created": "2010-03-10", "updated": "2019-05-22", "source": "ripe", "raw": "mntner:         levira-mnt\\norg:            ORG-AL152-RIPE\\ndescr:          AS Levira Maintainer\\nadmin-c:        LAC60-RIPE\\ntech-c:         LNA33-RIPE\\nupd-to:         upd-r@levira.com\\nauth:           SSO\\nauth:           SSO\\nauth:           SSO\\nauth:           SSO\\nmnt-by:         levira-mnt\\ncreated:        2010-03-10T14:49:05Z\\nlast-modified:  2019-05-22T07:49:32Z\\nsource:         RIPE"}, {"id": "AHR-RO-MNT", "name": "Alison Hayes (Romania) SRL\\nSos Bucuresti Buzau, km 55.2\\nUrziceni Ialomita 925300\\nRomania RO", "admin_id": "AD14821-RIPE", "tech_id": "AD14821-RIPE", "org_id": "ORG-AHRS1-RIPE", "created": "2014-05-21", "updated": "2018-11-07", "source": "ripe", "raw": "mntner:         AHR-RO-MNT\\ndescr:          Alison Hayes (Romania) SRL\\ndescr:          Sos Bucuresti Buzau, km 55.2\\ndescr:          Urziceni Ialomita 925300\\ndescr:          Romania RO\\nadmin-c:        AD14821-RIPE\\ntech-c:         AD14821-RIPE\\norg:            ORG-AHRS1-RIPE\\nupd-to:         adanciulescu@alisonhayes.com\\nmnt-nfy:        adanciulescu@alisonhayes.com\\nauth:           MD5-PW\\nauth:           PGPKEY-7FD0A168\\nnotify:         adanciulescu@alisonhayes.com\\nmnt-by:         AHR-RO-MNT\\ncreated:        2014-05-21T06:39:08Z\\nlast-modified:  2018-11-07T12:08:04Z\\nsource:         RIPE"}, {"id": "E-CARD-NOC", "name": "E-Card Ltd. Maintainer", "admin_id": "RT1834-RIPE\\nRP4620-RIPE", "tech_id": "RT1834-RIPE\\nRP4620-RIPE", "org_id": "ORG-EL28-RIPE", "created": "2006-06-21", "updated": "2015-07-03", "source": "ripe", "raw": "mntner:         E-CARD-NOC\\norg:            ORG-EL28-RIPE\\ndescr:          E-Card Ltd. Maintainer\\nadmin-c:        RT1834-RIPE\\nadmin-c:        RP4620-RIPE\\ntech-c:         RT1834-RIPE\\ntech-c:         RP4620-RIPE\\nupd-to:         noc@e-card.bg\\nauth:           MD5-PW\\nmnt-by:         E-CARD-NOC\\ncreated:        2006-06-21T14:08:34Z\\nlast-modified:  2015-07-03T14:11:18Z\\nsource:         RIPE"}, {"id": "IR-HEALTH-1-MNT", "name": "Startup maintainer", "admin_id": "AK14716-RIPE", "tech_id": "AK14716-RIPE", "org_id": "ORG-MOHT1-RIPE", "created": "2015-10-28", "updated": "2019-02-13", "source": "ripe", "raw": "mntner:         ir-health-1-mnt\\ndescr:          Startup maintainer\\nadmin-c:        AK14716-RIPE\\ntech-c:         AK14716-RIPE\\nupd-to:         khademi@behdasht.gov.ir\\nauth:           SSO\\nmnt-by:         ir-health-1-mnt\\norg:            ORG-MOHT1-RIPE\\ncreated:        2015-10-28T08:20:45Z\\nlast-modified:  2019-02-13T06:52:55Z\\nsource:         RIPE"}, {"id": "TELETRONIC-MNT", "name": "Teletronic Maintainer", "admin_id": "AR36315-RIPE", "tech_id": "AR36315-RIPE", "org_id": "ORG-TTSG4-RIPE", "created": "2017-12-13", "updated": "2017-12-13", "source": "ripe", "raw": "mntner:         TELETRONIC-MNT\\ndescr:          Teletronic Maintainer\\norg:            ORG-TTSG4-RIPE\\nadmin-c:        AR36315-RIPE\\ntech-c:         AR36315-RIPE\\nupd-to:         webmaster@teletronic.at\\nauth:           SSO\\nauth:           SSO\\nmnt-by:         TELETRONIC-MNT\\ncreated:        2017-12-13T15:52:40Z\\nlast-modified:  2017-12-13T16:25:50Z\\nsource:         RIPE"}, {"id": "UNLI-MNT", "name": "ProxyVPN net mntner", "admin_id": "AK5416-RIPE", "tech_id": "AK5416-RIPE", "org_id": "ORG-PAK1-RIPE", "created": "2007-11-14", "updated": "2010-03-10", "source": "ripe", "raw": "mntner:         UNLI-MNT\\ndescr:          ProxyVPN net mntner\\norg:            ORG-PAK1-RIPE\\nadmin-c:        AK5416-RIPE\\ntech-c:         AK5416-RIPE\\nupd-to:         seyka@mail.kz\\nmnt-nfy:        seyka@mail.kz\\nremarks:        MD5 passwords older than November 2011 were removed from this maintainer, see: https://www.ripe.net/removed2011pw\\nnotify:         seyka@mail.kz\\nmnt-by:         UNLI-MNT\\ncreated:        2007-11-14T15:23:08Z\\nlast-modified:  2010-03-10T21:55:13Z\\nsource:         RIPE"}, {"id": "SUMIDA-MNT", "name": "SUMIDA Romania SRL\\nStr. Corneliu Coposu nr. 1A\\nJimbolia Timis\\nRomania RO", "admin_id": "CB9932-RIPE", "tech_id": "CB9932-RIPE", "org_id": "ORG-SRS24-RIPE", "created": "2011-06-03", "updated": "2011-06-03", "source": "ripe", "raw": "mntner:         SUMIDA-MNT\\ndescr:          SUMIDA Romania SRL\\ndescr:          Str. Corneliu Coposu nr. 1A\\ndescr:          Jimbolia Timis\\ndescr:          Romania RO\\nadmin-c:        CB9932-RIPE\\ntech-c:         CB9932-RIPE\\norg:            ORG-SRS24-RIPE\\nupd-to:         cbouros@sumida-eu.com\\nmnt-nfy:        cbouros@sumida-eu.com\\nauth:           PGPKEY-7FD0A168\\nremarks:        MD5 passwords older than November 2011 were removed from this maintainer, see: https://www.ripe.net/removed2011pw\\nnotify:         cbouros@sumida-eu.com\\nmnt-by:         SUMIDA-MNT\\ncreated:        2011-06-03T07:01:33Z\\nlast-modified:  2011-06-03T07:01:33Z\\nsource:         RIPE"}, {"id": "PROACTDE", "name": "Proact Deutschland GmbH", "admin_id": "OK1063-RIPE", "tech_id": "TNM-RIPE", "org_id": "ORG-TG88-RIPE", "created": "2017-10-13", "updated": "2019-07-09", "source": "ripe", "raw": "mntner:         PROACTDE\\ndescr:          Proact Deutschland GmbH\\nadmin-c:        OK1063-RIPE\\ntech-c:         TNM-RIPE\\nremarks:        Teamix Netmaster Role (new)\\nauth:           PGPKEY-657F39CC\\nremarks:        --\\nremarks:        Teamix Netmaster Role (old)\\nauth:           PGPKEY-15F3FCC9\\nremarks:        --\\nremarks:        OKAY1-RIPE\\nauth:           PGPKEY-FA49A61A\\nauth:           SSO\\nremarks:        --\\nremarks:        RICO-RIPE\\nauth:           PGPKEY-61F05B8C\\nauth:           SSO\\nremarks:        --\\nremarks:        CS-DE\\nauth:           SSO\\nremarks:        --\\nupd-to:         ripe@proact.de\\nmnt-nfy:        ripe@proact.de\\nnotify:         ripe@proact.de\\nmnt-by:         PROACTDE\\nmnt-by:         TEAMIX-MNT\\norg:            ORG-TG88-RIPE\\ncreated:        2017-10-13T08:10:11Z\\nlast-modified:  2019-07-09T12:31:48Z\\nsource:         RIPE"}, {"id": "ALPHA-WIND-MNT", "name": "Alpha Wind SRL\\nGeneral Constantin Budisteanu 16\\nBucuresti Sector 1\\nRomania RO", "admin_id": "GB14793-RIPE", "tech_id": "GB14793-RIPE", "org_id": "ORG-AWS5-RIPE", "created": "2012-03-28", "updated": "2012-03-28", "source": "ripe", "raw": "mntner:         ALPHA-WIND-MNT\\ndescr:          Alpha Wind SRL\\ndescr:          General Constantin Budisteanu 16\\ndescr:          Bucuresti Sector 1\\ndescr:          Romania RO\\nadmin-c:        GB14793-RIPE\\ntech-c:         GB14793-RIPE\\norg:            ORG-AWS5-RIPE\\nupd-to:         bogdan.gurita@verbund.com\\nmnt-nfy:        bogdan.gurita@verbund.com\\nauth:           MD5-PW\\nauth:           PGPKEY-7FD0A168\\nnotify:         bogdan.gurita@verbund.com\\nmnt-by:         ALPHA-WIND-MNT\\ncreated:        2012-03-28T08:41:45Z\\nlast-modified:  2012-03-28T08:41:45Z\\nsource:         RIPE"}, {"id": "OTPBANK-MNT", "name": "OTP BANK ROMANIA SA\\nBd. Unirii 59, Sector 3 Bucharest\\nRO", "admin_id": "LS6793-RIPE", "tech_id": "DS3000-RIPE", "org_id": "ORG-SOBR1-RIPE", "created": "2005-10-07", "updated": "2015-03-02", "source": "ripe", "raw": "mntner:         OTPBANK-MNT\\ndescr:          OTP BANK ROMANIA SA\\ndescr:          Bd. Unirii 59, Sector 3 Bucharest\\ndescr:          RO\\nadmin-c:        LS6793-RIPE\\ntech-c:         DS3000-RIPE\\norg:            ORG-SOBR1-RIPE\\nupd-to:         simona.stanica@otpbank.ro\\nmnt-nfy:        simona.stanica@otpbank.ro\\nauth:           SSO\\nauth:           PGPKEY-7FD0A168\\nremarks:        MD5 passwords older than November 2011 were removed from this maintainer, see: https://www.ripe.net/removed2011pw\\nnotify:         simona.stanica@otpbank.ro\\nmnt-by:         OTPBANK-MNT\\ncreated:        2005-10-07T11:13:31Z\\nlast-modified:  2015-03-02T10:00:50Z\\nsource:         RIPE"}, {"id": "NO-LINPRO-MNT", "name": "Redpill Linpro AS RIPE DB maintainer", "admin_id": "RLHM-RIPE", "tech_id": "RLHM-RIPE", "org_id": "ORG-LA61-RIPE", "created": "2005-11-24", "updated": "2019-09-24", "source": "ripe", "raw": "mntner:         NO-LINPRO-MNT\\ndescr:          Redpill Linpro AS RIPE DB maintainer\\norg:            ORG-LA61-RIPE\\nadmin-c:        RLHM-RIPE\\ntech-c:         RLHM-RIPE\\nupd-to:         noc@redpill-linpro.com\\nmnt-nfy:        noc@redpill-linpro.com\\nauth:           SSO\\nauth:           SSO\\nmnt-by:         NO-LINPRO-MNT\\ncreated:        2005-11-24T16:50:23Z\\nlast-modified:  2019-09-24T05:56:12Z\\nsource:         RIPE"}, {"id": "COGEMA-MNT", "name": "AREVA NC Etablissement de Marcoule BP 170 F-30206 Bagnols CEDEX France", "admin_id": "CB2978-RIPE", "tech_id": "CB2978-RIPE", "org_id": "ORG-CM3-RIPE", "created": "2004-07-28", "updated": "2009-05-14", "source": "ripe", "raw": "mntner:         COGEMA-MNT\\ndescr:          AREVA NC Etablissement de Marcoule BP 170 F-30206 Bagnols CEDEX France\\norg:            ORG-CM3-RIPE\\nadmin-c:        CB2978-RIPE\\ntech-c:         CB2978-RIPE\\nupd-to:         cbouriaud@cogema.fr\\nmnt-nfy:        cbouriaud@cogema.fr\\nremarks:        MD5 passwords older than November 2011 were removed from this maintainer, see: https://www.ripe.net/removed2011pw\\nremarks:        mntner des inetnums d'Areva SA\\nnotify:         cbouriaud@cogema.fr\\nmnt-by:         COGEMA-MNT\\ncreated:        2004-07-28T12:57:13Z\\nlast-modified:  2009-05-14T16:38:34Z\\nsource:         RIPE"}, {"id": "SEGEZHA-MNT", "name": "Segezha Packaging A/S\\nStigsborgvej 36, 9400 Norresungby, Denmark", "admin_id": "VG5151-RIPE", "tech_id": "VG5151-RIPE", "org_id": "ORG-SPA54-RIPE", "created": "2018-06-08", "updated": "2019-05-23", "source": "ripe", "raw": "mntner:         SEGEZHA-MNT\\ndescr:          Segezha Packaging A/S\\ndescr:          Stigsborgvej 36, 9400 Norresungby, Denmark\\nadmin-c:        VG5151-RIPE\\ntech-c:         VG5151-RIPE\\norg:            ORG-SPA54-RIPE\\nupd-to:         Vitaly.Glotov@segezha.com\\nmnt-nfy:        Vitaly.Glotov@segezha.com\\nauth:           MD5-PW\\nauth:           SSO\\nauth:           PGPKEY-FCBDA54E\\nauth:           PGPKEY-7FD0A168\\nnotify:         Vitaly.Glotov@segezha.com\\nmnt-by:         SEGEZHA-MNT\\ncreated:        2018-06-08T10:29:33Z\\nlast-modified:  2019-05-23T12:28:04Z\\nsource:         RIPE"}, {"id": "SALENAMES-MNT", "name": "The SALENAMES network", "admin_id": "ROBS-RIPE", "tech_id": "ROBS-RIPE", "org_id": "ORG-SL94-RIPE", "created": "2006-01-17", "updated": "2017-11-13", "source": "ripe", "raw": "mntner:         SALENAMES-MNT\\ndescr:          The SALENAMES network\\norg:            ORG-SL94-RIPE\\nadmin-c:        ROBS-RIPE\\ntech-c:         ROBS-RIPE\\nupd-to:         rusweb@gmail.com\\nauth:           MD5-PW\\nauth:           SSO\\nmnt-by:         SALENAMES-MNT\\ncreated:        2006-01-17T11:41:43Z\\nlast-modified:  2017-11-13T15:52:30Z\\nsource:         RIPE"}, {"id": "FASTHOST-IPV6-MNT", "name": "FastHost IPv6 Maintainer Object", "admin_id": "RM2814-RIPE", "tech_id": "EHN3-RIPE", "org_id": "ORG-FA9-RIPE", "created": "2005-09-30", "updated": "2005-09-30", "source": "ripe", "raw": "mntner:         FASTHOST-IPV6-MNT\\ndescr:          FastHost IPv6 Maintainer Object\\norg:            ORG-FA9-RIPE\\nadmin-c:        RM2814-RIPE\\ntech-c:         EHN3-RIPE\\nupd-to:         ripe@fasthost.no\\nremarks:        MD5 passwords older than November 2011 were removed from this maintainer, see: https://www.ripe.net/removed2011pw\\nmnt-by:         FASTHOST-MNT\\ncreated:        2005-09-30T13:55:56Z\\nlast-modified:  2005-09-30T14:43:24Z\\nsource:         RIPE"}, {"id": "DIGICOM-MNT", "name": "DigiCom Systems\\nBucharest, Calea Dorobantilor 102-110\\nSector 1, 71224, Romania\\nRO", "admin_id": "SG5415-RIPE\\nCC6118-RIPE", "tech_id": "SG5415-RIPE", "org_id": "ORG-DSS3-RIPE", "created": "2002-06-18", "updated": "2018-04-23", "source": "ripe", "raw": "mntner:         DIGICOM-MNT\\norg:            ORG-DSS3-RIPE\\ndescr:          DigiCom Systems\\ndescr:          Bucharest, Calea Dorobantilor 102-110\\ndescr:          Sector 1, 71224, Romania\\ndescr:          RO\\nadmin-c:        SG5415-RIPE\\nadmin-c:        CC6118-RIPE\\ntech-c:         SG5415-RIPE\\nupd-to:         hostmaster@ines.ro\\nmnt-nfy:        hostmaster@ines.ro\\nauth:           PGPKEY-AC8F4812\\nauth:           PGPKEY-8FA9D9E4\\nnotify:         hostmaster@ines.ro\\nmnt-by:         DIGICOM-MNT\\ncreated:        2002-06-18T11:46:39Z\\nlast-modified:  2018-04-23T09:29:50Z\\nsource:         RIPE"}, {"id": "LAROM-MNT", "name": "Larom TV SRL\\nGheorghe Madan 48 bl. 3\\nChisinau Riscani MD-2020\\nMoldova MD", "admin_id": "RB12917-RIPE", "tech_id": "RB12917-RIPE", "org_id": "ORG-LTS7-RIPE", "created": "2012-03-02", "updated": "2018-09-27", "source": "ripe", "raw": "mntner:         LAROM-MNT\\ndescr:          Larom TV SRL\\ndescr:          Gheorghe Madan 48 bl. 3\\ndescr:          Chisinau Riscani MD-2020\\ndescr:          Moldova MD\\nadmin-c:        RB12917-RIPE\\ntech-c:         RB12917-RIPE\\norg:            ORG-LTS7-RIPE\\nupd-to:         noc@larom.md\\nauth:           SSO\\nauth:           PGPKEY-7FD0A168\\nmnt-by:         LAROM-MNT\\ncreated:        2012-03-02T06:51:18Z\\nlast-modified:  2018-09-27T17:28:18Z\\nsource:         RIPE"}, {"id": "AST-MNT", "name": "ASIST TELECOMMUNICATIONS\\nNICOLAE IORGA BOULEVARD NO 63 BL B13 SC B\\nVALENII DE MUNTE, PRAHOVA COUNTY\\nROMANIA RO", "admin_id": "MMMI-RIPE", "tech_id": "MMMI-RIPE", "org_id": "ORG-SATS11-RIPE", "created": "2014-03-24", "updated": "2014-04-01", "source": "ripe", "raw": "mntner:         AST-MNT\\ndescr:          ASIST TELECOMMUNICATIONS\\ndescr:          NICOLAE IORGA BOULEVARD NO 63 BL B13 SC B\\ndescr:          VALENII DE MUNTE, PRAHOVA COUNTY\\ndescr:          ROMANIA RO\\norg:            ORG-SATS11-RIPE\\nadmin-c:        MMMI-RIPE\\ntech-c:         MMMI-RIPE\\nupd-to:         MIHAI.MUNTEANU@ASISTELECOM.RO\\nauth:           MD5-PW\\nmnt-by:         AST-MNT\\ncreated:        2014-03-24T19:36:52Z\\nlast-modified:  2014-04-01T13:51:25Z\\nsource:         RIPE"}, {"id": "NEOLAND-MNT", "name": "SC NEOLAND SRL\\nAleea Diham 5\\nBucuresti sector 2\\nRomania RO", "admin_id": "NN2081-RIPE", "tech_id": "NN2081-RIPE", "org_id": "ORG-SNS10-RIPE", "created": "2006-06-14", "updated": "2019-07-10", "source": "ripe", "raw": "mntner:         NEOLAND-MNT\\ndescr:          SC NEOLAND SRL\\ndescr:          Aleea Diham 5\\ndescr:          Bucuresti sector 2\\ndescr:          Romania RO\\nadmin-c:        NN2081-RIPE\\ntech-c:         NN2081-RIPE\\norg:            ORG-SNS10-RIPE\\nupd-to:         office@neoland.ro\\nmnt-nfy:        office@neoland.ro\\nauth:           MD5-PW\\nauth:           SSO\\nauth:           SSO\\nauth:           SSO\\nnotify:         office@neoland.ro\\nmnt-by:         NEOLAND-MNT\\ncreated:        2006-06-14T22:17:16Z\\nlast-modified:  2019-07-10T09:48:21Z\\nsource:         RIPE"}, {"id": "WECODE-MNT", "name": "We are code SRL-D\\nStr Edgar Quinet Nr 57 20\\nCluj-Napoca Cluj Romania", "admin_id": "AC34208-RIPE", "tech_id": "AC34208-RIPE", "org_id": "ORG-WACS1-RIPE", "created": "2017-03-18", "updated": "2017-03-18", "source": "ripe", "raw": "mntner:         WECODE-MNT\\ndescr:          We are code SRL-D\\ndescr:          Str Edgar Quinet Nr 57 20\\ndescr:          Cluj-Napoca Cluj Romania\\nadmin-c:        AC34208-RIPE\\ntech-c:         AC34208-RIPE\\norg:            ORG-WACS1-RIPE\\nupd-to:         alina@wecode.ro\\nmnt-nfy:        alina@wecode.ro\\nauth:           MD5-PW\\nauth:           PGPKEY-7FD0A168\\nnotify:         alina@wecode.ro\\nmnt-by:         WECODE-MNT\\ncreated:        2017-03-18T06:44:29Z\\nlast-modified:  2017-03-18T06:44:29Z\\nsource:         RIPE"}, {"id": "AS12867-MNT", "name": "Bulgaria Online mntner", "admin_id": "BOST3-RIPE", "tech_id": "BOST3-RIPE", "org_id": "ORG-BO1-RIPE", "created": "1970-01-01", "updated": "2017-01-24", "source": "ripe", "raw": "mntner:         AS12867-MNT\\ndescr:          Bulgaria Online mntner\\norg:            ORG-BO1-RIPE\\nadmin-c:        BOST3-RIPE\\ntech-c:         BOST3-RIPE\\nauth:           PGPKEY-1FDFC278\\nauth:           SSO\\nauth:           MD5-PW\\nmnt-by:         AS12867-MNT\\nmnt-by:         ITD-MNT\\nupd-to:         ripe@itdnet.net\\ncreated:        1970-01-01T00:00:00Z\\nlast-modified:  2017-01-24T15:01:48Z\\nsource:         RIPE"}, {"id": "INTERNETCON-MNT", "name": "SC InterNetCon SRL\\nStr. Meziad nr. 1 ap. 37\\nCluj-Napoca, jud. CLUJ\\nROMANIA", "admin_id": "BF4291-RIPE", "tech_id": "BF4291-RIPE", "org_id": "ORG-SIS11-RIPE", "created": "2004-07-19", "updated": "2016-01-09", "source": "ripe", "raw": "mntner:         INTERNETCON-MNT\\ndescr:          SC InterNetCon SRL\\ndescr:          Str. Meziad nr. 1 ap. 37\\ndescr:          Cluj-Napoca, jud. CLUJ\\ndescr:          ROMANIA\\nadmin-c:        BF4291-RIPE\\ntech-c:         BF4291-RIPE\\norg:            ORG-SIS11-RIPE\\nupd-to:         florinb@bizarnet.ro\\nmnt-nfy:        florinb@bizarnet.ro\\nauth:           PGPKEY-7FD0A168\\nnotify:         florinb@bizarnet.ro\\nmnt-by:         INTERNETCON-MNT\\ncreated:        2004-07-19T18:14:08Z\\nlast-modified:  2016-01-09T10:46:23Z\\nsource:         RIPE"}, {"id": "ASIST-TELECOM-MNT", "name": "ASIST TELECOMMUNICATIONS SRL\\nBULEVARD NICOLAE IORGA, NUMARUL 63, BLOC B13, SCARA B, PARTER\\nVALENII DE MUNTE PRAHOVA 106400\\nROMANIA RO", "admin_id": "MM38843-RIPE", "tech_id": "MM38843-RIPE", "org_id": "ORG-ATS45-RIPE", "created": "2014-04-01", "updated": "2014-06-27", "source": "ripe", "raw": "mntner:         ASIST-TELECOM-MNT\\ndescr:          ASIST TELECOMMUNICATIONS SRL\\ndescr:          BULEVARD NICOLAE IORGA, NUMARUL 63, BLOC B13, SCARA B, PARTER\\ndescr:          VALENII DE MUNTE PRAHOVA 106400\\ndescr:          ROMANIA RO\\nadmin-c:        MM38843-RIPE\\ntech-c:         MM38843-RIPE\\norg:            ORG-ATS45-RIPE\\nupd-to:         mihai.munteanu@asistelecom.ro\\nmnt-nfy:        mihai.munteanu@asistelecom.ro\\nauth:           MD5-PW\\nauth:           PGPKEY-7FD0A168\\nnotify:         mihai.munteanu@asistelecom.ro\\nmnt-by:         ASIST-TELECOM-MNT\\ncreated:        2014-04-01T09:15:31Z\\nlast-modified:  2014-06-27T04:20:35Z\\nsource:         RIPE"}, {"id": "ATG-MNT", "name": "SC AXEL TELECOM GRUP SRL\\nStr. Docherilor, Nr. 22\\nConstanta Constanta\\nRomania RO", "admin_id": "DV1786-RIPE", "tech_id": "DV1786-RIPE", "org_id": "ORG-SATG1-RIPE", "created": "2008-10-17", "updated": "2018-01-18", "source": "ripe", "raw": "mntner:         ATG-MNT\\ndescr:          SC AXEL TELECOM GRUP SRL\\ndescr:          Str. Docherilor, Nr. 22\\ndescr:          Constanta Constanta\\ndescr:          Romania RO\\nadmin-c:        DV1786-RIPE\\ntech-c:         DV1786-RIPE\\norg:            ORG-SATG1-RIPE\\nupd-to:         danv@axelweb.ro\\nmnt-nfy:        danv@axelweb.ro\\nauth:           PGPKEY-7FD0A168\\nauth:           SSO\\nremarks:        MD5 passwords older than November 2011 were removed from this maintainer, see: https://www.ripe.net/removed2011pw\\nnotify:         danv@axelweb.ro\\nmnt-by:         ATG-MNT\\ncreated:        2008-10-17T12:14:28Z\\nlast-modified:  2018-01-18T07:30:52Z\\nsource:         RIPE"}, {"id": "SA-SAUDI-1-MNT", "name": "SEC maintainer", "admin_id": "IA4113-RIPE\\nSERO2-RIPE\\nKA5837-RIPE", "tech_id": "IA4113-RIPE\\nSERO2-RIPE\\nKA5837-RIPE", "org_id": "ORG-SEC3-RIPE", "created": "2016-04-29", "updated": "2016-05-03", "source": "ripe", "raw": "mntner:         sa-saudi-1-mnt\\ndescr:          SEC maintainer\\nmnt-nfy:        kefah@sahara.com\\nadmin-c:        IA4113-RIPE\\nadmin-c:        SERO2-RIPE\\norg:            ORG-SEC3-RIPE\\nadmin-c:        KA5837-RIPE\\ntech-c:         IA4113-RIPE\\ntech-c:         SERO2-RIPE\\nnotify:         kefah@sahara.com\\nauth:           MD5-PW\\nauth:           SSO\\ntech-c:         KA5837-RIPE\\nupd-to:         sec-internetservice@se.com.sa\\nupd-to:         Kefah@sahara.com\\nauth:           SSO\\nauth:           SSO\\nmnt-by:         sa-saudi-1-mnt\\ncreated:        2016-04-29T13:13:35Z\\nlast-modified:  2016-05-03T09:22:56Z\\nsource:         RIPE"}, {"id": "PSN-MNT", "name": "Pushchino Research Center of RAS", "admin_id": "ILO2-RIPE", "tech_id": "ILO2-RIPE\\nAYZ3-RIPE\\nDD42-RIPE", "org_id": "ORG-PSN3-RIPE", "created": "2001-10-08", "updated": "2009-12-18", "source": "ripe", "raw": "mntner:         PSN-MNT\\ndescr:          Pushchino Research Center of RAS\\norg:            ORG-PSN3-RIPE\\nadmin-c:        ILO2-RIPE\\ntech-c:         ILO2-RIPE\\ntech-c:         AYZ3-RIPE\\ntech-c:         DD42-RIPE\\nupd-to:         hostmaster@psn.ru\\nmnt-nfy:        hostmaster@psn.ru\\nauth:           PGPKEY-A5E0F52C\\nauth:           X509-2404\\nauth:           PGPKEY-41D28F62\\nauth:           PGPKEY-E7D51BC1\\nmnt-by:         PSN-MNT\\ncreated:        2001-10-08T19:55:06Z\\nlast-modified:  2009-12-18T07:07:09Z\\nsource:         RIPE"}, {"id": "OPTICBRIDGE-MNT", "name": "SC Optic Bridge SRL\\nAleea Magura Vulturului 9 Bloc 435, Sc.B, Apt.52\\nBucuresti Sector 2\\nRomania RO", "admin_id": "GM6308-RIPE", "tech_id": "GM6308-RIPE", "org_id": "ORG-SOBS1-RIPE", "created": "2006-01-27", "updated": "2015-08-07", "source": "ripe", "raw": "mntner:         OPTICBRIDGE-MNT\\ndescr:          SC Optic Bridge SRL\\ndescr:          Aleea Magura Vulturului 9 Bloc 435, Sc.B, Apt.52\\ndescr:          Bucuresti Sector 2\\ndescr:          Romania RO\\nadmin-c:        GM6308-RIPE\\ntech-c:         GM6308-RIPE\\norg:            ORG-SOBS1-RIPE\\nupd-to:         opticbridge@yahoo.com\\nmnt-nfy:        opticbridge@yahoo.com\\nauth:           MD5-PW\\nauth:           SSO\\nnotify:         opticbridge@yahoo.com\\nmnt-by:         OPTICBRIDGE-MNT\\ncreated:        2006-01-27T08:09:13Z\\nlast-modified:  2015-08-07T16:04:22Z\\nsource:         RIPE"}, {"id": "AGRICOVER-MNT", "name": "Agricover SRL\\nBd.Pipera nr.1B, Clad de Birouri Cubic Center et.6\\nVoluntari Ilfov Romania RO", "admin_id": "IS6269-RIPE", "tech_id": "IS6269-RIPE", "org_id": "ORG-AS505-RIPE", "created": "2016-05-16", "updated": "2016-05-16", "source": "ripe", "raw": "mntner:         AGRICOVER-MNT\\ndescr:          Agricover SRL\\ndescr:          Bd.Pipera nr.1B, Clad de Birouri Cubic Center et.6\\ndescr:          Voluntari Ilfov Romania RO\\nadmin-c:        IS6269-RIPE\\ntech-c:         IS6269-RIPE\\norg:            ORG-AS505-RIPE\\nupd-to:         Ionut.Savu@agricover.ro\\nmnt-nfy:        Ionut.Savu@agricover.ro\\nauth:           MD5-PW\\nauth:           PGPKEY-7FD0A168\\nnotify:         Ionut.Savu@agricover.ro\\nmnt-by:         AGRICOVER-MNT\\ncreated:        2016-05-16T17:38:04Z\\nlast-modified:  2016-05-16T17:38:04Z\\nsource:         RIPE"}, {"id": "UNIVERS-NET-MNT", "name": "SC Univers Net Com SRL\\nStr Ungureni nr 42\\nJilava Ilfov\\nRomania RO", "admin_id": "CM5687-RIPE", "tech_id": "CM5687-RIPE", "org_id": "ORG-SUNC1-RIPE", "created": "2008-08-10", "updated": "2016-10-28", "source": "ripe", "raw": "mntner:         UNIVERS-NET-MNT\\ndescr:          SC Univers Net Com SRL\\ndescr:          Str Ungureni nr 42\\ndescr:          Jilava Ilfov\\ndescr:          Romania RO\\nadmin-c:        CM5687-RIPE\\ntech-c:         CM5687-RIPE\\norg:            ORG-SUNC1-RIPE\\nupd-to:         admin@universnet.ro\\nmnt-nfy:        admin@universnet.ro\\nauth:           MD5-PW\\nauth:           SSO\\nauth:           PGPKEY-7FD0A168\\nnotify:         admin@universnet.ro\\nmnt-by:         UNIVERS-NET-MNT\\ncreated:        2008-08-10T08:02:34Z\\nlast-modified:  2016-10-28T11:59:41Z\\nsource:         RIPE"}, {"id": "AGE-MNT", "name": "A.G.E. NETWORKS SISTEMS S.R.L.\\nstr.Principala nr 138\\nVidra com.Vidra,sat Sintesti\\nRomania RO", "admin_id": "OE730-RIPE", "tech_id": "OE730-RIPE", "org_id": "ORG-ANSS2-RIPE", "created": "2012-04-02", "updated": "2012-04-02", "source": "ripe", "raw": "mntner:         AGE-MNT\\ndescr:          A.G.E. NETWORKS SISTEMS S.R.L.\\ndescr:          str.Principala nr 138\\ndescr:          Vidra com.Vidra,sat Sintesti\\ndescr:          Romania RO\\nadmin-c:        OE730-RIPE\\ntech-c:         OE730-RIPE\\norg:            ORG-ANSS2-RIPE\\nupd-to:         age_net_systems@yahoo.com\\nmnt-nfy:        age_net_systems@yahoo.com\\nauth:           MD5-PW\\nauth:           PGPKEY-7FD0A168\\nnotify:         age_net_systems@yahoo.com\\nmnt-by:         AGE-MNT\\ncreated:        2012-04-02T01:13:52Z\\nlast-modified:  2012-04-02T01:13:52Z\\nsource:         RIPE"}, {"id": "ITEYE-MNT", "name": "SC ITEYE DESIGN SRL\\nIuliu Maniu, nr. 57 bl. OD16, sc. 3, ap. 46\\nBucuresti 6\\nRomania RO", "admin_id": "PA2890-RIPE", "tech_id": "PA2890-RIPE", "org_id": "ORG-SIDS2-RIPE", "created": "2006-07-02", "updated": "2006-07-02", "source": "ripe", "raw": "mntner:         ITEYE-MNT\\ndescr:          SC ITEYE DESIGN SRL\\ndescr:          Iuliu Maniu, nr. 57 bl. OD16, sc. 3, ap. 46\\ndescr:          Bucuresti 6\\ndescr:          Romania RO\\nadmin-c:        PA2890-RIPE\\ntech-c:         PA2890-RIPE\\norg:            ORG-SIDS2-RIPE\\nupd-to:         andrei.popa@i-neo.ro\\nmnt-nfy:        andrei.popa@i-neo.ro\\nauth:           PGPKEY-7FD0A168\\nremarks:        MD5 passwords older than November 2011 were removed from this maintainer, see: https://www.ripe.net/removed2011pw\\nnotify:         andrei.popa@i-neo.ro\\nmnt-by:         ITEYE-MNT\\ncreated:        2006-07-02T21:45:12Z\\nlast-modified:  2006-07-02T21:45:12Z\\nsource:         RIPE"}, {"id": "ALT-MNT", "name": "Przedsiebiorstwo ALT\\nul. Jagiellonska 46\\n33-300 Nowy Sacz\\nPoland", "admin_id": "KK2170-RIPE", "tech_id": "KK2170-RIPE", "org_id": "ORG-PA122-RIPE", "created": "2005-12-21", "updated": "2006-06-22", "source": "ripe", "raw": "mntner:         ALT-MNT\\ndescr:          Przedsiebiorstwo ALT\\ndescr:          ul. Jagiellonska 46\\ndescr:          33-300 Nowy Sacz\\ndescr:          Poland\\norg:            ORG-PA122-RIPE\\nadmin-c:        KK2170-RIPE\\ntech-c:         KK2170-RIPE\\nupd-to:         phaberko@gts.pl\\nmnt-nfy:        phaberko@gts.pl\\nremarks:        MD5 passwords older than November 2011 were removed from this maintainer, see: https://www.ripe.net/removed2011pw\\nmnt-by:         IPARTNERS-MNT\\nmnt-by:         ALT-MNT\\ncreated:        2005-12-21T11:55:22Z\\nlast-modified:  2006-06-22T07:43:57Z\\nsource:         RIPE"}, {"id": "BURSTNET", "name": "BurstNET Limited", "admin_id": "BED8-RIPE", "tech_id": "BED8-RIPE", "org_id": "ORG-BL102-RIPE", "created": "2011-08-07", "updated": "2011-09-15", "source": "ripe", "raw": "mntner:         BurstNET\\norg:            ORG-BL102-RIPE\\nadmin-c:        BED8-RIPE\\ntech-c:         BED8-RIPE\\ndescr:          BurstNET Limited\\nupd-to:         ripe@burst.net\\nmnt-nfy:        ripe@burst.net\\nremarks:        MD5 passwords older than November 2011 were removed from this maintainer, see: https://www.ripe.net/removed2011pw\\nmnt-by:         BurstNET\\ncreated:        2011-08-07T16:24:03Z\\nlast-modified:  2011-09-15T01:14:10Z\\nsource:         RIPE"}, {"id": "MICRODATA-MNT", "name": "OOO Microdata", "admin_id": "YAP1-RIPE", "tech_id": "YAP1-RIPE", "org_id": "ORG-MA303-RIPE", "created": "2008-10-14", "updated": "2017-12-08", "source": "ripe", "raw": "mntner:         MICRODATA-MNT\\ndescr:          OOO Microdata\\norg:            ORG-MA303-RIPE\\nadmin-c:        YAP1-RIPE\\ntech-c:         YAP1-RIPE\\nupd-to:         microdatafwd@gmail.com\\nmnt-nfy:        microdatafwd@gmail.com\\nauth:           MD5-PW\\nauth:           SSO\\nmnt-by:         MICRODATA-MNT\\ncreated:        2008-10-14T10:31:52Z\\nlast-modified:  2017-12-08T09:04:05Z\\nsource:         RIPE"}, {"id": "WEBFACTOR-MNT", "name": "SC Webfactor SRL\\nBizusa nr.10 A31\\nCluj-Napoca Cluj 400429\\nRomania RO", "admin_id": "VH502-RIPE", "tech_id": "VH502-RIPE", "org_id": "ORG-SWS2-RIPE", "created": "2005-11-03", "updated": "2018-05-11", "source": "ripe", "raw": "mntner:         WEBFACTOR-MNT\\ndescr:          SC Webfactor SRL\\ndescr:          Bizusa nr.10 A31\\ndescr:          Cluj-Napoca Cluj 400429\\ndescr:          Romania RO\\nadmin-c:        VH502-RIPE\\ntech-c:         VH502-RIPE\\norg:            ORG-SWS2-RIPE\\nupd-to:         admin@webfactor.ro\\nmnt-nfy:        admin@webfactor.ro\\nauth:           MD5-PW\\nauth:           SSO\\nauth:           SSO\\nauth:           PGPKEY-7FD0A168\\nnotify:         admin@webfactor.ro\\nmnt-by:         WEBFACTOR-MNT\\ncreated:        2005-11-03T06:31:42Z\\nlast-modified:  2018-05-11T05:11:31Z\\nsource:         RIPE"}, {"id": "VENDIO-MNT", "name": "SC Vendio SRL\\nBd. G-ral Vasile Milea 4,\\nIntrare Far, Etaj 2, Spatiul A\\nBucuresti, Sector 6, Cod 061344\\nRomania", "admin_id": "LS2023-RIPE\\nSS18753-RIPE", "tech_id": "LS2023-RIPE\\nSS18753-RIPE", "org_id": "ORG-SVS5-RIPE", "created": "2007-03-24", "updated": "2017-11-03", "source": "ripe", "raw": "mntner:         VENDIO-MNT\\ndescr:          SC Vendio SRL\\ndescr:          Bd. G-ral Vasile Milea 4,\\ndescr:          Intrare Far, Etaj 2, Spatiul A\\ndescr:          Bucuresti, Sector 6, Cod 061344\\ndescr:          Romania\\nadmin-c:        LS2023-RIPE\\nadmin-c:        SS18753-RIPE\\ntech-c:         LS2023-RIPE\\ntech-c:         SS18753-RIPE\\norg:            ORG-SVS5-RIPE\\nupd-to:         ops@vendio.ro\\nmnt-nfy:        ops@vendio.ro\\nauth:           PGPKEY-7FD0A168\\nauth:           SSO\\nremarks:        MD5 passwords older than November 2011 were removed from this maintainer, see: https://www.ripe.net/removed2011pw\\nnotify:         ops@vendio.ro\\nmnt-by:         VENDIO-MNT\\ncreated:        2007-03-24T09:36:14Z\\nlast-modified:  2017-11-03T15:24:27Z\\nsource:         RIPE"}, {"id": "TIM-NET-MNT", "name": "SC Total Inter Media SRL\\nGarii 2 street Tulcea 8800 Romania\\nRO", "admin_id": "BV575-RIPE", "tech_id": "BV575-RIPE", "org_id": "ORG-STIM1-RIPE", "created": "2005-01-27", "updated": "2013-01-30", "source": "ripe", "raw": "mntner:         TIM-NET-MNT\\ndescr:          SC Total Inter Media SRL\\ndescr:          Garii 2 street Tulcea 8800 Romania\\ndescr:          RO\\nadmin-c:        BV575-RIPE\\ntech-c:         BV575-RIPE\\norg:            ORG-STIM1-RIPE\\nupd-to:         office@tim.ro\\nmnt-nfy:        office@tim.ro\\nauth:           MD5-PW\\nnotify:         office@tim.ro\\nmnt-by:         TIM-NET-MNT\\ncreated:        2005-01-27T12:21:53Z\\nlast-modified:  2013-01-30T14:39:39Z\\nsource:         RIPE"}, {"id": "MIONET-MNT", "name": "Mionet IT SRL\\nVointei, nr. 1A\\nBragadiru Ilfov Romania", "admin_id": "AS32101-RIPE", "tech_id": "AS32101-RIPE", "org_id": "ORG-MIS22-RIPE", "created": "2014-03-13", "updated": "2014-03-13", "source": "ripe", "raw": "mntner:         MIONET-MNT\\ndescr:          Mionet IT SRL\\ndescr:          Vointei, nr. 1A\\ndescr:          Bragadiru Ilfov Romania\\nadmin-c:        AS32101-RIPE\\ntech-c:         AS32101-RIPE\\norg:            ORG-MIS22-RIPE\\nupd-to:         office@mionet.ro\\nmnt-nfy:        office@mionet.ro\\nauth:           MD5-PW\\nauth:           PGPKEY-7FD0A168\\nnotify:         office@mionet.ro\\nmnt-by:         MIONET-MNT\\ncreated:        2014-03-13T07:48:40Z\\nlast-modified:  2014-03-13T07:48:40Z\\nsource:         RIPE"}, {"id": "BIROTEC-MNT", "name": "SC Birotec SRL\\nPaltinis nr.1 A\\nMedias Sibiu 551089\\nRomania RO", "admin_id": "MR5859-RIPE", "tech_id": "MR5859-RIPE", "org_id": "ORG-SBS7-RIPE", "created": "2005-11-25", "updated": "2019-01-24", "source": "ripe", "raw": "mntner:         BIROTEC-MNT\\ndescr:          SC Birotec SRL\\ndescr:          Paltinis nr.1 A\\ndescr:          Medias Sibiu 551089\\ndescr:          Romania RO\\nadmin-c:        MR5859-RIPE\\ntech-c:         MR5859-RIPE\\norg:            ORG-SBS7-RIPE\\nupd-to:         rmircea@birotec.ro\\nmnt-nfy:        rmircea@birotec.ro\\nauth:           MD5-PW\\nauth:           SSO\\nauth:           PGPKEY-7FD0A168\\nnotify:         rmircea@birotec.ro\\nmnt-by:         BIROTEC-MNT\\ncreated:        2005-11-25T09:44:26Z\\nlast-modified:  2019-01-24T12:53:36Z\\nsource:         RIPE"}, {"id": "MAINT-NO-RIGNET", "name": "RIGNET maintainer object", "admin_id": "RNT9-RIPE", "tech_id": "RNT9-RIPE", "org_id": "ORG-RA131-RIPE", "created": "2006-09-06", "updated": "2016-09-12", "source": "ripe", "raw": "mntner:         MAINT-NO-RIGNET\\ndescr:          RIGNET maintainer object\\nadmin-c:        RNT9-RIPE\\ntech-c:         RNT9-RIPE\\nupd-to:         rir.admin@rig.net\\norg:            ORG-RA131-RIPE\\nauth:           X509-2744\\nauth:           SSO\\nauth:           SSO\\nmnt-by:         MAINT-NO-RIGNET\\ncreated:        2006-09-06T14:07:07Z\\nlast-modified:  2016-09-12T10:03:33Z\\nsource:         RIPE"}, {"id": "XINDI-MNT", "name": "XINDI Networks SRL", "admin_id": "RA9000-RIPE", "tech_id": "RA9000-RIPE", "org_id": "ORG-XNS8-RIPE", "created": "2008-10-12", "updated": "2017-08-15", "source": "ripe", "raw": "mntner:         XINDI-MNT\\ndescr:          XINDI Networks SRL\\nadmin-c:        RA9000-RIPE\\ntech-c:         RA9000-RIPE\\norg:            ORG-XNS8-RIPE\\nupd-to:         ripe@xindi.eu\\nmnt-nfy:        ripe@xindi.eu\\nauth:           SSO\\nauth:           PGPKEY-C78178FD\\nnotify:         ripe@xindi.eu\\nmnt-by:         XINDI-MNT\\ncreated:        2008-10-12T06:58:44Z\\nlast-modified:  2017-08-15T10:51:17Z\\nsource:         RIPE"}, {"id": "ICCREA-MNT", "name": "ICCREA BANCA SPA", "admin_id": "ICR13-RIPE", "tech_id": "ICR13-RIPE", "org_id": "ORG-IBS4-RIPE", "created": "2011-07-12", "updated": "2019-03-12", "source": "ripe", "raw": "mntner:         ICCREA-MNT\\norg:            ORG-IBS4-RIPE\\ndescr:          ICCREA BANCA SPA\\nadmin-c:        ICR13-RIPE\\ntech-c:         ICR13-RIPE\\nupd-to:         registry@iccrea.bcc.it\\nauth:           SSO\\nauth:           SSO\\nmnt-by:         ICCREA-MNT\\ncreated:        2011-07-12T08:36:21Z\\nlast-modified:  2019-03-12T11:06:50Z\\nsource:         RIPE"}, {"id": "AS20955-MNT", "name": "ProQuest AS Maintainer", "admin_id": "PRT", "tech_id": "PRT", "org_id": "ORG-PIaL1-RIPE", "created": "2003-01-15", "updated": "2019-02-15", "source": "ripe", "raw": "mntner:         AS20955-MNT\\ndescr:          ProQuest AS Maintainer\\norg:            ORG-PIaL1-RIPE\\nadmin-c:        PRT\\ntech-c:         PRT\\nauth:           PGPKEY-6DE51001\\nauth:           SSO\\nmnt-by:         AS20955-MNT\\nmnt-nfy:        ripe-notify@prtsystems.ltd.uk\\nupd-to:         ripe-notify@prtsystems.ltd.uk\\ncreated:        2003-01-15T12:11:20Z\\nlast-modified:  2019-02-15T17:08:47Z\\nsource:         RIPE"}, {"id": "THOSTING-MNT", "name": "thosting Maintainer", "admin_id": "THA14-RIPE", "tech_id": "THH19-RIPE", "org_id": "ORG-Ta7-RIPE", "created": "2013-01-18", "updated": "2018-11-01", "source": "ripe", "raw": "mntner:         THOSTING-MNT\\ndescr:          thosting Maintainer\\norg:            ORG-Ta7-RIPE\\nadmin-c:        THA14-RIPE\\ntech-c:         THH19-RIPE\\nauth:           MD5-PW\\nauth:           SSO\\nnotify:         hostmaster@thosting.cz\\nupd-to:         hostmaster@thosting.cz\\nmnt-nfy:        hostmaster@thosting.cz\\nmnt-by:         THOSTING-MNT\\nremarks:        Accepted the RIPE Database Terms and Conditions\\ncreated:        2013-01-18T13:22:25Z\\nlast-modified:  2018-11-01T14:06:49Z\\nsource:         RIPE"}, {"id": "BBANDA-MNT", "name": "Mantainer for BBANDA RIPE DBM objects.", "admin_id": "IRS16-RIPE", "tech_id": "IRS16-RIPE", "org_id": "ORG-BS79-RIPE", "created": "2010-10-27", "updated": "2016-05-03", "source": "ripe", "raw": "mntner:         BBANDA-MNT\\ndescr:          Mantainer for BBANDA RIPE DBM objects.\\norg:            ORG-BS79-RIPE\\nadmin-c:        IRS16-RIPE\\ntech-c:         IRS16-RIPE\\nupd-to:         abongiorno@bbanda.it\\nauth:           SSO\\nmnt-by:         BBANDA-MNT\\ncreated:        2010-10-27T17:29:04Z\\nlast-modified:  2016-05-03T11:55:20Z\\nsource:         RIPE"}, {"id": "NETMASTER-MNT", "name": "Netmaster Communications S.R.L\\nBucharest Bd. Banu Manta 18\\nbl 28 sc B et 8 ap 109\\nsector 1, 011226, Romania\\nRO", "admin_id": "AS5792-RIPE", "tech_id": "AA3080-RIPE", "org_id": "ORG-SNCS1-RIPE", "created": "2004-07-08", "updated": "2008-10-09", "source": "ripe", "raw": "mntner:         NETMASTER-MNT\\ndescr:          Netmaster Communications S.R.L\\ndescr:          Bucharest Bd. Banu Manta 18\\ndescr:          bl 28 sc B et 8 ap 109\\ndescr:          sector 1, 011226, Romania\\ndescr:          RO\\norg:            ORG-SNCS1-RIPE\\nadmin-c:        AS5792-RIPE\\ntech-c:         AA3080-RIPE\\nupd-to:         tech@netmaster.ro\\nmnt-nfy:        tech@netmaster.ro\\nremarks:        MD5 passwords older than November 2011 were removed from this maintainer, see: https://www.ripe.net/removed2011pw\\nmnt-by:         NETMASTER-MNT\\ncreated:        2004-07-08T15:26:39Z\\nlast-modified:  2008-10-09T13:22:57Z\\nsource:         RIPE"}, {"id": "IMASTER-MNT", "name": "ru.imaster maintaner", "admin_id": "GESL2-RIPE", "tech_id": "GESL2-RIPE", "org_id": "ORG-CC3-RIPE", "created": "2004-06-29", "updated": "2018-04-09", "source": "ripe", "raw": "mntner:         IMASTER-MNT\\ndescr:          ru.imaster maintaner\\norg:            ORG-CC3-RIPE\\nadmin-c:        GESL2-RIPE\\ntech-c:         GESL2-RIPE\\nupd-to:         lirmnt@imaster.ru\\nmnt-nfy:        lirmnt@imaster.ru\\nauth:           PGPKEY-C396EEA0\\nauth:           SSO\\nmnt-by:         IMASTER-MNT\\ncreated:        2004-06-29T14:36:00Z\\nlast-modified:  2018-04-09T05:35:41Z\\nsource:         RIPE"}, {"id": "EPEDU-MNT", "name": "EPEDU-NET @ Seinajoki, Finland", "admin_id": "EA6394-RIPE", "tech_id": "ET5049-RIPE", "org_id": "ORG-EPN1-RIPE", "created": "2006-01-18", "updated": "2019-04-11", "source": "ripe", "raw": "mntner:         EPEDU-MNT\\ndescr:          EPEDU-NET @ Seinajoki, Finland\\nadmin-c:        EA6394-RIPE\\ntech-c:         ET5049-RIPE\\nupd-to:         ripe@sedu.fi\\nmnt-nfy:        ripe@sedu.fi\\nauth:           SSO\\nauth:           SSO\\nmnt-by:         EPEDU-MNT\\norg:            ORG-EPN1-RIPE\\ncreated:        2006-01-18T18:09:05Z\\nlast-modified:  2019-04-11T13:06:28Z\\nsource:         RIPE"}, {"id": "W3LOGISTICS-MNT", "name": "Maintainer of w3logistics' Objects", "admin_id": "WH1151-RIPE\\nTO55", "tech_id": "WH1151-RIPE\\nTO778-RIPE", "org_id": "ORG-WWW3-RIPE", "created": "1970-01-01", "updated": "2019-04-15", "source": "ripe", "raw": "mntner:         W3LOGISTICS-MNT\\ndescr:          Maintainer of w3logistics' Objects\\norg:            ORG-WWW3-RIPE\\nadmin-c:        WH1151-RIPE\\nadmin-c:        TO55\\ntech-c:         WH1151-RIPE\\ntech-c:         TO778-RIPE\\nupd-to:         hostmaster@w3logistics.de\\nupd-to:         thomas@omerzu.de\\nmnt-nfy:        hostmaster@w3logistics.de\\nmnt-nfy:        thomas@omerzu.de\\nauth:           PGPKEY-BD6AE201\\nauth:           SSO\\nauth:           MD5-PW\\nmnt-by:         W3LOGISTICS-MNT\\ncreated:        1970-01-01T00:00:00Z\\nlast-modified:  2019-04-15T10:46:10Z\\nsource:         RIPE"}, {"id": "MNT-NNLTD", "name": "NetNames Limited", "admin_id": "NETN-RIPE", "tech_id": "NETN-RIPE", "org_id": "ORG-NL246-RIPE", "created": "2015-01-07", "updated": "2017-11-13", "source": "ripe", "raw": "mntner:         MNT-NNLTD\\ndescr:          NetNames Limited\\norg:            ORG-NL246-RIPE\\nadmin-c:        NETN-RIPE\\ntech-c:         NETN-RIPE\\nupd-to:         sys-ripe@netnames.com\\nmnt-nfy:        sys-ripe@netnames.com\\nauth:           MD5-PW\\nauth:           SSO\\nnotify:         sys-ripe@netnames.com\\nmnt-by:         MNT-NETNAMES\\ncreated:        2015-01-07T16:34:05Z\\nlast-modified:  2017-11-13T15:54:31Z\\nsource:         RIPE"}, {"id": "BURSTNET", "name": "BurstNET Limited", "admin_id": "BED8-RIPE", "tech_id": "BED8-RIPE", "org_id": "ORG-BL102-RIPE", "created": "2011-08-07", "updated": "2011-09-15", "source": "ripe", "raw": "mntner:         BurstNET\\norg:            ORG-BL102-RIPE\\nadmin-c:        BED8-RIPE\\ntech-c:         BED8-RIPE\\ndescr:          BurstNET Limited\\nupd-to:         ripe@burst.net\\nmnt-nfy:        ripe@burst.net\\nremarks:        MD5 passwords older than November 2011 were removed from this maintainer, see: https://www.ripe.net/removed2011pw\\nmnt-by:         BurstNET\\ncreated:        2011-08-07T16:24:03Z\\nlast-modified:  2011-09-15T01:14:10Z\\nsource:         RIPE"}, {"id": "MNT-CHEMICOMP", "name": "Chemicomp+ CJSC.", "admin_id": "NS7570-RIPE", "tech_id": "NS7570-RIPE", "org_id": "ORG-CC37-RIPE", "created": "2008-09-09", "updated": "2019-04-17", "source": "ripe", "raw": "mntner:         MNT-CHEMICOMP\\ndescr:          Chemicomp+ CJSC.\\nadmin-c:        NS7570-RIPE\\ntech-c:         NS7570-RIPE\\norg:            ORG-CC37-RIPE\\nupd-to:         ns@chemicomp.ru\\nauth:           SSO\\nmnt-by:         MNT-CHEMICOMP\\ncreated:        2008-09-09T13:14:48Z\\nlast-modified:  2019-04-17T09:21:04Z\\nsource:         RIPE"}, {"id": "RARTEL-MNT", "name": "SC RARTEL SA\\nDr. Iacob Felix 70, etaj 3\\nBucuresti Sector 1 011041\\nRomania RO", "admin_id": "RS6660-RIPE", "tech_id": "MMP-RIPE", "org_id": "ORG-SRS8-RIPE", "created": "2006-10-02", "updated": "2016-12-06", "source": "ripe", "raw": "mntner:         RARTEL-MNT\\ndescr:          SC RARTEL SA\\ndescr:          Dr. Iacob Felix 70, etaj 3\\ndescr:          Bucuresti Sector 1 011041\\ndescr:          Romania RO\\nadmin-c:        RS6660-RIPE\\ntech-c:         MMP-RIPE\\norg:            ORG-SRS8-RIPE\\nupd-to:         mihai.presicareanu@rartel.ro\\nmnt-nfy:        mihai.presicareanu@rartel.ro\\nauth:           MD5-PW\\nauth:           SSO\\nnotify:         roberto.scagnoli@rartel.ro\\nmnt-by:         RARTEL-MNT\\ncreated:        2006-10-02T10:24:22Z\\nlast-modified:  2016-12-06T16:16:18Z\\nsource:         RIPE"}, {"id": "ELCITY-MNT", "name": "Electronniy gorod, Ltd.", "admin_id": "IIV9-RIPE", "tech_id": "IIV9-RIPE", "org_id": "ORG-EgL2-RIPE", "created": "2006-07-26", "updated": "2006-08-07", "source": "ripe", "raw": "mntner:         ELCITY-MNT\\ndescr:          Electronniy gorod, Ltd.\\norg:            ORG-EgL2-RIPE\\nadmin-c:        IIV9-RIPE\\ntech-c:         IIV9-RIPE\\nupd-to:         admin@elcity.ru\\nremarks:        MD5 passwords older than November 2011 were removed from this maintainer, see: https://www.ripe.net/removed2011pw\\nmnt-by:         ELCITY-MNT\\ncreated:        2006-07-26T12:26:07Z\\nlast-modified:  2006-08-07T14:24:41Z\\nsource:         RIPE"}, {"id": "MAGICNET-MNT", "name": "PE Marina Lebedeva", "admin_id": "LM3474-RIPE", "tech_id": "SA4105-RIPE", "org_id": "ORG-PML2-RIPE", "created": "2008-09-09", "updated": "2016-12-28", "source": "ripe", "raw": "mntner:         MAGICNET-MNT\\ndescr:          PE Marina Lebedeva\\norg:            ORG-PML2-RIPE\\nadmin-c:        LM3474-RIPE\\ntech-c:         SA4105-RIPE\\nupd-to:         magicnet.marina@gmail.com\\nmnt-nfy:        magicnet.marina@gmail.com\\nauth:           SSO\\nremarks:        MD5 passwords older than November 2011 were removed from this maintainer, see: https://www.ripe.net/removed2011pw\\nnotify:         magicnet.marina@gmail.com\\nmnt-by:         MAGICNET-MNT\\ncreated:        2008-09-09T19:29:34Z\\nlast-modified:  2016-12-28T23:03:16Z\\nsource:         RIPE"}, {"id": "EAD-TELECOM-MNT", "name": "EAD TELECOM SRL\\nEroilor 17\\nBrasov Brasov\\nRomania RO", "admin_id": "RA4848-RIPE", "tech_id": "IM103-RIPE", "org_id": "ORG-ETS3-RIPE", "created": "2010-10-21", "updated": "2010-12-10", "source": "ripe", "raw": "mntner:         EAD-TELECOM-MNT\\ndescr:          EAD TELECOM SRL\\ndescr:          Eroilor 17\\ndescr:          Brasov Brasov\\ndescr:          Romania RO\\nadmin-c:        RA4848-RIPE\\ntech-c:         IM103-RIPE\\norg:            ORG-ETS3-RIPE\\nupd-to:         razvan@eadtel.com\\nmnt-nfy:        razvan@eadtel.com\\nauth:           PGPKEY-7FD0A168\\nremarks:        MD5 passwords older than November 2011 were removed from this maintainer, see: https://www.ripe.net/removed2011pw\\nnotify:         razvan@eadtel.com\\nmnt-by:         EAD-TELECOM-MNT\\ncreated:        2010-10-21T07:42:40Z\\nlast-modified:  2010-12-10T17:16:06Z\\nsource:         RIPE"}, {"id": "TRADEADS-MNT", "name": "TRADEADS INTERACTIVE SRL\\nBdul Unirii Nr 19 Bl 4B Parter\\nSector 5 Bucuresti 040103 ROMANIA", "admin_id": "IN607-RIPE", "tech_id": "IN607-RIPE", "org_id": "ORG-TIS18-RIPE", "created": "2009-04-21", "updated": "2009-04-21", "source": "ripe", "raw": "mntner:         TRADEADS-MNT\\ndescr:          TRADEADS INTERACTIVE SRL\\ndescr:          Bdul Unirii Nr 19 Bl 4B Parter\\ndescr:          Sector 5 Bucuresti 040103 ROMANIA\\nadmin-c:        IN607-RIPE\\ntech-c:         IN607-RIPE\\norg:            ORG-TIS18-RIPE\\nupd-to:         ionel.naftanaila@tradeads.eu\\nmnt-nfy:        ionel.naftanaila@tradeads.eu\\nauth:           PGPKEY-7FD0A168\\nremarks:        MD5 passwords older than November 2011 were removed from this maintainer, see: https://www.ripe.net/removed2011pw\\nnotify:         ionel.naftanaila@tradeads.eu\\nmnt-by:         TRADEADS-MNT\\ncreated:        2009-04-21T09:36:32Z\\nlast-modified:  2009-04-21T09:36:32Z\\nsource:         RIPE"}, {"id": "VIVA-NET-MNT", "name": "Viva Net SRL\\nbd.Decebal 80/1 et.2 of. 204\\nChisinau Moldova MD-2038", "admin_id": "CD7297-RIPE", "tech_id": "CD7297-RIPE", "org_id": "ORG-VNS7-RIPE", "created": "2016-06-15", "updated": "2016-08-18", "source": "ripe", "raw": "mntner:         VIVA-NET-MNT\\ndescr:          Viva Net SRL\\ndescr:          bd.Decebal 80/1 et.2 of. 204\\ndescr:          Chisinau Moldova MD-2038\\nadmin-c:        CD7297-RIPE\\ntech-c:         CD7297-RIPE\\norg:            ORG-VNS7-RIPE\\nupd-to:         dmitri.cioban@gmail.com\\nmnt-nfy:        dmitri.cioban@gmail.com\\nauth:           MD5-PW\\nauth:           SSO\\nauth:           SSO\\nauth:           PGPKEY-7FD0A168\\nnotify:         dmitri.cioban@gmail.com\\nmnt-by:         VIVA-NET-MNT\\ncreated:        2016-06-15T13:56:52Z\\nlast-modified:  2016-08-18T14:21:38Z\\nsource:         RIPE"}, {"id": "EDUSERV-MNT", "name": "Eduserv Internet Networks Team", "admin_id": "CD79-RIPE", "tech_id": "CD79-RIPE", "org_id": "ORG-EI6-RIPE", "created": "2004-06-14", "updated": "2018-04-09", "source": "ripe", "raw": "mntner:         EDUSERV-MNT\\norg:            ORG-EI6-RIPE\\ndescr:          Eduserv Internet Networks Team\\nadmin-c:        CD79-RIPE\\ntech-c:         CD79-RIPE\\nupd-to:         nasa@eduserv.org.uk\\nmnt-nfy:        nasa@eduserv.org.uk\\nmnt-by:         EDUSERV-MNT\\ncreated:        2004-06-14T15:23:32Z\\nlast-modified:  2018-04-09T13:35:54Z\\nsource:         RIPE\\nauth:           MD5-PW\\nauth:           SSO\\nauth:           SSO"}, {"id": "TV-TEOMAR-MNT", "name": "TV TEOMAR SRL\\nPRICIPALA BROSCAUTI\\nBOTOSANI 717040\\nRomania RO", "admin_id": "TC4128-RIPE", "tech_id": "TC4128-RIPE", "org_id": "ORG-TTS17-RIPE", "created": "2013-02-01", "updated": "2015-06-27", "source": "ripe", "raw": "mntner:         TV-TEOMAR-MNT\\ndescr:          TV TEOMAR SRL\\ndescr:          PRICIPALA BROSCAUTI\\ndescr:          BOTOSANI 717040\\ndescr:          Romania RO\\nadmin-c:        TC4128-RIPE\\ntech-c:         TC4128-RIPE\\norg:            ORG-TTS17-RIPE\\nupd-to:         tcsbroscauti@yahoo.com\\nmnt-nfy:        tcsbroscauti@yahoo.com\\nauth:           MD5-PW\\nauth:           PGPKEY-7FD0A168\\nauth:           SSO\\nnotify:         tcsbroscauti@yahoo.com\\nmnt-by:         TV-TEOMAR-MNT\\ncreated:        2013-02-01T10:39:07Z\\nlast-modified:  2015-06-27T08:03:51Z\\nsource:         RIPE"}, {"id": "ALVOGEN-MNT", "name": "ALVOGEN ROMANIA SRL\\nSTR.DRUMUL GARII NR.32\\nOTOPENI Ilfov Romania", "admin_id": "MLP466-RIPE", "tech_id": "MLP466-RIPE", "org_id": "ORG-ARS7-RIPE", "created": "2013-08-13", "updated": "2013-08-13", "source": "ripe", "raw": "mntner:         ALVOGEN-MNT\\ndescr:          ALVOGEN ROMANIA SRL\\ndescr:          STR.DRUMUL GARII NR.32\\ndescr:          OTOPENI Ilfov Romania\\nadmin-c:        MLP466-RIPE\\ntech-c:         MLP466-RIPE\\norg:            ORG-ARS7-RIPE\\nupd-to:         marius.pavel@alvogen.com\\nmnt-nfy:        marius.pavel@alvogen.com\\nauth:           MD5-PW\\nauth:           PGPKEY-7FD0A168\\nnotify:         marius.pavel@alvogen.com\\nmnt-by:         ALVOGEN-MNT\\ncreated:        2013-08-13T08:30:10Z\\nlast-modified:  2013-08-13T08:30:10Z\\nsource:         RIPE"}, {"id": "ISTRANET-MNT", "name": "Istranet LLC", "admin_id": "AP14781-RIPE", "tech_id": "AP14781-RIPE", "org_id": "ORG-IL82-RIPE", "created": "2007-04-10", "updated": "2019-03-12", "source": "ripe", "raw": "mntner:         ISTRANET-MNT\\ndescr:          Istranet LLC\\norg:            ORG-IL82-RIPE\\nadmin-c:        AP14781-RIPE\\nauth:           MD5-PW\\nauth:           SSO\\nauth:           SSO\\nauth:           SSO\\nauth:           PGPKEY-C396EEA0\\ntech-c:         AP14781-RIPE\\nupd-to:         pogorelkin54@mail.ru\\nmnt-nfy:        pogorelkin54@mail.ru\\nnotify:         pogorelkin54@mail.ru\\nmnt-by:         ISTRANET-MNT\\ncreated:        2007-04-10T16:03:32Z\\nlast-modified:  2019-03-12T13:21:04Z\\nsource:         RIPE"}, {"id": "INTRAROM-MNT", "name": "SC INTRAROM SA\\nFabrica de Glucoza, 17\\nBucuresti 2\\nRomania RO", "admin_id": "AN2895-RIPE", "tech_id": "AN2895-RIPE", "org_id": "ORG-SIS28-RIPE", "created": "2007-05-25", "updated": "2007-05-25", "source": "ripe", "raw": "mntner:         INTRAROM-MNT\\ndescr:          SC INTRAROM SA\\ndescr:          Fabrica de Glucoza, 17\\ndescr:          Bucuresti 2\\ndescr:          Romania RO\\nadmin-c:        AN2895-RIPE\\ntech-c:         AN2895-RIPE\\norg:            ORG-SIS28-RIPE\\nupd-to:         it.support@intrarom.ro\\nmnt-nfy:        it.support@intrarom.ro\\nauth:           PGPKEY-7FD0A168\\nremarks:        MD5 passwords older than November 2011 were removed from this maintainer, see: https://www.ripe.net/removed2011pw\\nnotify:         it.support@intrarom.ro\\nmnt-by:         INTRAROM-MNT\\ncreated:        2007-05-25T06:51:53Z\\nlast-modified:  2007-05-25T06:51:53Z\\nsource:         RIPE"}, {"id": "RO-BGS-MNT", "name": "BGS DIVIZIA DE SECURITATE SRL\\nGura Vadului 1 Bloc G26 sc D et 1 ap 34\\nBucuresti Sector 3 032336\\nRomania RO", "admin_id": "CD6346-RIPE", "tech_id": "CD6346-RIPE", "org_id": "ORG-BDDS1-RIPE", "created": "2014-03-12", "updated": "2014-03-12", "source": "ripe", "raw": "mntner:         RO-BGS-MNT\\ndescr:          BGS DIVIZIA DE SECURITATE SRL\\ndescr:          Gura Vadului 1 Bloc G26 sc D et 1 ap 34\\ndescr:          Bucuresti Sector 3 032336\\ndescr:          Romania RO\\nadmin-c:        CD6346-RIPE\\ntech-c:         CD6346-RIPE\\norg:            ORG-BDDS1-RIPE\\nupd-to:         cristian.dimache@bgs.ro\\nmnt-nfy:        cristian.dimache@bgs.ro\\nauth:           MD5-PW\\nauth:           PGPKEY-7FD0A168\\nnotify:         cristian.dimache@bgs.ro\\nmnt-by:         RO-BGS-MNT\\ncreated:        2014-03-12T12:20:42Z\\nlast-modified:  2014-03-12T12:20:42Z\\nsource:         RIPE"}, {"id": "INTERACTIVE-NOC", "name": "Interactive Network Communications GmbH mntner object\\nMaintainer of all related person objects", "admin_id": "RJF1-RIPE", "tech_id": "RJF1-RIPE", "org_id": "ORG-INCG1-RIPE", "created": "2006-01-16", "updated": "2017-11-13", "source": "ripe", "raw": "mntner:         INTERACTIVE-NOC\\ndescr:          Interactive Network Communications GmbH mntner object\\ndescr:          Maintainer of all related person objects\\norg:            ORG-INCG1-RIPE\\nadmin-c:        RJF1-RIPE\\ntech-c:         RJF1-RIPE\\nmnt-nfy:        ripe@internet.de\\nauth:           MD5-PW\\nauth:           SSO\\nauth:           SSO\\nauth:           SSO\\nremarks:        send all netabuse and Spam to abuse@internet.de\\nnotify:         ripe@internet.de\\nupd-to:         noc@internet.de\\nmnt-by:         INTERACTIVE-NOC\\ncreated:        2006-01-16T17:28:15Z\\nlast-modified:  2017-11-13T15:52:30Z\\nsource:         RIPE"}, {"id": "BALTICDATACENTER-MNT", "name": "Baltic Data Center", "admin_id": "JA2732-RIPE", "tech_id": "JA2732-RIPE", "org_id": "ORG-BDC1-RIPE", "created": "2008-07-24", "updated": "2008-07-30", "source": "ripe", "raw": "mntner:         BALTICDATACENTER-MNT\\ndescr:          Baltic Data Center\\norg:            ORG-BDC1-RIPE\\nadmin-c:        JA2732-RIPE\\ntech-c:         JA2732-RIPE\\nupd-to:         bok@balticdatacenter.pl\\nmnt-nfy:        bok@balticdatacenter.pl\\nremarks:        MD5 passwords older than November 2011 were removed from this maintainer, see: https://www.ripe.net/removed2011pw\\nnotify:         bok@balticdatacenter.pl\\nmnt-by:         BALTICDATACENTER-MNT\\nmnt-by:         NEPHAX-MNT\\ncreated:        2008-07-24T16:58:45Z\\nlast-modified:  2008-07-30T20:38:37Z\\nsource:         RIPE"}, {"id": "VINCON-MNT", "name": "Vincon Vrancea SA\\nstr. Avantului, nr.12\\nFocsani VN\\nRomania RO", "admin_id": "NS4185-RIPE", "tech_id": "NS4185-RIPE", "org_id": "ORG-VVS3-RIPE", "created": "2012-05-04", "updated": "2012-05-04", "source": "ripe", "raw": "mntner:         VINCON-MNT\\ndescr:          Vincon Vrancea SA\\ndescr:          str. Avantului, nr.12\\ndescr:          Focsani VN\\ndescr:          Romania RO\\nadmin-c:        NS4185-RIPE\\ntech-c:         NS4185-RIPE\\norg:            ORG-VVS3-RIPE\\nupd-to:         sorin@vinconromania.com\\nmnt-nfy:        sorin@vinconromania.com\\nauth:           MD5-PW\\nauth:           PGPKEY-7FD0A168\\nnotify:         sorin@vinconromania.com\\nmnt-by:         VINCON-MNT\\ncreated:        2012-05-04T05:23:10Z\\nlast-modified:  2012-05-04T05:23:10Z\\nsource:         RIPE"}, {"id": "METRONETKZ-MNT", "name": "TOO \"Metro Net\"", "admin_id": "TO850-RIPE", "tech_id": "TO850-RIPE", "org_id": "ORG-TMN1-RIPE", "created": "2008-09-18", "updated": "2016-01-23", "source": "ripe", "raw": "mntner:         METRONETKZ-MNT\\ndescr:          TOO \"Metro Net\"\\norg:            ORG-TMN1-RIPE\\nadmin-c:        TO850-RIPE\\ntech-c:         TO850-RIPE\\nupd-to:         o.tropinin@metronet.kz\\nmnt-nfy:        o.tropinin@metronet.kz\\nauth:           MD5-PW\\nauth:           SSO\\nnotify:         o.tropinin@metronet.kz\\nmnt-by:         METRONETKZ-MNT\\ncreated:        2008-09-18T11:47:39Z\\nlast-modified:  2016-01-23T11:16:36Z\\nsource:         RIPE"}, {"id": "AMKR-MNT", "name": "PJSC ArcelorMittal Kryviy Rih", "admin_id": "IK4264-RIPE\\nOD1773-RIPE\\nGT6875-RIPE", "tech_id": "GT6875-RIPE\\nIK4264-RIPE\\nOD1773-RIPE", "org_id": "ORG-KRR1-RIPE", "created": "2015-01-28", "updated": "2016-12-08", "source": "ripe", "raw": "mntner:         AMKR-MNT\\ndescr:          PJSC ArcelorMittal Kryviy Rih\\nadmin-c:        IK4264-RIPE\\nadmin-c:        OD1773-RIPE\\nadmin-c:        GT6875-RIPE\\nupd-to:         noc-amkr@arcelormittal.com\\nauth:           SSO\\nauth:           SSO\\nauth:           SSO\\nauth:           SSO\\nmnt-by:         AMKR-MNT\\ncreated:        2015-01-28T13:56:40Z\\nlast-modified:  2016-12-08T13:34:00Z\\nsource:         RIPE\\norg:            ORG-KRR1-RIPE\\ntech-c:         GT6875-RIPE\\ntech-c:         IK4264-RIPE\\ntech-c:         OD1773-RIPE\\nnotify:         noc-amkr@arcelormittal.com"}, {"id": "BMFMS-MNT", "name": "BURSA MONETAR FINANCIARA SI DE MARFURI SIBIU\\n2 MIHAIL KOGALNICEANU STREET, SIBIU\\nRO", "admin_id": "BB2009-RIPE", "tech_id": "BC2266-RIPE", "org_id": "ORG-BMFS1-RIPE", "created": "2006-07-25", "updated": "2014-08-29", "source": "ripe", "raw": "mntner:         BMFMS-MNT\\ndescr:          BURSA MONETAR FINANCIARA SI DE MARFURI SIBIU\\ndescr:          2 MIHAIL KOGALNICEANU STREET, SIBIU\\ndescr:          RO\\nadmin-c:        BB2009-RIPE\\ntech-c:         BC2266-RIPE\\norg:            ORG-BMFS1-RIPE\\nupd-to:         bogdanbarsan@bmfms.ro\\nmnt-nfy:        bogdanbarsan@bmfms.ro\\nnotify:         bogdanbarsan@bmfms.ro\\nmnt-by:         BMFMS-MNT\\nauth:           MD5-PW\\ncreated:        2006-07-25T14:19:29Z\\nlast-modified:  2014-08-29T07:43:06Z\\nsource:         RIPE"}, {"id": "MEDIA-NET-MNT", "name": "SC MediaNet SRL\\nHotin Bl C5 Ap 14\\nTargoviste Dambovita\\nRomania RO", "admin_id": "AT4416-RIPE", "tech_id": "AT4416-RIPE", "org_id": "ORG-SMS11-RIPE", "created": "2006-06-27", "updated": "2006-06-27", "source": "ripe", "raw": "mntner:         MEDIA-NET-MNT\\ndescr:          SC MediaNet SRL\\ndescr:          Hotin Bl C5 Ap 14\\ndescr:          Targoviste Dambovita\\ndescr:          Romania RO\\nadmin-c:        AT4416-RIPE\\ntech-c:         AT4416-RIPE\\norg:            ORG-SMS11-RIPE\\nupd-to:         alexandra@medianet.com.ro\\nmnt-nfy:        alexandra@medianet.com.ro\\nauth:           PGPKEY-7FD0A168\\nremarks:        MD5 passwords older than November 2011 were removed from this maintainer, see: https://www.ripe.net/removed2011pw\\nnotify:         alexandra@medianet.com.ro\\nmnt-by:         MEDIA-NET-MNT\\ncreated:        2006-06-27T23:59:30Z\\nlast-modified:  2006-06-27T23:59:30Z\\nsource:         RIPE"}, {"id": "TECHCOM-MNT", "name": "TechCom s.r.o.", "admin_id": "VP2596-RIPE\\nRJ1855-RIPE", "tech_id": "VP2596-RIPE\\nRJ1855-RIPE", "org_id": "ORG-Ts97-RIPE", "created": "2010-02-25", "updated": "2017-11-13", "source": "ripe", "raw": "mntner:         techcom-mnt\\ndescr:          TechCom s.r.o.\\norg:            ORG-Ts97-RIPE\\nadmin-c:        VP2596-RIPE\\nadmin-c:        RJ1855-RIPE\\ntech-c:         VP2596-RIPE\\ntech-c:         RJ1855-RIPE\\nupd-to:         poli@techcom.cz\\nupd-to:         jendrys@techcom.cz\\nauth:           SSO\\nauth:           PGPKEY-26AB09E7\\nauth:           PGPKEY-901F812D\\nauth:           MD5-PW\\nmnt-by:         techcom-mnt\\nnotify:         ripe@techcom.cz\\ncreated:        2010-02-25T12:16:53Z\\nlast-modified:  2017-11-13T15:53:27Z\\nsource:         RIPE"}, {"id": "BTTEL-MNT", "name": "BT Telecomunicaciones Maintainer red", "admin_id": "VGC10-RIPE\\nVGC10-RIPE", "tech_id": "VGC10-RIPE\\nTPR3-RIPE", "org_id": "ORG-BTS1-RIPE", "created": "1970-01-01", "updated": "2019-09-27", "source": "ripe", "raw": "mntner:         BTTEL-MNT\\ndescr:          BT Telecomunicaciones Maintainer red\\norg:            ORG-BTS1-RIPE\\nadmin-c:        VGC10-RIPE\\nadmin-c:        VGC10-RIPE\\ntech-c:         VGC10-RIPE\\ntech-c:         TPR3-RIPE\\nupd-to:         victoria.gutierrez@bt.com\\nmnt-nfy:        victoria.gutierrez@bt.com\\nauth:           MD5-PW\\nauth:           SSO\\nauth:           SSO\\nauth:           SSO\\nauth:           PGPKEY-556BD356\\nmnt-by:         BTTEL-MNT\\ncreated:        1970-01-01T00:00:00Z\\nlast-modified:  2019-09-27T08:37:23Z\\nsource:         RIPE"}, {"id": "ITMSC-MNT", "name": "Leonardo S.p.a.", "admin_id": "SCSc5-RIPE", "tech_id": "SCSc5-RIPE", "org_id": "ORG-MSCs1-RIPE", "created": "2008-10-10", "updated": "2017-07-21", "source": "ripe", "raw": "mntner:         ITMSC-MNT\\ndescr:          Leonardo S.p.a.\\norg:            ORG-MSCs1-RIPE\\nadmin-c:        SCSc5-RIPE\\ntech-c:         SCSc5-RIPE\\nauth:           MD5-PW\\nauth:           SSO\\nauth:           SSO\\nmnt-by:         ITMSC-MNT\\nmnt-by:         ELSAG-NET-MNT\\nmnt-by:         LEONARDO-MNT\\nnotify:         salvatore.longobardo@leonardocompany.com\\nupd-to:         network.inf.op@leonardocompany.com\\nnotify:         alessandro.barisone@leonardocompany.com\\nnotify:         network.inf.op@leonardocompany.com\\nnotify:         graziano.sommariva@leonardocompany.com\\nnotify:         fabio.manzoni@leonardocompany.com\\nupd-to:         salvatore.longobardo@leonardocompany.com\\nupd-to:         alessandro.barisone@leonardocompany.com\\nupd-to:         graziano.sommariva@leonardocompany.com\\nupd-to:         fabio.manzoni@leonardocompany.com\\nmnt-nfy:        salvatore.longoabrdo@leonardocompany.com\\nmnt-nfy:        alessandro.barisone@leonardocompany.com\\nmnt-nfy:        graziano.sommariva@leonardocompany.com\\nmnt-nfy:        fabio.manzoni@leonardocompany.com\\ncreated:        2008-10-10T12:57:14Z\\nlast-modified:  2017-07-21T12:37:29Z\\nsource:         RIPE"}, {"id": "OLCAB-MNT", "name": "Olcab Telecom SRL\\nSuceava, ROMANIA", "admin_id": "OTN-RIPE", "tech_id": "OTN-RIPE", "org_id": "ORG-SOTS2-RIPE", "created": "2006-08-25", "updated": "2016-12-20", "source": "ripe", "raw": "mntner:         OLCAB-MNT\\ndescr:          Olcab Telecom SRL\\ndescr:          Suceava, ROMANIA\\nadmin-c:        OTN-RIPE\\ntech-c:         OTN-RIPE\\norg:            ORG-SOTS2-RIPE\\nupd-to:         hostmaster@olcab.ro\\nmnt-nfy:        hostmaster@olcab.ro\\nauth:           PGPKEY-7FD0A168\\nauth:           SSO\\nremarks:        MD5 passwords older than November 2011 were removed from this maintainer, see: https://www.ripe.net/removed2011pw\\nnotify:         hostmaster@olcab.ro\\nmnt-by:         OLCAB-MNT\\ncreated:        2006-08-25T07:16:46Z\\nlast-modified:  2016-12-20T19:57:25Z\\nsource:         RIPE"}, {"id": "FAQ-MNT", "name": "HOSTBOX.LV", "admin_id": "AM1270-RIPE", "tech_id": "AM1270-RIPE", "org_id": "ORG-PA328-RIPE", "created": "2009-07-23", "updated": "2017-08-22", "source": "ripe", "raw": "mntner:         FAQ-MNT\\ndescr:          HOSTBOX.LV\\norg:            ORG-PA328-RIPE\\nadmin-c:        AM1270-RIPE\\ntech-c:         AM1270-RIPE\\nupd-to:         info@hostbox.lv\\nmnt-nfy:        info@hostbox.lv\\nauth:           SSO\\nremarks:        MD5 passwords older than November 2011 were removed from this maintainer, see: https://www.ripe.net/removed2011pw\\nnotify:         info@hostbox.lv\\nmnt-by:         FAQ-MNT\\ncreated:        2009-07-23T13:54:04Z\\nlast-modified:  2017-08-22T08:28:41Z\\nsource:         RIPE"}, {"id": "FCRUISE-MNT", "name": "Maintainer Object for Fidelio Cruise", "admin_id": "FCAH1-RIPE", "tech_id": "FCHM-RIPE", "org_id": "ORG-FCSG1-RIPE", "created": "2004-07-27", "updated": "2017-11-13", "source": "ripe", "raw": "mntner:         FCRUISE-MNT\\ndescr:          Maintainer Object for Fidelio Cruise\\norg:            ORG-FCSG1-RIPE\\nadmin-c:        FCAH1-RIPE\\ntech-c:         FCHM-RIPE\\nauth:           PGPKEY-B2BF3475\\nauth:           PGPKEY-AD3EF21C\\nmnt-by:         FCRUISE-MNT\\nmnt-by:         DESC-MNT\\nremarks:        --------------------------------------------------\\nremarks:        ,___ _ _ _ _ ___ _\\nremarks:        | __(_)__| |___| (_)___ / __|_ _ _ _(_)___ ___\\nremarks:        | _|| / _` / -_) | / _ \\\\ | (__| '_| || | (_-</ -_)\\nremarks:        |_| |_\\\\__,_\\\\___|_|_\\\\___/ \\\\___|_| \\\\_,_|_/__/\\\\___|\\nremarks:        --------------------------------------------------\\nremarks:        Leads the market in the design, installation and\\nremarks:        support of IT systems for the cruise ship industry\\nremarks:        --------------------------------------------------\\nupd-to:         ripe.guardian@fcruise.net\\nnotify:         ripe.guardian@fcruise.net\\nmnt-nfy:        ripe.guardian@fcruise.net\\ncreated:        2004-07-27T21:17:07Z\\nlast-modified:  2017-11-13T15:52:14Z\\nsource:         RIPE"}, {"id": "INTRA-NET-MNT", "name": "SC INTRANET VISION SRL\\nStr Ozana Nr 3 Bl I31 Sc 4 Et 4 Ap 60\\nBucuresti Sector 3\\nRomania RO", "admin_id": "EC2078-RIPE", "tech_id": "EC2078-RIPE", "org_id": "ORG-SIVS1-RIPE", "created": "2005-11-17", "updated": "2005-11-17", "source": "ripe", "raw": "mntner:         INTRA-NET-MNT\\ndescr:          SC INTRANET VISION SRL\\ndescr:          Str Ozana Nr 3 Bl I31 Sc 4 Et 4 Ap 60\\ndescr:          Bucuresti Sector 3\\ndescr:          Romania RO\\nadmin-c:        EC2078-RIPE\\ntech-c:         EC2078-RIPE\\norg:            ORG-SIVS1-RIPE\\nupd-to:         webmaster@intra-net.ro\\nmnt-nfy:        webmaster@intra-net.ro\\nauth:           PGPKEY-7FD0A168\\nremarks:        MD5 passwords older than November 2011 were removed from this maintainer, see: https://www.ripe.net/removed2011pw\\nnotify:         webmaster@intra-net.ro\\nmnt-by:         INTRA-NET-MNT\\ncreated:        2005-11-17T08:28:32Z\\nlast-modified:  2005-11-17T08:28:32Z\\nsource:         RIPE"}, {"id": "VIDEOMAG-MNT", "name": "VIDEOMAG SRL\\nGRANICERULUI 27\\nCOLIBASI CAHUL 5316\\nMoldova", "admin_id": "FC12160-RIPE", "tech_id": "FC12160-RIPE", "org_id": "ORG-VS99-RIPE", "created": "2013-08-30", "updated": "2016-07-29", "source": "ripe", "raw": "mntner:         VIDEOMAG-MNT\\ndescr:          VIDEOMAG SRL\\ndescr:          GRANICERULUI 27\\ndescr:          COLIBASI CAHUL 5316\\ndescr:          Moldova\\nadmin-c:        FC12160-RIPE\\ntech-c:         FC12160-RIPE\\norg:            ORG-VS99-RIPE\\nupd-to:         costel77799@mail.ru\\nmnt-nfy:        costel77799@mail.ru\\nauth:           MD5-PW\\nauth:           SSO\\nauth:           PGPKEY-7FD0A168\\nnotify:         costel77799@mail.ru\\nmnt-by:         VIDEOMAG-MNT\\ncreated:        2013-08-30T06:23:44Z\\nlast-modified:  2016-07-29T09:14:27Z\\nsource:         RIPE"}, {"id": "BITTNET-MNT", "name": "Bittnet Systems SA\\nStr Soimus, Nr 23, Bl 2, Sc B, Ap 24,\\nBucuresti, Sector 4, Romania, RO-040704", "admin_id": "CI1776-RIPE", "tech_id": "CI1776-RIPE", "org_id": "ORG-BSS35-RIPE", "created": "2019-02-18", "updated": "2019-02-18", "source": "ripe", "raw": "mntner:         BITTNET-MNT\\ndescr:          Bittnet Systems SA\\ndescr:          Str Soimus, Nr 23, Bl 2, Sc B, Ap 24,\\ndescr:          Bucuresti, Sector 4, Romania, RO-040704\\nadmin-c:        CI1776-RIPE\\ntech-c:         CI1776-RIPE\\norg:            ORG-BSS35-RIPE\\nupd-to:         cristian.ionescu@bittnet.ro\\nmnt-nfy:        cristian.ionescu@bittnet.ro\\nauth:           MD5-PW\\nauth:           PGPKEY-7FD0A168\\nnotify:         cristian.ionescu@bittnet.ro\\nmnt-by:         BITTNET-MNT\\ncreated:        2019-02-18T09:19:24Z\\nlast-modified:  2019-02-18T09:19:24Z\\nsource:         RIPE"}, {"id": "BCIT-MNT", "name": "UniCredit Bank SA\\n1F, Expozitiei Bd.\\nRO - 012101, Bucharest 1, Romania", "admin_id": "OI74-RIPE", "tech_id": "BC1559-RIPE", "org_id": "ORG-BCIT1-RIPE", "created": "2005-03-07", "updated": "2015-12-16", "source": "ripe", "raw": "mntner:         BCIT-MNT\\ndescr:          UniCredit Bank SA\\ndescr:          1F, Expozitiei Bd.\\ndescr:          RO - 012101, Bucharest 1, Romania\\nadmin-c:        OI74-RIPE\\ntech-c:         BC1559-RIPE\\norg:            ORG-BCIT1-RIPE\\nupd-to:         ROUCTHOICTManagement-ICTCommunications@unicredit.ro\\nmnt-nfy:        ROUCTHOICTManagement-ICTCommunications@unicredit.ro\\nauth:           SSO\\nremarks:        MD5 passwords older than November 2011 were removed from this maintainer, see: https://www.ripe.net/removed2011pw\\nnotify:         ROUCTHOICTManagement-ICTCommunications@unicredit.ro\\nmnt-by:         BCIT-MNT\\ncreated:        2005-03-07T07:34:01Z\\nlast-modified:  2015-12-16T10:36:09Z\\nsource:         RIPE"}, {"id": "BUBTAINA", "name": "Owner of the Infrastructure, account holder", "admin_id": "MB44730-RIPE", "tech_id": "MAB284-RIPE", "org_id": "ORG-BGL20-RIPE", "created": "2017-09-08", "updated": "2018-07-17", "source": "ripe", "raw": "mntner:         Bubtaina\\ndescr:          Owner of the Infrastructure, account holder\\nmnt-nfy:        NCC@Bubtaina.Com\\ntech-c:         MAB284-RIPE\\norg:            ORG-BGL20-RIPE\\nadmin-c:        MB44730-RIPE\\nupd-to:         manager@bubtaina.group\\nauth:           SSO\\nmnt-by:         Bubtaina\\ncreated:        2017-09-08T23:37:59Z\\nlast-modified:  2018-07-17T16:52:01Z\\nsource:         RIPE"}, {"id": "CKLT-MNT", "name": "CIKLET ILETISIM", "admin_id": "cklt-ripe\\nalp-ripe", "tech_id": "cklt1-ripe", "org_id": "ORG-CTIV2-RIPE", "created": "2008-10-06", "updated": "2019-09-25", "source": "ripe", "raw": "mntner:         CKLT-MNT\\ndescr:          CIKLET ILETISIM\\nremarks:        Ciklet Tasarim Iletisim ve Org. Tic. Ltd. Sti.\\nremarks:        Esentepe Mahallesi Talatpasa Caddesi No:5 Sisli\\nremarks:        34394, Istanbul - TURKEY\\nremarks:        +90 (212) 705 2550\\nremarks:        +90 (212) 705 2555\\nadmin-c:        cklt-ripe\\nadmin-c:        alp-ripe\\ntech-c:         cklt1-ripe\\nupd-to:         a.sunnetci@ciklet.com.tr\\nmnt-by:         cklt-mnt\\nmnt-by:         ciklet-mnt\\norg:            ORG-CTIV2-RIPE\\nremarks:        \\nremarks:        Abuse & intrusion reports should\\nremarks:        be sent to: abuse@ciklet.net.tr\\nremarks:        \\nauth:           SSO\\nauth:           SSO\\ncreated:        2008-10-06T21:27:00Z\\nlast-modified:  2019-09-25T20:59:55Z\\nsource:         RIPE"}, {"id": "NETROUTING-MNT", "name": "Netrouting Data Facilities", "admin_id": "SBT10-RIPE", "tech_id": "SBT10-RIPE", "org_id": "ORG-NA302-RIPE", "created": "2008-09-09", "updated": "2017-11-13", "source": "ripe", "raw": "mntner:         NETROUTING-MNT\\ndescr:          Netrouting Data Facilities\\norg:            ORG-NA302-RIPE\\nadmin-c:        SBT10-RIPE\\ntech-c:         SBT10-RIPE\\nupd-to:         s.bout@netrouting.eu\\nauth:           MD5-PW\\nauth:           SSO\\nauth:           SSO\\nauth:           SSO\\nauth:           SSO\\nauth:           SSO\\nmnt-by:         NETROUTING-MNT\\ncreated:        2008-09-09T08:46:24Z\\nlast-modified:  2017-11-13T15:53:06Z\\nsource:         RIPE"}, {"id": "ANM-RO-MNT", "name": "Agentia Nationala a Medicamentului\\nAv. Sanatescu Nr. 48\\nBucuresti Sector 1\\nRomania RO", "admin_id": "MG1292-RIPE", "tech_id": "GM939-RIPE", "org_id": "ORG-ANaM1-RIPE", "created": "2009-07-17", "updated": "2009-07-31", "source": "ripe", "raw": "mntner:         ANM-RO-MNT\\ndescr:          Agentia Nationala a Medicamentului\\ndescr:          Av. Sanatescu Nr. 48\\ndescr:          Bucuresti Sector 1\\ndescr:          Romania RO\\nadmin-c:        MG1292-RIPE\\ntech-c:         GM939-RIPE\\norg:            ORG-ANaM1-RIPE\\nupd-to:         webmaster@anm.ro\\nmnt-nfy:        webmaster@anm.ro\\nauth:           PGPKEY-7FD0A168\\nremarks:        MD5 passwords older than November 2011 were removed from this maintainer, see: https://www.ripe.net/removed2011pw\\nnotify:         webmaster@anm.ro\\nmnt-by:         ANM-RO-MNT\\ncreated:        2009-07-17T21:58:05Z\\nlast-modified:  2009-07-31T09:47:01Z\\nsource:         RIPE"}, {"id": "GRN1-RIPE-MNT", "name": "GRN Serveis Telematics, S.L.\\nAdministracio del Sistema", "admin_id": "GN613-RIPE", "tech_id": "GN613-RIPE", "org_id": "ORG-GSTS1-RIPE", "created": "1970-01-01", "updated": "2017-01-13", "source": "ripe", "raw": "mntner:         GRN1-RIPE-MNT\\ndescr:          GRN Serveis Telematics, S.L.\\ndescr:          Administracio del Sistema\\norg:            ORG-GSTS1-RIPE\\nadmin-c:        GN613-RIPE\\ntech-c:         GN613-RIPE\\nupd-to:         admin@grn.es\\nmnt-nfy:        admin@grn.es\\nauth:           PGPKEY-53E0CF37\\nauth:           X509-3196\\nauth:           SSO\\nauth:           SSO\\nauth:           SSO\\nnotify:         admin@grn.es\\nmnt-by:         GRN1-RIPE-MNT\\ncreated:        1970-01-01T00:00:00Z\\nlast-modified:  2017-01-13T09:11:42Z\\nsource:         RIPE"}, {"id": "ABILENE-MNT", "name": "Abilene S.r.l.\\nVia della Croce Rossa, 62\\n35129 Padova", "admin_id": "CM1574-RIPE", "tech_id": "CM1574-RIPE", "org_id": "ORG-ANSS1-RIPE", "created": "2004-06-15", "updated": "2018-08-29", "source": "ripe", "raw": "mntner:         ABILENE-MNT\\ndescr:          Abilene S.r.l.\\ndescr:          Via della Croce Rossa, 62\\ndescr:          35129 Padova\\norg:            ORG-ANSS1-RIPE\\nadmin-c:        CM1574-RIPE\\ntech-c:         CM1574-RIPE\\nupd-to:         abilene@abilene.it\\nmnt-nfy:        abilene@abilene.it\\nauth:           SSO\\nauth:           SSO\\nauth:           SSO\\nauth:           MD5-PW\\nmnt-by:         ABILENE-MNT\\ncreated:        2004-06-15T14:34:04Z\\nlast-modified:  2018-08-29T09:41:08Z\\nsource:         RIPE"}, {"id": "GN76112-MNT", "name": "Maintainer for Global-Connexion", "admin_id": "GN3603-RIPE", "tech_id": "GN3603-RIPE", "org_id": "ORG-GA376-RIPE", "created": "2013-06-20", "updated": "2017-11-13", "source": "ripe", "raw": "mntner:         GN76112-MNT\\ndescr:          Maintainer for Global-Connexion\\nadmin-c:        GN3603-RIPE\\nupd-to:         noc@global-connexion.com\\nauth:           MD5-PW\\nmnt-by:         GN76112-MNT\\nnotify:         noc@global-connexion.com\\nremarks:        Accepted the RIPE Database Terms and Conditions\\ncreated:        2013-06-20T20:21:24Z\\nlast-modified:  2017-11-13T15:54:13Z\\nsource:         RIPE\\norg:            ORG-GA376-RIPE\\ntech-c:         GN3603-RIPE\\nmnt-nfy:        noc@global-connexion.com"}, {"id": "OPENINTEGRA-MNT", "name": "OpenIntegra PLC - mntner object", "admin_id": "VK1265-RIPE\\nSDM138-RIPE", "tech_id": "VK1265-RIPE\\nSDM138-RIPE", "org_id": "ORG-OP7-RIPE", "created": "2006-09-04", "updated": "2019-02-19", "source": "ripe", "raw": "mntner:         OPENINTEGRA-MNT\\ndescr:          OpenIntegra PLC - mntner object\\norg:            ORG-OP7-RIPE\\nauth:           PGPKEY-16F00E02\\nauth:           PGPKEY-2670057E\\nauth:           PGPKEY-DDAC23A1\\nadmin-c:        VK1265-RIPE\\nadmin-c:        SDM138-RIPE\\ntech-c:         VK1265-RIPE\\ntech-c:         SDM138-RIPE\\nremarks:        MD5 passwords older than November 2011 were removed from this maintainer, see: https://www.ripe.net/removed2011pw\\nnotify:         register@openintegra.com\\nupd-to:         register@openintegra.com\\nmnt-by:         OPENINTEGRA-MNT\\ncreated:        2006-09-04T17:56:42Z\\nlast-modified:  2019-02-19T04:28:12Z\\nsource:         RIPE"}, {"id": "ROMKATEL-MNT", "name": "ROMKATEL SRL\\nstr. Dristor nr. 5\\nBucuresti sector 3\\nRomania RO", "admin_id": "AM17241-RIPE", "tech_id": "AM17241-RIPE", "org_id": "ORG-RS42-RIPE", "created": "2010-11-03", "updated": "2017-08-03", "source": "ripe", "raw": "mntner:         ROMKATEL-MNT\\ndescr:          ROMKATEL SRL\\ndescr:          str. Dristor nr. 5\\ndescr:          Bucuresti sector 3\\ndescr:          Romania RO\\nadmin-c:        AM17241-RIPE\\ntech-c:         AM17241-RIPE\\norg:            ORG-RS42-RIPE\\nupd-to:         artur.mueller@romkatel.com\\nmnt-nfy:        artur.mueller@romkatel.com\\nmnt-nfy:        intressrv@netprotect.ro\\nauth:           SSO\\nnotify:         artur.mueller@romkatel.com\\nmnt-by:         ROMKATEL-MNT\\ncreated:        2010-11-03T09:57:37Z\\nlast-modified:  2017-08-03T13:27:07Z\\nsource:         RIPE"}, {"id": "MECHANIKUS-MNT", "name": "MECHANIKUS CONCEPT SERVICE SRL\\nIntr. Maior Al. Campeanu nr. 3A Ap. 1\\nBucuresti Sector 1 Romania RO", "admin_id": "BD3531-RIPE", "tech_id": "BD3531-RIPE", "org_id": "ORG-MCSS1-RIPE", "created": "2013-09-30", "updated": "2013-09-30", "source": "ripe", "raw": "mntner:         MECHANIKUS-MNT\\ndescr:          MECHANIKUS CONCEPT SERVICE SRL\\ndescr:          Intr. Maior Al. Campeanu nr. 3A Ap. 1\\ndescr:          Bucuresti Sector 1 Romania RO\\nadmin-c:        BD3531-RIPE\\ntech-c:         BD3531-RIPE\\norg:            ORG-MCSS1-RIPE\\nupd-to:         bogdan@mechanikus.ro\\nmnt-nfy:        bogdan@mechanikus.ro\\nauth:           MD5-PW\\nauth:           PGPKEY-7FD0A168\\nnotify:         bogdan@mechanikus.ro\\nmnt-by:         MECHANIKUS-MNT\\ncreated:        2013-09-30T09:41:47Z\\nlast-modified:  2013-09-30T09:41:47Z\\nsource:         RIPE"}, {"id": "TATARINOVA-MNT", "name": "PE Tatarinova", "admin_id": "TAI18-RIPE", "tech_id": "TAI18-RIPE", "org_id": "ORG-PTAI1-RIPE", "created": "2007-12-07", "updated": "2018-11-16", "source": "ripe", "raw": "mntner:         TATARINOVA-MNT\\ndescr:          PE Tatarinova\\norg:            ORG-PTAI1-RIPE\\nadmin-c:        TAI18-RIPE\\ntech-c:         TAI18-RIPE\\nupd-to:         tatarinovd@gmail.com\\nauth:           MD5-PW\\nauth:           SSO\\nnotify:         tatarinovd@gmail.com\\nmnt-by:         TATARINOVA-MNT\\ncreated:        2007-12-07T11:38:47Z\\nlast-modified:  2018-11-16T10:22:48Z\\nsource:         RIPE"}, {"id": "RO-TVSAT-MNT", "name": "TV SAT 2002 SRL\\nStr. Costieni bl.8 ap.42\\nRamnicu Sarat Buzau\\nRomania RO", "admin_id": "AN2408-RIPE", "tech_id": "IIL7-RIPE\\nTSS67-RIPE", "org_id": "ORG-STS29-RIPE", "created": "2006-08-31", "updated": "2017-11-13", "source": "ripe", "raw": "mntner:         RO-TVSAT-MNT\\ndescr:          TV SAT 2002 SRL\\ndescr:          Str. Costieni bl.8 ap.42\\ndescr:          Ramnicu Sarat Buzau\\ndescr:          Romania RO\\nadmin-c:        AN2408-RIPE\\nauth:           SSO\\ntech-c:         IIL7-RIPE\\ntech-c:         TSS67-RIPE\\norg:            ORG-STS29-RIPE\\nupd-to:         office@tvsatrm.ro\\nmnt-nfy:        office@tvsatrm.ro\\nnotify:         office@tvsatrm.ro\\nmnt-by:         RO-TVSAT-MNT\\ncreated:        2006-08-31T04:53:52Z\\nlast-modified:  2017-11-13T15:52:40Z\\nsource:         RIPE"}, {"id": "STAGE-MNT", "name": "STAGE EXPERT SRL\\nSoseaua Oltenitei nr 251\\nBucuresti Sector 4 040592\\nRomania RO", "admin_id": "SB8626-RIPE", "tech_id": "SB8626-RIPE", "org_id": "ORG-SES17-RIPE", "created": "2008-09-22", "updated": "2009-06-25", "source": "ripe", "raw": "mntner:         STAGE-MNT\\ndescr:          STAGE EXPERT SRL\\ndescr:          Soseaua Oltenitei nr 251\\ndescr:          Bucuresti Sector 4 040592\\ndescr:          Romania RO\\nadmin-c:        SB8626-RIPE\\ntech-c:         SB8626-RIPE\\norg:            ORG-SES17-RIPE\\nupd-to:         stefanel.balan@stage-expert.ro\\nmnt-nfy:        stefanel.balan@stage-expert.ro\\nauth:           PGPKEY-7FD0A168\\nremarks:        MD5 passwords older than November 2011 were removed from this maintainer, see: https://www.ripe.net/removed2011pw\\nnotify:         stefanel.balan@stage-expert.ro\\nmnt-by:         STAGE-MNT\\ncreated:        2008-09-22T13:29:51Z\\nlast-modified:  2009-06-25T08:26:45Z\\nsource:         RIPE"}, {"id": "ENDAVA-RO-MNT", "name": "ENDAVA ROMANIA SRL\\nSTR ALEXANDRU VAIDA VOEVOD NR 51\\nCLUJ-NAPOCA CLUJ 400436\\nROMANIA RO", "admin_id": "MAT314-RIPE", "tech_id": "MAT314-RIPE", "org_id": "ORG-ERS11-RIPE", "created": "2019-05-20", "updated": "2019-05-20", "source": "ripe", "raw": "mntner:         ENDAVA-RO-MNT\\ndescr:          ENDAVA ROMANIA SRL\\ndescr:          STR ALEXANDRU VAIDA VOEVOD NR 51\\ndescr:          CLUJ-NAPOCA CLUJ 400436\\ndescr:          ROMANIA RO\\nadmin-c:        MAT314-RIPE\\ntech-c:         MAT314-RIPE\\norg:            ORG-ERS11-RIPE\\nupd-to:         ITSuppliers@endava.com\\nmnt-nfy:        ITSuppliers@endava.com\\nauth:           PGPKEY-7FD0A168\\nauth:           MD5-PW\\nnotify:         ITSuppliers@endava.com\\nmnt-by:         ENDAVA-RO-MNT\\ncreated:        2019-05-20T06:45:37Z\\nlast-modified:  2019-05-20T06:45:37Z\\nsource:         RIPE"}, {"id": "OLTCHIM-MNT", "name": "OLTCHIM SA\\nUzinei, Nr. 1,\\nRm Valcea Valcea\\nRomania RO", "admin_id": "CB11998-RIPE", "tech_id": "CB11998-RIPE", "org_id": "ORG-OS99-RIPE", "created": "2012-12-03", "updated": "2012-12-03", "source": "ripe", "raw": "mntner:         OLTCHIM-MNT\\ndescr:          OLTCHIM SA\\ndescr:          Uzinei, Nr. 1,\\ndescr:          Rm Valcea Valcea\\ndescr:          Romania RO\\nadmin-c:        CB11998-RIPE\\ntech-c:         CB11998-RIPE\\norg:            ORG-OS99-RIPE\\nupd-to:         bogdan.cirstina@oltchim.com\\nmnt-nfy:        bogdan.cirstina@oltchim.com\\nauth:           MD5-PW\\nauth:           PGPKEY-7FD0A168\\nnotify:         bogdan.cirstina@oltchim.com\\nmnt-by:         OLTCHIM-MNT\\ncreated:        2012-12-03T10:21:13Z\\nlast-modified:  2012-12-03T10:21:13Z\\nsource:         RIPE"}, {"id": "DE-FCCS-MNT", "name": "Cornelsen inum maintainer", "admin_id": "UT1469-RIPE", "tech_id": "TB6790-RIPE", "org_id": "ORG-FCCS1-RIPE", "created": "2014-03-11", "updated": "2017-12-27", "source": "ripe", "raw": "mntner:         DE-FCCS-MNT\\ndescr:          Cornelsen inum maintainer\\norg:            ORG-FCCS1-RIPE\\nadmin-c:        UT1469-RIPE\\ntech-c:         TB6790-RIPE\\nupd-to:         ip-address_management@t-systems.com\\nauth:           MD5-PW\\nauth:           X509-1635\\nauth:           SSO\\nauth:           SSO\\nnotify:         ip-address_management@t-systems.com\\nmnt-by:         DE-TSBS-MNT\\ncreated:        2014-03-11T07:04:33Z\\nlast-modified:  2017-12-27T09:25:50Z\\nsource:         RIPE"}, {"id": "INTOUCHRU-MNT", "name": "In-touch mntner", "admin_id": "AB34267-RIPE", "tech_id": "AB34267-RIPE", "org_id": "ORG-JSE1-RIPE", "created": "2008-09-18", "updated": "2016-04-20", "source": "ripe", "raw": "mntner:         INTOUCHRU-MNT\\ndescr:          In-touch mntner\\norg:            ORG-JSE1-RIPE\\nadmin-c:        AB34267-RIPE\\ntech-c:         AB34267-RIPE\\nupd-to:         Andrey.Baev@in-touch.ru\\nmnt-nfy:        Andrey.Baev@in-touch.ru\\nauth:           SSO\\nremarks:        MD5 passwords older than November 2011 were removed from this maintainer, see: https://www.ripe.net/removed2011pw\\nnotify:         Andrey.Baev@in-touch.ru\\nmnt-by:         INTOUCHRU-MNT\\ncreated:        2008-09-18T14:26:12Z\\nlast-modified:  2016-04-20T14:00:16Z\\nsource:         RIPE"}, {"id": "PBCONSULTING-MNT", "name": "PB Consulting\\nal. Pilsudskiego 34\\n41-303 Dabrowa Gornicza\\nPoland", "admin_id": "PB6011-RIPE\\nSS6551-RIPE", "tech_id": "TR1456-RIPE\\nSS6553-RIPE", "org_id": "ORG-PC42-RIPE", "created": "2005-11-04", "updated": "2010-11-10", "source": "ripe", "raw": "mntner:         PBCONSULTING-MNT\\ndescr:          PB Consulting\\ndescr:          al. Pilsudskiego 34\\ndescr:          41-303 Dabrowa Gornicza\\ndescr:          Poland\\norg:            ORG-PC42-RIPE\\nadmin-c:        PB6011-RIPE\\nadmin-c:        SS6551-RIPE\\ntech-c:         TR1456-RIPE\\ntech-c:         SS6553-RIPE\\nupd-to:         phaberko@gts.pl\\nupd-to:         piotrbaran71@gmail.com\\nmnt-nfy:        phaberko@gts.pl\\nmnt-nfy:        piotrbaran71@gmail.com\\nremarks:        MD5 passwords older than November 2011 were removed from this maintainer, see: https://www.ripe.net/removed2011pw\\nmnt-by:         IPARTNERS-MNT\\nmnt-by:         PBCONSULTING-MNT\\ncreated:        2005-11-04T11:56:29Z\\nlast-modified:  2010-11-10T13:41:04Z\\nsource:         RIPE"}, {"id": "IPSOS-MNT", "name": "SC Ipsos Interactive Services SRL\\nSplaiul Independentei 319, Sema City Building\\nBucharest\\nRomania RO", "admin_id": "BGDC-RIPE", "tech_id": "TOMT-RIPE", "org_id": "ORG-SINM1-RIPE", "created": "2005-04-05", "updated": "2017-07-25", "source": "ripe", "raw": "mntner:         IPSOS-MNT\\ndescr:          SC Ipsos Interactive Services SRL\\ndescr:          Splaiul Independentei 319, Sema City Building\\ndescr:          Bucharest\\ndescr:          Romania RO\\nadmin-c:        BGDC-RIPE\\ntech-c:         TOMT-RIPE\\norg:            ORG-SINM1-RIPE\\nupd-to:         ovidiu.todirascu@ipsos-interactive.com\\nmnt-nfy:        ovidiu.todirascu@ipsos-interactive.com\\nauth:           SSO\\nremarks:        MD5 passwords older than November 2011 were removed from this maintainer, see: https://www.ripe.net/removed2011pw\\nnotify:         ovidiu.todirascu@ipsos-interactive.com\\nmnt-by:         IPSOS-MNT\\ncreated:        2005-04-05T17:05:23Z\\nlast-modified:  2017-07-25T14:25:05Z\\nsource:         RIPE"}, {"id": "IN-BERLIN-MNT", "name": "Individual Network Berlin e.V.\\nLehrter Str. 53\\nD-10557 Berlin\\nGermany", "admin_id": "IN-RIPE", "tech_id": "IN-RIPE", "org_id": "ORG-INBE3-RIPE", "created": "1970-01-01", "updated": "2017-11-13", "source": "ripe", "raw": "mntner:         IN-BERLIN-MNT\\norg:            ORG-INBE3-RIPE\\ndescr:          Individual Network Berlin e.V.\\ndescr:          Lehrter Str. 53\\ndescr:          D-10557 Berlin\\ndescr:          Germany\\nadmin-c:        IN-RIPE\\ntech-c:         IN-RIPE\\nupd-to:         ripe@in-berlin.de\\nmnt-nfy:        ripe@in-berlin.de\\nauth:           PGPKEY-7555F107\\nauth:           PGPKEY-159ED881\\nauth:           PGPKEY-D8F13DBE\\nauth:           PGPKEY-9B820836\\nauth:           SSO\\nauth:           SSO\\nmnt-by:         IN-BERLIN-MNT\\ncreated:        1970-01-01T00:00:00Z\\nlast-modified:  2017-11-13T15:51:42Z\\nsource:         RIPE"}, {"id": "MNT-NTSERVICE", "name": "Network Technology Service Ltd.", "admin_id": "MS44988-RIPE", "tech_id": "MS44988-RIPE", "org_id": "ORG-NTSL2-RIPE", "created": "2005-10-10", "updated": "2019-09-16", "source": "ripe", "raw": "mntner:         MNT-NTSERVICE\\norg:            ORG-NTSL2-RIPE\\ndescr:          Network Technology Service Ltd.\\nadmin-c:        MS44988-RIPE\\ntech-c:         MS44988-RIPE\\nupd-to:         mr.m.b.shevchenko@gmail.com\\nauth:           SSO\\nmnt-by:         MNT-NTSERVICE\\ncreated:        2005-10-10T15:47:37Z\\nlast-modified:  2019-09-16T10:18:12Z\\nsource:         RIPE"}, {"id": "BSWS-MNT", "name": "BS Web Services GmbH\\nRIPE Database Maintainer", "admin_id": "HB4369-RIPE", "tech_id": "NOC54-RIPE", "org_id": "ORG-BSWS1-RIPE", "created": "2002-04-05", "updated": "2014-04-28", "source": "ripe", "raw": "mntner:         BSWS-MNT\\ndescr:          BS Web Services GmbH\\ndescr:          RIPE Database Maintainer\\nadmin-c:        HB4369-RIPE\\ntech-c:         NOC54-RIPE\\nupd-to:         hostmaster-ripe-bsws-mnt@bsws.de\\nmnt-nfy:        hostmaster-ripe-bsws-mnt@bsws.de\\nauth:           PGPKEY-3A83DF32\\nremarks:        -----------------------------------------------------\\nremarks:        Feel free to contact us for further information\\nremarks:        http://bsws.de/\\nremarks:        -----------------------------------------------------\\nnotify:         hostmaster-ripe-bsws-mnt@bsws.de\\nmnt-by:         BSWS-MNT\\ncreated:        2002-04-05T22:17:26Z\\nlast-modified:  2014-04-28T11:56:31Z\\nsource:         RIPE\\norg:            ORG-BSWS1-RIPE"}, {"id": "SECPRAL-MNT", "name": "Secpral COM SRL\\nCampul Painii nr.26\\nCluj Napoca Cluj 400629\\nRomania RO", "admin_id": "MI2622-RIPE", "tech_id": "MI2622-RIPE", "org_id": "ORG-SCS37-RIPE", "created": "2011-07-25", "updated": "2012-08-25", "source": "ripe", "raw": "mntner:         SECPRAL-MNT\\ndescr:          Secpral COM SRL\\ndescr:          Campul Painii nr.26\\ndescr:          Cluj Napoca Cluj 400629\\ndescr:          Romania RO\\nadmin-c:        MI2622-RIPE\\ntech-c:         MI2622-RIPE\\norg:            ORG-SCS37-RIPE\\nupd-to:         mihai@security.ro\\nmnt-nfy:        mihai@security.ro\\nremarks:        MD5 passwords older than November 2011 were removed from this maintainer, see: https://www.ripe.net/removed2011pw\\nnotify:         mihai@security.ro\\nmnt-by:         SECPRAL-MNT\\ncreated:        2011-07-25T08:42:58Z\\nlast-modified:  2012-08-25T06:46:43Z\\nsource:         RIPE"}, {"id": "TOPHOST-MD", "name": "IT CONCEPT SRL\\nR.Moldova, Chisinau, Paris 18A\\nMD Buiucani 2051", "admin_id": "RI1161-RIPE", "tech_id": "RI1161-RIPE", "org_id": "ORG-ICS14-RIPE", "created": "2012-02-29", "updated": "2012-03-09", "source": "ripe", "raw": "mntner:         TOPHOST-MD\\ndescr:          IT CONCEPT SRL\\ndescr:          R.Moldova, Chisinau, Paris 18A\\ndescr:          MD Buiucani 2051\\nadmin-c:        RI1161-RIPE\\ntech-c:         RI1161-RIPE\\norg:            ORG-ICS14-RIPE\\nupd-to:         support@tophost.md\\nmnt-nfy:        support@tophost.md\\nauth:           MD5-PW\\nauth:           PGPKEY-7FD0A168\\nnotify:         support@tophost.md\\nmnt-by:         TOPHOST-MD\\ncreated:        2012-02-29T06:10:20Z\\nlast-modified:  2012-03-09T07:55:54Z\\nsource:         RIPE"}, {"id": "ELECTROGRUP-MNT", "name": "ELECTROGRUP SA\\nCalea Turzii, Nr. 217\\nCluj Napoca Cluj\\nRomania RO", "admin_id": "VI580-RIPE", "tech_id": "VI580-RIPE", "org_id": "ORG-ES80-RIPE", "created": "2010-01-14", "updated": "2015-03-16", "source": "ripe", "raw": "mntner:         ELECTROGRUP-MNT\\ndescr:          ELECTROGRUP SA\\ndescr:          Calea Turzii, Nr. 217\\ndescr:          Cluj Napoca Cluj\\ndescr:          Romania RO\\nadmin-c:        VI580-RIPE\\ntech-c:         VI580-RIPE\\norg:            ORG-ES80-RIPE\\nupd-to:         botond.nagy@electrogrup.ro\\nmnt-nfy:        botond.nagy@electrogrup.ro\\nauth:           MD5-PW\\nauth:           SSO\\nauth:           PGPKEY-7FD0A168\\nnotify:         victor.inceu@electrogrup.ro\\nmnt-by:         ELECTROGRUP-MNT\\ncreated:        2010-01-14T06:34:53Z\\nlast-modified:  2015-03-16T13:15:56Z\\nsource:         RIPE"}, {"id": "CNETWORK-MNT", "name": "CNETWORK SRL\\nstr Tudor Vladimirescu nr 36\\nCurtici, Arad\\nRO", "admin_id": "CA2456-RIPE", "tech_id": "CA2456-RIPE", "org_id": "ORG-CA952-RIPE", "created": "2008-11-11", "updated": "2018-04-11", "source": "ripe", "raw": "mntner:         CNETWORK-MNT\\ndescr:          CNETWORK SRL\\ndescr:          str Tudor Vladimirescu nr 36\\ndescr:          Curtici, Arad\\ndescr:          RO\\nadmin-c:        CA2456-RIPE\\ntech-c:         CA2456-RIPE\\norg:            ORG-CA952-RIPE\\nupd-to:         alexcsordas@cnetwork.ro\\nmnt-nfy:        alexcsordas@cnetwork.ro\\nauth:           PGPKEY-7FD0A168\\nauth:           SSO\\nremarks:        MD5 passwords older than November 2011 were removed from this maintainer, see: https://www.ripe.net/removed2011pw\\nnotify:         alexcsordas@cnetwork.ro\\nmnt-by:         CNETWORK-MNT\\ncreated:        2008-11-11T10:05:19Z\\nlast-modified:  2018-04-11T10:03:26Z\\nsource:         RIPE"}, {"id": "SC-DIGITAL-PROJECT-SRL-MNT", "name": "SC DIGITAL PROJECT SRL\\n4, Insulei\\nBucharest, Sector 1\\nRO", "admin_id": "MS15190-RIPE", "tech_id": "MS15190-RIPE", "org_id": "ORG-SDPS1-RIPE", "created": "2007-03-05", "updated": "2016-01-19", "source": "ripe", "raw": "mntner:         SC-DIGITAL-PROJECT-SRL-MNT\\ndescr:          SC DIGITAL PROJECT SRL\\ndescr:          4, Insulei\\ndescr:          Bucharest, Sector 1\\ndescr:          RO\\nadmin-c:        MS15190-RIPE\\ntech-c:         MS15190-RIPE\\norg:            ORG-SDPS1-RIPE\\nupd-to:         stefan.maldaianu@dp-net.ro\\nmnt-nfy:        stefan.maldaianu@dp-net.ro\\nauth:           MD5-PW\\nauth:           SSO\\nauth:           PGPKEY-7FD0A168\\nnotify:         stefan.maldaianu@dp-net.ro\\nmnt-by:         SC-DIGITAL-PROJECT-SRL-MNT\\ncreated:        2007-03-05T15:38:13Z\\nlast-modified:  2016-01-19T14:10:39Z\\nsource:         RIPE"}, {"id": "NEXTLAN-MNT", "name": "NEXTLAN SRL\\nProgresului nr. 7\\nTargu-Mures Mures 540481\\nRomania RO", "admin_id": "RVA58-RIPE", "tech_id": "RVA58-RIPE", "org_id": "ORG-NS227-RIPE", "created": "2014-05-29", "updated": "2019-09-07", "source": "ripe", "raw": "mntner:         NEXTLAN-MNT\\ndescr:          NEXTLAN SRL\\ndescr:          Progresului nr. 7\\ndescr:          Targu-Mures Mures 540481\\ndescr:          Romania RO\\nadmin-c:        RVA58-RIPE\\ntech-c:         RVA58-RIPE\\norg:            ORG-NS227-RIPE\\nupd-to:         office@nextlan.ro\\nmnt-nfy:        office@nextlan.ro\\nauth:           MD5-PW\\nauth:           SSO\\nauth:           SSO\\nauth:           SSO\\nauth:           SSO\\nauth:           PGPKEY-7FD0A168\\nnotify:         office@nextlan.ro\\nmnt-by:         NEXTLAN-MNT\\ncreated:        2014-05-29T09:26:41Z\\nlast-modified:  2019-09-07T13:13:03Z\\nsource:         RIPE"}, {"id": "US-GITHUB-1-MNT", "name": "GitHub Maintainer Group", "admin_id": "GA9828-RIPE", "tech_id": "NO1444-RIPE", "org_id": "ORG-GI58-RIPE", "created": "2017-04-11", "updated": "2017-04-18", "source": "ripe", "raw": "mntner:         us-github-1-mnt\\ndescr:          GitHub Maintainer Group\\nadmin-c:        GA9828-RIPE\\ntech-c:         NO1444-RIPE\\nupd-to:         noc@github.com\\nauth:           SSO\\nauth:           SSO\\nauth:           SSO\\nmnt-by:         us-github-1-mnt\\ncreated:        2017-04-11T08:28:46Z\\nlast-modified:  2017-04-18T22:20:18Z\\nsource:         RIPE\\norg:            ORG-GI58-RIPE"}, {"id": "ENSIGHT-MNT", "name": "Ensight Management Consulting SRL\\nstr. Traian 184-186 et 4\\nBucuresti Sector 2\\nRomania RO", "admin_id": "AP14898-RIPE", "tech_id": "AP14898-RIPE", "org_id": "ORG-EMCS1-RIPE", "created": "2011-05-26", "updated": "2011-06-29", "source": "ripe", "raw": "mntner:         ENSIGHT-MNT\\ndescr:          Ensight Management Consulting SRL\\ndescr:          str. Traian 184-186 et 4\\ndescr:          Bucuresti Sector 2\\ndescr:          Romania RO\\nadmin-c:        AP14898-RIPE\\ntech-c:         AP14898-RIPE\\norg:            ORG-EMCS1-RIPE\\nupd-to:         andrei.petroaie@ensight.ro\\nmnt-nfy:        andrei.petroaie@ensight.ro\\nauth:           PGPKEY-7FD0A168\\nremarks:        MD5 passwords older than November 2011 were removed from this maintainer, see: https://www.ripe.net/removed2011pw\\nnotify:         andrei.petroaie@ensight.ro\\nmnt-by:         ENSIGHT-MNT\\ncreated:        2011-05-26T10:50:01Z\\nlast-modified:  2011-06-29T07:55:52Z\\nsource:         RIPE"}, {"id": "PORTRIX-MNT", "name": "portrix Systems GmbH", "admin_id": "PTX-RIPE", "tech_id": "PTX-RIPE", "org_id": "ORG-pSG6-RIPE", "created": "2009-06-05", "updated": "2019-07-22", "source": "ripe", "raw": "mntner:         PORTRIX-MNT\\ndescr:          portrix Systems GmbH\\norg:            ORG-pSG6-RIPE\\nadmin-c:        PTX-RIPE\\ntech-c:         PTX-RIPE\\nupd-to:         f.bauhaus@portrix-systems.de\\nmnt-nfy:        f.bauhaus@portrix-systems.de\\nauth:           PGPKEY-34795B3E\\nauth:           PGPKEY-98C7E6DF\\nauth:           SSO\\nauth:           SSO\\nnotify:         f.bauhaus@portrix-systems.de\\nmnt-by:         PORTRIX-MNT\\ncreated:        2009-06-05T15:00:25Z\\nlast-modified:  2019-07-22T09:55:14Z\\nsource:         RIPE"}, {"id": "RO-SNT-MNT", "name": "S&T Romania SRL\\nBlvd. Nicolae Titulescu, nr 4-8\\nAmerica House - tronson est, etaj 7\\nBucuresti Bucuresti 011141\\nRomania RO", "admin_id": "BN1050-RIPE", "tech_id": "IC1429-RIPE", "org_id": "ORG-SR19-RIPE", "created": "2008-09-15", "updated": "2008-09-17", "source": "ripe", "raw": "mntner:         RO-SNT-MNT\\ndescr:          S&T Romania SRL\\ndescr:          Blvd. Nicolae Titulescu, nr 4-8\\ndescr:          America House - tronson est, etaj 7\\ndescr:          Bucuresti Bucuresti 011141\\ndescr:          Romania RO\\nadmin-c:        BN1050-RIPE\\ntech-c:         IC1429-RIPE\\norg:            ORG-SR19-RIPE\\nupd-to:         ionut.craciunescu@snt.ro\\nmnt-nfy:        ionut.craciunescu@snt.ro\\nauth:           PGPKEY-7FD0A168\\nremarks:        MD5 passwords older than November 2011 were removed from this maintainer, see: https://www.ripe.net/removed2011pw\\nnotify:         ionut.craciunescu@snt.ro\\nmnt-by:         RO-SNT-MNT\\ncreated:        2008-09-15T11:43:45Z\\nlast-modified:  2008-09-17T16:04:02Z\\nsource:         RIPE"}, {"id": "POINT-UA-MNT", "name": "ISP Point Ltd\\nBerdyansk\\nUA", "admin_id": "AL8662-RIPE", "tech_id": "AL8662-RIPE\\nNT2912-RIPE", "org_id": "ORG-PL7-RIPE", "created": "2004-06-02", "updated": "2018-11-29", "source": "ripe", "raw": "mntner:         POINT-UA-MNT\\ndescr:          ISP Point Ltd\\ndescr:          Berdyansk\\ndescr:          UA\\norg:            ORG-PL7-RIPE\\nadmin-c:        AL8662-RIPE\\ntech-c:         AL8662-RIPE\\ntech-c:         NT2912-RIPE\\nupd-to:         admin@berdyansk.net\\nmnt-nfy:        admin@berdyansk.net\\nauth:           SSO\\nauth:           SSO\\nmnt-by:         POINT-UA-MNT\\ncreated:        2004-06-02T10:09:06Z\\nlast-modified:  2018-11-29T10:48:59Z\\nsource:         RIPE"}, {"id": "SYNCO-MNT", "name": "Synco Media SRL\\nInt. Barsei 6, Bl. G7, Ap 76\\nBucuresti, Romania", "admin_id": "LO343-RIPE", "tech_id": "LO343-RIPE", "org_id": "ORG-SSMS1-RIPE", "created": "2005-02-14", "updated": "2018-04-14", "source": "ripe", "raw": "mntner:         SYNCO-MNT\\ndescr:          Synco Media SRL\\ndescr:          Int. Barsei 6, Bl. G7, Ap 76\\ndescr:          Bucuresti, Romania\\nadmin-c:        LO343-RIPE\\ntech-c:         LO343-RIPE\\norg:            ORG-SSMS1-RIPE\\nupd-to:         lucian@synco.ro\\nmnt-nfy:        lucian@synco.ro\\nnotify:         lucian@synco.ro\\nnotify:         luca.bogdan@gmail.com\\nauth:           PGPKEY-25B04571\\nauth:           SSO\\nauth:           MD5-PW\\nmnt-by:         SYNCO-MNT\\ncreated:        2005-02-14T23:02:26Z\\nlast-modified:  2018-04-14T14:34:03Z\\nsource:         RIPE"}, {"id": "NTEC", "name": "Maintainer", "admin_id": "AB32862-RIPE", "tech_id": "AB32862-RIPE\\nDK8890-RIPE", "org_id": "ORG-RUET1-RIPE", "created": "2012-11-14", "updated": "2018-10-10", "source": "ripe", "raw": "mntner:         NTEC\\ndescr:          Maintainer\\norg:            ORG-RUET1-RIPE\\nadmin-c:        AB32862-RIPE\\ntech-c:         AB32862-RIPE\\ntech-c:         DK8890-RIPE\\nupd-to:         abond@ncot.by\\nauth:           MD5-PW\\nauth:           SSO\\nauth:           SSO\\nmnt-by:         NTEC\\nnotify:         admin@ncot.by\\nremarks:        Accepted the RIPE Database Terms and Conditions\\ncreated:        2012-11-14T12:31:08Z\\nlast-modified:  2018-10-10T07:09:31Z\\nsource:         RIPE"}, {"id": "VIVATELECOM-MNT", "name": "Viva Telecom SRL\\nStr. Turnul Eiffel, Nr. 15 3\\nBucuresti Sector 2 Romania RO", "admin_id": "IL1351-RIPE", "tech_id": "IL1351-RIPE", "org_id": "ORG-VTS6-RIPE", "created": "2011-07-28", "updated": "2015-11-03", "source": "ripe", "raw": "mntner:         VIVATELECOM-MNT\\ndescr:          Viva Telecom SRL\\ndescr:          Str. Turnul Eiffel, Nr. 15 3\\ndescr:          Bucuresti Sector 2 Romania RO\\nadmin-c:        IL1351-RIPE\\ntech-c:         IL1351-RIPE\\norg:            ORG-VTS6-RIPE\\nupd-to:         noc@vivatelecom.ro\\nmnt-nfy:        noc@vivatelecom.ro\\nauth:           PGPKEY-7FD0A168\\nauth:           SSO\\nremarks:        MD5 passwords older than November 2011 were removed from this maintainer, see: https://www.ripe.net/removed2011pw\\nnotify:         noc@vivatelecom.ro\\nmnt-by:         VIVATELECOM-MNT\\ncreated:        2011-07-28T10:24:38Z\\nlast-modified:  2015-11-03T16:07:35Z\\nsource:         RIPE"}, {"id": "ADB-MNT", "name": "Maintainer", "admin_id": "DS8846-RIPE\\nJD9874-RIPE", "tech_id": "DS8846-RIPE", "org_id": "ORG-APsz4-RIPE", "created": "2011-06-20", "updated": "2017-10-18", "source": "ripe", "raw": "mntner:         ADB-MNT\\ndescr:          Maintainer\\norg:            ORG-APsz4-RIPE\\nadmin-c:        DS8846-RIPE\\nadmin-c:        JD9874-RIPE\\ntech-c:         DS8846-RIPE\\nupd-to:         d.szkudlarski@adbglobal.com\\nauth:           SSO\\nauth:           SSO\\nmnt-by:         ADB-MNT\\nnotify:         d.szkudlarski@adbglobal.com\\nremarks:        Accepted the RIPE Database Terms and Conditions\\ncreated:        2011-06-20T12:42:38Z\\nlast-modified:  2017-10-18T06:45:55Z\\nsource:         RIPE"}, {"id": "BLUEWINNET-MNT", "name": "Maintainer for Swisscom (Switzerland) AG\\nResidential Internet Services", "admin_id": "BCR1-RIPE", "tech_id": "BCR1-RIPE", "org_id": "ORG-BA8-RIPE", "created": "1970-01-01", "updated": "2019-05-07", "source": "ripe", "raw": "mntner:         BLUEWINNET-MNT\\ndescr:          Maintainer for Swisscom (Switzerland) AG\\ndescr:          Residential Internet Services\\nremarks:        ************************************************\\nremarks:        Swisscom (Switzerland) Ltd. / Bluewin is an\\nremarks:        internet service provider and LIR in CH.\\nremarks:        In case of hack attacks, spam, scans etc. please\\nremarks:        send abuse mail notifications to the abuse-mailbox\\nremarks:        E-Mails to the adresses below will be IGNORED!\\nremarks:        ************************************************\\nadmin-c:        BCR1-RIPE\\ntech-c:         BCR1-RIPE\\nupd-to:         Ipmgmt.res@swisscom.com\\nmnt-nfy:        Ipmgmt.res@swisscom.com\\nauth:           SSO\\nauth:           SSO\\nauth:           SSO\\nauth:           SSO\\nauth:           SSO\\nauth:           SSO\\nauth:           SSO\\nauth:           X509-3252\\nauth:           X509-3349\\nauth:           MD5-PW\\nmnt-by:         BLUEWINNET-MNT\\norg:            ORG-BA8-RIPE\\ncreated:        1970-01-01T00:00:00Z\\nlast-modified:  2019-05-07T14:27:59Z\\nsource:         RIPE"}, {"id": "MAPI-MNT", "name": "MAPI Ltd.\\nBolshaya Kosinskaya st. 135A bld.E\\nRussian Federation, Moscow RU 111622", "admin_id": "AN279-RIPE", "tech_id": "AN279-RIPE", "org_id": "ORG-ML125-RIPE", "created": "2009-07-17", "updated": "2009-07-17", "source": "ripe", "raw": "mntner:         MAPI-MNT\\ndescr:          MAPI Ltd.\\ndescr:          Bolshaya Kosinskaya st. 135A bld.E\\ndescr:          Russian Federation, Moscow RU 111622\\nadmin-c:        AN279-RIPE\\ntech-c:         AN279-RIPE\\norg:            ORG-ML125-RIPE\\nupd-to:         admin@mappi.ru\\nmnt-nfy:        admin@mappi.ru\\nauth:           PGPKEY-7FD0A168\\nremarks:        MD5 passwords older than November 2011 were removed from this maintainer, see: https://www.ripe.net/removed2011pw\\nnotify:         admin@mappi.ru\\nmnt-by:         MAPI-MNT\\ncreated:        2009-07-17T22:59:15Z\\nlast-modified:  2009-07-17T23:18:39Z\\nsource:         RIPE"}, {"id": "RO-UBISOFT-MNT", "name": "SC UBISOFT SRL\\nBd. Expozitei nr.2 et. 4\\nBucuresti Sector 1 012103\\nRomania RO", "admin_id": "MM21199-RIPE", "tech_id": "MM21199-RIPE", "org_id": "ORG-SUS7-RIPE", "created": "2009-04-05", "updated": "2017-05-15", "source": "ripe", "raw": "mntner:         RO-UBISOFT-MNT\\ndescr:          SC UBISOFT SRL\\ndescr:          Bd. Expozitei nr.2 et. 4\\ndescr:          Bucuresti Sector 1 012103\\ndescr:          Romania RO\\nadmin-c:        MM21199-RIPE\\ntech-c:         MM21199-RIPE\\norg:            ORG-SUS7-RIPE\\nupd-to:         mihai.mreana@ubisoft.com\\nmnt-nfy:        mihai.mreana@ubisoft.com\\nauth:           MD5-PW\\nauth:           SSO\\nnotify:         mihai.mreana@ubisoft.com\\nmnt-by:         RO-UBISOFT-MNT\\ncreated:        2009-04-05T22:37:55Z\\nlast-modified:  2017-05-15T11:57:55Z\\nsource:         RIPE"}, {"id": "AISBERG-MNT", "name": "Aisberg LLC", "admin_id": "SPG19-RIPE", "tech_id": "SAS145-RIPE", "org_id": "ORG-AL69-RIPE", "created": "2007-04-10", "updated": "2008-07-31", "source": "ripe", "raw": "mntner:         AISBERG-MNT\\ndescr:          Aisberg LLC\\norg:            ORG-AL69-RIPE\\nadmin-c:        SPG19-RIPE\\ntech-c:         SAS145-RIPE\\nupd-to:         aisberg.llc@gmail.com\\nmnt-nfy:        aisberg.llc@gmail.com\\nremarks:        MD5 passwords older than November 2011 were removed from this maintainer, see: https://www.ripe.net/removed2011pw\\nnotify:         aisberg.llc@gmail.com\\nmnt-by:         AISBERG-MNT\\ncreated:        2007-04-10T15:53:58Z\\nlast-modified:  2008-07-31T13:46:48Z\\nsource:         RIPE"}, {"id": "PREMIUM-IT-MNT", "name": "Premium IT Technologies SRL\\nGrigore Alexandrescu, nr. 36\\nBucuresti Sector 1 010626\\nRomania RO", "admin_id": "AP22407", "tech_id": "AP22407", "org_id": "ORG-PITS1-RIPE", "created": "2014-05-29", "updated": "2014-06-16", "source": "ripe", "raw": "mntner:         PREMIUM-IT-MNT\\ndescr:          Premium IT Technologies SRL\\ndescr:          Grigore Alexandrescu, nr. 36\\ndescr:          Bucuresti Sector 1 010626\\ndescr:          Romania RO\\nadmin-c:        AP22407\\ntech-c:         AP22407\\norg:            ORG-PITS1-RIPE\\nupd-to:         alinp@premiumitt.com\\nmnt-nfy:        alinp@premiumitt.com\\nauth:           MD5-PW\\nauth:           PGPKEY-7FD0A168\\nnotify:         alinp@premiumitt.com\\nmnt-by:         PREMIUM-IT-MNT\\ncreated:        2014-05-29T11:04:58Z\\nlast-modified:  2014-06-16T09:14:59Z\\nsource:         RIPE"}, {"id": "MNT-COMPAS", "name": "General Parnership \"Compas - Karadjov & Co.\"", "admin_id": "ID820-RIPE", "tech_id": "ID820-RIPE", "org_id": "ORG-GPCK1-RIPE", "created": "2007-04-02", "updated": "2018-02-11", "source": "ripe", "raw": "mntner:         MNT-COMPAS\\ndescr:          General Parnership \"Compas - Karadjov & Co.\"\\norg:            ORG-GPCK1-RIPE\\nadmin-c:        ID820-RIPE\\ntech-c:         ID820-RIPE\\nupd-to:         orfey@compasbg.com\\nmnt-nfy:        orfey@compasbg.com\\nauth:           SSO\\nremarks:        MD5 passwords older than November 2011 were removed from this maintainer, see: https://www.ripe.net/removed2011pw\\nnotify:         orfey@compasbg.com\\nmnt-by:         MNT-COMPAS\\nmnt-by:         NETGUARDBG-MNT\\ncreated:        2007-04-02T08:19:57Z\\nlast-modified:  2018-02-11T16:38:34Z\\nsource:         RIPE"}, {"id": "FIBRELAC-MNT", "name": "Maintainer for objects of Fibre Lac SA", "admin_id": "FLAC-RIPE\\nEUNX1-RIPE", "tech_id": "EUNX1-RIPE", "org_id": "ORG-FLS1-RIPE", "created": "2004-05-13", "updated": "2018-12-10", "source": "ripe", "raw": "mntner:         FIBRELAC-MNT\\ndescr:          Maintainer for objects of Fibre Lac SA\\norg:            ORG-FLS1-RIPE\\nadmin-c:        FLAC-RIPE\\nadmin-c:        EUNX1-RIPE\\ntech-c:         EUNX1-RIPE\\nupd-to:         hostmaster@eunetworks.com\\nauth:           PGPKEY-DFB47005\\nauth:           SSO\\nauth:           SSO\\nmnt-by:         LNC-MNT\\nmnt-by:         EUNX-MNT\\ncreated:        2004-05-13T10:42:13Z\\nlast-modified:  2018-12-10T12:13:47Z\\nsource:         RIPE"}, {"id": "MNTR-RH9919-RIPE", "name": "193.0.20.0/24", "admin_id": "RH9919-RIPE", "tech_id": "RTT10-RIPE", "org_id": "ORG-RTT7-RIPE", "created": "2019-03-15", "updated": "2019-03-17", "source": "ripe", "raw": "mntner:         mntr-rh9919-ripe\\ndescr:          193.0.20.0/24\\nadmin-c:        RH9919-RIPE\\ntech-c:         RTT10-RIPE\\nupd-to:         roufique@rtat.net\\norg:            ORG-RTT7-RIPE\\nauth:           MD5-PW\\nauth:           SSO\\nmnt-by:         mntr-rh9919-ripe\\ncreated:        2019-03-15T21:48:50Z\\nlast-modified:  2019-03-17T08:26:09Z\\nsource:         RIPE"}, {"id": "MNT-EURODATA", "name": "eurodata AG IP registry", "admin_id": "JK647-RIPE", "tech_id": "JK647-RIPE\\nAK4443-RIPE", "org_id": "ORG-ARSG1-RIPE", "created": "2014-03-17", "updated": "2019-02-19", "source": "ripe", "raw": "mntner:         MNT-EURODATA\\ndescr:          eurodata AG IP registry\\norg:            ORG-ARSG1-RIPE\\nadmin-c:        JK647-RIPE\\ntech-c:         JK647-RIPE\\ntech-c:         AK4443-RIPE\\nupd-to:         lir-eurodata-ag@eurodata.de\\nmnt-nfy:        lir-eurodata-ag@eurodata.de\\nauth:           MD5-PW\\nauth:           X509-1100\\nauth:           X509-1105\\nauth:           SSO\\nauth:           SSO\\nmnt-by:         MNT-EURODATA\\ncreated:        2014-03-17T10:15:21Z\\nlast-modified:  2019-02-19T10:59:25Z\\nsource:         RIPE"}, {"id": "DIDAS-NET", "name": "DIDAS Business Services GmbH", "admin_id": "HG95246-RIPE", "tech_id": "MS26815-RIPE", "org_id": "ORG-DBSG1-RIPE", "created": "2012-02-01", "updated": "2018-10-19", "source": "ripe", "raw": "mntner:         didas-net\\ndescr:          DIDAS Business Services GmbH\\norg:            ORG-DBSG1-RIPE\\nadmin-c:        HG95246-RIPE\\ntech-c:         MS26815-RIPE\\nupd-to:         michael.schwartz@cancom.de\\nauth:           MD5-PW\\nauth:           SSO\\nmnt-by:         didas-net\\nnotify:         michael.schwartz@cancom.de\\ncreated:        2012-02-01T17:31:33Z\\nlast-modified:  2018-10-19T11:54:41Z\\nsource:         RIPE"}, {"id": "BDE-MNT-JMAX", "name": "Maintainer for Banco de Espana", "admin_id": "EPM10-RIPE\\nJEMA2-RIPE\\nJFSP-RIPE", "tech_id": "JEMA2-RIPE\\nEPM10-RIPE\\nJFSP-RIPE", "org_id": "ORG-BDE1-RIPE", "created": "2007-03-23", "updated": "2017-01-20", "source": "ripe", "raw": "mntner:         BDE-MNT-JMAX\\ndescr:          Maintainer for Banco de Espana\\norg:            ORG-BDE1-RIPE\\nadmin-c:        EPM10-RIPE\\nadmin-c:        JEMA2-RIPE\\nadmin-c:        JFSP-RIPE\\ntech-c:         JEMA2-RIPE\\ntech-c:         EPM10-RIPE\\ntech-c:         JFSP-RIPE\\nupd-to:         71123@empresas-externas.bde.es\\nupd-to:         javier.fernandez-sanguino@bde.es\\nupd-to:         enrique.pernas@bde.es\\nauth:           X509-1382\\nauth:           SSO\\nremarks:        MD5 passwords older than November 2011 were removed from this maintainer, see: https://www.ripe.net/removed2011pw\\nmnt-by:         BDE-MNT-JMAX\\ncreated:        2007-03-23T10:00:19Z\\nlast-modified:  2017-01-20T12:50:15Z\\nsource:         RIPE"}, {"id": "BRD-MNT", "name": "BRD-Groupe Societe Generale\\nBucharest, Splaiul Independentei nr. 15\\nbl. 100, sector 5, 050092, Romania\\nRO", "admin_id": "DCM13-RIPE", "tech_id": "DCM13-RIPE", "org_id": "ORG-BSG4-RIPE", "created": "2007-04-16", "updated": "2012-01-24", "source": "ripe", "raw": "mntner:         BRD-MNT\\ndescr:          BRD-Groupe Societe Generale\\ndescr:          Bucharest, Splaiul Independentei nr. 15\\ndescr:          bl. 100, sector 5, 050092, Romania\\ndescr:          RO\\nadmin-c:        DCM13-RIPE\\ntech-c:         DCM13-RIPE\\norg:            ORG-BSG4-RIPE\\nupd-to:         dan.munteanu@brd.ro\\nmnt-nfy:        dan.munteanu@brd.ro\\nnotify:         dan.munteanu@brd.ro\\nmnt-by:         BRD-MNT\\ncreated:        2007-04-16T14:02:34Z\\nlast-modified:  2012-01-24T12:29:45Z\\nsource:         RIPE\\nauth:           MD5-PW"}, {"id": "VULTR-GLOBAL", "name": "Global ISP Deployment", "admin_id": "VHL6-RIPE", "tech_id": "VHL6-RIPE", "org_id": "ORG-VHL4-RIPE", "created": "2016-06-01", "updated": "2016-06-01", "source": "ripe", "raw": "mntner:         VULTR-GLOBAL\\ndescr:          Global ISP Deployment\\norg:            ORG-VHL4-RIPE\\nadmin-c:        VHL6-RIPE\\ntech-c:         VHL6-RIPE\\nupd-to:         mail@onlineserviceproviderbv.nl\\nauth:           SSO\\nauth:           MD5-PW\\nmnt-by:         VULTR-GLOBAL\\ncreated:        2016-06-01T09:05:45Z\\nlast-modified:  2016-06-01T09:26:58Z\\nsource:         RIPE"}, {"id": "UPC-MNT", "name": "UPC Romania SA\\nTimisoara, Piata Consiliul Europei 1,\\n300627, Romania RO", "admin_id": "MA190-RIPE", "tech_id": "MA190-RIPE", "org_id": "ORG-URS1-RIPE", "created": "2005-02-14", "updated": "2005-02-14", "source": "ripe", "raw": "mntner:         UPC-MNT\\ndescr:          UPC Romania SA\\ndescr:          Timisoara, Piata Consiliul Europei 1,\\ndescr:          300627, Romania RO\\nadmin-c:        MA190-RIPE\\ntech-c:         MA190-RIPE\\norg:            ORG-URS1-RIPE\\nupd-to:         alexandru.mangu@upctm.ro\\nmnt-nfy:        alexandru.mangu@upctm.ro\\nremarks:        MD5 passwords older than November 2011 were removed from this maintainer, see: https://www.ripe.net/removed2011pw\\nnotify:         alexandru.mangu@upctm.ro\\nmnt-by:         UPC-MNT\\ncreated:        2005-02-14T23:32:33Z\\nlast-modified:  2005-02-14T23:37:59Z\\nsource:         RIPE"}, {"id": "LYKOS-MNT", "name": "Inform Lykos SA\\nSos. Odai, Nr. 347 - 363,\\nSector 1, Bucuresti Romania", "admin_id": "GB4739-RIPE", "tech_id": "GB4739-RIPE", "org_id": "ORG-SILS1-RIPE", "created": "2006-01-01", "updated": "2018-01-15", "source": "ripe", "raw": "mntner:         LYKOS-MNT\\ndescr:          Inform Lykos SA\\ndescr:          Sos. Odai, Nr. 347 - 363,\\ndescr:          Sector 1, Bucuresti Romania\\nadmin-c:        GB4739-RIPE\\ntech-c:         GB4739-RIPE\\norg:            ORG-SILS1-RIPE\\nupd-to:         g.branzea@lykos.ro\\nmnt-nfy:        g.branzea@lykos.ro\\nauth:           PGPKEY-7FD0A168\\nauth:           SSO\\nauth:           MD5-PW\\nnotify:         g.branzea@lykos.ro\\nmnt-by:         LYKOS-MNT\\ncreated:        2006-01-01T09:39:05Z\\nlast-modified:  2018-01-15T15:15:06Z\\nsource:         RIPE"}, {"id": "SECURED-MNT", "name": "I.M. LEVEL7 SRL\\nstr. Armeneasca 35\\nMD-2012 Chisinau Republica Moldova\\nChisinau Centru Moldova\\nMoldova MD", "admin_id": "IN894-RIPE\\nMM19346-RIPE", "tech_id": "EV2243-RIPE", "org_id": "ORG-FVS1-RIPE", "created": "2010-11-03", "updated": "2016-06-17", "source": "ripe", "raw": "mntner:         SECURED-MNT\\ndescr:          I.M. LEVEL7 SRL\\ndescr:          str. Armeneasca 35\\ndescr:          MD-2012 Chisinau Republica Moldova\\ndescr:          Chisinau Centru Moldova\\ndescr:          Moldova MD\\nadmin-c:        IN894-RIPE\\nadmin-c:        MM19346-RIPE\\ntech-c:         EV2243-RIPE\\norg:            ORG-FVS1-RIPE\\nupd-to:         noc@secured.md\\nmnt-nfy:        noc@secured.md\\nauth:           MD5-PW\\nauth:           SSO\\nauth:           SSO\\nnotify:         noc@secured.md\\nmnt-by:         SECURED-MNT\\ncreated:        2010-11-03T08:38:47Z\\nlast-modified:  2016-06-17T11:32:44Z\\nsource:         RIPE"}, {"id": "INTERRA-MNT", "name": "\"Interra\" TG, Ltd. Maintainer", "admin_id": "VL2008-RIPE", "tech_id": "AS31797-RIPE", "org_id": "ORG-LA171-RIPE", "created": "2008-07-26", "updated": "2016-05-31", "source": "ripe", "raw": "mntner:         INTERRA-MNT\\ndescr:          \"Interra\" TG, Ltd. Maintainer\\norg:            ORG-LA171-RIPE\\nadmin-c:        VL2008-RIPE\\ntech-c:         AS31797-RIPE\\nupd-to:         boss@interra.ru\\nauth:           PGPKEY-C396EEA0\\nauth:           SSO\\nauth:           SSO\\nremarks:        MD5 passwords older than November 2011 were removed from this maintainer, see: https://www.ripe.net/removed2011pw\\nmnt-by:         INTERRA-MNT\\ncreated:        2008-07-26T07:09:54Z\\nlast-modified:  2016-05-31T04:57:26Z\\nsource:         RIPE"}, {"id": "HDT-MNT", "name": "SC OMNITECH SRL\\nOltului 47 Galati\\nRomania RO", "admin_id": "LS4067-RIPE", "tech_id": "LS4067-RIPE", "org_id": "ORG-SOS1-RIPE", "created": "2006-07-03", "updated": "2006-07-03", "source": "ripe", "raw": "mntner:         HDT-MNT\\ndescr:          SC OMNITECH SRL\\ndescr:          Oltului 47 Galati\\ndescr:          Romania RO\\nadmin-c:        LS4067-RIPE\\ntech-c:         LS4067-RIPE\\norg:            ORG-SOS1-RIPE\\nupd-to:         liviu.strati@hdt.ro\\nmnt-nfy:        liviu.strati@hdt.ro\\nauth:           PGPKEY-7FD0A168\\nremarks:        MD5 passwords older than November 2011 were removed from this maintainer, see: https://www.ripe.net/removed2011pw\\nnotify:         liviu.strati@hdt.ro\\nmnt-by:         HDT-MNT\\ncreated:        2006-07-03T01:55:14Z\\nlast-modified:  2006-07-03T01:55:14Z\\nsource:         RIPE"}, {"id": "BVB-MNT", "name": "Bursa de Valori Bucuresti (BVB)\\nB-dul. Carol I, nr. 34-36, Sector 2, Bucuresti\\nRO", "admin_id": "NS1111-RIPE", "tech_id": "NS1111-RIPE", "org_id": "ORG-BdVB1-RIPE", "created": "2004-08-04", "updated": "2006-03-23", "source": "ripe", "raw": "mntner:         BVB-MNT\\ndescr:          Bursa de Valori Bucuresti (BVB)\\ndescr:          B-dul. Carol I, nr. 34-36, Sector 2, Bucuresti\\ndescr:          RO\\nadmin-c:        NS1111-RIPE\\ntech-c:         NS1111-RIPE\\norg:            ORG-BdVB1-RIPE\\nupd-to:         stefan.nanescu@bvb.ro\\nmnt-nfy:        stefan.nanescu@bvb.ro\\nauth:           PGPKEY-7FD0A168\\nremarks:        MD5 passwords older than November 2011 were removed from this maintainer, see: https://www.ripe.net/removed2011pw\\nnotify:         stefan.nanescu@bvb.ro\\nmnt-by:         BVB-MNT\\ncreated:        2004-08-04T09:10:42Z\\nlast-modified:  2006-03-23T14:40:09Z\\nsource:         RIPE"}, {"id": "SERVIER-MNT", "name": "SERVIER PHARMA SRL\\nTipografilor nr. 11-15 Corp A1-A2, Et. 3\\nBucuresti Sector 1 Romania", "admin_id": "CM15951-RIPE", "tech_id": "CM15951-RIPE", "org_id": "ORG-SPS32-RIPE", "created": "2015-10-23", "updated": "2015-10-23", "source": "ripe", "raw": "mntner:         SERVIER-MNT\\ndescr:          SERVIER PHARMA SRL\\ndescr:          Tipografilor nr. 11-15 Corp A1-A2, Et. 3\\ndescr:          Bucuresti Sector 1 Romania\\nadmin-c:        CM15951-RIPE\\ntech-c:         CM15951-RIPE\\norg:            ORG-SPS32-RIPE\\nupd-to:         frontdesk@ro.ro.netgrs.com\\nmnt-nfy:        frontdesk@ro.ro.netgrs.com\\nauth:           MD5-PW\\nauth:           PGPKEY-7FD0A168\\nnotify:         frontdesk@ro.ro.netgrs.com\\nmnt-by:         SERVIER-MNT\\ncreated:        2015-10-23T01:41:56Z\\nlast-modified:  2015-10-23T01:41:56Z\\nsource:         RIPE"}, {"id": "MEGAACCESS-NOC", "name": "Occino GmbH Maintainer Object", "admin_id": "KL10", "tech_id": "KL10", "org_id": "ORG-MAG4-RIPE", "created": "2008-02-03", "updated": "2019-08-16", "source": "ripe", "raw": "mntner:         MEGAACCESS-NOC\\ndescr:          Occino GmbH Maintainer Object\\norg:            ORG-MAG4-RIPE\\nadmin-c:        KL10\\ntech-c:         KL10\\nupd-to:         landefeld@occino.de\\nauth:           MD5-PW\\nauth:           SSO\\nmnt-by:         MEGAACCESS-NOC\\nmnt-by:         NGENN-NOC\\ncreated:        2008-02-03T21:42:37Z\\nlast-modified:  2019-08-16T16:36:29Z\\nsource:         RIPE"}, {"id": "COMPLEX-MNT", "name": "Complex Computers sp. z o.o.", "admin_id": "WB279-RIPE", "tech_id": "PB10754-RIPE", "org_id": "ORG-CCsz3-RIPE", "created": "2010-03-01", "updated": "2012-04-10", "source": "ripe", "raw": "mntner:         COMPLEX-MNT\\ndescr:          Complex Computers sp. z o.o.\\norg:            ORG-CCsz3-RIPE\\nadmin-c:        WB279-RIPE\\ntech-c:         PB10754-RIPE\\nupd-to:         administrator@complex.pl\\nmnt-nfy:        administrator@complex.pl\\nremarks:        MD5 passwords older than November 2011 were removed from this maintainer, see: https://www.ripe.net/removed2011pw\\nnotify:         administrator@complex.pl\\nauth:           PGPKEY-3814636B\\nmnt-by:         COMPLEX-MNT\\ncreated:        2010-03-01T15:17:43Z\\nlast-modified:  2012-04-10T17:15:31Z\\nsource:         RIPE"}, {"id": "ALLNET-CLOUD-MNT", "name": "ALLNET CLOUD SRL\\nIalomicioarei Nr.20\\nBUCURESTI SECTOR 1 011278\\nRomania RO", "admin_id": "IT479-RIPE", "tech_id": "IT306-RIPE\\nBT1854-RIPE", "org_id": "ORG-ACS32-RIPE", "created": "2014-03-26", "updated": "2017-11-24", "source": "ripe", "raw": "mntner:         ALLNET-CLOUD-MNT\\ndescr:          ALLNET CLOUD SRL\\ndescr:          Ialomicioarei Nr.20\\ndescr:          BUCURESTI SECTOR 1 011278\\ndescr:          Romania RO\\nadmin-c:        IT479-RIPE\\ntech-c:         IT306-RIPE\\ntech-c:         BT1854-RIPE\\norg:            ORG-ACS32-RIPE\\nupd-to:         iulian@allnet.ro\\nmnt-nfy:        iulian@allnet.ro\\nauth:           MD5-PW\\nauth:           SSO\\nauth:           PGPKEY-7FD0A168\\nnotify:         iulian@allnet.ro\\nmnt-by:         ALLNET-CLOUD-MNT\\ncreated:        2014-03-26T16:35:09Z\\nlast-modified:  2017-11-24T16:56:37Z\\nsource:         RIPE"}, {"id": "VIZITNETUA-MNT", "name": "Telestroymontazh, Ltd.", "admin_id": "VVV45-RIPE", "tech_id": "DZ839-RIPE", "org_id": "ORG-TL61-RIPE", "created": "2006-06-16", "updated": "2017-10-19", "source": "ripe", "raw": "mntner:         VIZITNETUA-MNT\\ndescr:          Telestroymontazh, Ltd.\\norg:            ORG-TL61-RIPE\\nadmin-c:        VVV45-RIPE\\ntech-c:         DZ839-RIPE\\nupd-to:         sadmin@vizit-net.com\\nauth:           SSO\\nremarks:        MD5 passwords older than November 2011 were removed from this maintainer, see: https://www.ripe.net/removed2011pw\\nmnt-by:         VIZITNETUA-MNT\\ncreated:        2006-06-16T14:00:48Z\\nlast-modified:  2017-10-19T14:13:02Z\\nsource:         RIPE"}, {"id": "SMITH-MNT", "name": "Smith & Smith SRL\\nstr. George Georgescu - intrare prin Justitiei 54, nr.10\\nBucuresti sector 4 Romania RO", "admin_id": "SA39414-RIPE", "tech_id": "SA39414-RIPE", "org_id": "ORG-SSS93-RIPE", "created": "2019-02-12", "updated": "2019-02-12", "source": "ripe", "raw": "mntner:         SMITH-MNT\\ndescr:          Smith & Smith SRL\\ndescr:          str. George Georgescu - intrare prin Justitiei 54, nr.10\\ndescr:          Bucuresti sector 4 Romania RO\\nadmin-c:        SA39414-RIPE\\ntech-c:         SA39414-RIPE\\norg:            ORG-SSS93-RIPE\\nupd-to:         sorin.anton@smith-smith.ro\\nmnt-nfy:        sorin.anton@smith-smith.ro\\nauth:           MD5-PW\\nauth:           PGPKEY-7FD0A168\\nnotify:         sorin.anton@smith-smith.ro\\nmnt-by:         SMITH-MNT\\ncreated:        2019-02-12T09:10:26Z\\nlast-modified:  2019-02-12T09:10:26Z\\nsource:         RIPE"}, {"id": "AXS-MNT", "name": "AXS IT SOLUTIONS SRL\\nEroii Sanitari nr. 55 ap 1\\nbucuresti sector 5 050472\\nRomania RO", "admin_id": "AR12616-RIPE", "tech_id": "AR12616-RIPE", "org_id": "ORG-SAST1-RIPE", "created": "2008-10-05", "updated": "2010-11-04", "source": "ripe", "raw": "mntner:         AXS-MNT\\ndescr:          AXS IT SOLUTIONS SRL\\ndescr:          Eroii Sanitari nr. 55 ap 1\\ndescr:          bucuresti sector 5 050472\\ndescr:          Romania RO\\nadmin-c:        AR12616-RIPE\\ntech-c:         AR12616-RIPE\\norg:            ORG-SAST1-RIPE\\nupd-to:         andrei@axs.ro\\nmnt-nfy:        andrei@axs.ro\\nauth:           PGPKEY-7FD0A168\\nremarks:        MD5 passwords older than November 2011 were removed from this maintainer, see: https://www.ripe.net/removed2011pw\\nnotify:         andrei@axs.ro\\nmnt-by:         AXS-MNT\\ncreated:        2008-10-05T20:45:44Z\\nlast-modified:  2010-11-04T05:34:09Z\\nsource:         RIPE"}, {"id": "CALL-INTERNATIONAL-OUTSOURCING-MNT", "name": "CALL INTERNATIONAL OUTSOURCING SRL\\n105A, Oltenitei\\nBucharest, Sector 4\\nRO", "admin_id": "AM3667-RIPE", "tech_id": "AM3667-RIPE", "org_id": "ORG-CIOS1-RIPE", "created": "2007-04-26", "updated": "2015-07-09", "source": "ripe", "raw": "mntner:         CALL-INTERNATIONAL-OUTSOURCING-MNT\\ndescr:          CALL INTERNATIONAL OUTSOURCING SRL\\ndescr:          105A, Oltenitei\\ndescr:          Bucharest, Sector 4\\ndescr:          RO\\nadmin-c:        AM3667-RIPE\\ntech-c:         AM3667-RIPE\\norg:            ORG-CIOS1-RIPE\\nupd-to:         andrei.miron@euroanswer.co.uk\\nmnt-nfy:        andrei.miron@euroanswer.co.uk\\nauth:           SSO\\nremarks:        MD5 passwords older than November 2011 were removed from this maintainer, see: https://www.ripe.net/removed2011pw\\nnotify:         andrei.miron@euroanswer.co.uk\\nmnt-by:         AS3233-MNT\\ncreated:        2007-04-26T11:33:19Z\\nlast-modified:  2015-07-09T12:46:30Z\\nsource:         RIPE"}, {"id": "RO-STREAMWIDE-MNT", "name": "Streamwide Romania SRL\\n25, F?g?ra? Street\\nBucharest 1\\nRomania RO", "admin_id": "VC3990-RIPE", "tech_id": "CL5036-RIPE", "org_id": "ORG-SRS19-RIPE", "created": "2010-01-20", "updated": "2019-05-23", "source": "ripe", "raw": "mntner:         RO-STREAMWIDE-MNT\\ndescr:          Streamwide Romania SRL\\ndescr:          25, F?g?ra? Street\\ndescr:          Bucharest 1\\ndescr:          Romania RO\\nadmin-c:        VC3990-RIPE\\ntech-c:         CL5036-RIPE\\norg:            ORG-SRS19-RIPE\\nupd-to:         noc@streamwide.ro\\nmnt-nfy:        noc@streamwide.ro\\nauth:           PGPKEY-7FD0A168\\nauth:           SSO\\nremarks:        MD5 passwords older than November 2011 were removed from this maintainer, see: https://www.ripe.net/removed2011pw\\nnotify:         noc@streamwide.ro\\nmnt-by:         RO-STREAMWIDE-MNT\\ncreated:        2010-01-20T23:02:19Z\\nlast-modified:  2019-05-23T13:01:13Z\\nsource:         RIPE"}, {"id": "MNT-YESSER", "name": "YESSER , E-GOVNMENT PROGRAM", "admin_id": "FSA39-RIPE", "tech_id": "MFA29-RIPE", "org_id": "ORG-YEP1-RIPE", "created": "2012-12-18", "updated": "2012-12-18", "source": "ripe", "raw": "mntner:         MNT-YESSER\\ndescr:          YESSER , E-GOVNMENT PROGRAM\\norg:            ORG-YEP1-RIPE\\nadmin-c:        FSA39-RIPE\\ntech-c:         MFA29-RIPE\\nupd-to:         net@yesser.gov.sa\\nauth:           MD5-PW\\nmnt-by:         MNT-YESSER\\nmnt-by:         KACST-ISU-MNT\\ncreated:        2012-12-18T05:56:35Z\\nlast-modified:  2012-12-18T06:16:31Z\\nsource:         RIPE"}, {"id": "WIFINET-MNT", "name": "WIFINET S.R.L.\\nIleana Cosanzeana nr.5\\nCluj Napoca Cluj 400230\\nRomania RO", "admin_id": "BDC34-RIPE", "tech_id": "BDC34-RIPE", "org_id": "ORG-WS57-RIPE", "created": "2011-07-22", "updated": "2011-07-27", "source": "ripe", "raw": "mntner:         WIFINET-MNT\\ndescr:          WIFINET S.R.L.\\ndescr:          Ileana Cosanzeana nr.5\\ndescr:          Cluj Napoca Cluj 400230\\ndescr:          Romania RO\\nadmin-c:        BDC34-RIPE\\ntech-c:         BDC34-RIPE\\norg:            ORG-WS57-RIPE\\nupd-to:         admin@wfi.ro\\nmnt-nfy:        admin@wfi.ro\\nauth:           PGPKEY-7FD0A168\\nremarks:        MD5 passwords older than November 2011 were removed from this maintainer, see: https://www.ripe.net/removed2011pw\\nnotify:         admin@wfi.ro\\nmnt-by:         WIFINET-MNT\\ncreated:        2011-07-22T03:21:19Z\\nlast-modified:  2011-07-27T19:08:39Z\\nsource:         RIPE"}, {"id": "NEW-PRESENCE-MNT", "name": "New Presence SRL\\nSiderurgistilor SD10B, parter, camera 2\\nGalati Romania RO 800484", "admin_id": "FC12926-RIPE", "tech_id": "FC12926-RIPE", "org_id": "ORG-NPS7-RIPE", "created": "2014-04-21", "updated": "2014-04-21", "source": "ripe", "raw": "mntner:         NEW-PRESENCE-MNT\\ndescr:          New Presence SRL\\ndescr:          Siderurgistilor SD10B, parter, camera 2\\ndescr:          Galati Romania RO 800484\\nadmin-c:        FC12926-RIPE\\ntech-c:         FC12926-RIPE\\norg:            ORG-NPS7-RIPE\\nupd-to:         florin.chiper@agress.ro\\nmnt-nfy:        florin.chiper@agress.ro\\nauth:           MD5-PW\\nauth:           PGPKEY-7FD0A168\\nnotify:         florin.chiper@agress.ro\\nmnt-by:         NEW-PRESENCE-MNT\\ncreated:        2014-04-21T07:43:44Z\\nlast-modified:  2014-04-21T07:43:44Z\\nsource:         RIPE"}, {"id": "SKYLINK", "name": "SkyLink Data Center B.V.", "admin_id": "ME6479-RIPE", "tech_id": "ME6479-RIPE", "org_id": "ORG-SDCB1-RIPE", "created": "2016-07-12", "updated": "2017-11-13", "source": "ripe", "raw": "mntner:         SKYLINK\\ndescr:          SkyLink Data Center B.V.\\nadmin-c:        ME6479-RIPE\\ntech-c:         ME6479-RIPE\\norg:            ORG-SDCB1-RIPE\\nupd-to:         marcel.vm@gmx.de\\nauth:           SSO\\nmnt-by:         SKYLINK\\ncreated:        2016-07-12T09:07:05Z\\nlast-modified:  2017-11-13T15:54:47Z\\nsource:         RIPE"}, {"id": "RU-BURAN-TELECOM-1-MNT", "name": "Buran Telecom maintainer", "admin_id": "BBR\\nOM3904-RIPE", "tech_id": "BBR", "org_id": "ORG-LB67-RIPE", "created": "2015-10-28", "updated": "2015-11-12", "source": "ripe", "raw": "mntner:         ru-buran-telecom-1-mnt\\ndescr:          Buran Telecom maintainer\\norg:            ORG-LB67-RIPE\\nadmin-c:        BBR\\nadmin-c:        OM3904-RIPE\\ntech-c:         BBR\\nupd-to:         noc@burantel.ru\\nmnt-nfy:        noc@burantel.ru\\nnotify:         noc@burantel.ru\\nauth:           SSO\\nauth:           SSO\\nauth:           SSO\\nmnt-by:         ru-buran-telecom-1-mnt\\ncreated:        2015-10-28T15:27:07Z\\nlast-modified:  2015-11-12T09:39:00Z\\nsource:         RIPE"}, {"id": "NETACCESS-MNT", "name": "SC Netaccess SRL\\nSimion Barnutiu Nr13\\nSatu Mare Romania RO", "admin_id": "SS7850-RIPE", "tech_id": "SS7850-RIPE", "org_id": "ORG-SNS11-RIPE", "created": "2006-07-03", "updated": "2017-05-30", "source": "ripe", "raw": "mntner:         NETACCESS-MNT\\ndescr:          SC Netaccess SRL\\ndescr:          Simion Barnutiu Nr13\\ndescr:          Satu Mare Romania RO\\nadmin-c:        SS7850-RIPE\\ntech-c:         SS7850-RIPE\\norg:            ORG-SNS11-RIPE\\nupd-to:         office@netaccess.ro\\nmnt-nfy:        office@netaccess.ro\\nauth:           MD5-PW\\nauth:           SSO\\nnotify:         office@netaccess.ro\\nmnt-by:         NETACCESS-MNT\\ncreated:        2006-07-03T06:45:52Z\\nlast-modified:  2017-05-30T13:13:11Z\\nsource:         RIPE"}, {"id": "GOVSK-MNT", "name": "The Slovak Republic Government Office RIPE Maintainer", "admin_id": "GVSK-RIPE", "tech_id": "GVSK-RIPE", "org_id": "ORG-OotG1-RIPE", "created": "2004-07-14", "updated": "2018-04-13", "source": "ripe", "raw": "mntner:         GOVSK-MNT\\ndescr:          The Slovak Republic Government Office RIPE Maintainer\\norg:            ORG-OotG1-RIPE\\nadmin-c:        GVSK-RIPE\\ntech-c:         GVSK-RIPE\\nupd-to:         ripe@gov.sk\\nmnt-nfy:        ripe@gov.sk\\nmnt-by:         GOVSK-MNT\\ncreated:        2004-07-14T12:50:13Z\\nlast-modified:  2018-04-13T17:46:38Z\\nsource:         RIPE\\nauth:           MD5-PW\\nauth:           SSO\\nauth:           SSO"}, {"id": "EUROINS-MNT", "name": "Euroins Romania Asigurarea Reasigurare SA\\nSos Bucuresti Nord Nr 10 Global City Business Park\\nCladirea O23 etaj 4 Voluntari Ilfov Romania RO 077190", "admin_id": "DG9457-RIPE", "tech_id": "DG9457-RIPE", "org_id": "ORG-ERAR1-RIPE", "created": "2014-05-07", "updated": "2014-05-07", "source": "ripe", "raw": "mntner:         EUROINS-MNT\\ndescr:          Euroins Romania Asigurarea Reasigurare SA\\ndescr:          Sos Bucuresti Nord Nr 10 Global City Business Park\\ndescr:          Cladirea O23 etaj 4 Voluntari Ilfov Romania RO 077190\\nadmin-c:        DG9457-RIPE\\ntech-c:         DG9457-RIPE\\norg:            ORG-ERAR1-RIPE\\nupd-to:         it@euroins.ro\\nmnt-nfy:        it@euroins.ro\\nauth:           MD5-PW\\nauth:           PGPKEY-7FD0A168\\nnotify:         it@euroins.ro\\nmnt-by:         EUROINS-MNT\\ncreated:        2014-05-07T02:54:04Z\\nlast-modified:  2014-05-07T02:54:04Z\\nsource:         RIPE"}, {"id": "HSIS-MNT", "name": "SC Hard & Soft Intelligent Solutions SRL\\nStr. Colentina, Nr. 76 Bl. 111, Sc. A, Ap. 17\\nBucuresti 2\\nRomania RO", "admin_id": "ART52-RIPE\\nDAR52-RIPE\\nART52-RIPE", "tech_id": "DAR52-RIPE\\nAAC52-RIPE", "org_id": "ORG-SHSI1-RIPE", "created": "2006-01-27", "updated": "2017-11-13", "source": "ripe", "raw": "mntner:         HSIS-MNT\\ndescr:          SC Hard & Soft Intelligent Solutions SRL\\ndescr:          Str. Colentina, Nr. 76 Bl. 111, Sc. A, Ap. 17\\ndescr:          Bucuresti 2\\ndescr:          Romania RO\\nadmin-c:        ART52-RIPE\\nremarks:        MD5 passwords older than November 2011 were removed from this maintainer, see: https://www.ripe.net/removed2011pw\\nadmin-c:        DAR52-RIPE\\nadmin-c:        ART52-RIPE\\ntech-c:         DAR52-RIPE\\ntech-c:         AAC52-RIPE\\norg:            ORG-SHSI1-RIPE\\nupd-to:         tehnic@hsis.ro\\nmnt-nfy:        tehnic@hsis.ro\\nauth:           PGPKEY-7FD0A168\\nnotify:         tehnic@hsis.ro\\nmnt-by:         HSIS-MNT\\ncreated:        2006-01-27T00:02:31Z\\nlast-modified:  2017-11-13T15:52:31Z\\nsource:         RIPE"}, {"id": "IP266-MNT", "name": "SPIE Switzerland IP-Address Maintainer", "admin_id": "ADMN266-RIPE", "tech_id": "TECH266-RIPE", "org_id": "ORG-SSA266-RIPE", "created": "2018-09-03", "updated": "2018-09-03", "source": "ripe", "raw": "mntner:         IP266-MNT\\ndescr:          SPIE Switzerland IP-Address Maintainer\\norg:            ORG-SSA266-RIPE\\nadmin-c:        ADMN266-RIPE\\ntech-c:         TECH266-RIPE\\nupd-to:         it.info@spie.ch\\nupd-to:         lorenzo.mini@spie.com\\nupd-to:         falk.siebeneiger@spie.com\\nmnt-nfy:        it.info@spie.ch\\nmnt-nfy:        lorenzo.mini@spie.com\\nmnt-nfy:        falk.siebeneiger@spie.com\\nnotify:         it.info@spie.ch\\nnotify:         lorenzo.mini@spie.com\\nnotify:         falk.siebeneiger@spie.com\\nauth:           SSO\\nauth:           SSO\\nmnt-by:         ch-spieswitzerland-1-mnt\\nmnt-by:         ORG-SSA266-MNT\\ncreated:        2018-09-03T13:23:02Z\\nlast-modified:  2018-09-03T13:40:12Z\\nsource:         RIPE"}, {"id": "SOFTWAREPARK-MNT", "name": "CONS MANAGEMENT PARC DE SOFT S.R.L.\\nStrada Portului nr. 23\\nGalati Galati\\nRomania RO", "admin_id": "BU244-RIPE", "tech_id": "BU244-RIPE", "org_id": "ORG-CMPD1-RIPE", "created": "2010-12-20", "updated": "2019-05-23", "source": "ripe", "raw": "mntner:         SOFTWAREPARK-MNT\\ndescr:          CONS MANAGEMENT PARC DE SOFT S.R.L.\\ndescr:          Strada Portului nr. 23\\ndescr:          Galati Galati\\ndescr:          Romania RO\\nadmin-c:        BU244-RIPE\\ntech-c:         BU244-RIPE\\norg:            ORG-CMPD1-RIPE\\nupd-to:         tehnic@softwarepark-galati.ro\\nmnt-nfy:        tehnic@softwarepark-galati.ro\\nauth:           PGPKEY-7FD0A168\\nauth:           SSO\\nnotify:         tehnic@softwarepark-galati.ro\\nmnt-by:         SOFTWAREPARK-MNT\\ncreated:        2010-12-20T08:20:39Z\\nlast-modified:  2019-05-23T10:01:35Z\\nsource:         RIPE"}, {"id": "LAGARDERE-MNT", "name": "LAGARDERE TRAVEL RETAIL SRL\\nB-Dul Dimitrie Pompei, Nr 9-9a,\\nCladirea 10, Etaj P+1+2,\\nBucuresti, Sector 2, Romania", "admin_id": "RS21754-RIPE", "tech_id": "RS21754-RIPE", "org_id": "ORG-LTRS1-RIPE", "created": "2017-03-07", "updated": "2017-03-07", "source": "ripe", "raw": "mntner:         LAGARDERE-MNT\\ndescr:          LAGARDERE TRAVEL RETAIL SRL\\ndescr:          B-Dul Dimitrie Pompei, Nr 9-9a,\\ndescr:          Cladirea 10, Etaj P+1+2,\\ndescr:          Bucuresti, Sector 2, Romania\\nadmin-c:        RS21754-RIPE\\ntech-c:         RS21754-RIPE\\norg:            ORG-LTRS1-RIPE\\nupd-to:         m.enescu@lagardere-tr.ro\\nmnt-nfy:        m.enescu@lagardere-tr.ro\\nauth:           MD5-PW\\nauth:           PGPKEY-7FD0A168\\nnotify:         m.enescu@lagardere-tr.ro\\nmnt-by:         LAGARDERE-MNT\\ncreated:        2017-03-07T06:09:45Z\\nlast-modified:  2017-03-07T06:09:45Z\\nsource:         RIPE"}, {"id": "MD-INET-MNT", "name": "S.C. Inet Expres S.R.L.\\nSocoleni 21\\nChisinau 2020\\nMoldova MD", "admin_id": "BS2434-RIPE", "tech_id": "BS2434-RIPE", "org_id": "ORG-SIES3-RIPE", "created": "2008-08-06", "updated": "2017-01-09", "source": "ripe", "raw": "mntner:         MD-INET-MNT\\ndescr:          S.C. Inet Expres S.R.L.\\ndescr:          Socoleni 21\\ndescr:          Chisinau 2020\\ndescr:          Moldova MD\\nadmin-c:        BS2434-RIPE\\ntech-c:         BS2434-RIPE\\norg:            ORG-SIES3-RIPE\\nupd-to:         office@inet.md\\nmnt-nfy:        office@inet.md\\nauth:           PGPKEY-7FD0A168\\nauth:           MD5-PW\\nnotify:         office@inet.md\\nmnt-by:         MD-INET-MNT\\ncreated:        2008-08-06T17:00:02Z\\nlast-modified:  2017-01-09T15:53:41Z\\nsource:         RIPE"}, {"id": "BP-MNT", "name": "SC BP OFFICE & SERVICE SRL\\nBucharest, Drumul Sabareni 24-26,Sector 6, 632700, Romania, RO", "admin_id": "MD3527-RIPE", "tech_id": "MD3527-RIPE", "org_id": "ORG-SBOS1-RIPE", "created": "2004-08-30", "updated": "2015-05-15", "source": "ripe", "raw": "mntner:         BP-MNT\\ndescr:          SC BP OFFICE & SERVICE SRL\\ndescr:          Bucharest, Drumul Sabareni 24-26,Sector 6, 632700, Romania, RO\\norg:            ORG-SBOS1-RIPE\\nadmin-c:        MD3527-RIPE\\ntech-c:         MD3527-RIPE\\nupd-to:         mihai.danielescu@bpoffice.ro\\nmnt-nfy:        mihai.danielescu@bpoffice.ro\\nnotify:         mihai.danielescu@bpoffice.ro\\nmnt-by:         BP-MNT\\nauth:           MD5-PW\\ncreated:        2004-08-30T13:36:32Z\\nlast-modified:  2015-05-15T08:58:11Z\\nsource:         RIPE\\nauth:           MD5-PW\\nauth:           SSO\\nauth:           SSO"}, {"id": "TBSUHR-MNT", "name": "--------------------------------------------------\\nTechnische Betriebe Suhr\\nMuehleweg 1, CH-5034 Suhr\\nTel. +41 62 855 57 57\\nFax. +41 62 855 57 50\\ninfo@ziknet.ch\\n--------------------------------------------------", "admin_id": "JS6657-RIPE", "tech_id": "JS6657-RIPE", "org_id": "ORG-TBS2-RIPE", "created": "2006-10-09", "updated": "2017-10-23", "source": "ripe", "raw": "mntner:         TBSUHR-MNT\\ndescr:          --------------------------------------------------\\ndescr:          Technische Betriebe Suhr\\ndescr:          Muehleweg 1, CH-5034 Suhr\\ndescr:          Tel. +41 62 855 57 57\\ndescr:          Fax. +41 62 855 57 50\\ndescr:          info@ziknet.ch\\ndescr:          --------------------------------------------------\\norg:            ORG-TBS2-RIPE\\nadmin-c:        JS6657-RIPE\\ntech-c:         JS6657-RIPE\\nupd-to:         info@ziknet.ch\\nmnt-by:         TBSUHR-MNT\\nmnt-by:         CH-LAN-MNT\\ncreated:        2006-10-09T14:57:53Z\\nlast-modified:  2017-10-23T12:34:55Z\\nsource:         RIPE\\nauth:           MD5-PW\\nauth:           SSO\\nauth:           SSO\\nauth:           SSO\\nauth:           SSO"}, {"id": "HOL-MNT", "name": "SC HOL.RO SRL\\n25th C-Tin Radulescu Motru Street\\nBucharest, 4th district, Romania", "admin_id": "HOL318-RIPE", "tech_id": "HOL318-RIPE", "org_id": "ORG-SHS5-RIPE", "created": "2008-08-21", "updated": "2016-05-27", "source": "ripe", "raw": "mntner:         HOL-MNT\\ndescr:          SC HOL.RO SRL\\ndescr:          25th C-Tin Radulescu Motru Street\\ndescr:          Bucharest, 4th district, Romania\\nadmin-c:        HOL318-RIPE\\ntech-c:         HOL318-RIPE\\norg:            ORG-SHS5-RIPE\\nupd-to:         hostmaster@hol.ro\\nmnt-nfy:        hostmaster@hol.ro\\nauth:           SSO\\nnotify:         hostmaster@hol.ro\\nmnt-by:         HOL-MNT\\ncreated:        2008-08-21T01:42:46Z\\nlast-modified:  2016-05-27T21:25:52Z\\nsource:         RIPE"}, {"id": "WORLD-NET-MNT", "name": "SC WORLDNET DATA COMUNICATII SRL\\nValea Ialomitei Nr 1A Bl C18a\\nSc 1 Et 2 Apt 9 Sect. 6\\nBucuresti Romania", "admin_id": "SL2157-RIPE", "tech_id": "SL2157-RIPE\\nCBI2-RIPE", "org_id": "ORG-SWDC1-RIPE", "created": "2005-01-20", "updated": "2016-06-14", "source": "ripe", "raw": "mntner:         WORLD-NET-MNT\\ndescr:          SC WORLDNET DATA COMUNICATII SRL\\ndescr:          Valea Ialomitei Nr 1A Bl C18a\\ndescr:          Sc 1 Et 2 Apt 9 Sect. 6\\ndescr:          Bucuresti Romania\\nadmin-c:        SL2157-RIPE\\ntech-c:         SL2157-RIPE\\ntech-c:         CBI2-RIPE\\norg:            ORG-SWDC1-RIPE\\nupd-to:         laurentiu.simion@gmail.com\\nmnt-nfy:        laurentiu.simion@gmail.com\\nnotify:         laurentiu.simion@gmail.com\\nmnt-by:         WORLD-NET-MNT\\ncreated:        2005-01-20T21:05:33Z\\nlast-modified:  2016-06-14T21:50:31Z\\nsource:         RIPE\\nauth:           MD5-PW\\nauth:           SSO\\nauth:           PGPKEY-EB4BBF35\\nauth:           MD5-PW"}, {"id": "RO-SBS-MNT", "name": "SC Standard Business&Services SRL\\nStr Andrei Popovici , Nr 10 BL7 , sc A , ap 4\\nBucuresti 1 011723\\nRomania RO", "admin_id": "AG5906-RIPE", "tech_id": "AG5906-RIPE", "org_id": "ORG-SSBS1-RIPE", "created": "2005-12-13", "updated": "2012-12-11", "source": "ripe", "raw": "mntner:         RO-SBS-MNT\\ndescr:          SC Standard Business&Services SRL\\ndescr:          Str Andrei Popovici , Nr 10 BL7 , sc A , ap 4\\ndescr:          Bucuresti 1 011723\\ndescr:          Romania RO\\nadmin-c:        AG5906-RIPE\\ntech-c:         AG5906-RIPE\\norg:            ORG-SSBS1-RIPE\\nupd-to:         support@vollo.ro\\nmnt-nfy:        support@vollo.ro\\nauth:           PGPKEY-7FD0A168\\nremarks:        MD5 passwords older than November 2011 were removed from this maintainer, see: https://www.ripe.net/removed2011pw\\nnotify:         support@vollo.ro\\nmnt-by:         RO-SBS-MNT\\ncreated:        2005-12-13T14:57:37Z\\nlast-modified:  2012-12-11T12:40:34Z\\nsource:         RIPE"}, {"id": "ITSYSTEMS-MNT", "name": "SC IT Systems Solutii Profesionale SRL\\nAl. Valea Florilor, Nr.4 Bl.P10, Sc.G, Ap.139\\nBucuresti Sector 6\\nRomania RO", "admin_id": "RG3459-RIPE", "tech_id": "RG3459-RIPE", "org_id": "ORG-SISS7-RIPE", "created": "2007-05-11", "updated": "2013-10-08", "source": "ripe", "raw": "mntner:         ITSYSTEMS-MNT\\ndescr:          SC IT Systems Solutii Profesionale SRL\\ndescr:          Al. Valea Florilor, Nr.4 Bl.P10, Sc.G, Ap.139\\ndescr:          Bucuresti Sector 6\\ndescr:          Romania RO\\nadmin-c:        RG3459-RIPE\\ntech-c:         RG3459-RIPE\\norg:            ORG-SISS7-RIPE\\nupd-to:         robert@itsystems.ro\\nmnt-nfy:        robert@itsystems.ro\\nauth:           MD5-PW\\nnotify:         robert@itsystems.ro\\nmnt-by:         ITSYSTEMS-MNT\\ncreated:        2007-05-11T19:50:19Z\\nlast-modified:  2013-10-08T09:01:16Z\\nsource:         RIPE"}, {"id": "AS9160-MNT", "name": "Rokura SRL\\n46-48 Rahmaninov\\nBucharest, Romania", "admin_id": "II52-RIPE", "tech_id": "II52-RIPE", "org_id": "ORG-RS34-RIPE", "created": "1970-01-01", "updated": "2017-10-15", "source": "ripe", "raw": "mntner:         AS9160-MNT\\ndescr:          Rokura SRL\\ndescr:          46-48 Rahmaninov\\ndescr:          Bucharest, Romania\\nadmin-c:        II52-RIPE\\ntech-c:         II52-RIPE\\norg:            ORG-RS34-RIPE\\nupd-to:         hostmaster@roklink.ro\\nmnt-nfy:        hostmaster@roklink.ro\\nauth:           SSO\\nremarks:        MD5 passwords older than November 2011 were removed from this maintainer, see: https://www.ripe.net/removed2011pw\\nremarks:        This is the maintainer of all Rokura Network related objects\\nnotify:         hostmaster@roklink.ro\\nmnt-by:         AS9160-MNT\\ncreated:        1970-01-01T00:00:00Z\\nlast-modified:  2017-10-15T17:06:48Z\\nsource:         RIPE"}, {"id": "BIXCE-MNT", "name": "BIXCE Inc.", "admin_id": "BI1058-RIPE", "tech_id": "BI1058-RIPE", "org_id": "ORG-BI61-RIPE", "created": "2017-12-20", "updated": "2017-12-20", "source": "ripe", "raw": "mntner:         BIXCE-MNT\\ndescr:          BIXCE Inc.\\norg:            ORG-BI61-RIPE\\nadmin-c:        BI1058-RIPE\\ntech-c:         BI1058-RIPE\\nupd-to:         noc@bixce.com\\nauth:           MD5-PW\\nauth:           SSO\\nnotify:         noc@bixce.com\\nmnt-by:         BIXCE-MNT\\ncreated:        2017-12-20T09:12:08Z\\nlast-modified:  2017-12-20T09:41:57Z\\nsource:         RIPE"}, {"id": "MNT-ES-ALOJALIA-MAD-1", "name": "ALOJALIA CLOUD", "admin_id": "AP30427-RIPE", "tech_id": "AMS346-RIPE", "org_id": "ORG-ACS52-RIPE", "created": "2019-11-25", "updated": "2019-11-25", "source": "ripe", "raw": "mntner:         mnt-es-alojalia-mad-1\\norg:            ORG-ACS52-RIPE\\ndescr:          ALOJALIA CLOUD\\nadmin-c:        AP30427-RIPE\\ntech-c:         AMS346-RIPE\\nupd-to:         alejandro@alojalia.com\\nupd-to:         angel@alojalia.com\\nnotify:         alejandro@alojalia.com\\nnotify:         angel@alojalia.com\\nauth:           SSO\\nauth:           SSO\\nmnt-by:         mnt-es-alojalia-mad-1\\ncreated:        2019-11-25T10:21:07Z\\nlast-modified:  2019-11-25T16:14:59Z\\nsource:         RIPE"}, {"id": "DATASVIT-MNT", "name": "DATASVIT Maintainer", "admin_id": "DSCC-RIPE", "tech_id": "DSCC-RIPE", "org_id": "ORG-DS5-RIPE", "created": "2004-06-01", "updated": "2017-11-13", "source": "ripe", "raw": "mntner:         DATASVIT-MNT\\ndescr:          DATASVIT Maintainer\\norg:            ORG-DS5-RIPE\\nauth:           PGPKEY-CEE430D4\\nadmin-c:        DSCC-RIPE\\ntech-c:         DSCC-RIPE\\nupd-to:         admin@datasvit.net\\nmnt-nfy:        admin@datasvit.net\\nremarks:        MD5 passwords older than November 2011 were removed from this maintainer, see: https://www.ripe.net/removed2011pw\\nmnt-by:         VOLIA-MNT\\ncreated:        2004-06-01T09:31:44Z\\nlast-modified:  2017-11-13T15:52:13Z\\nsource:         RIPE"}, {"id": "ASESOFT-MNT", "name": "SC Asesoft International SA\\nMihai Bravu nr 10\\nPloiesti Prahova 100550\\nRomania RO", "admin_id": "MS11651-RIPE", "tech_id": "MS11651-RIPE", "org_id": "ORG-SAIS3-RIPE", "created": "2005-11-25", "updated": "2018-11-09", "source": "ripe", "raw": "mntner:         ASESOFT-MNT\\ndescr:          SC Asesoft International SA\\ndescr:          Mihai Bravu nr 10\\ndescr:          Ploiesti Prahova 100550\\ndescr:          Romania RO\\nadmin-c:        MS11651-RIPE\\ntech-c:         MS11651-RIPE\\norg:            ORG-SAIS3-RIPE\\nupd-to:         mstan@asesoft.ro\\nmnt-nfy:        mstan@asesoft.ro\\nauth:           PGPKEY-7FD0A168\\nauth:           SSO\\nremarks:        MD5 passwords older than November 2011 were removed from this maintainer, see: https://www.ripe.net/removed2011pw\\nnotify:         mstan@asesoft.ro\\nmnt-by:         ASESOFT-MNT\\ncreated:        2005-11-25T10:03:45Z\\nlast-modified:  2018-11-09T09:22:36Z\\nsource:         RIPE"}, {"id": "DOMO-MEDIA-MNT", "name": "DOMO MEDIA SRL\\nStr. Olari, nr. 4, Bl. 623,\\nSc. B, Ap.4, Iasi, Romania", "admin_id": "AC660-RIPE", "tech_id": "AC660-RIPE", "org_id": "ORG-DMS4-RIPE", "created": "2013-09-20", "updated": "2014-10-17", "source": "ripe", "raw": "mntner:         DOMO-MEDIA-MNT\\ndescr:          DOMO MEDIA SRL\\ndescr:          Str. Olari, nr. 4, Bl. 623,\\ndescr:          Sc. B, Ap.4, Iasi, Romania\\nadmin-c:        AC660-RIPE\\ntech-c:         AC660-RIPE\\norg:            ORG-DMS4-RIPE\\nupd-to:         admin@develbox.ro\\nmnt-nfy:        admin@develbox.ro\\nauth:           MD5-PW\\nauth:           SSO\\nauth:           PGPKEY-7FD0A168\\nnotify:         admin@develbox.ro\\nmnt-by:         DOMO-MEDIA-MNT\\ncreated:        2013-09-20T12:04:57Z\\nlast-modified:  2014-10-17T12:01:52Z\\nsource:         RIPE"}, {"id": "INFLPR-MNT", "name": "INFLPR RA\\nStr. Atomistilor, Nr. 409\\nMagurele Ilfov 077125\\nRomania RO", "admin_id": "MC24694-RIPE", "tech_id": "MC24694-RIPE", "org_id": "ORG-IR7-RIPE", "created": "2012-10-25", "updated": "2019-07-07", "source": "ripe", "raw": "mntner:         INFLPR-MNT\\ndescr:          INFLPR RA\\ndescr:          Str. Atomistilor, Nr. 409\\ndescr:          Magurele Ilfov 077125\\ndescr:          Romania RO\\nadmin-c:        MC24694-RIPE\\ntech-c:         MC24694-RIPE\\norg:            ORG-IR7-RIPE\\nupd-to:         catalin@pcdot.ro\\nmnt-nfy:        catalin@pcdot.ro\\nauth:           MD5-PW\\nauth:           PGPKEY-7FD0A168\\nnotify:         catalin@pcdot.ro\\nauth:           SSO\\nmnt-by:         INFLPR-MNT\\ncreated:        2012-10-25T11:50:22Z\\nlast-modified:  2019-07-07T22:27:22Z\\nsource:         RIPE"}, {"id": "AS760-MNT", "name": "Vienna University NOC", "admin_id": "UK6107-RIPE", "tech_id": "VUN1-RIPE", "org_id": "ORG-VUCC1-RIPE", "created": "2002-07-26", "updated": "2016-10-05", "source": "ripe", "raw": "mntner:         AS760-MNT\\norg:            ORG-VUCC1-RIPE\\ndescr:          Vienna University NOC\\nadmin-c:        UK6107-RIPE\\ntech-c:         VUN1-RIPE\\nupd-to:         net-admin@cc.univie.ac.at\\nmnt-nfy:        net-admin@cc.univie.ac.at\\nauth:           PGPKEY-DBC579D4\\nauth:           PGPKEY-708C030A\\nauth:           X509-2972\\nauth:           PGPKEY-087772F4\\nauth:           PGPKEY-01F71ADD\\nauth:           PGPKEY-C4D45015\\nauth:           PGPKEY-0B68A459\\nauth:           PGPKEY-3011D995\\nauth:           SSO\\nremarks:        MD5 passwords older than November 2011 were removed from this maintainer, see: https://www.ripe.net/removed2011pw\\nmnt-by:         AS760-MNT\\nmnt-by:         ACONET-LIR-MNT\\ncreated:        2002-07-26T09:46:30Z\\nlast-modified:  2016-10-05T10:41:15Z\\nsource:         RIPE"}, {"id": "PL-INFO-NET-1-MNT", "name": "INFO-NET M.Kaszuba Sp.J. AS206412 maintainer", "admin_id": "PK8273-RIPE", "tech_id": "pk666", "org_id": "ORG-MTAF1-RIPE", "created": "2017-01-02", "updated": "2019-03-08", "source": "ripe", "raw": "mntner:         pl-info-net-1-mnt\\ndescr:          INFO-NET M.Kaszuba Sp.J. AS206412 maintainer\\norg:            ORG-MTAF1-RIPE\\nauth:           MD5-PW\\nauth:           SSO\\nauth:           SSO\\nauth:           SSO\\nnotify:         admin@in.net.pl\\ntech-c:         pk666\\nadmin-c:        PK8273-RIPE\\nupd-to:         admin@in.net.pl\\nauth:           MD5-PW\\nauth:           SSO\\nmnt-by:         pl-info-net-1-mnt\\nmnt-by:         INFONET-SC-MNT\\ncreated:        2017-01-02T12:22:03Z\\nlast-modified:  2019-03-08T15:37:41Z\\nsource:         RIPE"}, {"id": "MEER-MNT", "name": "meerfarbig GmbH & Co. KG", "admin_id": "CHME-RIPE\\nDGME-RIPE", "tech_id": "CHME-RIPE\\nDGME-RIPE", "org_id": "ORG-LIGC3-RIPE", "created": "2015-03-02", "updated": "2019-02-20", "source": "ripe", "raw": "mntner:         MEER-MNT\\ndescr:          meerfarbig GmbH & Co. KG\\norg:            ORG-LIGC3-RIPE\\nadmin-c:        CHME-RIPE\\nadmin-c:        DGME-RIPE\\ntech-c:         CHME-RIPE\\ntech-c:         DGME-RIPE\\nupd-to:         noc@meerfarbig.de\\nauth:           MD5-PW\\nauth:           SSO\\nauth:           SSO\\nauth:           SSO\\nauth:           SSO\\nmnt-by:         MEER-MNT\\ncreated:        2015-03-02T21:24:42Z\\nlast-modified:  2019-02-20T11:32:07Z\\nsource:         RIPE"}, {"id": "CYCLOP-MNT", "name": "Broad Comunicatii SRL\\nVestei, Nr. 15\\nBucuresti Sector 1\\nRomania RO", "admin_id": "MP15009-RIPE", "tech_id": "MP15009-RIPE", "org_id": "ORG-BCS5-RIPE", "created": "2009-04-06", "updated": "2009-04-06", "source": "ripe", "raw": "mntner:         CYCLOP-MNT\\ndescr:          Broad Comunicatii SRL\\ndescr:          Vestei, Nr. 15\\ndescr:          Bucuresti Sector 1\\ndescr:          Romania RO\\nadmin-c:        MP15009-RIPE\\ntech-c:         MP15009-RIPE\\norg:            ORG-BCS5-RIPE\\nupd-to:         mircea.popp@broad.ro\\nmnt-nfy:        mircea.popp@broad.ro\\nauth:           PGPKEY-7FD0A168\\nremarks:        MD5 passwords older than November 2011 were removed from this maintainer, see: https://www.ripe.net/removed2011pw\\nnotify:         mircea.popp@broad.ro\\nmnt-by:         CYCLOP-MNT\\ncreated:        2009-04-06T07:16:01Z\\nlast-modified:  2009-04-06T07:16:01Z\\nsource:         RIPE"}, {"id": "RESERACH-INT-MNT", "name": "Maintaining objects of Research International", "admin_id": "MW2937-RIPE", "tech_id": "BW929-RIPE", "org_id": "ORG-RI6-RIPE", "created": "2005-10-28", "updated": "2007-12-13", "source": "ripe", "raw": "mntner:         RESERACH-INT-MNT\\ndescr:          Maintaining objects of Research International\\norg:            ORG-RI6-RIPE\\nadmin-c:        MW2937-RIPE\\ntech-c:         BW929-RIPE\\nupd-to:         b.watson@research-int.com\\nupd-to:         hendrik.volker@deu.mci.com\\nupd-to:         m.walsh@research-int.com\\nremarks:        MD5 passwords older than November 2011 were removed from this maintainer, see: https://www.ripe.net/removed2011pw\\nnotify:         b.watson@research-int.com\\nnotify:         m.walsh@research-int.com\\nmnt-by:         RESERACH-INT-MNT\\ncreated:        2005-10-28T12:13:59Z\\nlast-modified:  2007-12-13T09:59:09Z\\nsource:         RIPE"}, {"id": "NET-COMPUTERS-MNT", "name": "SC MAR - MIR ROB SRL\\nAlexandru Obregia Nr.25 Bloc I4A, Scara 1, Ap 20\\nBucuresti 4 07000\\nRomania RO", "admin_id": "MA6989-RIPE", "tech_id": "KARO-RIPE", "org_id": "ORG-SMMR1-RIPE", "created": "2008-01-16", "updated": "2008-12-23", "source": "ripe", "raw": "mntner:         NET-COMPUTERS-MNT\\ndescr:          SC MAR - MIR ROB SRL\\ndescr:          Alexandru Obregia Nr.25 Bloc I4A, Scara 1, Ap 20\\ndescr:          Bucuresti 4 07000\\ndescr:          Romania RO\\nadmin-c:        MA6989-RIPE\\ntech-c:         KARO-RIPE\\norg:            ORG-SMMR1-RIPE\\nupd-to:         office@net-computers.ro\\nmnt-nfy:        office@net-computers.ro\\nauth:           PGPKEY-7FD0A168\\nremarks:        MD5 passwords older than November 2011 were removed from this maintainer, see: https://www.ripe.net/removed2011pw\\nnotify:         office@net-computers.ro\\nmnt-by:         NET-COMPUTERS-MNT\\ncreated:        2008-01-16T08:00:39Z\\nlast-modified:  2008-12-23T21:41:23Z\\nsource:         RIPE"}, {"id": "ALVARION-MNT", "name": "SC Alvlleytech SRL\\nHoria Closca si Crisan, nr 27-37\\nOtopeni Ilfov\\nRomania RO", "admin_id": "MV4697-RIPE", "tech_id": "MV4697-RIPE", "org_id": "ORG-SAS19-RIPE", "created": "2006-10-02", "updated": "2014-03-19", "source": "ripe", "raw": "mntner:         ALVARION-MNT\\ndescr:          SC Alvlleytech SRL\\ndescr:          Horia Closca si Crisan, nr 27-37\\ndescr:          Otopeni Ilfov\\ndescr:          Romania RO\\nadmin-c:        MV4697-RIPE\\ntech-c:         MV4697-RIPE\\norg:            ORG-SAS19-RIPE\\nauth:           MD5-PW\\nupd-to:         inbar.amit@alvarion.com\\nmnt-nfy:        inbar.amit@alvarion.com\\nnotify:         inbar.amit@alvarion.com\\nmnt-by:         ALVARION-MNT\\ncreated:        2006-10-02T09:33:53Z\\nlast-modified:  2014-03-19T15:19:50Z\\nsource:         RIPE"}, {"id": "SOLUTIOS-MNT", "name": "Solutios", "admin_id": "SOLU-RIPE", "tech_id": "SOLU-RIPE", "org_id": "ORG-SL303-RIPE", "created": "2007-05-24", "updated": "2019-05-28", "source": "ripe", "raw": "mntner:         SOLUTIOS-MNT\\ndescr:          Solutios\\nadmin-c:        SOLU-RIPE\\ntech-c:         SOLU-RIPE\\norg:            ORG-SL303-RIPE\\nupd-to:         ripe@yorkshiretech.com\\nauth:           SSO\\nauth:           SSO\\nauth:           SSO\\nauth:           MD5-PW\\nremarks:        MD5 passwords older than November 2011 were removed from this maintainer, see: https://www.ripe.net/removed2011pw\\nnotify:         ripe@yorkshiretech.com\\nmnt-by:         SOLUTIOS-MNT\\ncreated:        2007-05-24T14:48:09Z\\nlast-modified:  2019-05-28T12:13:35Z\\nsource:         RIPE"}, {"id": "NL-DEVOLKSBANKNV-1-MNT", "name": "De Volksbank N.V.", "admin_id": "SNSB4-RIPE", "tech_id": "SNSB4-RIPE", "org_id": "ORG-SBN5-RIPE", "created": "2017-01-09", "updated": "2017-01-09", "source": "ripe", "raw": "mntner:         nl-devolksbanknv-1-mnt\\ndescr:          De Volksbank N.V.\\norg:            ORG-SBN5-RIPE\\nadmin-c:        SNSB4-RIPE\\ntech-c:         SNSB4-RIPE\\nupd-to:         networkservices@devolksbank.nl\\nauth:           SSO\\nauth:           SSO\\nauth:           SSO\\nauth:           SSO\\nauth:           SSO\\nauth:           SSO\\nauth:           SSO\\nmnt-by:         nl-devolksbanknv-1-mnt\\ncreated:        2017-01-09T16:02:57Z\\nlast-modified:  2017-01-09T17:24:29Z\\nsource:         RIPE\\nnotify:         networkservices@devolksbank.nl"}, {"id": "ELTEL-RIPE-MNT", "name": "ELTEL.NET Maintainer", "admin_id": "SVNT1-RIPE\\nEC2530-RIPE", "tech_id": "SVNT2-RIPE\\nEC2530-RIPE", "org_id": "ORG-EA40-RIPE", "created": "2002-05-23", "updated": "2019-07-31", "source": "ripe", "raw": "mntner:         ELTEL-RIPE-MNT\\ndescr:          ELTEL.NET Maintainer\\norg:            ORG-EA40-RIPE\\nadmin-c:        SVNT1-RIPE\\nadmin-c:        EC2530-RIPE\\ntech-c:         SVNT2-RIPE\\ntech-c:         EC2530-RIPE\\nupd-to:         registry@eltel.net\\nmnt-nfy:        noc@sovintel.ru\\nmnt-nfy:        registry@eltel.net\\nauth:           PGPKEY-ED567695\\nauth:           SSO\\nauth:           SSO\\nauth:           SSO\\nauth:           SSO\\nauth:           PGPKEY-00F9120D\\nauth:           MD5-PW\\nnotify:         noc@sovintel.ru\\nnotify:         registry@eltel.net\\nmnt-by:         ELTEL-RIPE-MNT\\ncreated:        2002-05-23T13:58:32Z\\nlast-modified:  2019-07-31T08:03:14Z\\nsource:         RIPE"}, {"id": "BRIGHTROLL-MNT", "name": "BrightRoll Maintainer", "admin_id": "BN2271-RIPE", "tech_id": "BN2271-RIPE", "org_id": "ORG-BUL4-RIPE", "created": "2014-06-27", "updated": "2016-04-18", "source": "ripe", "raw": "mntner:         BRIGHTROLL-MNT\\ndescr:          BrightRoll Maintainer\\nadmin-c:        BN2271-RIPE\\ntech-c:         BN2271-RIPE\\norg:            ORG-BUL4-RIPE\\nupd-to:         noc@brightroll.com\\nauth:           MD5-PW\\nauth:           SSO\\nmnt-by:         BRIGHTROLL-MNT\\ncreated:        2014-06-27T20:19:38Z\\nlast-modified:  2016-04-18T18:32:48Z\\nsource:         RIPE"}, {"id": "URBB-MNT", "name": "United Romanian Breweries Bereprod S.R.L.\\nBd. Unirii, Nr. 27 Bl. 15, Sc. 2, Et. 1, Ap. 24\\nBucuresti Sector 5 040103\\nRomania RO", "admin_id": "BC3815-RIPE", "tech_id": "BC3815-RIPE", "org_id": "ORG-URBB1-RIPE", "created": "2011-08-12", "updated": "2014-03-28", "source": "ripe", "raw": "mntner:         URBB-MNT\\ndescr:          United Romanian Breweries Bereprod S.R.L.\\ndescr:          Bd. Unirii, Nr. 27 Bl. 15, Sc. 2, Et. 1, Ap. 24\\ndescr:          Bucuresti Sector 5 040103\\ndescr:          Romania RO\\nadmin-c:        BC3815-RIPE\\ntech-c:         BC3815-RIPE\\norg:            ORG-URBB1-RIPE\\nupd-to:         bogdan_caltun@tuborg.ro\\nmnt-nfy:        bogdan_caltun@tuborg.ro\\nnotify:         bogdan_caltun@tuborg.ro\\nmnt-by:         URBB-MNT\\ncreated:        2011-08-12T07:15:13Z\\nlast-modified:  2014-03-28T13:15:10Z\\nsource:         RIPE\\nauth:           MD5-PW"}, {"id": "MCNETCZ-MNT", "name": "MCnet, s.r.o. CZ maintainer", "admin_id": "RSAF1-RIPE\\nMC1644-RIPE\\nRS5799-RIPE", "tech_id": "RSAF1-RIPE", "org_id": "ORG-Ms47-RIPE", "created": "2006-08-12", "updated": "2016-05-05", "source": "ripe", "raw": "mntner:         mcnetcz-mnt\\ndescr:          MCnet, s.r.o. CZ maintainer\\norg:            ORG-Ms47-RIPE\\nadmin-c:        RSAF1-RIPE\\nadmin-c:        MC1644-RIPE\\nadmin-c:        RS5799-RIPE\\nnotify:         lir@mcnet.cz\\nnotify:         roman@paskov.cz\\ntech-c:         RSAF1-RIPE\\nupd-to:         lir@mcnet.cz\\nauth:           PGPKEY-A406DE8C\\nmnt-by:         mcnetcz-mnt\\nauth:           SSO\\nauth:           SSO\\ncreated:        2006-08-12T10:09:00Z\\nlast-modified:  2016-05-05T10:49:43Z\\nsource:         RIPE"}, {"id": "ALLBECK-MNT", "name": "SC Editura Allbeck SRL\\nNutu Ion 2\\nBucuresti Sector 5\\nRomania RO", "admin_id": "FG2624-RIPE", "tech_id": "FG2624-RIPE", "org_id": "ORG-EA239-RIPE", "created": "2005-10-21", "updated": "2005-10-21", "source": "ripe", "raw": "mntner:         ALLBECK-MNT\\ndescr:          SC Editura Allbeck SRL\\ndescr:          Nutu Ion 2\\ndescr:          Bucuresti Sector 5\\ndescr:          Romania RO\\nadmin-c:        FG2624-RIPE\\ntech-c:         FG2624-RIPE\\norg:            ORG-EA239-RIPE\\nupd-to:         florin@beck.ro\\nmnt-nfy:        florin@beck.ro\\nauth:           PGPKEY-7FD0A168\\nremarks:        MD5 passwords older than November 2011 were removed from this maintainer, see: https://www.ripe.net/removed2011pw\\nnotify:         florin@beck.ro\\nmnt-by:         ALLBECK-MNT\\ncreated:        2005-10-21T05:07:18Z\\nlast-modified:  2005-10-21T05:07:18Z\\nsource:         RIPE"}]