[{"range": "206.124.162.0/23", "id": "COMSAT-LM-GX", "name": "Satcom Direct Inc.", "country": "US", "domain": "satcomdirect.com", "org_id": "SATCO-6", "status": "REASSIGNMENT", "tech_id": "DCSUP1-ARIN\\NTECHO33-ARIN", "mnt_id": "DCSUP1-ARIN", "admin_id": "DCSUP1-ARIN", "abuse_id": "DCSUP1-ARIN", "created": "2021-03-19", "updated": "2021-03-19", "source": "arin", "raw": "NetHandle:      NET-206-124-162-0-1\\nOrgID:          SATCO-6\\nParent:         NET-206-124-160-0-1\\nNetName:        COMSAT-LM-GX\\nNetRange:       206.124.162.0 - 206.124.163.255\\nNetType:        reassignment\\nOriginAS:       54238\\nRegDate:        2021-03-19\\nUpdated:        2021-03-19\\nSource:         ARIN\\n\n\nOrgID:          SATCO-6\\nOrgName:        Satcom Direct Inc.\\nCanAllocate:    \\nStreet:         1050 Satcom Lane\\nCity:           Melbourne\\nState/Prov:     FL\\nCountry:        US\\nPostalCode:     32940\\nRegDate:        2007-01-26\\nUpdated:        2021-10-26\\nOrgAbuseHandle: DCSUP1-ARIN\\nOrgAdminHandle: DCSUP1-ARIN\\nOrgNOCHandle:   DCSUP1-ARIN\\nOrgTechHandle:  DCSUP1-ARIN\\nOrgTechHandle:  TECHO33-ARIN\\nSource:         ARIN\\n\n\nPOCHandle:      TECHO33-ARIN\\nIsRole:         Y\\nLastName:       TechOps\\nFirstName:      \\nStreet:         1050 Satcom Lane\\nCity:           Melbourne\\nState/Prov:     FL\\nCountry:        US\\nPostalCode:     32940\\nRegDate:        2018-10-26\\nUpdated:        2022-05-04\\nOfficePhone:    +1-321-525-8014\\nMailbox:        techops@satcomdirect.com\\nSource:         ARIN\\n\n\nPOCHandle:      DCSUP1-ARIN\\nIsRole:         Y\\nLastName:       DCSupport\\nFirstName:      \\nStreet:         1050 Satcom Lane\\nCity:           Melbourne\\nState/Prov:     FL\\nCountry:        US\\nPostalCode:     32940\\nRegDate:        2018-08-02\\nUpdated:        2021-10-28\\nOfficePhone:    +1-321-777-3000\\nMailbox:        dcsupport@satcomdirect.com\\nSource:         ARIN\\n"}, {"range": "205.200.160.0/24", "id": "SHADOWPLAY-MB-CA-1", "name": "Shadowplay.net", "country": "CA", "domain": "shadowplay.net", "org_id": "SHADO", "status": "REASSIGNMENT", "tech_id": "KBR23-ARIN", "mnt_id": "SAT16-ARIN", "admin_id": "KBR23-ARIN", "abuse_id": "SAT16-ARIN", "created": "2004-05-27", "updated": "2021-01-20", "source": "arin", "raw": "NetHandle:      NET-205-200-160-0-1\\nOrgID:          SHADO\\nParent:         NET-205-200-0-0-1\\nNetName:        SHADOWPLAY-MB-CA-1\\nNetRange:       205.200.160.0 - 205.200.160.255\\nNetType:        reassignment\\nComment:        shadowplay.net has not had control of the ips associated with \\nComment:        NET-205-200-160-0-1 \t205.200.160.0/24  since 2008\\nComment:        MTS/Bell have not updated the assignement please dont open tickets with our help desk if you are under attack from this c class. we have no control and recommend you contact \\nComment:        Organization:   Bell Canada (LINX)\\nComment:        Ref:            https://rdap.arin.net/registry/ip/205.200.0.0\\nComment:        run a whois on \\nComment:        eg.. whois  205.200.160.0 and contact the followin handles \\nComment:        NetHandle:      NET-205-200-0-0-1\\nComment:        OrgTechHandle: ANR1-ARIN\\nComment:        OrgTechHandle: IPISP-ARIN\\nComment:        OrgAbuseHandle: ABUSE1127-ARIN\\nComment:        OrgAbuseHandle: ABAI1-ARIN\\nComment:        OrgTechHandle: DHANJ1-ARIN\\nComment:        RAbuseHandle: IAD3-ARIN\\nComment:        RTechHandle: WONGP6-ARIN\\nRegDate:        2004-05-27\\nUpdated:        2021-01-20\\nAbuseHandle:    SAT16-ARIN\\nSource:         ARIN\\n\n\nOrgID:          SHADO\\nOrgName:        Shadowplay.net\\nCanAllocate:    \\nStreet:         351 West Gore Street\\nCity:           Stratford\\nState/Prov:     ON\\nCountry:        CA\\nPostalCode:     N5A 1K9\\nComment:        shadowplay.net has not had control of the ips associated with \\nComment:        NET-205-200-160-0-1 \t205.200.160.0/24  since 2008\\nComment:        MTS/Bell have not updated the assignement please dont open tickets with our help desk if you are under attack from this c class. we have no control and recommend you contact \\nComment:        Organization:   Bell Canada (LINX)\\nComment:        Ref:            https://rdap.arin.net/registry/ip/205.200.0.0\\nComment:        run a whois on \\nComment:        eg.. whois  205.200.160.0 and contact the followin handles \\nComment:        NetHandle:      NET-205-200-0-0-1\\nComment:        OrgTechHandle: ANR1-ARIN\\nComment:        OrgTechHandle: IPISP-ARIN\\nComment:        OrgAbuseHandle: ABUSE1127-ARIN\\nComment:        OrgAbuseHandle: ABAI1-ARIN\\nComment:        OrgTechHandle: DHANJ1-ARIN\\nComment:        RAbuseHandle: IAD3-ARIN\\nComment:        RTechHandle: WONGP6-ARIN\\nRegDate:        2004-05-27\\nUpdated:        2021-01-20\\nOrgAbuseHandle: SAT16-ARIN\\nOrgAdminHandle: KBR23-ARIN\\nOrgNOCHandle:   SAT16-ARIN\\nOrgTechHandle:  KBR23-ARIN\\nSource:         ARIN\\n\n\nPOCHandle:      SAT16-ARIN\\nIsRole:         Y\\nLastName:       Shadowplay Abuse Team\\nFirstName:      \\nStreet:         351 West Gore Street\\nCity:           Stratford\\nState/Prov:     ON\\nCountry:        CA\\nPostalCode:     N5A 1K9\\nRegDate:        2004-05-27\\nUpdated:        2020-12-04\\nOfficePhone:    +1-647-471-0043\\nOfficePhone:    +1-800-693-1419\\nMailbox:        abuse@shadowplay.net\\nSource:         ARIN\\n\n\nPOCHandle:      KBR23-ARIN\\nIsRole:         N\\nLastName:       Brown\\nFirstName:      Kenneth\\nStreet:         351 West Gore Street\\nCity:           Stratford\\nState/Prov:     ON\\nCountry:        CA\\nPostalCode:     N5A 1K9\\nRegDate:        2004-05-27\\nUpdated:        2020-12-04\\nOfficePhone:    +1-800-693-1419\\nOfficePhone:    +1-647-471-0043\\nMailbox:        shadowplay@shadowplay.net\\nSource:         ARIN\\n"}, {"range": "69.226.175.8/29", "id": "SBCIS-WYPR-692261758", "name": "Wayport, LLC", "country": "US", "domain": "wayport.net", "org_id": "WYPR", "status": "REASSIGNMENT", "tech_id": "WN25-ARIN", "mnt_id": "AWSN-ARIN", "admin_id": "WN25-ARIN", "abuse_id": "ABUSE670-ARIN", "created": "2004-09-22", "updated": "2004-09-22", "source": "arin", "raw": "NetHandle:      NET-69-226-175-8-1\\nOrgID:          WYPR\\nParent:         NET-69-224-0-0-1\\nNetName:        SBCIS-WYPR-692261758\\nNetRange:       69.226.175.8 - 69.226.175.15\\nNetType:        reassignment\\nRegDate:        2004-09-22\\nUpdated:        2004-09-22\\nAbuseHandle:    ABUSE670-ARIN\\nSource:         ARIN\\n\n\nOrgID:          WYPR\\nOrgName:        Wayport, LLC\\nCanAllocate:    \\nStreet:         4509 Freidrich Lane\\nStreet:         Building III, Suite 300\\nCity:           Austin\\nState/Prov:     TX\\nCountry:        US\\nPostalCode:     78744\\nRegDate:        1997-07-29\\nUpdated:        2020-09-24\\nReferralServer: rwhois://rwhois.wayport.net:4321\\nOrgAbuseHandle: ABUSE670-ARIN\\nOrgAdminHandle: WN25-ARIN\\nOrgNOCHandle:   AWSN-ARIN\\nOrgTechHandle:  WN25-ARIN\\nSource:         ARIN\\n\n\nPOCHandle:      ABUSE670-ARIN\\nIsRole:         Y\\nLastName:       Abuse\\nFirstName:      \\nStreet:         4509 Freidrich Ln\\nStreet:         Building 3, Ste 300\\nCity:           Austin\\nState/Prov:     TX\\nCountry:        US\\nPostalCode:     78744\\nRegDate:        2004-07-13\\nUpdated:        2021-12-09\\nOfficePhone:    +1-512-519-6000\\nMailbox:        abuse@wayport.net\\nSource:         ARIN\\n\n\nPOCHandle:      WN25-ARIN\\nIsRole:         Y\\nLastName:       ATT WiFi Services IT\\nFirstName:      \\nStreet:         4509 Freidrich Ln\\nStreet:         Building III, Suite 300\\nCity:           Austin\\nState/Prov:     TX\\nCountry:        US\\nPostalCode:     78744\\nRegDate:        2000-01-21\\nUpdated:        2021-12-09\\nFaxPhone:       +1-512-519-6450\\nOfficePhone:    +1-512-519-6000\\nMailbox:        arin-coordinator@wayport.net\\nSource:         ARIN\\n\n\nPOCHandle:      AWSN-ARIN\\nIsRole:         Y\\nLastName:       ATT WiFi Services NOC\\nFirstName:      \\nStreet:         4509 Freidrich Lane\\nStreet:         Building III, Suite 300\\nCity:           Austin\\nState/Prov:     TX\\nCountry:        US\\nPostalCode:     78744\\nRegDate:        2012-05-31\\nUpdated:        2014-05-01\\nOfficePhone:    +1-512-519-6000\\nMailbox:        noc-internal@wayport.net\\nSource:         ARIN\\n"}, {"range": "198.128.224.0/20", "id": "UCLLNL-VISITOR-NET", "name": "Lawrence Livermore National Laboratory", "country": "US", "domain": "llnl.gov", "org_id": "LLNL-1", "status": "REASSIGNMENT", "tech_id": "DNSAD268-ARIN", "mnt_id": "ENO88-ARIN\\NSIDHU24-ARIN", "admin_id": "GOLDS7-ARIN", "abuse_id": "DNSAD268-ARIN", "created": "2004-07-07", "updated": "2011-02-08", "source": "arin", "raw": "NetHandle:      NET-198-128-224-0-1\\nOrgID:          LLNL-1\\nParent:         NET-198-128-0-0-1\\nNetName:        UCLLNL-VISITOR-NET\\nNetRange:       198.128.224.0 - 198.128.239.255\\nNetType:        reassignment\\nRegDate:        2004-07-07\\nUpdated:        2011-02-08\\nSource:         ARIN\\n\n\nOrgID:          LLNL-1\\nOrgName:        Lawrence Livermore National Laboratory\\nCanAllocate:    \\nStreet:         P.O. Box 808\\nCity:           Livermore\\nState/Prov:     CA\\nCountry:        US\\nPostalCode:     94550\\nRegDate:        1970-01-01\\nUpdated:        2021-03-10\\nOrgAbuseHandle: DNSAD268-ARIN\\nOrgAdminHandle: GOLDS7-ARIN\\nOrgDNSHandle:   DNSAD268-ARIN\\nOrgNOCHandle:   ENO88-ARIN\\nOrgNOCHandle:   SIDHU24-ARIN\\nOrgTechHandle:  DNSAD268-ARIN\\nSource:         ARIN\\n\n\nPOCHandle:      GOLDS7-ARIN\\nIsRole:         N\\nLastName:       Goldstone\\nFirstName:      Robin\\nStreet:         7000 East Ave.\\nStreet:         L-561\\nCity:           Livermore\\nState/Prov:     CA\\nCountry:        US\\nPostalCode:     94550\\nRegDate:        2011-01-28\\nUpdated:        2020-03-10\\nMobilePhone:    +1-925-980-1821\\nOfficePhone:    +1-925-422-5832\\nMailbox:        goldstone1@llnl.gov\\nSource:         ARIN\\n\n\nPOCHandle:      DNSAD268-ARIN\\nIsRole:         Y\\nLastName:       DNS Admin\\nFirstName:      \\nStreet:         7000 East Ave.\\nCity:           Livermore\\nState/Prov:     CA\\nCountry:        US\\nPostalCode:     94550\\nRegDate:        2011-06-30\\nUpdated:        2021-03-10\\nOfficePhone:    +1-925-315-7108\\nMailbox:        dns-admin@llnl.gov\\nSource:         ARIN\\n\n\nPOCHandle:      SIDHU24-ARIN\\nIsRole:         N\\nLastName:       Sidhu\\nFirstName:      Harjot\\nStreet:         7000 East Ave M/S L-555\\nCity:           Livermore\\nState/Prov:     CA\\nCountry:        US\\nPostalCode:     94550\\nRegDate:        2019-03-11\\nUpdated:        2022-04-14\\nOfficePhone:    +1-925-422-5294\\nMailbox:        sidhu2@llnl.gov\\nSource:         ARIN\\n\n\nPOCHandle:      ENO88-ARIN\\nIsRole:         Y\\nLastName:       Enterprise Network Operations\\nFirstName:      \\nStreet:         7000 East Ave.\\nCity:           Livemore\\nState/Prov:     CA\\nCountry:        US\\nPostalCode:     94550\\nRegDate:        2011-01-28\\nUpdated:        2019-07-09\\nOfficePhone:    +1-925-422-0484\\nMailbox:        ens@lists.llnl.gov\\nSource:         ARIN\\n"}, {"range": "8.42.161.0/24", "id": "LPL-141-CLOUD14-8-42-161", "name": "Cloudflare, Inc.", "country": "US", "domain": "cloudflare.com", "org_id": "CLOUD14", "status": "REASSIGNMENT", "tech_id": "ADMIN2521-ARIN", "mnt_id": "CLOUD146-ARIN", "admin_id": "ADMIN2521-ARIN", "abuse_id": "ABUSE2916-ARIN", "created": "2019-06-12", "updated": "2019-06-12", "source": "arin", "raw": "NetHandle:      NET-8-42-161-0-1\\nOrgID:          CLOUD14\\nParent:         NET-8-0-0-0-1\\nNetName:        LPL-141-CLOUD14-8-42-161\\nNetRange:       8.42.161.0 - 8.42.161.255\\nNetType:        reassignment\\nOriginAS:       13335\\nRegDate:        2019-06-12\\nUpdated:        2019-06-12\\nSource:         ARIN\\n\n\nOrgID:          CLOUD14\\nOrgName:        Cloudflare, Inc.\\nCanAllocate:    \\nStreet:         101 Townsend Street\\nCity:           San Francisco\\nState/Prov:     CA\\nCountry:        US\\nPostalCode:     94107\\nRegDate:        2010-07-09\\nUpdated:        2021-07-01\\nOrgAbuseHandle: ABUSE2916-ARIN\\nOrgAdminHandle: ADMIN2521-ARIN\\nOrgNOCHandle:   CLOUD146-ARIN\\nOrgRoutingHandle:   CLOUD146-ARIN\\nOrgTechHandle:  ADMIN2521-ARIN\\nSource:         ARIN\\n\n\nPOCHandle:      ABUSE2916-ARIN\\nIsRole:         Y\\nLastName:       Abuse\\nFirstName:      \\nStreet:         101 Townsend Street\\nCity:           San Francisco\\nState/Prov:     CA\\nCountry:        US\\nPostalCode:     94107\\nRegDate:        2011-02-14\\nUpdated:        2020-04-23\\nOfficePhone:    +1-650-319-8930\\nMailbox:        abuse@cloudflare.com\\nSource:         ARIN\\n\n\nPOCHandle:      CLOUD146-ARIN\\nIsRole:         Y\\nLastName:       Cloudflare-NOC\\nFirstName:      \\nStreet:         101 Townsend St\\nCity:           San Francsico\\nState/Prov:     CA\\nCountry:        US\\nPostalCode:     94107\\nRegDate:        2021-07-01\\nUpdated:        2022-08-09\\nOfficePhone:    +1-650-319-8930\\nMailbox:        noc@cloudflare.com\\nSource:         ARIN\\n\n\nPOCHandle:      ADMIN2521-ARIN\\nIsRole:         Y\\nLastName:       Admin\\nFirstName:      \\nStreet:         101 Townsend Street\\nCity:           San Francisco\\nState/Prov:     CA\\nCountry:        US\\nPostalCode:     94107\\nRegDate:        2011-04-19\\nUpdated:        2022-01-20\\nOfficePhone:    +1-650-319-8930\\nMailbox:        rir@cloudflare.com\\nSource:         ARIN\\n"}, {"range": "23.160.0.0/24", "id": "TWITCH", "name": "Twitch Interactive Inc.", "country": "US", "domain": "twitch.tv", "org_id": "JUSTI-19", "status": "ALLOCATION", "tech_id": "TECH923-ARIN", "mnt_id": "NOC32246-ARIN", "admin_id": "ADMIN5658-ARIN", "abuse_id": "ABUSE5070-ARIN", "created": "2015-09-15", "updated": "2020-10-20", "source": "arin", "raw": "NetHandle:      NET-23-160-0-0-1\\nOrgID:          JUSTI-19\\nParent:         NET-23-0-0-0-0\\nNetName:        TWITCH\\nNetRange:       23.160.0.0 - 23.160.0.255\\nNetType:        allocation\\nOriginAS:       46489\\nRegDate:        2015-09-15\\nUpdated:        2020-10-20\\nSource:         ARIN\\n\n\nOrgID:          JUSTI-19\\nOrgName:        Twitch Interactive Inc.\\nCanAllocate:    \\nStreet:         225 Bush Street\\nStreet:         9th Floor\\nCity:           San Francisco\\nState/Prov:     CA\\nCountry:        US\\nPostalCode:     94104\\nRegDate:        2008-10-01\\nUpdated:        2021-01-06\\nOrgAbuseHandle: ABUSE5070-ARIN\\nOrgAdminHandle: ADMIN5658-ARIN\\nOrgNOCHandle:   NOC32246-ARIN\\nOrgTechHandle:  TECH923-ARIN\\nSource:         ARIN\\n\n\nPOCHandle:      ABUSE5070-ARIN\\nIsRole:         Y\\nLastName:       ABUSE\\nFirstName:      \\nStreet:         225 Bush St.\\nStreet:         Suite 600\\nCity:           San Francisco\\nState/Prov:     CA\\nCountry:        US\\nPostalCode:     94104\\nRegDate:        2015-04-23\\nUpdated:        2022-01-07\\nOfficePhone:    +1-571-358-8662\\nMailbox:        abuse@amazonaws.com\\nSource:         ARIN\\n\n\nPOCHandle:      ADMIN5658-ARIN\\nIsRole:         Y\\nLastName:       ADMIN\\nFirstName:      \\nStreet:         350 Bush Street \\nStreet:         Suite 200\\nCity:           San Francisco\\nState/Prov:     CA\\nCountry:        US\\nPostalCode:     94104\\nRegDate:        2015-03-10\\nUpdated:        2021-10-05\\nOfficePhone:    +1-571-358-8662\\nMailbox:        noc@twitch.tv\\nMailbox:        ipmanagement@twitch.tv\\nSource:         ARIN\\n\n\nPOCHandle:      TECH923-ARIN\\nIsRole:         Y\\nLastName:       TECH\\nFirstName:      \\nStreet:         350 Bush Street\\nStreet:         Suite 200\\nCity:           San Francisco\\nState/Prov:     CA\\nCountry:        US\\nPostalCode:     94104\\nRegDate:        2015-04-23\\nUpdated:        2021-12-14\\nOfficePhone:    +1-571-358-8662\\nMailbox:        noc@twitch.tv\\nSource:         ARIN\\n\n\nPOCHandle:      NOC32246-ARIN\\nIsRole:         Y\\nLastName:       NOC\\nFirstName:      \\nStreet:         350 Bush Street\\nStreet:         Suite 200\\nCity:           San Francisco\\nState/Prov:     CA\\nCountry:        US\\nPostalCode:     94104\\nRegDate:        2015-03-10\\nUpdated:        2021-12-14\\nOfficePhone:    +1-571-358-8662\\nMailbox:        noc@twitch.tv\\nSource:         ARIN\\n"}, {"range": "67.133.40.216/29", "id": "Q0322-67-133-40-216", "name": "NORPAC FOODS INC", "country": "US", "domain": "norpac.com", "org_id": "NORPA-1", "status": "REASSIGNMENT", "tech_id": "SCA235-ARIN", "mnt_id": "SCA235-ARIN", "admin_id": "SCA235-ARIN", "abuse_id": "SCA235-ARIN", "created": "2010-03-22", "updated": "2010-03-22", "source": "arin", "raw": "NetHandle:      NET-67-133-40-216-1\\nOrgID:          NORPA-1\\nParent:         NET-67-128-0-0-1\\nNetName:        Q0322-67-133-40-216\\nNetRange:       67.133.40.216 - 67.133.40.223\\nNetType:        reassignment\\nOriginAS:       209\\nRegDate:        2010-03-22\\nUpdated:        2010-03-22\\nAbuseHandle:    SCA235-ARIN\\nNOCHandle:      SCA235-ARIN\\nSource:         ARIN\\n\n\nOrgID:          NORPA-1\\nOrgName:        NORPAC FOODS INC\\nCanAllocate:    \\nStreet:         4350 SW GALEWOOD ST\\nStreet:         BLDG MAIN FLR MAIN RM 1\\nCity:           LAKE OSWEGO\\nState/Prov:     OR\\nCountry:        US\\nPostalCode:     97035\\nRegDate:        2010-03-22\\nUpdated:        2011-09-24\\nOrgAbuseHandle: SCA235-ARIN\\nOrgAdminHandle: SCA235-ARIN\\nOrgTechHandle:  SCA235-ARIN\\nSource:         ARIN\\n\n\nPOCHandle:      SCA235-ARIN\\nIsRole:         N\\nLastName:       CARR\\nFirstName:      SUSIE\\nStreet:         4350 SW GALEWOOD ST\\nStreet:         BLDG MAIN FLR MAIN RM 1\\nCity:           LAKE OSWEGO\\nState/Prov:     OR\\nCountry:        US\\nPostalCode:     97035\\nRegDate:        2010-03-22\\nUpdated:        2010-03-22\\nOfficePhone:    +1-503-454-7362\\nMailbox:        s.carr@gotechnocom.com\\nSource:         ARIN\\n"}, {"range": "65.158.162.152/29", "id": "Q1118-65-158-162-152", "name": "AERUS LLC", "country": "US", "domain": "aerushome.com", "org_id": "AL-804", "status": "REASSIGNMENT", "tech_id": "WEBBM37-ARIN", "mnt_id": "WEBBM37-ARIN", "admin_id": "WEBBM37-ARIN", "abuse_id": "WEBBM37-ARIN", "created": "2015-11-19", "updated": "2015-11-19", "source": "arin", "raw": "NetHandle:      NET-65-158-162-152-1\\nOrgID:          AL-804\\nParent:         NET-65-128-0-0-1\\nNetName:        Q1118-65-158-162-152\\nNetRange:       65.158.162.152 - 65.158.162.159\\nNetType:        reassignment\\nOriginAS:       209\\nRegDate:        2015-11-19\\nUpdated:        2015-11-19\\nSource:         ARIN\\n\n\nOrgID:          AL-804\\nOrgName:        AERUS LLC\\nCanAllocate:    \\nStreet:         300 E VALLEY DR\\nCity:           BRISTOL\\nState/Prov:     VA\\nCountry:        US\\nPostalCode:     24201\\nRegDate:        2015-08-28\\nUpdated:        2022-07-18\\nOrgAbuseHandle: WEBBM37-ARIN\\nOrgAdminHandle: WEBBM37-ARIN\\nOrgDNSHandle:   WEBBM37-ARIN\\nOrgNOCHandle:   WEBBM37-ARIN\\nOrgRoutingHandle:   WEBBM37-ARIN\\nOrgTechHandle:  WEBBM37-ARIN\\nSource:         ARIN\\n\n\nPOCHandle:      WEBBM37-ARIN\\nIsRole:         N\\nLastName:       Webb\\nFirstName:      Matthew\\nStreet:         1300 East Valley Drive\\nCity:           Bristol\\nState/Prov:     VA\\nCountry:        US\\nPostalCode:     24201\\nRegDate:        2022-07-18\\nUpdated:        2022-07-18\\nOfficePhone:    +1-276-645-2660\\nMailbox:        mwebb@aerusonline.com\\nSource:         ARIN\\n"}, {"range": "23.174.0.0/23", "id": "LOOP-INTERNET", "name": "Loop Internet", "country": "US", "domain": "loopinternet.com", "org_id": "VCL-88", "status": "ALLOCATION", "tech_id": "HACKE16-ARIN", "mnt_id": "HACKE16-ARIN", "admin_id": "HACKE16-ARIN", "abuse_id": "HACKE16-ARIN", "created": "2016-04-05", "updated": "2018-03-07", "source": "arin", "raw": "NetHandle:      NET-23-174-0-0-1\\nOrgID:          VCL-88\\nParent:         NET-23-0-0-0-0\\nNetName:        LOOP-INTERNET\\nNetRange:       23.174.0.0 - 23.174.1.255\\nNetType:        allocation\\nOriginAS:       394868, 6461\\nComment:        https://loopinternet.com\\nRegDate:        2016-04-05\\nUpdated:        2018-03-07\\nSource:         ARIN\\n\n\nOrgID:          VCL-88\\nOrgName:        Loop Internet\\nCanAllocate:    \\nStreet:         67-69 Public Square, Suite 600\\nCity:           Wilkes-Barre\\nState/Prov:     PA\\nCountry:        US\\nPostalCode:     18701\\nComment:        https://loopinternet.com\\nRegDate:        2015-12-07\\nUpdated:        2018-03-30\\nOrgAbuseHandle: HACKE16-ARIN\\nOrgAdminHandle: HACKE16-ARIN\\nOrgNOCHandle:   HACKE16-ARIN\\nOrgTechHandle:  HACKE16-ARIN\\nSource:         ARIN\\n\n\nPOCHandle:      HACKE16-ARIN\\nIsRole:         N\\nLastName:       Hacken\\nFirstName:      Christopher\\nStreet:         67 Public Square, Suite 600\\nCity:           Wilkes-Barre\\nState/Prov:     PA\\nCountry:        US\\nPostalCode:     18711\\nRegDate:        2014-12-13\\nUpdated:        2022-02-03\\nOfficePhone:    +1-888-333-8099\\nMailbox:        info@loopinternet.com\\nSource:         ARIN\\n"}, {"range": "158.51.225.0/24", "id": "NGA911-IP4-01", "name": "NGA 911", "country": "US", "domain": "nga911.com", "org_id": "NL-721", "status": "ALLOCATION", "tech_id": "ASHTA-ARIN\\NFERGU654-ARIN\\NLEMON76-ARIN\\NMARTI3187-ARIN\\NVEAED1-ARIN", "mnt_id": "VEAED1-ARIN", "admin_id": "BLAND107-ARIN", "abuse_id": "VEAED1-ARIN", "created": "2020-01-17", "updated": "2020-01-17", "source": "arin", "raw": "NetHandle:      NET-158-51-225-0-1\\nOrgID:          NL-721\\nParent:         NET-158-0-0-0-0\\nNetName:        NGA911-IP4-01\\nNetRange:       158.51.225.0 - 158.51.225.255\\nNetType:        allocation\\nComment:        -----BEGIN CERTIFICATE-----MIID+TCCAuGgAwIBAgIJAOx3V+vnM1HEMA0GCSqGSIb3DQEBCwUAMIGSMQswCQYDVQQGEwJVUzELMAkGA1UECAwCQ0ExFjAUBgNVBAcMDUJldmVybHkgSGlsbHMxDzANBgNVBAoMBk5HQTkxMTEWMBQGA1UECwwNTkdBOTExLUlQNC0wMTEPMA0GA1UEAwwGTkdBOTExMSQwIgYJKoZIhvcNAQkBFhVtYXJrbGVtb25uQG5nYTkxMS5jb20wHhcNMjAwMTIxMTQ0NTU0WhcNMjIwMTIwMTQ0NTU0WjCBkjELMAkGA1UEBhMCVVMxCzAJBgNVBAgMAkNBMRYwFAYDVQQHDA1CZXZlcmx5IEhpbGxzMQ8wDQYDVQQKDAZOR0E5MTExFjAUBgNVBAsMDU5HQTkxMS1JUDQtMDExDzANBgNVBAMMBk5HQTkxMTEkMCIGCSqGSIb3DQEJARYVbWFya2xlbW9ubkBuZ2E5MTEuY29tMIIBIjANBgkqhkiG9w0BAQEFAAOCAQ8AMIIBCgKCAQEA0/K8P7BOWJtklmZAF/Dp3tl/GymaBbZJldGJaDVlP6a4lXOdt4cOl59MflW03e7BmGt4v6DAMGUjdsiPlfaLBEK8rQMORtAJr3ryuUt30pBnxr5GkHac7jzNWe0QMh4kxVoHPJski0G9Zgzgfz7zhnyrxLpOEzECW1JeBApeh3lC281zUaQhiL54bGaewIB9q+0tqmUlBip+rUlOrzbtAtn1YurAyeyUjzYlrEWu3ROsrGlnX+4AEuMFeMk8T2/bagxGv+j8t5fBYI3tDx5NV+siywk1eKiZsZ8Z94qjJQVVdC1bK3hl64o5X1d5HmDrPom87kN7Sy06AUK7r023WwIDAQABo1AwTjAdBgNVHQ4EFgQUR8+JkE70tjM7wM7IZ1BBlzzRB/swHwYDVR0jBBgwFoAUR8+JkE70tjM7wM7IZ1BBlzzRB/swDAYDVR0TBAUwAwEB/zANBgkqhkiG9w0BAQsFAAOCAQEAaOubeAGin1RaaTQFUCgEmniNfkZfyYFWNIwSmDQyrlhyLJndgWuS4e0umnccYd0e2w7W/tHHjBPJo7K811c0aGugSeIVB9brUSkJDtJF+1DIA3MRnLxD1VPnKvcsnQX2joUtXvl41L4WfQbBEfIAmicF13vj6pmBhdMwoLLnR4lUXah5RC0ISpt/KPjiB1Wnf5LIEDGntABDm0Qku9eWF5m3qVJ6j1CgK7MRYeKOYBJ1T1KeU4LHJTBr9B50otmadGY7nPQjVcx68iqpxzW3xgEMylwSVq0oxORdMV3otsE7ufQatI5/1gG4cjoJHFtqA9IrMR9xNw0lT+6b5crotw==-----END CERTIFICATE-----\\nRegDate:        2020-01-17\\nUpdated:        2020-01-17\\nSource:         ARIN\\n\n\nOrgID:          NL-721\\nOrgName:        NGA 911\\nCanAllocate:    \\nStreet:         8383 Wilshire Blvd, Suite 800\\nCity:           Beverly Hills\\nState/Prov:     CA\\nCountry:        US\\nPostalCode:     90211\\nRegDate:        2019-11-25\\nUpdated:        2021-03-19\\nOrgAbuseHandle: VEAED1-ARIN\\nOrgAdminHandle: BLAND107-ARIN\\nOrgDNSHandle:   LEMON76-ARIN\\nOrgNOCHandle:   VEAED1-ARIN\\nOrgRoutingHandle:   LEMON76-ARIN\\nOrgTechHandle:  ASHTA-ARIN\\nOrgTechHandle:  FERGU654-ARIN\\nOrgTechHandle:  LEMON76-ARIN\\nOrgTechHandle:  MARTI3187-ARIN\\nOrgTechHandle:  VEAED1-ARIN\\nSource:         ARIN\\n\n\nPOCHandle:      VEAED1-ARIN\\nIsRole:         N\\nLastName:       Vea\\nFirstName:      Ed\\nStreet:         8383 Wilshire Blvd, Suite 800\\nCity:           Beverly Hills\\nState/Prov:     CA\\nCountry:        US\\nPostalCode:     90211\\nRegDate:        2019-12-12\\nUpdated:        2022-03-26\\nOfficePhone:    +1-605-646-3832\\nMailbox:        Ed@nga911.com\\nSource:         ARIN\\n\n\nPOCHandle:      FERGU654-ARIN\\nIsRole:         N\\nLastName:       Ferguson\\nFirstName:      Don\\nStreet:         8383 Wilshire Blvd, Suite 800\\nCity:           Beverly Hills\\nState/Prov:     CA\\nCountry:        US\\nPostalCode:     90211\\nRegDate:        2019-12-12\\nUpdated:        2021-12-17\\nOfficePhone:    +1-213-284-1480\\nMailbox:        don@nga911.com\\nSource:         ARIN\\n\n\nPOCHandle:      BLAND107-ARIN\\nIsRole:         N\\nLastName:       Bland\\nFirstName:      Michelle\\nStreet:         8383 Wilshire Blvd, Suite 800\\nCity:           Beverly Hills\\nState/Prov:     CA\\nCountry:        US\\nPostalCode:     90211\\nRegDate:        2019-11-22\\nUpdated:        2021-03-19\\nMobilePhone:    +1-916-862-3373\\nOfficePhone:    +1-877-899-8337\\nMailbox:        Michelle@nga911.com\\nSource:         ARIN\\n\n\nPOCHandle:      LEMON76-ARIN\\nIsRole:         N\\nLastName:       LeMonn\\nFirstName:      Mark\\nStreet:         8383 Wilshire Blvd, Suite 800\\nCity:           Beverly Hills\\nState/Prov:     CA\\nCountry:        US\\nPostalCode:     90211\\nRegDate:        2019-12-12\\nUpdated:        2019-12-12\\nOfficePhone:    +1-916-220-8112\\nMailbox:        marklemonn@nga911.com\\nSource:         ARIN\\n\n\nPOCHandle:      MARTI3187-ARIN\\nIsRole:         N\\nLastName:       Martinez\\nFirstName:      Miguel\\nStreet:         8383 Wilshire Blvd, Suite 800\\nCity:           Beverly Hills\\nState/Prov:     CA\\nCountry:        US\\nPostalCode:     90211\\nRegDate:        2019-11-22\\nUpdated:        2021-11-22\\nMobilePhone:    +1-760-492-4817\\nOfficePhone:    +1-877-899-8337\\nMailbox:        Miguel@nga911.com\\nSource:         ARIN\\n\n\nPOCHandle:      ASHTA-ARIN\\nIsRole:         N\\nLastName:       Ashtaev\\nFirstName:      Alexey\\nStreet:         8383 Wilshire Blvd, Suite 800\\nStreet:         Beverly Hills, CA 90211\\nStreet:         United States\\nCity:           Beverly Hills\\nState/Prov:     CA\\nCountry:        US\\nPostalCode:     90211\\nRegDate:        2021-03-19\\nUpdated:        2022-03-21\\nOfficePhone:    +1-877-899-8337\\nMailbox:        alexey.ashtaev@nga911.com\\nSource:         ARIN\\n"}, {"range": "207.174.117.0/24", "id": "RKCI", "name": "Massive Networks", "country": "US", "domain": "massivenetworks.com", "org_id": "RKCI", "status": "ALLOCATION", "tech_id": "LEWIN9-ARIN", "mnt_id": "PM1080-ARIN", "admin_id": "PM1893-ARIN", "abuse_id": "ABUSE7475-ARIN", "created": "2022-03-24", "updated": "2022-03-24", "source": "arin", "raw": "NetHandle:      NET-207-174-117-0-2\\nOrgID:          RKCI\\nParent:         NET-207-0-0-0-0\\nNetName:        RKCI\\nNetRange:       207.174.117.0 - 207.174.117.255\\nNetType:        allocation\\nRegDate:        2022-03-24\\nUpdated:        2022-03-24\\nSource:         ARIN\\n\n\nOrgID:          RKCI\\nOrgName:        Massive Networks\\nCanAllocate:    \\nStreet:         382 S. Arthur Ave\\nStreet:         Ste 120\\nCity:           Louisville\\nState/Prov:     CO\\nCountry:        US\\nPostalCode:     80027\\nRegDate:        1996-08-08\\nUpdated:        2019-04-17\\nOrgAbuseHandle: ABUSE7475-ARIN\\nOrgAdminHandle: PM1893-ARIN\\nOrgNOCHandle:   PM1080-ARIN\\nOrgTechHandle:  LEWIN9-ARIN\\nSource:         ARIN\\n\n\nPOCHandle:      LEWIN9-ARIN\\nIsRole:         N\\nLastName:       Lewinski\\nFirstName:      Mike\\nStreet:         382 S. Arthur Ave\\nStreet:         Suite 120\\nCity:           Louisville\\nState/Prov:     CO\\nCountry:        US\\nPostalCode:     80027\\nRegDate:        2016-02-16\\nUpdated:        2022-02-18\\nOfficePhone:    +1-303-629-2860\\nMailbox:        mlewinski@massivenetworks.com\\nSource:         ARIN\\n\n\nPOCHandle:      PM1893-ARIN\\nIsRole:         N\\nLastName:       mako\\nFirstName:      paul\\nStreet:         382 S. Arthur Ave\\nCity:           Louisville\\nState/Prov:     CO\\nCountry:        US\\nPostalCode:     80027\\nRegDate:        1996-11-20\\nUpdated:        2021-09-16\\nOfficePhone:    +1-303-629-2850\\nMailbox:        pmako@massivenetworks.com\\nSource:         ARIN\\n\n\nPOCHandle:      PM1080-ARIN\\nIsRole:         N\\nLastName:       Mako\\nFirstName:      Paul\\nStreet:         382 S. Arthur Ave #120\\nCity:           Louisville\\nState/Prov:     CO\\nCountry:        US\\nPostalCode:     80027\\nRegDate:        1996-04-29\\nUpdated:        2022-04-17\\nOfficePhone:    +1-303-800-1300\\nMailbox:        support@massivenetworks.com\\nSource:         ARIN\\n\n\nPOCHandle:      ABUSE7475-ARIN\\nIsRole:         Y\\nLastName:       Abuse Department\\nFirstName:      \\nStreet:         382 S. Arthur Ave\\nStreet:         Suite 120\\nCity:           Louisville\\nState/Prov:     CO\\nCountry:        US\\nPostalCode:     80027\\nRegDate:        2019-04-17\\nUpdated:        2022-04-17\\nOfficePhone:    +1-303-800-1300\\nMailbox:        abuse@massivenetworks.com\\nSource:         ARIN\\n"}, {"range": "216.177.96.0/19", "id": "COGENT-ANET-0007", "name": "Cogent Communications", "country": "US", "domain": "cogentcomm.biz", "org_id": "COGC", "status": "ALLOCATION", "tech_id": "IPALL-ARIN", "mnt_id": "ZC108-ARIN", "admin_id": "IPALL-ARIN", "abuse_id": "COGEN-ARIN", "created": "2000-09-27", "updated": "2012-03-02", "source": "arin", "raw": "NetHandle:      NET-216-177-96-0-1\\nOrgID:          COGC\\nParent:         NET-216-0-0-0-0\\nNetName:        COGENT-ANET-0007\\nNetRange:       216.177.96.0 - 216.177.127.255\\nNetType:        allocation\\nOriginAS:       174\\nRegDate:        2000-09-27\\nUpdated:        2012-03-02\\nSource:         ARIN\\n\n\nOrgID:          COGC\\nOrgName:        Cogent Communications\\nCanAllocate:    \\nStreet:         2450 N Street NW\\nCity:           Washington\\nState/Prov:     DC\\nCountry:        US\\nPostalCode:     20037\\nRegDate:        2000-05-30\\nUpdated:        2021-06-27\\nReferralServer: rwhois://rwhois.cogentco.com:4321\\nOrgAbuseHandle: COGEN-ARIN\\nOrgAdminHandle: IPALL-ARIN\\nOrgNOCHandle:   ZC108-ARIN\\nOrgTechHandle:  IPALL-ARIN\\nSource:         ARIN\\n\n\nPOCHandle:      COGEN-ARIN\\nIsRole:         Y\\nLastName:       Cogent Abuse\\nFirstName:      \\nStreet:         2450 N street, NW\\nCity:           Washington\\nState/Prov:     DC\\nCountry:        US\\nPostalCode:     20037\\nRegDate:        2002-11-13\\nUpdated:        2022-07-07\\nOfficePhone:    +1-877-875-4311\\nMailbox:        abuse@cogentco.com\\nSource:         ARIN\\n\n\nPOCHandle:      IPALL-ARIN\\nIsRole:         Y\\nLastName:       IP Allocation\\nFirstName:      \\nStreet:         2450 N Street NW\\nCity:           Washington\\nState/Prov:     DC\\nCountry:        US\\nPostalCode:     20037\\nRegDate:        2002-11-13\\nUpdated:        2022-07-07\\nOfficePhone:    +1-877-875-4311\\nMailbox:        ipalloc@cogentco.com\\nSource:         ARIN\\n\n\nPOCHandle:      ZC108-ARIN\\nIsRole:         Y\\nLastName:       Cogent Communications\\nFirstName:      \\nStreet:         2450 N Street NW\\nCity:           Washington\\nState/Prov:     DC\\nCountry:        US\\nPostalCode:     20037\\nRegDate:        2001-01-24\\nUpdated:        2022-07-07\\nOfficePhone:    +1-877-875-4311\\nMailbox:        noc@cogentco.com\\nSource:         ARIN\\n"}, {"range": "204.197.0.0/17", "id": "ME-K12-LIB", "name": "University of Maine System", "country": "US", "domain": "maine.edu", "org_id": "ME", "status": "ALLOCATION", "tech_id": "IKA-ARIN", "mnt_id": "UCC-ARIN", "admin_id": "IKA-ARIN", "abuse_id": "IKA-ARIN", "created": "2009-08-04", "updated": "2012-03-20", "source": "arin", "raw": "NetHandle:      NET-204-197-0-0-1\\nOrgID:          ME\\nParent:         NET-204-0-0-0-0\\nNetName:        ME-K12-LIB\\nNetRange:       204.197.0.0 - 204.197.127.255\\nNetType:        allocation\\nOriginAS:       557\\nRegDate:        2009-08-04\\nUpdated:        2012-03-20\\nAbuseHandle:    NAR5-ARIN\\nNOCHandle:      UCC-ARIN\\nTechHandle:     IKA-ARIN\\nSource:         ARIN\\n\n\nOrgID:          ME\\nOrgName:        University of Maine System\\nCanAllocate:    \\nStreet:         c/o ITS Computing Center\\nStreet:         5752 Neville Hall\\nStreet:         Attn: Jeffrey Letourneau\\nStreet:         University of Maine System\\nCity:           Orono\\nState/Prov:     ME\\nCountry:        US\\nPostalCode:     04469\\nRegDate:        1996-05-16\\nUpdated:        2019-12-11\\nReferralServer: rwhois://named.its.maine.edu:4321\\nOrgAbuseHandle: IKA-ARIN\\nOrgAdminHandle: IKA-ARIN\\nOrgNOCHandle:   UCC-ARIN\\nOrgRoutingHandle:   PEIRC1-ARIN\\nOrgTechHandle:  IKA-ARIN\\nOrgTechHandle:  PEIRC1-ARIN\\nSource:         ARIN\\n\n\nPOCHandle:      IKA-ARIN\\nIsRole:         N\\nLastName:       Anderson\\nFirstName:      Irelann\\nStreet:         ITS Computing Center\\nStreet:         5752 Neville Hall\\nCity:           Orono\\nState/Prov:     ME\\nCountry:        US\\nPostalCode:     04469-5752\\nRegDate:        1970-01-01\\nUpdated:        2022-01-20\\nOfficePhone:    +1-207-581-3508\\nMailbox:        ika@maine.edu\\nSource:         ARIN\\n\n\nPOCHandle:      PEIRC1-ARIN\\nIsRole:         N\\nLastName:       Peirce\\nFirstName:      Garry\\nStreet:         ITS \\nStreet:         5752 Computing Center\\nStreet:         Neville Hall\\nCity:           Orono\\nState/Prov:     ME\\nCountry:        US\\nPostalCode:     04469\\nRegDate:        2012-07-26\\nUpdated:        2021-12-14\\nOfficePhone:    +1-207-581-3539\\nMobilePhone:    +1-207-949-4229\\nMailbox:        peirce@maine.edu\\nSource:         ARIN\\n\n\nPOCHandle:      UCC-ARIN\\nIsRole:         Y\\nLastName:       UNET Computing Center\\nFirstName:      \\nStreet:         ITS Computing Center\\nStreet:         5752 Neville Hall\\nStreet:         University of Maine System\\nCity:           Orono\\nState/Prov:     ME\\nCountry:        US\\nPostalCode:     04469-5752\\nRegDate:        2002-10-09\\nUpdated:        2022-06-21\\nOfficePhone:    +1-207-581-3587\\nMailbox:        MSLN@lists.maine.edu\\nSource:         ARIN\\n\n\nPOCHandle:      NAR5-ARIN\\nIsRole:         Y\\nLastName:       Network Abuse Reports\\nFirstName:      \\nStreet:         ITS Computing Center\\nStreet:         University of Maine\\nCity:           Orono\\nState/Prov:     ME\\nCountry:        US\\nPostalCode:     04469\\nRegDate:        2004-01-22\\nUpdated:        2021-12-29\\nOfficePhone:    +1-207-581-3587\\nMailbox:        abuse@maine.edu\\nSource:         ARIN\\n"}, {"range": "23.249.208.0/20", "id": "AWSEMAIL", "name": "Amazon Web Services, Inc.", "country": "US", "domain": "amazon.com", "org_id": "AMAZO-22", "status": "ALLOCATION", "tech_id": "ANO24-ARIN", "mnt_id": "AANO1-ARIN", "admin_id": "IPMAN40-ARIN", "abuse_id": "ASA152-ARIN", "created": "2018-10-11", "updated": "2019-03-29", "source": "arin", "raw": "NetHandle:      NET-23-249-208-0-1\\nOrgID:          AMAZO-22\\nParent:         NET-23-0-0-0-0\\nNetName:        AWSEMAIL\\nNetRange:       23.249.208.0 - 23.249.223.255\\nNetType:        allocation\\nOriginAS:       16509\\nComment:        -----BEGIN CERTIFICATE-----MIIDajCCAlKgAwIBAgITUwyH9tjWZYpnSnCnhy7TPJrCZTANBgkqhkiG9w0BAQsFADBFMQswCQYDVQQGEwJBVTETMBEGA1UECAwKU29tZS1TdGF0ZTEhMB8GA1UECgwYSW50ZXJuZXQgV2lkZ2l0cyBQdHkgTHRkMB4XDTIwMDEyMzE3MzAwNloXDTIxMDEyMjE3MzAwNlowRTELMAkGA1UEBhMCQVUxEzARBgNVBAgMClNvbWUtU3RhdGUxITAfBgNVBAoMGEludGVybmV0IFdpZGdpdHMgUHR5IEx0ZDCCASIwDQYJKoZIhvcNAQEBBQADggEPADCCAQoCggEBALtBCLecdfkioVusN6S3asJK+SiXyeRMBzmf0Vcfed0AsK4RMV718Xxk531xHtl2cUuwzx8lty191xsgraXSSFlIJT2XF+IZaaUMVZrKlg4pvPrjw/S+NDuEjyn+aZxAlNE7GG5/YWjFYGtNghL/OUhpG8jVmrAo4UVLFEK/aomvcFwUpbv5s9Cj0PATvDBMVrXB4p4RQOzWcVcn8xMN59+fGeRtQBSmamvBELpW/4sJDnwYixgigUMSzG1CHCZHTJPFyhRK4xDXWTA02bs4+ajo7I/2WiGXAiPBI+U36yqLLlXdBb4fNzLO/DTNUWNNy3LgWTFtGX8UtNXrlHQDDyECAwEAAaNTMFEwHQYDVR0OBBYEFKWKhVQO5yrkFMcOsgdIozyhGd/OMB8GA1UdIwQYMBaAFKWKhVQO5yrkFMcOsgdIozyhGd/OMA8GA1UdEwEB/wQFMAMBAf8wDQYJKoZIhvcNAQELBQADggEBAGDMRLlYGB8X2rFK6i9beMofZmGlnaV4eWLSzY9Xp4ma+Sdd6MgGxTFh2iS1i1SYRcyyRoxPu4pydsU2HGaFD2NiVQ7np3Twv613yYxDv/EFDrqEt3/mFv4HEUlIBxyvLRJM8KK31AnUpl5AlO1akR1GKGypeTUiyRdiEo1FwZgljnSsxLO+iJc0ZCHkv2SciN5x5FnfpNeWHIPvHL9VydXgejUwaCL0C3Ad4OhqqkJfTytg5ysIJa5tfMTzZ28HmP5wUKKaEDbsnGFWDsyMaB7onn9sTlMfvaXDED7Cq3hCYUe64U9lTEElWtJNXtgTgl/fR/siyk+zz7S5SRgBlVo=-----END CERTIFICATE-----\\nComment:        -----BEGIN CERTIFICATE-----MIIDazCCAlOgAwIBAgIUagR7afRHNPknSo9ebBmKSCEmFE0wDQYJKoZIhvcNAQELBQAwRTELMAkGA1UEBhMCQVUxEzARBgNVBAgMClNvbWUtU3RhdGUxITAfBgNVBAoMGEludGVybmV0IFdpZGdpdHMgUHR5IEx0ZDAeFw0yMDAxMjMxNzM0MDdaFw0yMTAxMjIxNzM0MDdaMEUxCzAJBgNVBAYTAkFVMRMwEQYDVQQIDApTb21lLVN0YXRlMSEwHwYDVQQKDBhJbnRlcm5ldCBXaWRnaXRzIFB0eSBMdGQwggEiMA0GCSqGSIb3DQEBAQUAA4IBDwAwggEKAoIBAQDTrm076VcYYm+DOPvqrQyB2GKf+Q8PXYNT8Ju9QHg9huR/22U09ZEa+xVee/fRliWf/EDFBt2FZBP0kZv9tPO2j0dbVxTsNHXOOBfJPtWHE0i6jJ7NBZKxhSRu6n70BfLsQ5tetFqFml55pBa0wogY0DWiYCE9H3MRKxTaNkaSvr39JqeixNCmCUCmu+wa/4oZ7jZgHvpeKdvG5cgno1KSVF5GIoxA3R9CiDBmnLCFNROzW86SXLpPjl2v1KH58fpyXM2CpCT4rnlxJvJBmGrTS/Pp2nZVIu9zXjn/zLO27zYwPaY0uIu2jD0XQeQT0UOQGQK9CtJrqqrI7JeKYjQTAgMBAAGjUzBRMB0GA1UdDgQWBBQUvnCDKit+gDibasBxQQh6Y2G4QzAfBgNVHSMEGDAWgBQUvnCDKit+gDibasBxQQh6Y2G4QzAPBgNVHRMBAf8EBTADAQH/MA0GCSqGSIb3DQEBCwUAA4IBAQAdafKom/7eCnfmbXV9uvtidmO7e1AjjwLuca8FAQRm7GY36dUAf2xDtnqWadpX59gymqV251wuuUyWypGtNSpY84ZHJ2++hhryFG2VYIKAlz3ao0OQl6KQfRstl+r7BYj9+QT4fwsYrFOACa2zCj4y1NJeJIOi7+Y2zrcofSaoqgAcE9ArV0ojBrQM7IBZUBkWGPmog4PMDA2TUR5UNV6k97fwelv1asbtiGhvysE/cLnN4CfTiNl2qD7HgqZeGrX+zPFiIe20DTIMGk0WxPmSd9HmZ72G6Qke21Tr0Ko0ctaHUaeG71UrBod5nT/onc/BXnPXymRnTMaYnHva0N90-----END CERTIFICATE-----\\nRegDate:        2018-10-11\\nUpdated:        2019-03-29\\nSource:         ARIN\\n\n\nOrgID:          AMAZO-22\\nOrgName:        Amazon Web Services, Inc.\\nCanAllocate:    \\nStreet:         Amazon Web Services\\nStreet:         1200 12th Avenue South\\nCity:           Seattle\\nState/Prov:     WA\\nCountry:        US\\nPostalCode:     98144\\nRegDate:        2010-03-08\\nUpdated:        2021-07-22\\nOrgAbuseHandle: ASA152-ARIN\\nOrgAdminHandle: IPMAN40-ARIN\\nOrgNOCHandle:   AANO1-ARIN\\nOrgRoutingHandle:   ARMP-ARIN\\nOrgRoutingHandle:   IPROU3-ARIN\\nOrgTechHandle:  ANO24-ARIN\\nSource:         ARIN\\n\n\nPOCHandle:      IPMAN40-ARIN\\nIsRole:         Y\\nLastName:       IP Management\\nFirstName:      \\nStreet:         1918 8th Ave\\nCity:           Seattle\\nState/Prov:     WA\\nCountry:        US\\nPostalCode:     98109\\nRegDate:        2013-11-12\\nUpdated:        2022-03-31\\nOfficePhone:    +1-206-266-4064\\nMailbox:        ipmanagement@amazon.com\\nSource:         ARIN\\n\n\nPOCHandle:      ASA152-ARIN\\nIsRole:         Y\\nLastName:       Amazon SES Abuse\\nFirstName:      \\nStreet:         PO Box 81226\\nCity:           Seattle\\nState/Prov:     WA\\nCountry:        US\\nPostalCode:     98108\\nRegDate:        2015-03-09\\nUpdated:        2022-06-22\\nOfficePhone:    +1-206-741-3696\\nMailbox:        email-abuse@amazon.com\\nSource:         ARIN\\n\n\nPOCHandle:      ANO24-ARIN\\nIsRole:         Y\\nLastName:       Amazon EC2 Network Operations\\nFirstName:      \\nStreet:         PO BOX 81226\\nCity:           Seattle\\nState/Prov:     WA\\nCountry:        US\\nPostalCode:     98108-1226\\nRegDate:        2005-09-19\\nUpdated:        2022-03-31\\nOfficePhone:    +1-206-266-4064\\nMailbox:        amzn-noc-contact@amazon.com\\nSource:         ARIN\\n\n\nPOCHandle:      AANO1-ARIN\\nIsRole:         Y\\nLastName:       Amazon AWS Network Operations\\nFirstName:      \\nStreet:         410 Terry Ave N\\nCity:           Seattle\\nState/Prov:     WA\\nCountry:        US\\nPostalCode:     98109\\nRegDate:        2010-03-04\\nUpdated:        2022-06-22\\nOfficePhone:    +1-206-266-4064\\nMailbox:        amzn-noc-contact@amazon.com\\nSource:         ARIN\\n"}, {"range": "205.241.46.0/24", "id": "SPRINTLINK", "name": "MICROPACT ENGINEERING, INC.", "country": "US", "domain": "micropact.com", "org_id": "MICRO-71", "status": "REASSIGNMENT", "tech_id": "KCO62-ARIN", "mnt_id": "BROOK676-ARIN", "admin_id": "KCO62-ARIN", "abuse_id": "BROOK676-ARIN", "created": "2006-04-24", "updated": "2006-04-24", "source": "arin", "raw": "NetHandle:      NET-205-241-46-0-1\\nOrgID:          MICRO-71\\nParent:         NET-205-240-0-0-1\\nNetName:        SPRINTLINK\\nNetRange:       205.241.46.0 - 205.241.46.255\\nNetType:        reassignment\\nRegDate:        2006-04-24\\nUpdated:        2006-04-24\\nTechHandle:     KCO62-ARIN\\nSource:         ARIN\\n\n\nOrgID:          MICRO-71\\nOrgName:        MICROPACT ENGINEERING, INC.\\nCanAllocate:    \\nStreet:         12901 Worldgate Drive\\nStreet:         Suite 800\\nCity:           HERNDON\\nState/Prov:     VA\\nCountry:        US\\nPostalCode:     20171\\nRegDate:        2006-02-14\\nUpdated:        2022-02-02\\nOrgAbuseHandle: BROOK676-ARIN\\nOrgAbuseHandle: KCO62-ARIN\\nOrgAdminHandle: KCO62-ARIN\\nOrgDNSHandle:   BROOK676-ARIN\\nOrgNOCHandle:   BROOK676-ARIN\\nOrgRoutingHandle:   BROOK676-ARIN\\nOrgTechHandle:  KCO62-ARIN\\nSource:         ARIN\\n\n\nPOCHandle:      BROOK676-ARIN\\nIsRole:         N\\nLastName:       Brooks\\nFirstName:      Jennifer\\nStreet:         12901 Worldgate Drive\\nCity:           Herndon\\nState/Prov:     VA\\nCountry:        US\\nPostalCode:     20170\\nRegDate:        2021-05-19\\nUpdated:        2022-06-30\\nOfficePhone:    +1-571-236-7989\\nMailbox:        jennifer.brooks@tylerfederal.com\\nMailbox:        jennifer.brooks@micropact.com\\nSource:         ARIN\\n\n\nPOCHandle:      KCO62-ARIN\\nIsRole:         N\\nLastName:       COLLO\\nFirstName:      KEN\\nStreet:         12901 Worldgate Drive\\nStreet:         Suite 800\\nCity:           HERNDON\\nState/Prov:     VA\\nCountry:        US\\nPostalCode:     20171\\nRegDate:        2006-02-14\\nUpdated:        2021-12-07\\nOfficePhone:    +1-571-346-3711\\nOfficePhone:    +1-703-709-6110\\nOfficePhone:    +1-703-989-3028\\nMailbox:        itopsmgmt@micropact.com\\nSource:         ARIN\\n"}, {"range": "185.205.196.0/22", "id": "CAC-BLOCK18", "name": "Colocation America Corporation", "country": "US", "domain": "colocationamerica.com", "org_id": "CAC-89", "status": "ALLOCATION", "tech_id": "NOC1792-ARIN", "mnt_id": "NOC1792-ARIN", "admin_id": "NOC1792-ARIN", "abuse_id": "ABUSE7705-ARIN", "created": "2019-08-06", "updated": "2019-08-06", "source": "arin", "raw": "NetHandle:      NET-185-205-196-0-1\\nOrgID:          CAC-89\\nParent:         NET-185-0-0-0-1\\nNetName:        CAC-BLOCK18\\nNetRange:       185.205.196.0 - 185.205.199.255\\nNetType:        allocation\\nRegDate:        2019-08-06\\nUpdated:        2019-08-06\\nSource:         ARIN\\n\n\nOrgID:          CAC-89\\nOrgName:        Colocation America Corporation\\nCanAllocate:    \\nStreet:         9360 W Flamingo Rd Suite 178\\nCity:           Las Vegas\\nState/Prov:     NV\\nCountry:        US\\nPostalCode:     89147\\nComment:        Colocation America takes a zero tolerance approach to the sending of Unsolicited Commercial Email or SPAM over its network. \\nComment:        For all inquiries relating to network abuse, network security, DMCA, trademark, legal compliance, and law enforcement requests, contact Abuse@ColocationAmerica.com via e-mail or via postal mail as follow:\\nComment:        Colocation America Corp.\\nComment:        9360 W. Flamingo Rd. \\nComment:        Suite 178\\nComment:        Las Vegas, NV 89147\\nRegDate:        2005-04-06\\nUpdated:        2022-06-27\\nOrgAbuseHandle: ABUSE7705-ARIN\\nOrgAdminHandle: NOC1792-ARIN\\nOrgNOCHandle:   NOC1792-ARIN\\nOrgTechHandle:  NOC1792-ARIN\\nSource:         ARIN\\n\n\nPOCHandle:      ABUSE7705-ARIN\\nIsRole:         Y\\nLastName:       Abuse\\nFirstName:      \\nStreet:         9360 W. Flamingo Rd. \\nStreet:         Suite 110-178\\nCity:           Las Vegas\\nState/Prov:     NV\\nCountry:        US\\nPostalCode:     89147\\nRegDate:        2019-11-04\\nUpdated:        2021-11-02\\nOfficePhone:    +1-800-296-8915\\nMailbox:        Abuse@colocationamerica.com\\nSource:         ARIN\\n\n\nPOCHandle:      NOC1792-ARIN\\nIsRole:         Y\\nLastName:       Network Operations Center\\nFirstName:      \\nStreet:         9360 W Flamingo Rd Suite 110-178\\nCity:           Las Vegas\\nState/Prov:     NV\\nCountry:        US\\nPostalCode:     89147\\nRegDate:        2005-04-04\\nUpdated:        2022-03-31\\nOfficePhone:    +1-800-296-8915\\nMailbox:        noc@colocationamerica.com\\nSource:         ARIN\\n"}, {"range": "2607:3f00:12::/48", "id": "QP-IPV6-LAX", "name": "Access Internet Ltd", "country": "GB", "domain": "budgetnode.com", "org_id": "AIL-181", "status": "REASSIGNMENT", "tech_id": "AZMII-ARIN", "mnt_id": "NETWO8297-ARIN", "admin_id": "AZMII-ARIN", "abuse_id": "ABUSE5582-ARIN", "created": "2016-07-30", "updated": "2016-07-30", "source": "arin", "raw": "V6NetHandle:    NET6-2607-3F00-12-1\\nOrgID:          AIL-181\\nParent:         NET6-2607-3F00-1\\nNetName:        QP-IPV6-LAX\\nNetRange:       2607:3F00:12:: - 2607:3F00:12:FFFF:FFFF:FFFF:FFFF:FFFF\\nNetType:        reassignment\\nOriginAS:       46261\\nRegDate:        2016-07-30\\nUpdated:        2016-07-30\\nSource:         ARIN\\n\n\nOrgID:          AIL-181\\nOrgName:        Access Internet Ltd\\nCanAllocate:    \\nStreet:         Apt 3357, Chynoweth House\\nStreet:         Trevissome Park\\nCity:           Truro\\nState/Prov:     Cornwall\\nCountry:        GB\\nPostalCode:     TR4 8UN\\nComment:        https://budgetnode.com\\nRegDate:        2016-07-30\\nUpdated:        2017-09-15\\nOrgAbuseHandle: ABUSE5582-ARIN\\nOrgAdminHandle: AZMII-ARIN\\nOrgNOCHandle:   NETWO8297-ARIN\\nOrgTechHandle:  AZMII-ARIN\\nSource:         ARIN\\n\n\nPOCHandle:      NETWO8297-ARIN\\nIsRole:         Y\\nLastName:       Network Operations\\nFirstName:      \\nStreet:         Apt 3357, Chynoweth House, Trevissome Park\\nCity:           Truro\\nState/Prov:     Cornwall\\nCountry:        GB\\nPostalCode:     TR4 8UN\\nRegDate:        2017-09-15\\nUpdated:        2021-04-07\\nOfficePhone:    +442035823151\\nMailbox:        noc@budgetnode.com\\nSource:         ARIN\\n\n\nPOCHandle:      AZMII-ARIN\\nIsRole:         N\\nLastName:       Azmi\\nFirstName:      Ishaq\\nStreet:         Apt 3357, Chynoweth House, Trevissome Park\\nCity:           Truro\\nState/Prov:     Cornwall\\nCountry:        GB\\nPostalCode:     TR4 8UN\\nRegDate:        2016-07-30\\nUpdated:        2020-08-04\\nOfficePhone:    +442035823151\\nMailbox:        admin@budgetnode.com\\nSource:         ARIN\\n\n\nPOCHandle:      ABUSE5582-ARIN\\nIsRole:         Y\\nLastName:       Abuse Department\\nFirstName:      \\nStreet:         Apt 3357, Chynoweth House, Trevissome Park\\nCity:           Truro\\nState/Prov:     Cornwall\\nCountry:        GB\\nPostalCode:     TR4 8UN\\nRegDate:        2016-07-30\\nUpdated:        2020-08-04\\nOfficePhone:    +442035823151\\nMailbox:        abuse@budgetnode.com\\nSource:         ARIN\\n"}, {"range": "216.206.178.32/27", "id": "QWEST-BUC-MSMEDIA", "name": "Outlook Amusements, Inc.", "country": "US", "domain": "outlookamusements.com", "org_id": "OUTLO", "status": "REASSIGNMENT", "tech_id": "NRU4-ARIN", "mnt_id": "NETWO7749-ARIN", "admin_id": "NETWO7749-ARIN", "abuse_id": "ABUSE5449-ARIN", "created": "2004-07-19", "updated": "2004-07-19", "source": "arin", "raw": "NetHandle:      NET-216-206-178-32-1\\nOrgID:          OUTLO\\nParent:         NET-216-206-0-0-1\\nNetName:        QWEST-BUC-MSMEDIA\\nNetRange:       216.206.178.32 - 216.206.178.63\\nNetType:        reassignment\\nRegDate:        2004-07-19\\nUpdated:        2004-07-19\\nTechHandle:     NRU4-ARIN\\nSource:         ARIN\\n\n\nOrgID:          OUTLO\\nOrgName:        Outlook Amusements, Inc.\\nCanAllocate:    \\nStreet:         2900 W. Alameda Ave\\nCity:           Burbank\\nState/Prov:     CA\\nCountry:        US\\nPostalCode:     91505\\nComment:        Please, report network abuse to abuse@outlookamusements.com\\nRegDate:        2004-04-29\\nUpdated:        2021-05-25\\nOrgAbuseHandle: ABUSE5449-ARIN\\nOrgAdminHandle: NETWO7749-ARIN\\nOrgNOCHandle:   NETWO7749-ARIN\\nOrgTechHandle:  NETWO7749-ARIN\\nSource:         ARIN\\n\n\nPOCHandle:      ABUSE5449-ARIN\\nIsRole:         Y\\nLastName:       Abuse\\nFirstName:      \\nStreet:         2900 W Alameda Ave #400\\nCity:           Burbank\\nState/Prov:     CA\\nCountry:        US\\nPostalCode:     91505\\nRegDate:        2016-04-18\\nUpdated:        2020-06-30\\nOfficePhone:    +1-818-433-3800\\nMailbox:        abuse@outlookamusements.com\\nSource:         ARIN\\n\n\nPOCHandle:      NETWO7749-ARIN\\nIsRole:         Y\\nLastName:       Network Operations\\nFirstName:      \\nStreet:         3746 Foothill Blvd. #1119\\nCity:           Glendale\\nState/Prov:     CA\\nCountry:        US\\nPostalCode:     91214\\nRegDate:        2016-04-18\\nUpdated:        2021-05-25\\nOfficePhone:    +1-818-433-3800\\nMailbox:        netops@outlookamusements.com\\nSource:         ARIN\\n\n\nPOCHandle:      NRU4-ARIN\\nIsRole:         N\\nLastName:       Rubstov\\nFirstName:      Nick\\nStreet:         1662 Hillhurst Ave.\\nStreet:         Suite A\\nCity:           Los Angeles\\nState/Prov:     CA\\nCountry:        US\\nPostalCode:     90027\\nRegDate:        2004-07-19\\nUpdated:        2004-07-19\\nOfficePhone:    +1-323-913-7300\\nMailbox:        nick@outlookamusements.com\\nSource:         ARIN\\n"}, {"range": "2606:6940::/32", "id": "MERAKI-CUSTOMERS", "name": "Meraki LLC", "country": "US", "domain": "meraki.com", "org_id": "ML-772", "status": "ALLOCATION", "tech_id": "ADMIN6231-ARIN", "mnt_id": "SYSAD151-ARIN", "admin_id": "ADMIN6231-ARIN", "abuse_id": "SYSAD151-ARIN", "created": "2021-08-09", "updated": "2021-08-09", "source": "arin", "raw": "V6NetHandle:    NET6-2606-6940-1\\nOrgID:          ML-772\\nParent:         NET6-2600-1\\nNetName:        MERAKI-CUSTOMERS\\nNetRange:       2606:6940:: - 2606:6940:FFFF:FFFF:FFFF:FFFF:FFFF:FFFF\\nNetType:        allocation\\nRegDate:        2021-08-09\\nUpdated:        2021-08-09\\nSource:         ARIN\\n\n\nOrgID:          ML-772\\nOrgName:        Meraki LLC\\nCanAllocate:    \\nStreet:         500 Terry A Francois Blvd\\nCity:           San Francisco\\nState/Prov:     CA\\nCountry:        US\\nPostalCode:     94158\\nRegDate:        2016-04-12\\nUpdated:        2022-04-18\\nOrgAbuseHandle: SYSAD151-ARIN\\nOrgAdminHandle: ADMIN6231-ARIN\\nOrgNOCHandle:   SYSAD151-ARIN\\nOrgTechHandle:  ADMIN6231-ARIN\\nSource:         ARIN\\n\n\nPOCHandle:      ADMIN6231-ARIN\\nIsRole:         Y\\nLastName:       Admins\\nFirstName:      \\nStreet:         500 Terry A Francois Blvd\\nCity:           San Francisco\\nState/Prov:     CA\\nCountry:        US\\nPostalCode:     94158\\nRegDate:        2016-08-10\\nUpdated:        2021-09-07\\nOfficePhone:    +1-415-432-1000\\nMailbox:        arin@meraki.com\\nSource:         ARIN\\n\n\nPOCHandle:      SYSAD151-ARIN\\nIsRole:         Y\\nLastName:       Sysadmin\\nFirstName:      \\nStreet:         500 Terry A Francois Blvd\\nCity:           San Francisco\\nState/Prov:     CA\\nCountry:        US\\nPostalCode:     94158\\nRegDate:        2016-04-12\\nUpdated:        2020-08-26\\nOfficePhone:    +1-415-432-1000\\nMailbox:        sysadmin@meraki.com\\nSource:         ARIN\\n"}, {"range": "192.252.224.0/20", "id": "TEKSAV", "name": "TekSavvy Solutions, Inc.", "country": "CA", "domain": "teksavvy.com", "org_id": "TEKSAV", "status": "ALLOCATION", "tech_id": "NOC1728-ARIN\\NTEKSA-ARIN", "mnt_id": "TEKSA-ARIN", "admin_id": "ADMIN498-ARIN", "abuse_id": "ABUSE816-ARIN", "created": "2013-07-05", "updated": "2016-01-06", "source": "arin", "raw": "NetHandle:      NET-192-252-224-0-1\\nOrgID:          TEKSAV\\nParent:         NET-192-0-0-0-0\\nNetName:        TEKSAV\\nNetRange:       192.252.224.0 - 192.252.239.255\\nNetType:        allocation\\nOriginAS:       20375, 5645\\nRegDate:        2013-07-05\\nUpdated:        2016-01-06\\nSource:         ARIN\\n\n\nOrgID:          TEKSAV\\nOrgName:        TekSavvy Solutions, Inc.\\nCanAllocate:    \\nStreet:         800 Richmond St\\nCity:           Chatham\\nState/Prov:     ON\\nCountry:        CA\\nPostalCode:     N7M 5J5\\nRegDate:        2000-03-02\\nUpdated:        2019-04-02\\nReferralServer: rwhois://rwhois.teksavvy.com:4321\\nOrgAbuseHandle: ABUSE816-ARIN\\nOrgAdminHandle: ADMIN498-ARIN\\nOrgNOCHandle:   TEKSA-ARIN\\nOrgTechHandle:  NOC1728-ARIN\\nOrgTechHandle:  TEKSA-ARIN\\nSource:         ARIN\\n\n\nPOCHandle:      ADMIN498-ARIN\\nIsRole:         Y\\nLastName:       Admin\\nFirstName:      \\nStreet:         800 Richmond St\\nCity:           Chatham\\nState/Prov:     ON\\nCountry:        CA\\nPostalCode:     N7M 5J5\\nRegDate:        2005-03-03\\nUpdated:        2021-08-31\\nOfficePhone:    +1-519-360-1575\\nMailbox:        noc@teksavvy.com\\nMailbox:        net-admin@teksavvy.com\\nSource:         ARIN\\n\n\nPOCHandle:      NOC1728-ARIN\\nIsRole:         Y\\nLastName:       NOC\\nFirstName:      \\nStreet:         800 Richmond\\nCity:           Chatham\\nState/Prov:     ON\\nCountry:        CA\\nPostalCode:     N7M 5J5\\nRegDate:        2005-02-04\\nUpdated:        2022-05-04\\nOfficePhone:    +1-519-360-1575\\nFaxPhone:       +1-519-360-1716\\nMailbox:        support@teksavvy.com\\nSource:         ARIN\\n\n\nPOCHandle:      TEKSA-ARIN\\nIsRole:         Y\\nLastName:       Teksavvy NOC\\nFirstName:      \\nStreet:         800 Richmond\\nCity:           Chatham\\nState/Prov:     ON\\nCountry:        CA\\nPostalCode:     N7M-5J5\\nRegDate:        2019-03-26\\nUpdated:        2021-08-31\\nOfficePhone:    +1-519-360-1575\\nMailbox:        noc@teksavvy.com\\nSource:         ARIN\\n\n\nPOCHandle:      ABUSE816-ARIN\\nIsRole:         Y\\nLastName:       Abuse\\nFirstName:      \\nStreet:         800 Richmond St.\\nCity:           Chatham\\nState/Prov:     ON\\nCountry:        CA\\nPostalCode:     N7M 5J5\\nRegDate:        2005-02-04\\nUpdated:        2017-12-17\\nOfficePhone:    +1-519-360-1575\\nMailbox:        abuse@teksavvy.com\\nSource:         ARIN\\n"}, {"range": "198.147.146.0/24", "id": "ATCCNET1", "name": "American Type Culture Collection", "country": "US", "domain": "atcc.org", "org_id": "ATCC", "status": "ALLOCATION", "tech_id": "HELPD146-ARIN", "mnt_id": "HELPD146-ARIN", "admin_id": "HELPD146-ARIN", "abuse_id": "HELPD146-ARIN", "created": "1993-05-28", "updated": "2021-12-14", "source": "arin", "raw": "NetHandle:      NET-198-147-146-0-1\\nOrgID:          ATCC\\nParent:         NET-198-0-0-0-0\\nNetName:        ATCCNET1\\nNetRange:       198.147.146.0 - 198.147.146.255\\nNetType:        allocation\\nRegDate:        1993-05-28\\nUpdated:        2021-12-14\\nSource:         ARIN\\n\n\nOrgID:          ATCC\\nOrgName:        American Type Culture Collection\\nCanAllocate:    \\nStreet:         10801 University Blvd.\\nCity:           Manassas\\nState/Prov:     VA\\nCountry:        US\\nPostalCode:     20110\\nRegDate:        1993-05-28\\nUpdated:        2011-11-17\\nOrgAbuseHandle: HELPD146-ARIN\\nOrgAdminHandle: HELPD146-ARIN\\nOrgNOCHandle:   HELPD146-ARIN\\nOrgTechHandle:  HELPD146-ARIN\\nSource:         ARIN\\n\n\nPOCHandle:      HELPD146-ARIN\\nIsRole:         Y\\nLastName:       Helpdesk\\nFirstName:      \\nStreet:         10801 University Blvd\\nCity:           Manassas\\nState/Prov:     VA\\nCountry:        US\\nPostalCode:     20110\\nRegDate:        2011-11-14\\nUpdated:        2021-09-13\\nOfficePhone:    +1-703-365-2700\\nMailbox:        ServiceDesk@atcc.org\\nSource:         ARIN\\n"}, {"range": "8.39.214.0/24", "id": "LPL-141-CLOUD14-8-39-214", "name": "Cloudflare, Inc.", "country": "US", "domain": "cloudflare.com", "org_id": "CLOUD14", "status": "REASSIGNMENT", "tech_id": "ADMIN2521-ARIN", "mnt_id": "CLOUD146-ARIN", "admin_id": "ADMIN2521-ARIN", "abuse_id": "ABUSE2916-ARIN", "created": "2019-05-24", "updated": "2019-05-24", "source": "arin", "raw": "NetHandle:      NET-8-39-214-0-1\\nOrgID:          CLOUD14\\nParent:         NET-8-0-0-0-1\\nNetName:        LPL-141-CLOUD14-8-39-214\\nNetRange:       8.39.214.0 - 8.39.214.255\\nNetType:        reassignment\\nOriginAS:       13335\\nRegDate:        2019-05-24\\nUpdated:        2019-05-24\\nSource:         ARIN\\n\n\nOrgID:          CLOUD14\\nOrgName:        Cloudflare, Inc.\\nCanAllocate:    \\nStreet:         101 Townsend Street\\nCity:           San Francisco\\nState/Prov:     CA\\nCountry:        US\\nPostalCode:     94107\\nRegDate:        2010-07-09\\nUpdated:        2021-07-01\\nOrgAbuseHandle: ABUSE2916-ARIN\\nOrgAdminHandle: ADMIN2521-ARIN\\nOrgNOCHandle:   CLOUD146-ARIN\\nOrgRoutingHandle:   CLOUD146-ARIN\\nOrgTechHandle:  ADMIN2521-ARIN\\nSource:         ARIN\\n\n\nPOCHandle:      ABUSE2916-ARIN\\nIsRole:         Y\\nLastName:       Abuse\\nFirstName:      \\nStreet:         101 Townsend Street\\nCity:           San Francisco\\nState/Prov:     CA\\nCountry:        US\\nPostalCode:     94107\\nRegDate:        2011-02-14\\nUpdated:        2020-04-23\\nOfficePhone:    +1-650-319-8930\\nMailbox:        abuse@cloudflare.com\\nSource:         ARIN\\n\n\nPOCHandle:      CLOUD146-ARIN\\nIsRole:         Y\\nLastName:       Cloudflare-NOC\\nFirstName:      \\nStreet:         101 Townsend St\\nCity:           San Francsico\\nState/Prov:     CA\\nCountry:        US\\nPostalCode:     94107\\nRegDate:        2021-07-01\\nUpdated:        2022-08-09\\nOfficePhone:    +1-650-319-8930\\nMailbox:        noc@cloudflare.com\\nSource:         ARIN\\n\n\nPOCHandle:      ADMIN2521-ARIN\\nIsRole:         Y\\nLastName:       Admin\\nFirstName:      \\nStreet:         101 Townsend Street\\nCity:           San Francisco\\nState/Prov:     CA\\nCountry:        US\\nPostalCode:     94107\\nRegDate:        2011-04-19\\nUpdated:        2022-01-20\\nOfficePhone:    +1-650-319-8930\\nMailbox:        rir@cloudflare.com\\nSource:         ARIN\\n"}, {"range": "192.153.123.0/24", "id": "IUP-KITTY", "name": "Indiana University of Pennsylvania", "country": "US", "domain": "iup.edu", "org_id": "IUP-1-Z", "status": "ALLOCATION", "tech_id": "ROUMF-ARIN\\NTOYCO-ARIN", "mnt_id": "ROUMF-ARIN\\NTOYCO-ARIN", "admin_id": "TOYCO-ARIN", "abuse_id": "ROUMF-ARIN", "created": "1992-04-01", "updated": "2022-03-31", "source": "arin", "raw": "NetHandle:      NET-192-153-123-0-1\\nOrgID:          IUP-1-Z\\nParent:         NET-192-0-0-0-0\\nNetName:        IUP-KITTY\\nNetRange:       192.153.123.0 - 192.153.123.255\\nNetType:        allocation\\nOriginAS:       62989\\nRegDate:        1992-04-01\\nUpdated:        2022-03-31\\nSource:         ARIN\\n\n\nOrgID:          IUP-1-Z\\nOrgName:        Indiana University of Pennsylvania\\nCanAllocate:    \\nStreet:         Computer Center\\nStreet:         Stright Hall\\nCity:           Indiana\\nState/Prov:     PA\\nCountry:        US\\nPostalCode:     15705-1087\\nRegDate:        2022-03-15\\nUpdated:        2022-03-15\\nOrgAbuseHandle: ROUMF-ARIN\\nOrgAbuseHandle: TOYCO-ARIN\\nOrgAdminHandle: TOYCO-ARIN\\nOrgNOCHandle:   ROUMF-ARIN\\nOrgNOCHandle:   TOYCO-ARIN\\nOrgTechHandle:  ROUMF-ARIN\\nOrgTechHandle:  TOYCO-ARIN\\nSource:         ARIN\\n\n\nPOCHandle:      ROUMF-ARIN\\nIsRole:         N\\nLastName:       Roumfort\\nFirstName:      Jonathan\\nStreet:         G19 Stright Hall\\nStreet:         210 South 10th Street\\nCity:           Indiana\\nState/Prov:     PA\\nCountry:        US\\nPostalCode:     15705\\nRegDate:        2021-06-02\\nUpdated:        2022-06-02\\nOfficePhone:    +1-724-357-4718\\nMailbox:        roumfort@iup.edu\\nSource:         ARIN\\n\n\nPOCHandle:      TOYCO-ARIN\\nIsRole:         N\\nLastName:       Toy\\nFirstName:      Cody\\nStreet:         G20 Stright Hall\\nStreet:         210 S 10th ST\\nCity:           Indiana\\nState/Prov:     PA\\nCountry:        US\\nPostalCode:     15705\\nRegDate:        2021-10-15\\nUpdated:        2021-10-15\\nMobilePhone:    +1-724-762-6686\\nOfficePhone:    +1-724-357-1213\\nMailbox:        catoy@iup.edu\\nSource:         ARIN\\n"}, {"range": "69.85.203.16/28", "id": "PMC-137", "name": "Pellerin Milnor Corporation", "country": "US", "domain": "milnor.com", "org_id": "PMC-137", "status": "REASSIGNMENT", "tech_id": "CLOUD30-ARIN", "mnt_id": "CLOUD30-ARIN", "admin_id": "CLOUD30-ARIN", "abuse_id": "CLOUD30-ARIN", "created": "2015-08-05", "updated": "2015-08-05", "source": "arin", "raw": "NetHandle:      NET-69-85-203-16-1\\nOrgID:          PMC-137\\nParent:         NET-69-85-192-0-1\\nNetName:        PMC-137\\nNetRange:       69.85.203.16 - 69.85.203.31\\nNetType:        reassignment\\nOriginAS:       13760\\nRegDate:        2015-08-05\\nUpdated:        2015-08-05\\nSource:         ARIN\\n\n\nOrgID:          PMC-137\\nOrgName:        Pellerin Milnor Corporation\\nCanAllocate:    \\nStreet:         700 Jackson St\\nCity:           Kenner\\nState/Prov:     LA\\nCountry:        US\\nPostalCode:     70062\\nRegDate:        2015-04-22\\nUpdated:        2015-04-22\\nOrgAbuseHandle: CLOUD30-ARIN\\nOrgAdminHandle: CLOUD30-ARIN\\nOrgNOCHandle:   CLOUD30-ARIN\\nOrgTechHandle:  CLOUD30-ARIN\\nSource:         ARIN\\n\n\nPOCHandle:      CLOUD30-ARIN\\nIsRole:         N\\nLastName:       Cloud\\nFirstName:      Tony\\nStreet:         700 Jackson St\\nCity:           Kenner\\nState/Prov:     LA\\nCountry:        US\\nPostalCode:     70062\\nRegDate:        2015-04-22\\nUpdated:        2017-04-21\\nOfficePhone:    +1-504-712-7585\\nMailbox:        tonycloud@milnor.com\\nSource:         ARIN\\n"}, {"range": "64.52.111.0/24", "id": "SLL-137", "name": "Bishop Fox", "country": "US", "domain": "bishopfox.com", "org_id": "SLL-137", "status": "ALLOCATION", "tech_id": "BFIO-ARIN", "mnt_id": "BFIO-ARIN", "admin_id": "BFIO-ARIN", "abuse_id": "BFIS-ARIN", "created": "2021-03-30", "updated": "2021-12-14", "source": "arin", "raw": "NetHandle:      NET-64-52-111-0-1\\nOrgID:          SLL-137\\nParent:         NET-64-0-0-0-0\\nNetName:        SLL-137\\nNetRange:       64.52.111.0 - 64.52.111.255\\nNetType:        allocation\\nComment:        -----BEGIN CERTIFICATE-----MIIDYDCCAkigAwIBAgIJAJykU+Fq4bdvMA0GCSqGSIb3DQEBCwUAMEUxCzAJBgNVBAYTAkFVMRMwEQYDVQQIDApTb21lLVN0YXRlMSEwHwYDVQQKDBhJbnRlcm5ldCBXaWRnaXRzIFB0eSBMdGQwHhcNMjAxMTEwMTgyNzQ1WhcNMjExMTEwMTgyNzQ1WjBFMQswCQYDVQQGEwJBVTETMBEGA1UECAwKU29tZS1TdGF0ZTEhMB8GA1UECgwYSW50ZXJuZXQgV2lkZ2l0cyBQdHkgTHRkMIIBIjANBgkqhkiG9w0BAQEFAAOCAQ8AMIIBCgKCAQEAqRHRP9teTGMpOa2LP7lrVsC5ysurHQe5TiCLSpU54r1COdBuWOUr+SChJXNlDgSj4p+pNs1AKwVMxb23dGseSGU44VC5t1ZSOHi4mhvb4ORxDF9pmxq1LLGWHCUfAkrd0YXX9jWpIgPYikCXUFQkn7kHi9swisDy2g5uRDJpD6Ya2YjVeJq/j4B2wxaKPsSlOzI4GrxCRdUqb3qFNnBiRRci+HkB6n1UqOvDT4j6jTiNxhtP/qig/mmDOEeWqbCoVSqlqxCg3aX1GFc5+JMXrn86Of6W+XHcyw9koyGOD8GNkh5wlRYAnwkPikqBVY+2t3xZIq3HGowWENvz7tCh1wIDAQABo1MwUTAdBgNVHQ4EFgQUwe1eSiWlj6Xp8LN9SXqj/imNQLUwHwYDVR0jBBgwFoAUwe1eSiWlj6Xp8LN9SXqj/imNQLUwDwYDVR0TAQH/BAUwAwEB/zANBgkqhkiG9w0BAQsFAAOCAQEAie7G7g0au4qw1BZZ+Z8eyy40aVTYD5/ne0mp3Y0HYc5nFBozKIKf9Dv23pAO2cAvTVNyYXQlKVkD74mxbad3rLtIc+vOt9yqjvc5C9/Mv+sYa/nVVAB2hFs+DLLeoGZekn+PS3XUOp+jo++aPLYLkkucTCB5Qrlzp5HkMEs6RFkPkv8/BN3xzcuXabpjL6RASn3vnFe6yhYLlxO/twIo28fG1ClPCZHoS+S8arc9e/nEycEGzHrZFSWW+0kIgrn9A3zw71pc+NLv3x6z1V1UHal8q+Ktjd29XTBYA6pIIsvH2hBxwm4Mb06W6OQcK/6Fv7P/NubQ79Qw1iSPV+m6NA==-----END CERTIFICATE-----\\nRegDate:        2021-03-30\\nUpdated:        2021-12-14\\nSource:         ARIN\\n\n\nOrgID:          SLL-137\\nOrgName:        Bishop Fox\\nCanAllocate:    \\nStreet:         8240 S. Kyrene Road Suite A-113\\nCity:           Tempe\\nState/Prov:     AZ\\nCountry:        US\\nPostalCode:     85284\\nRegDate:        2019-10-01\\nUpdated:        2020-08-06\\nOrgAbuseHandle: BFIS-ARIN\\nOrgAdminHandle: BFIO-ARIN\\nOrgDNSHandle:   BFIO-ARIN\\nOrgNOCHandle:   BFIO-ARIN\\nOrgRoutingHandle:   BFIO-ARIN\\nOrgTechHandle:  BFIO-ARIN\\nSource:         ARIN\\n\n\nPOCHandle:      BFIO-ARIN\\nIsRole:         Y\\nLastName:       Bishop Fox IT Operations\\nFirstName:      \\nStreet:         8240 S. Kyrene Rd Suite A113\\nCity:           Tempe\\nState/Prov:     AZ\\nCountry:        US\\nPostalCode:     85284\\nRegDate:        2020-07-31\\nUpdated:        2022-08-03\\nOfficePhone:    +1-480-621-8967\\nMailbox:        admin@bishopfox.com\\nSource:         ARIN\\n\n\nPOCHandle:      BFIS-ARIN\\nIsRole:         Y\\nLastName:       Bishop Fox Information Security\\nFirstName:      \\nStreet:         8240 S. Kyrene Rd Suite A113\\nCity:           Tempe\\nState/Prov:     AZ\\nCountry:        US\\nPostalCode:     85284\\nRegDate:        2020-08-06\\nUpdated:        2021-08-10\\nOfficePhone:    +1-480-621-8967\\nMailbox:        abuse@bishopfox.com\\nSource:         ARIN\\n"}, {"range": "74.127.83.0/24", "id": "NNS-PSD", "name": "Public Service Data, Inc.", "country": "US", "domain": "pstel.net", "org_id": "PSD-54", "status": "REASSIGNMENT", "tech_id": "ADMIN6545-ARIN", "mnt_id": "ADMIN6545-ARIN\\NROBER1038-ARIN", "admin_id": "ADMIN6545-ARIN", "abuse_id": "ABUSE6292-ARIN", "created": "2014-11-18", "updated": "2014-11-18", "source": "arin", "raw": "NetHandle:      NET-74-127-83-0-1\\nOrgID:          PSD-54\\nParent:         NET-74-127-64-0-1\\nNetName:        NNS-PSD\\nNetRange:       74.127.83.0 - 74.127.83.255\\nNetType:        reassignment\\nRegDate:        2014-11-18\\nUpdated:        2014-11-18\\nSource:         ARIN\\n\n\nOrgID:          PSD-54\\nOrgName:        Public Service Data, Inc.\\nCanAllocate:    \\nStreet:         8 North Winston Street\\nCity:           Reynolds\\nState/Prov:     GA\\nCountry:        US\\nPostalCode:     31076\\nComment:        www.pstel.net\\nComment:        Standard NOC hours are 8:30 AM to 5:30 PM EST.\\nRegDate:        2013-12-09\\nUpdated:        2017-08-02\\nOrgAbuseHandle: ABUSE6292-ARIN\\nOrgAdminHandle: ADMIN6545-ARIN\\nOrgNOCHandle:   ADMIN6545-ARIN\\nOrgNOCHandle:   ROBER1038-ARIN\\nOrgTechHandle:  ADMIN6545-ARIN\\nSource:         ARIN\\n\n\nPOCHandle:      ROBER1038-ARIN\\nIsRole:         N\\nLastName:       Roberts\\nFirstName:      Michael\\nStreet:         8 North Winston Street\\nCity:           Reynolds\\nState/Prov:     GA\\nCountry:        US\\nPostalCode:     31076\\nRegDate:        2017-05-05\\nUpdated:        2017-05-05\\nOfficePhone:    +1-478-847-6247\\nMailbox:        michael.roberts@pstel.com\\nSource:         ARIN\\n\n\nPOCHandle:      ABUSE6292-ARIN\\nIsRole:         Y\\nLastName:       Abuse\\nFirstName:      \\nStreet:         8 N. Winston Street\\nCity:           Reynolds\\nState/Prov:     GA\\nCountry:        US\\nPostalCode:     31076\\nRegDate:        2017-08-02\\nUpdated:        2022-02-10\\nOfficePhone:    +1-478-847-4111\\nMailbox:        steven.fandozzi@pstel.com\\nMailbox:        stephen.bass@pstel.com\\nMailbox:        ekbond@pstel.com\\nMailbox:        dmca.notices@pstel.com\\nMailbox:        melissa.ramey@pstel.com\\nMailbox:        jim.bond@pstel.com\\nSource:         ARIN\\n\n\nPOCHandle:      ADMIN6545-ARIN\\nIsRole:         Y\\nLastName:       Admin\\nFirstName:      \\nStreet:         8 N Winston Street\\nCity:           Reynolds\\nState/Prov:     GA\\nCountry:        US\\nPostalCode:     31076\\nRegDate:        2017-07-31\\nUpdated:        2022-02-07\\nOfficePhone:    +1-478-847-4111\\nMailbox:        steven.fandozzi@pstel.com\\nMailbox:        melissa.ramey@pstel.com\\nMailbox:        stephen.bass@pstel.com\\nMailbox:        ekbond@pstel.com\\nMailbox:        jim.bond@pstel.com\\nSource:         ARIN\\n"}, {"range": "162.249.196.0/22", "id": "VERTE-44", "name": "Vertex Inc.", "country": "US", "domain": "vertexinc.com", "org_id": "VERTE-44", "status": "ALLOCATION", "tech_id": "RIVER469-ARIN", "mnt_id": "RIVER469-ARIN", "admin_id": "RIVER469-ARIN", "abuse_id": "ABUSE7513-ARIN", "created": "2019-04-16", "updated": "2021-12-14", "source": "arin", "raw": "NetHandle:      NET-162-249-196-0-1\\nOrgID:          VERTE-44\\nParent:         NET-162-0-0-0-0\\nNetName:        VERTE-44\\nNetRange:       162.249.196.0 - 162.249.199.255\\nNetType:        allocation\\nRegDate:        2019-04-16\\nUpdated:        2021-12-14\\nSource:         ARIN\\n\n\nOrgID:          VERTE-44\\nOrgName:        Vertex Inc.\\nCanAllocate:    \\nStreet:         2301 Renaissance Blvd\\nCity:           King of Prussia\\nState/Prov:     PA\\nCountry:        US\\nPostalCode:     19406\\nRegDate:        2019-01-29\\nUpdated:        2019-05-14\\nOrgAbuseHandle: ABUSE7513-ARIN\\nOrgAdminHandle: RIVER469-ARIN\\nOrgNOCHandle:   RIVER469-ARIN\\nOrgTechHandle:  RIVER469-ARIN\\nSource:         ARIN\\n\n\nPOCHandle:      RIVER469-ARIN\\nIsRole:         N\\nLastName:       Rivera\\nFirstName:      Thomas\\nStreet:         2301 Renaissance Blvd\\nCity:           King of Prussia\\nState/Prov:     PA\\nCountry:        US\\nPostalCode:     19406\\nRegDate:        2019-01-28\\nUpdated:        2021-01-27\\nOfficePhone:    +1-484-595-6188\\nMailbox:        tom.rivera@vertexinc.com\\nSource:         ARIN\\n\n\nPOCHandle:      ABUSE7513-ARIN\\nIsRole:         Y\\nLastName:       ABUSE-INFOSEC\\nFirstName:      \\nStreet:         2301 Renaissance Blvd\\nCity:           King of Prussia\\nState/Prov:     PA\\nCountry:        US\\nPostalCode:     19406\\nRegDate:        2019-05-14\\nUpdated:        2019-05-14\\nOfficePhone:    +1-610-642-4200\\nMailbox:        informationsecurity@vertexinc.com\\nSource:         ARIN\\n"}, {"range": "199.103.0.0/21", "id": "PROMIN-9", "name": "Prominic.NET, Inc.", "country": "US", "domain": "prominic.net", "org_id": "PROMIN-9", "status": "ALLOCATION", "tech_id": "JHI70-ARIN", "mnt_id": "JHI70-ARIN", "admin_id": "JES107-ARIN", "abuse_id": "ANDRE590-ARIN", "created": "2009-03-12", "updated": "2012-02-24", "source": "arin", "raw": "NetHandle:      NET-199-103-0-0-1\\nOrgID:          PROMIN-9\\nParent:         NET-199-0-0-0-0\\nNetName:        PROMIN-9\\nNetRange:       199.103.0.0 - 199.103.7.255\\nNetType:        allocation\\nOriginAS:       22663\\nRegDate:        2009-03-12\\nUpdated:        2012-02-24\\nAbuseHandle:    JHI70-ARIN\\nNOCHandle:      JHI70-ARIN\\nTechHandle:     JHI70-ARIN\\nSource:         ARIN\\n\n\nOrgID:          PROMIN-9\\nOrgName:        Prominic.NET, Inc.\\nCanAllocate:    \\nStreet:         101 West International Ave.\\nCity:           Rantoul\\nState/Prov:     IL\\nCountry:        US\\nPostalCode:     61866\\nComment:        http://Prominic.NET Support@Prominic.NET for any concerns.\\nRegDate:        2001-10-31\\nUpdated:        2021-11-11\\nOrgAbuseHandle: ANDRE590-ARIN\\nOrgAbuseHandle: FOLKP-ARIN\\nOrgAbuseHandle: JES107-ARIN\\nOrgAbuseHandle: JHI70-ARIN\\nOrgAdminHandle: JES107-ARIN\\nOrgTechHandle:  ANDRE590-ARIN\\nOrgTechHandle:  FOLKP-ARIN\\nOrgTechHandle:  JES107-ARIN\\nOrgTechHandle:  JHI70-ARIN\\nSource:         ARIN\\n\n\nPOCHandle:      JES107-ARIN\\nIsRole:         N\\nLastName:       Schultz\\nFirstName:      Jon\\nStreet:         101 West International Ave.\\nCity:           Rantoul\\nState/Prov:     IL\\nCountry:        US\\nPostalCode:     61866\\nRegDate:        2007-12-26\\nUpdated:        2022-03-10\\nOfficePhone:    +1-866-358-6004\\nMailbox:        jschultz@prominic.net\\nSource:         ARIN\\n\n\nPOCHandle:      ANDRE590-ARIN\\nIsRole:         N\\nLastName:       Andre\\nFirstName:      Chuck\\nStreet:         101 West International Ave.\\nCity:           Rantoul\\nState/Prov:     IL\\nCountry:        US\\nPostalCode:     61866\\nRegDate:        2021-04-13\\nUpdated:        2022-04-13\\nOfficePhone:    +1-585-201-8686\\nMailbox:        chuckandre@gmail.com\\nSource:         ARIN\\n\n\nPOCHandle:      JHI70-ARIN\\nIsRole:         N\\nLastName:       Hill\\nFirstName:      Justin\\nStreet:         101 West International\\nCity:           Rantoul\\nState/Prov:     IL\\nCountry:        US\\nPostalCode:     61866\\nRegDate:        2005-11-22\\nUpdated:        2021-04-13\\nOfficePhone:    +1-866-372-8506\\nMailbox:        Justin@prominic.net\\nSource:         ARIN\\n\n\nPOCHandle:      FOLKP-ARIN\\nIsRole:         N\\nLastName:       Folk\\nFirstName:      Peter\\nStreet:         3310 N. Cunningham Ave.\\nCity:           Urbana\\nState/Prov:     IL\\nCountry:        US\\nPostalCode:     61802\\nRegDate:        2019-02-18\\nUpdated:        2021-02-17\\nOfficePhone:    +1-217-367-8656\\nMailbox:        pfolk-arinonline@volo.net\\nSource:         ARIN\\n"}, {"range": "205.216.42.128/28", "id": "SAVV-S604700-0", "name": "New York Life Insurance Company", "country": "US", "domain": "newyorklife.com", "org_id": "NYLI-1", "status": "REALLOCATION", "tech_id": "JRI209-ARIN", "mnt_id": "HOSTM2032-ARIN", "admin_id": "HOSTM2032-ARIN", "abuse_id": "HOSTM2032-ARIN", "created": "2010-11-03", "updated": "2010-11-03", "source": "arin", "raw": "NetHandle:      NET-205-216-42-128-1\\nOrgID:          NYLI-1\\nParent:         NET-205-216-0-0-1\\nNetName:        SAVV-S604700-0\\nNetRange:       205.216.42.128 - 205.216.42.143\\nNetType:        reallocation\\nRegDate:        2010-11-03\\nUpdated:        2010-11-03\\nTechHandle:     JRI209-ARIN\\nSource:         ARIN\\n\n\nOrgID:          NYLI-1\\nOrgName:        New York Life Insurance Company\\nCanAllocate:    \\nStreet:         51 Madison Avenue\\nCity:           New York\\nState/Prov:     NY\\nCountry:        US\\nPostalCode:     10010\\nRegDate:        1995-08-09\\nUpdated:        2015-10-05\\nOrgAbuseHandle: HOSTM2032-ARIN\\nOrgAdminHandle: HOSTM2032-ARIN\\nOrgNOCHandle:   HOSTM2032-ARIN\\nOrgTechHandle:  HOSTM2032-ARIN\\nSource:         ARIN\\n\n\nPOCHandle:      HOSTM2032-ARIN\\nIsRole:         Y\\nLastName:       Hostmaster\\nFirstName:      \\nStreet:         51 Madison Avenue\\nCity:           New York\\nState/Prov:     NY\\nCountry:        US\\nPostalCode:     10010\\nRegDate:        2015-10-05\\nUpdated:        2021-08-28\\nOfficePhone:    +1-212-576-7000\\nMailbox:        hostmaster@newyorklife.com\\nSource:         ARIN\\n\n\nPOCHandle:      JRI209-ARIN\\nIsRole:         N\\nLastName:       Riha\\nFirstName:      Jeff\\nStreet:         51 Madison Avenue\\nStreet:         Attn: Procurement Desk, RM 300\\nCity:           New York\\nState/Prov:     NY\\nCountry:        US\\nPostalCode:     10010\\nRegDate:        2010-04-30\\nUpdated:        2010-04-30\\nOfficePhone:    +1-212-576-5835\\nMailbox:        Jeffrey_Riha@newyorklife.com\\nSource:         ARIN\\n"}, {"range": "72.23.180.0/25", "id": "ACS-CRANBERRYTWPPA", "name": "Armstrong", "country": "US", "domain": "armstrongonewire.com", "org_id": "ARMC", "status": "REALLOCATION", "tech_id": "NOC11973-ARIN", "mnt_id": "NOC11973-ARIN", "admin_id": "NOC11973-ARIN", "abuse_id": "NOC11974-ARIN", "created": "2020-10-22", "updated": "2020-10-22", "source": "arin", "raw": "NetHandle:      NET-72-23-180-0-1\\nOrgID:          ARMC\\nParent:         NET-72-23-0-0-1\\nNetName:        ACS-CRANBERRYTWPPA\\nNetRange:       72.23.180.0 - 72.23.180.127\\nNetType:        reallocation\\nOriginAS:       27364\\nRegDate:        2020-10-22\\nUpdated:        2020-10-22\\nSource:         ARIN\\n\n\nOrgID:          ARMC\\nOrgName:        Armstrong\\nCanAllocate:    \\nStreet:         ONE Armstrong Place\\nCity:           Butler\\nState/Prov:     PA\\nCountry:        US\\nPostalCode:     16001\\nRegDate:        1997-08-28\\nUpdated:        2022-04-18\\nOrgAbuseHandle: NOC11974-ARIN\\nOrgAdminHandle: NOC11973-ARIN\\nOrgNOCHandle:   NOC11973-ARIN\\nOrgTechHandle:  NOC11973-ARIN\\nSource:         ARIN\\n\n\nPOCHandle:      NOC11974-ARIN\\nIsRole:         Y\\nLastName:       Network Operations Center\\nFirstName:      \\nStreet:         One Armstrong Place\\nCity:           Butler\\nState/Prov:     PA\\nCountry:        US\\nPostalCode:     16001\\nRegDate:        2011-04-28\\nUpdated:        2022-04-20\\nFaxPhone:       +1-724-282-5624\\nOfficePhone:    +1-877-277-5709\\nMailbox:        abuse@zoominternet.net\\nSource:         ARIN\\n\n\nPOCHandle:      NOC11973-ARIN\\nIsRole:         Y\\nLastName:       Network Operations Center\\nFirstName:      \\nStreet:         One Armstrong Place\\nCity:           Butler\\nState/Prov:     PA\\nCountry:        US\\nPostalCode:     16001\\nRegDate:        2011-04-28\\nUpdated:        2022-04-20\\nOfficePhone:    +1-877-277-5709\\nFaxPhone:       +1-724-282-5624\\nMailbox:        noc@zoominternet.net\\nSource:         ARIN\\n"}, {"range": "216.165.224.0/19", "id": "GF-DATA", "name": "Giggle Fiber", "country": "US", "domain": "gigglefiber.com", "org_id": "GFL-28", "status": "ALLOCATION", "tech_id": "HLW6-ARIN\\NVILLA120-ARIN", "mnt_id": "HLW6-ARIN\\NVILLA120-ARIN", "admin_id": "HAVER7-ARIN", "abuse_id": "VILLA120-ARIN", "created": "2003-02-03", "updated": "2014-10-14", "source": "arin", "raw": "NetHandle:      NET-216-165-224-0-1\\nOrgID:          GFL-28\\nParent:         NET-216-0-0-0-0\\nNetName:        GF-DATA\\nNetRange:       216.165.224.0 - 216.165.255.255\\nNetType:        allocation\\nRegDate:        2003-02-03\\nUpdated:        2014-10-14\\nSource:         ARIN\\n\n\nOrgID:          GFL-28\\nOrgName:        Giggle Fiber\\nCanAllocate:    \\nStreet:         911 S Primrose Ave. Ste. E\\nCity:           Monrovia\\nState/Prov:     CA\\nCountry:        US\\nPostalCode:     91016\\nRegDate:        2014-07-25\\nUpdated:        2017-01-28\\nOrgAbuseHandle: VILLA120-ARIN\\nOrgAdminHandle: HAVER7-ARIN\\nOrgNOCHandle:   HLW6-ARIN\\nOrgNOCHandle:   VILLA120-ARIN\\nOrgTechHandle:  HLW6-ARIN\\nOrgTechHandle:  VILLA120-ARIN\\nSource:         ARIN\\n\n\nPOCHandle:      HLW6-ARIN\\nIsRole:         N\\nLastName:       White\\nFirstName:      Herbert\\nStreet:         911 S PRIMROSE AVE, STE E\\nCity:           MONROVIA\\nState/Prov:     CA\\nCountry:        US\\nPostalCode:     91016\\nRegDate:        2016-10-27\\nUpdated:        2020-10-29\\nOfficePhone:    +1-323-908-1073\\nMailbox:        LYNN@GIGGLEFIBER.COM\\nSource:         ARIN\\n\n\nPOCHandle:      HAVER7-ARIN\\nIsRole:         N\\nLastName:       Haverkate\\nFirstName:      David\\nStreet:         911 S Primrose Ave. Ste E\\nCity:           Monrovia\\nState/Prov:     CA\\nCountry:        US\\nPostalCode:     91016\\nRegDate:        2014-07-24\\nUpdated:        2015-10-15\\nOfficePhone:    +1-626-386-5850\\nMobilePhone:    +1-303-503-3512\\nMailbox:        dave@havrk8.com\\nSource:         ARIN\\n\n\nPOCHandle:      VILLA120-ARIN\\nIsRole:         N\\nLastName:       Villalobos\\nFirstName:      Herbert\\nStreet:         911 S Primrose Ave. Ste E\\nCity:           Monrovia\\nState/Prov:     CA\\nCountry:        US\\nPostalCode:     91016\\nRegDate:        2014-07-24\\nUpdated:        2021-02-05\\nOfficePhone:    +1-323-908-1346\\nMailbox:        herbert@gigglefiber.com\\nMailbox:        admin@gigglefiber.com\\nSource:         ARIN\\n"}, {"range": "192.75.62.0/24", "id": "RODALE-OWNED-24", "name": "Rodale Inc.", "country": "US", "domain": "rodaleinc.com", "org_id": "RODAL-4", "status": "ALLOCATION", "tech_id": "PMC232-ARIN", "mnt_id": "PMC232-ARIN", "admin_id": "PMC232-ARIN", "abuse_id": "PMC232-ARIN", "created": "2014-12-05", "updated": "2021-12-14", "source": "arin", "raw": "NetHandle:      NET-192-75-62-0-1\\nOrgID:          RODAL-4\\nParent:         NET-192-0-0-0-0\\nNetName:        RODALE-OWNED-24\\nNetRange:       192.75.62.0 - 192.75.62.255\\nNetType:        allocation\\nRegDate:        2014-12-05\\nUpdated:        2021-12-14\\nSource:         ARIN\\n\n\nOrgID:          RODAL-4\\nOrgName:        Rodale Inc.\\nCanAllocate:    \\nStreet:         400 S. Tenth Street\\nCity:           Emmaus\\nState/Prov:     PA\\nCountry:        US\\nPostalCode:     18098\\nRegDate:        2014-10-28\\nUpdated:        2019-11-01\\nOrgAbuseHandle: PMC232-ARIN\\nOrgAdminHandle: PMC232-ARIN\\nOrgNOCHandle:   PMC232-ARIN\\nOrgTechHandle:  PMC232-ARIN\\nSource:         ARIN\\n\n\nPOCHandle:      PMC232-ARIN\\nIsRole:         N\\nLastName:       McCaskill\\nFirstName:      Pat\\nStreet:         3540 Toringdon Way\\nCity:           Charlotte\\nState/Prov:     NC\\nCountry:        US\\nPostalCode:     28277\\nRegDate:        2004-06-10\\nUpdated:        2022-04-04\\nOfficePhone:    +1-704-348-0666\\nMailbox:        pmccaskill@hearst.com\\nSource:         ARIN\\n"}, {"range": "192.189.100.0/24", "id": "NETA", "name": "National Aeronautics and Space Administration", "country": "US", "domain": "nasa.gov", "org_id": "NASA", "status": "ALLOCATION", "tech_id": "ZN7-ARIN", "mnt_id": "NISN-ARIN", "admin_id": "BGS7-ARIN", "abuse_id": "NASAA-ARIN", "created": "1992-07-13", "updated": "2002-08-27", "source": "arin", "raw": "NetHandle:      NET-192-189-100-0-1\\nOrgID:          NASA\\nParent:         NET-192-0-0-0-0\\nNetName:        NETA\\nNetRange:       192.189.100.0 - 192.189.100.255\\nNetType:        allocation\\nRegDate:        1992-07-13\\nUpdated:        2002-08-27\\nTechHandle:     ZN7-ARIN\\nSource:         ARIN\\n\n\nOrgID:          NASA\\nOrgName:        National Aeronautics and Space Administration\\nCanAllocate:    \\nStreet:         IS05/Office of the Chief Information Officer\\nCity:           MSFC\\nState/Prov:     AL\\nCountry:        US\\nPostalCode:     35812\\nRegDate:        1970-01-01\\nUpdated:        2020-04-09\\nOrgAbuseHandle: NASAA-ARIN\\nOrgAdminHandle: BGS7-ARIN\\nOrgNOCHandle:   NISN-ARIN\\nOrgTechHandle:  IPAMO-ARIN\\nOrgTechHandle:  RFBJ-ARIN\\nSource:         ARIN\\n\n\nPOCHandle:      BGS7-ARIN\\nIsRole:         N\\nLastName:       Schleckser\\nFirstName:      Barbara\\nStreet:         215 Wynn Dr\\nCity:           Huntsville\\nState/Prov:     AL\\nCountry:        US\\nPostalCode:     35806\\nRegDate:        2020-04-09\\nUpdated:        2022-03-28\\nOfficePhone:    +1-256-624-0178\\nMailbox:        barbara.g.schleckser@nasa.gov\\nSource:         ARIN\\n\n\nPOCHandle:      NASAA-ARIN\\nIsRole:         Y\\nLastName:       NASA Abuse\\nFirstName:      \\nStreet:         Center Operations Directorate\\nStreet:         Information Services Department\\nCity:           Marshall Space Flight Center\\nState/Prov:     AL\\nCountry:        US\\nPostalCode:     35812\\nRegDate:        2002-08-26\\nUpdated:        2003-07-10\\nOfficePhone:    +1-800-762-7472\\nMailbox:        abuse@nasa.gov\\nSource:         ARIN\\n\n\nPOCHandle:      NISN-ARIN\\nIsRole:         Y\\nLastName:       NASA Information Services Network\\nFirstName:      \\nStreet:         215 Wynn Dr., Suite 300\\nCity:           Huntsville\\nState/Prov:     AL\\nCountry:        US\\nPostalCode:     35805\\nRegDate:        2002-09-27\\nUpdated:        2015-11-02\\nOfficePhone:    +1-256-961-4000\\nMailbox:        noc@nisn.nasa.gov\\nSource:         ARIN\\n\n\nPOCHandle:      RFBJ-ARIN\\nIsRole:         N\\nLastName:       Bischof, Jr.\\nFirstName:      Ralph\\nStreet:         221 Wynn Drive\\nStreet:         Suite 500\\nCity:           Huntsville\\nState/Prov:     AL\\nCountry:        US\\nPostalCode:     35805\\nRegDate:        2005-12-20\\nUpdated:        2021-11-22\\nOfficePhone:    256-961-4000\\nMailbox:        dns@nasa.gov\\nMailbox:        dns.support@nasa.gov\\nMailbox:        Ralph.Bischof@nasa.gov\\nSource:         ARIN\\n\n\nPOCHandle:      ZN7-ARIN\\nIsRole:         Y\\nLastName:       Center Operations Directorate\\nFirstName:      \\nStreet:         Attn: FOIA Office\\nStreet:         Mail Code CO50\\nStreet:         Marshall Space Flight Center\\nCity:           Huntsville\\nState/Prov:     AL\\nCountry:        US\\nPostalCode:     35812\\nRegDate:        1999-11-19\\nUpdated:        2021-11-08\\nOfficePhone:    256-961-4000\\nMailbox:        dns.support@nasa.gov\\nMailbox:        dns@nasa.gov\\nSource:         ARIN\\n\n\nPOCHandle:      IPAMO-ARIN\\nIsRole:         Y\\nLastName:       IPAM Operations\\nFirstName:      \\nStreet:         MSFC\\nCity:           MSFC\\nState/Prov:     AL\\nCountry:        US\\nPostalCode:     35812\\nRegDate:        2010-11-01\\nUpdated:        2021-11-15\\nOfficePhone:    +1-256-961-4726\\nMailbox:        ipam@nasa.gov\\nSource:         ARIN\\n"}, {"range": "192.161.66.0/23", "id": "SECOM-IPV4-NETWORK3", "name": "Secom, Inc", "country": "US", "domain": "secom.net", "org_id": "SECOM-2", "status": "ALLOCATION", "tech_id": "NOC13149-ARIN", "mnt_id": "NOC13149-ARIN", "admin_id": "HOSTM1959-ARIN", "abuse_id": "NOC13149-ARIN", "created": "2015-03-11", "updated": "2015-03-11", "source": "arin", "raw": "NetHandle:      NET-192-161-66-0-1\\nOrgID:          SECOM-2\\nParent:         NET-192-0-0-0-0\\nNetName:        SECOM-IPV4-NETWORK3\\nNetRange:       192.161.66.0 - 192.161.67.255\\nNetType:        allocation\\nOriginAS:       16832\\nRegDate:        2015-03-11\\nUpdated:        2015-03-11\\nSource:         ARIN\\n\n\nOrgID:          SECOM-2\\nOrgName:        Secom, Inc\\nCanAllocate:    \\nStreet:         27850 Harris Rd\\nStreet:         PO Box 357\\nCity:           La Junta\\nState/Prov:     CO\\nCountry:        US\\nPostalCode:     81050\\nRegDate:        2013-05-09\\nUpdated:        2019-05-11\\nOrgAbuseHandle: NOC13149-ARIN\\nOrgAdminHandle: HOSTM1959-ARIN\\nOrgNOCHandle:   NOC13149-ARIN\\nOrgTechHandle:  NOC13149-ARIN\\nSource:         ARIN\\n\n\nPOCHandle:      HOSTM1959-ARIN\\nIsRole:         Y\\nLastName:       Hostmaster\\nFirstName:      \\nStreet:         PO Box 357\\nCity:           La Junta\\nState/Prov:     CO\\nCountry:        US\\nPostalCode:     81050\\nRegDate:        2013-05-08\\nUpdated:        2019-05-11\\nOfficePhone:    +1-719-383-1349\\nMailbox:        hostmaster@secom.net\\nSource:         ARIN\\n\n\nPOCHandle:      NOC13149-ARIN\\nIsRole:         Y\\nLastName:       Network Operations Center\\nFirstName:      \\nStreet:         PO Box 357\\nCity:           La Junta\\nState/Prov:     CO\\nCountry:        US\\nPostalCode:     81050\\nRegDate:        2013-05-08\\nUpdated:        2021-10-20\\nOfficePhone:    +1-719-383-1349\\nMailbox:        noc@secom.net\\nSource:         ARIN\\n"}, {"range": "129.246.0.0/16", "id": "IDA", "name": "Institute for Defense Analyses", "country": "US", "domain": "ida.org", "org_id": "IDA-2-Z", "status": "ALLOCATION", "tech_id": "CMU49-ARIN", "mnt_id": "CJF8-ARIN", "admin_id": "JPR121-ARIN", "abuse_id": "DL1558-ARIN", "created": "1988-03-29", "updated": "2021-12-14", "source": "arin", "raw": "NetHandle:      NET-129-246-0-0-1\\nOrgID:          IDA-2-Z\\nParent:         NET-129-0-0-0-0\\nNetName:        IDA\\nNetRange:       129.246.0.0 - 129.246.255.255\\nNetType:        allocation\\nRegDate:        1988-03-29\\nUpdated:        2021-12-14\\nSource:         ARIN\\n\n\nOrgID:          IDA-2-Z\\nOrgName:        Institute for Defense Analyses\\nCanAllocate:    \\nStreet:         4850 Mark Center Dr\\nCity:           Alexandria\\nState/Prov:     VA\\nCountry:        US\\nPostalCode:     22311\\nRegDate:        2010-02-01\\nUpdated:        2019-03-18\\nOrgAbuseHandle: DL1558-ARIN\\nOrgAdminHandle: JPR121-ARIN\\nOrgNOCHandle:   CJF8-ARIN\\nOrgTechHandle:  CMU49-ARIN\\nSource:         ARIN\\n\n\nPOCHandle:      CJF8-ARIN\\nIsRole:         N\\nLastName:       Faber\\nFirstName:      Chris\\nStreet:         4850 Mark Center Drive\\nCity:           Alexandria\\nState/Prov:     VA\\nCountry:        US\\nPostalCode:     22311\\nRegDate:        2019-03-18\\nUpdated:        2021-08-04\\nOfficePhone:    +1-703-845-2114\\nMailbox:        cfaber@ida.org\\nSource:         ARIN\\n\n\nPOCHandle:      DL1558-ARIN\\nIsRole:         N\\nLastName:       Limo\\nFirstName:      Domingo\\nStreet:         730 E. Glebe Road\\nCity:           Alexandria\\nState/Prov:     VA\\nCountry:        US\\nPostalCode:     22305\\nRegDate:        1996-07-05\\nUpdated:        2022-04-01\\nOfficePhone:    +1-703-578-2791\\nMailbox:        dlimo@ida.org\\nSource:         ARIN\\n\n\nPOCHandle:      JPR121-ARIN\\nIsRole:         N\\nLastName:       Przybycien\\nFirstName:      John\\nStreet:         730 East Glebe Road\\nCity:           Alexandria\\nState/Prov:     VA\\nCountry:        US\\nPostalCode:     22305\\nRegDate:        2009-02-22\\nUpdated:        2022-05-20\\nOfficePhone:    +1-703-845-2246\\nMailbox:        jprzybyc@ida.org\\nSource:         ARIN\\n\n\nPOCHandle:      CMU49-ARIN\\nIsRole:         N\\nLastName:       Murphy\\nFirstName:      Chris\\nStreet:         4850 Mark Center Dr\\nCity:           Alexandria\\nState/Prov:     VA\\nCountry:        US\\nPostalCode:     22311\\nRegDate:        2008-11-20\\nUpdated:        2021-11-10\\nOfficePhone:    +1-703-845-6833\\nMailbox:        cmurphy@ida.org\\nSource:         ARIN\\n"}, {"range": "209.251.48.0/20", "id": "CENTRILOGIC-ROCH-NY", "name": "Centrilogic, Inc.", "country": "US", "domain": "centrilogic.com", "org_id": "CENTR-60", "status": "ALLOCATION", "tech_id": "CIT3-ARIN", "mnt_id": "CIT3-ARIN", "admin_id": "CIA18-ARIN", "abuse_id": "DACEN-ARIN", "created": "2008-03-25", "updated": "2012-03-02", "source": "arin", "raw": "NetHandle:      NET-209-251-48-0-1\\nOrgID:          CENTR-60\\nParent:         NET-209-0-0-0-0\\nNetName:        CENTRILOGIC-ROCH-NY\\nNetRange:       209.251.48.0 - 209.251.63.255\\nNetType:        allocation\\nOriginAS:       19693\\nComment:        CIT3-ARIN\\nRegDate:        2008-03-25\\nUpdated:        2012-03-02\\nAbuseHandle:    CIT3-ARIN\\nNOCHandle:      CIT3-ARIN\\nTechHandle:     CIT3-ARIN\\nSource:         ARIN\\n\n\nOrgID:          CENTR-60\\nOrgName:        Centrilogic, Inc.\\nCanAllocate:    \\nStreet:         28 Mansfield Street\\nCity:           Rochester\\nState/Prov:     NY\\nCountry:        US\\nPostalCode:     14606\\nComment:        http://www.centrilogic.com/\\nRegDate:        2007-05-14\\nUpdated:        2020-12-15\\nReferralServer: rwhois://rwhois.centrilogic.com:4321\\nOrgAbuseHandle: DACEN-ARIN\\nOrgAdminHandle: CIA18-ARIN\\nOrgNOCHandle:   CIT3-ARIN\\nOrgTechHandle:  CIT3-ARIN\\nSource:         ARIN\\n\n\nPOCHandle:      CIA18-ARIN\\nIsRole:         Y\\nLastName:       Centrilogic IP Admin\\nFirstName:      \\nStreet:         28 Mansfield Street\\nCity:           Rochester\\nState/Prov:     NY\\nCountry:        US\\nPostalCode:     14606\\nRegDate:        2007-05-10\\nUpdated:        2022-04-20\\nOfficePhone:    +1-888-999-3091\\nMailbox:        IPadmin@centrilogic.com\\nSource:         ARIN\\n\n\nPOCHandle:      CIT3-ARIN\\nIsRole:         Y\\nLastName:       Centrilogic IP Tech\\nFirstName:      \\nStreet:         28 Mansfield Street\\nCity:           Rochester\\nState/Prov:     NY\\nCountry:        US\\nPostalCode:     14606\\nRegDate:        2007-05-10\\nUpdated:        2021-09-17\\nOfficePhone:    +1-888-999-3091\\nMailbox:        IPtech@centrilogic.com\\nSource:         ARIN\\n\n\nPOCHandle:      DACEN-ARIN\\nIsRole:         Y\\nLastName:       Dacentec Abuse\\nFirstName:      \\nStreet:         801 Main Street NW\\nCity:           Lenoir\\nState/Prov:     NC\\nCountry:        US\\nPostalCode:     28645\\nRegDate:        2012-10-03\\nUpdated:        2021-12-20\\nOfficePhone:    +1-828-393-4443\\nMailbox:        abuse@dacentec.com\\nSource:         ARIN\\n"}, {"range": "205.245.67.0/24", "id": "SPRINTLINK", "name": "International Monetary Fund", "country": "US", "domain": "imf.org", "org_id": "IMF", "status": "REASSIGNMENT", "tech_id": "RST174-ARIN", "mnt_id": "KAMUN1-ARIN\\NKJS19-ARIN", "admin_id": "KAMUN1-ARIN", "abuse_id": "KAMUN1-ARIN", "created": "2009-12-16", "updated": "2009-12-16", "source": "arin", "raw": "NetHandle:      NET-205-245-67-0-1\\nOrgID:          IMF\\nParent:         NET-205-240-0-0-1\\nNetName:        SPRINTLINK\\nNetRange:       205.245.67.0 - 205.245.67.255\\nNetType:        reassignment\\nRegDate:        2009-12-16\\nUpdated:        2009-12-16\\nTechHandle:     RST174-ARIN\\nSource:         ARIN\\n\n\nOrgID:          IMF\\nOrgName:        International Monetary Fund\\nCanAllocate:    \\nStreet:         700 19th Street, NW\\nCity:           Washington\\nState/Prov:     DC\\nCountry:        US\\nPostalCode:     20431\\nRegDate:        1989-05-23\\nUpdated:        2022-05-11\\nOrgDNSHandle:   KJS19-ARIN\\nOrgAbuseHandle: KAMUN1-ARIN\\nOrgAbuseHandle: KJS19-ARIN\\nOrgAdminHandle: KAMUN1-ARIN\\nOrgDNSHandle:   KAMUN1-ARIN\\nOrgNOCHandle:   KAMUN1-ARIN\\nOrgNOCHandle:   KJS19-ARIN\\nOrgRoutingHandle:   KAMUN1-ARIN\\nOrgRoutingHandle:   KJS19-ARIN\\nOrgTechHandle:  KAMUN1-ARIN\\nOrgTechHandle:  KJS19-ARIN\\nSource:         ARIN\\n\n\nPOCHandle:      KJS19-ARIN\\nIsRole:         N\\nLastName:       Kim\\nFirstName:      Jong Soon\\nStreet:         1900 Pennsylvania Ave NW\\nCity:           Washington\\nState/Prov:     DC\\nCountry:        US\\nPostalCode:     20431\\nRegDate:        2018-03-26\\nUpdated:        2022-05-11\\nOfficePhone:    +1-202-623-8103\\nMailbox:        netengsvc@imf.org\\nMailbox:        JKim3@imf.org\\nSource:         ARIN\\n\n\nPOCHandle:      RST174-ARIN\\nIsRole:         N\\nLastName:       Tobias\\nFirstName:      Robert\\nStreet:         700 19th St, NW\\nCity:           Washington\\nState/Prov:     DC\\nCountry:        US\\nPostalCode:     20431\\nRegDate:        2008-07-21\\nUpdated:        2018-12-05\\nOfficePhone:    +1-202-623-7874\\nMailbox:        rtobias@imf.org\\nSource:         ARIN\\n\n\nPOCHandle:      KAMUN1-ARIN\\nIsRole:         N\\nLastName:       Kamunde\\nFirstName:      Antony\\nStreet:         700 19th Street NW\\nCity:           Washington DC\\nState/Prov:     DC\\nCountry:        US\\nPostalCode:     20431\\nRegDate:        2022-05-11\\nUpdated:        2022-05-11\\nOfficePhone:    +1-202-415-2046\\nMailbox:        akamunde@imf.org\\nSource:         ARIN\\n"}, {"range": "65.117.135.0/29", "id": "Q0301-65-117-135-0", "name": "Choctaw Nation of Oklahoma", "country": "US", "domain": "choctawnation.com", "org_id": "CNO-7", "status": "REASSIGNMENT", "tech_id": "ANDER2331-ARIN\\NNOC32848-ARIN", "mnt_id": "NOC32848-ARIN", "admin_id": "DCOEI-ARIN", "abuse_id": "NOC32848-ARIN", "created": "2017-03-01", "updated": "2017-03-01", "source": "arin", "raw": "NetHandle:      NET-65-117-135-0-1\\nOrgID:          CNO-7\\nParent:         NET-65-112-0-0-1\\nNetName:        Q0301-65-117-135-0\\nNetRange:       65.117.135.0 - 65.117.135.7\\nNetType:        reassignment\\nOriginAS:       209\\nRegDate:        2017-03-01\\nUpdated:        2017-03-01\\nSource:         ARIN\\n\n\nOrgID:          CNO-7\\nOrgName:        Choctaw Nation of Oklahoma\\nCanAllocate:    \\nStreet:         P.O. Box 1210\\nCity:           Durant\\nState/Prov:     OK\\nCountry:        US\\nPostalCode:     74702-1210\\nComment:        NOC is operational 24/7/365\\nRegDate:        2016-09-02\\nUpdated:        2022-06-29\\nOrgAbuseHandle: NOC32848-ARIN\\nOrgAdminHandle: DCOEI-ARIN\\nOrgNOCHandle:   NOC32848-ARIN\\nOrgTechHandle:  ANDER2331-ARIN\\nOrgTechHandle:  NOC32848-ARIN\\nSource:         ARIN\\n\n\nPOCHandle:      ANDER2331-ARIN\\nIsRole:         N\\nLastName:       anderson\\nFirstName:      brian\\nStreet:         4216 US-69\\nCity:           durant\\nState/Prov:     OK\\nCountry:        US\\nPostalCode:     74701\\nRegDate:        2022-04-13\\nUpdated:        2022-04-13\\nOfficePhone:    +1-580-924-8280\\nMailbox:        baanderson@choctawnation.com\\nSource:         ARIN\\n\n\nPOCHandle:      NOC32848-ARIN\\nIsRole:         Y\\nLastName:       NOC\\nFirstName:      \\nStreet:         1802 Chukka Hina\\nCity:           durant\\nState/Prov:     OK\\nCountry:        US\\nPostalCode:     74701\\nRegDate:        2018-08-21\\nUpdated:        2022-04-07\\nOfficePhone:    +1-580-920-7025\\nMailbox:        DCTR@choctawnation.com\\nSource:         ARIN\\n\n\nPOCHandle:      DCOEI-ARIN\\nIsRole:         Y\\nLastName:       Data Center Operation Engineer II\\nFirstName:      \\nStreet:         1100 west Main\\nCity:           durant\\nState/Prov:     OK\\nCountry:        US\\nPostalCode:     74701\\nRegDate:        2017-04-26\\nUpdated:        2022-05-24\\nOfficePhone:    +1-580-920-7025\\nMailbox:        DCTR@choctawnation.com\\nSource:         ARIN\\n"}, {"range": "65.132.202.184/29", "id": "Q1216-65-132-202-184", "name": "AIRESPRING, INC.", "country": "US", "domain": "airespring.com", "org_id": "AIRES-25", "status": "REALLOCATION", "tech_id": "NOC33032-ARIN\\NOPSNE22-ARIN", "mnt_id": "ABUSE5351-ARIN", "admin_id": "OPSNE22-ARIN", "abuse_id": "ABUSE5351-ARIN", "created": "2019-12-16", "updated": "2019-12-16", "source": "arin", "raw": "NetHandle:      NET-65-132-202-184-1\\nOrgID:          AIRES-25\\nParent:         NET-65-128-0-0-1\\nNetName:        Q1216-65-132-202-184\\nNetRange:       65.132.202.184 - 65.132.202.191\\nNetType:        reallocation\\nOriginAS:       209\\nRegDate:        2019-12-16\\nUpdated:        2019-12-16\\nSource:         ARIN\\n\n\nOrgID:          AIRES-25\\nOrgName:        AIRESPRING, INC.\\nCanAllocate:    \\nStreet:         7800 Woodley Ave\\nCity:           VAN NUYS\\nState/Prov:     CA\\nCountry:        US\\nPostalCode:     91406\\nRegDate:        2004-10-20\\nUpdated:        2020-01-07\\nOrgAbuseHandle: ABUSE5351-ARIN\\nOrgAdminHandle: OPSNE22-ARIN\\nOrgNOCHandle:   ABUSE5351-ARIN\\nOrgTechHandle:  NOC33032-ARIN\\nOrgTechHandle:  OPSNE22-ARIN\\nSource:         ARIN\\n\n\nPOCHandle:      OPSNE22-ARIN\\nIsRole:         N\\nLastName:       Ops\\nFirstName:      Net\\nStreet:         7800 Woodley Ave\\nCity:           Van Nuys\\nState/Prov:     CA\\nCountry:        US\\nPostalCode:     91406\\nRegDate:        2019-02-12\\nUpdated:        2022-03-01\\nOfficePhone:    +1-818-922-1181\\nMailbox:        netops@airespring.com\\nSource:         ARIN\\n\n\nPOCHandle:      NOC33032-ARIN\\nIsRole:         Y\\nLastName:       Network Operation Center\\nFirstName:      \\nStreet:         7800 Woodley Ave\\nCity:           Van Nuys\\nState/Prov:     CA\\nCountry:        US\\nPostalCode:     91406\\nRegDate:        2019-10-16\\nUpdated:        2021-10-15\\nOfficePhone:    +1-818-738-1784\\nMailbox:        PJ.Yegani@AireSpring.com\\nSource:         ARIN\\n\n\nPOCHandle:      ABUSE5351-ARIN\\nIsRole:         Y\\nLastName:       Abuse Dept\\nFirstName:      \\nStreet:         7800 Woodley Ave\\nCity:           Van Nuys\\nState/Prov:     CA\\nCountry:        US\\nPostalCode:     91406\\nRegDate:        2016-02-08\\nUpdated:        2022-05-17\\nOfficePhone:    +1-888-288-5010\\nMailbox:        abuse@airespring.com\\nSource:         ARIN\\n"}, {"range": "2607:f748::/32", "id": "IWEB-BLKV6-01", "name": "iWeb Technologies Inc.", "country": "CA", "domain": "iweb.com", "org_id": "GIT-20", "status": "ALLOCATION", "tech_id": "NETWO2356-ARIN", "mnt_id": "NETWO2356-ARIN", "admin_id": "NETWO2356-ARIN", "abuse_id": "ABUSE1906-ARIN", "created": "2008-12-19", "updated": "2015-07-29", "source": "arin", "raw": "V6NetHandle:    NET6-2607-F748-1\\nOrgID:          GIT-20\\nParent:         NET6-2600-1\\nNetName:        IWEB-BLKV6-01\\nNetRange:       2607:F748:: - 2607:F748:FFFF:FFFF:FFFF:FFFF:FFFF:FFFF\\nNetType:        allocation\\nOriginAS:       32613\\nComment:        Please use abuse@noc.privatedns.com for abuse issues.\\nRegDate:        2008-12-19\\nUpdated:        2015-07-29\\nSource:         ARIN\\n\n\nOrgID:          GIT-20\\nOrgName:        iWeb Technologies Inc.\\nCanAllocate:    \\nStreet:         20, place du Commerce\\nCity:           Montreal\\nState/Prov:     QC\\nCountry:        CA\\nPostalCode:     H3E-1Z6\\nComment:        http://www.iweb.com\\nRegDate:        2003-11-06\\nUpdated:        2019-09-25\\nOrgAbuseHandle: ABUSE1906-ARIN\\nOrgAdminHandle: NETWO2356-ARIN\\nOrgNOCHandle:   NETWO2356-ARIN\\nOrgTechHandle:  NETWO2356-ARIN\\nSource:         ARIN\\n\n\nPOCHandle:      ABUSE1906-ARIN\\nIsRole:         Y\\nLastName:       Abuse Coordinator\\nFirstName:      \\nStreet:         20, place du Commerce\\nCity:           Montreal\\nState/Prov:     QC\\nCountry:        CA\\nPostalCode:     H3E-1Z6\\nRegDate:        2008-03-28\\nUpdated:        2022-05-25\\nOfficePhone:    +1-514-286-4242\\nMailbox:        abuse@iweb.com\\nSource:         ARIN\\n\n\nPOCHandle:      NETWO2356-ARIN\\nIsRole:         Y\\nLastName:       Network Administrator\\nFirstName:      \\nStreet:         20, place du Commerce\\nCity:           Montreal\\nState/Prov:     QC\\nCountry:        CA\\nPostalCode:     H3E-1Z6\\nRegDate:        2008-03-28\\nUpdated:        2022-06-01\\nOfficePhone:    +1-514-286-4242\\nMailbox:        netops@ca.leaseweb.com\\nSource:         ARIN\\n"}, {"range": "192.94.105.0/24", "id": "UNMC4", "name": "University of Nebraska Medical Center", "country": "US", "domain": "unmc.edu", "org_id": "UNMC", "status": "ALLOCATION", "tech_id": "MRN6-ARIN", "mnt_id": "NETWO3886-ARIN", "admin_id": "NETWO3886-ARIN", "abuse_id": "NETWO3886-ARIN", "created": "1991-02-21", "updated": "2021-12-14", "source": "arin", "raw": "NetHandle:      NET-192-94-105-0-1\\nOrgID:          UNMC\\nParent:         NET-192-0-0-0-0\\nNetName:        UNMC4\\nNetRange:       192.94.105.0 - 192.94.105.255\\nNetType:        allocation\\nRegDate:        1991-02-21\\nUpdated:        2021-12-14\\nTechHandle:     MRN6-ARIN\\nSource:         ARIN\\n\n\nOrgID:          UNMC\\nOrgName:        University of Nebraska Medical Center\\nCanAllocate:    \\nStreet:         985030 Nebraska Medical Center\\nCity:           Omaha\\nState/Prov:     NE\\nCountry:        US\\nPostalCode:     68198-5030\\nRegDate:        1989-01-03\\nUpdated:        2018-01-30\\nOrgAbuseHandle: NETWO3886-ARIN\\nOrgAdminHandle: NETWO3886-ARIN\\nOrgNOCHandle:   NETWO3886-ARIN\\nOrgTechHandle:  NETWO3886-ARIN\\nSource:         ARIN\\n\n\nPOCHandle:      MRN6-ARIN\\nIsRole:         N\\nLastName:       Newcomb\\nFirstName:      Michael\\nStreet:         LAB-Interlink, Inc.\\nStreet:         1011 South Saddle Creek Road\\nCity:           Omaha\\nState/Prov:     NE\\nCountry:        US\\nPostalCode:     68106\\nRegDate:        1970-01-01\\nUpdated:        1996-09-13\\nOfficePhone:    +1-402-595-3767\\nMailbox:        mnewcomb@labinterlink.com\\nSource:         ARIN\\n\n\nPOCHandle:      NETWO3886-ARIN\\nIsRole:         Y\\nLastName:       Network Services\\nFirstName:      \\nStreet:         985030 Nebraska Medical Center\\nCity:           Omaha\\nState/Prov:     NE\\nCountry:        US\\nPostalCode:     68198-5030\\nRegDate:        2010-08-10\\nUpdated:        2021-12-20\\nOfficePhone:    +1-402-559-5378\\nMailbox:        rengel@nebraskamed.com\\nMailbox:        mdwiggins@nebraskamed.com\\nMailbox:        brluger@nebraskamed.com\\nMailbox:        stbusby@nebraskamed.com\\nSource:         ARIN\\n"}, {"range": "216.198.65.0/24", "id": "IQNT-BROAD-6", "name": "Inteliquent, inc.", "country": "US", "domain": "inteliquent.com", "org_id": "NTAJC", "status": "ALLOCATION", "tech_id": "APC12-ARIN\\NCDO98-ARIN\\NDESAI247-ARIN\\NUSA9-ARIN", "mnt_id": "CDO98-ARIN\\NAPC12-ARIN\\NUSA9-ARIN", "admin_id": "CDO98-ARIN", "abuse_id": "APC12-ARIN", "created": "2000-04-13", "updated": "2017-03-16", "source": "arin", "raw": "NetHandle:      NET-216-198-65-0-1\\nOrgID:          NTAJC\\nParent:         NET-216-0-0-0-0\\nNetName:        IQNT-BROAD-6\\nNetRange:       216.198.65.0 - 216.198.65.255\\nNetType:        allocation\\nRegDate:        2000-04-13\\nUpdated:        2017-03-16\\nSource:         ARIN\\n\n\nOrgID:          NTAJC\\nOrgName:        Inteliquent, inc.\\nCanAllocate:    \\nStreet:         550 West Adams St.\\nStreet:         Suite 900\\nCity:           CHICAGO\\nState/Prov:     IL\\nCountry:        US\\nPostalCode:     60661\\nRegDate:        2004-09-11\\nUpdated:        2019-10-14\\nOrgNOCHandle:   CDO98-ARIN\\nOrgAbuseHandle: APC12-ARIN\\nOrgAbuseHandle: CDO98-ARIN\\nOrgAbuseHandle: USA9-ARIN\\nOrgAdminHandle: CDO98-ARIN\\nOrgNOCHandle:   APC12-ARIN\\nOrgNOCHandle:   USA9-ARIN\\nOrgTechHandle:  APC12-ARIN\\nOrgTechHandle:  CDO98-ARIN\\nOrgTechHandle:  DESAI247-ARIN\\nOrgTechHandle:  USA9-ARIN\\nSource:         ARIN\\n\n\nPOCHandle:      APC12-ARIN\\nIsRole:         Y\\nLastName:       Admin Point of Contact\\nFirstName:      \\nStreet:         10300 6th Ave N\\nCity:           Plymouth\\nState/Prov:     MN\\nCountry:        US\\nPostalCode:     55441\\nRegDate:        2008-06-24\\nUpdated:        2021-07-23\\nOfficePhone:    +1-952-230-4848\\nMailbox:        arinpoc@onvoy.com\\nSource:         ARIN\\n\n\nPOCHandle:      USA9-ARIN\\nIsRole:         N\\nLastName:       Unnava\\nFirstName:      Sai Anvesh\\nStreet:         550 West Adams St\\nCity:           CHICAGO\\nState/Prov:     IL\\nCountry:        US\\nPostalCode:     60661\\nRegDate:        2018-10-24\\nUpdated:        2021-10-28\\nOfficePhone:    +1-312-348-8837\\nMailbox:        sai.unnava@inteliquent.com\\nSource:         ARIN\\n\n\nPOCHandle:      DESAI247-ARIN\\nIsRole:         N\\nLastName:       Desai\\nFirstName:      Tariq\\nStreet:         550 W Adams St. Suite 900\\nCity:           Chicago\\nState/Prov:     IL\\nCountry:        US\\nPostalCode:     60661\\nRegDate:        2019-04-24\\nUpdated:        2021-09-23\\nOfficePhone:    +1-312-380-4530\\nMailbox:        tariq.desai@inteliquent.com\\nSource:         ARIN\\n\n\nPOCHandle:      CDO98-ARIN\\nIsRole:         N\\nLastName:       Olson\\nFirstName:      Craig\\nStreet:         10300 6th Ave N\\nCity:           Plymouth\\nState/Prov:     MN\\nCountry:        US\\nPostalCode:     55426\\nRegDate:        2018-11-06\\nUpdated:        2018-11-06\\nMobilePhone:    +1-763-458-6688\\nOfficePhone:    +1-952-230-4882\\nMailbox:        craig.olson@inteliquent.com\\nSource:         ARIN\\n"}, {"range": "66.48.75.128/26", "id": "WIDEPORTUU1", "name": "Wideport.com Inc.", "country": "CA", "domain": "wideport.com", "org_id": "WIDEPO", "status": "REASSIGNMENT", "tech_id": "SC1306-ARIN", "mnt_id": "TOD4-ARIN", "admin_id": "COO-ARIN", "abuse_id": "SYSTE39-ARIN", "created": "2001-12-29", "updated": "2001-12-29", "source": "arin", "raw": "NetHandle:      NET-66-48-75-128-1\\nOrgID:          WIDEPO\\nParent:         NET-66-48-0-0-1\\nNetName:        WIDEPORTUU1\\nNetRange:       66.48.75.128 - 66.48.75.191\\nNetType:        reassignment\\nRegDate:        2001-12-29\\nUpdated:        2001-12-29\\nTechHandle:     SC1306-ARIN\\nSource:         ARIN\\n\n\nOrgID:          WIDEPO\\nOrgName:        Wideport.com Inc.\\nCanAllocate:    \\nStreet:         714-10 Milner Business Court\\nCity:           Toronto\\nState/Prov:     ON\\nCountry:        CA\\nPostalCode:     M1B 3C6\\nRegDate:        2001-12-29\\nUpdated:        2016-08-31\\nOrgAbuseHandle: SYSTE39-ARIN\\nOrgAdminHandle: COO-ARIN\\nOrgNOCHandle:   TOD4-ARIN\\nOrgTechHandle:  CTO10-ARIN\\nSource:         ARIN\\n\n\nPOCHandle:      TOD4-ARIN\\nIsRole:         Y\\nLastName:       Technical Operations Director\\nFirstName:      \\nStreet:         714-10 Milner Business Court\\nCity:           Toronto\\nState/Prov:     ON\\nCountry:        CA\\nPostalCode:     M1B 3C6\\nRegDate:        2003-06-12\\nUpdated:        2020-09-03\\nOfficePhone:    +1-844-411-9411\\nMailbox:        noc@wideport.com\\nSource:         ARIN\\n\n\nPOCHandle:      SC1306-ARIN\\nIsRole:         N\\nLastName:       Curry\\nFirstName:      Steve\\nStreet:         Wideport.com Inc.\\nStreet:         1100-120 Eglington Ave\\nCity:           Toronto\\nState/Prov:     ON\\nCountry:        CA\\nPostalCode:     M4P 1E2\\nRegDate:        2001-12-29\\nUpdated:        2011-01-04\\nOfficePhone:    +1-416-322-4843\\nMailbox:        steve@wideport.com\\nSource:         ARIN\\n\n\nPOCHandle:      SYSTE39-ARIN\\nIsRole:         Y\\nLastName:       System Administrator\\nFirstName:      \\nStreet:         714-10 Milner Business Court\\nCity:           Toronto\\nState/Prov:     ON\\nCountry:        CA\\nPostalCode:     M1B 3C6\\nRegDate:        2003-06-12\\nUpdated:        2020-09-03\\nOfficePhone:    +1-844-411-9411\\nMailbox:        root@wideport.com\\nSource:         ARIN\\n\n\nPOCHandle:      CTO10-ARIN\\nIsRole:         Y\\nLastName:       Chief Technology Officer\\nFirstName:      \\nStreet:         714-10 Milner Business Court\\nCity:           Toronto\\nState/Prov:     ON\\nCountry:        CA\\nPostalCode:     M1B 3C6\\nRegDate:        2003-06-12\\nUpdated:        2020-09-03\\nOfficePhone:    +1-844-411-9411\\nMailbox:        cto@wideport.com\\nSource:         ARIN\\n\n\nPOCHandle:      COO-ARIN\\nIsRole:         Y\\nLastName:       Chief Operating Officer\\nFirstName:      \\nStreet:         714-10 Milner Business Court\\nCity:           Toronto\\nState/Prov:     ON\\nCountry:        CA\\nPostalCode:     M1B 3C6\\nRegDate:        2003-06-12\\nUpdated:        2020-09-03\\nOfficePhone:    +1-844-411-9411\\nMailbox:        ceo@wideport.com\\nSource:         ARIN\\n"}, {"range": "66.235.210.0-66.235.213.255", "id": "IPOWERWEB-NET", "name": "Newfold Digital, Inc.", "country": "US", "domain": "enduranceinternational.com", "org_id": "EIG-12", "status": "ALLOCATION", "tech_id": "ENO74-ARIN", "mnt_id": "ENO74-ARIN", "admin_id": "ENO74-ARIN", "abuse_id": "EIGAB-ARIN", "created": "2003-07-07", "updated": "2012-02-24", "source": "arin", "raw": "NetHandle:      NET-66-235-210-0-1\\nOrgID:          EIG-12\\nParent:         NET-66-0-0-0-0\\nNetName:        IPOWERWEB-NET\\nNetRange:       66.235.210.0 - 66.235.213.255\\nNetType:        allocation\\nOriginAS:       29873\\nRegDate:        2003-07-07\\nUpdated:        2012-02-24\\nSource:         ARIN\\n\n\nOrgID:          EIG-12\\nOrgName:        Newfold Digital, Inc.\\nCanAllocate:    \\nStreet:         5535 Gate Parkway\\nCity:           Jacksonville\\nState/Prov:     FL\\nCountry:        US\\nPostalCode:     32256\\nRegDate:        2005-02-07\\nUpdated:        2021-10-29\\nOrgAbuseHandle: EIGAB-ARIN\\nOrgAdminHandle: ENO74-ARIN\\nOrgNOCHandle:   ENO74-ARIN\\nOrgTechHandle:  ENO74-ARIN\\nSource:         ARIN\\n\n\nPOCHandle:      ENO74-ARIN\\nIsRole:         Y\\nLastName:       EIG Network Operations\\nFirstName:      \\nStreet:         10 Corporate Drive\\nCity:           Burlington\\nState/Prov:     MA\\nCountry:        US\\nPostalCode:     01803\\nRegDate:        2010-08-25\\nUpdated:        2021-11-17\\nOfficePhone:    +1-781-852-3200\\nOfficePhone:    +1-877-659-6181\\nMailbox:        eig-noc@endurance.com\\nMailbox:        eig-net-team@endurance.com\\nSource:         ARIN\\n\n\nPOCHandle:      EIGAB-ARIN\\nIsRole:         Y\\nLastName:       eig-abuse\\nFirstName:      \\nStreet:         10 Corporate Drive\\nCity:           Burlington\\nState/Prov:     MA\\nCountry:        US\\nPostalCode:     01803\\nRegDate:        2013-08-13\\nUpdated:        2022-01-14\\nOfficePhone:    +1-781-852-3200\\nOfficePhone:    +1-877-659-6181\\nMailbox:        eig-abuse@endurance.com\\nSource:         ARIN\\n"}, {"range": "207.72.49.8/29", "id": "MICH-5864", "name": "Andrews University", "country": "US", "domain": "andrews.edu", "org_id": "ANDRE-21", "status": "REASSIGNMENT", "tech_id": "FREEM417-ARIN", "mnt_id": "FREEM417-ARIN", "admin_id": "IN-ORG-ARIN", "abuse_id": "IN-ORG-ARIN", "created": "2008-12-01", "updated": "2021-09-02", "source": "arin", "raw": "NetHandle:      NET-207-72-49-8-1\\nOrgID:          ANDRE-21\\nParent:         NET-207-72-0-0-1\\nNetName:        MICH-5864\\nNetRange:       207.72.49.8 - 207.72.49.15\\nNetType:        reassignment\\nRegDate:        2008-12-01\\nUpdated:        2021-09-02\\nAbuseHandle:    FREEM417-ARIN\\nNOCHandle:      FREEM417-ARIN\\nTechHandle:     FREEM417-ARIN\\nSource:         ARIN\\n\n\nOrgID:          ANDRE-21\\nOrgName:        Andrews University\\nCanAllocate:    \\nStreet:         100 US Highway 31\\nCity:           Berrien Springs\\nState/Prov:     MI\\nCountry:        US\\nPostalCode:     49104-0880\\nRegDate:        2008-12-01\\nUpdated:        2011-09-24\\nOrgAbuseHandle: IN-ORG-ARIN\\nOrgAdminHandle: IN-ORG-ARIN\\nOrgTechHandle:  IN-ORG-ARIN\\nSource:         ARIN\\n\n\nPOCHandle:      IN-ORG-ARIN\\nIsRole:         Y\\nLastName:       Internet Number Administrator\\nFirstName:      \\nStreet:         880 Technology Dr.,  Suite B\\nCity:           Ann Arbor\\nState/Prov:     MI\\nCountry:        US\\nPostalCode:     48108-8963\\nRegDate:        1999-02-18\\nUpdated:        2021-11-03\\nFaxPhone:       +1-734-527-5790\\nOfficePhone:    +1-734-527-5729\\nMailbox:        ipreg@merit.edu\\nSource:         ARIN\\n\n\nPOCHandle:      FREEM417-ARIN\\nIsRole:         N\\nLastName:       Freeman\\nFirstName:      Todd\\nStreet:         8490 East Campus Circle Dr\\nCity:           Berrien Springs\\nState/Prov:     MI\\nCountry:        US\\nPostalCode:     49104-0880\\nRegDate:        2021-01-19\\nUpdated:        2022-01-19\\nOfficePhone:    +1-269-471-6103\\nMailbox:        freeman@andrews.edu\\nSource:         ARIN\\n"}, {"range": "2605:f280::/32", "id": "RZWIPV6", "name": "RedZone Wireless, LLC", "country": "US", "domain": "redzonewireless.com", "org_id": "RW-35", "status": "ALLOCATION", "tech_id": "NIM11-ARIN", "mnt_id": "NIM11-ARIN", "admin_id": "NIM11-ARIN", "abuse_id": "NIM11-ARIN", "created": "2015-02-13", "updated": "2015-02-13", "source": "arin", "raw": "V6NetHandle:    NET6-2605-F280-1\\nOrgID:          RW-35\\nParent:         NET6-2600-1\\nNetName:        RZWIPV6\\nNetRange:       2605:F280:: - 2605:F280:FFFF:FFFF:FFFF:FFFF:FFFF:FFFF\\nNetType:        allocation\\nOriginAS:       10249\\nComment:        http://www.redzonewireless.com\\nRegDate:        2015-02-13\\nUpdated:        2015-02-13\\nSource:         ARIN\\n\n\nOrgID:          RW-35\\nOrgName:        RedZone Wireless, LLC\\nCanAllocate:    \\nStreet:         91 Camden St.\\nCity:           Rockland\\nState/Prov:     ME\\nCountry:        US\\nPostalCode:     04841\\nComment:        http://www.redzonewireless.com\\nComment:        Support 08:30-17:30 M-F EST\\nRegDate:        2014-02-06\\nUpdated:        2020-08-03\\nOrgAbuseHandle: NIM11-ARIN\\nOrgAdminHandle: NIM11-ARIN\\nOrgNOCHandle:   NIM11-ARIN\\nOrgTechHandle:  NIM11-ARIN\\nSource:         ARIN\\n\n\nPOCHandle:      NIM11-ARIN\\nIsRole:         Y\\nLastName:       Network Infrastructue Manager\\nFirstName:      \\nStreet:         91 Camden St.\\nCity:           Rockland\\nState/Prov:     ME\\nCountry:        US\\nPostalCode:     04841\\nRegDate:        2019-01-22\\nUpdated:        2022-08-04\\nOfficePhone:    +1-207-446-2835\\nMailbox:        atibbetts@redzonewireless.com\\nSource:         ARIN\\n"}, {"range": "2604:8980::/32", "id": "DAVINCI-V6-01", "name": "Xplornet Communications Inc.", "country": "CA", "domain": "xplornet.com", "org_id": "BARRE-2", "status": "ALLOCATION", "tech_id": "ADMIN5869-ARIN", "mnt_id": "ADMIN5869-ARIN", "admin_id": "ADMIN5869-ARIN", "abuse_id": "ABUSE4827-ARIN", "created": "2013-03-08", "updated": "2017-05-02", "source": "arin", "raw": "V6NetHandle:    NET6-2604-8980-1\\nOrgID:          BARRE-2\\nParent:         NET6-2600-1\\nNetName:        DAVINCI-V6-01\\nNetRange:       2604:8980:: - 2604:8980:FFFF:FFFF:FFFF:FFFF:FFFF:FFFF\\nNetType:        allocation\\nOriginAS:       3397\\nRegDate:        2013-03-08\\nUpdated:        2017-05-02\\nSource:         ARIN\\n\n\nOrgID:          BARRE-2\\nOrgName:        Xplornet Communications Inc.\\nCanAllocate:    \\nStreet:         300 Lockhart Rd\\nCity:           Woodstock\\nState/Prov:     NB\\nCountry:        CA\\nPostalCode:     E7M-5C3\\nRegDate:        2005-04-26\\nUpdated:        2020-08-25\\nOrgAbuseHandle: ABUSE4827-ARIN\\nOrgAdminHandle: ADMIN5869-ARIN\\nOrgNOCHandle:   ADMIN5869-ARIN\\nOrgTechHandle:  ADMIN5869-ARIN\\nSource:         ARIN\\n\n\nPOCHandle:      ADMIN5869-ARIN\\nIsRole:         Y\\nLastName:       Admin\\nFirstName:      \\nStreet:         300 Lockhart Mill Road\\nCity:           Woodstock\\nState/Prov:     NB\\nCountry:        CA\\nPostalCode:     E7M 5C3\\nRegDate:        2015-08-24\\nUpdated:        2022-03-22\\nOfficePhone:    +1-647-457-7732\\nMailbox:        IPCarrierRelations@corp.xplornet.com\\nSource:         ARIN\\n\n\nPOCHandle:      ABUSE4827-ARIN\\nIsRole:         Y\\nLastName:       Abuse\\nFirstName:      \\nStreet:         300 Lockhart Mill ROad\\nCity:           Woodstock\\nState/Prov:     NB\\nCountry:        CA\\nPostalCode:     E7M 6B5\\nRegDate:        2014-08-08\\nUpdated:        2022-06-21\\nOfficePhone:    +1-866-971-5062\\nMailbox:        abuse@xplornet.com\\nSource:         ARIN\\n"}, {"range": "2604:3a40::/32", "id": "BC-IPV6-A", "name": "Boston Colocation, Inc.", "country": "US", "domain": "bostcolo.com", "org_id": "BC-700", "status": "ALLOCATION", "tech_id": "INTAP1-ARIN\\NJWA240-ARIN", "mnt_id": "INTAP1-ARIN\\NJWA240-ARIN", "admin_id": "INTAP1-ARIN", "abuse_id": "ABUSE2190-ARIN", "created": "2017-04-28", "updated": "2017-04-28", "source": "arin", "raw": "V6NetHandle:    NET6-2604-3A40-1\\nOrgID:          BC-700\\nParent:         NET6-2600-1\\nNetName:        BC-IPV6-A\\nNetRange:       2604:3A40:: - 2604:3A40:FFFF:FFFF:FFFF:FFFF:FFFF:FFFF\\nNetType:        allocation\\nOriginAS:       22801\\nComment:        www.bostcolo.com\\nRegDate:        2017-04-28\\nUpdated:        2017-04-28\\nSource:         ARIN\\n\n\nOrgID:          BC-700\\nOrgName:        Boston Colocation, Inc.\\nCanAllocate:    \\nStreet:         2660 Private Lefler Dr\\nCity:           Johns Island\\nState/Prov:     SC\\nCountry:        US\\nPostalCode:     29455\\nRegDate:        2015-02-26\\nUpdated:        2022-07-18\\nOrgAbuseHandle: ABUSE2190-ARIN\\nOrgAbuseHandle: JWA240-ARIN\\nOrgAdminHandle: INTAP1-ARIN\\nOrgNOCHandle:   INTAP1-ARIN\\nOrgNOCHandle:   JWA240-ARIN\\nOrgTechHandle:  INTAP1-ARIN\\nOrgTechHandle:  JWA240-ARIN\\nSource:         ARIN\\n\n\nPOCHandle:      JWA240-ARIN\\nIsRole:         N\\nLastName:       Archer\\nFirstName:      James\\nStreet:         2660 Private Lefler Dr\\nCity:           Johns Island\\nState/Prov:     SC\\nCountry:        US\\nPostalCode:     29455\\nRegDate:        2007-12-21\\nUpdated:        2022-07-18\\nMobilePhone:    +1-401-480-4420\\nOfficePhone:    +1-401-480-4420\\nMailbox:        bostcolojim@gmail.com\\nSource:         ARIN\\n\n\nPOCHandle:      INTAP1-ARIN\\nIsRole:         Y\\nLastName:       Intap Adminstration\\nFirstName:      \\nStreet:         2660 Private Lefler Dr\\nCity:           Johns Island\\nState/Prov:     SC\\nCountry:        US\\nPostalCode:     29455\\nRegDate:        2009-02-24\\nUpdated:        2022-07-18\\nOfficePhone:    +1-401-480-4420\\nFaxPhone:       +1-401-480-4420\\nMobilePhone:    +1-401-480-4420\\nMailbox:        bostcolojim@gmail.com\\nSource:         ARIN\\n\n\nPOCHandle:      ABUSE2190-ARIN\\nIsRole:         Y\\nLastName:       Abuse\\nFirstName:      \\nStreet:         2660 Private Lefler Dr\\nCity:           Johns Island\\nState/Prov:     SC\\nCountry:        US\\nPostalCode:     29455\\nRegDate:        2009-02-24\\nUpdated:        2022-07-18\\nOfficePhone:    +1-401-480-4420\\nMobilePhone:    +1-401-480-4420\\nMailbox:        bostcolojim@gmail.com\\nSource:         ARIN\\n"}, {"range": "148.170.128.0/18", "id": "BRAGG", "name": "EastLink", "country": "CA", "domain": "eastlink.ca", "org_id": "BRAGG", "status": "ALLOCATION", "tech_id": "ATS22-ARIN", "mnt_id": "ANS2-ARIN", "admin_id": "AAS49-ARIN", "abuse_id": "AAS50-ARIN", "created": "2019-05-08", "updated": "2020-12-08", "source": "arin", "raw": "NetHandle:      NET-148-170-128-0-1\\nOrgID:          BRAGG\\nParent:         NET-148-0-0-0-0\\nNetName:        BRAGG\\nNetRange:       148.170.128.0 - 148.170.191.255\\nNetType:        allocation\\nOriginAS:       11260\\nRegDate:        2019-05-08\\nUpdated:        2020-12-08\\nSource:         ARIN\\n\n\nOrgID:          BRAGG\\nOrgName:        EastLink\\nCanAllocate:    \\nStreet:         6080 Young Street\\nStreet:         Suite 801, PO Box 8660, Station A\\nCity:           Halifax\\nState/Prov:     NS\\nCountry:        CA\\nPostalCode:     B3K-5M3\\nComment:        EastLink High Speed Internet\\nRegDate:        2007-01-17\\nUpdated:        2017-01-28\\nOrgAbuseHandle: AAS50-ARIN\\nOrgAdminHandle: AAS49-ARIN\\nOrgNOCHandle:   ANS2-ARIN\\nOrgTechHandle:  ATS22-ARIN\\nSource:         ARIN\\n\n\nPOCHandle:      AAS49-ARIN\\nIsRole:         Y\\nLastName:       ARIN Admin Support\\nFirstName:      \\nStreet:         6080 Young Street\\nStreet:         Suite 700\\nCity:           Halifax\\nState/Prov:     NS\\nCountry:        CA\\nPostalCode:     B3K-5M3\\nRegDate:        2007-03-13\\nUpdated:        2022-05-12\\nOfficePhone:    +1-902-453-2800\\nMailbox:        arin-admin@eastlink.ca\\nSource:         ARIN\\n\n\nPOCHandle:      AAS50-ARIN\\nIsRole:         Y\\nLastName:       ARIN Abuse Support\\nFirstName:      \\nStreet:         6080 Young Street\\nStreet:         Suite 700\\nCity:           Halifax\\nState/Prov:     NS\\nCountry:        CA\\nPostalCode:     B3K-5M3\\nRegDate:        2007-03-14\\nUpdated:        2022-05-12\\nOfficePhone:    +1-902-453-2800\\nMailbox:        arin-abuse@eastlink.ca\\nSource:         ARIN\\n\n\nPOCHandle:      ANS2-ARIN\\nIsRole:         Y\\nLastName:       ARIN NOC Support\\nFirstName:      \\nStreet:         6080 Young Street\\nStreet:         Suite 700\\nCity:           Halifax\\nState/Prov:     NS\\nCountry:        CA\\nPostalCode:     B3K-5M3\\nRegDate:        2007-03-16\\nUpdated:        2021-12-14\\nOfficePhone:    +1-902-453-2800\\nMailbox:        arin-noc@eastlink.ca\\nSource:         ARIN\\n\n\nPOCHandle:      ATS22-ARIN\\nIsRole:         Y\\nLastName:       ARIN Technical Support\\nFirstName:      \\nStreet:         6080 Young Street\\nStreet:         Suite 700\\nCity:           Halifax\\nState/Prov:     NS\\nCountry:        CA\\nPostalCode:     B3K-5M3\\nRegDate:        2007-03-13\\nUpdated:        2022-05-12\\nOfficePhone:    +1-902-453-2800\\nMailbox:        arin-tech@eastlink.ca\\nSource:         ARIN\\n"}, {"range": "69.208.108.72/29", "id": "SBCIS-WYPR-6920810872", "name": "Wayport, LLC", "country": "US", "domain": "wayport.net", "org_id": "WYPR", "status": "REASSIGNMENT", "tech_id": "WN25-ARIN", "mnt_id": "AWSN-ARIN", "admin_id": "WN25-ARIN", "abuse_id": "ABUSE670-ARIN", "created": "2004-09-15", "updated": "2004-09-15", "source": "arin", "raw": "NetHandle:      NET-69-208-108-72-1\\nOrgID:          WYPR\\nParent:         NET-69-208-0-0-1\\nNetName:        SBCIS-WYPR-6920810872\\nNetRange:       69.208.108.72 - 69.208.108.79\\nNetType:        reassignment\\nRegDate:        2004-09-15\\nUpdated:        2004-09-15\\nAbuseHandle:    ABUSE670-ARIN\\nSource:         ARIN\\n\n\nOrgID:          WYPR\\nOrgName:        Wayport, LLC\\nCanAllocate:    \\nStreet:         4509 Freidrich Lane\\nStreet:         Building III, Suite 300\\nCity:           Austin\\nState/Prov:     TX\\nCountry:        US\\nPostalCode:     78744\\nRegDate:        1997-07-29\\nUpdated:        2020-09-24\\nReferralServer: rwhois://rwhois.wayport.net:4321\\nOrgAbuseHandle: ABUSE670-ARIN\\nOrgAdminHandle: WN25-ARIN\\nOrgNOCHandle:   AWSN-ARIN\\nOrgTechHandle:  WN25-ARIN\\nSource:         ARIN\\n\n\nPOCHandle:      AWSN-ARIN\\nIsRole:         Y\\nLastName:       ATT WiFi Services NOC\\nFirstName:      \\nStreet:         4509 Freidrich Lane\\nStreet:         Building III, Suite 300\\nCity:           Austin\\nState/Prov:     TX\\nCountry:        US\\nPostalCode:     78744\\nRegDate:        2012-05-31\\nUpdated:        2014-05-01\\nOfficePhone:    +1-512-519-6000\\nMailbox:        noc-internal@wayport.net\\nSource:         ARIN\\n\n\nPOCHandle:      ABUSE670-ARIN\\nIsRole:         Y\\nLastName:       Abuse\\nFirstName:      \\nStreet:         4509 Freidrich Ln\\nStreet:         Building 3, Ste 300\\nCity:           Austin\\nState/Prov:     TX\\nCountry:        US\\nPostalCode:     78744\\nRegDate:        2004-07-13\\nUpdated:        2021-12-09\\nOfficePhone:    +1-512-519-6000\\nMailbox:        abuse@wayport.net\\nSource:         ARIN\\n\n\nPOCHandle:      WN25-ARIN\\nIsRole:         Y\\nLastName:       ATT WiFi Services IT\\nFirstName:      \\nStreet:         4509 Freidrich Ln\\nStreet:         Building III, Suite 300\\nCity:           Austin\\nState/Prov:     TX\\nCountry:        US\\nPostalCode:     78744\\nRegDate:        2000-01-21\\nUpdated:        2021-12-09\\nFaxPhone:       +1-512-519-6450\\nOfficePhone:    +1-512-519-6000\\nMailbox:        arin-coordinator@wayport.net\\nSource:         ARIN\\n"}, {"range": "2001:504:1c::/48", "id": "LLNW-V6-2", "name": "Limelight Networks, Inc.", "country": "US", "domain": "limelight.com", "org_id": "LLNW", "status": "ALLOCATION", "tech_id": "LNAA-ARIN", "mnt_id": "BPN2-ARIN\\NKLEIN349-ARIN", "admin_id": "BPN2-ARIN", "abuse_id": "BPN2-ARIN", "created": "2010-12-06", "updated": "2012-02-24", "source": "arin", "raw": "V6NetHandle:    NET6-2001-504-1C-1\\nOrgID:          LLNW\\nParent:         NET6-2001-400-0\\nNetName:        LLNW-V6-2\\nNetRange:       2001:504:1C:: - 2001:504:1C:FFFF:FFFF:FFFF:FFFF:FFFF\\nNetType:        allocation\\nOriginAS:       22822\\nRegDate:        2010-12-06\\nUpdated:        2012-02-24\\nAbuseHandle:    LNAD-ARIN\\nNOCHandle:      LNAA-ARIN\\nTechHandle:     LNAA-ARIN\\nSource:         ARIN\\n\n\nOrgID:          LLNW\\nOrgName:        Limelight Networks, Inc.\\nCanAllocate:    \\nStreet:         1465 N Scottsdale Road\\nStreet:         Suite 400\\nCity:           Scottsdale\\nState/Prov:     AZ\\nCountry:        US\\nPostalCode:     85257\\nRegDate:        2002-07-26\\nUpdated:        2022-03-02\\nOrgAbuseHandle: BPN2-ARIN\\nOrgAbuseHandle: SARKA4-ARIN\\nOrgAdminHandle: BPN2-ARIN\\nOrgDNSHandle:   DURHA71-ARIN\\nOrgTechHandle:  SARKA4-ARIN\\nOrgDNSHandle:   HUGHE681-ARIN\\nOrgTechHandle:  LEEJA108-ARIN\\nOrgDNSHandle:   SREDN2-ARIN\\nOrgNOCHandle:   BPN2-ARIN\\nOrgTechHandle:  KLEIN349-ARIN\\nOrgTechHandle:  BPN2-ARIN\\nOrgTechHandle:  HUGHE681-ARIN\\nOrgNOCHandle:   KLEIN349-ARIN\\nOrgRoutingHandle:   SARKA4-ARIN\\nOrgRoutingHandle:   BPN2-ARIN\\nOrgRoutingHandle:   HUGHE681-ARIN\\nOrgRoutingHandle:   KLEIN349-ARIN\\nSource:         ARIN\\n\n\nPOCHandle:      HUGHE681-ARIN\\nIsRole:         N\\nLastName:       Hughes\\nFirstName:      Mike\\nStreet:         c/o WeWork\\nStreet:         125 Kingsway, London\\nCity:           London\\nState/Prov:     \\nCountry:        GB\\nPostalCode:     WC2B 2HH\\nRegDate:        2021-09-22\\nUpdated:        2021-09-22\\nOfficePhone:    +442039230481\\nMailbox:        mhughes@llnw.com\\nSource:         ARIN\\n\n\nPOCHandle:      LEEJA108-ARIN\\nIsRole:         N\\nLastName:       Lee\\nFirstName:      Jason\\nStreet:         261 E Aster Dr\\nCity:           Chandler\\nState/Prov:     AZ\\nCountry:        US\\nPostalCode:     85286\\nRegDate:        2022-03-02\\nUpdated:        2022-03-02\\nMobilePhone:    +1-480-243-2716\\nOfficePhone:    +1-602-850-5000\\nMailbox:        jmlee@llnw.com\\nSource:         ARIN\\n\n\nPOCHandle:      KLEIN349-ARIN\\nIsRole:         N\\nLastName:       Kleinart\\nFirstName:      Shawn\\nStreet:         1465 N Scottsdale Rd #400\\nCity:           Scottsdale\\nState/Prov:     AZ\\nCountry:        US\\nPostalCode:     85257\\nRegDate:        2021-09-20\\nUpdated:        2021-09-20\\nOfficePhone:    +1-602-850-4845\\nMailbox:        skleinart@llnw.com\\nSource:         ARIN\\n\n\nPOCHandle:      BPN2-ARIN\\nIsRole:         N\\nLastName:       Nicklin\\nFirstName:      Ben\\nStreet:         Aviation House\\nStreet:         7th Floor\\nStreet:         125 Kingsway\\nCity:           London\\nState/Prov:     \\nCountry:        GB\\nPostalCode:     WC2B 6NH\\nRegDate:        2021-08-19\\nUpdated:        2021-08-19\\nOfficePhone:    +44 7971465185\\nMailbox:        bnicklin@llnw.com\\nSource:         ARIN\\n\n\nPOCHandle:      SARKA4-ARIN\\nIsRole:         N\\nLastName:       Sarkan\\nFirstName:      Sajari\\nStreet:         37th Floor, \\nStreet:         50 Raffles Place\\nStreet:         Singapore\\nCity:           Singapore\\nState/Prov:     \\nCountry:        SG\\nPostalCode:     \\nRegDate:        2015-03-01\\nUpdated:        2021-08-19\\nOfficePhone:    +65 9667 2513\\nMailbox:        sajari@llnw.com\\nSource:         ARIN\\n\n\nPOCHandle:      LNAD-ARIN\\nIsRole:         Y\\nLastName:       Limelight Networks Abuse Dept\\nFirstName:      \\nStreet:         2220 W. 14th Street\\nCity:           Tempe\\nState/Prov:     AZ\\nCountry:        US\\nPostalCode:     85281\\nRegDate:        2004-04-21\\nUpdated:        2020-04-15\\nOfficePhone:    +1-602-850-5095\\nMailbox:        ipadmin@limelightnetworks.com\\nSource:         ARIN\\n\n\nPOCHandle:      LNAA-ARIN\\nIsRole:         Y\\nLastName:       Limelight Networks ARIN Admin\\nFirstName:      \\nStreet:         1465 N Scottsdale Road\\nStreet:         Suite 400\\nCity:           Scottsdale\\nState/Prov:     AZ\\nCountry:        US\\nPostalCode:     85257\\nRegDate:        2004-04-21\\nUpdated:        2021-09-02\\nOfficePhone:    +1-602-850-7199\\nMailbox:        arinadmin@limelightnetworks.com\\nSource:         ARIN\\n"}, {"range": "128.177.46.0/24", "id": "ABOV-T00871-128-177-46-0-24", "name": "StratITsphere Data Center Solutions, LLC", "country": "US", "domain": "stratitsphere.com", "org_id": "SDCSL", "status": "REALLOCATION", "tech_id": "CNG22-ARIN", "mnt_id": "CNG22-ARIN", "admin_id": "CNG22-ARIN", "abuse_id": "CNG22-ARIN", "created": "2011-04-06", "updated": "2011-04-06", "source": "arin", "raw": "NetHandle:      NET-128-177-46-0-1\\nOrgID:          SDCSL\\nParent:         NET-128-177-0-0-1\\nNetName:        ABOV-T00871-128-177-46-0-24\\nNetRange:       128.177.46.0 - 128.177.46.255\\nNetType:        reallocation\\nComment:        jgross@stratitsphere.com\\nRegDate:        2011-04-06\\nUpdated:        2011-04-06\\nSource:         ARIN\\n\n\nOrgID:          SDCSL\\nOrgName:        StratITsphere Data Center Solutions, LLC\\nCanAllocate:    \\nStreet:         2950 N Loop W Fwy\\nCity:           Houston\\nState/Prov:     TX\\nCountry:        US\\nPostalCode:     77092\\nRegDate:        2010-10-20\\nUpdated:        2021-06-29\\nOrgAbuseHandle: CNG22-ARIN\\nOrgAdminHandle: CNG22-ARIN\\nOrgNOCHandle:   CNG22-ARIN\\nOrgTechHandle:  CNG22-ARIN\\nSource:         ARIN\\n\n\nPOCHandle:      CNG22-ARIN\\nIsRole:         Y\\nLastName:       Core Networking Group\\nFirstName:      \\nStreet:         2950 North Loop West 10th floor\\nCity:           Houston\\nState/Prov:     TX\\nCountry:        US\\nPostalCode:     77092\\nRegDate:        2014-02-28\\nUpdated:        2021-10-28\\nOfficePhone:    +1-800-444-0258\\nMailbox:        IP_Engineering@logix.com\\nSource:         ARIN\\n"}, {"range": "67.94.36.112/28", "id": "XOXO-67-94-36-112", "name": "Consolidated Smart Systems LLC", "country": "US", "domain": "consolidatedsmart.com", "org_id": "CSSL-9", "status": "REALLOCATION", "tech_id": "DEBUS5-ARIN\\NTIER3-ARIN", "mnt_id": "NOC33474-ARIN", "admin_id": "TIER3-ARIN", "abuse_id": "NOCAB25-ARIN", "created": "2007-06-28", "updated": "2007-06-28", "source": "arin", "raw": "NetHandle:      NET-67-94-36-112-1\\nOrgID:          CSSL-9\\nParent:         NET-67-88-0-0-1\\nNetName:        XOXO-67-94-36-112\\nNetRange:       67.94.36.112 - 67.94.36.127\\nNetType:        reallocation\\nRegDate:        2007-06-28\\nUpdated:        2007-06-28\\nSource:         ARIN\\n\n\nOrgID:          CSSL-9\\nOrgName:        Consolidated Smart Systems LLC\\nCanAllocate:    \\nStreet:         620 West 135th Street\\nCity:           Gardena\\nState/Prov:     CA\\nCountry:        US\\nPostalCode:     90248\\nRegDate:        2007-05-23\\nUpdated:        2022-06-07\\nOrgAbuseHandle: NOCAB25-ARIN\\nOrgAdminHandle: TIER3-ARIN\\nOrgNOCHandle:   NOC33474-ARIN\\nOrgTechHandle:  DEBUS5-ARIN\\nOrgTechHandle:  TIER3-ARIN\\nSource:         ARIN\\n\n\nPOCHandle:      NOCAB25-ARIN\\nIsRole:         Y\\nLastName:       NOC Abuse \\nFirstName:      \\nStreet:         429 S Main St\\nCity:           Logan\\nState/Prov:     UT\\nCountry:        US\\nPostalCode:     84321\\nRegDate:        2022-05-31\\nUpdated:        2022-05-31\\nOfficePhone:    +1-435-774-2337\\nMailbox:        support@smartaira.com\\nSource:         ARIN\\n\n\nPOCHandle:      TIER3-ARIN\\nIsRole:         Y\\nLastName:       Tier3 Support\\nFirstName:      \\nStreet:         620 West 135th Street\\nCity:           Gardena\\nState/Prov:     CA\\nCountry:        US\\nPostalCode:     90248\\nRegDate:        2007-05-23\\nUpdated:        2022-05-31\\nOfficePhone:    +1-435-774-2337\\nMailbox:        tier3@smartaira.com\\nSource:         ARIN\\n\n\nPOCHandle:      DEBUS5-ARIN\\nIsRole:         N\\nLastName:       DeBusk\\nFirstName:      Donanav\\nStreet:         620 w 135th ST\\nCity:           Gardena\\nState/Prov:     CA\\nCountry:        US\\nPostalCode:     90248\\nRegDate:        2018-10-17\\nUpdated:        2022-05-31\\nOfficePhone:    +1-310-200-6243\\nMailbox:        ddebusk@smartaira.com\\nSource:         ARIN\\n\n\nPOCHandle:      NOC33474-ARIN\\nIsRole:         Y\\nLastName:       NOC\\nFirstName:      \\nStreet:         429 S Main St\\nCity:           Logan\\nState/Prov:     UT\\nCountry:        US\\nPostalCode:     84321\\nRegDate:        2022-05-31\\nUpdated:        2022-05-31\\nOfficePhone:    +1-435-744-2337\\nMailbox:        Noc@smartaira.com\\nSource:         ARIN\\n"}, {"range": "24.154.170.128/25", "id": "ACS-WARRENDALEPA", "name": "Armstrong", "country": "US", "domain": "armstrongonewire.com", "org_id": "ARMC", "status": "REALLOCATION", "tech_id": "NOC11973-ARIN", "mnt_id": "NOC11973-ARIN", "admin_id": "NOC11973-ARIN", "abuse_id": "NOC11974-ARIN", "created": "2021-10-18", "updated": "2021-10-18", "source": "arin", "raw": "NetHandle:      NET-24-154-170-128-1\\nOrgID:          ARMC\\nParent:         NET-24-154-0-0-1\\nNetName:        ACS-WARRENDALEPA\\nNetRange:       24.154.170.128 - 24.154.170.255\\nNetType:        reallocation\\nOriginAS:       27364\\nRegDate:        2021-10-18\\nUpdated:        2021-10-18\\nSource:         ARIN\\n\n\nOrgID:          ARMC\\nOrgName:        Armstrong\\nCanAllocate:    \\nStreet:         ONE Armstrong Place\\nCity:           Butler\\nState/Prov:     PA\\nCountry:        US\\nPostalCode:     16001\\nRegDate:        1997-08-28\\nUpdated:        2022-04-18\\nOrgAbuseHandle: NOC11974-ARIN\\nOrgAdminHandle: NOC11973-ARIN\\nOrgNOCHandle:   NOC11973-ARIN\\nOrgTechHandle:  NOC11973-ARIN\\nSource:         ARIN\\n\n\nPOCHandle:      NOC11973-ARIN\\nIsRole:         Y\\nLastName:       Network Operations Center\\nFirstName:      \\nStreet:         One Armstrong Place\\nCity:           Butler\\nState/Prov:     PA\\nCountry:        US\\nPostalCode:     16001\\nRegDate:        2011-04-28\\nUpdated:        2022-04-20\\nOfficePhone:    +1-877-277-5709\\nFaxPhone:       +1-724-282-5624\\nMailbox:        noc@zoominternet.net\\nSource:         ARIN\\n\n\nPOCHandle:      NOC11974-ARIN\\nIsRole:         Y\\nLastName:       Network Operations Center\\nFirstName:      \\nStreet:         One Armstrong Place\\nCity:           Butler\\nState/Prov:     PA\\nCountry:        US\\nPostalCode:     16001\\nRegDate:        2011-04-28\\nUpdated:        2022-04-20\\nFaxPhone:       +1-724-282-5624\\nOfficePhone:    +1-877-277-5709\\nMailbox:        abuse@zoominternet.net\\nSource:         ARIN\\n"}, {"range": "199.38.221.148/30", "id": "6E74817D-3A67-417D-985A-90401808158F", "name": "Reflex Systems", "country": "US", "domain": "reflexsystems.com", "org_id": "RS-285", "status": "REASSIGNMENT", "tech_id": "EKM2-ARIN", "mnt_id": "EKM2-ARIN", "admin_id": "EKM2-ARIN", "abuse_id": "EKM2-ARIN", "created": "2014-05-12", "updated": "2014-05-12", "source": "arin", "raw": "NetHandle:      NET-199-38-221-148-1\\nOrgID:          RS-285\\nParent:         NET-199-38-216-0-1\\nNetName:        6E74817D-3A67-417D-985A-90401808158F\\nNetRange:       199.38.221.148 - 199.38.221.151\\nNetType:        reassignment\\nOriginAS:       53914\\nRegDate:        2014-05-12\\nUpdated:        2014-05-12\\nSource:         ARIN\\n\n\nOrgID:          RS-285\\nOrgName:        Reflex Systems\\nCanAllocate:    \\nStreet:         830 W. IL Route 22\\nStreet:         Suite 203\\nCity:           Lake Zurich\\nState/Prov:     IL\\nCountry:        US\\nPostalCode:     60047\\nRegDate:        2014-05-11\\nUpdated:        2014-05-11\\nOrgAbuseHandle: EKM2-ARIN\\nOrgAdminHandle: EKM2-ARIN\\nOrgNOCHandle:   EKM2-ARIN\\nOrgTechHandle:  EKM2-ARIN\\nSource:         ARIN\\n\n\nPOCHandle:      EKM2-ARIN\\nIsRole:         N\\nLastName:       Miller\\nFirstName:      Eric\\nStreet:         830 W. IL Route 22 Suite 203\\nCity:           Lake Zurich\\nState/Prov:     IL\\nCountry:        US\\nPostalCode:     60047\\nRegDate:        2011-06-02\\nUpdated:        2021-12-18\\nOfficePhone:    +1-877-270-1272\\nMailbox:        arin@genesishosting.com\\nSource:         ARIN\\n"}, {"range": "2602:fbc4::/36", "id": "ALKIRA-IPV6-BLOCK-1", "name": "Alkira Inc", "country": "US", "domain": "alkira.com", "org_id": "ALKIR", "status": "ALLOCATION", "tech_id": "ALKIR3-ARIN\\NRYV-ARIN", "mnt_id": "ALKIR3-ARIN", "admin_id": "ALKIR1-ARIN", "abuse_id": "ALKIR2-ARIN", "created": "2022-02-22", "updated": "2022-02-22", "source": "arin", "raw": "V6NetHandle:    NET6-2602-FBC4-1\\nOrgID:          ALKIR\\nParent:         NET6-2600-1\\nNetName:        ALKIRA-IPV6-BLOCK-1\\nNetRange:       2602:FBC4:: - 2602:FBC4:FFF:FFFF:FFFF:FFFF:FFFF:FFFF\\nNetType:        allocation\\nOriginAS:       46343\\nComment:        www.alkira.com\\nRegDate:        2022-02-22\\nUpdated:        2022-02-22\\nSource:         ARIN\\n\n\nOrgID:          ALKIR\\nOrgName:        Alkira Inc\\nCanAllocate:    \\nStreet:         2001 Gateway Pl #610W\\nCity:           San Jose\\nState/Prov:     CA\\nCountry:        US\\nPostalCode:     95110\\nRegDate:        2021-06-07\\nUpdated:        2021-09-03\\nOrgAbuseHandle: ALKIR2-ARIN\\nOrgAdminHandle: ALKIR1-ARIN\\nOrgDNSHandle:   ALKIR3-ARIN\\nOrgNOCHandle:   ALKIR3-ARIN\\nOrgRoutingHandle:   ALKIR3-ARIN\\nOrgTechHandle:  ALKIR3-ARIN\\nOrgTechHandle:  RYV-ARIN\\nSource:         ARIN\\n\n\nPOCHandle:      RYV-ARIN\\nIsRole:         N\\nLastName:       Vichery\\nFirstName:      Remi\\nStreet:         2001 Gateway Pl #610W\\nCity:           San Jose\\nState/Prov:     CA\\nCountry:        US\\nPostalCode:     95110\\nRegDate:        2021-07-21\\nUpdated:        2021-12-21\\nOfficePhone:    +1-855-925-5472\\nMailbox:        remi.vichery@gmail.com\\nMailbox:        remi@alkira.net\\nSource:         ARIN\\n\n\nPOCHandle:      ALKIR3-ARIN\\nIsRole:         Y\\nLastName:       alkira-arin-tech\\nFirstName:      \\nStreet:         2001 Gateway Pl #610W\\nCity:           SAN jose\\nState/Prov:     CA\\nCountry:        US\\nPostalCode:     95110\\nRegDate:        2021-07-21\\nUpdated:        2022-07-26\\nOfficePhone:    +1-855-925-5472\\nMailbox:        arin-tech@alkira.net\\nSource:         ARIN\\n\n\nPOCHandle:      ALKIR1-ARIN\\nIsRole:         Y\\nLastName:       alkira-arin-admin\\nFirstName:      \\nStreet:         2001 Gateway Pl #610W\\nCity:           SAN jose\\nState/Prov:     CA\\nCountry:        US\\nPostalCode:     95110\\nRegDate:        2021-07-21\\nUpdated:        2021-07-21\\nOfficePhone:    +1-855-925-5472\\nMailbox:        arin-admin@alkira.net\\nSource:         ARIN\\n\n\nPOCHandle:      ALKIR2-ARIN\\nIsRole:         Y\\nLastName:       alkira-arin-abuse\\nFirstName:      \\nStreet:         2001 Gateway Pl #610W\\nCity:           SAN jose\\nState/Prov:     CA\\nCountry:        US\\nPostalCode:     95110\\nRegDate:        2021-07-21\\nUpdated:        2021-07-21\\nOfficePhone:    +1-855-925-5472\\nMailbox:        arin-abuse@alkira.net\\nSource:         ARIN\\n"}, {"range": "24.101.175.0/25", "id": "ACS-MEADVILLEPA", "name": "Armstrong", "country": "US", "domain": "armstrongonewire.com", "org_id": "ARMC", "status": "REALLOCATION", "tech_id": "NOC11973-ARIN", "mnt_id": "NOC11973-ARIN", "admin_id": "NOC11973-ARIN", "abuse_id": "NOC11974-ARIN", "created": "2019-07-02", "updated": "2019-07-02", "source": "arin", "raw": "NetHandle:      NET-24-101-175-0-1\\nOrgID:          ARMC\\nParent:         NET-24-101-0-0-1\\nNetName:        ACS-MEADVILLEPA\\nNetRange:       24.101.175.0 - 24.101.175.127\\nNetType:        reallocation\\nOriginAS:       27364\\nRegDate:        2019-07-02\\nUpdated:        2019-07-02\\nSource:         ARIN\\n\n\nOrgID:          ARMC\\nOrgName:        Armstrong\\nCanAllocate:    \\nStreet:         ONE Armstrong Place\\nCity:           Butler\\nState/Prov:     PA\\nCountry:        US\\nPostalCode:     16001\\nRegDate:        1997-08-28\\nUpdated:        2022-04-18\\nOrgAbuseHandle: NOC11974-ARIN\\nOrgAdminHandle: NOC11973-ARIN\\nOrgNOCHandle:   NOC11973-ARIN\\nOrgTechHandle:  NOC11973-ARIN\\nSource:         ARIN\\n\n\nPOCHandle:      NOC11973-ARIN\\nIsRole:         Y\\nLastName:       Network Operations Center\\nFirstName:      \\nStreet:         One Armstrong Place\\nCity:           Butler\\nState/Prov:     PA\\nCountry:        US\\nPostalCode:     16001\\nRegDate:        2011-04-28\\nUpdated:        2022-04-20\\nOfficePhone:    +1-877-277-5709\\nFaxPhone:       +1-724-282-5624\\nMailbox:        noc@zoominternet.net\\nSource:         ARIN\\n\n\nPOCHandle:      NOC11974-ARIN\\nIsRole:         Y\\nLastName:       Network Operations Center\\nFirstName:      \\nStreet:         One Armstrong Place\\nCity:           Butler\\nState/Prov:     PA\\nCountry:        US\\nPostalCode:     16001\\nRegDate:        2011-04-28\\nUpdated:        2022-04-20\\nFaxPhone:       +1-724-282-5624\\nOfficePhone:    +1-877-277-5709\\nMailbox:        abuse@zoominternet.net\\nSource:         ARIN\\n"}, {"range": "205.219.73.0/24", "id": "SAVV-S605625-5", "name": "Socrata", "country": "US", "domain": "socrata.com", "org_id": "SOCRA-4", "status": "REALLOCATION", "tech_id": "ZOOKJ-ARIN", "mnt_id": "ZOOKJ-ARIN", "admin_id": "ZOOKJ-ARIN", "abuse_id": "ZOOKJ-ARIN", "created": "2013-05-01", "updated": "2013-05-01", "source": "arin", "raw": "NetHandle:      NET-205-219-73-0-1\\nOrgID:          SOCRA-4\\nParent:         NET-205-218-0-0-1\\nNetName:        SAVV-S605625-5\\nNetRange:       205.219.73.0 - 205.219.73.255\\nNetType:        reallocation\\nRegDate:        2013-05-01\\nUpdated:        2013-05-01\\nSource:         ARIN\\n\n\nOrgID:          SOCRA-4\\nOrgName:        Socrata\\nCanAllocate:    \\nStreet:         83 S. King St.\\nStreet:         Suite 107\\nCity:           Seattle\\nState/Prov:     WA\\nCountry:        US\\nPostalCode:     98104\\nRegDate:        2013-05-01\\nUpdated:        2014-12-16\\nOrgAbuseHandle: ZOOKJ-ARIN\\nOrgAdminHandle: ZOOKJ-ARIN\\nOrgNOCHandle:   ZOOKJ-ARIN\\nOrgTechHandle:  ZOOKJ-ARIN\\nSource:         ARIN\\n\n\nPOCHandle:      ZOOKJ-ARIN\\nIsRole:         N\\nLastName:       Zook\\nFirstName:      John\\nStreet:         83 S. King St, Suite 107\\nCity:           Seattle\\nState/Prov:     WA\\nCountry:        US\\nPostalCode:     98104\\nRegDate:        2014-12-16\\nUpdated:        2014-12-16\\nOfficePhone:    +1-206-340-8008\\nMailbox:        john.zook@socrata.com\\nSource:         ARIN\\n"}, {"range": "69.162.192.0/19", "id": "ACSG-1-NET-2", "name": "Alaska Communications Systems Group, Inc.", "country": "US", "domain": "alaskacommunications.com", "org_id": "ACSG-1", "status": "ALLOCATION", "tech_id": "AIT5-ARIN", "mnt_id": "AIN5-ARIN", "admin_id": "AIA5-ARIN", "abuse_id": "AIA4-ARIN", "created": "2008-07-10", "updated": "2012-03-02", "source": "arin", "raw": "NetHandle:      NET-69-162-192-0-1\\nOrgID:          ACSG-1\\nParent:         NET-69-0-0-0-0\\nNetName:        ACSG-1-NET-2\\nNetRange:       69.162.192.0 - 69.162.223.255\\nNetType:        allocation\\nOriginAS:       7782\\nRegDate:        2008-07-10\\nUpdated:        2012-03-02\\nAbuseHandle:    AIA4-ARIN\\nNOCHandle:      AIN5-ARIN\\nTechHandle:     AIT5-ARIN\\nSource:         ARIN\\n\n\nOrgID:          ACSG-1\\nOrgName:        Alaska Communications Systems Group, Inc.\\nCanAllocate:    \\nStreet:         c/o ACS Internet, Inc.\\nStreet:         600 Telephone Ave.\\nCity:           Anchorage\\nState/Prov:     AK\\nCountry:        US\\nPostalCode:     99503\\nRegDate:        2004-02-24\\nUpdated:        2017-01-28\\nReferralServer: rwhois://rwhois.acsalaska.net:4321\\nOrgAbuseHandle: AIA4-ARIN\\nOrgAdminHandle: AIA5-ARIN\\nOrgNOCHandle:   AIN5-ARIN\\nOrgTechHandle:  AIT5-ARIN\\nSource:         ARIN\\n\n\nPOCHandle:      AIA5-ARIN\\nIsRole:         Y\\nLastName:       ACS Internet - Admin\\nFirstName:      \\nStreet:         c/o ACS Internet, Inc.\\nStreet:         600 Telephone Ave.\\nCity:           Anchorage\\nState/Prov:     AK\\nCountry:        US\\nPostalCode:     99503\\nRegDate:        2004-02-17\\nUpdated:        2022-07-18\\nOfficePhone:    +1-907-273-6800\\nMailbox:        sys.admin@acsalaska.net\\nSource:         ARIN\\n\n\nPOCHandle:      AIN5-ARIN\\nIsRole:         Y\\nLastName:       ACS Internet - NOC\\nFirstName:      \\nStreet:         c/o ACS Internet, Inc.\\nStreet:         600 Telephone Ave.\\nCity:           Anchorage\\nState/Prov:     AK\\nCountry:        US\\nPostalCode:     99503\\nRegDate:        2004-02-17\\nUpdated:        2015-11-09\\nOfficePhone:    +1-907-273-6800\\nMailbox:        i-ops@acsalaska.net\\nSource:         ARIN\\n\n\nPOCHandle:      AIT5-ARIN\\nIsRole:         Y\\nLastName:       ACS Internet - Tech\\nFirstName:      \\nStreet:         c/o ACS Internet, Inc.\\nStreet:         600 Telephone Ave.\\nCity:           Anchorage\\nState/Prov:     AK\\nCountry:        US\\nPostalCode:     99503\\nRegDate:        2004-02-17\\nUpdated:        2017-11-06\\nOfficePhone:    +1-907-273-6800\\nMailbox:        dnsadmin@acsalaska.net\\nSource:         ARIN\\n\n\nPOCHandle:      AIA4-ARIN\\nIsRole:         Y\\nLastName:       ACS Internet - Abuse\\nFirstName:      \\nStreet:         c/o ACS Internet, Inc.\\nStreet:         600 Telephone Ave.\\nCity:           Anchorage\\nState/Prov:     AK\\nCountry:        US\\nPostalCode:     99503\\nRegDate:        2004-02-17\\nUpdated:        2017-11-15\\nOfficePhone:    +1-907-273-6898\\nMailbox:        abuse@acsalaska.net\\nSource:         ARIN\\n"}, {"range": "2620:11d:f000::/40", "id": "GEU-IPV6-NET", "name": "Gibson Energy ULC", "country": "CA", "domain": "canwestpropane.com", "org_id": "GEU", "status": "ALLOCATION", "tech_id": "BERGE9-ARIN", "mnt_id": "BERGE9-ARIN", "admin_id": "COOKN-ARIN", "abuse_id": "BERGE9-ARIN", "created": "2015-01-20", "updated": "2021-12-14", "source": "arin", "raw": "V6NetHandle:    NET6-2620-11D-F000-1\\nOrgID:          GEU\\nParent:         NET6-2620-1\\nNetName:        GEU-IPV6-NET\\nNetRange:       2620:11D:F000:: - 2620:11D:F0FF:FFFF:FFFF:FFFF:FFFF:FFFF\\nNetType:        allocation\\nOriginAS:       54296\\nRegDate:        2015-01-20\\nUpdated:        2021-12-14\\nSource:         ARIN\\n\n\nOrgID:          GEU\\nOrgName:        Gibson Energy ULC\\nCanAllocate:    \\nStreet:         1700, 440 2 Ave SW\\nCity:           Calgary\\nState/Prov:     AB\\nCountry:        CA\\nPostalCode:     t2p 5e9\\nRegDate:        2011-08-19\\nUpdated:        2011-08-19\\nOrgAbuseHandle: BERGE9-ARIN\\nOrgAdminHandle: COOKN-ARIN\\nOrgNOCHandle:   BERGE9-ARIN\\nOrgTechHandle:  BERGE9-ARIN\\nSource:         ARIN\\n\n\nPOCHandle:      COOKN-ARIN\\nIsRole:         N\\nLastName:       Cook\\nFirstName:      Norm\\nStreet:         1700, 440 2 Ave SW\\nCity:           Calgary\\nState/Prov:     AB\\nCountry:        CA\\nPostalCode:     t2p 5e9\\nRegDate:        2011-08-18\\nUpdated:        2015-08-27\\nFaxPhone:       +1-403-206-4165\\nOfficePhone:    +1-403-206-4149\\nMailbox:        norm.cook@gibsons.com\\nSource:         ARIN\\n\n\nPOCHandle:      BERGE9-ARIN\\nIsRole:         N\\nLastName:       Bergen\\nFirstName:      Richard\\nStreet:         1700, 440 2 Ave SW\\nCity:           Calgary\\nState/Prov:     AB\\nCountry:        CA\\nPostalCode:     t2p 5e9\\nRegDate:        2011-08-18\\nUpdated:        2014-11-08\\nOfficePhone:    +1-403-206-4113\\nMailbox:        rbergen@gibsons.com\\nSource:         ARIN\\n"}, {"range": "2620:49:c040::/48", "id": "JRADNET6", "name": "Jefferson Radiology, P.C.", "country": "US", "domain": "jeffersonradiology.com", "org_id": "JR-76", "status": "ALLOCATION", "tech_id": "ARAUJ8-ARIN\\NTMA288-ARIN", "mnt_id": "ARAUJ8-ARIN\\NTMA288-ARIN", "admin_id": "ARAUJ8-ARIN", "abuse_id": "ARAUJ8-ARIN", "created": "2016-04-14", "updated": "2021-12-14", "source": "arin", "raw": "V6NetHandle:    NET6-2620-49-C040-1\\nOrgID:          JR-76\\nParent:         NET6-2620-1\\nNetName:        JRADNET6\\nNetRange:       2620:49:C040:: - 2620:49:C040:FFFF:FFFF:FFFF:FFFF:FFFF\\nNetType:        allocation\\nOriginAS:       394444\\nComment:        Jefferson Radiology\\nRegDate:        2016-04-14\\nUpdated:        2021-12-14\\nAbuseHandle:    ARAUJ8-ARIN\\nAbuseHandle:    TMA288-ARIN\\nNOCHandle:      ARAUJ8-ARIN\\nNOCHandle:      TMA288-ARIN\\nTechHandle:     ARAUJ8-ARIN\\nTechHandle:     TMA288-ARIN\\nSource:         ARIN\\n\n\nOrgID:          JR-76\\nOrgName:        Jefferson Radiology, P.C.\\nCanAllocate:    \\nStreet:         111 Founders Plaza\\nCity:           East Hartford\\nState/Prov:     CT\\nCountry:        US\\nPostalCode:     06108\\nRegDate:        2015-07-29\\nUpdated:        2016-09-27\\nOrgAbuseHandle: ARAUJ8-ARIN\\nOrgAbuseHandle: TMA288-ARIN\\nOrgAdminHandle: ARAUJ8-ARIN\\nOrgNOCHandle:   ARAUJ8-ARIN\\nOrgNOCHandle:   TMA288-ARIN\\nOrgTechHandle:  ARAUJ8-ARIN\\nOrgTechHandle:  TMA288-ARIN\\nSource:         ARIN\\n\n\nPOCHandle:      ARAUJ8-ARIN\\nIsRole:         N\\nLastName:       Araujo\\nFirstName:      Jim\\nStreet:         110 Barnes Road\\nCity:           Wallingford\\nState/Prov:     CT\\nCountry:        US\\nPostalCode:     06492\\nRegDate:        2015-06-23\\nUpdated:        2019-06-12\\nOfficePhone:    +1-203-294-7316\\nMailbox:        araujo@chime.org\\nSource:         ARIN\\n\n\nPOCHandle:      TMA288-ARIN\\nIsRole:         N\\nLastName:       Marques\\nFirstName:      Tony\\nStreet:         111 Founders Plaza Suite 400\\nCity:           East Hartford\\nState/Prov:     CT\\nCountry:        US\\nPostalCode:     06108\\nRegDate:        2010-06-09\\nUpdated:        2021-09-27\\nOfficePhone:    +1-860-291-6519\\nMailbox:        tmarques@jeffersonradiology.com\\nSource:         ARIN\\n"}, {"range": "207.159.95.96/29", "id": "Q0523-207-159-95-96", "name": "Block Line Systems, LLC", "country": "US", "domain": "infinitecom.net", "org_id": "BLSL", "status": "REALLOCATION", "tech_id": "INE20-ARIN", "mnt_id": "INE20-ARIN", "admin_id": "INE20-ARIN", "abuse_id": "IAA18-ARIN", "created": "2018-05-23", "updated": "2018-05-23", "source": "arin", "raw": "NetHandle:      NET-207-159-95-96-1\\nOrgID:          BLSL\\nParent:         NET-207-159-64-0-1\\nNetName:        Q0523-207-159-95-96\\nNetRange:       207.159.95.96 - 207.159.95.103\\nNetType:        reallocation\\nOriginAS:       209\\nRegDate:        2018-05-23\\nUpdated:        2018-05-23\\nSource:         ARIN\\n\n\nOrgID:          BLSL\\nOrgName:        Block Line Systems, LLC\\nCanAllocate:    \\nStreet:         1645 West Chester Pike\\nStreet:         Suite 200\\nCity:           West Chester\\nState/Prov:     PA\\nCountry:        US\\nPostalCode:     19382\\nRegDate:        2015-11-12\\nUpdated:        2020-09-16\\nReferralServer: rwhois://rwhois.infinitecom.net:4321\\nOrgAbuseHandle: IAA18-ARIN\\nOrgAdminHandle: INE20-ARIN\\nOrgNOCHandle:   INE20-ARIN\\nOrgTechHandle:  INE20-ARIN\\nSource:         ARIN\\n\n\nPOCHandle:      IAA18-ARIN\\nIsRole:         Y\\nLastName:       IP Address Administrator\\nFirstName:      \\nStreet:         1645 West Chester Pike\\nStreet:         Suite 200\\nCity:           West Chester\\nState/Prov:     PA\\nCountry:        US\\nPostalCode:     19382\\nRegDate:        2007-09-12\\nUpdated:        2017-04-26\\nOfficePhone:    +1-610-355-9700\\nFaxPhone:       +1-610-918-1646\\nMailbox:        IPAdmin@infinitecomllc.com\\nSource:         ARIN\\n\n\nPOCHandle:      INE20-ARIN\\nIsRole:         Y\\nLastName:       IP Network Engineering\\nFirstName:      \\nStreet:         2700 Oregon Road\\nCity:           Northwood\\nState/Prov:     OH\\nCountry:        US\\nPostalCode:     43619\\nRegDate:        2015-07-16\\nUpdated:        2022-02-22\\nOfficePhone:    +1-419-724-3884\\nMailbox:        chustwayte@sharedsvcs.com\\nMailbox:        ss-noc@sharedsvcs.com\\nSource:         ARIN\\n"}, {"range": "216.31.208.0/20", "id": "BROADCOM-NORTHAMERICA-1", "name": "Broadcom Corporation", "country": "US", "domain": "broadcom.com", "org_id": "BROADC-9", "status": "ALLOCATION", "tech_id": "BCNET-ARIN", "mnt_id": "BCNET-ARIN", "admin_id": "BCNET-ARIN", "abuse_id": "BCNET-ARIN", "created": "2002-10-23", "updated": "2021-12-14", "source": "arin", "raw": "NetHandle:      NET-216-31-208-0-1\\nOrgID:          BROADC-9\\nParent:         NET-216-0-0-0-0\\nNetName:        BROADCOM-NORTHAMERICA-1\\nNetRange:       216.31.208.0 - 216.31.223.255\\nNetType:        allocation\\nRegDate:        2002-10-23\\nUpdated:        2021-12-14\\nSource:         ARIN\\n\n\nOrgID:          BROADC-9\\nOrgName:        Broadcom Corporation\\nCanAllocate:    \\nStreet:         1320 Ridder Park Drive\\nCity:           San Jose\\nState/Prov:     CA\\nCountry:        US\\nPostalCode:     95131\\nRegDate:        1999-08-08\\nUpdated:        2021-08-17\\nOrgAbuseHandle: BCNET-ARIN\\nOrgAdminHandle: BCNET-ARIN\\nOrgNOCHandle:   BCNET-ARIN\\nOrgRoutingHandle:   NUTHA-ARIN\\nOrgTechHandle:  BCNET-ARIN\\nSource:         ARIN\\n\n\nPOCHandle:      BCNET-ARIN\\nIsRole:         Y\\nLastName:       BCNETENG\\nFirstName:      \\nStreet:         1320 Ridder Park Drive\\nCity:           San Jose\\nState/Prov:     CA\\nCountry:        US\\nPostalCode:     95131\\nRegDate:        2015-01-20\\nUpdated:        2022-06-13\\nOfficePhone:    +1-888-574-4357\\nMailbox:        domains.admin@broadcom.com\\nSource:         ARIN\\n"}, {"range": "216.156.244.64/28", "id": "XOXO-216-156-244-64", "name": "INTRADO COMMUNICATIONS HOLDINGS, LLC", "country": "US", "domain": "hypercube-llc.com.", "org_id": "HL-1", "status": "REALLOCATION", "tech_id": "ARINT78-ARIN", "mnt_id": "ARINN29-ARIN", "admin_id": "ARINT78-ARIN", "abuse_id": "ARINA309-ARIN", "created": "2011-08-22", "updated": "2011-08-22", "source": "arin", "raw": "NetHandle:      NET-216-156-244-64-1\\nOrgID:          HL-1\\nParent:         NET-216-156-0-0-1\\nNetName:        XOXO-216-156-244-64\\nNetRange:       216.156.244.64 - 216.156.244.79\\nNetType:        reallocation\\nRegDate:        2011-08-22\\nUpdated:        2011-08-22\\nSource:         ARIN\\n\n\nOrgID:          HL-1\\nOrgName:        INTRADO COMMUNICATIONS HOLDINGS, LLC\\nCanAllocate:    \\nStreet:         3200 W. Pleasant Run Road\\nStreet:         Suite #300\\nCity:           Lancaster\\nState/Prov:     TX\\nCountry:        US\\nPostalCode:     75146\\nComment:        http://www.hypercube-llc.com\\nComment:        NOTICE: For TELEPHONY ISSUES ONLY contact the NOC 24x7 at h3_noc@hypercube-llc.com OR +1 866-905-1735.  For Internet connectivity, services or abuse issues, use noc@hypercube-llc.com.\\nRegDate:        2010-12-30\\nUpdated:        2022-05-19\\nOrgAbuseHandle: ARINA309-ARIN\\nOrgAdminHandle: ARINT78-ARIN\\nOrgNOCHandle:   ARINN29-ARIN\\nOrgTechHandle:  ARINT78-ARIN\\nSource:         ARIN\\n\n\nPOCHandle:      ARINN29-ARIN\\nIsRole:         Y\\nLastName:       ARIN-NOC\\nFirstName:      \\nStreet:         3200 W. Pleasant Run Road\\nStreet:         Suite #300\\nCity:           Lancaster\\nState/Prov:     TX\\nCountry:        US\\nPostalCode:     75146\\nRegDate:        2022-05-18\\nUpdated:        2022-05-18\\nOfficePhone:    +1-469-727-1649\\nMailbox:        ARIN-NOC@h3net.com\\nSource:         ARIN\\n\n\nPOCHandle:      ARINT78-ARIN\\nIsRole:         Y\\nLastName:       ARIN-Tech\\nFirstName:      \\nStreet:         3200 W. Pleasant Run Road\\nStreet:         Suite #300\\nCity:           Lancaster\\nState/Prov:     TX\\nCountry:        US\\nPostalCode:     75146\\nRegDate:        2022-05-18\\nUpdated:        2022-05-18\\nOfficePhone:    +1-469-727-1649\\nMailbox:        ARIN-Tech@h3net.com\\nSource:         ARIN\\n\n\nPOCHandle:      ARINA309-ARIN\\nIsRole:         Y\\nLastName:       ARIN-Abuse\\nFirstName:      \\nStreet:         3200 W Pleasant Run Road\\nCity:           Lancaster\\nState/Prov:     TX\\nCountry:        US\\nPostalCode:     75002\\nRegDate:        2022-05-18\\nUpdated:        2022-05-18\\nOfficePhone:    +1-469-727-1649\\nMailbox:        ARIN-Abuse@h3net.com\\nSource:         ARIN\\n"}, {"range": "209.159.151.128/25", "id": "HOSTINGSOURCE39", "name": "hostingsource.com", "country": "US", "domain": "hostingsource.com", "org_id": "PWG-13", "status": "REASSIGNMENT", "tech_id": "GOLDI4-ARIN", "mnt_id": "GOLDI4-ARIN", "admin_id": "GOLDI4-ARIN", "abuse_id": "GOLDI4-ARIN", "created": "2020-09-01", "updated": "2020-09-01", "source": "arin", "raw": "NetHandle:      NET-209-159-151-128-1\\nOrgID:          PWG-13\\nParent:         NET-209-159-144-0-1\\nNetName:        HOSTINGSOURCE39\\nNetRange:       209.159.151.128 - 209.159.151.255\\nNetType:        reassignment\\nRegDate:        2020-09-01\\nUpdated:        2020-09-01\\nSource:         ARIN\\n\n\nOrgID:          PWG-13\\nOrgName:        hostingsource.com\\nCanAllocate:    \\nStreet:         70 SPRUCE ST BLDG 12\\nCity:           PATERSON\\nState/Prov:     NJ\\nCountry:        US\\nPostalCode:     07501\\nComment:        http://www.hostingsource.com/\\nComment:        HostingSource provides fully managed linux and windows dedicated servers with 24/7 support. Lowest internet prices. Free setup.\\nRegDate:        2013-10-24\\nUpdated:        2020-08-31\\nOrgAbuseHandle: GOLDI4-ARIN\\nOrgAdminHandle: GOLDI4-ARIN\\nOrgNOCHandle:   GOLDI4-ARIN\\nOrgTechHandle:  GOLDI4-ARIN\\nSource:         ARIN\\n\n\nPOCHandle:      GOLDI4-ARIN\\nIsRole:         N\\nLastName:       goldin\\nFirstName:      boris\\nStreet:         70 SPRUCE ST BLDG 12\\nCity:           PATERSON\\nState/Prov:     NJ\\nCountry:        US\\nPostalCode:     07501\\nRegDate:        2013-10-02\\nUpdated:        2020-08-31\\nMobilePhone:    +1-917-456-7716\\nOfficePhone:    +1-866-291-9413\\nMailbox:        accounts@hostingsource.com\\nMailbox:        bgoldin@hostingsource.com\\nMailbox:        support@hostingsource.com\\nSource:         ARIN\\n"}, {"range": "72.164.33.168/29", "id": "Q0218-72-164-33-168", "name": "GOLFSMITH INTERNATIONAL", "country": "US", "domain": "golfsmith.com", "org_id": "GOLFS-31", "status": "REASSIGNMENT", "tech_id": "KPE41-ARIN", "mnt_id": "KPE41-ARIN", "admin_id": "KPE41-ARIN", "abuse_id": "KPE41-ARIN", "created": "2009-02-18", "updated": "2009-02-18", "source": "arin", "raw": "NetHandle:      NET-72-164-33-168-1\\nOrgID:          GOLFS-31\\nParent:         NET-72-164-0-0-1\\nNetName:        Q0218-72-164-33-168\\nNetRange:       72.164.33.168 - 72.164.33.175\\nNetType:        reassignment\\nOriginAS:       209\\nRegDate:        2009-02-18\\nUpdated:        2009-02-18\\nAbuseHandle:    KPE41-ARIN\\nNOCHandle:      KPE41-ARIN\\nSource:         ARIN\\n\n\nOrgID:          GOLFS-31\\nOrgName:        GOLFSMITH INTERNATIONAL\\nCanAllocate:    \\nStreet:         441 W ESPLANADE DR\\nStreet:         BLDG MAIN FLR MAIN RM TELCO\\nCity:           OXNARD\\nState/Prov:     CA\\nCountry:        US\\nPostalCode:     93036\\nRegDate:        2009-02-18\\nUpdated:        2011-09-24\\nOrgAbuseHandle: KPE41-ARIN\\nOrgAdminHandle: KPE41-ARIN\\nOrgTechHandle:  KPE41-ARIN\\nSource:         ARIN\\n\n\nPOCHandle:      KPE41-ARIN\\nIsRole:         N\\nLastName:       PECK\\nFirstName:      KEVIN\\nStreet:         2404 2404 BANK DR\\nCity:           BOISE\\nState/Prov:     ID\\nCountry:        US\\nPostalCode:     83705\\nRegDate:        2007-11-29\\nUpdated:        2007-11-29\\nOfficePhone:    +1-877-383-9016\\nMailbox:        kevin.peck@qwest.com\\nSource:         ARIN\\n"}, {"range": "208.69.252.0/22", "id": "CUCBC", "name": "Central 1 Credit Union", "country": "CA", "domain": "central1.com", "org_id": "CUCBC", "status": "ALLOCATION", "tech_id": "UNTZN-ARIN", "mnt_id": "HOSTM847-ARIN", "admin_id": "HOSTM847-ARIN", "abuse_id": "KUERT3-ARIN", "created": "2006-08-29", "updated": "2021-12-14", "source": "arin", "raw": "NetHandle:      NET-208-69-252-0-1\\nOrgID:          CUCBC\\nParent:         NET-208-0-0-0-0\\nNetName:        CUCBC\\nNetRange:       208.69.252.0 - 208.69.255.255\\nNetType:        allocation\\nOriginAS:       23498, 5071\\nRegDate:        2006-08-29\\nUpdated:        2021-12-14\\nAbuseHandle:    HOSTM847-ARIN\\nNOCHandle:      HOSTM847-ARIN\\nTechHandle:     UNTZN-ARIN\\nSource:         ARIN\\n\n\nOrgID:          CUCBC\\nOrgName:        Central 1 Credit Union\\nCanAllocate:    \\nStreet:         1441 Creekside Dr.\\nCity:           Vancouver\\nState/Prov:     BC\\nCountry:        CA\\nPostalCode:     V6J-4S7\\nRegDate:        1997-01-29\\nUpdated:        2022-03-23\\nOrgAbuseHandle: KUERT3-ARIN\\nOrgAbuseHandle: UNTZN-ARIN\\nOrgAdminHandle: HOSTM847-ARIN\\nOrgTechHandle:  KUERT3-ARIN\\nOrgTechHandle:  UNTZN-ARIN\\nOrgTechHandle:  ZARAM1-ARIN\\nSource:         ARIN\\n\n\nPOCHandle:      UNTZN-ARIN\\nIsRole:         N\\nLastName:       Untz\\nFirstName:      Nicolas\\nStreet:         1441 Creekside Drive\\nCity:           Vancouver\\nState/Prov:     BC\\nCountry:        CA\\nPostalCode:     V6J 4S7\\nRegDate:        2018-10-25\\nUpdated:        2020-10-29\\nOfficePhone:    +1-604-737-5094\\nMailbox:        nuntz@central1.com\\nSource:         ARIN\\n\n\nPOCHandle:      KUERT3-ARIN\\nIsRole:         N\\nLastName:       Kuerten\\nFirstName:      Nils\\nStreet:         1441 Creekside Dr\\nCity:           Vancouver\\nState/Prov:     BC\\nCountry:        CA\\nPostalCode:     V6J 4S7\\nRegDate:        2020-10-29\\nUpdated:        2021-10-29\\nOfficePhone:    +1-604-730-6431\\nMailbox:        nkuerten@central1.com\\nSource:         ARIN\\n\n\nPOCHandle:      HOSTM847-ARIN\\nIsRole:         Y\\nLastName:       Hostmaster\\nFirstName:      \\nStreet:         1441 Creekside Dr.\\nCity:           Vancouver\\nState/Prov:     BC\\nCountry:        CA\\nPostalCode:     V6J-4S7\\nRegDate:        2006-07-25\\nUpdated:        2020-10-29\\nOfficePhone:    +1-604-734-2511\\nMailbox:        hostmaster@central1.com\\nSource:         ARIN\\n\n\nPOCHandle:      ZARAM1-ARIN\\nIsRole:         N\\nLastName:       Zara\\nFirstName:      Marvin\\nStreet:         1441 Creekside Drive\\nCity:           Vancouver\\nState/Prov:     BC\\nCountry:        CA\\nPostalCode:     V6J 4S7\\nRegDate:        2022-03-23\\nUpdated:        2022-03-23\\nOfficePhone:    +1-604-737-5925\\nMailbox:        mzara@central1.com\\nSource:         ARIN\\n"}, {"range": "96.8.64.0/20", "id": "NEARFIELD-96-8-64-0-20", "name": "Nearfield Solution Systems, Inc.", "country": "US", "domain": "nearf.net", "org_id": "NEARF-1", "status": "ALLOCATION", "tech_id": "TECHN935-ARIN", "mnt_id": "TECHN935-ARIN", "admin_id": "EDWAR330-ARIN", "abuse_id": "TECHN935-ARIN", "created": "2010-08-27", "updated": "2015-11-20", "source": "arin", "raw": "NetHandle:      NET-96-8-64-0-1\\nOrgID:          NEARF-1\\nParent:         NET-96-0-0-0-0\\nNetName:        NEARFIELD-96-8-64-0-20\\nNetRange:       96.8.64.0 - 96.8.79.255\\nNetType:        allocation\\nOriginAS:       53503\\nRegDate:        2010-08-27\\nUpdated:        2015-11-20\\nAbuseHandle:    TECHN935-ARIN\\nNOCHandle:      TECHN935-ARIN\\nTechHandle:     TECHN935-ARIN\\nSource:         ARIN\\n\n\nOrgID:          NEARF-1\\nOrgName:        Nearfield Solution Systems, Inc.\\nCanAllocate:    \\nStreet:         11756 BORMAN DR\\nCity:           SAINT LOUIS\\nState/Prov:     MO\\nCountry:        US\\nPostalCode:     63146\\nRegDate:        2010-04-28\\nUpdated:        2019-07-23\\nReferralServer: rwhois://rwhois.nearf.net:4321\\nOrgAbuseHandle: TECHN935-ARIN\\nOrgAdminHandle: EDWAR330-ARIN\\nOrgTechHandle:  TECHN935-ARIN\\nSource:         ARIN\\n\n\nPOCHandle:      TECHN935-ARIN\\nIsRole:         Y\\nLastName:       Technical\\nFirstName:      \\nStreet:         11756 Borman Dr\\nCity:           Saint Louis\\nState/Prov:     MO\\nCountry:        US\\nPostalCode:     63146\\nRegDate:        2010-04-26\\nUpdated:        2021-10-07\\nOfficePhone:    +1-786-590-1015\\nMailbox:        support@nearfieldnetworks.net\\nSource:         ARIN\\n\n\nPOCHandle:      EDWAR330-ARIN\\nIsRole:         N\\nLastName:       Edwards\\nFirstName:      Brandon\\nStreet:         2025 Zumbehl Rd\\nStreet:         #335\\nCity:           Saint Charles\\nState/Prov:     MO\\nCountry:        US\\nPostalCode:     63303\\nRegDate:        2015-11-15\\nUpdated:        2022-07-01\\nOfficePhone:    +1-314-925-0490\\nMailbox:        brandone@nearfield-solutions.net\\nSource:         ARIN\\n"}, {"range": "63.148.36.152/29", "id": "Q0524-63-148-36-152", "name": "Block Line Systems, LLC", "country": "US", "domain": "infinitecom.net", "org_id": "BLSL", "status": "REALLOCATION", "tech_id": "INE20-ARIN", "mnt_id": "INE20-ARIN", "admin_id": "INE20-ARIN", "abuse_id": "IAA18-ARIN", "created": "2018-05-24", "updated": "2018-05-24", "source": "arin", "raw": "NetHandle:      NET-63-148-36-152-1\\nOrgID:          BLSL\\nParent:         NET-63-144-0-0-1\\nNetName:        Q0524-63-148-36-152\\nNetRange:       63.148.36.152 - 63.148.36.159\\nNetType:        reallocation\\nOriginAS:       209\\nRegDate:        2018-05-24\\nUpdated:        2018-05-24\\nSource:         ARIN\\n\n\nOrgID:          BLSL\\nOrgName:        Block Line Systems, LLC\\nCanAllocate:    \\nStreet:         1645 West Chester Pike\\nStreet:         Suite 200\\nCity:           West Chester\\nState/Prov:     PA\\nCountry:        US\\nPostalCode:     19382\\nRegDate:        2015-11-12\\nUpdated:        2020-09-16\\nReferralServer: rwhois://rwhois.infinitecom.net:4321\\nOrgAbuseHandle: IAA18-ARIN\\nOrgAdminHandle: INE20-ARIN\\nOrgNOCHandle:   INE20-ARIN\\nOrgTechHandle:  INE20-ARIN\\nSource:         ARIN\\n\n\nPOCHandle:      INE20-ARIN\\nIsRole:         Y\\nLastName:       IP Network Engineering\\nFirstName:      \\nStreet:         2700 Oregon Road\\nCity:           Northwood\\nState/Prov:     OH\\nCountry:        US\\nPostalCode:     43619\\nRegDate:        2015-07-16\\nUpdated:        2022-02-22\\nOfficePhone:    +1-419-724-3884\\nMailbox:        chustwayte@sharedsvcs.com\\nMailbox:        ss-noc@sharedsvcs.com\\nSource:         ARIN\\n\n\nPOCHandle:      IAA18-ARIN\\nIsRole:         Y\\nLastName:       IP Address Administrator\\nFirstName:      \\nStreet:         1645 West Chester Pike\\nStreet:         Suite 200\\nCity:           West Chester\\nState/Prov:     PA\\nCountry:        US\\nPostalCode:     19382\\nRegDate:        2007-09-12\\nUpdated:        2017-04-26\\nOfficePhone:    +1-610-355-9700\\nFaxPhone:       +1-610-918-1646\\nMailbox:        IPAdmin@infinitecomllc.com\\nSource:         ARIN\\n"}, {"range": "192.65.199.0/24", "id": "NAS-SE-NET", "name": "National Aeronautics and Space Administration", "country": "US", "domain": "nasa.gov", "org_id": "NASA", "status": "ALLOCATION", "tech_id": "ZN7-ARIN", "mnt_id": "NISN-ARIN", "admin_id": "BGS7-ARIN", "abuse_id": "NASAA-ARIN", "created": "1989-11-30", "updated": "2002-08-27", "source": "arin", "raw": "NetHandle:      NET-192-65-199-0-1\\nOrgID:          NASA\\nParent:         NET-192-0-0-0-0\\nNetName:        NAS-SE-NET\\nNetRange:       192.65.199.0 - 192.65.199.255\\nNetType:        allocation\\nRegDate:        1989-11-30\\nUpdated:        2002-08-27\\nTechHandle:     ZN7-ARIN\\nSource:         ARIN\\n\n\nOrgID:          NASA\\nOrgName:        National Aeronautics and Space Administration\\nCanAllocate:    \\nStreet:         IS05/Office of the Chief Information Officer\\nCity:           MSFC\\nState/Prov:     AL\\nCountry:        US\\nPostalCode:     35812\\nRegDate:        1970-01-01\\nUpdated:        2020-04-09\\nOrgAbuseHandle: NASAA-ARIN\\nOrgAdminHandle: BGS7-ARIN\\nOrgNOCHandle:   NISN-ARIN\\nOrgTechHandle:  IPAMO-ARIN\\nOrgTechHandle:  RFBJ-ARIN\\nSource:         ARIN\\n\n\nPOCHandle:      IPAMO-ARIN\\nIsRole:         Y\\nLastName:       IPAM Operations\\nFirstName:      \\nStreet:         MSFC\\nCity:           MSFC\\nState/Prov:     AL\\nCountry:        US\\nPostalCode:     35812\\nRegDate:        2010-11-01\\nUpdated:        2021-11-15\\nOfficePhone:    +1-256-961-4726\\nMailbox:        ipam@nasa.gov\\nSource:         ARIN\\n\n\nPOCHandle:      RFBJ-ARIN\\nIsRole:         N\\nLastName:       Bischof, Jr.\\nFirstName:      Ralph\\nStreet:         221 Wynn Drive\\nStreet:         Suite 500\\nCity:           Huntsville\\nState/Prov:     AL\\nCountry:        US\\nPostalCode:     35805\\nRegDate:        2005-12-20\\nUpdated:        2021-11-22\\nOfficePhone:    256-961-4000\\nMailbox:        dns@nasa.gov\\nMailbox:        dns.support@nasa.gov\\nMailbox:        Ralph.Bischof@nasa.gov\\nSource:         ARIN\\n\n\nPOCHandle:      NASAA-ARIN\\nIsRole:         Y\\nLastName:       NASA Abuse\\nFirstName:      \\nStreet:         Center Operations Directorate\\nStreet:         Information Services Department\\nCity:           Marshall Space Flight Center\\nState/Prov:     AL\\nCountry:        US\\nPostalCode:     35812\\nRegDate:        2002-08-26\\nUpdated:        2003-07-10\\nOfficePhone:    +1-800-762-7472\\nMailbox:        abuse@nasa.gov\\nSource:         ARIN\\n\n\nPOCHandle:      ZN7-ARIN\\nIsRole:         Y\\nLastName:       Center Operations Directorate\\nFirstName:      \\nStreet:         Attn: FOIA Office\\nStreet:         Mail Code CO50\\nStreet:         Marshall Space Flight Center\\nCity:           Huntsville\\nState/Prov:     AL\\nCountry:        US\\nPostalCode:     35812\\nRegDate:        1999-11-19\\nUpdated:        2021-11-08\\nOfficePhone:    256-961-4000\\nMailbox:        dns.support@nasa.gov\\nMailbox:        dns@nasa.gov\\nSource:         ARIN\\n\n\nPOCHandle:      BGS7-ARIN\\nIsRole:         N\\nLastName:       Schleckser\\nFirstName:      Barbara\\nStreet:         215 Wynn Dr\\nCity:           Huntsville\\nState/Prov:     AL\\nCountry:        US\\nPostalCode:     35806\\nRegDate:        2020-04-09\\nUpdated:        2022-03-28\\nOfficePhone:    +1-256-624-0178\\nMailbox:        barbara.g.schleckser@nasa.gov\\nSource:         ARIN\\n\n\nPOCHandle:      NISN-ARIN\\nIsRole:         Y\\nLastName:       NASA Information Services Network\\nFirstName:      \\nStreet:         215 Wynn Dr., Suite 300\\nCity:           Huntsville\\nState/Prov:     AL\\nCountry:        US\\nPostalCode:     35805\\nRegDate:        2002-09-27\\nUpdated:        2015-11-02\\nOfficePhone:    +1-256-961-4000\\nMailbox:        noc@nisn.nasa.gov\\nSource:         ARIN\\n"}, {"range": "192.80.88.0/22", "id": "AJU-192-80-88", "name": "Lunavi, Inc.", "country": "US", "domain": "greenhousedata.com", "org_id": "GHD-7", "status": "ALLOCATION", "tech_id": "NOC2912-ARIN", "mnt_id": "NOC2912-ARIN", "admin_id": "NOC2912-ARIN", "abuse_id": "NOC2912-ARIN", "created": "2012-08-28", "updated": "2018-07-13", "source": "arin", "raw": "NetHandle:      NET-192-80-88-0-1\\nOrgID:          GHD-7\\nParent:         NET-192-0-0-0-0\\nNetName:        AJU-192-80-88\\nNetRange:       192.80.88.0 - 192.80.91.255\\nNetType:        allocation\\nOriginAS:       6939, 54431\\nRegDate:        2012-08-28\\nUpdated:        2018-07-13\\nSource:         ARIN\\n\n\nOrgID:          GHD-7\\nOrgName:        Lunavi, Inc.\\nCanAllocate:    \\nStreet:         304 Progress Circle\\nCity:           Cheyenne\\nState/Prov:     WY\\nCountry:        US\\nPostalCode:     82007\\nRegDate:        2007-12-27\\nUpdated:        2020-09-30\\nReferralServer: rwhois://rwhois.greenhousedata.com:4321\\nOrgAbuseHandle: NOC2912-ARIN\\nOrgAdminHandle: NOC2912-ARIN\\nOrgNOCHandle:   NOC2912-ARIN\\nOrgTechHandle:  NOC2912-ARIN\\nSource:         ARIN\\n\n\nPOCHandle:      NOC2912-ARIN\\nIsRole:         Y\\nLastName:       Network Operations Center\\nFirstName:      \\nStreet:         340 Progress Circle\\nCity:           Cheyenne\\nState/Prov:     WY\\nCountry:        US\\nPostalCode:     82007\\nRegDate:        2007-12-27\\nUpdated:        2021-09-21\\nOfficePhone:    +1-866-995-3282\\nFaxPhone:       +1-307-222-0643\\nMailbox:        noc@lunavi.com\\nSource:         ARIN\\n"}, {"range": "204.13.0.0/21", "id": "BIZNESSHOSTING-204", "name": "VOLICO", "country": "US", "domain": "biznesshosting.com", "org_id": "BIZNE", "status": "ALLOCATION", "tech_id": "VOLIC-ARIN", "mnt_id": "VOLIC-ARIN", "admin_id": "VOLIC-ARIN", "abuse_id": "DAB80-ARIN", "created": "2005-03-30", "updated": "2018-01-29", "source": "arin", "raw": "NetHandle:      NET-204-13-0-0-1\\nOrgID:          BIZNE\\nParent:         NET-204-0-0-0-0\\nNetName:        BIZNESSHOSTING-204\\nNetRange:       204.13.0.0 - 204.13.7.255\\nNetType:        allocation\\nOriginAS:       33724\\nRegDate:        2005-03-30\\nUpdated:        2018-01-29\\nSource:         ARIN\\n\n\nOrgID:          BIZNE\\nOrgName:        VOLICO\\nCanAllocate:    \\nStreet:         500 Green Road\\nCity:           Deerfield\\nState/Prov:     FL\\nCountry:        US\\nPostalCode:     33064\\nComment:        Please Send Abuse to abuse@biznesshosting.com\\nRegDate:        2005-02-28\\nUpdated:        2017-03-06\\nReferralServer: rwhois://rwhois.biznesshosting.com:4321\\nOrgAbuseHandle: DAB80-ARIN\\nOrgAdminHandle: VOLIC-ARIN\\nOrgNOCHandle:   VOLIC-ARIN\\nOrgTechHandle:  VOLIC-ARIN\\nSource:         ARIN\\n\n\nPOCHandle:      DAB80-ARIN\\nIsRole:         N\\nLastName:       Abuse\\nFirstName:      Dept\\nStreet:         500 Green Road\\nCity:           Deerfield\\nState/Prov:     FL\\nCountry:        US\\nPostalCode:     33064\\nRegDate:        2009-04-04\\nUpdated:        2022-02-12\\nOfficePhone:    +1-888-865-4261\\nMailbox:        abuse@biznesshosting.com\\nSource:         ARIN\\n\n\nPOCHandle:      VOLIC-ARIN\\nIsRole:         Y\\nLastName:       Volico NOC\\nFirstName:      \\nStreet:         500 Green Road\\nCity:           Deerfield\\nState/Prov:     FL\\nCountry:        US\\nPostalCode:     33064\\nRegDate:        2017-02-06\\nUpdated:        2022-07-26\\nOfficePhone:    +1-888-865-4261\\nMailbox:        support@volico.com\\nSource:         ARIN\\n"}, {"range": "64.14.242.0/24", "id": "SAVV-S235136-13", "name": "Zerolag Communications, Inc.", "country": "US", "domain": "zerolag.com", "org_id": "ZLC-3", "status": "REALLOCATION", "tech_id": "GST67-ARIN", "mnt_id": "ZEROL-ARIN", "admin_id": "GST67-ARIN", "abuse_id": "ZEROL-ARIN", "created": "2006-11-08", "updated": "2006-11-08", "source": "arin", "raw": "NetHandle:      NET-64-14-242-0-1\\nOrgID:          ZLC-3\\nParent:         NET-64-14-0-0-1\\nNetName:        SAVV-S235136-13\\nNetRange:       64.14.242.0 - 64.14.242.255\\nNetType:        reallocation\\nRegDate:        2006-11-08\\nUpdated:        2006-11-08\\nTechHandle:     GST67-ARIN\\nSource:         ARIN\\n\n\nOrgID:          ZLC-3\\nOrgName:        Zerolag Communications, Inc.\\nCanAllocate:    \\nStreet:         34 Peachtree ST, Suite 400\\nCity:           Atlanta\\nState/Prov:     GA\\nCountry:        US\\nPostalCode:     30303\\nRegDate:        2006-09-01\\nUpdated:        2018-02-23\\nOrgAbuseHandle: ZEROL-ARIN\\nOrgAdminHandle: GST67-ARIN\\nOrgNOCHandle:   ZEROL-ARIN\\nOrgTechHandle:  ZEROL-ARIN\\nSource:         ARIN\\n\n\nPOCHandle:      ZEROL-ARIN\\nIsRole:         Y\\nLastName:       ZeroLag NOC\\nFirstName:      \\nStreet:         34 Peachtree ST, Suite 400\\nCity:           Atlanta\\nState/Prov:     GA\\nCountry:        US\\nPostalCode:     30303\\nRegDate:        2007-08-27\\nUpdated:        2018-02-23\\nOfficePhone:    +1-877-937-6524\\nMailbox:        noc@as46562.net\\nSource:         ARIN\\n\n\nPOCHandle:      GST67-ARIN\\nIsRole:         N\\nLastName:       Strelzoff\\nFirstName:      Greg\\nStreet:         289 South Robertson Blvd.\\nStreet:         Suite 441\\nCity:           Beverly Hills\\nState/Prov:     CA\\nCountry:        US\\nPostalCode:     90211\\nRegDate:        2006-09-01\\nUpdated:        2011-09-28\\nOfficePhone:    +1-310-306-7333\\nMailbox:        greg@zerolag.com\\nSource:         ARIN\\n"}, {"range": "2607:b700::/32", "id": "K12ITC", "name": "Menlo, Inc.", "country": "US", "domain": "maronelectric.com", "org_id": "KI", "status": "ALLOCATION", "tech_id": "SANDT-ARIN", "mnt_id": "SANDT-ARIN", "admin_id": "SANDT-ARIN", "abuse_id": "SANDT-ARIN", "created": "2012-06-22", "updated": "2012-06-22", "source": "arin", "raw": "V6NetHandle:    NET6-2607-B700-1\\nOrgID:          KI\\nParent:         NET6-2600-1\\nNetName:        K12ITC\\nNetRange:       2607:B700:: - 2607:B700:FFFF:FFFF:FFFF:FFFF:FFFF:FFFF\\nNetType:        allocation\\nOriginAS:       15188\\nRegDate:        2012-06-22\\nUpdated:        2012-06-22\\nSource:         ARIN\\n\n\nOrgID:          KI\\nOrgName:        Menlo, Inc.\\nCanAllocate:    \\nStreet:         1901 McGee Street\\nStreet:         Suite 200\\nCity:           Kansas City\\nState/Prov:     MO\\nCountry:        US\\nPostalCode:     64108\\nRegDate:        2011-02-07\\nUpdated:        2020-11-19\\nOrgAbuseHandle: SANDT-ARIN\\nOrgAdminHandle: SANDT-ARIN\\nOrgNOCHandle:   SANDT-ARIN\\nOrgTechHandle:  SANDT-ARIN\\nSource:         ARIN\\n\n\nPOCHandle:      SANDT-ARIN\\nIsRole:         N\\nLastName:       Sandt\\nFirstName:      Brad\\nStreet:         1901 McGee Street\\nStreet:         Suite 200\\nCity:           Kansas City\\nState/Prov:     MO\\nCountry:        US\\nPostalCode:     64108\\nRegDate:        2011-02-05\\nUpdated:        2021-11-19\\nOfficePhone:    +1-816-382-4800\\nMailbox:        brad.sandt@menloinc.com\\nMailbox:        brad.sandt@k12itc.com\\nSource:         ARIN\\n"}, {"range": "75.150.18.8/30", "id": "BOA", "name": "Bank of America, National Association", "country": "US", "domain": "bankofamerica.com", "org_id": "BANKOF-2", "status": "REALLOCATION", "tech_id": "LAU-ARIN\\NSPD3-ARIN\\NZB29-ARIN", "mnt_id": "ZB29-ARIN", "admin_id": "ZB29-ARIN", "abuse_id": "ABUSE608-ARIN", "created": "2021-07-03", "updated": "2021-07-03", "source": "arin", "raw": "NetHandle:      NET-75-150-18-8-1\\nOrgID:          BANKOF-2\\nParent:         NET-75-150-16-0-1\\nNetName:        BOA\\nNetRange:       75.150.18.8 - 75.150.18.11\\nNetType:        reallocation\\nRegDate:        2021-07-03\\nUpdated:        2021-07-03\\nSource:         ARIN\\n\n\nOrgID:          BANKOF-2\\nOrgName:        Bank of America, National Association\\nCanAllocate:    \\nStreet:         Bank of America Corporation\\nStreet:         100 North Tryon Street\\nCity:           Charlotte\\nState/Prov:     NC\\nCountry:        US\\nPostalCode:     28255\\nComment:        For abuse issues contact abuse@bankofamerica.com\\nRegDate:        1992-01-06\\nUpdated:        2022-04-25\\nOrgAbuseHandle: ABUSE608-ARIN\\nOrgAdminHandle: ZB29-ARIN\\nOrgNOCHandle:   ZB29-ARIN\\nOrgTechHandle:  LAU-ARIN\\nOrgTechHandle:  SPD3-ARIN\\nOrgTechHandle:  ZB29-ARIN\\nSource:         ARIN\\n\n\nPOCHandle:      SPD3-ARIN\\nIsRole:         N\\nLastName:       Dornan\\nFirstName:      Sean\\nStreet:         30650 23 MILE RD\\nCity:           Chesterfield\\nState/Prov:     MI\\nCountry:        US\\nPostalCode:     48047\\nRegDate:        2016-01-04\\nUpdated:        2021-01-04\\nOfficePhone:    +1-586-273-1444\\nMobilePhone:    +1-586-876-7947\\nMailbox:        sean.dornan@bankofamerica.com\\nSource:         ARIN\\n\n\nPOCHandle:      LAU-ARIN\\nIsRole:         N\\nLastName:       Uribarri\\nFirstName:      Luis\\nStreet:         330 N Mesa St\\nCity:           El Paso\\nState/Prov:     TX\\nCountry:        US\\nPostalCode:     79901\\nRegDate:        2003-03-19\\nUpdated:        2021-12-07\\nOfficePhone:    +1-646-556-2742\\nMailbox:        luis.a.uribarri@bofa.com\\nSource:         ARIN\\n\n\nPOCHandle:      ABUSE608-ARIN\\nIsRole:         Y\\nLastName:       ABUSE\\nFirstName:      \\nStreet:         200 S. COLLEGE STREET\\nStreet:         NC1-014-14-04\\nCity:           CHARLOTTE\\nState/Prov:     NC\\nCountry:        US\\nPostalCode:     28255\\nRegDate:        2004-04-14\\nUpdated:        2018-11-05\\nOfficePhone:    +1-704-386-5000\\nMailbox:        ABUSE@bankofamerica.com\\nSource:         ARIN\\n\n\nPOCHandle:      ZB29-ARIN\\nIsRole:         Y\\nLastName:       HOSTMASTER\\nFirstName:      \\nStreet:         ATTN: Patrick O'Hagerty\\nStreet:         Mailcode NC1-003-03-95\\nStreet:         901 West Trade Street\\nCity:           Charlotte\\nState/Prov:     NC\\nCountry:        US\\nPostalCode:     28255\\nRegDate:        2000-05-09\\nUpdated:        2021-12-10\\nMobilePhone:    +1-518-708-9371\\nOfficePhone:    +1-980-387-3750\\nMailbox:        HOSTMASTER@bankofamerica.com\\nMailbox:        patrick.ohagerty@bofa.com\\nSource:         ARIN\\n"}, {"range": "63.147.136.88/29", "id": "Q0924-63-147-136-88", "name": "AIRESPRING, INC.", "country": "US", "domain": "airespring.com", "org_id": "AIRES-25", "status": "REALLOCATION", "tech_id": "NOC33032-ARIN\\NOPSNE22-ARIN", "mnt_id": "ABUSE5351-ARIN", "admin_id": "OPSNE22-ARIN", "abuse_id": "ABUSE5351-ARIN", "created": "2016-09-24", "updated": "2016-09-24", "source": "arin", "raw": "NetHandle:      NET-63-147-136-88-1\\nOrgID:          AIRES-25\\nParent:         NET-63-144-0-0-1\\nNetName:        Q0924-63-147-136-88\\nNetRange:       63.147.136.88 - 63.147.136.95\\nNetType:        reallocation\\nOriginAS:       209\\nRegDate:        2016-09-24\\nUpdated:        2016-09-24\\nSource:         ARIN\\n\n\nOrgID:          AIRES-25\\nOrgName:        AIRESPRING, INC.\\nCanAllocate:    \\nStreet:         7800 Woodley Ave\\nCity:           VAN NUYS\\nState/Prov:     CA\\nCountry:        US\\nPostalCode:     91406\\nRegDate:        2004-10-20\\nUpdated:        2020-01-07\\nOrgAbuseHandle: ABUSE5351-ARIN\\nOrgAdminHandle: OPSNE22-ARIN\\nOrgNOCHandle:   ABUSE5351-ARIN\\nOrgTechHandle:  NOC33032-ARIN\\nOrgTechHandle:  OPSNE22-ARIN\\nSource:         ARIN\\n\n\nPOCHandle:      OPSNE22-ARIN\\nIsRole:         N\\nLastName:       Ops\\nFirstName:      Net\\nStreet:         7800 Woodley Ave\\nCity:           Van Nuys\\nState/Prov:     CA\\nCountry:        US\\nPostalCode:     91406\\nRegDate:        2019-02-12\\nUpdated:        2022-03-01\\nOfficePhone:    +1-818-922-1181\\nMailbox:        netops@airespring.com\\nSource:         ARIN\\n\n\nPOCHandle:      NOC33032-ARIN\\nIsRole:         Y\\nLastName:       Network Operation Center\\nFirstName:      \\nStreet:         7800 Woodley Ave\\nCity:           Van Nuys\\nState/Prov:     CA\\nCountry:        US\\nPostalCode:     91406\\nRegDate:        2019-10-16\\nUpdated:        2021-10-15\\nOfficePhone:    +1-818-738-1784\\nMailbox:        PJ.Yegani@AireSpring.com\\nSource:         ARIN\\n\n\nPOCHandle:      ABUSE5351-ARIN\\nIsRole:         Y\\nLastName:       Abuse Dept\\nFirstName:      \\nStreet:         7800 Woodley Ave\\nCity:           Van Nuys\\nState/Prov:     CA\\nCountry:        US\\nPostalCode:     91406\\nRegDate:        2016-02-08\\nUpdated:        2022-05-17\\nOfficePhone:    +1-888-288-5010\\nMailbox:        abuse@airespring.com\\nSource:         ARIN\\n"}, {"range": "65.98.127.0/24", "id": "FORTRESSITX", "name": "OC1-DedicatedNow, LLC", "country": "US", "domain": "dedicatednow.com", "org_id": "OL-207", "status": "ALLOCATION", "tech_id": "DNO108-ARIN", "mnt_id": "DNO108-ARIN", "admin_id": "DNO108-ARIN", "abuse_id": "DNO108-ARIN", "created": "2004-07-21", "updated": "2018-06-21", "source": "arin", "raw": "NetHandle:      NET-65-98-127-0-1\\nOrgID:          OL-207\\nParent:         NET-65-0-0-0-0\\nNetName:        FORTRESSITX\\nNetRange:       65.98.127.0 - 65.98.127.255\\nNetType:        allocation\\nRegDate:        2004-07-21\\nUpdated:        2018-06-21\\nSource:         ARIN\\n\n\nOrgID:          OL-207\\nOrgName:        OC1-DedicatedNow, LLC\\nCanAllocate:    \\nStreet:         56 Leonard Street, Suite 21AE\\nCity:           New York\\nState/Prov:     NY\\nCountry:        US\\nPostalCode:     10013\\nComment:        http://www.dedicatednow.com\\nRegDate:        2018-03-14\\nUpdated:        2018-06-25\\nOrgAbuseHandle: DNO108-ARIN\\nOrgAdminHandle: DNO108-ARIN\\nOrgNOCHandle:   DNO108-ARIN\\nOrgTechHandle:  DNO108-ARIN\\nSource:         ARIN\\n\n\nPOCHandle:      DNO108-ARIN\\nIsRole:         Y\\nLastName:       DedicatedNow Network Operations\\nFirstName:      \\nStreet:         14 Wall Street, Suite 2036\\nCity:           New York\\nState/Prov:     NY\\nCountry:        US\\nPostalCode:     10005\\nRegDate:        2017-08-31\\nUpdated:        2021-08-18\\nOfficePhone:    +1-888-734-7320\\nMailbox:        dedicatednow@cloudequitygroup.com\\nSource:         ARIN\\n"}, {"range": "216.110.194.0/24", "id": "DFN-LSN-BLK3", "name": "Douglas FastNet", "country": "US", "domain": "douglasfast.net", "org_id": "DFD-5", "status": "REALLOCATION", "tech_id": "IAD24-ARIN", "mnt_id": "NOC1711-ARIN", "admin_id": "IAD24-ARIN", "abuse_id": "ABUSE1671-ARIN", "created": "2021-02-12", "updated": "2021-02-12", "source": "arin", "raw": "NetHandle:      NET-216-110-194-0-1\\nOrgID:          DFD-5\\nParent:         NET-216-110-192-0-1\\nNetName:        DFN-LSN-BLK3\\nNetRange:       216.110.194.0 - 216.110.194.255\\nNetType:        reallocation\\nOriginAS:       13692\\nRegDate:        2021-02-12\\nUpdated:        2021-02-12\\nSource:         ARIN\\n\n\nOrgID:          DFD-5\\nOrgName:        Douglas FastNet\\nCanAllocate:    \\nStreet:         2350 Aviation Drive\\nCity:           Roseburg\\nState/Prov:     OR\\nCountry:        US\\nPostalCode:     97470\\nComment:        http://www.douglasfast.net\\nRegDate:        2003-01-14\\nUpdated:        2017-01-28\\nOrgAbuseHandle: ABUSE1671-ARIN\\nOrgAdminHandle: IAD24-ARIN\\nOrgNOCHandle:   NOC1711-ARIN\\nOrgTechHandle:  IAD24-ARIN\\nSource:         ARIN\\n\n\nPOCHandle:      IAD24-ARIN\\nIsRole:         Y\\nLastName:       Douglas FastNet IP Administration\\nFirstName:      \\nStreet:         2350 Aviation Drive\\nCity:           Roseburg\\nState/Prov:     OR\\nCountry:        US\\nPostalCode:     97470\\nRegDate:        2007-05-21\\nUpdated:        2022-06-21\\nOfficePhone:    +1-541-673-4242\\nMailbox:        noc@douglasfast.net\\nSource:         ARIN\\n\n\nPOCHandle:      ABUSE1671-ARIN\\nIsRole:         Y\\nLastName:       Douglas FastNet Security and Abuse\\nFirstName:      \\nStreet:         2350 Aviation Drive\\nCity:           Roseburg\\nState/Prov:     OR\\nCountry:        US\\nPostalCode:     97470\\nRegDate:        2007-05-21\\nUpdated:        2022-06-21\\nOfficePhone:    +1-541-673-4242\\nMailbox:        abuse@douglasfast.net\\nSource:         ARIN\\n\n\nPOCHandle:      NOC1711-ARIN\\nIsRole:         Y\\nLastName:       Douglas FastNet Network Operations Center\\nFirstName:      \\nStreet:         2350 Aviation Drive\\nCity:           Roseburg\\nState/Prov:     OR\\nCountry:        US\\nPostalCode:     97470\\nRegDate:        2005-01-14\\nUpdated:        2022-06-21\\nOfficePhone:    +1-541-673-4242\\nMailbox:        noc@dfn.net\\nSource:         ARIN\\n"}, {"range": "65.125.203.208/29", "id": "Q0528-65-125-203-208", "name": "CUTTING EDGE FABRICATION LLC", "country": "US", "domain": "cuttingedgefabrication.com", "org_id": "CEFL", "status": "REASSIGNMENT", "tech_id": "TCH100-ARIN", "mnt_id": "TCH100-ARIN", "admin_id": "TCH100-ARIN", "abuse_id": "TCH100-ARIN", "created": "2008-05-28", "updated": "2008-05-28", "source": "arin", "raw": "NetHandle:      NET-65-125-203-208-1\\nOrgID:          CEFL\\nParent:         NET-65-112-0-0-1\\nNetName:        Q0528-65-125-203-208\\nNetRange:       65.125.203.208 - 65.125.203.215\\nNetType:        reassignment\\nOriginAS:       209\\nRegDate:        2008-05-28\\nUpdated:        2008-05-28\\nAbuseHandle:    TCH100-ARIN\\nNOCHandle:      TCH100-ARIN\\nSource:         ARIN\\n\n\nOrgID:          CEFL\\nOrgName:        CUTTING EDGE FABRICATION LLC\\nCanAllocate:    \\nStreet:         8317 S CAMINO DE CAFE\\nCity:           TUCSON\\nState/Prov:     AZ\\nCountry:        US\\nPostalCode:     85747\\nRegDate:        2008-05-28\\nUpdated:        2011-09-24\\nOrgAbuseHandle: TCH100-ARIN\\nOrgAdminHandle: TCH100-ARIN\\nOrgTechHandle:  TCH100-ARIN\\nSource:         ARIN\\n\n\nPOCHandle:      TCH100-ARIN\\nIsRole:         N\\nLastName:       CHAMBERS-\\nFirstName:      TONIA\\nStreet:         840 N 52ND AVE\\nCity:           PHOENIX\\nState/Prov:     AZ\\nCountry:        US\\nPostalCode:     85043\\nRegDate:        2008-05-16\\nUpdated:        2008-05-16\\nOfficePhone:    +1-866-610-0310\\nMailbox:        tonia.chambers@qwest.com\\nSource:         ARIN\\n"}, {"range": "72.28.192.0/20", "id": "JST-PA-72-28-192-0", "name": "Breezeline", "country": "US", "domain": "breezeline.com", "org_id": "ATLAN-19", "status": "REALLOCATION", "tech_id": "IPADD2-ARIN", "mnt_id": "NOC1646-ARIN", "admin_id": "MCMAS1-ARIN", "abuse_id": "ABUSE619-ARIN", "created": "2007-02-15", "updated": "2022-03-04", "source": "arin", "raw": "NetHandle:      NET-72-28-192-0-1\\nOrgID:          ATLAN-19\\nParent:         NET-72-28-128-0-1\\nNetName:        JST-PA-72-28-192-0\\nNetRange:       72.28.192.0 - 72.28.207.255\\nNetType:        reallocation\\nComment:        Please send all Abuse complaints to abuse@breezeline.com\\nRegDate:        2007-02-15\\nUpdated:        2022-03-04\\nTechHandle:     IPADD2-ARIN\\nSource:         ARIN\\n\n\nOrgID:          ATLAN-19\\nOrgName:        Breezeline\\nCanAllocate:    \\nStreet:         Batterymarch Park\\nStreet:         Suite 200\\nCity:           Quincy\\nState/Prov:     MA\\nCountry:        US\\nPostalCode:     02169\\nComment:        Please send all Abuse complaints to\\nComment:        abuse@breezeline.com\\nRegDate:        2004-04-15\\nUpdated:        2022-06-09\\nOrgAbuseHandle: ABUSE619-ARIN\\nOrgAdminHandle: MCMAS1-ARIN\\nOrgNOCHandle:   NOC1646-ARIN\\nOrgTechHandle:  IPADD2-ARIN\\nOrgTechHandle:  RODEN41-ARIN\\nSource:         ARIN\\n\n\nPOCHandle:      NOC1646-ARIN\\nIsRole:         Y\\nLastName:       Network Operations Center\\nFirstName:      \\nStreet:         120 Southmont Blvd\\nCity:           Johnstown\\nState/Prov:     PA\\nCountry:        US\\nPostalCode:     15905\\nRegDate:        2004-08-19\\nUpdated:        2020-12-23\\nOfficePhone:    +1-800-317-2621\\nMailbox:        pa_noc@atlanticbb.com\\nSource:         ARIN\\n\n\nPOCHandle:      MCMAS1-ARIN\\nIsRole:         N\\nLastName:       McMasters\\nFirstName:      Jeremy\\nStreet:         120 Southmont Blvd\\nCity:           Johnstown\\nState/Prov:     PA\\nCountry:        US\\nPostalCode:     15905\\nRegDate:        2012-01-17\\nUpdated:        2020-12-23\\nOfficePhone:    +1-814-535-3506\\nFaxPhone:       +1-814-535-7749\\nMailbox:        jmcmasters@atlanticbb.com\\nSource:         ARIN\\n\n\nPOCHandle:      ABUSE619-ARIN\\nIsRole:         Y\\nLastName:       Abuse\\nFirstName:      \\nStreet:         120 Southmont Blvd\\nCity:           Johnstown\\nState/Prov:     PA\\nCountry:        US\\nPostalCode:     15905\\nRegDate:        2004-04-27\\nUpdated:        2020-12-23\\nOfficePhone:    +1-814-539-8971\\nMailbox:        Abuse@atlanticbb.com\\nSource:         ARIN\\n\n\nPOCHandle:      RODEN41-ARIN\\nIsRole:         N\\nLastName:       Rodenhois\\nFirstName:      John \\nStreet:         21 Jarvis Ave\\nCity:           Rochester\\nState/Prov:     NH\\nCountry:        US\\nPostalCode:     03868\\nRegDate:        2018-01-24\\nUpdated:        2022-03-04\\nOfficePhone:    +1-603-330-7702\\nMailbox:        JRodenhuis@breezeline.com\\nSource:         ARIN\\n\n\nPOCHandle:      IPADD2-ARIN\\nIsRole:         Y\\nLastName:       IPAddressing\\nFirstName:      \\nStreet:         120 Southmont Blvd\\nCity:           Johnstown\\nState/Prov:     PA\\nCountry:        US\\nPostalCode:     15905\\nRegDate:        2004-04-27\\nUpdated:        2022-03-04\\nOfficePhone:    +1-603-330-7702\\nMailbox:        IPAddressing@breezeline.com\\nSource:         ARIN\\n"}, {"range": "63.150.97.176/29", "id": "Q1115-63-150-97-176", "name": "AIRESPRING, INC.", "country": "US", "domain": "airespring.com", "org_id": "AIRES-25", "status": "REALLOCATION", "tech_id": "NOC33032-ARIN\\NOPSNE22-ARIN", "mnt_id": "ABUSE5351-ARIN", "admin_id": "OPSNE22-ARIN", "abuse_id": "ABUSE5351-ARIN", "created": "2012-11-15", "updated": "2012-11-15", "source": "arin", "raw": "NetHandle:      NET-63-150-97-176-1\\nOrgID:          AIRES-25\\nParent:         NET-63-144-0-0-1\\nNetName:        Q1115-63-150-97-176\\nNetRange:       63.150.97.176 - 63.150.97.183\\nNetType:        reallocation\\nOriginAS:       209\\nRegDate:        2012-11-15\\nUpdated:        2012-11-15\\nSource:         ARIN\\n\n\nOrgID:          AIRES-25\\nOrgName:        AIRESPRING, INC.\\nCanAllocate:    \\nStreet:         7800 Woodley Ave\\nCity:           VAN NUYS\\nState/Prov:     CA\\nCountry:        US\\nPostalCode:     91406\\nRegDate:        2004-10-20\\nUpdated:        2020-01-07\\nOrgAbuseHandle: ABUSE5351-ARIN\\nOrgAdminHandle: OPSNE22-ARIN\\nOrgNOCHandle:   ABUSE5351-ARIN\\nOrgTechHandle:  NOC33032-ARIN\\nOrgTechHandle:  OPSNE22-ARIN\\nSource:         ARIN\\n\n\nPOCHandle:      ABUSE5351-ARIN\\nIsRole:         Y\\nLastName:       Abuse Dept\\nFirstName:      \\nStreet:         7800 Woodley Ave\\nCity:           Van Nuys\\nState/Prov:     CA\\nCountry:        US\\nPostalCode:     91406\\nRegDate:        2016-02-08\\nUpdated:        2022-05-17\\nOfficePhone:    +1-888-288-5010\\nMailbox:        abuse@airespring.com\\nSource:         ARIN\\n\n\nPOCHandle:      NOC33032-ARIN\\nIsRole:         Y\\nLastName:       Network Operation Center\\nFirstName:      \\nStreet:         7800 Woodley Ave\\nCity:           Van Nuys\\nState/Prov:     CA\\nCountry:        US\\nPostalCode:     91406\\nRegDate:        2019-10-16\\nUpdated:        2021-10-15\\nOfficePhone:    +1-818-738-1784\\nMailbox:        PJ.Yegani@AireSpring.com\\nSource:         ARIN\\n\n\nPOCHandle:      OPSNE22-ARIN\\nIsRole:         N\\nLastName:       Ops\\nFirstName:      Net\\nStreet:         7800 Woodley Ave\\nCity:           Van Nuys\\nState/Prov:     CA\\nCountry:        US\\nPostalCode:     91406\\nRegDate:        2019-02-12\\nUpdated:        2022-03-01\\nOfficePhone:    +1-818-922-1181\\nMailbox:        netops@airespring.com\\nSource:         ARIN\\n"}, {"range": "205.164.59.0/24", "id": "NET-205-164-59-0", "name": "Server Destroyers LLC", "country": "US", "domain": "serverdestroyers.com", "org_id": "SDL-157", "status": "REALLOCATION", "tech_id": "JTC25-ARIN", "mnt_id": "JTC25-ARIN", "admin_id": "JTC25-ARIN", "abuse_id": "JTC25-ARIN", "created": "2020-09-04", "updated": "2020-11-18", "source": "arin", "raw": "NetHandle:      NET-205-164-59-0-1\\nOrgID:          SDL-157\\nParent:         NET-205-164-0-0-1\\nNetName:        NET-205-164-59-0\\nNetRange:       205.164.59.0 - 205.164.59.255\\nNetType:        reallocation\\nOriginAS:       1239\\nRegDate:        2020-09-04\\nUpdated:        2020-11-18\\nSource:         ARIN\\n\n\nOrgID:          SDL-157\\nOrgName:        Server Destroyers LLC\\nCanAllocate:    \\nStreet:         30 N Gould St Ste R\\nCity:           Sheridan\\nState/Prov:     WY\\nCountry:        US\\nPostalCode:     82801\\nComment:        https://serverdestroyers.com/\\nRegDate:        2020-05-05\\nUpdated:        2020-09-30\\nOrgAbuseHandle: JTC25-ARIN\\nOrgAdminHandle: JTC25-ARIN\\nOrgDNSHandle:   JTC25-ARIN\\nOrgNOCHandle:   JTC25-ARIN\\nOrgRoutingHandle:   JTC25-ARIN\\nOrgTechHandle:  JTC25-ARIN\\nSource:         ARIN\\n\n\nPOCHandle:      JTC25-ARIN\\nIsRole:         N\\nLastName:       Cho\\nFirstName:      Jonathan\\nStreet:         24 aster ct\\nCity:           brooklyn\\nState/Prov:     NY\\nCountry:        US\\nPostalCode:     11229\\nRegDate:        2020-05-03\\nUpdated:        2022-05-03\\nOfficePhone:    +1-347-575-9113\\nMailbox:        serverdestroyers@gmail.com\\nSource:         ARIN\\n"}, {"range": "65.115.195.152/29", "id": "Q1115-65-115-195-152", "name": "AIRESPRING, INC.", "country": "US", "domain": "airespring.com", "org_id": "AIRES-25", "status": "REALLOCATION", "tech_id": "NOC33032-ARIN\\NOPSNE22-ARIN", "mnt_id": "ABUSE5351-ARIN", "admin_id": "OPSNE22-ARIN", "abuse_id": "ABUSE5351-ARIN", "created": "2012-11-15", "updated": "2012-11-15", "source": "arin", "raw": "NetHandle:      NET-65-115-195-152-1\\nOrgID:          AIRES-25\\nParent:         NET-65-112-0-0-1\\nNetName:        Q1115-65-115-195-152\\nNetRange:       65.115.195.152 - 65.115.195.159\\nNetType:        reallocation\\nOriginAS:       209\\nRegDate:        2012-11-15\\nUpdated:        2012-11-15\\nSource:         ARIN\\n\n\nOrgID:          AIRES-25\\nOrgName:        AIRESPRING, INC.\\nCanAllocate:    \\nStreet:         7800 Woodley Ave\\nCity:           VAN NUYS\\nState/Prov:     CA\\nCountry:        US\\nPostalCode:     91406\\nRegDate:        2004-10-20\\nUpdated:        2020-01-07\\nOrgAbuseHandle: ABUSE5351-ARIN\\nOrgAdminHandle: OPSNE22-ARIN\\nOrgNOCHandle:   ABUSE5351-ARIN\\nOrgTechHandle:  NOC33032-ARIN\\nOrgTechHandle:  OPSNE22-ARIN\\nSource:         ARIN\\n\n\nPOCHandle:      NOC33032-ARIN\\nIsRole:         Y\\nLastName:       Network Operation Center\\nFirstName:      \\nStreet:         7800 Woodley Ave\\nCity:           Van Nuys\\nState/Prov:     CA\\nCountry:        US\\nPostalCode:     91406\\nRegDate:        2019-10-16\\nUpdated:        2021-10-15\\nOfficePhone:    +1-818-738-1784\\nMailbox:        PJ.Yegani@AireSpring.com\\nSource:         ARIN\\n\n\nPOCHandle:      OPSNE22-ARIN\\nIsRole:         N\\nLastName:       Ops\\nFirstName:      Net\\nStreet:         7800 Woodley Ave\\nCity:           Van Nuys\\nState/Prov:     CA\\nCountry:        US\\nPostalCode:     91406\\nRegDate:        2019-02-12\\nUpdated:        2022-03-01\\nOfficePhone:    +1-818-922-1181\\nMailbox:        netops@airespring.com\\nSource:         ARIN\\n\n\nPOCHandle:      ABUSE5351-ARIN\\nIsRole:         Y\\nLastName:       Abuse Dept\\nFirstName:      \\nStreet:         7800 Woodley Ave\\nCity:           Van Nuys\\nState/Prov:     CA\\nCountry:        US\\nPostalCode:     91406\\nRegDate:        2016-02-08\\nUpdated:        2022-05-17\\nOfficePhone:    +1-888-288-5010\\nMailbox:        abuse@airespring.com\\nSource:         ARIN\\n"}, {"range": "24.101.86.0/24", "id": "ACS-BUTLERPA", "name": "Armstrong", "country": "US", "domain": "armstrongonewire.com", "org_id": "ARMC", "status": "REASSIGNMENT", "tech_id": "NOC11973-ARIN", "mnt_id": "NOC11973-ARIN", "admin_id": "NOC11973-ARIN", "abuse_id": "NOC11974-ARIN", "created": "2014-05-06", "updated": "2014-05-06", "source": "arin", "raw": "NetHandle:      NET-24-101-86-0-1\\nOrgID:          ARMC\\nParent:         NET-24-101-0-0-1\\nNetName:        ACS-BUTLERPA\\nNetRange:       24.101.86.0 - 24.101.86.255\\nNetType:        reassignment\\nOriginAS:       27364\\nComment:        NONE\\nRegDate:        2014-05-06\\nUpdated:        2014-05-06\\nSource:         ARIN\\n\n\nOrgID:          ARMC\\nOrgName:        Armstrong\\nCanAllocate:    \\nStreet:         ONE Armstrong Place\\nCity:           Butler\\nState/Prov:     PA\\nCountry:        US\\nPostalCode:     16001\\nRegDate:        1997-08-28\\nUpdated:        2022-04-18\\nOrgAbuseHandle: NOC11974-ARIN\\nOrgAdminHandle: NOC11973-ARIN\\nOrgNOCHandle:   NOC11973-ARIN\\nOrgTechHandle:  NOC11973-ARIN\\nSource:         ARIN\\n\n\nPOCHandle:      NOC11973-ARIN\\nIsRole:         Y\\nLastName:       Network Operations Center\\nFirstName:      \\nStreet:         One Armstrong Place\\nCity:           Butler\\nState/Prov:     PA\\nCountry:        US\\nPostalCode:     16001\\nRegDate:        2011-04-28\\nUpdated:        2022-04-20\\nOfficePhone:    +1-877-277-5709\\nFaxPhone:       +1-724-282-5624\\nMailbox:        noc@zoominternet.net\\nSource:         ARIN\\n\n\nPOCHandle:      NOC11974-ARIN\\nIsRole:         Y\\nLastName:       Network Operations Center\\nFirstName:      \\nStreet:         One Armstrong Place\\nCity:           Butler\\nState/Prov:     PA\\nCountry:        US\\nPostalCode:     16001\\nRegDate:        2011-04-28\\nUpdated:        2022-04-20\\nFaxPhone:       +1-724-282-5624\\nOfficePhone:    +1-877-277-5709\\nMailbox:        abuse@zoominternet.net\\nSource:         ARIN\\n"}, {"range": "2620:88:e000::/48", "id": "SYNC-IPV6-0", "name": "Sync.com Inc.", "country": "CA", "domain": "sync.com", "org_id": "SYNCC", "status": "ALLOCATION", "tech_id": "TECH723-ARIN", "mnt_id": "NOC13070-ARIN", "admin_id": "ADMIN3964-ARIN", "abuse_id": "ABUSE3697-ARIN", "created": "2020-06-19", "updated": "2021-12-14", "source": "arin", "raw": "V6NetHandle:    NET6-2620-88-E000-1\\nOrgID:          SYNCC\\nParent:         NET6-2620-1\\nNetName:        SYNC-IPV6-0\\nNetRange:       2620:88:E000:: - 2620:88:E000:FFFF:FFFF:FFFF:FFFF:FFFF\\nNetType:        allocation\\nOriginAS:       14254\\nComment:        http://sync.com\\nRegDate:        2020-06-19\\nUpdated:        2021-12-14\\nSource:         ARIN\\n\n\nOrgID:          SYNCC\\nOrgName:        Sync.com Inc.\\nCanAllocate:    \\nStreet:         105 - 151 Gordon Baker Road\\nCity:           Toronto\\nState/Prov:     ON\\nCountry:        CA\\nPostalCode:     M2N 3N5\\nComment:        http://www.sync.com\\nRegDate:        2014-02-14\\nUpdated:        2022-08-05\\nReferralServer: rwhois://whois.moniker.com:43\\nOrgAbuseHandle: ABUSE3697-ARIN\\nOrgAdminHandle: ADMIN3964-ARIN\\nOrgNOCHandle:   NOC13070-ARIN\\nOrgTechHandle:  TECH723-ARIN\\nSource:         ARIN\\n\n\nPOCHandle:      NOC13070-ARIN\\nIsRole:         Y\\nLastName:       noc\\nFirstName:      \\nStreet:         105-155 Gordon Baker Rd\\nCity:           Toronto\\nState/Prov:     ON\\nCountry:        CA\\nPostalCode:     M2H 3N5\\nRegDate:        2013-03-14\\nUpdated:        2022-03-03\\nOfficePhone:    +1-416-716-3627\\nMailbox:        hostmaster@sync.com\\nSource:         ARIN\\n\n\nPOCHandle:      ABUSE3697-ARIN\\nIsRole:         Y\\nLastName:       Abuse\\nFirstName:      \\nStreet:         105-155 Gordon Baker Rd\\nCity:           Toronto\\nState/Prov:     ON\\nCountry:        CA\\nPostalCode:     M2H 3N5\\nRegDate:        2013-03-15\\nUpdated:        2022-03-03\\nOfficePhone:    +1-416-716-3627\\nMailbox:        abuse@sync.com\\nSource:         ARIN\\n\n\nPOCHandle:      ADMIN3964-ARIN\\nIsRole:         Y\\nLastName:       Admin\\nFirstName:      \\nStreet:         105-155 Gordon Baker Rd\\nCity:           Toronto\\nState/Prov:     ON\\nCountry:        CA\\nPostalCode:     M2H 3N5\\nRegDate:        2013-03-15\\nUpdated:        2022-03-03\\nOfficePhone:    +1-416-716-3627\\nMailbox:        hostmaster@sync.com\\nSource:         ARIN\\n\n\nPOCHandle:      TECH723-ARIN\\nIsRole:         Y\\nLastName:       Tech\\nFirstName:      \\nStreet:         105-155 Gordon Baker Rd\\nCity:           Toronto\\nState/Prov:     ON\\nCountry:        CA\\nPostalCode:     M2H 3N5\\nRegDate:        2013-03-15\\nUpdated:        2022-03-03\\nOfficePhone:    +1-416-716-3627\\nMailbox:        hostmaster@sync.com\\nSource:         ARIN\\n"}, {"range": "192.5.110.0/24", "id": "CWRUNET-C1", "name": "Case Western Reserve University", "country": "US", "domain": "case.edu", "org_id": "CWRU-Z", "status": "ALLOCATION", "tech_id": "JAG3-ARIN", "mnt_id": "NOC32756-ARIN", "admin_id": "JAG3-ARIN", "abuse_id": "ABUSE6716-ARIN", "created": "1988-07-07", "updated": "2021-12-14", "source": "arin", "raw": "NetHandle:      NET-192-5-110-0-1\\nOrgID:          CWRU-Z\\nParent:         NET-192-0-0-0-0\\nNetName:        CWRUNET-C1\\nNetRange:       192.5.110.0 - 192.5.110.255\\nNetType:        allocation\\nRegDate:        1988-07-07\\nUpdated:        2021-12-14\\nTechHandle:     JAG3-ARIN\\nSource:         ARIN\\n\n\nOrgID:          CWRU-Z\\nOrgName:        Case Western Reserve University\\nCanAllocate:    \\nStreet:         10900 Euclid Avenue\\nCity:           Cleveland\\nState/Prov:     OH\\nCountry:        US\\nPostalCode:     44106\\nComment:        http://www.case.edu\\nRegDate:        2009-03-26\\nUpdated:        2017-12-08\\nOrgAbuseHandle: ABUSE6716-ARIN\\nOrgAdminHandle: JAG3-ARIN\\nOrgNOCHandle:   NOC32756-ARIN\\nOrgTechHandle:  DNA49-ARIN\\nSource:         ARIN\\n\n\nPOCHandle:      ABUSE6716-ARIN\\nIsRole:         Y\\nLastName:       Abuse\\nFirstName:      \\nStreet:         10900 Euclid Avenue - Crawford Hall 4th Floor\\nCity:           Cleveland\\nState/Prov:     OH\\nCountry:        US\\nPostalCode:     44106-7072\\nRegDate:        2017-12-08\\nUpdated:        2022-01-14\\nOfficePhone:    +1-216-368-4357\\nMailbox:        abuse@case.edu\\nSource:         ARIN\\n\n\nPOCHandle:      JAG3-ARIN\\nIsRole:         N\\nLastName:       Gumpf\\nFirstName:      Jeffrey\\nStreet:         Case Western Reserve University\\nStreet:         Crawford Hall, Room 575\\nStreet:         Attn: Jeffrey Gumpf\\nCity:           Cleveland\\nState/Prov:     OH\\nCountry:        US\\nPostalCode:     44106\\nRegDate:        1970-01-01\\nUpdated:        2021-10-20\\nOfficePhone:    +1-216-368-5893\\nMailbox:        jeffrey.gumpf@case.edu\\nSource:         ARIN\\n\n\nPOCHandle:      DNA49-ARIN\\nIsRole:         N\\nLastName:       Andrews\\nFirstName:      Debra\\nStreet:         10900 Euclid Avenue\\nStreet:         Crawford Hall Rm. 416\\nCity:           Cleveland\\nState/Prov:     OH\\nCountry:        US\\nPostalCode:     44106-7072\\nRegDate:        2008-07-24\\nUpdated:        2021-12-17\\nOfficePhone:    +1-216-368-1253\\nFaxPhone:       +1-216-368-3165\\nMailbox:        dnd@case.edu\\nSource:         ARIN\\n\n\nPOCHandle:      NOC32756-ARIN\\nIsRole:         Y\\nLastName:       NOC\\nFirstName:      \\nStreet:         10900 Euclid Avenue - Crawford Hall 4th Floor\\nCity:           Cleveland\\nState/Prov:     OH\\nCountry:        US\\nPostalCode:     44106-7072\\nRegDate:        2017-12-08\\nUpdated:        2021-09-16\\nOfficePhone:    +1-216-368-4357\\nMailbox:        nesg@case.edu\\nSource:         ARIN\\n"}, {"range": "24.215.6.0/24", "id": "MNTN-BIZ6", "name": "Mountain Cablevision LTD.", "country": "CA", "domain": "mountaincable.net", "org_id": "MNTN", "status": "REASSIGNMENT", "tech_id": "SA6-ORG-ARIN", "mnt_id": "SA281-ARIN", "admin_id": "SA6-ORG-ARIN", "abuse_id": "ABUSE25-ARIN", "created": "2006-11-29", "updated": "2006-11-29", "source": "arin", "raw": "NetHandle:      NET-24-215-6-0-1\\nOrgID:          MNTN\\nParent:         NET-24-215-0-0-1\\nNetName:        MNTN-BIZ6\\nNetRange:       24.215.6.0 - 24.215.6.255\\nNetType:        reassignment\\nRegDate:        2006-11-29\\nUpdated:        2006-11-29\\nTechHandle:     SA6-ORG-ARIN\\nSource:         ARIN\\n\n\nOrgID:          MNTN\\nOrgName:        Mountain Cablevision LTD.\\nCanAllocate:    \\nStreet:         141 Hester Street\\nCity:           Hamilton\\nState/Prov:     ON\\nCountry:        CA\\nPostalCode:     L9A-2N9\\nRegDate:        1999-04-15\\nUpdated:        2017-04-19\\nOrgAbuseHandle: ABUSE25-ARIN\\nOrgAdminHandle: SA6-ORG-ARIN\\nOrgNOCHandle:   SA281-ARIN\\nOrgTechHandle:  SA6-ORG-ARIN\\nSource:         ARIN\\n\n\nPOCHandle:      SA281-ARIN\\nIsRole:         Y\\nLastName:       System Admin\\nFirstName:      \\nStreet:         141 Hester Street\\nCity:           Hamilton\\nState/Prov:     ON\\nCountry:        CA\\nPostalCode:     L9B 2N9\\nRegDate:        1999-12-03\\nUpdated:        2016-09-10\\nOfficePhone:    +1-905-389-1347\\nMailbox:        networking@mountaincable.on.ca\\nSource:         ARIN\\n\n\nPOCHandle:      SA6-ORG-ARIN\\nIsRole:         Y\\nLastName:       Mountain Cablevision\\nFirstName:      \\nStreet:         141 Hester Street\\nCity:           Hamilton\\nState/Prov:     ON\\nCountry:        CA\\nPostalCode:     L9A-2N9\\nRegDate:        1999-06-23\\nUpdated:        2016-09-10\\nOfficePhone:    +1-905-389-1393\\nMailbox:        networking@mountaincable.on.ca\\nSource:         ARIN\\n\n\nPOCHandle:      ABUSE25-ARIN\\nIsRole:         Y\\nLastName:       Abuse\\nFirstName:      \\nStreet:         141 Hester Street\\nCity:           Hamilton\\nState/Prov:     ON\\nCountry:        CA\\nPostalCode:     L9B-2N9\\nRegDate:        2002-09-03\\nUpdated:        2020-06-16\\nOfficePhone:    +1-905-389-1393\\nMailbox:        abuse@mountaincable.on.ca\\nSource:         ARIN\\n"}, {"range": "23.177.48.0/24", "id": "CLS-765-IP4-01", "name": "Citizen Support LLC", "country": "US", "domain": "citizens.support", "org_id": "CSL-765", "status": "ALLOCATION", "tech_id": "ROWLE47-ARIN", "mnt_id": "ROWLE47-ARIN", "admin_id": "ROWLE47-ARIN", "abuse_id": "ROWLE47-ARIN", "created": "2021-04-08", "updated": "2021-04-10", "source": "arin", "raw": "NetHandle:      NET-23-177-48-0-1\\nOrgID:          CSL-765\\nParent:         NET-23-0-0-0-0\\nNetName:        CLS-765-IP4-01\\nNetRange:       23.177.48.0 - 23.177.48.255\\nNetType:        allocation\\nOriginAS:       399466, 33182\\nComment:        https://www.citizens.support\\nComment:        Standard NOC hours are 7:00 AM to 10:00 PM EST\\nRegDate:        2021-04-08\\nUpdated:        2021-04-10\\nSource:         ARIN\\n\n\nOrgID:          CSL-765\\nOrgName:        Citizen Support LLC\\nCanAllocate:    \\nStreet:         P.O. Box 10152\\nCity:           Bradenton\\nState/Prov:     FL\\nCountry:        US\\nPostalCode:     34282\\nComment:        https://www.citizens.support\\nComment:        Standard NOC hours are 7:00 AM to 11:00 PM EST\\nRegDate:        2021-03-15\\nUpdated:        2021-03-30\\nOrgAbuseHandle: ROWLE47-ARIN\\nOrgAdminHandle: ROWLE47-ARIN\\nOrgDNSHandle:   ROWLE47-ARIN\\nOrgNOCHandle:   ROWLE47-ARIN\\nOrgRoutingHandle:   ROWLE47-ARIN\\nOrgTechHandle:  ROWLE47-ARIN\\nSource:         ARIN\\n\n\nPOCHandle:      ROWLE47-ARIN\\nIsRole:         N\\nLastName:       Rowley\\nFirstName:      Alan\\nStreet:         P.O. Box 10152\\nCity:           Bradenton\\nState/Prov:     FL\\nCountry:        US\\nPostalCode:     34282\\nRegDate:        2021-03-02\\nUpdated:        2022-03-09\\nOfficePhone:    +1-941-800-5225\\nMailbox:        ARIN@citizen.bz\\nSource:         ARIN\\n"}, {"range": "192.195.74.0/24", "id": "ISATNET", "name": "University of California at Berkeley, Electronics Research Lab", "country": "US", "domain": "berkeley.edu", "org_id": "UCABERL", "status": "ALLOCATION", "tech_id": "UCB-NOC-ARIN", "mnt_id": "UCB-NOC-ARIN", "admin_id": "UCB-NOC-ARIN", "abuse_id": "UCBSE-ARIN", "created": "1992-07-17", "updated": "2021-12-14", "source": "arin", "raw": "NetHandle:      NET-192-195-74-0-1\\nOrgID:          UCABERL\\nParent:         NET-192-0-0-0-0\\nNetName:        ISATNET\\nNetRange:       192.195.74.0 - 192.195.74.255\\nNetType:        allocation\\nComment:        DMCA Designated Agent is policy@berkeley.edu\\nRegDate:        1992-07-17\\nUpdated:        2021-12-14\\nNOCHandle:      UCB-NOC-ARIN\\nTechHandle:     UCB-NOC-ARIN\\nSource:         ARIN\\n\n\nOrgID:          UCABERL\\nOrgName:        University of California at Berkeley, Electronics Research Lab\\nCanAllocate:    \\nStreet:         558 Cory Hall\\nCity:           Berkeley\\nState/Prov:     CA\\nCountry:        US\\nPostalCode:     94720\\nRegDate:        1992-07-17\\nUpdated:        2016-05-04\\nOrgAbuseHandle: UCBSE-ARIN\\nOrgAdminHandle: UCB-NOC-ARIN\\nOrgNOCHandle:   UCB-NOC-ARIN\\nOrgTechHandle:  UCB-NOC-ARIN\\nSource:         ARIN\\n\n\nPOCHandle:      UCBSE-ARIN\\nIsRole:         Y\\nLastName:       UCB-SECURIT-ARIN\\nFirstName:      \\nStreet:         2850 Telegraph Ave\\nCity:           Berkeley\\nState/Prov:     CA\\nCountry:        US\\nPostalCode:     94705\\nRegDate:        2016-04-18\\nUpdated:        2021-09-07\\nOfficePhone:    +1-510-664-9000\\nMailbox:        abuse@security.berkeley.edu\\nSource:         ARIN\\n\n\nPOCHandle:      UCB-NOC-ARIN\\nIsRole:         Y\\nLastName:       IST Communication and Network Services\\nFirstName:      \\nStreet:         2850 Telegraph Ave\\nCity:           Berkeley\\nState/Prov:     CA\\nCountry:        US\\nPostalCode:     94720\\nRegDate:        1970-01-01\\nUpdated:        2022-05-24\\nOfficePhone:    +1-510-664-9000\\nMailbox:        noc@berkeley.edu\\nSource:         ARIN\\n"}, {"range": "2604:6800::/32", "id": "INFOB-IPV6-2010", "name": "Infobunker, L.L.C.", "country": "US", "domain": "infobunker.com", "org_id": "INFOB", "status": "ALLOCATION", "tech_id": "SOC22-ARIN", "mnt_id": "IAA16-ARIN", "admin_id": "IAA15-ARIN", "abuse_id": "IAA16-ARIN", "created": "2010-04-20", "updated": "2014-10-06", "source": "arin", "raw": "V6NetHandle:    NET6-2604-6800-1\\nOrgID:          INFOB\\nParent:         NET6-2600-1\\nNetName:        INFOB-IPV6-2010\\nNetRange:       2604:6800:: - 2604:6800:FFFF:FFFF:FFFF:FFFF:FFFF:FFFF\\nNetType:        allocation\\nOriginAS:       36436\\nRegDate:        2010-04-20\\nUpdated:        2014-10-06\\nAbuseHandle:    IAA16-ARIN\\nNOCHandle:      IAA16-ARIN\\nTechHandle:     SOC22-ARIN\\nSource:         ARIN\\n\n\nOrgID:          INFOB\\nOrgName:        Infobunker, L.L.C.\\nCanAllocate:    \\nStreet:         3101 Ingersoll Ave.\\nStreet:         Suite 300\\nCity:           Des Moines\\nState/Prov:     IA\\nCountry:        US\\nPostalCode:     50312\\nComment:        Please use the abuse@infobunker.com email address\\nComment:        for sending abuse complaints via SMTP email.\\nRegDate:        2005-11-15\\nUpdated:        2017-01-28\\nReferralServer: rwhois://rwhois.infobunker.com:4321\\nOrgAbuseHandle: IAA16-ARIN\\nOrgAdminHandle: IAA15-ARIN\\nOrgNOCHandle:   IAA16-ARIN\\nOrgTechHandle:  SOC22-ARIN\\nSource:         ARIN\\n\n\nPOCHandle:      IAA15-ARIN\\nIsRole:         Y\\nLastName:       Infobunker ARIN Admin\\nFirstName:      \\nStreet:         3101 Ingersoll Ave.\\nStreet:         Suite 300\\nCity:           Des Moines\\nState/Prov:     IA\\nCountry:        US\\nPostalCode:     50312\\nRegDate:        2005-10-26\\nUpdated:        2022-04-25\\nOfficePhone:    +1-800-679-3132\\nMailbox:        OrgAdmin@infobunker.com\\nSource:         ARIN\\n\n\nPOCHandle:      IAA16-ARIN\\nIsRole:         Y\\nLastName:       Infobunker ARIN Abuse\\nFirstName:      \\nStreet:         3101 Ingersoll Ave.\\nStreet:         Suite 300\\nCity:           Des Moines\\nState/Prov:     IA\\nCountry:        US\\nPostalCode:     50312\\nRegDate:        2005-10-27\\nUpdated:        2022-04-25\\nOfficePhone:    +1-800-679-3132\\nMailbox:        OrgAbuse@infobunker.com\\nMailbox:        Abuse@infobunker.com\\nSource:         ARIN\\n\n\nPOCHandle:      SOC22-ARIN\\nIsRole:         N\\nLastName:       Ocken\\nFirstName:      Scott\\nStreet:         3101 Ingersoll Ave.\\nStreet:         Suite 300\\nCity:           Des Moines\\nState/Prov:     IA\\nCountry:        US\\nPostalCode:     50312\\nRegDate:        2007-11-19\\nUpdated:        2022-04-25\\nOfficePhone:    +1-800-679-3132\\nMailbox:        scott@infobunker.com\\nSource:         ARIN\\n"}, {"range": "206.108.171.120/29", "id": "NET-ACCEL-CLIENTS171-120", "name": "Accelerated Connections Inc.", "country": "CA", "domain": "connections.ca", "org_id": "ACLT", "status": "REASSIGNMENT", "tech_id": "DBL7-ARIN", "mnt_id": "NOC2114-ARIN", "admin_id": "AS3251-ARIN", "abuse_id": "GAD46-ARIN", "created": "2006-03-24", "updated": "2006-03-24", "source": "arin", "raw": "NetHandle:      NET-206-108-171-120-1\\nOrgID:          ACLT\\nParent:         NET-206-108-128-0-1\\nNetName:        NET-ACCEL-CLIENTS171-120\\nNetRange:       206.108.171.120 - 206.108.171.127\\nNetType:        reassignment\\nRegDate:        2006-03-24\\nUpdated:        2006-03-24\\nTechHandle:     DBL7-ARIN\\nSource:         ARIN\\n\n\nOrgID:          ACLT\\nOrgName:        Accelerated Connections Inc.\\nCanAllocate:    \\nStreet:         3740 - 155 Wellington St. W.\\nCity:           Toronto\\nState/Prov:     ON\\nCountry:        CA\\nPostalCode:     M5V 3H1\\nComment:        http://www.connections.ca\\nRegDate:        2000-12-19\\nUpdated:        2019-07-03\\nOrgAbuseHandle: GAD46-ARIN\\nOrgAdminHandle: AS3251-ARIN\\nOrgNOCHandle:   NOC2114-ARIN\\nOrgTechHandle:  AS3251-ARIN\\nOrgTechHandle:  NOC2114-ARIN\\nSource:         ARIN\\n\n\nPOCHandle:      NOC2114-ARIN\\nIsRole:         Y\\nLastName:       Network Operations Center\\nFirstName:      \\nStreet:         155 Wellington St West, Suite 3740\\nCity:           Toronto\\nState/Prov:     ON\\nCountry:        CA\\nPostalCode:     M5V 3H1\\nRegDate:        2006-05-01\\nUpdated:        2019-07-03\\nOfficePhone:    +1-416-637-3433\\nMailbox:        net.eng@connections.ca\\nSource:         ARIN\\n\n\nPOCHandle:      DBL7-ARIN\\nIsRole:         N\\nLastName:       Blackwood\\nFirstName:      Dean\\nStreet:         3740 - 155 Wellington St W\\nCity:           Toronto\\nState/Prov:     ON\\nCountry:        CA\\nPostalCode:     M5V 3H1\\nRegDate:        2003-04-17\\nUpdated:        2019-07-03\\nOfficePhone:    +1-416-637-3433\\nMailbox:        support@dsl4u.ca\\nSource:         ARIN\\n\n\nPOCHandle:      GAD46-ARIN\\nIsRole:         Y\\nLastName:       GTT Abuse Department\\nFirstName:      \\nStreet:         7900 Tysons One Place\\nStreet:         Suite 1450\\nCity:           McLean\\nState/Prov:     VA\\nCountry:        US\\nPostalCode:     22102\\nRegDate:        2014-04-16\\nUpdated:        2022-01-19\\nFaxPhone:       +1-703-442-5501\\nOfficePhone:    +1-703-442-5500\\nMailbox:        abuse@gtt.net\\nSource:         ARIN\\n\n\nPOCHandle:      AS3251-ARIN\\nIsRole:         Y\\nLastName:       AS3257 Netguard\\nFirstName:      \\nStreet:         Hugenottenallee 167\\nCity:           Neu-Isenburg\\nState/Prov:     \\nCountry:        DE\\nPostalCode:     63263\\nRegDate:        2009-07-03\\nUpdated:        2022-06-07\\nOfficePhone:    +49 6102 8235 381\\nFaxPhone:       +49 6102 8235 389\\nMailbox:        netguard@gtt.net\\nSource:         ARIN\\n"}, {"range": "104.244.212.0/22", "id": "LUCERA-NETWORK", "name": "Lucera Financial Infrastructures, LLC", "country": "US", "domain": "lucera.com", "org_id": "LFIL-1", "status": "ALLOCATION", "tech_id": "SYSTE501-ARIN", "mnt_id": "SYSTE501-ARIN", "admin_id": "SYSTE501-ARIN", "abuse_id": "SYSTE501-ARIN", "created": "2014-12-11", "updated": "2021-12-14", "source": "arin", "raw": "NetHandle:      NET-104-244-212-0-1\\nOrgID:          LFIL-1\\nParent:         NET-104-0-0-0-0\\nNetName:        LUCERA-NETWORK\\nNetRange:       104.244.212.0 - 104.244.215.255\\nNetType:        allocation\\nOriginAS:       63287\\nRegDate:        2014-12-11\\nUpdated:        2021-12-14\\nSource:         ARIN\\n\n\nOrgID:          LFIL-1\\nOrgName:        Lucera Financial Infrastructures, LLC\\nCanAllocate:    \\nStreet:         805 3rd Avenue\\nStreet:         19th Floor\\nCity:           New York\\nState/Prov:     NY\\nCountry:        US\\nPostalCode:     10022\\nRegDate:        2014-08-13\\nUpdated:        2020-04-05\\nOrgAbuseHandle: SYSTE501-ARIN\\nOrgAdminHandle: SYSTE501-ARIN\\nOrgNOCHandle:   SYSTE501-ARIN\\nOrgTechHandle:  SYSTE501-ARIN\\nSource:         ARIN\\n\n\nPOCHandle:      SYSTE501-ARIN\\nIsRole:         Y\\nLastName:       System Administrator\\nFirstName:      \\nStreet:         805 3rd Avenue\\nStreet:         19th Floor\\nCity:           New York\\nState/Prov:     NY\\nCountry:        US\\nPostalCode:     10022\\nRegDate:        2014-08-11\\nUpdated:        2022-04-05\\nOfficePhone:    +1-855-893-2231\\nMailbox:        kmcnicholas@lucera.com\\nSource:         ARIN\\n"}, {"range": "162.223.60.0/22", "id": "NEUS1", "name": "MCN Online, LLC", "country": "US", "domain": "mcnonline.net", "org_id": "MOL-14", "status": "ALLOCATION", "tech_id": "FISHM1-ARIN", "mnt_id": "NAP6-ARIN", "admin_id": "FISHM1-ARIN", "abuse_id": "NAP6-ARIN", "created": "2013-10-21", "updated": "2013-10-21", "source": "arin", "raw": "NetHandle:      NET-162-223-60-0-1\\nOrgID:          MOL-14\\nParent:         NET-162-0-0-0-0\\nNetName:        NEUS1\\nNetRange:       162.223.60.0 - 162.223.63.255\\nNetType:        allocation\\nOriginAS:       33673\\nComment:        US\\nRegDate:        2013-10-21\\nUpdated:        2013-10-21\\nSource:         ARIN\\n\n\nOrgID:          MOL-14\\nOrgName:        MCN Online, LLC\\nCanAllocate:    \\nStreet:         492-C Cedar Lane\\nStreet:         Suite 191\\nCity:           Teaneck\\nState/Prov:     NJ\\nCountry:        US\\nPostalCode:     07666\\nComment:        www.mcnonline.net\\nRegDate:        2013-02-22\\nUpdated:        2017-01-28\\nOrgAbuseHandle: NAP6-ARIN\\nOrgAdminHandle: FISHM1-ARIN\\nOrgNOCHandle:   NAP6-ARIN\\nOrgTechHandle:  FISHM1-ARIN\\nSource:         ARIN\\n\n\nPOCHandle:      FISHM1-ARIN\\nIsRole:         N\\nLastName:       Fishman\\nFirstName:      Samuel\\nStreet:         492-C Cedar Lane\\nStreet:         Suite 191\\nCity:           Teaneck\\nState/Prov:     NJ\\nCountry:        US\\nPostalCode:     07666\\nRegDate:        2013-02-21\\nUpdated:        2018-12-13\\nOfficePhone:    +1-212-901-4299\\nFaxPhone:       +1-201-591-9805\\nMailbox:        network@mcnonline.net\\nSource:         ARIN\\n\n\nPOCHandle:      NAP6-ARIN\\nIsRole:         Y\\nLastName:       Network Abuse POC\\nFirstName:      \\nStreet:         492-C Cedar Lane\\nStreet:         Suite 191\\nCity:           Teaneck\\nState/Prov:     NJ\\nCountry:        US\\nPostalCode:     07666\\nRegDate:        2013-02-21\\nUpdated:        2015-02-21\\nFaxPhone:       +1-201-402-1099\\nOfficePhone:    +1-212-901-4299\\nMailbox:        abuse@mcnonline.net\\nSource:         ARIN\\n"}, {"range": "64.148.73.176/28", "id": "SBC-64-148-73-176-28-0802014034", "name": "Wayport, LLC", "country": "US", "domain": "wayport.net", "org_id": "WYPR", "status": "REASSIGNMENT", "tech_id": "WN25-ARIN", "mnt_id": "AWSN-ARIN", "admin_id": "WN25-ARIN", "abuse_id": "ABUSE670-ARIN", "created": "2008-02-01", "updated": "2008-02-01", "source": "arin", "raw": "NetHandle:      NET-64-148-73-176-1\\nOrgID:          WYPR\\nParent:         NET-64-148-0-0-1\\nNetName:        SBC-64-148-73-176-28-0802014034\\nNetRange:       64.148.73.176 - 64.148.73.191\\nNetType:        reassignment\\nRegDate:        2008-02-01\\nUpdated:        2008-02-01\\nSource:         ARIN\\n\n\nOrgID:          WYPR\\nOrgName:        Wayport, LLC\\nCanAllocate:    \\nStreet:         4509 Freidrich Lane\\nStreet:         Building III, Suite 300\\nCity:           Austin\\nState/Prov:     TX\\nCountry:        US\\nPostalCode:     78744\\nRegDate:        1997-07-29\\nUpdated:        2020-09-24\\nReferralServer: rwhois://rwhois.wayport.net:4321\\nOrgAbuseHandle: ABUSE670-ARIN\\nOrgAdminHandle: WN25-ARIN\\nOrgNOCHandle:   AWSN-ARIN\\nOrgTechHandle:  WN25-ARIN\\nSource:         ARIN\\n\n\nPOCHandle:      WN25-ARIN\\nIsRole:         Y\\nLastName:       ATT WiFi Services IT\\nFirstName:      \\nStreet:         4509 Freidrich Ln\\nStreet:         Building III, Suite 300\\nCity:           Austin\\nState/Prov:     TX\\nCountry:        US\\nPostalCode:     78744\\nRegDate:        2000-01-21\\nUpdated:        2021-12-09\\nFaxPhone:       +1-512-519-6450\\nOfficePhone:    +1-512-519-6000\\nMailbox:        arin-coordinator@wayport.net\\nSource:         ARIN\\n\n\nPOCHandle:      ABUSE670-ARIN\\nIsRole:         Y\\nLastName:       Abuse\\nFirstName:      \\nStreet:         4509 Freidrich Ln\\nStreet:         Building 3, Ste 300\\nCity:           Austin\\nState/Prov:     TX\\nCountry:        US\\nPostalCode:     78744\\nRegDate:        2004-07-13\\nUpdated:        2021-12-09\\nOfficePhone:    +1-512-519-6000\\nMailbox:        abuse@wayport.net\\nSource:         ARIN\\n\n\nPOCHandle:      AWSN-ARIN\\nIsRole:         Y\\nLastName:       ATT WiFi Services NOC\\nFirstName:      \\nStreet:         4509 Freidrich Lane\\nStreet:         Building III, Suite 300\\nCity:           Austin\\nState/Prov:     TX\\nCountry:        US\\nPostalCode:     78744\\nRegDate:        2012-05-31\\nUpdated:        2014-05-01\\nOfficePhone:    +1-512-519-6000\\nMailbox:        noc-internal@wayport.net\\nSource:         ARIN\\n"}, {"range": "199.19.148.0/22", "id": "JASPER-WIRELESS", "name": "Jasper Technologies, Inc.", "country": "US", "domain": "jasper.com", "org_id": "JASPE", "status": "ALLOCATION", "tech_id": "NOC2708-ARIN", "mnt_id": "NOC2708-ARIN", "admin_id": "ADMIN7957-ARIN", "abuse_id": "NOC33386-ARIN", "created": "2010-07-27", "updated": "2021-12-14", "source": "arin", "raw": "NetHandle:      NET-199-19-148-0-1\\nOrgID:          JASPE\\nParent:         NET-199-0-0-0-0\\nNetName:        JASPER-WIRELESS\\nNetRange:       199.19.148.0 - 199.19.151.255\\nNetType:        allocation\\nOriginAS:       36180\\nRegDate:        2010-07-27\\nUpdated:        2021-12-14\\nAbuseHandle:    NOC2708-ARIN\\nNOCHandle:      NOC2708-ARIN\\nTechHandle:     NOC2708-ARIN\\nSource:         ARIN\\n\n\nOrgID:          JASPE\\nOrgName:        Jasper Technologies, Inc.\\nCanAllocate:    \\nStreet:         3003 Bunker Hill Lane\\nCity:           Santa Clara\\nState/Prov:     CA\\nCountry:        US\\nPostalCode:     95054\\nRegDate:        2005-08-08\\nUpdated:        2021-12-08\\nOrgAbuseHandle: NOC33386-ARIN\\nOrgAdminHandle: ADMIN7957-ARIN\\nOrgTechHandle:  NOC33386-ARIN\\nSource:         ARIN\\n\n\nPOCHandle:      NOC2708-ARIN\\nIsRole:         Y\\nLastName:       NOC\\nFirstName:      \\nStreet:         189 North Bernardo Avenue\\nStreet:         Suite 150\\nCity:           Mountain View\\nState/Prov:     CA\\nCountry:        US\\nPostalCode:     95126\\nRegDate:        2007-08-24\\nUpdated:        2021-12-03\\nOfficePhone:    +1-408-328-5200\\nMailbox:        notify@jasperwireless.com\\nSource:         ARIN\\n\n\nPOCHandle:      NOC33386-ARIN\\nIsRole:         Y\\nLastName:       NOC\\nFirstName:      \\nStreet:         170 West Tasman Drive\\nCity:           San Jose\\nState/Prov:     CA\\nCountry:        US\\nPostalCode:     95134\\nRegDate:        2021-12-08\\nUpdated:        2021-12-08\\nOfficePhone:    +1-844-674-7288\\nMailbox:        iot-nes-arin-noc@cisco.com\\nSource:         ARIN\\n\n\nPOCHandle:      ADMIN7957-ARIN\\nIsRole:         Y\\nLastName:       ADMIN\\nFirstName:      \\nStreet:         170 West Tasman Drive\\nCity:           San Jose\\nState/Prov:     CA\\nCountry:        US\\nPostalCode:     95134\\nRegDate:        2021-11-19\\nUpdated:        2021-11-19\\nOfficePhone:    +1-844-674-7288\\nMailbox:        iot-nes-arin-admin@cisco.com\\nSource:         ARIN\\n"}, {"range": "24.239.211.0/24", "id": "ACS-MEDINAOH", "name": "Armstrong", "country": "US", "domain": "armstrongonewire.com", "org_id": "ARMC", "status": "REASSIGNMENT", "tech_id": "NOC11973-ARIN", "mnt_id": "NOC11973-ARIN", "admin_id": "NOC11973-ARIN", "abuse_id": "NOC11974-ARIN", "created": "2014-05-07", "updated": "2014-05-07", "source": "arin", "raw": "NetHandle:      NET-24-239-211-0-1\\nOrgID:          ARMC\\nParent:         NET-24-239-192-0-1\\nNetName:        ACS-MEDINAOH\\nNetRange:       24.239.211.0 - 24.239.211.255\\nNetType:        reassignment\\nOriginAS:       27364\\nComment:        NONE\\nRegDate:        2014-05-07\\nUpdated:        2014-05-07\\nSource:         ARIN\\n\n\nOrgID:          ARMC\\nOrgName:        Armstrong\\nCanAllocate:    \\nStreet:         ONE Armstrong Place\\nCity:           Butler\\nState/Prov:     PA\\nCountry:        US\\nPostalCode:     16001\\nRegDate:        1997-08-28\\nUpdated:        2022-04-18\\nOrgAbuseHandle: NOC11974-ARIN\\nOrgAdminHandle: NOC11973-ARIN\\nOrgNOCHandle:   NOC11973-ARIN\\nOrgTechHandle:  NOC11973-ARIN\\nSource:         ARIN\\n\n\nPOCHandle:      NOC11974-ARIN\\nIsRole:         Y\\nLastName:       Network Operations Center\\nFirstName:      \\nStreet:         One Armstrong Place\\nCity:           Butler\\nState/Prov:     PA\\nCountry:        US\\nPostalCode:     16001\\nRegDate:        2011-04-28\\nUpdated:        2022-04-20\\nFaxPhone:       +1-724-282-5624\\nOfficePhone:    +1-877-277-5709\\nMailbox:        abuse@zoominternet.net\\nSource:         ARIN\\n\n\nPOCHandle:      NOC11973-ARIN\\nIsRole:         Y\\nLastName:       Network Operations Center\\nFirstName:      \\nStreet:         One Armstrong Place\\nCity:           Butler\\nState/Prov:     PA\\nCountry:        US\\nPostalCode:     16001\\nRegDate:        2011-04-28\\nUpdated:        2022-04-20\\nOfficePhone:    +1-877-277-5709\\nFaxPhone:       +1-724-282-5624\\nMailbox:        noc@zoominternet.net\\nSource:         ARIN\\n"}, {"range": "67.134.69.32/27", "id": "Q0331-67-134-69-32", "name": "Bandwidth.com Inc.", "country": "US", "domain": "bandwidth.com", "org_id": "BNO", "status": "REALLOCATION", "tech_id": "BCNO1-ARIN", "mnt_id": "BNO13-ARIN", "admin_id": "BCNO1-ARIN", "abuse_id": "BCNO1-ARIN", "created": "2011-03-31", "updated": "2011-03-31", "source": "arin", "raw": "NetHandle:      NET-67-134-69-32-1\\nOrgID:          BNO\\nParent:         NET-67-128-0-0-1\\nNetName:        Q0331-67-134-69-32\\nNetRange:       67.134.69.32 - 67.134.69.63\\nNetType:        reallocation\\nOriginAS:       209\\nRegDate:        2011-03-31\\nUpdated:        2011-03-31\\nSource:         ARIN\\n\n\nOrgID:          BNO\\nOrgName:        Bandwidth.com Inc.\\nCanAllocate:    \\nStreet:         900 Main Campus Drive\\nCity:           Raleigh\\nState/Prov:     NC\\nCountry:        US\\nPostalCode:     27606\\nRegDate:        2003-11-17\\nUpdated:        2014-03-17\\nOrgAbuseHandle: BCNO1-ARIN\\nOrgAdminHandle: BCNO1-ARIN\\nOrgNOCHandle:   BNO13-ARIN\\nOrgTechHandle:  BCNO1-ARIN\\nSource:         ARIN\\n\n\nPOCHandle:      BNO13-ARIN\\nIsRole:         Y\\nLastName:       Bandwidth Network Operations\\nFirstName:      \\nStreet:         4001 Weston Parkway\\nStreet:         Suite 100\\nCity:           Cary\\nState/Prov:     NC\\nCountry:        US\\nPostalCode:     27513\\nRegDate:        2003-11-17\\nUpdated:        2014-11-07\\nOfficePhone:    +1-800-409-4357\\nMailbox:        networkservices@bandwidth.com\\nSource:         ARIN\\n\n\nPOCHandle:      BCNO1-ARIN\\nIsRole:         Y\\nLastName:       Customer Care Department\\nFirstName:      \\nStreet:         900 Main Campus Drive\\nCity:           Raleigh\\nState/Prov:     NC\\nCountry:        US\\nPostalCode:     27606\\nRegDate:        2003-11-17\\nUpdated:        2015-03-17\\nOfficePhone:    +1-800-808-5150\\nMailbox:        support@broadband.com\\nSource:         ARIN\\n"}, {"range": "209.242.64.16/29", "id": "GT004-ADAMSSTREET-003", "name": "Adams Street Partners", "country": "US", "domain": "adamsstreetpartners.com", "org_id": "ADAMS-19", "status": "REASSIGNMENT", "tech_id": "AI91-ARIN", "mnt_id": "AI91-ARIN", "admin_id": "AI91-ARIN", "abuse_id": "AI91-ARIN", "created": "2008-09-26", "updated": "2008-09-26", "source": "arin", "raw": "NetHandle:      NET-209-242-64-16-1\\nOrgID:          ADAMS-19\\nParent:         NET-209-242-64-0-1\\nNetName:        GT004-ADAMSSTREET-003\\nNetRange:       209.242.64.16 - 209.242.64.23\\nNetType:        reassignment\\nOriginAS:       19384\\nComment:        THIS NETWORK IS NON-PORTABLE\\nRegDate:        2008-09-26\\nUpdated:        2008-09-26\\nAbuseHandle:    AI91-ARIN\\nNOCHandle:      AI91-ARIN\\nTechHandle:     AI91-ARIN\\nSource:         ARIN\\n\n\nOrgID:          ADAMS-19\\nOrgName:        Adams Street Partners\\nCanAllocate:    \\nStreet:         1 North Wacker Drive\\nStreet:         Suite 2200\\nCity:           Chicago\\nState/Prov:     IL\\nCountry:        US\\nPostalCode:     60606\\nRegDate:        2008-09-26\\nUpdated:        2011-09-24\\nOrgAbuseHandle: AI91-ARIN\\nOrgAdminHandle: AI91-ARIN\\nOrgTechHandle:  AI91-ARIN\\nSource:         ARIN\\n\n\nPOCHandle:      AI91-ARIN\\nIsRole:         Y\\nLastName:       Admin IP\\nFirstName:      \\nStreet:         316 East Monroe Street\\nCity:           South Bend\\nState/Prov:     IN\\nCountry:        US\\nPostalCode:     46601\\nRegDate:        2001-05-24\\nUpdated:        2014-05-14\\nOfficePhone:    +1-574-472-4726\\nMailbox:        ipadmin001@cbts.cinbell.com\\nSource:         ARIN\\n"}, {"range": "204.29.147.0-204.29.148.255", "id": "CHICAGOPARKS", "name": "Chicago Park District", "country": "US", "domain": "chicagoparkdistrict.com", "org_id": "CPD-2", "status": "ALLOCATION", "tech_id": "RUIZA17-ARIN", "mnt_id": "RUIZA17-ARIN", "admin_id": "AWD5-ARIN", "abuse_id": "RS144-ARIN", "created": "1994-06-22", "updated": "2021-12-14", "source": "arin", "raw": "NetHandle:      NET-204-29-147-0-1\\nOrgID:          CPD-2\\nParent:         NET-204-0-0-0-0\\nNetName:        CHICAGOPARKS\\nNetRange:       204.29.147.0 - 204.29.148.255\\nNetType:        allocation\\nRegDate:        1994-06-22\\nUpdated:        2021-12-14\\nAbuseHandle:    RUIZA17-ARIN\\nNOCHandle:      RUIZA17-ARIN\\nTechHandle:     RUIZA17-ARIN\\nSource:         ARIN\\n\n\nOrgID:          CPD-2\\nOrgName:        Chicago Park District\\nCanAllocate:    \\nStreet:         541 N. Fairbanks Ct.\\nStreet:         3rd Floor - IT Department\\nCity:           Chicago\\nState/Prov:     IL\\nCountry:        US\\nPostalCode:     60611\\nRegDate:        1994-06-22\\nUpdated:        2016-01-04\\nOrgAbuseHandle: RS144-ARIN\\nOrgAdminHandle: AWD5-ARIN\\nOrgTechHandle:  AWD5-ARIN\\nSource:         ARIN\\n\n\nPOCHandle:      AWD5-ARIN\\nIsRole:         N\\nLastName:       Dobbins\\nFirstName:      Anthony\\nStreet:         541 N. Fairbanks Ct\\nStreet:         3rd Floor - IT Dept\\nCity:           Chicago\\nState/Prov:     IL\\nCountry:        US\\nPostalCode:     60611\\nRegDate:        2015-08-25\\nUpdated:        2017-08-25\\nOfficePhone:    +1-312-742-4601\\nMobilePhone:    +1-630-816-5854\\nMailbox:        anthony.dobbins@chicagoparkdistrict.com\\nSource:         ARIN\\n\n\nPOCHandle:      RS144-ARIN\\nIsRole:         N\\nLastName:       Sherman\\nFirstName:      Roger\\nStreet:         425 E. McFetridge Drive\\nCity:           Chicago\\nState/Prov:     IL\\nCountry:        US\\nPostalCode:     60605\\nRegDate:        1994-06-22\\nUpdated:        1994-06-22\\nOfficePhone:    +1-312-294-2387\\nSource:         ARIN\\n\n\nPOCHandle:      RUIZA17-ARIN\\nIsRole:         N\\nLastName:       Ruiz\\nFirstName:      Alman\\nStreet:         541 N. Fairbanks Court\\nStreet:         3rd Floor IT Department\\nCity:           Chicago\\nState/Prov:     IL\\nCountry:        US\\nPostalCode:     60611\\nRegDate:        2017-11-20\\nUpdated:        2019-11-26\\nOfficePhone:    +1-312-742-4570\\nMailbox:        alman.ruiz@chicagoparkdistrict.com\\nSource:         ARIN\\n"}, {"range": "74.121.186.96/27", "id": "74-121-186-96-27-WOWRACKSUPPORTACTIVE", "name": "Wowrack.com", "country": "US", "domain": "wowrack.com", "org_id": "WOWTEC-1", "status": "REASSIGNMENT", "tech_id": "WOWRA1-ARIN", "mnt_id": "WOWRA-ARIN", "admin_id": "JP1718-ARIN", "abuse_id": "WAT1-ARIN", "created": "2012-07-03", "updated": "2012-07-03", "source": "arin", "raw": "NetHandle:      NET-74-121-186-96-1\\nOrgID:          WOWTEC-1\\nParent:         NET-74-121-184-0-1\\nNetName:        74-121-186-96-27-WOWRACKSUPPORTACTIVE\\nNetRange:       74.121.186.96 - 74.121.186.127\\nNetType:        reassignment\\nRegDate:        2012-07-03\\nUpdated:        2012-07-03\\nSource:         ARIN\\n\n\nOrgID:          WOWTEC-1\\nOrgName:        Wowrack.com\\nCanAllocate:    \\nStreet:         12201 Tukwila International Blvd\\nStreet:         STE 100\\nCity:           Seattle\\nState/Prov:     WA\\nCountry:        US\\nPostalCode:     98168\\nRegDate:        2002-01-07\\nUpdated:        2018-05-31\\nOrgAbuseHandle: WAT1-ARIN\\nOrgAdminHandle: JP1718-ARIN\\nOrgNOCHandle:   WOWRA-ARIN\\nOrgTechHandle:  WOWRA1-ARIN\\nSource:         ARIN\\n\n\nPOCHandle:      WOWRA1-ARIN\\nIsRole:         Y\\nLastName:       Wowrack NOC\\nFirstName:      \\nStreet:         12201 Tukwila International Blvd\\nStreet:         STE 100\\nCity:           Seattle\\nState/Prov:     WA\\nCountry:        US\\nPostalCode:     98168\\nRegDate:        2008-03-14\\nUpdated:        2021-10-27\\nOfficePhone:    +1-206-522-4402\\nFaxPhone:       +1-866-969-8878\\nMailbox:        noc@wowrack.com\\nSource:         ARIN\\n\n\nPOCHandle:      WOWRA-ARIN\\nIsRole:         Y\\nLastName:       Wowrack Hostmaster\\nFirstName:      \\nStreet:         12201 Tukwila International Blvd\\nStreet:         STE 100\\nCity:           Seattle\\nState/Prov:     WA\\nCountry:        US\\nPostalCode:     98168\\nRegDate:        2003-07-29\\nUpdated:        2021-10-27\\nFaxPhone:       +1-866-969-8878\\nOfficePhone:    +1-206-522-4402\\nMailbox:        hostmaster@wowrack.com\\nSource:         ARIN\\n\n\nPOCHandle:      WAT1-ARIN\\nIsRole:         Y\\nLastName:       Wowrack Abuse Team\\nFirstName:      \\nStreet:         12201 Tukwila International Blvd\\nStreet:         STE 100\\nCity:           Seattle\\nState/Prov:     WA\\nCountry:        US\\nPostalCode:     98168\\nRegDate:        2003-07-29\\nUpdated:        2021-10-27\\nFaxPhone:       +1-866-969-8878\\nOfficePhone:    +1-206-522-4402\\nMailbox:        abuse@wowrack.com\\nSource:         ARIN\\n\n\nPOCHandle:      JP1718-ARIN\\nIsRole:         N\\nLastName:       Pandra\\nFirstName:      Jimmy\\nStreet:         12201 Tukwila International Blvd\\nStreet:         STE 100\\nCity:           Seattle\\nState/Prov:     WA\\nCountry:        US\\nPostalCode:     98168\\nRegDate:        2001-11-26\\nUpdated:        2021-10-27\\nOfficePhone:    +1-206-522-4402\\nFaxPhone:       +1-866-969-8878\\nMailbox:        jim@wowrack.com\\nSource:         ARIN\\n"}, {"range": "104.245.108.0/22", "id": "TEKFINITY", "name": "Fatbeam, LLC", "country": "US", "domain": "fatbeam.com", "org_id": "FL-379", "status": "ALLOCATION", "tech_id": "BARRO151-ARIN\\NFNO21-ARIN", "mnt_id": "FATBE-ARIN", "admin_id": "BUDDG3-ARIN", "abuse_id": "FNO21-ARIN", "created": "2014-12-09", "updated": "2021-04-21", "source": "arin", "raw": "NetHandle:      NET-104-245-108-0-1\\nOrgID:          FL-379\\nParent:         NET-104-0-0-0-0\\nNetName:        TEKFINITY\\nNetRange:       104.245.108.0 - 104.245.111.255\\nNetType:        allocation\\nOriginAS:       63298\\nRegDate:        2014-12-09\\nUpdated:        2021-04-21\\nSource:         ARIN\\n\n\nOrgID:          FL-379\\nOrgName:        Fatbeam, LLC\\nCanAllocate:    \\nStreet:         2065 W Riverstone Drive\\nStreet:         Suite #205\\nCity:           Coeur d Alene\\nState/Prov:     ID\\nCountry:        US\\nPostalCode:     83814\\nComment:        http://www.fatbeam.com\\nComment:        Please Call 1-855-979-8844 -- This will ring our NOC.\\nRegDate:        2017-02-14\\nUpdated:        2022-04-06\\nOrgAbuseHandle: FNO21-ARIN\\nOrgAdminHandle: BUDDG3-ARIN\\nOrgNOCHandle:   FATBE-ARIN\\nOrgTechHandle:  BARRO151-ARIN\\nOrgTechHandle:  FNO21-ARIN\\nSource:         ARIN\\n\n\nPOCHandle:      BARRO151-ARIN\\nIsRole:         N\\nLastName:       Barron\\nFirstName:      Zac\\nStreet:         2065 W Riverstone Dr \\nStreet:         Suite. 202\\nCity:           Coeur d'Alene\\nState/Prov:     ID\\nCountry:        US\\nPostalCode:     83814\\nRegDate:        2022-03-29\\nUpdated:        2022-03-29\\nOfficePhone:    +1-208-618-9374\\nMailbox:        Zac@fatbeam.com\\nSource:         ARIN\\n\n\nPOCHandle:      FATBE-ARIN\\nIsRole:         Y\\nLastName:       Fatbeam NOC\\nFirstName:      \\nStreet:         2065 W. Riverstone Dr. \\nStreet:         Suite 105,\\nCity:           Coeur d Alene\\nState/Prov:     ID\\nCountry:        US\\nPostalCode:     83814\\nRegDate:        2019-09-09\\nUpdated:        2021-09-08\\nOfficePhone:    +1-855-979-8844\\nMailbox:        support@fatbeam.com\\nSource:         ARIN\\n\n\nPOCHandle:      BUDDG3-ARIN\\nIsRole:         N\\nLastName:       Budd\\nFirstName:      Gavin\\nStreet:         2065 W. Riverstone Dr.\\nStreet:         Suite 105\\nCity:           Coeur d'Alene\\nState/Prov:     ID\\nCountry:        US\\nPostalCode:     83814\\nRegDate:        2012-11-09\\nUpdated:        2021-09-09\\nOfficePhone:    +1-208-758-7021\\nMailbox:        gavin@fatbeam.com\\nSource:         ARIN\\n\n\nPOCHandle:      FNO21-ARIN\\nIsRole:         Y\\nLastName:       Fatbeam Network Operations\\nFirstName:      \\nStreet:         2065 W. Riverstone Drive\\nStreet:         STE 105\\nCity:           Coeur d Alene\\nState/Prov:     ID\\nCountry:        US\\nPostalCode:     83814\\nRegDate:        2019-09-09\\nUpdated:        2021-09-08\\nOfficePhone:    +1-509-344-1008\\nMailbox:        netops@fatbeam.com\\nSource:         ARIN\\n"}, {"range": "216.172.160.0/19", "id": "HGBLOCK-2", "name": "WEBSITEWELCOME.COM", "country": "US", "domain": "websitewelcome.com", "org_id": "BO", "status": "ALLOCATION", "tech_id": "IPADM551-ARIN", "mnt_id": "ENO74-ARIN", "admin_id": "ENO74-ARIN", "abuse_id": "ABUSE3580-ARIN", "created": "2011-06-28", "updated": "2012-03-02", "source": "arin", "raw": "NetHandle:      NET-216-172-160-0-1\\nOrgID:          BO\\nParent:         NET-216-0-0-0-0\\nNetName:        HGBLOCK-2\\nNetRange:       216.172.160.0 - 216.172.191.255\\nNetType:        allocation\\nRegDate:        2011-06-28\\nUpdated:        2012-03-02\\nAbuseHandle:    IPADM551-ARIN\\nNOCHandle:      IPADM551-ARIN\\nTechHandle:     IPADM551-ARIN\\nSource:         ARIN\\n\n\nOrgID:          BO\\nOrgName:        WEBSITEWELCOME.COM\\nCanAllocate:    \\nStreet:         10 Corporate Drive\\nCity:           Burlington\\nState/Prov:     MA\\nCountry:        US\\nPostalCode:     01803\\nRegDate:        2011-02-16\\nUpdated:        2020-01-31\\nReferralServer: rwhois://rwhois.websitewelcome.com:4321\\nOrgAbuseHandle: ABUSE3580-ARIN\\nOrgAdminHandle: ENO74-ARIN\\nOrgNOCHandle:   ENO74-ARIN\\nOrgTechHandle:  ENO74-ARIN\\nSource:         ARIN\\n\n\nPOCHandle:      ENO74-ARIN\\nIsRole:         Y\\nLastName:       EIG Network Operations\\nFirstName:      \\nStreet:         10 Corporate Drive\\nCity:           Burlington\\nState/Prov:     MA\\nCountry:        US\\nPostalCode:     01803\\nRegDate:        2010-08-25\\nUpdated:        2021-11-17\\nOfficePhone:    +1-781-852-3200\\nOfficePhone:    +1-877-659-6181\\nMailbox:        eig-noc@endurance.com\\nMailbox:        eig-net-team@endurance.com\\nSource:         ARIN\\n\n\nPOCHandle:      IPADM551-ARIN\\nIsRole:         Y\\nLastName:       IP Admin\\nFirstName:      \\nStreet:         10 Corporate Dr.\\nCity:           Burlington\\nState/Prov:     MA\\nCountry:        US\\nPostalCode:     01803\\nRegDate:        2011-01-17\\nUpdated:        2021-11-17\\nOfficePhone:    +1-781-852-3200\\nMailbox:        eig-net-team@endurance.com\\nMailbox:        jayanathan.muhunthan@endurance.com\\nSource:         ARIN\\n\n\nPOCHandle:      ABUSE3580-ARIN\\nIsRole:         Y\\nLastName:       Abuse Department\\nFirstName:      \\nStreet:         1958 South 950 East\\nCity:           Provo\\nState/Prov:     UT\\nCountry:        US\\nPostalCode:     84606\\nRegDate:        2012-10-26\\nUpdated:        2022-01-13\\nOfficePhone:    +1-713-574-5287\\nMailbox:        abuse@hostgator.com\\nSource:         ARIN\\n"}, {"range": "67.129.241.208/29", "id": "Q0423-67-129-241-208", "name": "Telecommunication Systems, Inc.", "country": "US", "domain": "telecomsys.com", "org_id": "TELEC-15", "status": "REASSIGNMENT", "tech_id": "NES11-ARIN", "mnt_id": "NOC12132-ARIN", "admin_id": "NES11-ARIN", "abuse_id": "NOC12132-ARIN", "created": "2015-04-23", "updated": "2015-04-23", "source": "arin", "raw": "NetHandle:      NET-67-129-241-208-1\\nOrgID:          TELEC-15\\nParent:         NET-67-128-0-0-1\\nNetName:        Q0423-67-129-241-208\\nNetRange:       67.129.241.208 - 67.129.241.215\\nNetType:        reassignment\\nOriginAS:       209\\nRegDate:        2015-04-23\\nUpdated:        2015-04-23\\nSource:         ARIN\\n\n\nOrgID:          TELEC-15\\nOrgName:        Telecommunication Systems, Inc.\\nCanAllocate:    \\nStreet:         2401 Elliott Ave.\\nStreet:         Suite 200\\nCity:           Seattle\\nState/Prov:     WA\\nCountry:        US\\nPostalCode:     98121\\nRegDate:        2004-04-02\\nUpdated:        2021-07-27\\nOrgAbuseHandle: NOC12132-ARIN\\nOrgAdminHandle: NES11-ARIN\\nOrgNOCHandle:   NOC12132-ARIN\\nOrgTechHandle:  NES11-ARIN\\nSource:         ARIN\\n\n\nPOCHandle:      NES11-ARIN\\nIsRole:         Y\\nLastName:       Network Engineering - SSG\\nFirstName:      \\nStreet:         2401 Elliott Ave.\\nStreet:         Suite 200\\nCity:           Seattle\\nState/Prov:     WA\\nCountry:        US\\nPostalCode:     98121\\nRegDate:        2012-05-17\\nUpdated:        2021-09-24\\nOfficePhone:    +1-206-792-2000\\nMailbox:        NE-Team@comtechtel.com\\nSource:         ARIN\\n\n\nPOCHandle:      NOC12132-ARIN\\nIsRole:         Y\\nLastName:       NOC\\nFirstName:      \\nStreet:         2401 Elliott\\nStreet:         2nd Floor\\nCity:           Seattle\\nState/Prov:     WA\\nCountry:        US\\nPostalCode:     98121\\nRegDate:        2011-07-18\\nUpdated:        2016-11-03\\nOfficePhone:    +1-800-959-3749\\nMailbox:        noc@telecomsys.com\\nSource:         ARIN\\n"}, {"range": "8.20.103.0/24", "id": "LPL-141-CLOUD14-8-20-103", "name": "Cloudflare, Inc.", "country": "US", "domain": "cloudflare.com", "org_id": "CLOUD14", "status": "REASSIGNMENT", "tech_id": "ADMIN2521-ARIN", "mnt_id": "CLOUD146-ARIN", "admin_id": "ADMIN2521-ARIN", "abuse_id": "ABUSE2916-ARIN", "created": "2019-06-11", "updated": "2019-06-11", "source": "arin", "raw": "NetHandle:      NET-8-20-103-0-1\\nOrgID:          CLOUD14\\nParent:         NET-8-0-0-0-1\\nNetName:        LPL-141-CLOUD14-8-20-103\\nNetRange:       8.20.103.0 - 8.20.103.255\\nNetType:        reassignment\\nOriginAS:       13335\\nRegDate:        2019-06-11\\nUpdated:        2019-06-11\\nSource:         ARIN\\n\n\nOrgID:          CLOUD14\\nOrgName:        Cloudflare, Inc.\\nCanAllocate:    \\nStreet:         101 Townsend Street\\nCity:           San Francisco\\nState/Prov:     CA\\nCountry:        US\\nPostalCode:     94107\\nRegDate:        2010-07-09\\nUpdated:        2021-07-01\\nOrgAbuseHandle: ABUSE2916-ARIN\\nOrgAdminHandle: ADMIN2521-ARIN\\nOrgNOCHandle:   CLOUD146-ARIN\\nOrgRoutingHandle:   CLOUD146-ARIN\\nOrgTechHandle:  ADMIN2521-ARIN\\nSource:         ARIN\\n\n\nPOCHandle:      ADMIN2521-ARIN\\nIsRole:         Y\\nLastName:       Admin\\nFirstName:      \\nStreet:         101 Townsend Street\\nCity:           San Francisco\\nState/Prov:     CA\\nCountry:        US\\nPostalCode:     94107\\nRegDate:        2011-04-19\\nUpdated:        2022-01-20\\nOfficePhone:    +1-650-319-8930\\nMailbox:        rir@cloudflare.com\\nSource:         ARIN\\n\n\nPOCHandle:      ABUSE2916-ARIN\\nIsRole:         Y\\nLastName:       Abuse\\nFirstName:      \\nStreet:         101 Townsend Street\\nCity:           San Francisco\\nState/Prov:     CA\\nCountry:        US\\nPostalCode:     94107\\nRegDate:        2011-02-14\\nUpdated:        2020-04-23\\nOfficePhone:    +1-650-319-8930\\nMailbox:        abuse@cloudflare.com\\nSource:         ARIN\\n\n\nPOCHandle:      CLOUD146-ARIN\\nIsRole:         Y\\nLastName:       Cloudflare-NOC\\nFirstName:      \\nStreet:         101 Townsend St\\nCity:           San Francsico\\nState/Prov:     CA\\nCountry:        US\\nPostalCode:     94107\\nRegDate:        2021-07-01\\nUpdated:        2022-08-09\\nOfficePhone:    +1-650-319-8930\\nMailbox:        noc@cloudflare.com\\nSource:         ARIN\\n"}, {"range": "8.17.96.0/24", "id": "HBS-BLK-HBS-SUMMARY-NETWORK", "name": "Hotwire Business Solutions", "country": "US", "domain": "gethotwired.net", "org_id": "HBS-54", "status": "REALLOCATION", "tech_id": "ADMIN5342-ARIN\\NDCP8-ARIN\\NDRK9-ARIN\\NJSL39-ARIN\\NLAWSO19-ARIN", "mnt_id": "JSL39-ARIN", "admin_id": "JSL48-ARIN", "abuse_id": "JSL39-ARIN", "created": "2018-03-14", "updated": "2018-03-14", "source": "arin", "raw": "NetHandle:      NET-8-17-96-0-2\\nOrgID:          HBS-54\\nParent:         NET-8-17-96-0-1\\nNetName:        HBS-BLK-HBS-SUMMARY-NETWORK\\nNetRange:       8.17.96.0 - 8.17.96.255\\nNetType:        reallocation\\nOriginAS:       23089, 31793\\nComment:        Addresses within this range are NON-PORTABLE\\nComment:        In use at development \u00e2\u20ac\u201c US - FL - HBS SUMMARY NETWORK - HBS Aggregate Summary\\nRegDate:        2018-03-14\\nUpdated:        2018-03-14\\nSource:         ARIN\\n\n\nOrgID:          HBS-54\\nOrgName:        Hotwire Business Solutions\\nCanAllocate:    \\nStreet:         Three Bala Plaza East,\\nStreet:         Suite 700\\nCity:           Bala Cynwyd\\nState/Prov:     PA\\nCountry:        US\\nPostalCode:     19004\\nComment:        Information regarding this Autonomous System can be found at http://as23089.peeringdb.com\\nRegDate:        2014-07-29\\nUpdated:        2021-09-14\\nReferralServer: rwhois://rwhois.gethotwired.net:4321\\nOrgAbuseHandle: JSL39-ARIN\\nOrgAdminHandle: JSL48-ARIN\\nOrgNOCHandle:   JSL39-ARIN\\nOrgTechHandle:  ADMIN5342-ARIN\\nOrgTechHandle:  DCP8-ARIN\\nOrgTechHandle:  DRK9-ARIN\\nOrgTechHandle:  JSL39-ARIN\\nOrgTechHandle:  LAWSO19-ARIN\\nSource:         ARIN\\n\n\nPOCHandle:      JSL39-ARIN\\nIsRole:         N\\nLastName:       Slattery\\nFirstName:      Jim\\nStreet:         3 Bala Plaza East\\nStreet:         suite 700\\nCity:           Bala Cynwyd\\nState/Prov:     PA\\nCountry:        US\\nPostalCode:     19004\\nRegDate:        2004-05-10\\nUpdated:        2021-11-24\\nOfficePhone:    +1-484-580-9006\\nMailbox:        JSlattery@hotwirecommunication.com\\nSource:         ARIN\\n\n\nPOCHandle:      DRK9-ARIN\\nIsRole:         N\\nLastName:       Ketterhagen\\nFirstName:      Donald\\nStreet:         1415 Martin Luther King Jr Ave S\\nCity:           Salisbury\\nState/Prov:     NC\\nCountry:        US\\nPostalCode:     28144\\nRegDate:        2005-03-12\\nUpdated:        2022-03-12\\nFaxPhone:       +1-954-417-3562\\nMobilePhone:    +1-919-609-4669\\nOfficePhone:    +1-704-244-5552\\nMailbox:        bketterhagen@hotwirecommunication.com\\nMailbox:        bob@ketterhagen.com\\nSource:         ARIN\\n\n\nPOCHandle:      ADMIN5342-ARIN\\nIsRole:         Y\\nLastName:       Administrator\\nFirstName:      \\nStreet:         Three Bala Plaza East,\\nStreet:         Suite 700\\nCity:           Bala Cynwyd\\nState/Prov:     PA\\nCountry:        US\\nPostalCode:     19004\\nRegDate:        2014-07-22\\nUpdated:        2021-08-18\\nOfficePhone:    +1-484-572-6200\\nMailbox:        ipadmin@hotwirecommunication.com\\nSource:         ARIN\\n\n\nPOCHandle:      LAWSO19-ARIN\\nIsRole:         N\\nLastName:       Lawson\\nFirstName:      Jeff\\nStreet:         300 East Lancaster Ave\\nStreet:         Suite 208\\nCity:           Wynnewood\\nState/Prov:     PA\\nCountry:        US\\nPostalCode:     19096\\nRegDate:        2012-10-03\\nUpdated:        2020-04-21\\nOfficePhone:    +1-215-720-4028\\nMobilePhone:    +1-215-720-4028\\nMailbox:        jlawson@hotwiremail.com\\nSource:         ARIN\\n\n\nPOCHandle:      JSL48-ARIN\\nIsRole:         N\\nLastName:       slattery\\nFirstName:      jim\\nStreet:         3 Bala Plaza East\\nStreet:         suite 700\\nCity:           Bala Cynwyd\\nState/Prov:     PA\\nCountry:        US\\nPostalCode:     19004\\nRegDate:        2005-04-19\\nUpdated:        2021-08-23\\nOfficePhone:    +1-484-580-9006\\nMailbox:        jslattery@hotwiremail.com\\nSource:         ARIN\\n\n\nPOCHandle:      DCP8-ARIN\\nIsRole:         N\\nLastName:       Pacheco\\nFirstName:      Donaldo\\nStreet:         2100 W Cypress Creek Rd\\nCity:           Fort Lauderdale\\nState/Prov:     FL\\nCountry:        US\\nPostalCode:     33309\\nRegDate:        2015-08-03\\nUpdated:        2022-07-29\\nOfficePhone:    +1-954-417-6745\\nMailbox:        donaldo.pacheco@hotwirecommunication.com\\nSource:         ARIN\\n"}, {"range": "204.115.6.0/23", "id": "DRIVETIME-PUBLIC-1", "name": "DriveTime", "country": "US", "domain": "drivetime.fm", "org_id": "DSFL", "status": "ALLOCATION", "tech_id": "DRIVE3-ARIN", "mnt_id": "DRIVE3-ARIN", "admin_id": "DRIVE3-ARIN", "abuse_id": "DRIVE3-ARIN", "created": "2011-05-11", "updated": "2021-12-14", "source": "arin", "raw": "NetHandle:      NET-204-115-6-0-1\\nOrgID:          DSFL\\nParent:         NET-204-0-0-0-0\\nNetName:        DRIVETIME-PUBLIC-1\\nNetRange:       204.115.6.0 - 204.115.7.255\\nNetType:        allocation\\nOriginAS:       53562\\nRegDate:        2011-05-11\\nUpdated:        2021-12-14\\nSource:         ARIN\\n\n\nOrgID:          DSFL\\nOrgName:        DriveTime\\nCanAllocate:    \\nStreet:         1720 West Rio Salado Pkwy\\nCity:           Tempe\\nState/Prov:     AZ\\nCountry:        US\\nPostalCode:     85281\\nRegDate:        2010-05-21\\nUpdated:        2016-11-04\\nOrgAbuseHandle: DRIVE3-ARIN\\nOrgAdminHandle: DRIVE3-ARIN\\nOrgNOCHandle:   DRIVE3-ARIN\\nOrgTechHandle:  DRIVE3-ARIN\\nSource:         ARIN\\n\n\nPOCHandle:      DRIVE3-ARIN\\nIsRole:         N\\nLastName:       DriveTime\\nFirstName:      DriveTime\\nStreet:         1720 West Rio Salado Pkwy\\nCity:           Tempe\\nState/Prov:     AZ\\nCountry:        US\\nPostalCode:     85281\\nRegDate:        2010-05-18\\nUpdated:        2022-07-28\\nOfficePhone:    +1-800-967-8895\\nMailbox:        netman@drivetime.com\\nSource:         ARIN\\n"}, {"range": "74.221.208.0/20", "id": "OPTIC-IP-LLC", "name": "DME Hosting LLC", "country": "US", "domain": "opticip.com", "org_id": "DHL-28", "status": "ALLOCATION", "tech_id": "TECHD6-ARIN", "mnt_id": "NOC11786-ARIN", "admin_id": "DEE5-ARIN", "abuse_id": "ABUSE2870-ARIN", "created": "2011-08-02", "updated": "2021-07-22", "source": "arin", "raw": "NetHandle:      NET-74-221-208-0-1\\nOrgID:          DHL-28\\nParent:         NET-74-0-0-0-0\\nNetName:        OPTIC-IP-LLC\\nNetRange:       74.221.208.0 - 74.221.223.255\\nNetType:        allocation\\nOriginAS:       174\\nRegDate:        2011-08-02\\nUpdated:        2021-07-22\\nSource:         ARIN\\n\n\nOrgID:          DHL-28\\nOrgName:        DME Hosting LLC\\nCanAllocate:    \\nStreet:         Optic IP LLC\\nStreet:         2221 W Pecos Rd\\nStreet:         Suite #6\\nCity:           Chandler\\nState/Prov:     AZ\\nCountry:        US\\nPostalCode:     85224\\nComment:        https://www.opticip.com/\\nComment:        david@opticip.com\\nRegDate:        2011-01-10\\nUpdated:        2020-07-08\\nOrgAbuseHandle: ABUSE2870-ARIN\\nOrgAdminHandle: DEE5-ARIN\\nOrgNOCHandle:   NOC11786-ARIN\\nOrgTechHandle:  TECHD6-ARIN\\nSource:         ARIN\\n\n\nPOCHandle:      TECHD6-ARIN\\nIsRole:         Y\\nLastName:       Tech Department\\nFirstName:      \\nStreet:         2221 W Pecos Rd STE #6\\nCity:           Chandler\\nState/Prov:     AZ\\nCountry:        US\\nPostalCode:     85224\\nRegDate:        2011-01-08\\nUpdated:        2022-08-02\\nOfficePhone:    +1-602-309-3685\\nMailbox:        Support@opticip.com\\nSource:         ARIN\\n\n\nPOCHandle:      DEE5-ARIN\\nIsRole:         N\\nLastName:       Ellsworth\\nFirstName:      David\\nStreet:         2221 W Pecos Rd\\nStreet:         Suite #6\\nCity:           Chandler\\nState/Prov:     AZ\\nCountry:        US\\nPostalCode:     85224\\nRegDate:        2009-05-29\\nUpdated:        2022-08-02\\nFaxPhone:       +1-480-963-4502\\nOfficePhone:    +1-602-309-3658\\nMailbox:        support@opticip.com\\nMailbox:        David@opticip.com\\nSource:         ARIN\\n\n\nPOCHandle:      ABUSE2870-ARIN\\nIsRole:         Y\\nLastName:       Abuse Department\\nFirstName:      \\nStreet:         2221 W Pecos Rd\\nStreet:         Suite #6\\nCity:           Chandler\\nState/Prov:     AZ\\nCountry:        US\\nPostalCode:     85224\\nRegDate:        2011-01-08\\nUpdated:        2022-08-02\\nFaxPhone:       +1-602-288-6714\\nOfficePhone:    +1-602-309-3658\\nMailbox:        support@opticip.com\\nMailbox:        david@opticip.com\\nSource:         ARIN\\n\n\nPOCHandle:      NOC11786-ARIN\\nIsRole:         Y\\nLastName:       Noc\\nFirstName:      \\nStreet:         2221 W Pecos Rd\\nStreet:         Suite #6\\nCity:           Chandler\\nState/Prov:     AZ\\nCountry:        US\\nPostalCode:     85224\\nRegDate:        2011-01-09\\nUpdated:        2022-08-02\\nOfficePhone:    +1-602-904-5538\\nFaxPhone:       +1-602-288-6714\\nMailbox:        support@opticip.com\\nSource:         ARIN\\n"}, {"range": "199.21.112.0/22", "id": "CC-03", "name": "ColoCrossing", "country": "US", "domain": "colocrossing.com", "org_id": "VGS-9", "status": "ALLOCATION", "tech_id": "NETWO882-ARIN", "mnt_id": "NETWO882-ARIN", "admin_id": "NETWO882-ARIN", "abuse_id": "ABUSE3246-ARIN", "created": "2011-10-14", "updated": "2012-03-02", "source": "arin", "raw": "NetHandle:      NET-199-21-112-0-1\\nOrgID:          VGS-9\\nParent:         NET-199-0-0-0-0\\nNetName:        CC-03\\nNetRange:       199.21.112.0 - 199.21.115.255\\nNetType:        allocation\\nOriginAS:       36352\\nComment:        http://www.colocrossing.com\\nRegDate:        2011-10-14\\nUpdated:        2012-03-02\\nAbuseHandle:    ABUSE3246-ARIN\\nSource:         ARIN\\n\n\nOrgID:          VGS-9\\nOrgName:        ColoCrossing\\nCanAllocate:    \\nStreet:         325 Delaware Avenue\\nStreet:         Suite 300\\nCity:           Buffalo\\nState/Prov:     NY\\nCountry:        US\\nPostalCode:     14202\\nRegDate:        2005-06-20\\nUpdated:        2019-10-17\\nOrgAbuseHandle: ABUSE3246-ARIN\\nOrgAdminHandle: NETWO882-ARIN\\nOrgNOCHandle:   NETWO882-ARIN\\nOrgTechHandle:  NETWO882-ARIN\\nSource:         ARIN\\n\n\nPOCHandle:      ABUSE3246-ARIN\\nIsRole:         Y\\nLastName:       Abuse\\nFirstName:      \\nStreet:         325 Delaware Avenue\\nStreet:         Suite 300\\nCity:           Buffalo\\nState/Prov:     NY\\nCountry:        US\\nPostalCode:     14202\\nRegDate:        2011-11-14\\nUpdated:        2022-02-07\\nOfficePhone:    +1-800-518-9716\\nMailbox:        abuse@colocrossing.com\\nSource:         ARIN\\n\n\nPOCHandle:      NETWO882-ARIN\\nIsRole:         Y\\nLastName:       Network Operations\\nFirstName:      \\nStreet:         325 Delaware Avenue\\nStreet:         Suite 300\\nCity:           Buffalo\\nState/Prov:     NY\\nCountry:        US\\nPostalCode:     14202\\nRegDate:        2005-06-03\\nUpdated:        2022-08-11\\nOfficePhone:    +1-800-518-9716\\nMailbox:        support@colocrossing.com\\nSource:         ARIN\\n"}, {"range": "57.134.128.0/17", "id": "CGOC-30BLK", "name": "COGECO COMMUNICATIONS INC.", "country": "CA", "domain": "cogeco.com", "org_id": "CGOC", "status": "ALLOCATION", "tech_id": "INS2-ARIN", "mnt_id": "SITA-MNT", "admin_id": "IPSER5-ARIN", "abuse_id": "ABUSE3134-ARIN", "created": "2022-02-03", "updated": "2022-03-02", "source": "arin", "raw": "NetHandle:      NET-57-134-128-0-1\\nOrgID:          CGOC\\nParent:         NET-57-0-0-0-1\\nNetName:        CGOC-30BLK\\nNetRange:       57.134.128.0 - 57.134.255.255\\nNetType:        allocation\\nOriginAS:       7992\\nComment:        Please email security@cogeco.net for abuse/security violations.\\nRegDate:        2022-02-03\\nUpdated:        2022-03-02\\nSource:         ARIN\\n\n\nOrgID:          CGOC\\nOrgName:        COGECO COMMUNICATIONS INC.\\nCanAllocate:    \\nStreet:         PO Box 5076, Stn. Main\\nStreet:         950 Syscon Road\\nCity:           Burlington\\nState/Prov:     ON\\nCountry:        CA\\nPostalCode:     L7R-4S6\\nComment:        Please email 'security@cogeco.net' for abuse/security violations\\nRegDate:        1997-03-31\\nUpdated:        2022-08-02\\nOrgAbuseHandle: ABUSE3134-ARIN\\nOrgAdminHandle: IPSER5-ARIN\\nOrgTechHandle:  INS2-ARIN\\nSource:         ARIN\\n\n\nPOCHandle:      ABUSE3134-ARIN\\nIsRole:         Y\\nLastName:       Abuse\\nFirstName:      \\nStreet:         PO Box 5076, Stn. Main \\nStreet:         950 Syscon Road\\nCity:           Burlington\\nState/Prov:     ON\\nCountry:        CA\\nPostalCode:     L7R-4S6\\nRegDate:        2011-08-17\\nUpdated:        2022-03-05\\nOfficePhone:    +1-905-333-5343\\nMailbox:        security@cogeco.net\\nSource:         ARIN\\n\n\nPOCHandle:      IPSER5-ARIN\\nIsRole:         Y\\nLastName:       IP Services\\nFirstName:      \\nStreet:         P.O.Box 5076 Stn. Main\\nStreet:         950 Syscon Rd.\\nCity:           Burlington\\nState/Prov:     ON\\nCountry:        CA\\nPostalCode:     L7R-4S6\\nRegDate:        2007-07-05\\nUpdated:        2022-07-26\\nOfficePhone:    +1-905-333-5343\\nMailbox:        ipservices@cogeco.com\\nSource:         ARIN\\n\n\nPOCHandle:      INS2-ARIN\\nIsRole:         Y\\nLastName:       IP Network Service\\nFirstName:      \\nStreet:         PO Box 5076, Stn. Main\\nStreet:         950 Syscon Road\\nCity:           Burlington\\nState/Prov:     ON\\nCountry:        CA\\nPostalCode:     L7R-4S6\\nRegDate:        2002-09-16\\nUpdated:        2022-07-26\\nOfficePhone:    +1-905-333-5343\\nMailbox:        ipservices@cogeco.com\\nSource:         ARIN\\n"}, {"range": "63.229.58.48/28", "id": "Q1231-63-229-58-48", "name": "MONROVIA NURSERY COMPANY", "country": "US", "domain": "monrovia.com", "org_id": "MONRO-14", "status": "REASSIGNMENT", "tech_id": "RMA303-ARIN", "mnt_id": "RMA303-ARIN", "admin_id": "RMA303-ARIN", "abuse_id": "RMA303-ARIN", "created": "2008-12-31", "updated": "2008-12-31", "source": "arin", "raw": "NetHandle:      NET-63-229-58-48-1\\nOrgID:          MONRO-14\\nParent:         NET-63-224-0-0-1\\nNetName:        Q1231-63-229-58-48\\nNetRange:       63.229.58.48 - 63.229.58.63\\nNetType:        reassignment\\nOriginAS:       209\\nRegDate:        2008-12-31\\nUpdated:        2008-12-31\\nAbuseHandle:    RMA303-ARIN\\nNOCHandle:      RMA303-ARIN\\nTechHandle:     RMA303-ARIN\\nSource:         ARIN\\n\n\nOrgID:          MONRO-14\\nOrgName:        MONROVIA NURSERY COMPANY\\nCanAllocate:    \\nStreet:         13455 SE LAFAYETTE HWY\\nStreet:         BLDG MAIN FLR 1 RM TELCO\\nCity:           DAYTON\\nState/Prov:     OR\\nCountry:        US\\nPostalCode:     97114\\nRegDate:        2008-12-31\\nUpdated:        2011-09-24\\nOrgAbuseHandle: RMA303-ARIN\\nOrgAdminHandle: RMA303-ARIN\\nOrgTechHandle:  RMA303-ARIN\\nSource:         ARIN\\n\n\nPOCHandle:      RMA303-ARIN\\nIsRole:         N\\nLastName:       MARTIN\\nFirstName:      RAY\\nStreet:         18331 E FOOTHILL BLVD\\nStreet:         BLDG MAIN FLR 1 RM TELC\\nCity:           IRWINDALE\\nState/Prov:     CA\\nCountry:        US\\nPostalCode:     91702\\nRegDate:        2008-12-11\\nUpdated:        2008-12-11\\nOfficePhone:    +1-626-334-9321\\nMailbox:        rmartin@monrovia.com\\nSource:         ARIN\\n"}, {"range": "207.225.76.112/29", "id": "Q1120-207-225-76-112", "name": "PORTLAND INTERNETWORKS", "country": "US", "domain": "pdx.net", "org_id": "PRTL", "status": "REASSIGNMENT", "tech_id": "MCWIL-ARIN", "mnt_id": "MCWIL-ARIN", "admin_id": "DEW36-ARIN", "abuse_id": "ABUSE1471-ARIN", "created": "2017-11-20", "updated": "2017-11-20", "source": "arin", "raw": "NetHandle:      NET-207-225-76-112-1\\nOrgID:          PRTL\\nParent:         NET-207-224-0-0-1\\nNetName:        Q1120-207-225-76-112\\nNetRange:       207.225.76.112 - 207.225.76.119\\nNetType:        reassignment\\nOriginAS:       209\\nRegDate:        2017-11-20\\nUpdated:        2017-11-20\\nSource:         ARIN\\n\n\nOrgID:          PRTL\\nOrgName:        PORTLAND INTERNETWORKS\\nCanAllocate:    \\nStreet:         419 NE 10th Ave\\nCity:           Portland\\nState/Prov:     OR\\nCountry:        US\\nPostalCode:     97232\\nRegDate:        1999-03-01\\nUpdated:        2019-03-06\\nOrgAbuseHandle: ABUSE1471-ARIN\\nOrgAdminHandle: DEW36-ARIN\\nOrgNOCHandle:   MCWIL-ARIN\\nOrgTechHandle:  MCWIL-ARIN\\nSource:         ARIN\\n\n\nPOCHandle:      DEW36-ARIN\\nIsRole:         N\\nLastName:       Westervelt\\nFirstName:      Doug\\nStreet:         532 SE Clay Street\\nCity:           Portland\\nState/Prov:     OR\\nCountry:        US\\nPostalCode:     97214\\nRegDate:        2013-08-08\\nUpdated:        2017-09-18\\nOfficePhone:    +1-503-972-7272\\nFaxPhone:       +1-503-222-0548\\nMailbox:        dougw@pdx.net\\nSource:         ARIN\\n\n\nPOCHandle:      ABUSE1471-ARIN\\nIsRole:         Y\\nLastName:       Abuse\\nFirstName:      \\nStreet:         419 NE 10th Ave\\nCity:           Portland\\nState/Prov:     OR\\nCountry:        US\\nPostalCode:     97232\\nRegDate:        2006-10-23\\nUpdated:        2021-11-13\\nOfficePhone:    +1-503-972-7272\\nMailbox:        abuse@pdx.net\\nSource:         ARIN\\n\n\nPOCHandle:      MCWIL-ARIN\\nIsRole:         N\\nLastName:       McWilliams\\nFirstName:      Tim\\nStreet:         419 NE 10th Ave\\nCity:           Portland\\nState/Prov:     OR\\nCountry:        US\\nPostalCode:     97232\\nRegDate:        2011-05-09\\nUpdated:        2021-11-13\\nOfficePhone:    +1-503-972-7272\\nFaxPhone:       +1-503-222-0548\\nMailbox:        tim@pdx.net\\nSource:         ARIN\\n"}, {"range": "2607:b400::/32", "id": "VA-TECH-V6", "name": "Virginia Polytechnic Institute and State Univ.", "country": "US", "domain": "vt.edu", "org_id": "VPISU", "status": "ALLOCATION", "tech_id": "PB123-ARIN", "mnt_id": "VTOC-ARIN", "admin_id": "BEJ1-ARIN", "abuse_id": "ABUSE44-ARIN", "created": "2010-10-18", "updated": "2012-03-02", "source": "arin", "raw": "V6NetHandle:    NET6-2607-B400-1\\nOrgID:          VPISU\\nParent:         NET6-2600-1\\nNetName:        VA-TECH-V6\\nNetRange:       2607:B400:: - 2607:B400:FFFF:FFFF:FFFF:FFFF:FFFF:FFFF\\nNetType:        allocation\\nOriginAS:       1312, 40220\\nComment:        DMCA and copyright complaints to DMCA@vt.edu.\\nRegDate:        2010-10-18\\nUpdated:        2012-03-02\\nSource:         ARIN\\n\n\nOrgID:          VPISU\\nOrgName:        Virginia Polytechnic Institute and State Univ.\\nCanAllocate:    \\nStreet:         Communications Network Services\\nStreet:         1770 Forecast Dr\\nCity:           Blacksburg\\nState/Prov:     VA\\nCountry:        US\\nPostalCode:     24061-0506\\nComment:        DMCA and copyright complaints to DMCA@vt.edu.\\nRegDate:        1993-09-23\\nUpdated:        2022-07-07\\nOrgAbuseHandle: ABUSE44-ARIN\\nOrgAbuseHandle: VTOC-ARIN\\nOrgAdminHandle: BEJ1-ARIN\\nOrgDNSHandle:   ECL27-ARIN\\nOrgNOCHandle:   VTOC-ARIN\\nOrgTechHandle:  PB123-ARIN\\nSource:         ARIN\\n\n\nPOCHandle:      PB123-ARIN\\nIsRole:         N\\nLastName:       Benchoff\\nFirstName:      Phil\\nStreet:         Communications Network Services\\nStreet:         1770 Forecast Dr\\nCity:           Blacksburg\\nState/Prov:     VA\\nCountry:        US\\nPostalCode:     24061-0506\\nRegDate:        1970-01-01\\nUpdated:        2022-07-07\\nOfficePhone:    +1-540-231-6460\\nMailbox:        benchoff@vt.edu\\nSource:         ARIN\\n\n\nPOCHandle:      VTOC-ARIN\\nIsRole:         Y\\nLastName:       Virginia Tech Operations Center\\nFirstName:      \\nStreet:         Communications Network Services\\nStreet:         1770 Forecast Drive\\nCity:           Blacksburg\\nState/Prov:     VA\\nCountry:        US\\nPostalCode:     24061-0506\\nRegDate:        2004-03-25\\nUpdated:        2021-10-15\\nOfficePhone:    +1-540-231-6780\\nMailbox:        nis-neo-g@vt.edu\\nSource:         ARIN\\n\n\nPOCHandle:      ABUSE44-ARIN\\nIsRole:         Y\\nLastName:       Abuse Department\\nFirstName:      \\nStreet:         Communications Network Services\\nStreet:         1770 Forecast Dr\\nCity:           Blacksburg\\nState/Prov:     VA\\nCountry:        US\\nPostalCode:     24061-0506\\nRegDate:        2002-09-20\\nUpdated:        2022-07-07\\nOfficePhone:    +1-540-231-9500\\nMailbox:        abuse@vt.edu\\nSource:         ARIN\\n\n\nPOCHandle:      BEJ1-ARIN\\nIsRole:         N\\nLastName:       Jones\\nFirstName:      Brian\\nStreet:         1770 Forecast Drive\\nCity:           Blacksburg\\nState/Prov:     VA\\nCountry:        US\\nPostalCode:     24061\\nRegDate:        2010-10-05\\nUpdated:        2022-03-16\\nOfficePhone:    +1-540-231-3930\\nMailbox:        bjones@vt.edu\\nSource:         ARIN\\n"}, {"range": "63.228.24.144/29", "id": "Q0719-63-228-24-144", "name": "AIRESPRING, INC.", "country": "US", "domain": "airespring.com", "org_id": "AIRES-25", "status": "REALLOCATION", "tech_id": "NOC33032-ARIN\\NOPSNE22-ARIN", "mnt_id": "ABUSE5351-ARIN", "admin_id": "OPSNE22-ARIN", "abuse_id": "ABUSE5351-ARIN", "created": "2016-07-19", "updated": "2016-07-19", "source": "arin", "raw": "NetHandle:      NET-63-228-24-144-1\\nOrgID:          AIRES-25\\nParent:         NET-63-224-0-0-1\\nNetName:        Q0719-63-228-24-144\\nNetRange:       63.228.24.144 - 63.228.24.151\\nNetType:        reallocation\\nOriginAS:       209\\nRegDate:        2016-07-19\\nUpdated:        2016-07-19\\nSource:         ARIN\\n\n\nOrgID:          AIRES-25\\nOrgName:        AIRESPRING, INC.\\nCanAllocate:    \\nStreet:         7800 Woodley Ave\\nCity:           VAN NUYS\\nState/Prov:     CA\\nCountry:        US\\nPostalCode:     91406\\nRegDate:        2004-10-20\\nUpdated:        2020-01-07\\nOrgAbuseHandle: ABUSE5351-ARIN\\nOrgAdminHandle: OPSNE22-ARIN\\nOrgNOCHandle:   ABUSE5351-ARIN\\nOrgTechHandle:  NOC33032-ARIN\\nOrgTechHandle:  OPSNE22-ARIN\\nSource:         ARIN\\n\n\nPOCHandle:      NOC33032-ARIN\\nIsRole:         Y\\nLastName:       Network Operation Center\\nFirstName:      \\nStreet:         7800 Woodley Ave\\nCity:           Van Nuys\\nState/Prov:     CA\\nCountry:        US\\nPostalCode:     91406\\nRegDate:        2019-10-16\\nUpdated:        2021-10-15\\nOfficePhone:    +1-818-738-1784\\nMailbox:        PJ.Yegani@AireSpring.com\\nSource:         ARIN\\n\n\nPOCHandle:      ABUSE5351-ARIN\\nIsRole:         Y\\nLastName:       Abuse Dept\\nFirstName:      \\nStreet:         7800 Woodley Ave\\nCity:           Van Nuys\\nState/Prov:     CA\\nCountry:        US\\nPostalCode:     91406\\nRegDate:        2016-02-08\\nUpdated:        2022-05-17\\nOfficePhone:    +1-888-288-5010\\nMailbox:        abuse@airespring.com\\nSource:         ARIN\\n\n\nPOCHandle:      OPSNE22-ARIN\\nIsRole:         N\\nLastName:       Ops\\nFirstName:      Net\\nStreet:         7800 Woodley Ave\\nCity:           Van Nuys\\nState/Prov:     CA\\nCountry:        US\\nPostalCode:     91406\\nRegDate:        2019-02-12\\nUpdated:        2022-03-01\\nOfficePhone:    +1-818-922-1181\\nMailbox:        netops@airespring.com\\nSource:         ARIN\\n"}, {"range": "75.119.188.0/23", "id": "CS-2787", "name": "Cisco Systems Inc", "country": "US", "domain": "cisco.com", "org_id": "CS-2787", "status": "ALLOCATION", "tech_id": "CCB10-ARIN", "mnt_id": "CCB10-ARIN", "admin_id": "CCB10-ARIN", "abuse_id": "CCB10-ARIN", "created": "2021-04-29", "updated": "2021-04-29", "source": "arin", "raw": "NetHandle:      NET-75-119-188-0-1\\nOrgID:          CS-2787\\nParent:         NET-75-0-0-0-0\\nNetName:        CS-2787\\nNetRange:       75.119.188.0 - 75.119.189.255\\nNetType:        allocation\\nRegDate:        2021-04-29\\nUpdated:        2021-04-29\\nSource:         ARIN\\n\n\nOrgID:          CS-2787\\nOrgName:        Cisco Systems Inc\\nCanAllocate:    \\nStreet:         170 West Tasman Dr\\nCity:           San Jose\\nState/Prov:     CA\\nCountry:        US\\nPostalCode:     95129\\nRegDate:        2020-03-10\\nUpdated:        2021-11-26\\nOrgAbuseHandle: CCB10-ARIN\\nOrgAdminHandle: CCB10-ARIN\\nOrgDNSHandle:   CCB10-ARIN\\nOrgNOCHandle:   CCB10-ARIN\\nOrgRoutingHandle:   CCB10-ARIN\\nOrgTechHandle:  CCB10-ARIN\\nSource:         ARIN\\n\n\nPOCHandle:      CCB10-ARIN\\nIsRole:         Y\\nLastName:       Contact Center BU\\nFirstName:      \\nStreet:         170 West Tasman Dr\\nCity:           San Jose\\nState/Prov:     CA\\nCountry:        US\\nPostalCode:     95129\\nRegDate:        2020-03-09\\nUpdated:        2022-03-31\\nOfficePhone:    +1-408-525-3244\\nMailbox:        sudpadma@cisco.com\\nMailbox:        svs@cisco.com\\nMailbox:        philimil@cisco.com\\nSource:         ARIN\\n"}, {"range": "68.248.29.56/29", "id": "SBCIS-WYPR-682482956", "name": "Wayport, LLC", "country": "US", "domain": "wayport.net", "org_id": "WYPR", "status": "REASSIGNMENT", "tech_id": "WN25-ARIN", "mnt_id": "AWSN-ARIN", "admin_id": "WN25-ARIN", "abuse_id": "ABUSE670-ARIN", "created": "2004-09-16", "updated": "2004-09-16", "source": "arin", "raw": "NetHandle:      NET-68-248-29-56-1\\nOrgID:          WYPR\\nParent:         NET-68-248-0-0-1\\nNetName:        SBCIS-WYPR-682482956\\nNetRange:       68.248.29.56 - 68.248.29.63\\nNetType:        reassignment\\nRegDate:        2004-09-16\\nUpdated:        2004-09-16\\nAbuseHandle:    ABUSE670-ARIN\\nSource:         ARIN\\n\n\nOrgID:          WYPR\\nOrgName:        Wayport, LLC\\nCanAllocate:    \\nStreet:         4509 Freidrich Lane\\nStreet:         Building III, Suite 300\\nCity:           Austin\\nState/Prov:     TX\\nCountry:        US\\nPostalCode:     78744\\nRegDate:        1997-07-29\\nUpdated:        2020-09-24\\nReferralServer: rwhois://rwhois.wayport.net:4321\\nOrgAbuseHandle: ABUSE670-ARIN\\nOrgAdminHandle: WN25-ARIN\\nOrgNOCHandle:   AWSN-ARIN\\nOrgTechHandle:  WN25-ARIN\\nSource:         ARIN\\n\n\nPOCHandle:      AWSN-ARIN\\nIsRole:         Y\\nLastName:       ATT WiFi Services NOC\\nFirstName:      \\nStreet:         4509 Freidrich Lane\\nStreet:         Building III, Suite 300\\nCity:           Austin\\nState/Prov:     TX\\nCountry:        US\\nPostalCode:     78744\\nRegDate:        2012-05-31\\nUpdated:        2014-05-01\\nOfficePhone:    +1-512-519-6000\\nMailbox:        noc-internal@wayport.net\\nSource:         ARIN\\n\n\nPOCHandle:      ABUSE670-ARIN\\nIsRole:         Y\\nLastName:       Abuse\\nFirstName:      \\nStreet:         4509 Freidrich Ln\\nStreet:         Building 3, Ste 300\\nCity:           Austin\\nState/Prov:     TX\\nCountry:        US\\nPostalCode:     78744\\nRegDate:        2004-07-13\\nUpdated:        2021-12-09\\nOfficePhone:    +1-512-519-6000\\nMailbox:        abuse@wayport.net\\nSource:         ARIN\\n\n\nPOCHandle:      WN25-ARIN\\nIsRole:         Y\\nLastName:       ATT WiFi Services IT\\nFirstName:      \\nStreet:         4509 Freidrich Ln\\nStreet:         Building III, Suite 300\\nCity:           Austin\\nState/Prov:     TX\\nCountry:        US\\nPostalCode:     78744\\nRegDate:        2000-01-21\\nUpdated:        2021-12-09\\nFaxPhone:       +1-512-519-6450\\nOfficePhone:    +1-512-519-6000\\nMailbox:        arin-coordinator@wayport.net\\nSource:         ARIN\\n"}, {"range": "165.140.152.0/22", "id": "SONICSPECTRUM-01", "name": "SonicPCS", "country": "US", "domain": "sonicpcs.com", "org_id": "SS-1022", "status": "ALLOCATION", "tech_id": "BECKE114-ARIN", "mnt_id": "BECKE114-ARIN", "admin_id": "BECKE114-ARIN", "abuse_id": "BECKE114-ARIN", "created": "2021-10-08", "updated": "2021-10-10", "source": "arin", "raw": "NetHandle:      NET-165-140-152-0-1\\nOrgID:          SS-1022\\nParent:         NET-165-0-0-0-0\\nNetName:        SONICSPECTRUM-01\\nNetRange:       165.140.152.0 - 165.140.155.255\\nNetType:        allocation\\nOriginAS:       400069\\nComment:        http://www.sonicpcs.com\\nRegDate:        2021-10-08\\nUpdated:        2021-10-10\\nSource:         ARIN\\n\n\nOrgID:          SS-1022\\nOrgName:        SonicPCS\\nCanAllocate:    \\nStreet:         416 Center St\\nCity:           Durand\\nState/Prov:     IL\\nCountry:        US\\nPostalCode:     61024\\nRegDate:        2015-08-07\\nUpdated:        2021-10-09\\nOrgAbuseHandle: BECKE114-ARIN\\nOrgAdminHandle: BECKE114-ARIN\\nOrgNOCHandle:   BECKE114-ARIN\\nOrgTechHandle:  BECKE114-ARIN\\nSource:         ARIN\\n\n\nPOCHandle:      BECKE114-ARIN\\nIsRole:         N\\nLastName:       Becker\\nFirstName:      AJ\\nStreet:         416 Center St\\nCity:           Durand\\nState/Prov:     IL\\nCountry:        US\\nPostalCode:     61024\\nRegDate:        2015-08-05\\nUpdated:        2021-09-16\\nOfficePhone:    +1-815-904-8700\\nMailbox:        abecker@sonicpcs.com\\nSource:         ARIN\\n"}, {"range": "209.201.98.64/28", "id": "209-201-98-64-28", "name": "Equinix, Inc.", "country": "US", "domain": "equinix.com", "org_id": "EQUINIX", "status": "REASSIGNMENT", "tech_id": "CAIRN10-ARIN\\NCARRI6-ARIN\\NHARIM2-ARIN\\NINDRA-ARIN\\NPERRY482-ARIN\\NMIRWA-ARIN\\NNIWAZ-ARIN\\NSHAHV1-ARIN\\NPATEL2857-ARIN\\NPEDER59-ARIN", "mnt_id": "EQ12-ARIN", "admin_id": "CAIRN10-ARIN", "abuse_id": "EQ127-ARIN", "created": "2022-04-28", "updated": "2022-04-28", "source": "arin", "raw": "NetHandle:      NET-209-201-98-64-1\\nOrgID:          EQUINIX\\nParent:         NET-209-201-0-0-1\\nNetName:        209-201-98-64-28\\nNetRange:       209.201.98.64 - 209.201.98.79\\nNetType:        reassignment\\nRegDate:        2022-04-28\\nUpdated:        2022-04-28\\nSource:         ARIN\\n\n\nOrgID:          EQUINIX\\nOrgName:        Equinix, Inc.\\nCanAllocate:    \\nStreet:         One Lagoon Drive\\nCity:           Redwood City\\nState/Prov:     CA\\nCountry:        US\\nPostalCode:     94065\\nComment:        http://www.equinix.com Abuse reports should be sent\\nComment:        to abuse@equinix.com\\nRegDate:        2002-06-12\\nUpdated:        2021-10-04\\nOrgNOCHandle:   EQ12-ARIN\\nOrgAbuseHandle: EQ127-ARIN\\nOrgAdminHandle: CAIRN10-ARIN\\nOrgTechHandle:  CAIRN10-ARIN\\nOrgTechHandle:  CARRI6-ARIN\\nOrgTechHandle:  HARIM2-ARIN\\nOrgTechHandle:  INDRA-ARIN\\nOrgTechHandle:  PERRY482-ARIN\\nOrgTechHandle:  MIRWA-ARIN\\nOrgTechHandle:  NIWAZ-ARIN\\nOrgTechHandle:  SHAHV1-ARIN\\nOrgTechHandle:  PATEL2857-ARIN\\nOrgTechHandle:  PEDER59-ARIN\\nSource:         ARIN\\n\n\nPOCHandle:      HARIM2-ARIN\\nIsRole:         Y\\nLastName:       Hari Modali\\nFirstName:      \\nStreet:         1188 East Arques Avenue\\nCity:           Sunnyvale\\nState/Prov:     CA\\nCountry:        US\\nPostalCode:     94085\\nRegDate:        2020-07-06\\nUpdated:        2021-07-21\\nOfficePhone:    +1-408-505-0444\\nMailbox:        hmodali@equinix.com\\nSource:         ARIN\\n\n\nPOCHandle:      EQ127-ARIN\\nIsRole:         Y\\nLastName:       Equinix Response Center\\nFirstName:      \\nStreet:         One Lagoon Drive\\nStreet:         4th Floor\\nCity:           Redwood City\\nState/Prov:     CA\\nCountry:        US\\nPostalCode:     94065\\nRegDate:        2002-06-14\\nUpdated:        2022-08-07\\nOfficePhone:    +1-650-598-6000\\nFaxPhone:       +1-650-598-6900\\nOfficePhone:    +1-866-378-4649\\nMailbox:        abuse@equinix.com\\nMailbox:        noc@equinix.com\\nMailbox:        support@equinix.com\\nSource:         ARIN\\n\n\nPOCHandle:      MIRWA-ARIN\\nIsRole:         N\\nLastName:       Mir\\nFirstName:      Waheed\\nStreet:         1188 E Arques Arve\\nCity:           Sunnyvale\\nState/Prov:     CA\\nCountry:        US\\nPostalCode:     94085\\nRegDate:        2021-01-21\\nUpdated:        2021-01-21\\nOfficePhone:    +1-855-403-9086\\nMailbox:        wmir@equinix.com\\nSource:         ARIN\\n\n\nPOCHandle:      NIWAZ-ARIN\\nIsRole:         N\\nLastName:       Niwaz\\nFirstName:      Shaukat\\nStreet:         11 Devonshire Square\\nCity:           London\\nState/Prov:     \\nCountry:        GB\\nPostalCode:     \\nRegDate:        2021-01-21\\nUpdated:        2021-01-21\\nOfficePhone:    +0845 373 2900\\nMailbox:        Shaukat.Niwaz@eu.equinix.com\\nSource:         ARIN\\n\n\nPOCHandle:      PEDER59-ARIN\\nIsRole:         N\\nLastName:       Pederson\\nFirstName:      Kris\\nStreet:         1735 Lundy\\nCity:           San Jose\\nState/Prov:     CA\\nCountry:        US\\nPostalCode:     95131\\nRegDate:        2017-08-17\\nUpdated:        2021-08-18\\nOfficePhone:    +1-408-454-2182\\nMailbox:        kpederson@equinix.com\\nSource:         ARIN\\n\n\nPOCHandle:      CAIRN10-ARIN\\nIsRole:         N\\nLastName:       Cairney\\nFirstName:      Paul\\nStreet:         London\\nCity:           London\\nState/Prov:     \\nCountry:        GB\\nPostalCode:     \\nRegDate:        2020-07-06\\nUpdated:        2022-07-15\\nOfficePhone:    +0845 373 2900\\nMailbox:        paul.cairney@eu.equinix.com\\nSource:         ARIN\\n\n\nPOCHandle:      EQ12-ARIN\\nIsRole:         Y\\nLastName:       Equinix NOC\\nFirstName:      \\nStreet:         One Lagoon Drive\\nStreet:         4th Floor\\nCity:           Redwood City\\nState/Prov:     CA\\nCountry:        US\\nPostalCode:     94065\\nRegDate:        2002-06-13\\nUpdated:        2021-08-23\\nFaxPhone:       +1-650-598-6900\\nOfficePhone:    +1-650-598-6000\\nMailbox:        noc@equinix.com\\nSource:         ARIN\\n\n\nPOCHandle:      PERRY482-ARIN\\nIsRole:         N\\nLastName:       Perry\\nFirstName:      Chris\\nStreet:         151 Front St. W\\nCity:           Toronto\\nState/Prov:     ON\\nCountry:        CA\\nPostalCode:     M5J 2N1\\nRegDate:        2021-10-04\\nUpdated:        2021-10-18\\nOfficePhone:    +1-416-277-0141\\nMailbox:        cperry@equinix.com\\nSource:         ARIN\\n\n\nPOCHandle:      INDRA-ARIN\\nIsRole:         N\\nLastName:       Indraji\\nFirstName:      Affandi\\nStreet:         1188 E Arques Ave\\nCity:           Sunnyvale\\nState/Prov:     CA\\nCountry:        US\\nPostalCode:     94085\\nRegDate:        2019-08-20\\nUpdated:        2019-08-20\\nOfficePhone:    +1-416-365-2279\\nMailbox:        affandi.indraji@equinix.com\\nSource:         ARIN\\n\n\nPOCHandle:      CARRI6-ARIN\\nIsRole:         N\\nLastName:       Carrillo\\nFirstName:      John\\nStreet:         1350 Duane Ave.\\nCity:           Santa Clara\\nState/Prov:     CA\\nCountry:        US\\nPostalCode:     95054\\nRegDate:        2010-12-07\\nUpdated:        2022-02-11\\nOfficePhone:    +1-408-486-3500\\nMailbox:        jcarrillo@equinix.com\\nSource:         ARIN\\n\n\nPOCHandle:      SHAHV1-ARIN\\nIsRole:         N\\nLastName:       Shah\\nFirstName:      Vijal\\nStreet:         11 Devonshire Square\\nCity:           London\\nState/Prov:     \\nCountry:        GB\\nPostalCode:     \\nRegDate:        2021-02-16\\nUpdated:        2022-02-16\\nOfficePhone:    +0845 373 2900\\nMailbox:        vijal.shah@eu.equinix.com\\nSource:         ARIN\\n\n\nPOCHandle:      PATEL2857-ARIN\\nIsRole:         N\\nLastName:       PATEL\\nFirstName:      TARKESHKUMAR\\nStreet:         5851 West Side Ave\\nCity:           North Bergen\\nState/Prov:     NJ\\nCountry:        US\\nPostalCode:     07047\\nRegDate:        2020-05-07\\nUpdated:        2021-05-07\\nOfficePhone:    +1-201-305-0108\\nMailbox:        tpatel@equinix.com\\nSource:         ARIN\\n"}, {"range": "2602:ff16::/36", "id": "SN-2602-FF16-36", "name": "Strasmore, Inc.", "country": "US", "domain": "strasmore.com", "org_id": "SN-74", "status": "ALLOCATION", "tech_id": "SHAMS20-ARIN", "mnt_id": "NONO4-ARIN", "admin_id": "MGC11-ARIN", "abuse_id": "NONO4-ARIN", "created": "2016-12-21", "updated": "2020-09-10", "source": "arin", "raw": "V6NetHandle:    NET6-2602-FF16-1\\nOrgID:          SN-74\\nParent:         NET6-2600-1\\nNetName:        SN-2602-FF16-36\\nNetRange:       2602:FF16:: - 2602:FF16:FFF:FFFF:FFFF:FFFF:FFFF:FFFF\\nNetType:        allocation\\nOriginAS:       29802, 54540\\nComment:        https://www.strasmore.com\\nComment:        https://www.ssdnodes.com\\nRegDate:        2016-12-21\\nUpdated:        2020-09-10\\nTechHandle:     SHAMS20-ARIN\\nSource:         ARIN\\n\n\nOrgID:          SN-74\\nOrgName:        Strasmore, Inc.\\nCanAllocate:    \\nStreet:         2522 Chambers Road Suite 100\\nCity:           Tustin\\nState/Prov:     CA\\nCountry:        US\\nPostalCode:     92780\\nComment:        https://www.ssdnodes.com\\nRegDate:        2013-03-19\\nUpdated:        2017-04-27\\nOrgAbuseHandle: NONO4-ARIN\\nOrgAdminHandle: MGC11-ARIN\\nOrgNOCHandle:   NONO4-ARIN\\nOrgTechHandle:  NONO4-ARIN\\nSource:         ARIN\\n\n\nPOCHandle:      MGC11-ARIN\\nIsRole:         N\\nLastName:       Connor\\nFirstName:      Matt\\nStreet:         2522 Chambers Road Suite 100\\nCity:           Tustin\\nState/Prov:     CA\\nCountry:        US\\nPostalCode:     92780\\nRegDate:        2013-03-18\\nUpdated:        2021-04-30\\nOfficePhone:    +1-949-438-0456\\nMailbox:        matt@strasmore.com\\nSource:         ARIN\\n\n\nPOCHandle:      SHAMS20-ARIN\\nIsRole:         N\\nLastName:       Shams\\nFirstName:      Kamal\\nStreet:         2522 Chambers Road Suite 100\\nCity:           Tustin\\nState/Prov:     CA\\nCountry:        US\\nPostalCode:     92780\\nRegDate:        2020-04-08\\nUpdated:        2022-04-08\\nOfficePhone:    +1-949-438-0456\\nMailbox:        kamal@ssdnodes.com\\nSource:         ARIN\\n\n\nPOCHandle:      NONO4-ARIN\\nIsRole:         N\\nLastName:       Network Operations\\nFirstName:      Network Operations\\nStreet:         2522 Chambers Road Suite 100\\nCity:           Tustin\\nState/Prov:     CA\\nCountry:        US\\nPostalCode:     92780\\nRegDate:        2016-02-19\\nUpdated:        2021-04-30\\nOfficePhone:    +1-949-438-0456\\nMailbox:        netops@strasmore.com\\nSource:         ARIN\\n"}, {"range": "8.4.229.0/24", "id": "LVLT-PF-171-8-4-229", "name": "PRACTICE FUSION, INC.", "country": "US", "domain": "practicefusion.com", "org_id": "PF-171", "status": "REASSIGNMENT", "tech_id": "NETWO6620-ARIN", "mnt_id": "NETWO6620-ARIN", "admin_id": "NETWO6620-ARIN", "abuse_id": "NETWO6620-ARIN", "created": "2016-09-07", "updated": "2016-09-07", "source": "arin", "raw": "NetHandle:      NET-8-4-229-0-1\\nOrgID:          PF-171\\nParent:         NET-8-0-0-0-1\\nNetName:        LVLT-PF-171-8-4-229\\nNetRange:       8.4.229.0 - 8.4.229.255\\nNetType:        reassignment\\nRegDate:        2016-09-07\\nUpdated:        2016-09-07\\nSource:         ARIN\\n\n\nOrgID:          PF-171\\nOrgName:        PRACTICE FUSION, INC.\\nCanAllocate:    \\nStreet:         650 Townsend Street\\nStreet:         Floor 5\\nCity:           San Francisco\\nState/Prov:     CA\\nCountry:        US\\nPostalCode:     94103\\nRegDate:        2014-03-05\\nUpdated:        2014-05-20\\nOrgAbuseHandle: NETWO6620-ARIN\\nOrgAdminHandle: NETWO6620-ARIN\\nOrgNOCHandle:   NETWO6620-ARIN\\nOrgTechHandle:  NETWO6620-ARIN\\nSource:         ARIN\\n\n\nPOCHandle:      NETWO6620-ARIN\\nIsRole:         Y\\nLastName:       NetworkOps\\nFirstName:      \\nStreet:         650 Townsend Street\\nStreet:         Floor 5\\nCity:           San Francisco\\nState/Prov:     CA\\nCountry:        US\\nPostalCode:     94103\\nRegDate:        2014-03-03\\nUpdated:        2020-04-22\\nOfficePhone:    +1-415-346-7700\\nMailbox:        _NetworkOps@practicefusion.com\\nSource:         ARIN\\n"}, {"range": "63.234.222.216/29", "id": "Q1014-63-234-222-216", "name": "APEX SYSTEMS", "country": "US", "domain": "apexsystemsinc.com", "org_id": "APEXS-40", "status": "REASSIGNMENT", "tech_id": "CARTE7-ARIN", "mnt_id": "CARTE7-ARIN", "admin_id": "CARTE7-ARIN", "abuse_id": "CARTE7-ARIN", "created": "2010-10-14", "updated": "2010-10-14", "source": "arin", "raw": "NetHandle:      NET-63-234-222-216-1\\nOrgID:          APEXS-40\\nParent:         NET-63-232-0-0-1\\nNetName:        Q1014-63-234-222-216\\nNetRange:       63.234.222.216 - 63.234.222.223\\nNetType:        reassignment\\nOriginAS:       209\\nComment:        PrimaryPrimary\\nRegDate:        2010-10-14\\nUpdated:        2010-10-14\\nAbuseHandle:    CARTE7-ARIN\\nNOCHandle:      CARTE7-ARIN\\nTechHandle:     CARTE7-ARIN\\nSource:         ARIN\\n\n\nOrgID:          APEXS-40\\nOrgName:        APEX SYSTEMS\\nCanAllocate:    \\nStreet:         512 TOWNSHIP LINE RD\\nStreet:         BLDG MAIN FLR 1 RM MAIN\\nCity:           BLUE BELL\\nState/Prov:     PA\\nCountry:        US\\nPostalCode:     19422\\nRegDate:        2010-10-14\\nUpdated:        2011-09-24\\nOrgAbuseHandle: CARTE7-ARIN\\nOrgAdminHandle: CARTE7-ARIN\\nOrgTechHandle:  CARTE7-ARIN\\nSource:         ARIN\\n\n\nPOCHandle:      CARTE7-ARIN\\nIsRole:         Y\\nLastName:       CARTER COREY\\nFirstName:      \\nStreet:         10205 WESTHEIMER RD\\nStreet:         BLDG MAIN FLR 4 RM MAIN\\nCity:           HOUSTON\\nState/Prov:     TX\\nCountry:        US\\nPostalCode:     77042\\nRegDate:        2010-09-30\\nUpdated:        2019-01-17\\nOfficePhone:    +1-804-237-8372\\nMailbox:        ccarter@apexsystemsinc.com\\nSource:         ARIN\\n"}, {"range": "199.96.104.0/22", "id": "HVDN-NET-D", "name": "HUDSON VALLEY DATANET, LLC", "country": "US", "domain": "hvdata.net", "org_id": "HVDN", "status": "ALLOCATION", "tech_id": "IPENG33-ARIN", "mnt_id": "NETWO7258-ARIN", "admin_id": "IPENG33-ARIN", "abuse_id": "ABUSE4944-ARIN", "created": "2012-02-06", "updated": "2014-12-18", "source": "arin", "raw": "NetHandle:      NET-199-96-104-0-1\\nOrgID:          HVDN\\nParent:         NET-199-0-0-0-0\\nNetName:        HVDN-NET-D\\nNetRange:       199.96.104.0 - 199.96.107.255\\nNetType:        allocation\\nOriginAS:       46887\\nRegDate:        2012-02-06\\nUpdated:        2014-12-18\\nAbuseHandle:    ABUSE4944-ARIN\\nNOCHandle:      NETWO7258-ARIN\\nTechHandle:     IPENG33-ARIN\\nSource:         ARIN\\n\n\nOrgID:          HVDN\\nOrgName:        HUDSON VALLEY DATANET, LLC\\nCanAllocate:    \\nStreet:         8020 Katy Freeway\\nCity:           Houston\\nState/Prov:     TX\\nCountry:        US\\nPostalCode:     77024\\nRegDate:        2001-11-26\\nUpdated:        2022-01-06\\nOrgAbuseHandle: ABUSE4944-ARIN\\nOrgAdminHandle: IPENG33-ARIN\\nOrgNOCHandle:   NETWO7258-ARIN\\nOrgTechHandle:  IPENG33-ARIN\\nSource:         ARIN\\n\n\nPOCHandle:      NETWO7258-ARIN\\nIsRole:         Y\\nLastName:       Network Operations\\nFirstName:      \\nStreet:         80 Central Street\\nCity:           Boxborough\\nState/Prov:     MA\\nCountry:        US\\nPostalCode:     01719\\nRegDate:        2014-12-18\\nUpdated:        2021-09-30\\nOfficePhone:    +1-978-264-6000\\nMailbox:        support@lightower.com\\nSource:         ARIN\\n\n\nPOCHandle:      ABUSE4944-ARIN\\nIsRole:         Y\\nLastName:       Abuse\\nFirstName:      \\nStreet:         8020 Katy Freeway\\nCity:           Houston\\nState/Prov:     TX\\nCountry:        US\\nPostalCode:     77024\\nRegDate:        2014-12-18\\nUpdated:        2022-01-13\\nOfficePhone:    +1-978-264-6000\\nMailbox:        abuse@lightower.com\\nSource:         ARIN\\n\n\nPOCHandle:      IPENG33-ARIN\\nIsRole:         Y\\nLastName:       IP Engineering\\nFirstName:      \\nStreet:         8020 Katy Freeway\\nCity:           Houston\\nState/Prov:     TX\\nCountry:        US\\nPostalCode:     77024\\nRegDate:        2014-12-18\\nUpdated:        2022-01-06\\nOfficePhone:    +1-855-933-4237\\nMailbox:        ipadmin@lightower.com\\nSource:         ARIN\\n"}, {"range": "144.217.201.12/30", "id": "HOSTZONE-BRAZIL-3920115", "name": "hostzone", "country": "BR", "domain": "hostzone.com.br", "org_id": "HOSTZ-2", "status": "REASSIGNMENT", "tech_id": "NOC32773-ARIN", "mnt_id": "NOC32773-ARIN", "admin_id": "ACN7-ARIN", "abuse_id": "ABUSE5835-ARIN", "created": "2017-03-10", "updated": "2017-03-12", "source": "arin", "raw": "NetHandle:      NET-144-217-201-12-1\\nOrgID:          HOSTZ-2\\nParent:         NET-144-217-0-0-1\\nNetName:        HOSTZONE-BRAZIL-3920115\\nNetRange:       144.217.201.12 - 144.217.201.15\\nNetType:        reassignment\\nOriginAS:       16276\\nRegDate:        2017-03-10\\nUpdated:        2017-03-12\\nSource:         ARIN\\n\n\nOrgID:          HOSTZ-2\\nOrgName:        hostzone\\nCanAllocate:    \\nStreet:         Av Pres Epitacio Pessoa\\nCity:           Joao Pessoa\\nState/Prov:     PB\\nCountry:        BR\\nPostalCode:     58037545\\nComment:        http://hostzone.com.br\\nComment:        Standard NOC hours are 9:00 AM to 11:00 PM GMT-3\\nRegDate:        2017-01-26\\nUpdated:        2018-01-25\\nOrgAbuseHandle: ABUSE5835-ARIN\\nOrgAdminHandle: ACN7-ARIN\\nOrgNOCHandle:   NOC32773-ARIN\\nOrgTechHandle:  NOC32773-ARIN\\nSource:         ARIN\\n\n\nPOCHandle:      ABUSE5835-ARIN\\nIsRole:         Y\\nLastName:       Abuse department\\nFirstName:      \\nStreet:         Rua Pres. Epitacio Pessoa\\nCity:           Joao Pessoa\\nState/Prov:     PB\\nCountry:        BR\\nPostalCode:     58037-000\\nRegDate:        2017-01-25\\nUpdated:        2019-03-10\\nOfficePhone:    +05583994042743\\nMailbox:        abuse@hostzone.com.br\\nSource:         ARIN\\n\n\nPOCHandle:      NOC32773-ARIN\\nIsRole:         Y\\nLastName:       Network Operation Center\\nFirstName:      \\nStreet:         Avenida Vinte e Sete de Julho\\nCity:           Campina Grande\\nState/Prov:     PB\\nCountry:        BR\\nPostalCode:     58429-130\\nRegDate:        2018-01-25\\nUpdated:        2018-01-25\\nOfficePhone:    +551142007772\\nMailbox:        contato@hostzone.com.br\\nSource:         ARIN\\n\n\nPOCHandle:      ACN7-ARIN\\nIsRole:         N\\nLastName:       Neto\\nFirstName:      Aldemaro\\nStreet:         Rua Pres. Epitacio Pessoa\\nCity:           Joao Pessoa\\nState/Prov:     PB\\nCountry:        BR\\nPostalCode:     58037-000\\nRegDate:        2017-01-25\\nUpdated:        2019-01-25\\nOfficePhone:    +05583994042743\\nMailbox:        contato@hostzone.com.br\\nSource:         ARIN\\n"}, {"range": "199.30.48.0/21", "id": "COMCE-4", "name": "COMCELL INC.", "country": "US", "domain": "comcell.net", "org_id": "COMCE-4", "status": "ALLOCATION", "tech_id": "ABUSE8472-ARIN", "mnt_id": "ABUSE8472-ARIN", "admin_id": "MLH38-ARIN", "abuse_id": "ABUSE8472-ARIN", "created": "2021-08-19", "updated": "2021-08-19", "source": "arin", "raw": "NetHandle:      NET-199-30-48-0-1\\nOrgID:          COMCE-4\\nParent:         NET-199-0-0-0-0\\nNetName:        COMCE-4\\nNetRange:       199.30.48.0 - 199.30.55.255\\nNetType:        allocation\\nRegDate:        2021-08-19\\nUpdated:        2021-08-19\\nSource:         ARIN\\n\n\nOrgID:          COMCE-4\\nOrgName:        COMCELL INC.\\nCanAllocate:    \\nStreet:         P.O. BOX 130\\nStreet:         10184 ST HWY 25E\\nCity:           WINDTHORST\\nState/Prov:     TX\\nCountry:        US\\nPostalCode:     76389\\nComment:        HTTP://WWW.COMCELL.NET\\nRegDate:        2008-04-18\\nUpdated:        2022-06-15\\nOrgAbuseHandle: ABUSE8472-ARIN\\nOrgAdminHandle: MLH38-ARIN\\nOrgDNSHandle:   ABUSE8472-ARIN\\nOrgNOCHandle:   ABUSE8472-ARIN\\nOrgRoutingHandle:   ABUSE8472-ARIN\\nOrgTechHandle:  ABUSE8472-ARIN\\nSource:         ARIN\\n\n\nPOCHandle:      MLH38-ARIN\\nIsRole:         N\\nLastName:       Humpert\\nFirstName:      Mike\\nStreet:         p.o. box 130\\nStreet:         10184 St hwy 25e\\nCity:           Windthorst\\nState/Prov:     TX\\nCountry:        US\\nPostalCode:     76389\\nRegDate:        2008-04-18\\nUpdated:        2020-10-19\\nMobilePhone:    +1-940-237-2234\\nOfficePhone:    +1-940-237-2234\\nFaxPhone:       +1-940-423-2111\\nMailbox:        mikeh@comcell.net\\nSource:         ARIN\\n\n\nPOCHandle:      ABUSE8472-ARIN\\nIsRole:         Y\\nLastName:       abuse contact\\nFirstName:      \\nStreet:         10184 State Highway 25\\nStreet:         PO Box 130\\nCity:           Windthorst\\nState/Prov:     TX\\nCountry:        US\\nPostalCode:     76389\\nRegDate:        2022-06-15\\nUpdated:        2022-06-15\\nOfficePhone:    +1-940-423-6201\\nMailbox:        abuse@comcell.net\\nSource:         ARIN\\n"}, {"range": "216.12.89.64/26", "id": "NTELO-216-12-89-64-HCS", "name": "Helix Computer Systems, Inc.", "country": "US", "domain": "helixsystems.com", "org_id": "HXPC", "status": "REASSIGNMENT", "tech_id": "CLG8-ARIN\\NNOC3167-ARIN", "mnt_id": "NOC3167-ARIN", "admin_id": "AOB1-ARIN", "abuse_id": "NOC3167-ARIN", "created": "2005-12-14", "updated": "2005-12-14", "source": "arin", "raw": "NetHandle:      NET-216-12-89-64-1\\nOrgID:          HXPC\\nParent:         NET-216-12-0-0-1\\nNetName:        NTELO-216-12-89-64-HCS\\nNetRange:       216.12.89.64 - 216.12.89.127\\nNetType:        reassignment\\nRegDate:        2005-12-14\\nUpdated:        2005-12-14\\nSource:         ARIN\\n\n\nOrgID:          HXPC\\nOrgName:        Helix Computer Systems, Inc.\\nCanAllocate:    \\nStreet:         700 Harris St. Suite 103\\nCity:           Charlottesville\\nState/Prov:     VA\\nCountry:        US\\nPostalCode:     22903\\nRegDate:        2000-10-26\\nUpdated:        2017-01-28\\nReferralServer: rwhois://rwhois.helixsystems.com:4321\\nOrgAbuseHandle: NOC3167-ARIN\\nOrgAdminHandle: AOB1-ARIN\\nOrgNOCHandle:   NOC3167-ARIN\\nOrgTechHandle:  CLG8-ARIN\\nOrgTechHandle:  NOC3167-ARIN\\nSource:         ARIN\\n\n\nPOCHandle:      CLG8-ARIN\\nIsRole:         N\\nLastName:       Guillot\\nFirstName:      Clint\\nStreet:         3024 Palm Vista Dr.\\nCity:           Kenner\\nState/Prov:     LA\\nCountry:        US\\nPostalCode:     70065\\nRegDate:        2007-08-20\\nUpdated:        2021-02-28\\nOfficePhone:    +1-504-456-0030\\nMailbox:        clint@xenir.com\\nSource:         ARIN\\n\n\nPOCHandle:      AOB1-ARIN\\nIsRole:         N\\nLastName:       Obrien\\nFirstName:      Anthony\\nStreet:         2401 Hydraulic Rd.\\nCity:           Charlottesville\\nState/Prov:     VA\\nCountry:        US\\nPostalCode:     22901\\nRegDate:        2003-06-30\\nUpdated:        2022-02-28\\nOfficePhone:    +1-434-963-4900\\nMailbox:        tony@helixsystems.com\\nSource:         ARIN\\n\n\nPOCHandle:      NOC3167-ARIN\\nIsRole:         Y\\nLastName:       Network Operations Center\\nFirstName:      \\nStreet:         700 Harris St\\nStreet:         Suite 103\\nCity:           Charlottesville\\nState/Prov:     VA\\nCountry:        US\\nPostalCode:     22903\\nRegDate:        2008-07-22\\nUpdated:        2021-02-28\\nOfficePhone:    +1-434-817-7809\\nMailbox:        noc@helixsystems.com\\nSource:         ARIN\\n"}, {"range": "198.168.5.0/24", "id": "PELMOREX-CORP-IPV4", "name": "Pelmorex Corp", "country": "CA", "domain": "pelmorex.com", "org_id": "PC-2167", "status": "ALLOCATION", "tech_id": "MS2363-ARIN\\NPOTAP1-ARIN", "mnt_id": "MS2363-ARIN\\NPOTAP1-ARIN", "admin_id": "POTAP1-ARIN", "abuse_id": "MS2363-ARIN", "created": "1993-07-12", "updated": "2021-12-14", "source": "arin", "raw": "NetHandle:      NET-198-168-5-0-1\\nOrgID:          PC-2167\\nParent:         NET-198-0-0-0-0\\nNetName:        PELMOREX-CORP-IPV4\\nNetRange:       198.168.5.0 - 198.168.5.255\\nNetType:        allocation\\nRegDate:        1993-07-12\\nUpdated:        2021-12-14\\nSource:         ARIN\\n\n\nOrgID:          PC-2167\\nOrgName:        Pelmorex Corp\\nCanAllocate:    \\nStreet:         2655 Bristol Circle\\nCity:           Oakville\\nState/Prov:     ON\\nCountry:        CA\\nPostalCode:     L6H 7W1\\nComment:        https://www.pelmorex.com/\\nComment:        Standard NOC hours are 24x7\\nComment:        support@pelmorex.com\\nRegDate:        2019-12-02\\nUpdated:        2020-10-27\\nOrgAbuseHandle: MS2363-ARIN\\nOrgAbuseHandle: POTAP1-ARIN\\nOrgAdminHandle: POTAP1-ARIN\\nOrgDNSHandle:   POTAP1-ARIN\\nOrgNOCHandle:   MS2363-ARIN\\nOrgNOCHandle:   POTAP1-ARIN\\nOrgRoutingHandle:   POTAP1-ARIN\\nOrgTechHandle:  MS2363-ARIN\\nOrgTechHandle:  POTAP1-ARIN\\nSource:         ARIN\\n\n\nPOCHandle:      MS2363-ARIN\\nIsRole:         N\\nLastName:       Semghouni\\nFirstName:      Mounir\\nStreet:         2655 BRISTOL CIRCLE\\nCity:           Oakville\\nState/Prov:     ON\\nCountry:        CA\\nPostalCode:     L6H 7W1\\nRegDate:        2001-10-17\\nUpdated:        2021-09-08\\nMobilePhone:    +1-289-981-9770\\nOfficePhone:    +1-289-981-9770\\nMailbox:        msemghouni@pelmorex.com\\nSource:         ARIN\\n\n\nPOCHandle:      POTAP1-ARIN\\nIsRole:         N\\nLastName:       Potapov\\nFirstName:      Yuri\\nStreet:         2655 Bristol Circle\\nCity:           Oakville\\nState/Prov:     ON\\nCountry:        CA\\nPostalCode:     L6H 7W1\\nRegDate:        2019-11-26\\nUpdated:        2021-11-25\\nMobilePhone:    +1-416-844-1442\\nOfficePhone:    +1-905-829-1159\\nMailbox:        ypotapov@pelmorex.com\\nSource:         ARIN\\n"}, {"range": "208.75.176.0/21", "id": "COLOCATEUSA-BLK-1", "name": "ColocateUSA", "country": "US", "domain": "colocateusa.net", "org_id": "TSL-46", "status": "ALLOCATION", "tech_id": "SUPPO110-ARIN", "mnt_id": "SUPPO110-ARIN", "admin_id": "ARINM5-ARIN", "abuse_id": "ABUSE1546-ARIN", "created": "2007-03-02", "updated": "2012-02-24", "source": "arin", "raw": "NetHandle:      NET-208-75-176-0-1\\nOrgID:          TSL-46\\nParent:         NET-208-0-0-0-0\\nNetName:        COLOCATEUSA-BLK-1\\nNetRange:       208.75.176.0 - 208.75.183.255\\nNetType:        allocation\\nOriginAS:       40431\\nComment:        http://www.ColocateUSA.com\\nRegDate:        2007-03-02\\nUpdated:        2012-02-24\\nAbuseHandle:    ABUSE1546-ARIN\\nNOCHandle:      SUPPO110-ARIN\\nTechHandle:     SUPPO110-ARIN\\nSource:         ARIN\\n\n\nOrgID:          TSL-46\\nOrgName:        ColocateUSA\\nCanAllocate:    \\nStreet:         2777 N Stemmons Frwy, Suite 1655\\nCity:           Dallas\\nState/Prov:     TX\\nCountry:        US\\nPostalCode:     75207\\nRegDate:        2004-08-09\\nUpdated:        2022-06-14\\nOrgAbuseHandle: ABUSE1546-ARIN\\nOrgAdminHandle: ARINM5-ARIN\\nOrgNOCHandle:   SUPPO110-ARIN\\nOrgTechHandle:  SUPPO110-ARIN\\nSource:         ARIN\\n\n\nPOCHandle:      ABUSE1546-ARIN\\nIsRole:         Y\\nLastName:       Abuse Complaints\\nFirstName:      \\nStreet:         2777 Stemmons Frwy, Suite 1655\\nCity:           Dallas\\nState/Prov:     TX\\nCountry:        US\\nPostalCode:     75207\\nRegDate:        2007-01-07\\nUpdated:        2022-01-07\\nOfficePhone:    +1-214-467-8464\\nMailbox:        abuse@colocateusa.com\\nSource:         ARIN\\n\n\nPOCHandle:      ARINM5-ARIN\\nIsRole:         Y\\nLastName:       ARIN Manager\\nFirstName:      \\nStreet:         2777 N. Stemmons Fwy., Suite 1655\\nCity:           Dallas\\nState/Prov:     TX\\nCountry:        US\\nPostalCode:     75207\\nRegDate:        2017-08-11\\nUpdated:        2021-10-13\\nOfficePhone:    +1-214-467-8464\\nMailbox:        arin@colocateusa.com\\nSource:         ARIN\\n\n\nPOCHandle:      SUPPO110-ARIN\\nIsRole:         Y\\nLastName:       Support\\nFirstName:      \\nStreet:         2777 Stemmons Frwy, Suite 1655\\nCity:           Dallas\\nState/Prov:     TX\\nCountry:        US\\nPostalCode:     75207\\nRegDate:        2004-08-09\\nUpdated:        2021-12-16\\nOfficePhone:    +1-214-467-8464\\nMailbox:        support@colocateusa.net\\nSource:         ARIN\\n"}, {"range": "208.253.13.16/28", "id": "UU-208-253-13-16-D2", "name": "Bandwidth.com Inc.", "country": "US", "domain": "bandwidth.com", "org_id": "BNO", "status": "REALLOCATION", "tech_id": "BCNO1-ARIN", "mnt_id": "BNO13-ARIN", "admin_id": "BCNO1-ARIN", "abuse_id": "BCNO1-ARIN", "created": "2010-08-11", "updated": "2010-08-11", "source": "arin", "raw": "NetHandle:      NET-208-253-13-16-1\\nOrgID:          BNO\\nParent:         NET-208-192-0-0-1\\nNetName:        UU-208-253-13-16-D2\\nNetRange:       208.253.13.16 - 208.253.13.31\\nNetType:        reallocation\\nComment:        Addresses within this block are non-portable.\\nRegDate:        2010-08-11\\nUpdated:        2010-08-11\\nAbuseHandle:    ABUSE3-ARIN\\nSource:         ARIN\\n\n\nOrgID:          BNO\\nOrgName:        Bandwidth.com Inc.\\nCanAllocate:    \\nStreet:         900 Main Campus Drive\\nCity:           Raleigh\\nState/Prov:     NC\\nCountry:        US\\nPostalCode:     27606\\nRegDate:        2003-11-17\\nUpdated:        2014-03-17\\nOrgAbuseHandle: BCNO1-ARIN\\nOrgAdminHandle: BCNO1-ARIN\\nOrgNOCHandle:   BNO13-ARIN\\nOrgTechHandle:  BCNO1-ARIN\\nSource:         ARIN\\n\n\nPOCHandle:      BNO13-ARIN\\nIsRole:         Y\\nLastName:       Bandwidth Network Operations\\nFirstName:      \\nStreet:         4001 Weston Parkway\\nStreet:         Suite 100\\nCity:           Cary\\nState/Prov:     NC\\nCountry:        US\\nPostalCode:     27513\\nRegDate:        2003-11-17\\nUpdated:        2014-11-07\\nOfficePhone:    +1-800-409-4357\\nMailbox:        networkservices@bandwidth.com\\nSource:         ARIN\\n\n\nPOCHandle:      BCNO1-ARIN\\nIsRole:         Y\\nLastName:       Customer Care Department\\nFirstName:      \\nStreet:         900 Main Campus Drive\\nCity:           Raleigh\\nState/Prov:     NC\\nCountry:        US\\nPostalCode:     27606\\nRegDate:        2003-11-17\\nUpdated:        2015-03-17\\nOfficePhone:    +1-800-808-5150\\nMailbox:        support@broadband.com\\nSource:         ARIN\\n\n\nPOCHandle:      ABUSE3-ARIN\\nIsRole:         Y\\nLastName:       abuse\\nFirstName:      \\nStreet:         22001 Loudoun County Parkway\\nCity:           Ashburn\\nState/Prov:     VA\\nCountry:        US\\nPostalCode:     20147\\nRegDate:        2002-08-24\\nUpdated:        2021-06-27\\nOfficePhone:    +1-800-900-0241\\nMailbox:        abuse-mail@verizonbusiness.com\\nSource:         ARIN\\n"}, {"range": "216.158.128.0/19", "id": "PILOT-US-8", "name": "Pilot Fiber, Inc.", "country": "US", "domain": "pilotfiber.com", "org_id": "PF-176", "status": "ALLOCATION", "tech_id": "NETWO6963-ARIN\\NTYPAL1-ARIN", "mnt_id": "NETWO6963-ARIN", "admin_id": "NETWO6963-ARIN", "abuse_id": "ABUSE7999-ARIN", "created": "2018-03-06", "updated": "2018-07-13", "source": "arin", "raw": "NetHandle:      NET-216-158-128-0-1\\nOrgID:          PF-176\\nParent:         NET-216-0-0-0-0\\nNetName:        PILOT-US-8\\nNetRange:       216.158.128.0 - 216.158.159.255\\nNetType:        allocation\\nRegDate:        2018-03-06\\nUpdated:        2018-07-13\\nSource:         ARIN\\n\n\nOrgID:          PF-176\\nOrgName:        Pilot Fiber, Inc.\\nCanAllocate:    \\nStreet:         1115 Broadway\\nStreet:         Floor 12\\nCity:           New York\\nState/Prov:     NY\\nCountry:        US\\nPostalCode:     10010\\nComment:        Pilot Network Operations \\nComment:        NOC Phone: 855-578-5500 \\nComment:        NOC Email: noc@pilotfiber.com\\nComment:        Website: pilotfiber.com \\nComment:        Normal business hours are M-F 9A-6P EST, Network Operations Center is reachable for network related incidents 24/7.\\nRegDate:        2014-05-22\\nUpdated:        2020-09-28\\nOrgAbuseHandle: ABUSE7999-ARIN\\nOrgAdminHandle: NETWO6963-ARIN\\nOrgNOCHandle:   NETWO6963-ARIN\\nOrgTechHandle:  NETWO6963-ARIN\\nOrgTechHandle:  TYPAL1-ARIN\\nSource:         ARIN\\n\n\nPOCHandle:      ABUSE7999-ARIN\\nIsRole:         Y\\nLastName:       Abuse\\nFirstName:      \\nStreet:         1115 Broadway\\nStreet:         Floor 12\\nCity:           New York\\nState/Prov:     NY\\nCountry:        US\\nPostalCode:     10010\\nRegDate:        2020-09-28\\nUpdated:        2021-10-25\\nOfficePhone:    +1-855-578-5500\\nMailbox:        abuse@pilotfiber.com\\nSource:         ARIN\\n\n\nPOCHandle:      NETWO6963-ARIN\\nIsRole:         Y\\nLastName:       Network Operations\\nFirstName:      \\nStreet:         1115 Broadway \\nStreet:         Floor 12\\nCity:           New York\\nState/Prov:     NY\\nCountry:        US\\nPostalCode:     10010\\nRegDate:        2014-05-20\\nUpdated:        2021-09-27\\nOfficePhone:    +1-855-578-5500\\nMailbox:        ip-admin@pilotfiber.com\\nSource:         ARIN\\n\n\nPOCHandle:      TYPAL1-ARIN\\nIsRole:         N\\nLastName:       Typaldos\\nFirstName:      Alexander\\nStreet:         1115 Broadway\\nStreet:         Floor 12\\nCity:           New York\\nState/Prov:     NY\\nCountry:        US\\nPostalCode:     10010\\nRegDate:        2020-01-23\\nUpdated:        2021-10-25\\nOfficePhone:    +1-332-900-1200\\nMobilePhone:    +1-973-819-1678\\nMailbox:        atypaldos@pilotfiber.com\\nSource:         ARIN\\n"}, {"range": "173.14.138.28/30", "id": "BOA", "name": "Bank of America, National Association", "country": "US", "domain": "bankofamerica.com", "org_id": "BANKOF-2", "status": "REALLOCATION", "tech_id": "LAU-ARIN\\NSPD3-ARIN\\NZB29-ARIN", "mnt_id": "ZB29-ARIN", "admin_id": "ZB29-ARIN", "abuse_id": "ABUSE608-ARIN", "created": "2021-07-02", "updated": "2021-07-02", "source": "arin", "raw": "NetHandle:      NET-173-14-138-28-1\\nOrgID:          BANKOF-2\\nParent:         NET-173-14-128-0-1\\nNetName:        BOA\\nNetRange:       173.14.138.28 - 173.14.138.31\\nNetType:        reallocation\\nRegDate:        2021-07-02\\nUpdated:        2021-07-02\\nSource:         ARIN\\n\n\nOrgID:          BANKOF-2\\nOrgName:        Bank of America, National Association\\nCanAllocate:    \\nStreet:         Bank of America Corporation\\nStreet:         100 North Tryon Street\\nCity:           Charlotte\\nState/Prov:     NC\\nCountry:        US\\nPostalCode:     28255\\nComment:        For abuse issues contact abuse@bankofamerica.com\\nRegDate:        1992-01-06\\nUpdated:        2022-04-25\\nOrgAbuseHandle: ABUSE608-ARIN\\nOrgAdminHandle: ZB29-ARIN\\nOrgNOCHandle:   ZB29-ARIN\\nOrgTechHandle:  LAU-ARIN\\nOrgTechHandle:  SPD3-ARIN\\nOrgTechHandle:  ZB29-ARIN\\nSource:         ARIN\\n\n\nPOCHandle:      SPD3-ARIN\\nIsRole:         N\\nLastName:       Dornan\\nFirstName:      Sean\\nStreet:         30650 23 MILE RD\\nCity:           Chesterfield\\nState/Prov:     MI\\nCountry:        US\\nPostalCode:     48047\\nRegDate:        2016-01-04\\nUpdated:        2021-01-04\\nOfficePhone:    +1-586-273-1444\\nMobilePhone:    +1-586-876-7947\\nMailbox:        sean.dornan@bankofamerica.com\\nSource:         ARIN\\n\n\nPOCHandle:      LAU-ARIN\\nIsRole:         N\\nLastName:       Uribarri\\nFirstName:      Luis\\nStreet:         330 N Mesa St\\nCity:           El Paso\\nState/Prov:     TX\\nCountry:        US\\nPostalCode:     79901\\nRegDate:        2003-03-19\\nUpdated:        2021-12-07\\nOfficePhone:    +1-646-556-2742\\nMailbox:        luis.a.uribarri@bofa.com\\nSource:         ARIN\\n\n\nPOCHandle:      ZB29-ARIN\\nIsRole:         Y\\nLastName:       HOSTMASTER\\nFirstName:      \\nStreet:         ATTN: Patrick O'Hagerty\\nStreet:         Mailcode NC1-003-03-95\\nStreet:         901 West Trade Street\\nCity:           Charlotte\\nState/Prov:     NC\\nCountry:        US\\nPostalCode:     28255\\nRegDate:        2000-05-09\\nUpdated:        2021-12-10\\nMobilePhone:    +1-518-708-9371\\nOfficePhone:    +1-980-387-3750\\nMailbox:        HOSTMASTER@bankofamerica.com\\nMailbox:        patrick.ohagerty@bofa.com\\nSource:         ARIN\\n\n\nPOCHandle:      ABUSE608-ARIN\\nIsRole:         Y\\nLastName:       ABUSE\\nFirstName:      \\nStreet:         200 S. COLLEGE STREET\\nStreet:         NC1-014-14-04\\nCity:           CHARLOTTE\\nState/Prov:     NC\\nCountry:        US\\nPostalCode:     28255\\nRegDate:        2004-04-14\\nUpdated:        2018-11-05\\nOfficePhone:    +1-704-386-5000\\nMailbox:        ABUSE@bankofamerica.com\\nSource:         ARIN\\n"}, {"range": "64.211.211.188/30", "id": "LVLT-64-211-211-188-30", "name": "Greenberg Traurig P.A", "country": "US", "domain": "gtlaw.com", "org_id": "GTP-16", "status": "REASSIGNMENT", "tech_id": "ARMEN4-ARIN\\NSMO239-ARIN", "mnt_id": "ARMEN4-ARIN\\NSMO239-ARIN", "admin_id": "ARMEN4-ARIN", "abuse_id": "ARMEN4-ARIN", "created": "2021-05-07", "updated": "2022-08-15", "source": "arin", "raw": "NetHandle:      NET-64-211-211-188-1\\nOrgID:          GTP-16\\nParent:         NET-64-211-163-0-1\\nNetName:        LVLT-64-211-211-188-30\\nNetRange:       64.211.211.188 - 64.211.211.191\\nNetType:        reassignment\\nOriginAS:       19482\\nRegDate:        2021-05-07\\nUpdated:        2022-08-15\\nSource:         ARIN\\n\n\nOrgID:          GTP-16\\nOrgName:        Greenberg Traurig P.A\\nCanAllocate:    \\nStreet:         333 Avenue of Americas\\nCity:           Miami\\nState/Prov:     FL\\nCountry:        US\\nPostalCode:     33131\\nComment:        http://www.gtlaw.com\\nComment:        noc@gtlaw.com\\nRegDate:        2012-11-15\\nUpdated:        2013-12-16\\nOrgAbuseHandle: ARMEN4-ARIN\\nOrgAbuseHandle: SMO239-ARIN\\nOrgAdminHandle: ARMEN4-ARIN\\nOrgNOCHandle:   ARMEN4-ARIN\\nOrgNOCHandle:   SMO239-ARIN\\nOrgTechHandle:  ARMEN4-ARIN\\nOrgTechHandle:  SMO239-ARIN\\nSource:         ARIN\\n\n\nPOCHandle:      ARMEN4-ARIN\\nIsRole:         N\\nLastName:       Armenteros\\nFirstName:      Angelo\\nStreet:         8400 NW 36th Street\\nStreet:         Suite 400\\nCity:           Miami\\nState/Prov:     FL\\nCountry:        US\\nPostalCode:     33166\\nRegDate:        2012-11-14\\nUpdated:        2021-12-22\\nOfficePhone:    +1-305-418-6200\\nMailbox:        armenterosa@gtlaw.com\\nSource:         ARIN\\n\n\nPOCHandle:      SMO239-ARIN\\nIsRole:         N\\nLastName:       Osterbauer\\nFirstName:      Scott\\nStreet:         2375 E. Camelback Road\\nStreet:         Suite 700\\nCity:           Phoenix\\nState/Prov:     AZ\\nCountry:        US\\nPostalCode:     85016\\nRegDate:        2012-11-14\\nUpdated:        2021-01-05\\nOfficePhone:    +1-602-445-8164\\nMailbox:        osterbauers@gtlaw.com\\nSource:         ARIN\\n"}, {"range": "24.42.165.0/24", "id": "PINE24421650", "name": "KNOLOGY,  Inc.", "country": "US", "domain": "knology.com", "org_id": "KNOW", "status": "REASSIGNMENT", "tech_id": "IK59-ARIN", "mnt_id": "NETIP-ARIN", "admin_id": "BDN8-ARIN", "abuse_id": "IPADM469-ARIN", "created": "2009-03-18", "updated": "2009-03-18", "source": "arin", "raw": "NetHandle:      NET-24-42-165-0-1\\nOrgID:          KNOW\\nParent:         NET-24-42-128-0-1\\nNetName:        PINE24421650\\nNetRange:       24.42.165.0 - 24.42.165.255\\nNetType:        reassignment\\nRegDate:        2009-03-18\\nUpdated:        2009-03-18\\nTechHandle:     IK59-ARIN\\nSource:         ARIN\\n\n\nOrgID:          KNOW\\nOrgName:        KNOLOGY,  Inc.\\nCanAllocate:    \\nStreet:         1241 OG Skinner Drive\\nCity:           West Point\\nState/Prov:     GA\\nCountry:        US\\nPostalCode:     31833\\nRegDate:        1998-09-09\\nUpdated:        2019-08-22\\nOrgAbuseHandle: IPADM469-ARIN\\nOrgAbuseHandle: MALON196-ARIN\\nOrgAbuseHandle: NETIP-ARIN\\nOrgAdminHandle: BDN8-ARIN\\nOrgNOCHandle:   NETIP-ARIN\\nOrgTechHandle:  IPADM669-ARIN\\nOrgTechHandle:  MALON196-ARIN\\nOrgTechHandle:  NETIP-ARIN\\nSource:         ARIN\\n\n\nPOCHandle:      BDN8-ARIN\\nIsRole:         N\\nLastName:       Nabors\\nFirstName:      Brian\\nStreet:         11675 Rainwater Dr, suite 650\\nCity:           Alpharetta\\nState/Prov:     GA\\nCountry:        US\\nPostalCode:     30009\\nRegDate:        2019-03-29\\nUpdated:        2022-02-01\\nOfficePhone:    +1-706-585-0761\\nMailbox:        brian.nabors@wowinc.com\\nSource:         ARIN\\n\n\nPOCHandle:      NETIP-ARIN\\nIsRole:         Y\\nLastName:       NetIPAdmin\\nFirstName:      \\nStreet:         1241 O.G. Skinner Drive\\nCity:           West Point\\nState/Prov:     GA\\nCountry:        US\\nPostalCode:     31833\\nRegDate:        2012-07-27\\nUpdated:        2021-03-16\\nOfficePhone:    +1-706-645-8510\\nMobilePhone:    +1-770-597-7914\\nMailbox:        brian.nabors@wowinc.com\\nMailbox:        armand.demas@wowinc.com\\nSource:         ARIN\\n\n\nPOCHandle:      IK59-ARIN\\nIsRole:         Y\\nLastName:       KNOLOGY Holdings Inc\\nFirstName:      \\nStreet:         1241 OG Skinner Drive\\nCity:           West Point\\nState/Prov:     GA\\nCountry:        US\\nPostalCode:     31833\\nRegDate:        2001-07-10\\nUpdated:        2016-05-12\\nOfficePhone:    +1-706-634-2898\\nMailbox:        ipadmin@wideopenwest.com\\nSource:         ARIN\\n\n\nPOCHandle:      IPADM469-ARIN\\nIsRole:         Y\\nLastName:       IP Administrator\\nFirstName:      \\nStreet:         1241 O.G. Skinner Dr.\\nCity:           West Point\\nState/Prov:     GA\\nCountry:        US\\nPostalCode:     31833\\nRegDate:        2009-03-20\\nUpdated:        2016-10-04\\nOfficePhone:    +1-706-645-8194\\nMailbox:        abuse@wideopenwest.com\\nSource:         ARIN\\n\n\nPOCHandle:      IPADM669-ARIN\\nIsRole:         Y\\nLastName:       IP Administrator\\nFirstName:      \\nStreet:         1241 OG Skinner Drive\\nCity:           West Point\\nState/Prov:     GA\\nCountry:        US\\nPostalCode:     31833\\nRegDate:        2013-08-27\\nUpdated:        2018-09-10\\nOfficePhone:    +1-706-634-2898\\nMailbox:        ipadmin@wowinc.com\\nSource:         ARIN\\n\n\nPOCHandle:      MALON196-ARIN\\nIsRole:         N\\nLastName:       malone\\nFirstName:      mearran\\nStreet:         11675 Rainwater Dr.\\nCity:           Alpharetta\\nState/Prov:     GA\\nCountry:        US\\nPostalCode:     30009\\nRegDate:        2019-08-22\\nUpdated:        2019-08-22\\nOfficePhone:    +1-706-501-8323\\nMailbox:        aaron.malone@wowinc.com\\nSource:         ARIN\\n"}, {"range": "67.217.24.0/22", "id": "SCN-67-217-24-0-1", "name": "Smart City Networks, L.P.", "country": "US", "domain": "smartcitynetworks.com", "org_id": "SCNC-1", "status": "ALLOCATION", "tech_id": "ENGIN223-ARIN\\NJOSEP286-ARIN\\NPROSS23-ARIN\\NSAKIM-ARIN\\NZARHA-ARIN", "mnt_id": "SCN-ARIN", "admin_id": "DL571-ARIN", "abuse_id": "ABUSE4847-ARIN", "created": "2014-06-02", "updated": "2017-06-13", "source": "arin", "raw": "NetHandle:      NET-67-217-24-0-1\\nOrgID:          SCNC-1\\nParent:         NET-67-0-0-0-0\\nNetName:        SCN-67-217-24-0-1\\nNetRange:       67.217.24.0 - 67.217.27.255\\nNetType:        allocation\\nRegDate:        2014-06-02\\nUpdated:        2017-06-13\\nSource:         ARIN\\n\n\nOrgID:          SCNC-1\\nOrgName:        Smart City Networks, L.P.\\nCanAllocate:    \\nStreet:         5795 W. Badura Ave. Ste.110\\nCity:           Las Vegas\\nState/Prov:     NV\\nCountry:        US\\nPostalCode:     89118\\nComment:        Smart City Networks Corporate Office.\\nRegDate:        2002-09-26\\nUpdated:        2022-08-04\\nOrgAbuseHandle: ABUSE4847-ARIN\\nOrgAdminHandle: DL571-ARIN\\nOrgNOCHandle:   SCN-ARIN\\nOrgTechHandle:  ENGIN223-ARIN\\nOrgTechHandle:  JOSEP286-ARIN\\nOrgTechHandle:  PROSS23-ARIN\\nOrgTechHandle:  SAKIM-ARIN\\nOrgTechHandle:  ZARHA-ARIN\\nSource:         ARIN\\n\n\nPOCHandle:      ABUSE4847-ARIN\\nIsRole:         Y\\nLastName:       Abuse\\nFirstName:      \\nStreet:         5795 W. Badura Ave Ste.110\\nCity:           Las Vegas\\nState/Prov:     NV\\nCountry:        US\\nPostalCode:     89118\\nRegDate:        2014-09-12\\nUpdated:        2018-09-13\\nOfficePhone:    +1-702-943-6059\\nMailbox:        abuse@smartcity.com\\nSource:         ARIN\\n\n\nPOCHandle:      SCN-ARIN\\nIsRole:         Y\\nLastName:       Smart City NOC\\nFirstName:      \\nStreet:         5795 West Badura Avenue\\nStreet:         Suite 110\\nCity:           Las Vegas\\nState/Prov:     NV\\nCountry:        US\\nPostalCode:     89118\\nRegDate:        2002-09-24\\nUpdated:        2022-07-20\\nOfficePhone:    +1-702-967-9302\\nMailbox:        support@smartcity.com\\nSource:         ARIN\\n\n\nPOCHandle:      ENGIN223-ARIN\\nIsRole:         Y\\nLastName:       Engineering \\nFirstName:      \\nStreet:         5795 Badura Ave #110\\nCity:           Las Vegas\\nState/Prov:     NV\\nCountry:        US\\nPostalCode:     89118\\nRegDate:        2018-11-09\\nUpdated:        2018-11-09\\nOfficePhone:    +1-702-967-9378\\nMailbox:        Engineering@smartcity.com\\nSource:         ARIN\\n\n\nPOCHandle:      SAKIM-ARIN\\nIsRole:         N\\nLastName:       Sakimura\\nFirstName:      Daniel\\nStreet:         5795 Badura Ave #110\\nCity:           Las Vegas\\nState/Prov:     NV\\nCountry:        US\\nPostalCode:     89118\\nRegDate:        2022-07-20\\nUpdated:        2022-07-20\\nOfficePhone:    +1-303-228-8138\\nMailbox:        dsakimura@smartcity.com\\nSource:         ARIN\\n\n\nPOCHandle:      DL571-ARIN\\nIsRole:         N\\nLastName:       Langford\\nFirstName:      David\\nStreet:         5795 Badura Ave\\nStreet:         Suite 110\\nCity:           Las Vegas\\nState/Prov:     NV\\nCountry:        US\\nPostalCode:     89118\\nRegDate:        2000-04-24\\nUpdated:        2021-10-21\\nOfficePhone:    +1-702-943-6041\\nFaxPhone:       +1-702-943-6011\\nMailbox:        dlangford@smartcity.com\\nSource:         ARIN\\n\n\nPOCHandle:      ZARHA-ARIN\\nIsRole:         N\\nLastName:       Zarharchuck\\nFirstName:      James\\nStreet:         5795 Badura Ave #110\\nCity:           Las Vegas\\nState/Prov:     NV\\nCountry:        US\\nPostalCode:     89118\\nRegDate:        2019-05-08\\nUpdated:        2022-08-04\\nOfficePhone:    +1-702-967-9302\\nMailbox:        jzarharchuck@smartcity.com\\nSource:         ARIN\\n\n\nPOCHandle:      JOSEP286-ARIN\\nIsRole:         N\\nLastName:       Joseph\\nFirstName:      James\\nStreet:         5795 Badura Ave #110\\nCity:           Las Vegas\\nState/Prov:     NV\\nCountry:        US\\nPostalCode:     89118\\nRegDate:        2022-07-20\\nUpdated:        2022-07-20\\nOfficePhone:    +1-702-967-9378\\nMailbox:        jbjoseph@smartcitynetworks.com\\nSource:         ARIN\\n\n\nPOCHandle:      PROSS23-ARIN\\nIsRole:         N\\nLastName:       Prosser\\nFirstName:      Mike\\nStreet:         5795 Badura Ave   Suite 110\\nCity:           Las Vegas \\nState/Prov:     NV\\nCountry:        US\\nPostalCode:     89118\\nRegDate:        2018-11-09\\nUpdated:        2021-12-15\\nOfficePhone:    +1-702-967-9302\\nMailbox:        mprosser@smartcity.com\\nSource:         ARIN\\n"}, {"range": "69.166.128.0/19", "id": "TP4-RAL-69-166-128-0-19", "name": "TierPoint, LLC", "country": "US", "domain": "tierpoint.com", "org_id": "TL-801", "status": "ALLOCATION", "tech_id": "CHEEK1-ARIN\\NCZUMB2-ARIN", "mnt_id": "TIERP3-ARIN", "admin_id": "CHEEK1-ARIN", "abuse_id": "TIERP2-ARIN", "created": "2008-07-11", "updated": "2017-07-06", "source": "arin", "raw": "NetHandle:      NET-69-166-128-0-1\\nOrgID:          TL-801\\nParent:         NET-69-0-0-0-0\\nNetName:        TP4-RAL-69-166-128-0-19\\nNetRange:       69.166.128.0 - 69.166.159.255\\nNetType:        allocation\\nOriginAS:       7349\\nRegDate:        2008-07-11\\nUpdated:        2017-07-06\\nSource:         ARIN\\n\n\nOrgID:          TL-801\\nOrgName:        TierPoint, LLC\\nCanAllocate:    \\nStreet:         12444 Powerscourt Drive                              Suite 450\\nCity:           St. Louis\\nState/Prov:     MO\\nCountry:        US\\nPostalCode:     63131\\nRegDate:        2017-01-18\\nUpdated:        2017-12-20\\nReferralServer: rwhois://rwhois.tierpoint.net:4321\\nOrgAbuseHandle: TIERP2-ARIN\\nOrgAdminHandle: CHEEK1-ARIN\\nOrgNOCHandle:   TIERP3-ARIN\\nOrgTechHandle:  CHEEK1-ARIN\\nOrgTechHandle:  CZUMB2-ARIN\\nSource:         ARIN\\n\n\nPOCHandle:      TIERP2-ARIN\\nIsRole:         Y\\nLastName:       Tierpoint Abuse\\nFirstName:      \\nStreet:         12444 Powerscourt Dr.\\nStreet:         Suite 450\\nCity:           St. Louis\\nState/Prov:     MO\\nCountry:        US\\nPostalCode:     63131\\nRegDate:        2017-12-20\\nUpdated:        2021-12-21\\nOfficePhone:    +1-844-200-8718\\nMailbox:        abuse@tierpoint.com\\nSource:         ARIN\\n\n\nPOCHandle:      CZUMB2-ARIN\\nIsRole:         N\\nLastName:       Czumbil\\nFirstName:      Romeo\\nStreet:         9999 Hamilton Blvd\\nStreet:         Building #4\\nCity:           Breinigsville\\nState/Prov:     PA\\nCountry:        US\\nPostalCode:     18031\\nRegDate:        2016-06-14\\nUpdated:        2022-06-16\\nOfficePhone:    +1-610-994-3046\\nMailbox:        romeo.czumbil@tierpoint.com\\nSource:         ARIN\\n\n\nPOCHandle:      TIERP3-ARIN\\nIsRole:         Y\\nLastName:       Tierpoint NOC\\nFirstName:      \\nStreet:         12444 Powerscourt Dr.\\nStreet:         Suite 450\\nCity:           St. Louis\\nState/Prov:     MO\\nCountry:        US\\nPostalCode:     63131\\nRegDate:        2017-12-20\\nUpdated:        2021-12-21\\nOfficePhone:    +1-844-200-8718\\nMailbox:        support@tierpoint.com\\nSource:         ARIN\\n\n\nPOCHandle:      CHEEK1-ARIN\\nIsRole:         N\\nLastName:       Cheek\\nFirstName:      Brian\\nStreet:         3864 Courtney St Suite 130\\nCity:           Bethlehem\\nState/Prov:     PA\\nCountry:        US\\nPostalCode:     18017\\nRegDate:        2015-05-19\\nUpdated:        2021-12-21\\nOfficePhone:    +1-484-893-1507\\nMailbox:        brian.cheek@tierpoint.com\\nSource:         ARIN\\n"}, {"range": "24.238.2.0/24", "id": "HWC-BLK-LAKESIDEAPTS", "name": "HWC", "country": "US", "domain": "gethotwired.net", "org_id": "HWC-33", "status": "REALLOCATION", "tech_id": "DCP8-ARIN\\NDRK9-ARIN\\NIPADM737-ARIN\\NJSL39-ARIN\\NLAWSO19-ARIN", "mnt_id": "JSL39-ARIN", "admin_id": "JSL48-ARIN", "abuse_id": "JSL39-ARIN", "created": "2015-03-26", "updated": "2015-03-26", "source": "arin", "raw": "NetHandle:      NET-24-238-2-0-2\\nOrgID:          HWC-33\\nParent:         NET-24-238-2-0-1\\nNetName:        HWC-BLK-LAKESIDEAPTS\\nNetRange:       24.238.2.0 - 24.238.2.255\\nNetType:        reallocation\\nOriginAS:       23089, 31793\\nComment:        Addresses within this range are NON-PORTABLE\\nComment:        In use at development \u00e2\u20ac\u201c US - NJ - Lakeside Apartments Customer Data\\nRegDate:        2015-03-26\\nUpdated:        2015-03-26\\nSource:         ARIN\\n\n\nOrgID:          HWC-33\\nOrgName:        HWC\\nCanAllocate:    \\nStreet:         Three Bala Plaza East,\\nStreet:         Suite 700\\nCity:           Bala Cynwyd\\nState/Prov:     PA\\nCountry:        US\\nPostalCode:     19004\\nComment:        Information regarding this Autonomous System can be found at http://as23089.peeringdb.com\\nRegDate:        2015-03-26\\nUpdated:        2021-09-14\\nReferralServer: rwhois://rwhois.gethotwired.net:4321\\nOrgAbuseHandle: JSL39-ARIN\\nOrgAdminHandle: JSL48-ARIN\\nOrgNOCHandle:   JSL39-ARIN\\nOrgTechHandle:  DCP8-ARIN\\nOrgTechHandle:  DRK9-ARIN\\nOrgTechHandle:  IPADM737-ARIN\\nOrgTechHandle:  JSL39-ARIN\\nOrgTechHandle:  LAWSO19-ARIN\\nSource:         ARIN\\n\n\nPOCHandle:      DRK9-ARIN\\nIsRole:         N\\nLastName:       Ketterhagen\\nFirstName:      Donald\\nStreet:         1415 Martin Luther King Jr Ave S\\nCity:           Salisbury\\nState/Prov:     NC\\nCountry:        US\\nPostalCode:     28144\\nRegDate:        2005-03-12\\nUpdated:        2022-03-12\\nFaxPhone:       +1-954-417-3562\\nMobilePhone:    +1-919-609-4669\\nOfficePhone:    +1-704-244-5552\\nMailbox:        bketterhagen@hotwirecommunication.com\\nMailbox:        bob@ketterhagen.com\\nSource:         ARIN\\n\n\nPOCHandle:      JSL39-ARIN\\nIsRole:         N\\nLastName:       Slattery\\nFirstName:      Jim\\nStreet:         3 Bala Plaza East\\nStreet:         suite 700\\nCity:           Bala Cynwyd\\nState/Prov:     PA\\nCountry:        US\\nPostalCode:     19004\\nRegDate:        2004-05-10\\nUpdated:        2021-11-24\\nOfficePhone:    +1-484-580-9006\\nMailbox:        JSlattery@hotwirecommunication.com\\nSource:         ARIN\\n\n\nPOCHandle:      JSL48-ARIN\\nIsRole:         N\\nLastName:       slattery\\nFirstName:      jim\\nStreet:         3 Bala Plaza East\\nStreet:         suite 700\\nCity:           Bala Cynwyd\\nState/Prov:     PA\\nCountry:        US\\nPostalCode:     19004\\nRegDate:        2005-04-19\\nUpdated:        2021-08-23\\nOfficePhone:    +1-484-580-9006\\nMailbox:        jslattery@hotwiremail.com\\nSource:         ARIN\\n\n\nPOCHandle:      DCP8-ARIN\\nIsRole:         N\\nLastName:       Pacheco\\nFirstName:      Donaldo\\nStreet:         2100 W Cypress Creek Rd\\nCity:           Fort Lauderdale\\nState/Prov:     FL\\nCountry:        US\\nPostalCode:     33309\\nRegDate:        2015-08-03\\nUpdated:        2022-07-29\\nOfficePhone:    +1-954-417-6745\\nMailbox:        donaldo.pacheco@hotwirecommunication.com\\nSource:         ARIN\\n\n\nPOCHandle:      IPADM737-ARIN\\nIsRole:         Y\\nLastName:       IP Administrator\\nFirstName:      \\nStreet:         One Belmont Avenue\\nStreet:         Suite 1100\\nCity:           Bala Cynwyd\\nState/Prov:     PA\\nCountry:        US\\nPostalCode:     19004\\nRegDate:        2015-03-26\\nUpdated:        2021-08-31\\nOfficePhone:    +1-484-572-6200\\nMailbox:        ipadmin@hotwirecommunication.com\\nSource:         ARIN\\n\n\nPOCHandle:      LAWSO19-ARIN\\nIsRole:         N\\nLastName:       Lawson\\nFirstName:      Jeff\\nStreet:         300 East Lancaster Ave\\nStreet:         Suite 208\\nCity:           Wynnewood\\nState/Prov:     PA\\nCountry:        US\\nPostalCode:     19096\\nRegDate:        2012-10-03\\nUpdated:        2020-04-21\\nOfficePhone:    +1-215-720-4028\\nMobilePhone:    +1-215-720-4028\\nMailbox:        jlawson@hotwiremail.com\\nSource:         ARIN\\n"}, {"range": "198.73.228.0/24", "id": "CITIBANKCAN", "name": "Citibank Canada", "country": "US", "domain": "citibank.ca", "org_id": "CITIBA-1", "status": "ALLOCATION", "tech_id": "NEC1-ARIN", "mnt_id": "CCC9-ARIN", "admin_id": "MORRI141-ARIN", "abuse_id": "CCC9-ARIN", "created": "1993-05-18", "updated": "2021-12-14", "source": "arin", "raw": "NetHandle:      NET-198-73-228-0-1\\nOrgID:          CITIBA-1\\nParent:         NET-198-0-0-0-0\\nNetName:        CITIBANKCAN\\nNetRange:       198.73.228.0 - 198.73.228.255\\nNetType:        allocation\\nRegDate:        1993-05-18\\nUpdated:        2021-12-14\\nTechHandle:     NEC1-ARIN\\nSource:         ARIN\\n\n\nOrgID:          CITIBA-1\\nOrgName:        Citibank Canada\\nCanAllocate:    \\nStreet:         390 Greenwich Street\\nCity:           New York\\nState/Prov:     NY\\nCountry:        US\\nPostalCode:     10013\\nRegDate:        1993-05-18\\nUpdated:        2019-05-01\\nOrgAbuseHandle: CCC9-ARIN\\nOrgAdminHandle: MORRI141-ARIN\\nOrgNOCHandle:   CCC9-ARIN\\nOrgTechHandle:  CHAUW-ARIN\\nOrgTechHandle:  MORRI141-ARIN\\nOrgTechHandle:  PENAR13-ARIN\\nSource:         ARIN\\n\n\nPOCHandle:      PENAR13-ARIN\\nIsRole:         N\\nLastName:       Pena\\nFirstName:      Ray\\nStreet:         68 South Service road\\nCity:           Melville\\nState/Prov:     NY\\nCountry:        US\\nPostalCode:     11747\\nRegDate:        2017-01-20\\nUpdated:        2021-07-15\\nOfficePhone:    +1-631-712-7472\\nMailbox:        raymond.i.pena@citi.com\\nSource:         ARIN\\n\n\nPOCHandle:      NEC1-ARIN\\nIsRole:         Y\\nLastName:       Citigroup\\nFirstName:      \\nStreet:         388 Greenwich St\\nCity:           New York\\nState/Prov:     NY\\nCountry:        US\\nPostalCode:     10013\\nRegDate:        2002-07-29\\nUpdated:        2015-12-17\\nOfficePhone:    +1-212-723-5500\\nMailbox:        network.addressmngt@citigroup.com\\nSource:         ARIN\\n\n\nPOCHandle:      CHAUW-ARIN\\nIsRole:         N\\nLastName:       Chau\\nFirstName:      Weikuo\\nStreet:         390 Greenwich Street\\nCity:           New York\\nState/Prov:     NY\\nCountry:        US\\nPostalCode:     10013\\nRegDate:        2017-01-20\\nUpdated:        2022-01-21\\nOfficePhone:    +1-908-563-6387\\nMailbox:        weikuo.chau@citi.com\\nSource:         ARIN\\n\n\nPOCHandle:      MORRI141-ARIN\\nIsRole:         N\\nLastName:       Morris\\nFirstName:      Patrick\\nStreet:         388 Greenwich St\\nCity:           NY\\nState/Prov:     NY\\nCountry:        US\\nPostalCode:     10013\\nRegDate:        2013-07-18\\nUpdated:        2021-11-13\\nOfficePhone:    +1-631-712-8024\\nMailbox:        iptechservices@citi.com\\nSource:         ARIN\\n\n\nPOCHandle:      CCC9-ARIN\\nIsRole:         Y\\nLastName:       CTAC Command Center\\nFirstName:      \\nStreet:         388 Greenwich\\nCity:           NY\\nState/Prov:     NY\\nCountry:        US\\nPostalCode:     10013\\nRegDate:        2004-09-21\\nUpdated:        2015-05-01\\nMobilePhone:    +1 800 266-1557\\nOfficePhone:    +1 212 444-0017\\nMailbox:        soc@citi.com\\nSource:         ARIN\\n"}, {"range": "2605:4580::/32", "id": "ADPES", "name": "Automatic Data Processing, Inc.", "country": "US", "domain": "adp.com", "org_id": "ADPES", "status": "ALLOCATION", "tech_id": "ESC76-ARIN\\NHOSTM27-ARIN\\NLACKR6-ARIN\\NWILSO1075-ARIN", "mnt_id": "HOSTM27-ARIN", "admin_id": "HOSTM27-ARIN", "abuse_id": "ABUSE3476-ARIN", "created": "2014-02-18", "updated": "2014-02-18", "source": "arin", "raw": "V6NetHandle:    NET6-2605-4580-1\\nOrgID:          ADPES\\nParent:         NET6-2600-1\\nNetName:        ADPES\\nNetRange:       2605:4580:: - 2605:4580:FFFF:FFFF:FFFF:FFFF:FFFF:FFFF\\nNetType:        allocation\\nOriginAS:       14299, 22812\\nComment:        http://www.adp.com\\nComment:        NOC Hours: 24X7\\nRegDate:        2014-02-18\\nUpdated:        2014-02-18\\nSource:         ARIN\\n\n\nOrgID:          ADPES\\nOrgName:        Automatic Data Processing, Inc.\\nCanAllocate:    \\nStreet:         1 ADP Boulevard\\nCity:           Roseland\\nState/Prov:     NJ\\nCountry:        US\\nPostalCode:     07068\\nRegDate:        1994-05-18\\nUpdated:        2018-07-24\\nOrgAbuseHandle: ABUSE3476-ARIN\\nOrgAdminHandle: HOSTM27-ARIN\\nOrgNOCHandle:   HOSTM27-ARIN\\nOrgTechHandle:  ESC76-ARIN\\nOrgTechHandle:  HOSTM27-ARIN\\nOrgTechHandle:  LACKR6-ARIN\\nOrgTechHandle:  WILSO1075-ARIN\\nSource:         ARIN\\n\n\nPOCHandle:      WILSO1075-ARIN\\nIsRole:         N\\nLastName:       wilson\\nFirstName:      kevin\\nStreet:         1 adp blvd\\nCity:           roseland\\nState/Prov:     NJ\\nCountry:        US\\nPostalCode:     01234\\nRegDate:        2017-04-18\\nUpdated:        2022-04-20\\nOfficePhone:    +1-385-444-0653\\nMailbox:        kevin.wilson@adp.com\\nSource:         ARIN\\n\n\nPOCHandle:      ABUSE3476-ARIN\\nIsRole:         Y\\nLastName:       Abuse\\nFirstName:      \\nStreet:         1 ADP Blvd\\nCity:           Roseland\\nState/Prov:     NJ\\nCountry:        US\\nPostalCode:     07068\\nRegDate:        2012-07-17\\nUpdated:        2017-04-03\\nOfficePhone:    +1-999-999-9999\\nMailbox:        abuse@adp.com\\nSource:         ARIN\\n\n\nPOCHandle:      ESC76-ARIN\\nIsRole:         N\\nLastName:       enabothula\\nFirstName:      sharath chanrda\\nStreet:         5800 windward pkwy\\nCity:           alpharetta\\nState/Prov:     GA\\nCountry:        US\\nPostalCode:     30005\\nRegDate:        2017-04-18\\nUpdated:        2017-04-18\\nOfficePhone:    +1-470-385-3368\\nMailbox:        sharath.enabothula@adp.com\\nSource:         ARIN\\n\n\nPOCHandle:      HOSTM27-ARIN\\nIsRole:         Y\\nLastName:       Hostmaster\\nFirstName:      \\nStreet:         1 ADP Boulevard\\nCity:           Roseland\\nState/Prov:     NJ\\nCountry:        US\\nPostalCode:     07068\\nRegDate:        2002-10-16\\nUpdated:        2020-11-19\\nOfficePhone:    +1-973-974-5868\\nMailbox:        hostmaster@adp.com\\nSource:         ARIN\\n\n\nPOCHandle:      LACKR6-ARIN\\nIsRole:         N\\nLastName:       Lackraj\\nFirstName:      Andy\\nStreet:         5800 Windward Parkway\\nCity:           Alpharetta\\nState/Prov:     GA\\nCountry:        US\\nPostalCode:     30005\\nRegDate:        2017-04-18\\nUpdated:        2021-04-17\\nOfficePhone:    +1-678-225-2841\\nMailbox:        andy.lackraj@adp.com\\nSource:         ARIN\\n"}, {"range": "2604:5300::/32", "id": "CCMAINE-6BLK-1", "name": "Cornerstone Communications, LLC", "country": "US", "domain": "ccmaine.net", "org_id": "CCL-216", "status": "ALLOCATION", "tech_id": "HOSTM1149-ARIN", "mnt_id": "NOC2972-ARIN", "admin_id": "ADMIN1318-ARIN", "abuse_id": "ABUSE1865-ARIN", "created": "2011-04-07", "updated": "2012-03-02", "source": "arin", "raw": "V6NetHandle:    NET6-2604-5300-1\\nOrgID:          CCL-216\\nParent:         NET6-2600-1\\nNetName:        CCMAINE-6BLK-1\\nNetRange:       2604:5300:: - 2604:5300:FFFF:FFFF:FFFF:FFFF:FFFF:FFFF\\nNetType:        allocation\\nOriginAS:       46188\\nComment:        http://www.ccmaine.net/\\nComment:        Standard NOC hours are 9AM to 5PM Eastern Time,\\nComment:        Monday through Friday.\\nRegDate:        2011-04-07\\nUpdated:        2012-03-02\\nSource:         ARIN\\n\n\nOrgID:          CCL-216\\nOrgName:        Cornerstone Communications, LLC\\nCanAllocate:    \\nStreet:         125 School Road\\nCity:           Charleston\\nState/Prov:     ME\\nCountry:        US\\nPostalCode:     04422\\nRegDate:        2008-02-15\\nUpdated:        2017-01-28\\nReferralServer: rwhois://rwhois.ccmaine.net:4321\\nOrgAbuseHandle: ABUSE1865-ARIN\\nOrgAdminHandle: ADMIN1318-ARIN\\nOrgNOCHandle:   NOC2972-ARIN\\nOrgTechHandle:  HOSTM1149-ARIN\\nSource:         ARIN\\n\n\nPOCHandle:      HOSTM1149-ARIN\\nIsRole:         Y\\nLastName:       Hostmaster\\nFirstName:      \\nStreet:         547 Odlin Rd\\nCity:           Bangor\\nState/Prov:     ME\\nCountry:        US\\nPostalCode:     04401\\nRegDate:        2008-02-14\\nUpdated:        2022-07-07\\nFaxPhone:       +1-207-285-1234\\nOfficePhone:    +1-207-735-2611\\nMailbox:        abreda@pcb-me.com\\nSource:         ARIN\\n\n\nPOCHandle:      NOC2972-ARIN\\nIsRole:         Y\\nLastName:       Network Operations Center\\nFirstName:      \\nStreet:         125 School Road\\nCity:           Charleston\\nState/Prov:     ME\\nCountry:        US\\nPostalCode:     04422\\nRegDate:        2008-02-14\\nUpdated:        2010-06-18\\nOfficePhone:    +1-207-992-4411\\nMailbox:        noc@ccmaine.net\\nSource:         ARIN\\n\n\nPOCHandle:      ABUSE1865-ARIN\\nIsRole:         Y\\nLastName:       Abuse\\nFirstName:      \\nStreet:         547 Odlin Rd\\nCity:           Bangor\\nState/Prov:     ME\\nCountry:        US\\nPostalCode:     04401\\nRegDate:        2008-02-14\\nUpdated:        2021-04-15\\nFaxPhone:       +1-207-285-1234\\nOfficePhone:    +1-207-735-2611\\nMailbox:        abuse@ccmaine.net\\nSource:         ARIN\\n\n\nPOCHandle:      ADMIN1318-ARIN\\nIsRole:         Y\\nLastName:       Administrative Office\\nFirstName:      \\nStreet:         547 Odlin Rd\\nCity:           Bangor\\nState/Prov:     ME\\nCountry:        US\\nPostalCode:     04401\\nRegDate:        2008-02-14\\nUpdated:        2022-07-07\\nOfficePhone:    +1-207-564-5000\\nOfficePhone:    +1-207-735-2611\\nMailbox:        abreda@pcb-me.com\\nSource:         ARIN\\n"}, {"range": "64.185.224.0/20", "id": "WEBNX-BLK-12", "name": "WebNX, Inc.", "country": "US", "domain": "webnx.com", "org_id": "WEBNX", "status": "ALLOCATION", "tech_id": "TECHS71-ARIN", "mnt_id": "NOC2920-ARIN", "admin_id": "DPA132-ARIN", "abuse_id": "ABUSE1832-ARIN", "created": "2014-07-22", "updated": "2014-07-22", "source": "arin", "raw": "NetHandle:      NET-64-185-224-0-1\\nOrgID:          WEBNX\\nParent:         NET-64-0-0-0-0\\nNetName:        WEBNX-BLK-12\\nNetRange:       64.185.224.0 - 64.185.239.255\\nNetType:        allocation\\nOriginAS:       18450\\nComment:        WebNX.com - For abuse related issues please email abuse@webnx.com\\nRegDate:        2014-07-22\\nUpdated:        2014-07-22\\nSource:         ARIN\\n\n\nOrgID:          WEBNX\\nOrgName:        WebNX, Inc.\\nCanAllocate:    \\nStreet:         119 N 600 W\\nCity:           Ogden\\nState/Prov:     UT\\nCountry:        US\\nPostalCode:     84404\\nComment:        http://WebNX.com\\nComment:        To report abuse, please email abuse@webnx.com\\nRegDate:        2006-11-01\\nUpdated:        2019-09-02\\nReferralServer: rwhois://clients.webnx.com:4321\\nOrgAbuseHandle: ABUSE1832-ARIN\\nOrgAdminHandle: DPA132-ARIN\\nOrgNOCHandle:   NOC2920-ARIN\\nOrgTechHandle:  TECHS71-ARIN\\nSource:         ARIN\\n\n\nPOCHandle:      ABUSE1832-ARIN\\nIsRole:         Y\\nLastName:       Abuse\\nFirstName:      \\nStreet:         119 N 600 W\\nCity:           Ogden\\nState/Prov:     UT\\nCountry:        US\\nPostalCode:     84404\\nRegDate:        2008-01-04\\nUpdated:        2021-12-31\\nOfficePhone:    +1-800-840-5996\\nMailbox:        abuse@webnx.com\\nSource:         ARIN\\n\n\nPOCHandle:      DPA132-ARIN\\nIsRole:         N\\nLastName:       Pautz\\nFirstName:      Daniel\\nStreet:         119 N 600 W\\nCity:           Ogden\\nState/Prov:     UT\\nCountry:        US\\nPostalCode:     84404\\nRegDate:        2006-11-01\\nUpdated:        2021-12-31\\nOfficePhone:    +1-800-840-5996\\nMailbox:        dan@webnx.com\\nSource:         ARIN\\n\n\nPOCHandle:      TECHS71-ARIN\\nIsRole:         Y\\nLastName:       Tech Support\\nFirstName:      \\nStreet:         119 N 600 W\\nCity:           Ogden\\nState/Prov:     UT\\nCountry:        US\\nPostalCode:     84404\\nRegDate:        2008-01-04\\nUpdated:        2021-12-31\\nOfficePhone:    +1-800-840-5996\\nMailbox:        dan@webnx.com\\nSource:         ARIN\\n\n\nPOCHandle:      NOC2920-ARIN\\nIsRole:         Y\\nLastName:       NOC\\nFirstName:      \\nStreet:         119 N 600 W\\nCity:           Ogden\\nState/Prov:     UT\\nCountry:        US\\nPostalCode:     84404\\nRegDate:        2008-01-04\\nUpdated:        2021-12-31\\nOfficePhone:    +1-800-840-5996\\nMailbox:        NOC@webnx.com\\nSource:         ARIN\\n"}, {"range": "207.182.192.0/19", "id": "TYLER-CORP-1", "name": "Tyler Technologies, Inc.", "country": "US", "domain": "tylertech.com", "org_id": "TT-1", "status": "ALLOCATION", "tech_id": "TAT26-ARIN", "mnt_id": "TYLER34-ARIN", "admin_id": "TAA9-ARIN", "abuse_id": "AAATT-ARIN", "created": "1996-09-12", "updated": "2017-01-13", "source": "arin", "raw": "NetHandle:      NET-207-182-192-0-1\\nOrgID:          TT-1\\nParent:         NET-207-0-0-0-0\\nNetName:        TYLER-CORP-1\\nNetRange:       207.182.192.0 - 207.182.223.255\\nNetType:        allocation\\nComment:        ADDRESSES WITHIN THIS BLOCK ARE NON-PORTABLE\\nComment:        http://www.TylerTech.com \\nComment:        NYSE: TYL\\nRegDate:        1996-09-12\\nUpdated:        2017-01-13\\nSource:         ARIN\\n\n\nOrgID:          TT-1\\nOrgName:        Tyler Technologies, Inc.\\nCanAllocate:    \\nStreet:         5101 Tennyson Parkway\\nCity:           Plano\\nState/Prov:     TX\\nCountry:        US\\nPostalCode:     75024\\nComment:        http://www.TylerTech.com \\nComment:        NYSE: TYL\\nRegDate:        2011-01-27\\nUpdated:        2017-01-28\\nOrgAbuseHandle: AAATT-ARIN\\nOrgAdminHandle: TAA9-ARIN\\nOrgNOCHandle:   TYLER34-ARIN\\nOrgTechHandle:  TAT26-ARIN\\nSource:         ARIN\\n\n\nPOCHandle:      TAA9-ARIN\\nIsRole:         Y\\nLastName:       Tyler ARIN Admin\\nFirstName:      \\nStreet:         5101 Tennyson Parkway\\nCity:           Plano\\nState/Prov:     TX\\nCountry:        US\\nPostalCode:     75024\\nRegDate:        2013-09-24\\nUpdated:        2021-11-30\\nOfficePhone:    +1-972-713-3700\\nMailbox:        ARINAdmin@tylertech.com\\nSource:         ARIN\\n\n\nPOCHandle:      TAT26-ARIN\\nIsRole:         Y\\nLastName:       Tyler ARIN Tech\\nFirstName:      \\nStreet:         5101 Tennyson Parkway\\nCity:           Plano\\nState/Prov:     TX\\nCountry:        US\\nPostalCode:     75024\\nRegDate:        2013-09-24\\nUpdated:        2021-11-30\\nOfficePhone:    +1-972-713-3700\\nMailbox:        ARINTech@tylertech.com\\nSource:         ARIN\\n\n\nPOCHandle:      TYLER34-ARIN\\nIsRole:         Y\\nLastName:       Tyler NOC\\nFirstName:      \\nStreet:         5101 Tennyson Parkway\\nCity:           Plano\\nState/Prov:     TX\\nCountry:        US\\nPostalCode:     75024\\nRegDate:        2013-09-24\\nUpdated:        2021-11-30\\nOfficePhone:    +1-972-713-3700\\nMailbox:        ARINNOC@tylertech.com\\nSource:         ARIN\\n\n\nPOCHandle:      AAATT-ARIN\\nIsRole:         Y\\nLastName:       ARIN Abuse at Tyler Tech\\nFirstName:      \\nStreet:         5101 Tennyson Parkway\\nCity:           Plano\\nState/Prov:     TX\\nCountry:        US\\nPostalCode:     75024\\nRegDate:        2013-09-24\\nUpdated:        2021-11-30\\nOfficePhone:    +1-972-713-3700\\nMailbox:        ARINAbuse@TylerTech.com\\nSource:         ARIN\\n"}, {"range": "69.49.224.0/19", "id": "OPENTRANSFER-ECOMMERCE", "name": "Newfold Digital, Inc.", "country": "US", "domain": "enduranceinternational.com", "org_id": "EIG-12", "status": "ALLOCATION", "tech_id": "ENO74-ARIN", "mnt_id": "ENO74-ARIN", "admin_id": "ENO74-ARIN", "abuse_id": "EIGAB-ARIN", "created": "2003-05-27", "updated": "2017-10-23", "source": "arin", "raw": "NetHandle:      NET-69-49-224-0-1\\nOrgID:          EIG-12\\nParent:         NET-69-0-0-0-0\\nNetName:        OPENTRANSFER-ECOMMERCE\\nNetRange:       69.49.224.0 - 69.49.255.255\\nNetType:        allocation\\nOriginAS:       32392\\nRegDate:        2003-05-27\\nUpdated:        2017-10-23\\nSource:         ARIN\\n\n\nOrgID:          EIG-12\\nOrgName:        Newfold Digital, Inc.\\nCanAllocate:    \\nStreet:         5535 Gate Parkway\\nCity:           Jacksonville\\nState/Prov:     FL\\nCountry:        US\\nPostalCode:     32256\\nRegDate:        2005-02-07\\nUpdated:        2021-10-29\\nOrgAbuseHandle: EIGAB-ARIN\\nOrgAdminHandle: ENO74-ARIN\\nOrgNOCHandle:   ENO74-ARIN\\nOrgTechHandle:  ENO74-ARIN\\nSource:         ARIN\\n\n\nPOCHandle:      EIGAB-ARIN\\nIsRole:         Y\\nLastName:       eig-abuse\\nFirstName:      \\nStreet:         10 Corporate Drive\\nCity:           Burlington\\nState/Prov:     MA\\nCountry:        US\\nPostalCode:     01803\\nRegDate:        2013-08-13\\nUpdated:        2022-01-14\\nOfficePhone:    +1-781-852-3200\\nOfficePhone:    +1-877-659-6181\\nMailbox:        eig-abuse@endurance.com\\nSource:         ARIN\\n\n\nPOCHandle:      ENO74-ARIN\\nIsRole:         Y\\nLastName:       EIG Network Operations\\nFirstName:      \\nStreet:         10 Corporate Drive\\nCity:           Burlington\\nState/Prov:     MA\\nCountry:        US\\nPostalCode:     01803\\nRegDate:        2010-08-25\\nUpdated:        2021-11-17\\nOfficePhone:    +1-781-852-3200\\nOfficePhone:    +1-877-659-6181\\nMailbox:        eig-noc@endurance.com\\nMailbox:        eig-net-team@endurance.com\\nSource:         ARIN\\n"}, {"range": "162.218.182.0/23", "id": "FB-PUBLIC-04", "name": "Fatbeam, LLC", "country": "US", "domain": "fatbeam.com", "org_id": "FL-379", "status": "ALLOCATION", "tech_id": "BARRO151-ARIN\\NFNO21-ARIN", "mnt_id": "FATBE-ARIN", "admin_id": "BUDDG3-ARIN", "abuse_id": "FNO21-ARIN", "created": "2013-08-06", "updated": "2018-08-21", "source": "arin", "raw": "NetHandle:      NET-162-218-182-0-2\\nOrgID:          FL-379\\nParent:         NET-162-0-0-0-0\\nNetName:        FB-PUBLIC-04\\nNetRange:       162.218.182.0 - 162.218.183.255\\nNetType:        allocation\\nOriginAS:       55039\\nRegDate:        2013-08-06\\nUpdated:        2018-08-21\\nSource:         ARIN\\n\n\nOrgID:          FL-379\\nOrgName:        Fatbeam, LLC\\nCanAllocate:    \\nStreet:         2065 W Riverstone Drive\\nStreet:         Suite #205\\nCity:           Coeur d Alene\\nState/Prov:     ID\\nCountry:        US\\nPostalCode:     83814\\nComment:        http://www.fatbeam.com\\nComment:        Please Call 1-855-979-8844 -- This will ring our NOC.\\nRegDate:        2017-02-14\\nUpdated:        2022-04-06\\nOrgAbuseHandle: FNO21-ARIN\\nOrgAdminHandle: BUDDG3-ARIN\\nOrgNOCHandle:   FATBE-ARIN\\nOrgTechHandle:  BARRO151-ARIN\\nOrgTechHandle:  FNO21-ARIN\\nSource:         ARIN\\n\n\nPOCHandle:      FNO21-ARIN\\nIsRole:         Y\\nLastName:       Fatbeam Network Operations\\nFirstName:      \\nStreet:         2065 W. Riverstone Drive\\nStreet:         STE 105\\nCity:           Coeur d Alene\\nState/Prov:     ID\\nCountry:        US\\nPostalCode:     83814\\nRegDate:        2019-09-09\\nUpdated:        2021-09-08\\nOfficePhone:    +1-509-344-1008\\nMailbox:        netops@fatbeam.com\\nSource:         ARIN\\n\n\nPOCHandle:      BUDDG3-ARIN\\nIsRole:         N\\nLastName:       Budd\\nFirstName:      Gavin\\nStreet:         2065 W. Riverstone Dr.\\nStreet:         Suite 105\\nCity:           Coeur d'Alene\\nState/Prov:     ID\\nCountry:        US\\nPostalCode:     83814\\nRegDate:        2012-11-09\\nUpdated:        2021-09-09\\nOfficePhone:    +1-208-758-7021\\nMailbox:        gavin@fatbeam.com\\nSource:         ARIN\\n\n\nPOCHandle:      BARRO151-ARIN\\nIsRole:         N\\nLastName:       Barron\\nFirstName:      Zac\\nStreet:         2065 W Riverstone Dr \\nStreet:         Suite. 202\\nCity:           Coeur d'Alene\\nState/Prov:     ID\\nCountry:        US\\nPostalCode:     83814\\nRegDate:        2022-03-29\\nUpdated:        2022-03-29\\nOfficePhone:    +1-208-618-9374\\nMailbox:        Zac@fatbeam.com\\nSource:         ARIN\\n\n\nPOCHandle:      FATBE-ARIN\\nIsRole:         Y\\nLastName:       Fatbeam NOC\\nFirstName:      \\nStreet:         2065 W. Riverstone Dr. \\nStreet:         Suite 105,\\nCity:           Coeur d Alene\\nState/Prov:     ID\\nCountry:        US\\nPostalCode:     83814\\nRegDate:        2019-09-09\\nUpdated:        2021-09-08\\nOfficePhone:    +1-855-979-8844\\nMailbox:        support@fatbeam.com\\nSource:         ARIN\\n"}, {"range": "216.249.196.0/24", "id": "0-196-249-216-ACC-770", "name": "Alliance Communications", "country": "US", "domain": "alliancecommunications.us", "org_id": "ACC-770", "status": "REASSIGNMENT", "tech_id": "EGENE3-ARIN", "mnt_id": "EGENE3-ARIN", "admin_id": "EGENE3-ARIN", "abuse_id": "EGENE3-ARIN", "created": "2017-06-21", "updated": "2017-06-21", "source": "arin", "raw": "NetHandle:      NET-216-249-196-0-1\\nOrgID:          ACC-770\\nParent:         NET-216-249-192-0-1\\nNetName:        0-196-249-216-ACC-770\\nNetRange:       216.249.196.0 - 216.249.196.255\\nNetType:        reassignment\\nRegDate:        2017-06-21\\nUpdated:        2017-06-21\\nSource:         ARIN\\n\n\nOrgID:          ACC-770\\nOrgName:        Alliance Communications\\nCanAllocate:    \\nStreet:         612 3rd Street\\nCity:           Garretson\\nState/Prov:     SD\\nCountry:        US\\nPostalCode:     57030\\nRegDate:        2017-06-15\\nUpdated:        2017-08-24\\nOrgAbuseHandle: EGENE3-ARIN\\nOrgAdminHandle: EGENE3-ARIN\\nOrgNOCHandle:   EGENE3-ARIN\\nOrgTechHandle:  EGENE3-ARIN\\nSource:         ARIN\\n\n\nPOCHandle:      EGENE3-ARIN\\nIsRole:         N\\nLastName:       Egenes\\nFirstName:      Darin\\nStreet:         612 3rd Street\\nCity:           Garretson\\nState/Prov:     SD\\nCountry:        US\\nPostalCode:     57030\\nRegDate:        2015-02-11\\nUpdated:        2021-12-15\\nOfficePhone:    +1-605-594-3411\\nMailbox:        darin@alliancecom.net\\nSource:         ARIN\\n"}, {"range": "67.111.12.0/24", "id": "XOXO-67-111-12-0", "name": "Topica, Inc.", "country": "US", "domain": "topica.com", "org_id": "TOPICA", "status": "REALLOCATION", "tech_id": "NOC33323-ARIN", "mnt_id": "NOC33323-ARIN", "admin_id": "NOC33323-ARIN", "abuse_id": "NOC33323-ARIN", "created": "2007-01-16", "updated": "2007-01-16", "source": "arin", "raw": "NetHandle:      NET-67-111-12-0-1\\nOrgID:          TOPICA\\nParent:         NET-67-104-0-0-1\\nNetName:        XOXO-67-111-12-0\\nNetRange:       67.111.12.0 - 67.111.12.255\\nNetType:        reallocation\\nRegDate:        2007-01-16\\nUpdated:        2007-01-16\\nSource:         ARIN\\n\n\nOrgID:          TOPICA\\nOrgName:        Topica, Inc.\\nCanAllocate:    \\nStreet:         P.O. Box 34280\\nCity:           San Francisco\\nState/Prov:     CA\\nCountry:        US\\nPostalCode:     94134\\nRegDate:        1998-04-16\\nUpdated:        2021-06-16\\nOrgAbuseHandle: NOC33323-ARIN\\nOrgAdminHandle: NOC33323-ARIN\\nOrgNOCHandle:   NOC33323-ARIN\\nOrgTechHandle:  NOC33323-ARIN\\nSource:         ARIN\\n\n\nPOCHandle:      NOC33323-ARIN\\nIsRole:         Y\\nLastName:       noc\\nFirstName:      \\nStreet:         18425 Burbank Blvd #714\\nCity:           Tarzana\\nState/Prov:     CA\\nCountry:        US\\nPostalCode:     91356\\nRegDate:        2021-06-16\\nUpdated:        2022-06-16\\nOfficePhone:    +1-818-776-8080\\nMailbox:        noc@infostreet.com\\nSource:         ARIN\\n"}, {"range": "192.154.202.0/24", "id": "192154202", "name": "TND, LLC", "country": "US", "domain": "tnd.cloud", "org_id": "TL-1318", "status": "REASSIGNMENT", "tech_id": "TDN5-ARIN", "mnt_id": "TDN5-ARIN", "admin_id": "TDN5-ARIN", "abuse_id": "TDN5-ARIN", "created": "2021-09-07", "updated": "2021-09-07", "source": "arin", "raw": "NetHandle:      NET-192-154-202-0-2\\nOrgID:          TL-1318\\nParent:         NET-192-154-202-0-1\\nNetName:        192154202\\nNetRange:       192.154.202.0 - 192.154.202.255\\nNetType:        reassignment\\nRegDate:        2021-09-07\\nUpdated:        2021-09-07\\nSource:         ARIN\\n\n\nOrgID:          TL-1318\\nOrgName:        TND, LLC\\nCanAllocate:    \\nStreet:         1309 Coffeen Avenue STE 1200\\nCity:           Sheridan\\nState/Prov:     WY\\nCountry:        US\\nPostalCode:     82801\\nComment:        http://tnd.cloud\\nComment:        http://tndhost.com\\nRegDate:        2020-07-09\\nUpdated:        2020-07-09\\nOrgAbuseHandle: TDN5-ARIN\\nOrgAdminHandle: TDN5-ARIN\\nOrgDNSHandle:   TDN5-ARIN\\nOrgNOCHandle:   TDN5-ARIN\\nOrgRoutingHandle:   TDN5-ARIN\\nOrgTechHandle:  TDN5-ARIN\\nSource:         ARIN\\n\n\nPOCHandle:      TDN5-ARIN\\nIsRole:         N\\nLastName:       Nguyen\\nFirstName:      Thanh\\nStreet:         1309 Coffeen Avenue STE 1200\\nCity:           Sheridan\\nState/Prov:     WY\\nCountry:        US\\nPostalCode:     87505\\nRegDate:        2020-04-02\\nUpdated:        2021-09-07\\nOfficePhone:    +1-307-222-7999\\nMailbox:        sales@tnd.cloud\\nSource:         ARIN\\n"}, {"range": "24.144.253.128/25", "id": "ACS-SOUTHPOINTOH", "name": "Armstrong", "country": "US", "domain": "armstrongonewire.com", "org_id": "ARMC", "status": "REALLOCATION", "tech_id": "NOC11973-ARIN", "mnt_id": "NOC11973-ARIN", "admin_id": "NOC11973-ARIN", "abuse_id": "NOC11974-ARIN", "created": "2019-12-30", "updated": "2019-12-30", "source": "arin", "raw": "NetHandle:      NET-24-144-253-128-1\\nOrgID:          ARMC\\nParent:         NET-24-144-128-0-1\\nNetName:        ACS-SOUTHPOINTOH\\nNetRange:       24.144.253.128 - 24.144.253.255\\nNetType:        reallocation\\nOriginAS:       27364\\nRegDate:        2019-12-30\\nUpdated:        2019-12-30\\nSource:         ARIN\\n\n\nOrgID:          ARMC\\nOrgName:        Armstrong\\nCanAllocate:    \\nStreet:         ONE Armstrong Place\\nCity:           Butler\\nState/Prov:     PA\\nCountry:        US\\nPostalCode:     16001\\nRegDate:        1997-08-28\\nUpdated:        2022-04-18\\nOrgAbuseHandle: NOC11974-ARIN\\nOrgAdminHandle: NOC11973-ARIN\\nOrgNOCHandle:   NOC11973-ARIN\\nOrgTechHandle:  NOC11973-ARIN\\nSource:         ARIN\\n\n\nPOCHandle:      NOC11973-ARIN\\nIsRole:         Y\\nLastName:       Network Operations Center\\nFirstName:      \\nStreet:         One Armstrong Place\\nCity:           Butler\\nState/Prov:     PA\\nCountry:        US\\nPostalCode:     16001\\nRegDate:        2011-04-28\\nUpdated:        2022-04-20\\nOfficePhone:    +1-877-277-5709\\nFaxPhone:       +1-724-282-5624\\nMailbox:        noc@zoominternet.net\\nSource:         ARIN\\n\n\nPOCHandle:      NOC11974-ARIN\\nIsRole:         Y\\nLastName:       Network Operations Center\\nFirstName:      \\nStreet:         One Armstrong Place\\nCity:           Butler\\nState/Prov:     PA\\nCountry:        US\\nPostalCode:     16001\\nRegDate:        2011-04-28\\nUpdated:        2022-04-20\\nFaxPhone:       +1-724-282-5624\\nOfficePhone:    +1-877-277-5709\\nMailbox:        abuse@zoominternet.net\\nSource:         ARIN\\n"}, {"range": "209.133.204.120/29", "id": "PURPLE-IT-INC", "name": "Purple IT Inc", "country": "US", "domain": "purpleit.com", "org_id": "PI-984", "status": "REASSIGNMENT", "tech_id": "AHMED245-ARIN", "mnt_id": "AHMED245-ARIN", "admin_id": "AHMED245-ARIN", "abuse_id": "AHMED246-ARIN", "created": "2021-07-11", "updated": "2021-07-11", "source": "arin", "raw": "NetHandle:      NET-209-133-204-120-1\\nOrgID:          PI-984\\nParent:         NET-209-133-192-0-1\\nNetName:        PURPLE-IT-INC\\nNetRange:       209.133.204.120 - 209.133.204.127\\nNetType:        reassignment\\nOriginAS:       29802\\nComment:        For abuse issues please contact abuse@purpleit.com\\nRegDate:        2021-07-11\\nUpdated:        2021-07-11\\nSource:         ARIN\\n\n\nOrgID:          PI-984\\nOrgName:        Purple IT Inc\\nCanAllocate:    \\nStreet:         30 N Gould St Ste 1336\\nCity:           Sheridan\\nState/Prov:     WY\\nCountry:        US\\nPostalCode:     82801\\nRegDate:        2021-04-27\\nUpdated:        2021-07-09\\nOrgAbuseHandle: AHMED246-ARIN\\nOrgAdminHandle: AHMED245-ARIN\\nOrgDNSHandle:   AHMED245-ARIN\\nOrgNOCHandle:   AHMED245-ARIN\\nOrgRoutingHandle:   AHMED245-ARIN\\nOrgTechHandle:  AHMED245-ARIN\\nSource:         ARIN\\n\n\nPOCHandle:      AHMED246-ARIN\\nIsRole:         N\\nLastName:       Ahmed\\nFirstName:      Saleh\\nStreet:         30 N Gould St Ste 1336\\nCity:           Sheridan\\nState/Prov:     WY\\nCountry:        US\\nPostalCode:     82801\\nRegDate:        2021-07-09\\nUpdated:        2022-07-11\\nOfficePhone:    +1-307-429-0696\\nMailbox:        abuse@purpleit.com\\nSource:         ARIN\\n\n\nPOCHandle:      AHMED245-ARIN\\nIsRole:         N\\nLastName:       Ahmed\\nFirstName:      Saleh\\nStreet:         30 N Gould St Ste 1336\\nCity:           Sheridan\\nState/Prov:     WY\\nCountry:        US\\nPostalCode:     82801\\nRegDate:        2021-04-20\\nUpdated:        2021-04-20\\nOfficePhone:    +1-307-429-0696\\nMailbox:        saleh@purpleit.com\\nSource:         ARIN\\n"}, {"range": "67.207.32.0/20", "id": "CENTRACOM", "name": "Central Utah Telephone, Inc.", "country": "US", "domain": "cut.net", "org_id": "CNUT", "status": "ALLOCATION", "tech_id": "BW918-ARIN", "mnt_id": "CHILD294-ARIN\\NTESIM-ARIN", "admin_id": "TESIM-ARIN", "abuse_id": "ABUSE8245-ARIN", "created": "2007-06-27", "updated": "2013-03-12", "source": "arin", "raw": "NetHandle:      NET-67-207-32-0-1\\nOrgID:          CNUT\\nParent:         NET-67-0-0-0-0\\nNetName:        CENTRACOM\\nNetRange:       67.207.32.0 - 67.207.47.255\\nNetType:        allocation\\nOriginAS:       36103\\nComment:        BW918-ARIN\\nRegDate:        2007-06-27\\nUpdated:        2013-03-12\\nAbuseHandle:    BW918-ARIN\\nNOCHandle:      BW918-ARIN\\nTechHandle:     BW918-ARIN\\nSource:         ARIN\\n\n\nOrgID:          CNUT\\nOrgName:        Central Utah Telephone, Inc.\\nCanAllocate:    \\nStreet:         PO Box 7\\nStreet:         45 West Center\\nCity:           Fairview\\nState/Prov:     UT\\nCountry:        US\\nPostalCode:     84629\\nRegDate:        2001-04-27\\nUpdated:        2021-09-17\\nOrgAbuseHandle: ABUSE8245-ARIN\\nOrgAdminHandle: TESIM-ARIN\\nOrgDNSHandle:   TESIM-ARIN\\nOrgNOCHandle:   CHILD294-ARIN\\nOrgNOCHandle:   TESIM-ARIN\\nOrgRoutingHandle:   CHILD294-ARIN\\nOrgRoutingHandle:   TESIM-ARIN\\nOrgTechHandle:  CHILD294-ARIN\\nOrgTechHandle:  TESIM-ARIN\\nSource:         ARIN\\n\n\nPOCHandle:      CHILD294-ARIN\\nIsRole:         N\\nLastName:       Childs\\nFirstName:      Brandon\\nStreet:         35 S. State St\\nCity:           Fairview\\nState/Prov:     UT\\nCountry:        US\\nPostalCode:     84629\\nRegDate:        2020-08-12\\nUpdated:        2022-08-16\\nOfficePhone:    +1-435-427-0520\\nMailbox:        b.childs@centracom.com\\nSource:         ARIN\\n\n\nPOCHandle:      ABUSE8245-ARIN\\nIsRole:         Y\\nLastName:       Abuse\\nFirstName:      \\nStreet:         35 S. State Street\\nCity:           Fairview\\nState/Prov:     UT\\nCountry:        US\\nPostalCode:     84629\\nRegDate:        2021-09-15\\nUpdated:        2021-09-15\\nOfficePhone:    +1-844-427-0533\\nMailbox:        abuse@centracom.com\\nSource:         ARIN\\n\n\nPOCHandle:      BW918-ARIN\\nIsRole:         N\\nLastName:       Welch\\nFirstName:      Brad\\nStreet:         Cental Utah Telephon\\nStreet:         45 W. Center PO Box 7\\nCity:           Fairview\\nState/Prov:     UT\\nCountry:        US\\nPostalCode:     84629\\nRegDate:        2001-11-13\\nUpdated:        2021-02-22\\nOfficePhone:    +1-800-427-8449\\nMailbox:        bradw@centracom.com\\nSource:         ARIN\\n\n\nPOCHandle:      TESIM-ARIN\\nIsRole:         N\\nLastName:       Tesi\\nFirstName:      Manase\\nStreet:         PO Box 7\\nCity:           Fairview\\nState/Prov:     UT\\nCountry:        US\\nPostalCode:     84629\\nRegDate:        2017-10-10\\nUpdated:        2022-01-27\\nOfficePhone:    +1-435-427-0582\\nMailbox:        manase@centracom.com\\nSource:         ARIN\\n"}, {"range": "184.8.0.0/13", "id": "FRONTIER-COMMUNICATIONS", "name": "Frontier Communications of America, Inc.", "country": "US", "domain": "frontiernet.net", "org_id": "FRTR", "status": "ALLOCATION", "tech_id": "ZF47-ARIN", "mnt_id": "ZF47-ARIN", "admin_id": "IPADM314-ARIN", "abuse_id": "ABUSE223-ARIN", "created": "2009-10-01", "updated": "2012-02-24", "source": "arin", "raw": "NetHandle:      NET-184-8-0-0-1\\nOrgID:          FRTR\\nParent:         NET-184-0-0-0-0\\nNetName:        FRONTIER-COMMUNICATIONS\\nNetRange:       184.8.0.0 - 184.15.255.255\\nNetType:        allocation\\nOriginAS:       30064, 5650, 7011, 3593, 26127\\nComment:        All abuse complaints for this block will only be\\nComment:        answered by the Frontier abuse team and not the ELI abuse team. Use\\nComment:        contact info from Handle ABUSE223-ARIN.\\nRegDate:        2009-10-01\\nUpdated:        2012-02-24\\nAbuseHandle:    ABUSE223-ARIN\\nNOCHandle:      ZF47-ARIN\\nTechHandle:     ZF47-ARIN\\nSource:         ARIN\\n\n\nOrgID:          FRTR\\nOrgName:        Frontier Communications of America, Inc.\\nCanAllocate:    \\nStreet:         95 Fitzhugh St N\\nCity:           Rochester\\nState/Prov:     NY\\nCountry:        US\\nPostalCode:     14614\\nComment:        all abuse complaints will only be answered when sent to abuse@frontiernet.net\\nRegDate:        1996-05-09\\nUpdated:        2021-05-03\\nReferralServer: rwhois://rwhois.frontiernet.net:4321\\nOrgAbuseHandle: ABUSE223-ARIN\\nOrgAdminHandle: IPADM314-ARIN\\nOrgRoutingHandle:   HOSTM2146-ARIN\\nOrgTechHandle:  ZF47-ARIN\\nSource:         ARIN\\n\n\nPOCHandle:      ABUSE223-ARIN\\nIsRole:         Y\\nLastName:       Abuse\\nFirstName:      \\nStreet:         95 Fitzhugh St N\\nCity:           Rochester\\nState/Prov:     NY\\nCountry:        US\\nPostalCode:     14614\\nRegDate:        2003-03-07\\nUpdated:        2021-11-22\\nOfficePhone:    +1-972-908-4105\\nOfficePhone:    +1-866-745-9122\\nMailbox:        abuse@frontiernet.net\\nSource:         ARIN\\n\n\nPOCHandle:      IPADM314-ARIN\\nIsRole:         Y\\nLastName:       ipadmin\\nFirstName:      \\nStreet:         95 Fitzhugh St N\\nCity:           Rochester\\nState/Prov:     NY\\nCountry:        US\\nPostalCode:     14614\\nRegDate:        2006-07-18\\nUpdated:        2021-09-16\\nOfficePhone:    +1-585-413-9128\\nMailbox:        marla.azinger@ftr.com\\nMailbox:        ip.address.escalations@ftr.com\\nSource:         ARIN\\n\n\nPOCHandle:      ZF47-ARIN\\nIsRole:         Y\\nLastName:       Frontier Communications\\nFirstName:      \\nStreet:         95 Fitzhugh St N\\nCity:           Rochester\\nState/Prov:     NY\\nCountry:        US\\nPostalCode:     14614\\nRegDate:        2001-11-21\\nUpdated:        2021-11-22\\nOfficePhone:    +1-972-908-4105\\nOfficePhone:    +1-866-745-9122\\nMailbox:        abuse@frontiernet.net\\nSource:         ARIN\\n"}, {"range": "198.232.147.0/24", "id": "DIGITALOCEAN-198-232-147-0", "name": "DigitalOcean, LLC", "country": "US", "domain": "digitalocean.com", "org_id": "DO-13", "status": "ALLOCATION", "tech_id": "NOC32014-ARIN", "mnt_id": "NOC32014-ARIN", "admin_id": "NOC32014-ARIN", "abuse_id": "ABUSE5232-ARIN", "created": "1993-11-15", "updated": "2020-04-03", "source": "arin", "raw": "NetHandle:      NET-198-232-147-0-1\\nOrgID:          DO-13\\nParent:         NET-198-0-0-0-0\\nNetName:        DIGITALOCEAN-198-232-147-0\\nNetRange:       198.232.147.0 - 198.232.147.255\\nNetType:        allocation\\nOriginAS:       14061\\nComment:        Routing and Peering Policy can be found at https://www.as14061.net\\nComment:        Please submit abuse reports at https://www.digitalocean.com/company/contact/#abuse\\nRegDate:        1993-11-15\\nUpdated:        2020-04-03\\nSource:         ARIN\\n\n\nOrgID:          DO-13\\nOrgName:        DigitalOcean, LLC\\nCanAllocate:    \\nStreet:         101 Ave of the Americas\\nStreet:         FL2\\nCity:           New York\\nState/Prov:     NY\\nCountry:        US\\nPostalCode:     10013\\nRegDate:        2012-05-14\\nUpdated:        2022-05-19\\nOrgAbuseHandle: ABUSE5232-ARIN\\nOrgAdminHandle: NOC32014-ARIN\\nOrgNOCHandle:   NOC32014-ARIN\\nOrgTechHandle:  NOC32014-ARIN\\nSource:         ARIN\\n\n\nPOCHandle:      ABUSE5232-ARIN\\nIsRole:         N\\nLastName:       Abuse\\nFirstName:      DigitalOcean\\nStreet:         101, Ave of the Americas\\nCity:           New York\\nState/Prov:     NY\\nCountry:        US\\nPostalCode:     10013\\nRegDate:        2015-10-09\\nUpdated:        2021-11-24\\nOfficePhone:    +1-347-875-6044\\nMailbox:        abuse@digitalocean.com\\nSource:         ARIN\\n\n\nPOCHandle:      NOC32014-ARIN\\nIsRole:         Y\\nLastName:       Network Operations Center\\nFirstName:      \\nStreet:         101 Ave of the Americas\\nStreet:         FL2\\nCity:           New York\\nState/Prov:     NY\\nCountry:        US\\nPostalCode:     10013\\nRegDate:        2014-08-22\\nUpdated:        2022-05-19\\nOfficePhone:    +1-347-875-6044\\nMailbox:        noc@digitalocean.com\\nSource:         ARIN\\n"}, {"range": "107.161.56.0/21", "id": "EBOX-NET-107-161-56-0-1", "name": "EBOX", "country": "CA", "domain": "as1403.net", "org_id": "QUEBE-50", "status": "ALLOCATION", "tech_id": "TECH1007-ARIN", "mnt_id": "NOC32597-ARIN", "admin_id": "ADMIN6354-ARIN", "abuse_id": "ABUSE5806-ARIN", "created": "2018-09-13", "updated": "2020-10-12", "source": "arin", "raw": "NetHandle:      NET-107-161-56-0-1\\nOrgID:          QUEBE-50\\nParent:         NET-107-0-0-0-0\\nNetName:        EBOX-NET-107-161-56-0-1\\nNetRange:       107.161.56.0 - 107.161.63.255\\nNetType:        allocation\\nOriginAS:       1403\\nComment:        Geofeed https://as1403.net/geofeed.csv\\nRegDate:        2018-09-13\\nUpdated:        2020-10-12\\nSource:         ARIN\\n\n\nOrgID:          QUEBE-50\\nOrgName:        EBOX\\nCanAllocate:    \\nStreet:         1225 St-Charles Ouest, Suite 1100\\nCity:           Longueuil\\nState/Prov:     QC\\nCountry:        CA\\nPostalCode:     J4K 0B9\\nRegDate:        2009-06-29\\nUpdated:        2020-02-19\\nOrgAbuseHandle: ABUSE5806-ARIN\\nOrgAdminHandle: ADMIN6354-ARIN\\nOrgDNSHandle:   NOC32597-ARIN\\nOrgNOCHandle:   NOC32597-ARIN\\nOrgRoutingHandle:   NOC32597-ARIN\\nOrgTechHandle:  TECH1007-ARIN\\nSource:         ARIN\\n\n\nPOCHandle:      ADMIN6354-ARIN\\nIsRole:         Y\\nLastName:       Admin\\nFirstName:      \\nStreet:         1225 St-Charles Ouest, Suite 1100\\nCity:           Longueuil\\nState/Prov:     QC\\nCountry:        CA\\nPostalCode:     J4K 0B9\\nRegDate:        2017-01-05\\nUpdated:        2022-01-05\\nOfficePhone:    +1-877-282-6933\\nMailbox:        noc@ebox.ca\\nSource:         ARIN\\n\n\nPOCHandle:      ABUSE5806-ARIN\\nIsRole:         Y\\nLastName:       Abuse\\nFirstName:      \\nStreet:         1225 St-Charles Ouest, Suite 1100\\nCity:           Longueuil\\nState/Prov:     QC\\nCountry:        CA\\nPostalCode:     J4K 0B9\\nRegDate:        2017-01-05\\nUpdated:        2022-02-15\\nOfficePhone:    +1-877-282-6933\\nMailbox:        abuse@ebox.ca\\nSource:         ARIN\\n\n\nPOCHandle:      TECH1007-ARIN\\nIsRole:         Y\\nLastName:       Tech\\nFirstName:      \\nStreet:         1225 St-Charles Ouest, Suite 1100\\nCity:           Longueuil\\nState/Prov:     QC\\nCountry:        CA\\nPostalCode:     J4K 0B9\\nRegDate:        2017-01-05\\nUpdated:        2022-01-05\\nOfficePhone:    +1-877-282-6933\\nMailbox:        noc@ebox.ca\\nSource:         ARIN\\n\n\nPOCHandle:      NOC32597-ARIN\\nIsRole:         Y\\nLastName:       NOC\\nFirstName:      \\nStreet:         1225 St-Charles Ouest, Suite 1100\\nCity:           Longueuil\\nState/Prov:     QC\\nCountry:        CA\\nPostalCode:     J4K 0B9\\nRegDate:        2017-01-05\\nUpdated:        2022-01-05\\nOfficePhone:    +1-877-282-6933\\nMailbox:        noc@ebox.ca\\nSource:         ARIN\\n"}, {"range": "66.115.196.64/29", "id": "WEST-RIVER", "name": "West River Telecommunications Cooperative", "country": "US", "domain": "westriv.com", "org_id": "WRVR", "status": "REASSIGNMENT", "tech_id": "NRB2-ARIN\\NPQU2-ARIN", "mnt_id": "PQU2-ARIN", "admin_id": "MURSC1-ARIN", "abuse_id": "MURSC1-ARIN", "created": "2017-06-22", "updated": "2017-06-22", "source": "arin", "raw": "NetHandle:      NET-66-115-196-64-1\\nOrgID:          WRVR\\nParent:         NET-66-115-192-0-1\\nNetName:        WEST-RIVER\\nNetRange:       66.115.196.64 - 66.115.196.71\\nNetType:        reassignment\\nRegDate:        2017-06-22\\nUpdated:        2017-06-22\\nSource:         ARIN\\n\n\nOrgID:          WRVR\\nOrgName:        West River Telecommunications Cooperative\\nCanAllocate:    \\nStreet:         101 Main ST\\nStreet:         PO Box 467\\nCity:           Hazen\\nState/Prov:     ND\\nCountry:        US\\nPostalCode:     58545\\nRegDate:        1998-05-20\\nUpdated:        2021-07-19\\nOrgAbuseHandle: MURSC1-ARIN\\nOrgAdminHandle: MURSC1-ARIN\\nOrgNOCHandle:   PQU2-ARIN\\nOrgTechHandle:  NRB2-ARIN\\nOrgTechHandle:  PQU2-ARIN\\nSource:         ARIN\\n\n\nPOCHandle:      PQU2-ARIN\\nIsRole:         N\\nLastName:       Quast\\nFirstName:      Philip\\nStreet:         101 West Main\\nStreet:         PO Box 467\\nCity:           Hazen\\nState/Prov:     ND\\nCountry:        US\\nPostalCode:     58545\\nRegDate:        2004-08-04\\nUpdated:        2022-05-23\\nOfficePhone:    +1-701-748-2211\\nMailbox:        philq@wrtc.com\\nSource:         ARIN\\n\n\nPOCHandle:      NRB2-ARIN\\nIsRole:         N\\nLastName:       Beard\\nFirstName:      Nathan\\nStreet:         1205 4th Street NE\\nCity:           Staples\\nState/Prov:     MN\\nCountry:        US\\nPostalCode:     56479\\nRegDate:        2011-11-22\\nUpdated:        2021-12-29\\nOfficePhone:    +1-218-820-7636\\nMailbox:        nbeard@7sigma.com\\nSource:         ARIN\\n\n\nPOCHandle:      MURSC1-ARIN\\nIsRole:         N\\nLastName:       Murschel\\nFirstName:      Jody\\nStreet:         101 Main St W\\nCity:           Hazen\\nState/Prov:     ND\\nCountry:        US\\nPostalCode:     58523\\nRegDate:        2015-08-07\\nUpdated:        2022-03-25\\nMobilePhone:    +1-701-880-8535\\nOfficePhone:    +1-701-748-2211\\nMailbox:        jodym@wrtc.com\\nSource:         ARIN\\n"}, {"range": "205.143.192.0/24", "id": "WARENET-INT-1", "name": "Technicolor, Inc.", "country": "US", "domain": "technicolor.com", "org_id": "TECHNI-8", "status": "REASSIGNMENT", "tech_id": "ARINT14-ARIN", "mnt_id": "ARINT14-ARIN", "admin_id": "ARINA48-ARIN", "abuse_id": "ANSC1-ARIN", "created": "1996-08-07", "updated": "2013-05-16", "source": "arin", "raw": "NetHandle:      NET-205-143-192-0-2\\nOrgID:          TECHNI-8\\nParent:         NET-205-143-192-0-1\\nNetName:        WARENET-INT-1\\nNetRange:       205.143.192.0 - 205.143.192.255\\nNetType:        reassignment\\nRegDate:        1996-08-07\\nUpdated:        2013-05-16\\nAbuseHandle:    ANSC1-ARIN\\nTechHandle:     ARINT14-ARIN\\nSource:         ARIN\\n\n\nOrgID:          TECHNI-8\\nOrgName:        Technicolor, Inc.\\nCanAllocate:    \\nStreet:         8921 Lindblade St\\nCity:           Culver City\\nState/Prov:     CA\\nCountry:        US\\nPostalCode:     90232\\nComment:        https://www.technicolor.com/\\nRegDate:        1994-06-25\\nUpdated:        2021-09-22\\nOrgAbuseHandle: ANSC1-ARIN\\nOrgAdminHandle: ARINA48-ARIN\\nOrgNOCHandle:   ARINT14-ARIN\\nOrgTechHandle:  ARINT14-ARIN\\nSource:         ARIN\\n\n\nPOCHandle:      ARINA48-ARIN\\nIsRole:         Y\\nLastName:       ARIN-Admin\\nFirstName:      \\nStreet:         8921 Lindblade Street\\nCity:           Culver City\\nState/Prov:     CA\\nCountry:        US\\nPostalCode:     90232\\nRegDate:        2006-10-12\\nUpdated:        2022-02-21\\nOfficePhone:    +1-310-526-5800\\nMailbox:        arin.admin@thomson.net\\nMailbox:        arin.admin@technicolor.com\\nSource:         ARIN\\n\n\nPOCHandle:      ANSC1-ARIN\\nIsRole:         Y\\nLastName:       ARIN Network and Security Committee\\nFirstName:      \\nStreet:         6040 Sunset Blvd\\nCity:           Los Angeles\\nState/Prov:     CA\\nCountry:        US\\nPostalCode:     90028\\nRegDate:        2013-05-15\\nUpdated:        2022-02-28\\nOfficePhone:    +1-323-817-6600\\nMailbox:        abuse@technicolor.com\\nSource:         ARIN\\n\n\nPOCHandle:      ARINT14-ARIN\\nIsRole:         Y\\nLastName:       ARIN-Tech\\nFirstName:      \\nStreet:         8921 Lindblade St\\nCity:           Culver City\\nState/Prov:     CA\\nCountry:        US\\nPostalCode:     90232\\nRegDate:        2006-10-12\\nUpdated:        2022-05-31\\nOfficePhone:    +1-323-817-6600\\nMailbox:        arin.tech@thomson.net\\nMailbox:        arin.admin@technicolor.com\\nSource:         ARIN\\n"}, {"range": "66.228.192.0/19", "id": "GHD-66-228-192-0-1", "name": "Lunavi, Inc.", "country": "US", "domain": "greenhousedata.com", "org_id": "GHD-7", "status": "ALLOCATION", "tech_id": "NOC2912-ARIN", "mnt_id": "NOC2912-ARIN", "admin_id": "NOC2912-ARIN", "abuse_id": "NOC2912-ARIN", "created": "2002-02-08", "updated": "2018-02-26", "source": "arin", "raw": "NetHandle:      NET-66-228-192-0-1\\nOrgID:          GHD-7\\nParent:         NET-66-0-0-0-0\\nNetName:        GHD-66-228-192-0-1\\nNetRange:       66.228.192.0 - 66.228.223.255\\nNetType:        allocation\\nOriginAS:       6295\\nRegDate:        2002-02-08\\nUpdated:        2018-02-26\\nSource:         ARIN\\n\n\nOrgID:          GHD-7\\nOrgName:        Lunavi, Inc.\\nCanAllocate:    \\nStreet:         304 Progress Circle\\nCity:           Cheyenne\\nState/Prov:     WY\\nCountry:        US\\nPostalCode:     82007\\nRegDate:        2007-12-27\\nUpdated:        2020-09-30\\nReferralServer: rwhois://rwhois.greenhousedata.com:4321\\nOrgAbuseHandle: NOC2912-ARIN\\nOrgAdminHandle: NOC2912-ARIN\\nOrgNOCHandle:   NOC2912-ARIN\\nOrgTechHandle:  NOC2912-ARIN\\nSource:         ARIN\\n\n\nPOCHandle:      NOC2912-ARIN\\nIsRole:         Y\\nLastName:       Network Operations Center\\nFirstName:      \\nStreet:         340 Progress Circle\\nCity:           Cheyenne\\nState/Prov:     WY\\nCountry:        US\\nPostalCode:     82007\\nRegDate:        2007-12-27\\nUpdated:        2021-09-21\\nOfficePhone:    +1-866-995-3282\\nFaxPhone:       +1-307-222-0643\\nMailbox:        noc@lunavi.com\\nSource:         ARIN\\n"}, {"range": "76.76.144.0/20", "id": "PDX-NET-2", "name": "PORTLAND INTERNETWORKS", "country": "US", "domain": "pdx.net", "org_id": "PRTL", "status": "ALLOCATION", "tech_id": "MCWIL-ARIN", "mnt_id": "MCWIL-ARIN", "admin_id": "DEW36-ARIN", "abuse_id": "ABUSE1471-ARIN", "created": "2008-09-30", "updated": "2019-03-06", "source": "arin", "raw": "NetHandle:      NET-76-76-144-0-1\\nOrgID:          PRTL\\nParent:         NET-76-0-0-0-0\\nNetName:        PDX-NET-2\\nNetRange:       76.76.144.0 - 76.76.159.255\\nNetType:        allocation\\nOriginAS:       13409\\nRegDate:        2008-09-30\\nUpdated:        2019-03-06\\nAbuseHandle:    ABUSE1471-ARIN\\nNOCHandle:      MCWIL-ARIN\\nTechHandle:     MCWIL-ARIN\\nSource:         ARIN\\n\n\nOrgID:          PRTL\\nOrgName:        PORTLAND INTERNETWORKS\\nCanAllocate:    \\nStreet:         419 NE 10th Ave\\nCity:           Portland\\nState/Prov:     OR\\nCountry:        US\\nPostalCode:     97232\\nRegDate:        1999-03-01\\nUpdated:        2019-03-06\\nOrgAbuseHandle: ABUSE1471-ARIN\\nOrgAdminHandle: DEW36-ARIN\\nOrgNOCHandle:   MCWIL-ARIN\\nOrgTechHandle:  MCWIL-ARIN\\nSource:         ARIN\\n\n\nPOCHandle:      DEW36-ARIN\\nIsRole:         N\\nLastName:       Westervelt\\nFirstName:      Doug\\nStreet:         532 SE Clay Street\\nCity:           Portland\\nState/Prov:     OR\\nCountry:        US\\nPostalCode:     97214\\nRegDate:        2013-08-08\\nUpdated:        2017-09-18\\nOfficePhone:    +1-503-972-7272\\nFaxPhone:       +1-503-222-0548\\nMailbox:        dougw@pdx.net\\nSource:         ARIN\\n\n\nPOCHandle:      ABUSE1471-ARIN\\nIsRole:         Y\\nLastName:       Abuse\\nFirstName:      \\nStreet:         419 NE 10th Ave\\nCity:           Portland\\nState/Prov:     OR\\nCountry:        US\\nPostalCode:     97232\\nRegDate:        2006-10-23\\nUpdated:        2021-11-13\\nOfficePhone:    +1-503-972-7272\\nMailbox:        abuse@pdx.net\\nSource:         ARIN\\n\n\nPOCHandle:      MCWIL-ARIN\\nIsRole:         N\\nLastName:       McWilliams\\nFirstName:      Tim\\nStreet:         419 NE 10th Ave\\nCity:           Portland\\nState/Prov:     OR\\nCountry:        US\\nPostalCode:     97232\\nRegDate:        2011-05-09\\nUpdated:        2021-11-13\\nOfficePhone:    +1-503-972-7272\\nFaxPhone:       +1-503-222-0548\\nMailbox:        tim@pdx.net\\nSource:         ARIN\\n"}, {"range": "205.234.203.0/24", "id": "SCNET-205-234-203-0-24", "name": "ColoCrossing", "country": "US", "domain": "colocrossing.com", "org_id": "VGS-9", "status": "REALLOCATION", "tech_id": "NETWO882-ARIN", "mnt_id": "NETWO882-ARIN", "admin_id": "NETWO882-ARIN", "abuse_id": "ABUSE3246-ARIN", "created": "2010-06-09", "updated": "2010-06-09", "source": "arin", "raw": "NetHandle:      NET-205-234-203-0-1\\nOrgID:          VGS-9\\nParent:         NET-205-234-128-0-1\\nNetName:        SCNET-205-234-203-0-24\\nNetRange:       205.234.203.0 - 205.234.203.255\\nNetType:        reallocation\\nOriginAS:       36352\\nRegDate:        2010-06-09\\nUpdated:        2010-06-09\\nSource:         ARIN\\n\n\nOrgID:          VGS-9\\nOrgName:        ColoCrossing\\nCanAllocate:    \\nStreet:         325 Delaware Avenue\\nStreet:         Suite 300\\nCity:           Buffalo\\nState/Prov:     NY\\nCountry:        US\\nPostalCode:     14202\\nRegDate:        2005-06-20\\nUpdated:        2019-10-17\\nOrgAbuseHandle: ABUSE3246-ARIN\\nOrgAdminHandle: NETWO882-ARIN\\nOrgNOCHandle:   NETWO882-ARIN\\nOrgTechHandle:  NETWO882-ARIN\\nSource:         ARIN\\n\n\nPOCHandle:      ABUSE3246-ARIN\\nIsRole:         Y\\nLastName:       Abuse\\nFirstName:      \\nStreet:         325 Delaware Avenue\\nStreet:         Suite 300\\nCity:           Buffalo\\nState/Prov:     NY\\nCountry:        US\\nPostalCode:     14202\\nRegDate:        2011-11-14\\nUpdated:        2022-02-07\\nOfficePhone:    +1-800-518-9716\\nMailbox:        abuse@colocrossing.com\\nSource:         ARIN\\n\n\nPOCHandle:      NETWO882-ARIN\\nIsRole:         Y\\nLastName:       Network Operations\\nFirstName:      \\nStreet:         325 Delaware Avenue\\nStreet:         Suite 300\\nCity:           Buffalo\\nState/Prov:     NY\\nCountry:        US\\nPostalCode:     14202\\nRegDate:        2005-06-03\\nUpdated:        2022-08-11\\nOfficePhone:    +1-800-518-9716\\nMailbox:        support@colocrossing.com\\nSource:         ARIN\\n"}, {"range": "12.191.194.0/24", "id": "NET-12-191-194-0-24", "name": "Datrium, Inc", "country": "US", "domain": "datrium.com", "org_id": "DATRI-1", "status": "REASSIGNMENT", "tech_id": "DAADM-ARIN\\NHB29-ARIN", "mnt_id": "DAADM-ARIN\\NHB29-ARIN", "admin_id": "HB29-ARIN", "abuse_id": "DAADM-ARIN", "created": "2020-04-30", "updated": "2020-04-30", "source": "arin", "raw": "NetHandle:      NET-12-191-194-0-1\\nOrgID:          DATRI-1\\nParent:         NET-12-0-0-0-1\\nNetName:        NET-12-191-194-0-24\\nNetRange:       12.191.194.0 - 12.191.194.255\\nNetType:        reassignment\\nRegDate:        2020-04-30\\nUpdated:        2020-04-30\\nSource:         ARIN\\n\n\nOrgID:          DATRI-1\\nOrgName:        Datrium, Inc\\nCanAllocate:    \\nStreet:         385 Moffett Park Dr.\\nStreet:         Suite 205\\nCity:           Sunnyvale\\nState/Prov:     CA\\nCountry:        US\\nPostalCode:     94089\\nRegDate:        2016-08-02\\nUpdated:        2016-11-04\\nOrgAbuseHandle: DAADM-ARIN\\nOrgAbuseHandle: HB29-ARIN\\nOrgAdminHandle: HB29-ARIN\\nOrgNOCHandle:   DAADM-ARIN\\nOrgNOCHandle:   HB29-ARIN\\nOrgTechHandle:  DAADM-ARIN\\nOrgTechHandle:  HB29-ARIN\\nSource:         ARIN\\n\n\nPOCHandle:      HB29-ARIN\\nIsRole:         N\\nLastName:       barker\\nFirstName:      harold\\nStreet:         385 Moffett Park Dr.\\nStreet:         Suite 205\\nCity:           Sunnyvale\\nState/Prov:     CA\\nCountry:        US\\nPostalCode:     94089\\nRegDate:        1994-02-25\\nUpdated:        2021-09-30\\nOfficePhone:    +1-669-721-9444\\nMailbox:        hvb@dsms.com\\nSource:         ARIN\\n\n\nPOCHandle:      DAADM-ARIN\\nIsRole:         Y\\nLastName:       daadmin\\nFirstName:      \\nStreet:         385 Moffett Park Dr. Suite 205\\nCity:           Sunnyvale\\nState/Prov:     CA\\nCountry:        US\\nPostalCode:     94089\\nRegDate:        2016-11-04\\nUpdated:        2021-11-03\\nOfficePhone:    +1-669-721-9444\\nMailbox:        daadmin@datrium.com\\nSource:         ARIN\\n"}, {"range": "206.108.161.88/29", "id": "NET-ACCEL-CLIENTS161-88", "name": "Accelerated Connections Inc.", "country": "CA", "domain": "connections.ca", "org_id": "ACLT", "status": "REASSIGNMENT", "tech_id": "DBL7-ARIN", "mnt_id": "NOC2114-ARIN", "admin_id": "AS3251-ARIN", "abuse_id": "GAD46-ARIN", "created": "2006-03-21", "updated": "2006-03-21", "source": "arin", "raw": "NetHandle:      NET-206-108-161-88-1\\nOrgID:          ACLT\\nParent:         NET-206-108-128-0-1\\nNetName:        NET-ACCEL-CLIENTS161-88\\nNetRange:       206.108.161.88 - 206.108.161.95\\nNetType:        reassignment\\nRegDate:        2006-03-21\\nUpdated:        2006-03-21\\nTechHandle:     DBL7-ARIN\\nSource:         ARIN\\n\n\nOrgID:          ACLT\\nOrgName:        Accelerated Connections Inc.\\nCanAllocate:    \\nStreet:         3740 - 155 Wellington St. W.\\nCity:           Toronto\\nState/Prov:     ON\\nCountry:        CA\\nPostalCode:     M5V 3H1\\nComment:        http://www.connections.ca\\nRegDate:        2000-12-19\\nUpdated:        2019-07-03\\nOrgAbuseHandle: GAD46-ARIN\\nOrgAdminHandle: AS3251-ARIN\\nOrgNOCHandle:   NOC2114-ARIN\\nOrgTechHandle:  AS3251-ARIN\\nOrgTechHandle:  NOC2114-ARIN\\nSource:         ARIN\\n\n\nPOCHandle:      DBL7-ARIN\\nIsRole:         N\\nLastName:       Blackwood\\nFirstName:      Dean\\nStreet:         3740 - 155 Wellington St W\\nCity:           Toronto\\nState/Prov:     ON\\nCountry:        CA\\nPostalCode:     M5V 3H1\\nRegDate:        2003-04-17\\nUpdated:        2019-07-03\\nOfficePhone:    +1-416-637-3433\\nMailbox:        support@dsl4u.ca\\nSource:         ARIN\\n\n\nPOCHandle:      GAD46-ARIN\\nIsRole:         Y\\nLastName:       GTT Abuse Department\\nFirstName:      \\nStreet:         7900 Tysons One Place\\nStreet:         Suite 1450\\nCity:           McLean\\nState/Prov:     VA\\nCountry:        US\\nPostalCode:     22102\\nRegDate:        2014-04-16\\nUpdated:        2022-01-19\\nFaxPhone:       +1-703-442-5501\\nOfficePhone:    +1-703-442-5500\\nMailbox:        abuse@gtt.net\\nSource:         ARIN\\n\n\nPOCHandle:      AS3251-ARIN\\nIsRole:         Y\\nLastName:       AS3257 Netguard\\nFirstName:      \\nStreet:         Hugenottenallee 167\\nCity:           Neu-Isenburg\\nState/Prov:     \\nCountry:        DE\\nPostalCode:     63263\\nRegDate:        2009-07-03\\nUpdated:        2022-06-07\\nOfficePhone:    +49 6102 8235 381\\nFaxPhone:       +49 6102 8235 389\\nMailbox:        netguard@gtt.net\\nSource:         ARIN\\n\n\nPOCHandle:      NOC2114-ARIN\\nIsRole:         Y\\nLastName:       Network Operations Center\\nFirstName:      \\nStreet:         155 Wellington St West, Suite 3740\\nCity:           Toronto\\nState/Prov:     ON\\nCountry:        CA\\nPostalCode:     M5V 3H1\\nRegDate:        2006-05-01\\nUpdated:        2019-07-03\\nOfficePhone:    +1-416-637-3433\\nMailbox:        net.eng@connections.ca\\nSource:         ARIN\\n"}, {"range": "198.178.234.0-198.178.239.255", "id": "NETBLK-MILWRDBRN", "name": "Millward Brown, Inc.", "country": "US", "domain": "millwardbrown.com", "org_id": "MILLWA", "status": "ALLOCATION", "tech_id": "KANTA10-ARIN", "mnt_id": "KANTA10-ARIN", "admin_id": "KANTA10-ARIN", "abuse_id": "KANTA10-ARIN", "created": "1993-07-30", "updated": "2021-12-14", "source": "arin", "raw": "NetHandle:      NET-198-178-234-0-1\\nOrgID:          MILLWA\\nParent:         NET-198-0-0-0-0\\nNetName:        NETBLK-MILWRDBRN\\nNetRange:       198.178.234.0 - 198.178.239.255\\nNetType:        allocation\\nRegDate:        1993-07-30\\nUpdated:        2021-12-14\\nNOCHandle:      KANTA10-ARIN\\nSource:         ARIN\\n\n\nOrgID:          MILLWA\\nOrgName:        Millward Brown, Inc.\\nCanAllocate:    \\nStreet:         3333 Warrenville Road, Suite 400\\nCity:           Lisle\\nState/Prov:     IL\\nCountry:        US\\nPostalCode:     60532\\nRegDate:        1993-07-30\\nUpdated:        2019-07-15\\nOrgAbuseHandle: KANTA10-ARIN\\nOrgAdminHandle: KANTA10-ARIN\\nOrgDNSHandle:   KANTA10-ARIN\\nOrgNOCHandle:   KANTA10-ARIN\\nOrgRoutingHandle:   KANTA10-ARIN\\nOrgTechHandle:  KANTA10-ARIN\\nSource:         ARIN\\n\n\nPOCHandle:      KANTA10-ARIN\\nIsRole:         Y\\nLastName:       Kantar networks\\nFirstName:      \\nStreet:         6 More London Place\\nCity:           London\\nState/Prov:     UK\\nCountry:        GB\\nPostalCode:     SE12QY\\nRegDate:        2019-07-15\\nUpdated:        2022-07-20\\nOfficePhone:    +4402086014499\\nMailbox:        networks@kantar.com\\nSource:         ARIN\\n"}, {"range": "162.249.252.0/22", "id": "ADMO-NET5", "name": "Contegix", "country": "US", "domain": "contegix.com", "org_id": "CONTE-25", "status": "ALLOCATION", "tech_id": "HOSTM1486-ARIN", "mnt_id": "NOCCO14-ARIN", "admin_id": "HOSTM1486-ARIN", "abuse_id": "ABUSE2391-ARIN", "created": "2013-12-10", "updated": "2020-08-12", "source": "arin", "raw": "NetHandle:      NET-162-249-252-0-1\\nOrgID:          CONTE-25\\nParent:         NET-162-0-0-0-0\\nNetName:        ADMO-NET5\\nNetRange:       162.249.252.0 - 162.249.255.255\\nNetType:        allocation\\nOriginAS:       54020\\nRegDate:        2013-12-10\\nUpdated:        2020-08-12\\nSource:         ARIN\\n\n\nOrgID:          CONTE-25\\nOrgName:        Contegix\\nCanAllocate:    \\nStreet:         210 N. Tucker Blvd.\\nStreet:         Suite 600\\nCity:           St. Louis\\nState/Prov:     MO\\nCountry:        US\\nPostalCode:     63101\\nRegDate:        2009-04-13\\nUpdated:        2019-04-23\\nOrgAbuseHandle: ABUSE2391-ARIN\\nOrgAdminHandle: HOSTM1486-ARIN\\nOrgNOCHandle:   NOCCO14-ARIN\\nOrgTechHandle:  HOSTM1486-ARIN\\nSource:         ARIN\\n\n\nPOCHandle:      NOCCO14-ARIN\\nIsRole:         Y\\nLastName:       NOC-Contegix\\nFirstName:      \\nStreet:         210 N. Tucker Blvd.\\nStreet:         Suite 600\\nCity:           Saint Louis\\nState/Prov:     MO\\nCountry:        US\\nPostalCode:     63101\\nRegDate:        2011-07-28\\nUpdated:        2018-10-23\\nOfficePhone:    +1-314-622-6200\\nMailbox:        noc@contegix.com\\nSource:         ARIN\\n\n\nPOCHandle:      ABUSE2391-ARIN\\nIsRole:         Y\\nLastName:       Abuse-Contegix\\nFirstName:      \\nStreet:         210 N. Tucker Blvd.\\nStreet:         Suite 600\\nCity:           Saint Louis\\nState/Prov:     MO\\nCountry:        US\\nPostalCode:     63101\\nRegDate:        2009-09-01\\nUpdated:        2021-08-24\\nOfficePhone:    +1-314-622-6200\\nMailbox:        abuse@contegix.com\\nSource:         ARIN\\n\n\nPOCHandle:      HOSTM1486-ARIN\\nIsRole:         Y\\nLastName:       Hostmaster-Contegix\\nFirstName:      \\nStreet:         210 N. Tucker Blvd.\\nStreet:         Suite 600\\nCity:           Saint Louis\\nState/Prov:     MO\\nCountry:        US\\nPostalCode:     63101\\nRegDate:        2009-09-02\\nUpdated:        2021-04-07\\nOfficePhone:    +1-314-622-6200\\nMailbox:        hostmaster@contegix.com\\nSource:         ARIN\\n"}, {"range": "216.176.176.0/20", "id": "WOW-IPV4-NET1", "name": "Wowrack.com", "country": "US", "domain": "wowrack.com", "org_id": "WOWTEC-1", "status": "ALLOCATION", "tech_id": "EO104-ARIN", "mnt_id": "WOWRA-ARIN", "admin_id": "JP1718-ARIN", "abuse_id": "WAT1-ARIN", "created": "2004-04-07", "updated": "2012-03-02", "source": "arin", "raw": "NetHandle:      NET-216-176-176-0-1\\nOrgID:          WOWTEC-1\\nParent:         NET-216-0-0-0-0\\nNetName:        WOW-IPV4-NET1\\nNetRange:       216.176.176.0 - 216.176.191.255\\nNetType:        allocation\\nOriginAS:       23033\\nRegDate:        2004-04-07\\nUpdated:        2012-03-02\\nAbuseHandle:    WAT1-ARIN\\nNOCHandle:      WOWRA-ARIN\\nTechHandle:     EO104-ARIN\\nSource:         ARIN\\n\n\nOrgID:          WOWTEC-1\\nOrgName:        Wowrack.com\\nCanAllocate:    \\nStreet:         12201 Tukwila International Blvd\\nStreet:         STE 100\\nCity:           Seattle\\nState/Prov:     WA\\nCountry:        US\\nPostalCode:     98168\\nRegDate:        2002-01-07\\nUpdated:        2018-05-31\\nOrgAbuseHandle: WAT1-ARIN\\nOrgAdminHandle: JP1718-ARIN\\nOrgNOCHandle:   WOWRA-ARIN\\nOrgTechHandle:  WOWRA1-ARIN\\nSource:         ARIN\\n\n\nPOCHandle:      WAT1-ARIN\\nIsRole:         Y\\nLastName:       Wowrack Abuse Team\\nFirstName:      \\nStreet:         12201 Tukwila International Blvd\\nStreet:         STE 100\\nCity:           Seattle\\nState/Prov:     WA\\nCountry:        US\\nPostalCode:     98168\\nRegDate:        2003-07-29\\nUpdated:        2021-10-27\\nFaxPhone:       +1-866-969-8878\\nOfficePhone:    +1-206-522-4402\\nMailbox:        abuse@wowrack.com\\nSource:         ARIN\\n\n\nPOCHandle:      EO104-ARIN\\nIsRole:         N\\nLastName:       Osckar\\nFirstName:      Erward\\nStreet:         12201 Tukwila International Blvd\\nStreet:         STE 100\\nCity:           Seattle\\nState/Prov:     WA\\nCountry:        US\\nPostalCode:     98168\\nRegDate:        2002-01-07\\nUpdated:        2021-10-27\\nFaxPhone:       +1-866-969-8878\\nOfficePhone:    +1-206-522-4402\\nMailbox:        ed@wowrack.com\\nSource:         ARIN\\n\n\nPOCHandle:      JP1718-ARIN\\nIsRole:         N\\nLastName:       Pandra\\nFirstName:      Jimmy\\nStreet:         12201 Tukwila International Blvd\\nStreet:         STE 100\\nCity:           Seattle\\nState/Prov:     WA\\nCountry:        US\\nPostalCode:     98168\\nRegDate:        2001-11-26\\nUpdated:        2021-10-27\\nOfficePhone:    +1-206-522-4402\\nFaxPhone:       +1-866-969-8878\\nMailbox:        jim@wowrack.com\\nSource:         ARIN\\n\n\nPOCHandle:      WOWRA1-ARIN\\nIsRole:         Y\\nLastName:       Wowrack NOC\\nFirstName:      \\nStreet:         12201 Tukwila International Blvd\\nStreet:         STE 100\\nCity:           Seattle\\nState/Prov:     WA\\nCountry:        US\\nPostalCode:     98168\\nRegDate:        2008-03-14\\nUpdated:        2021-10-27\\nOfficePhone:    +1-206-522-4402\\nFaxPhone:       +1-866-969-8878\\nMailbox:        noc@wowrack.com\\nSource:         ARIN\\n\n\nPOCHandle:      WOWRA-ARIN\\nIsRole:         Y\\nLastName:       Wowrack Hostmaster\\nFirstName:      \\nStreet:         12201 Tukwila International Blvd\\nStreet:         STE 100\\nCity:           Seattle\\nState/Prov:     WA\\nCountry:        US\\nPostalCode:     98168\\nRegDate:        2003-07-29\\nUpdated:        2021-10-27\\nFaxPhone:       +1-866-969-8878\\nOfficePhone:    +1-206-522-4402\\nMailbox:        hostmaster@wowrack.com\\nSource:         ARIN\\n"}, {"range": "2001:428:c02:1ed::/64", "id": "Q0414-2001-0428-0C02-01ED-0000-0000-0000-0000", "name": "NBS", "country": "US", "domain": "nbsvoice.com", "org_id": "ISGIL", "status": "REALLOCATION", "tech_id": "GEORG13-ARIN\\NNETWO7814-ARIN", "mnt_id": "NOC11449-ARIN", "admin_id": "NETWO7814-ARIN", "abuse_id": "NOC11449-ARIN", "created": "2018-04-14", "updated": "2018-04-14", "source": "arin", "raw": "V6NetHandle:    NET6-2001-428-C02-1ED-1\\nOrgID:          ISGIL\\nParent:         NET6-2001-428-1\\nNetName:        Q0414-2001-0428-0C02-01ED-0000-0000-0000-0000\\nNetRange:       2001:428:C02:1ED:: - 2001:428:C02:1ED:FFFF:FFFF:FFFF:FFFF\\nNetType:        reallocation\\nOriginAS:       209\\nRegDate:        2018-04-14\\nUpdated:        2018-04-14\\nSource:         ARIN\\n\n\nOrgID:          ISGIL\\nOrgName:        NBS\\nCanAllocate:    \\nStreet:         c/o Fusion\\nStreet:         210 Interstate North Parkway, Suite 200\\nCity:           Atlanta\\nState/Prov:     GA\\nCountry:        US\\nPostalCode:     30339\\nComment:        http://www.nbsvoice.com\\nComment:        NOC: 973-638-2100 x2\\nRegDate:        2010-04-27\\nUpdated:        2021-09-24\\nOrgAbuseHandle: NOC11449-ARIN\\nOrgAdminHandle: NETWO7814-ARIN\\nOrgNOCHandle:   NOC11449-ARIN\\nOrgTechHandle:  GEORG13-ARIN\\nOrgTechHandle:  NETWO7814-ARIN\\nSource:         ARIN\\n\n\nPOCHandle:      GEORG13-ARIN\\nIsRole:         N\\nLastName:       George\\nFirstName:      Brian\\nStreet:         155 Willowbrook Blvd\\nCity:           Wayne\\nState/Prov:     NJ\\nCountry:        US\\nPostalCode:     07470\\nRegDate:        2010-04-27\\nUpdated:        2022-06-10\\nOfficePhone:    +1-973-638-2156\\nMailbox:        briang@nbsvoice.com\\nSource:         ARIN\\n\n\nPOCHandle:      NOC11449-ARIN\\nIsRole:         Y\\nLastName:       Network Operations Center\\nFirstName:      \\nStreet:         155 Willowbrook Blvd\\nCity:           Wayne\\nState/Prov:     NJ\\nCountry:        US\\nPostalCode:     07470\\nRegDate:        2010-04-27\\nUpdated:        2022-01-04\\nOfficePhone:    +1-973-638-2100\\nMailbox:        noc@nbsvoice.com\\nSource:         ARIN\\n\n\nPOCHandle:      NETWO7814-ARIN\\nIsRole:         Y\\nLastName:       Network Engineering\\nFirstName:      \\nStreet:         210 Interstate North Parkway, SE\\nStreet:         STE 300\\nCity:           Atlanta\\nState/Prov:     GA\\nCountry:        US\\nPostalCode:     30339\\nRegDate:        2016-06-03\\nUpdated:        2022-05-09\\nOfficePhone:    +1-888-301-1721\\nMailbox:        NCC@fusionconnect.com\\nMailbox:        arin@fusionconnect.com\\nSource:         ARIN\\n"}, {"range": "70.46.163.0/24", "id": "CLRWPBLFL1", "name": "CLEAR LINK Networks, Inc.", "country": "US", "domain": "clearlinknetworks.com", "org_id": "CLEAR-99", "status": "REASSIGNMENT", "tech_id": "NOC3516-ARIN", "mnt_id": "NOC3516-ARIN", "admin_id": "CLNC-ARIN", "abuse_id": "ABUSE2182-ARIN", "created": "2009-02-23", "updated": "2009-02-23", "source": "arin", "raw": "NetHandle:      NET-70-46-163-0-1\\nOrgID:          CLEAR-99\\nParent:         NET-70-46-0-0-1\\nNetName:        CLRWPBLFL1\\nNetRange:       70.46.163.0 - 70.46.163.255\\nNetType:        reassignment\\nOriginAS:       11458\\nRegDate:        2009-02-23\\nUpdated:        2009-02-23\\nNOCHandle:      NOC3516-ARIN\\nSource:         ARIN\\n\n\nOrgID:          CLEAR-99\\nOrgName:        CLEAR LINK Networks, Inc.\\nCanAllocate:    \\nStreet:         319 Clematis Street\\nStreet:         Third Floor - Suite #301\\nCity:           West Palm Beach\\nState/Prov:     FL\\nCountry:        US\\nPostalCode:     33401\\nComment:        http://www.clearlinknetworks.com\\nRegDate:        2009-02-19\\nUpdated:        2009-02-19\\nOrgAbuseHandle: ABUSE2182-ARIN\\nOrgAdminHandle: CLNC-ARIN\\nOrgNOCHandle:   NOC3516-ARIN\\nOrgTechHandle:  NOC3516-ARIN\\nSource:         ARIN\\n\n\nPOCHandle:      ABUSE2182-ARIN\\nIsRole:         Y\\nLastName:       Abuse Department\\nFirstName:      \\nStreet:         319 Clematis Street\\nStreet:         Third Floor - Suite #301\\nCity:           West Palm Beach\\nState/Prov:     FL\\nCountry:        US\\nPostalCode:     33401\\nRegDate:        2009-02-18\\nUpdated:        2009-02-18\\nOfficePhone:    +1-561-253-6500\\nFaxPhone:       +1-561-253-1001\\nMailbox:        abuse@clearlinknetworks.com\\nSource:         ARIN\\n\n\nPOCHandle:      NOC3516-ARIN\\nIsRole:         Y\\nLastName:       Network Operations Center\\nFirstName:      \\nStreet:         319 Clematis Street\\nStreet:         Third Floor - Suite #301\\nCity:           West Palm Beach\\nState/Prov:     FL\\nCountry:        US\\nPostalCode:     33401\\nRegDate:        2009-02-18\\nUpdated:        2010-11-04\\nOfficePhone:    +1-561-253-6602\\nFaxPhone:       +1-561-253-1001\\nMailbox:        noc@clearlinknetworks.com\\nSource:         ARIN\\n\n\nPOCHandle:      CLNC-ARIN\\nIsRole:         Y\\nLastName:       CLEAR LINK Networks Corporate\\nFirstName:      \\nStreet:         319 Clematis Street\\nStreet:         Third Floor - Suite #301\\nCity:           West Palm Beach\\nState/Prov:     FL\\nCountry:        US\\nPostalCode:     33401\\nRegDate:        2009-02-19\\nUpdated:        2010-08-17\\nFaxPhone:       +1-561-253-6500\\nOfficePhone:    +1-561-253-6500\\nMailbox:        sales@clearlinknetworks.com\\nSource:         ARIN\\n"}, {"range": "136.175.180.0/22", "id": "TERAMUNDI", "name": "Teramundi", "country": "US", "domain": "teramundi.com", "org_id": "TSLM-1", "status": "ALLOCATION", "tech_id": "NOC32474-ARIN", "mnt_id": "NOC32474-ARIN", "admin_id": "GUIMA1-ARIN", "abuse_id": "ABUSE5314-ARIN", "created": "2021-01-05", "updated": "2021-12-14", "source": "arin", "raw": "NetHandle:      NET-136-175-180-0-1\\nOrgID:          TSLM-1\\nParent:         NET-136-0-0-0-0\\nNetName:        TERAMUNDI\\nNetRange:       136.175.180.0 - 136.175.183.255\\nNetType:        allocation\\nOriginAS:       64233\\nComment:        ****************************************\\nComment:        Teramundi - Managed Hosting\\nComment:        https://www.teramundi.com/\\nComment:        ****************************************\\nRegDate:        2021-01-05\\nUpdated:        2021-12-14\\nSource:         ARIN\\n\n\nOrgID:          TSLM-1\\nOrgName:        Teramundi\\nCanAllocate:    \\nStreet:         601 Brickell Key Drive\\nCity:           Miami\\nState/Prov:     FL\\nCountry:        US\\nPostalCode:     33131\\nComment:        ****************************************\\nComment:        Teramundi - Managed Hosting\\nComment:        https://www.teramundi.com/\\nComment:        ****************************************\\nRegDate:        2015-06-08\\nUpdated:        2021-01-11\\nOrgAbuseHandle: ABUSE5314-ARIN\\nOrgAdminHandle: GUIMA1-ARIN\\nOrgNOCHandle:   NOC32474-ARIN\\nOrgTechHandle:  NOC32474-ARIN\\nSource:         ARIN\\n\n\nPOCHandle:      ABUSE5314-ARIN\\nIsRole:         Y\\nLastName:       Abuse\\nFirstName:      \\nStreet:         Rua Gelu Vervloet dos Santos, 590\\nStreet:         Suites 801/802\\nCity:           Vitoria\\nState/Prov:     ES\\nCountry:        BR\\nPostalCode:     29090-100\\nRegDate:        2015-12-19\\nUpdated:        2022-02-09\\nOfficePhone:    +55-27-3024-0004\\nMailbox:        abuse@teramundi.com\\nSource:         ARIN\\n\n\nPOCHandle:      NOC32474-ARIN\\nIsRole:         Y\\nLastName:       NOC\\nFirstName:      \\nStreet:         Rua Gelu Vervloet dos Santos, 590\\nStreet:         Suites 801/802\\nCity:           Vitoria\\nState/Prov:     ES\\nCountry:        BR\\nPostalCode:     29090-100\\nRegDate:        2015-12-19\\nUpdated:        2022-02-09\\nOfficePhone:    +55-27-3024-0004\\nMailbox:        operations@teramundi.com\\nSource:         ARIN\\n\n\nPOCHandle:      GUIMA1-ARIN\\nIsRole:         N\\nLastName:       Guimaraes\\nFirstName:      Luciano\\nStreet:         590, Gelu Vervloet dos Santos St, Suites 801 and 802\\nCity:           Vitoria\\nState/Prov:     Espirito Santo\\nCountry:        BR\\nPostalCode:     29090-100\\nRegDate:        2017-10-30\\nUpdated:        2021-12-21\\nOfficePhone:    +55-27-3024-0004\\nMailbox:        luciano@teramundi.com\\nSource:         ARIN\\n"}, {"range": "142.54.200.0/23", "id": "EPSILON-142-54-200", "name": "Epsilon Data Management LLC", "country": "US", "domain": "epsilon.com", "org_id": "PSI1", "status": "ALLOCATION", "tech_id": "RFU24-ARIN", "mnt_id": "RFU24-ARIN", "admin_id": "SA610-ARIN", "abuse_id": "DELIV1-ARIN", "created": "1991-05-13", "updated": "2021-12-14", "source": "arin", "raw": "NetHandle:      NET-142-54-200-0-1\\nOrgID:          PSI1\\nParent:         NET-142-0-0-0-0\\nNetName:        EPSILON-142-54-200\\nNetRange:       142.54.200.0 - 142.54.201.255\\nNetType:        allocation\\nOriginAS:       19137, 21935\\nRegDate:        1991-05-13\\nUpdated:        2021-12-14\\nAbuseHandle:    MYO54-ARIN\\nNOCHandle:      RFU24-ARIN\\nTechHandle:     RFU24-ARIN\\nSource:         ARIN\\n\n\nOrgID:          PSI1\\nOrgName:        Epsilon Data Management LLC\\nCanAllocate:    \\nStreet:         601 Edgewater Drive\\nCity:           Wakefield\\nState/Prov:     MA\\nCountry:        US\\nPostalCode:     01880\\nRegDate:        1996-10-07\\nUpdated:        2022-08-09\\nOrgAbuseHandle: DELIV1-ARIN\\nOrgAbuseHandle: RFU24-ARIN\\nOrgAdminHandle: SA610-ARIN\\nOrgTechHandle:  BOOKE39-ARIN\\nOrgTechHandle:  GLENN1457-ARIN\\nOrgTechHandle:  KPS7-ARIN\\nOrgTechHandle:  LEBAR-ARIN\\nOrgTechHandle:  RFU24-ARIN\\nSource:         ARIN\\n\n\nPOCHandle:      BOOKE39-ARIN\\nIsRole:         N\\nLastName:       Booker\\nFirstName:      Scott\\nStreet:         6021 Connection Drive\\nCity:           Irving\\nState/Prov:     TX\\nCountry:        US\\nPostalCode:     75039\\nRegDate:        2019-05-16\\nUpdated:        2021-09-29\\nOfficePhone:    +1-469-262-1577\\nMailbox:        scott.booker@epsilon.com\\nSource:         ARIN\\n\n\nPOCHandle:      DELIV1-ARIN\\nIsRole:         Y\\nLastName:       Delivery Team\\nFirstName:      \\nStreet:         601 Edgewater Drive\\nCity:           Wakefield\\nState/Prov:     MA\\nCountry:        US\\nPostalCode:     01880\\nRegDate:        2011-12-01\\nUpdated:        2022-03-31\\nOfficePhone:    +1-781-685-6000\\nMailbox:        deliverabilityteam@epsilon.com\\nSource:         ARIN\\n\n\nPOCHandle:      MYO54-ARIN\\nIsRole:         N\\nLastName:       Youngblood\\nFirstName:      Mary\\nStreet:         16 West 20th. Street\\nStreet:         9th floor\\nCity:           New York\\nState/Prov:     NY\\nCountry:        US\\nPostalCode:     10011\\nRegDate:        2010-08-13\\nUpdated:        2015-12-17\\nOfficePhone:    +1-212-457-7333\\nMailbox:        postmaster@dmx1.bfi0.com\\nSource:         ARIN\\n\n\nPOCHandle:      SA610-ARIN\\nIsRole:         N\\nLastName:       Almquist\\nFirstName:      Sally\\nStreet:         Epsilon Data Management\\nStreet:         6021 Connections Drive\\nCity:           Dallas\\nState/Prov:     TX\\nCountry:        US\\nPostalCode:     75039\\nRegDate:        2001-05-04\\nUpdated:        2022-03-14\\nOfficePhone:    +1-781-451-3462\\nMailbox:        sally.raymond@epsilon.com\\nMailbox:        salmquist@epsilon.com\\nSource:         ARIN\\n\n\nPOCHandle:      GLENN1457-ARIN\\nIsRole:         N\\nLastName:       Glenn\\nFirstName:      Robert\\nStreet:         6021 Connection Drive\\nCity:           Irving\\nState/Prov:     TX\\nCountry:        US\\nPostalCode:     75039\\nRegDate:        2022-08-08\\nUpdated:        2022-08-08\\nOfficePhone:    +1-469-770-2678\\nMailbox:        robert.glenn@epsilon.com\\nSource:         ARIN\\n\n\nPOCHandle:      LEBAR-ARIN\\nIsRole:         N\\nLastName:       LEBARON\\nFirstName:      JASON\\nStreet:         6021 CONNECTION DR\\nStreet:         FLR 2 RM DATA\\nCity:           IRVING\\nState/Prov:     TX\\nCountry:        US\\nPostalCode:     75039\\nRegDate:        2014-01-14\\nUpdated:        2022-08-08\\nOfficePhone:    +1-469-262-1213\\nMailbox:        JASON.LEBARON@EPSILON.COM\\nSource:         ARIN\\n\n\nPOCHandle:      RFU24-ARIN\\nIsRole:         N\\nLastName:       Fu\\nFirstName:      Rich\\nStreet:         601 Edgewater Drive\\nCity:           wakefield\\nState/Prov:     MA\\nCountry:        US\\nPostalCode:     01880\\nRegDate:        2009-04-06\\nUpdated:        2022-08-08\\nOfficePhone:    +1-781-685-6000\\nMailbox:        rich.fu@epsilonconversant.com\\nMailbox:        rich.fu@epsilon.com\\nSource:         ARIN\\n\n\nPOCHandle:      KPS7-ARIN\\nIsRole:         N\\nLastName:       Stockmar\\nFirstName:      Kevin\\nStreet:         6021 Connection Drive\\nCity:           Irving\\nState/Prov:     TX\\nCountry:        US\\nPostalCode:     75039\\nRegDate:        2022-08-08\\nUpdated:        2022-08-08\\nOfficePhone:    +1-469-770-2494\\nMailbox:        kevin.stockmar@epsilon.com\\nSource:         ARIN\\n"}, {"range": "67.90.233.128/28", "id": "XOXO-67-90-233-128", "name": "INTRADO COMMUNICATIONS HOLDINGS, LLC", "country": "US", "domain": "hypercube-llc.com.", "org_id": "HL-1", "status": "REALLOCATION", "tech_id": "ARINT78-ARIN", "mnt_id": "ARINN29-ARIN", "admin_id": "ARINT78-ARIN", "abuse_id": "ARINA309-ARIN", "created": "2011-08-22", "updated": "2011-08-22", "source": "arin", "raw": "NetHandle:      NET-67-90-233-128-1\\nOrgID:          HL-1\\nParent:         NET-67-88-0-0-1\\nNetName:        XOXO-67-90-233-128\\nNetRange:       67.90.233.128 - 67.90.233.143\\nNetType:        reallocation\\nRegDate:        2011-08-22\\nUpdated:        2011-08-22\\nSource:         ARIN\\n\n\nOrgID:          HL-1\\nOrgName:        INTRADO COMMUNICATIONS HOLDINGS, LLC\\nCanAllocate:    \\nStreet:         3200 W. Pleasant Run Road\\nStreet:         Suite #300\\nCity:           Lancaster\\nState/Prov:     TX\\nCountry:        US\\nPostalCode:     75146\\nComment:        http://www.hypercube-llc.com\\nComment:        NOTICE: For TELEPHONY ISSUES ONLY contact the NOC 24x7 at h3_noc@hypercube-llc.com OR +1 866-905-1735.  For Internet connectivity, services or abuse issues, use noc@hypercube-llc.com.\\nRegDate:        2010-12-30\\nUpdated:        2022-05-19\\nOrgAbuseHandle: ARINA309-ARIN\\nOrgAdminHandle: ARINT78-ARIN\\nOrgNOCHandle:   ARINN29-ARIN\\nOrgTechHandle:  ARINT78-ARIN\\nSource:         ARIN\\n\n\nPOCHandle:      ARINN29-ARIN\\nIsRole:         Y\\nLastName:       ARIN-NOC\\nFirstName:      \\nStreet:         3200 W. Pleasant Run Road\\nStreet:         Suite #300\\nCity:           Lancaster\\nState/Prov:     TX\\nCountry:        US\\nPostalCode:     75146\\nRegDate:        2022-05-18\\nUpdated:        2022-05-18\\nOfficePhone:    +1-469-727-1649\\nMailbox:        ARIN-NOC@h3net.com\\nSource:         ARIN\\n\n\nPOCHandle:      ARINA309-ARIN\\nIsRole:         Y\\nLastName:       ARIN-Abuse\\nFirstName:      \\nStreet:         3200 W Pleasant Run Road\\nCity:           Lancaster\\nState/Prov:     TX\\nCountry:        US\\nPostalCode:     75002\\nRegDate:        2022-05-18\\nUpdated:        2022-05-18\\nOfficePhone:    +1-469-727-1649\\nMailbox:        ARIN-Abuse@h3net.com\\nSource:         ARIN\\n\n\nPOCHandle:      ARINT78-ARIN\\nIsRole:         Y\\nLastName:       ARIN-Tech\\nFirstName:      \\nStreet:         3200 W. Pleasant Run Road\\nStreet:         Suite #300\\nCity:           Lancaster\\nState/Prov:     TX\\nCountry:        US\\nPostalCode:     75146\\nRegDate:        2022-05-18\\nUpdated:        2022-05-18\\nOfficePhone:    +1-469-727-1649\\nMailbox:        ARIN-Tech@h3net.com\\nSource:         ARIN\\n"}, {"range": "67.152.153.0/24", "id": "XOXO-67-152-153-0", "name": "HeatSeeker Technology Partners, Inc.", "country": "US", "domain": "heatseeker.com", "org_id": "HTP-13", "status": "REALLOCATION", "tech_id": "ARINT25-ARIN", "mnt_id": "ARINN7-ARIN", "admin_id": "IPADM398-ARIN", "abuse_id": "ARINA78-ARIN", "created": "2011-01-21", "updated": "2011-01-21", "source": "arin", "raw": "NetHandle:      NET-67-152-153-0-1\\nOrgID:          HTP-13\\nParent:         NET-67-152-0-0-1\\nNetName:        XOXO-67-152-153-0\\nNetRange:       67.152.153.0 - 67.152.153.255\\nNetType:        reallocation\\nOriginAS:       23012\\nRegDate:        2011-01-21\\nUpdated:        2011-01-21\\nSource:         ARIN\\n\n\nOrgID:          HTP-13\\nOrgName:        HeatSeeker Technology Partners, Inc.\\nCanAllocate:    \\nStreet:         452 Northco Drive, Suite 100\\nCity:           Fridley\\nState/Prov:     MN\\nCountry:        US\\nPostalCode:     55432\\nRegDate:        2008-02-21\\nUpdated:        2017-01-28\\nOrgAbuseHandle: ARINA78-ARIN\\nOrgAdminHandle: IPADM398-ARIN\\nOrgNOCHandle:   ARINN7-ARIN\\nOrgTechHandle:  ARINT25-ARIN\\nSource:         ARIN\\n\n\nPOCHandle:      ARINA78-ARIN\\nIsRole:         Y\\nLastName:       arin-abuse\\nFirstName:      \\nStreet:         452 Northco Drive, Suite 100\\nCity:           Fridley\\nState/Prov:     MN\\nCountry:        US\\nPostalCode:     55432\\nRegDate:        2009-08-04\\nUpdated:        2022-05-20\\nOfficePhone:    +1-612-454-1100\\nOfficePhone:    +1-612-454-1110\\nMailbox:        ipadmin@heatseeker.com\\nMailbox:        support-team@heatseeker.com\\nSource:         ARIN\\n\n\nPOCHandle:      IPADM398-ARIN\\nIsRole:         Y\\nLastName:       IP Administrator\\nFirstName:      \\nStreet:         452 Northco Drive, Suite 100\\nCity:           Fridley\\nState/Prov:     MN\\nCountry:        US\\nPostalCode:     55432\\nRegDate:        2008-02-20\\nUpdated:        2021-05-12\\nOfficePhone:    +1-612-454-1110\\nOfficePhone:    +1-612-454-1100\\nMailbox:        ipadmin@heatseeker.com\\nSource:         ARIN\\n\n\nPOCHandle:      ARINN7-ARIN\\nIsRole:         Y\\nLastName:       arin-noc\\nFirstName:      \\nStreet:         452 Northco Drive, Suite 100\\nCity:           Fridley\\nState/Prov:     MN\\nCountry:        US\\nPostalCode:     55432\\nRegDate:        2009-08-04\\nUpdated:        2022-04-14\\nOfficePhone:    +1-612-454-1100\\nOfficePhone:    +1-612-454-1110\\nMailbox:        ipadmin@heatseeker.com\\nMailbox:        support-team@heatseeker.com\\nSource:         ARIN\\n\n\nPOCHandle:      ARINT25-ARIN\\nIsRole:         Y\\nLastName:       arin-tech\\nFirstName:      \\nStreet:         452 Northco Drive, Suite 100\\nCity:           Fridley\\nState/Prov:     MN\\nCountry:        US\\nPostalCode:     55432\\nRegDate:        2009-08-04\\nUpdated:        2020-05-12\\nOfficePhone:    +1-612-454-1110\\nMailbox:        ipadmin@heatseeker.com\\nSource:         ARIN\\n"}, {"range": "69.38.208.0/20", "id": "TWRS", "name": "LV.Net", "country": "US", "domain": "lv.net", "org_id": "LASVEG", "status": "ALLOCATION", "tech_id": "CJS6-ARIN", "mnt_id": "CJS6-ARIN", "admin_id": "MM1259-ARIN", "abuse_id": "MM1259-ARIN", "created": "2003-04-23", "updated": "2022-01-18", "source": "arin", "raw": "NetHandle:      NET-69-38-208-0-1\\nOrgID:          LASVEG\\nParent:         NET-69-0-0-0-0\\nNetName:        TWRS\\nNetRange:       69.38.208.0 - 69.38.223.255\\nNetType:        allocation\\nRegDate:        2003-04-23\\nUpdated:        2022-01-18\\nSource:         ARIN\\n\n\nOrgID:          LASVEG\\nOrgName:        LV.Net\\nCanAllocate:    \\nStreet:         2595 Fremont Street\\nCity:           Las Vegas\\nState/Prov:     NV\\nCountry:        US\\nPostalCode:     89104\\nRegDate:        2000-05-23\\nUpdated:        2022-01-11\\nOrgAbuseHandle: MM1259-ARIN\\nOrgAdminHandle: MM1259-ARIN\\nOrgNOCHandle:   CJS6-ARIN\\nOrgTechHandle:  CJS6-ARIN\\nSource:         ARIN\\n\n\nPOCHandle:      CJS6-ARIN\\nIsRole:         N\\nLastName:       Sattler\\nFirstName:      Charles\\nStreet:         2595 Fremont Street\\nCity:           Las Vegas\\nState/Prov:     NV\\nCountry:        US\\nPostalCode:     89104\\nRegDate:        2006-06-05\\nUpdated:        2021-12-17\\nOfficePhone:    +1-702-792-5100\\nMailbox:        arin@lasvegas.net\\nSource:         ARIN\\n\n\nPOCHandle:      MM1259-ARIN\\nIsRole:         N\\nLastName:       MIZRAHI\\nFirstName:      Martin\\nStreet:         2595 FREMONT STREET\\nStreet:         LASVEGAS.NET\\nCity:           LAS VEGAS\\nState/Prov:     NV\\nCountry:        US\\nPostalCode:     89104\\nRegDate:        1995-11-17\\nUpdated:        2022-01-11\\nOfficePhone:    +1-702-900-0000\\nMailbox:        MARTY@lasvegas.net\\nSource:         ARIN\\n"}, {"range": "192.69.68.0/22", "id": "MTI-NET1", "name": "Mainland Telecom Inc.", "country": "CA", "domain": "mainlandtelecom.com", "org_id": "MT-43", "status": "ALLOCATION", "tech_id": "ARINT70-ARIN", "mnt_id": "ARINN26-ARIN", "admin_id": "ARINA263-ARIN", "abuse_id": "ARINA264-ARIN", "created": "2012-12-19", "updated": "2012-12-25", "source": "arin", "raw": "NetHandle:      NET-192-69-68-0-1\\nOrgID:          MT-43\\nParent:         NET-192-0-0-0-0\\nNetName:        MTI-NET1\\nNetRange:       192.69.68.0 - 192.69.71.255\\nNetType:        allocation\\nOriginAS:       39964\\nRegDate:        2012-12-19\\nUpdated:        2012-12-25\\nSource:         ARIN\\n\n\nOrgID:          MT-43\\nOrgName:        Mainland Telecom Inc.\\nCanAllocate:    \\nStreet:         292 Marshall Street\\nCity:           Middleton\\nState/Prov:     NS\\nCountry:        CA\\nPostalCode:     B0S 1P0\\nComment:        http://www.mainlandtelecom.com\\nRegDate:        2011-09-26\\nUpdated:        2019-10-04\\nOrgAbuseHandle: ARINA264-ARIN\\nOrgAdminHandle: ARINA263-ARIN\\nOrgDNSHandle:   ARIND-ARIN\\nOrgNOCHandle:   ARINN26-ARIN\\nOrgRoutingHandle:   ARINR6-ARIN\\nOrgTechHandle:  ARINT70-ARIN\\nSource:         ARIN\\n\n\nPOCHandle:      ARINA264-ARIN\\nIsRole:         Y\\nLastName:       ARIN Abuse\\nFirstName:      \\nStreet:         292 Marshall Street\\nCity:           Middleton\\nState/Prov:     NS\\nCountry:        CA\\nPostalCode:     B0S 1P0\\nRegDate:        2019-10-04\\nUpdated:        2021-07-21\\nOfficePhone:    +1-902-365-3132\\nMailbox:        arin-abuse@mainlandtelecom.com\\nSource:         ARIN\\n\n\nPOCHandle:      ARINA263-ARIN\\nIsRole:         Y\\nLastName:       ARIN Admin\\nFirstName:      \\nStreet:         292 Marshall Street\\nCity:           Middleton\\nState/Prov:     NS\\nCountry:        CA\\nPostalCode:     B0S 1P0\\nRegDate:        2019-10-04\\nUpdated:        2021-07-21\\nOfficePhone:    +1-902-365-3132\\nMailbox:        arin-admin@mainlandtelecom.com\\nSource:         ARIN\\n\n\nPOCHandle:      ARINN26-ARIN\\nIsRole:         Y\\nLastName:       ARIN NOC\\nFirstName:      \\nStreet:         292 Marshall Street\\nCity:           Middleton\\nState/Prov:     NS\\nCountry:        CA\\nPostalCode:     B0S 1P0\\nRegDate:        2019-10-04\\nUpdated:        2021-07-21\\nOfficePhone:    +1-902-365-3132\\nMailbox:        arin-noc@mainlandtelecom.com\\nSource:         ARIN\\n\n\nPOCHandle:      ARINT70-ARIN\\nIsRole:         Y\\nLastName:       ARIN Tech\\nFirstName:      \\nStreet:         292 Marshall Street\\nCity:           Middleton\\nState/Prov:     NS\\nCountry:        CA\\nPostalCode:     B0S 1P0\\nRegDate:        2019-10-04\\nUpdated:        2021-07-21\\nOfficePhone:    +1-902-365-3132\\nMailbox:        arin-tech@mainlandtelecom.com\\nSource:         ARIN\\n"}, {"range": "128.102.0.0/16", "id": "AMES-NET", "name": "National Aeronautics and Space Administration", "country": "US", "domain": "nasa.gov", "org_id": "NASA", "status": "ALLOCATION", "tech_id": "ZN7-ARIN", "mnt_id": "NISN-ARIN", "admin_id": "BGS7-ARIN", "abuse_id": "NASAA-ARIN", "created": "1986-01-24", "updated": "2008-12-16", "source": "arin", "raw": "NetHandle:      NET-128-102-0-0-1\\nOrgID:          NASA\\nParent:         NET-128-0-0-0-0\\nNetName:        AMES-NET\\nNetRange:       128.102.0.0 - 128.102.255.255\\nNetType:        allocation\\nRegDate:        1986-01-24\\nUpdated:        2008-12-16\\nTechHandle:     ZN7-ARIN\\nSource:         ARIN\\n\n\nOrgID:          NASA\\nOrgName:        National Aeronautics and Space Administration\\nCanAllocate:    \\nStreet:         IS05/Office of the Chief Information Officer\\nCity:           MSFC\\nState/Prov:     AL\\nCountry:        US\\nPostalCode:     35812\\nRegDate:        1970-01-01\\nUpdated:        2020-04-09\\nOrgAbuseHandle: NASAA-ARIN\\nOrgAdminHandle: BGS7-ARIN\\nOrgNOCHandle:   NISN-ARIN\\nOrgTechHandle:  IPAMO-ARIN\\nOrgTechHandle:  RFBJ-ARIN\\nSource:         ARIN\\n\n\nPOCHandle:      ZN7-ARIN\\nIsRole:         Y\\nLastName:       Center Operations Directorate\\nFirstName:      \\nStreet:         Attn: FOIA Office\\nStreet:         Mail Code CO50\\nStreet:         Marshall Space Flight Center\\nCity:           Huntsville\\nState/Prov:     AL\\nCountry:        US\\nPostalCode:     35812\\nRegDate:        1999-11-19\\nUpdated:        2021-11-08\\nOfficePhone:    256-961-4000\\nMailbox:        dns.support@nasa.gov\\nMailbox:        dns@nasa.gov\\nSource:         ARIN\\n\n\nPOCHandle:      IPAMO-ARIN\\nIsRole:         Y\\nLastName:       IPAM Operations\\nFirstName:      \\nStreet:         MSFC\\nCity:           MSFC\\nState/Prov:     AL\\nCountry:        US\\nPostalCode:     35812\\nRegDate:        2010-11-01\\nUpdated:        2021-11-15\\nOfficePhone:    +1-256-961-4726\\nMailbox:        ipam@nasa.gov\\nSource:         ARIN\\n\n\nPOCHandle:      BGS7-ARIN\\nIsRole:         N\\nLastName:       Schleckser\\nFirstName:      Barbara\\nStreet:         215 Wynn Dr\\nCity:           Huntsville\\nState/Prov:     AL\\nCountry:        US\\nPostalCode:     35806\\nRegDate:        2020-04-09\\nUpdated:        2022-03-28\\nOfficePhone:    +1-256-624-0178\\nMailbox:        barbara.g.schleckser@nasa.gov\\nSource:         ARIN\\n\n\nPOCHandle:      RFBJ-ARIN\\nIsRole:         N\\nLastName:       Bischof, Jr.\\nFirstName:      Ralph\\nStreet:         221 Wynn Drive\\nStreet:         Suite 500\\nCity:           Huntsville\\nState/Prov:     AL\\nCountry:        US\\nPostalCode:     35805\\nRegDate:        2005-12-20\\nUpdated:        2021-11-22\\nOfficePhone:    256-961-4000\\nMailbox:        dns@nasa.gov\\nMailbox:        dns.support@nasa.gov\\nMailbox:        Ralph.Bischof@nasa.gov\\nSource:         ARIN\\n\n\nPOCHandle:      NISN-ARIN\\nIsRole:         Y\\nLastName:       NASA Information Services Network\\nFirstName:      \\nStreet:         215 Wynn Dr., Suite 300\\nCity:           Huntsville\\nState/Prov:     AL\\nCountry:        US\\nPostalCode:     35805\\nRegDate:        2002-09-27\\nUpdated:        2015-11-02\\nOfficePhone:    +1-256-961-4000\\nMailbox:        noc@nisn.nasa.gov\\nSource:         ARIN\\n\n\nPOCHandle:      NASAA-ARIN\\nIsRole:         Y\\nLastName:       NASA Abuse\\nFirstName:      \\nStreet:         Center Operations Directorate\\nStreet:         Information Services Department\\nCity:           Marshall Space Flight Center\\nState/Prov:     AL\\nCountry:        US\\nPostalCode:     35812\\nRegDate:        2002-08-26\\nUpdated:        2003-07-10\\nOfficePhone:    +1-800-762-7472\\nMailbox:        abuse@nasa.gov\\nSource:         ARIN\\n"}, {"range": "65.122.79.32/27", "id": "Q0826-65-122-79-32", "name": "Bandwidth.com Inc.", "country": "US", "domain": "bandwidth.com", "org_id": "BNO", "status": "REALLOCATION", "tech_id": "BCNO1-ARIN", "mnt_id": "BNO13-ARIN", "admin_id": "BCNO1-ARIN", "abuse_id": "BCNO1-ARIN", "created": "2004-08-27", "updated": "2004-08-27", "source": "arin", "raw": "NetHandle:      NET-65-122-79-32-1\\nOrgID:          BNO\\nParent:         NET-65-112-0-0-1\\nNetName:        Q0826-65-122-79-32\\nNetRange:       65.122.79.32 - 65.122.79.63\\nNetType:        reallocation\\nRegDate:        2004-08-27\\nUpdated:        2004-08-27\\nAbuseHandle:    CCA28-ARIN\\nSource:         ARIN\\n\n\nOrgID:          BNO\\nOrgName:        Bandwidth.com Inc.\\nCanAllocate:    \\nStreet:         900 Main Campus Drive\\nCity:           Raleigh\\nState/Prov:     NC\\nCountry:        US\\nPostalCode:     27606\\nRegDate:        2003-11-17\\nUpdated:        2014-03-17\\nOrgAbuseHandle: BCNO1-ARIN\\nOrgAdminHandle: BCNO1-ARIN\\nOrgNOCHandle:   BNO13-ARIN\\nOrgTechHandle:  BCNO1-ARIN\\nSource:         ARIN\\n\n\nPOCHandle:      BCNO1-ARIN\\nIsRole:         Y\\nLastName:       Customer Care Department\\nFirstName:      \\nStreet:         900 Main Campus Drive\\nCity:           Raleigh\\nState/Prov:     NC\\nCountry:        US\\nPostalCode:     27606\\nRegDate:        2003-11-17\\nUpdated:        2015-03-17\\nOfficePhone:    +1-800-808-5150\\nMailbox:        support@broadband.com\\nSource:         ARIN\\n\n\nPOCHandle:      CCA28-ARIN\\nIsRole:         Y\\nLastName:       Customer Care\\nFirstName:      \\nStreet:         2708 ALT. 19 NORTH\\nCity:           PALM HARBOR\\nState/Prov:     FL\\nCountry:        US\\nPostalCode:     34683\\nRegDate:        2003-12-05\\nUpdated:        2005-05-09\\nOfficePhone:    +1-800-409-4357\\nMailbox:        customercare@bandwidth.com\\nSource:         ARIN\\n\n\nPOCHandle:      BNO13-ARIN\\nIsRole:         Y\\nLastName:       Bandwidth Network Operations\\nFirstName:      \\nStreet:         4001 Weston Parkway\\nStreet:         Suite 100\\nCity:           Cary\\nState/Prov:     NC\\nCountry:        US\\nPostalCode:     27513\\nRegDate:        2003-11-17\\nUpdated:        2014-11-07\\nOfficePhone:    +1-800-409-4357\\nMailbox:        networkservices@bandwidth.com\\nSource:         ARIN\\n"}, {"range": "8.29.69.0/24", "id": "HBS-BLK-HBS-SUMMARY-NETWORK", "name": "Hotwire Business Solutions", "country": "US", "domain": "gethotwired.net", "org_id": "HBS-54", "status": "REALLOCATION", "tech_id": "ADMIN5342-ARIN\\NDCP8-ARIN\\NDRK9-ARIN\\NJSL39-ARIN\\NLAWSO19-ARIN", "mnt_id": "JSL39-ARIN", "admin_id": "JSL48-ARIN", "abuse_id": "JSL39-ARIN", "created": "2018-03-14", "updated": "2018-03-14", "source": "arin", "raw": "NetHandle:      NET-8-29-69-0-2\\nOrgID:          HBS-54\\nParent:         NET-8-29-69-0-1\\nNetName:        HBS-BLK-HBS-SUMMARY-NETWORK\\nNetRange:       8.29.69.0 - 8.29.69.255\\nNetType:        reallocation\\nOriginAS:       23089, 31793\\nComment:        Addresses within this range are NON-PORTABLE\\nComment:        In use at development \u00e2\u20ac\u201c US - FL - HBS SUMMARY NETWORK - HBS Aggregate Summary\\nRegDate:        2018-03-14\\nUpdated:        2018-03-14\\nSource:         ARIN\\n\n\nOrgID:          HBS-54\\nOrgName:        Hotwire Business Solutions\\nCanAllocate:    \\nStreet:         Three Bala Plaza East,\\nStreet:         Suite 700\\nCity:           Bala Cynwyd\\nState/Prov:     PA\\nCountry:        US\\nPostalCode:     19004\\nComment:        Information regarding this Autonomous System can be found at http://as23089.peeringdb.com\\nRegDate:        2014-07-29\\nUpdated:        2021-09-14\\nReferralServer: rwhois://rwhois.gethotwired.net:4321\\nOrgAbuseHandle: JSL39-ARIN\\nOrgAdminHandle: JSL48-ARIN\\nOrgNOCHandle:   JSL39-ARIN\\nOrgTechHandle:  ADMIN5342-ARIN\\nOrgTechHandle:  DCP8-ARIN\\nOrgTechHandle:  DRK9-ARIN\\nOrgTechHandle:  JSL39-ARIN\\nOrgTechHandle:  LAWSO19-ARIN\\nSource:         ARIN\\n\n\nPOCHandle:      ADMIN5342-ARIN\\nIsRole:         Y\\nLastName:       Administrator\\nFirstName:      \\nStreet:         Three Bala Plaza East,\\nStreet:         Suite 700\\nCity:           Bala Cynwyd\\nState/Prov:     PA\\nCountry:        US\\nPostalCode:     19004\\nRegDate:        2014-07-22\\nUpdated:        2021-08-18\\nOfficePhone:    +1-484-572-6200\\nMailbox:        ipadmin@hotwirecommunication.com\\nSource:         ARIN\\n\n\nPOCHandle:      DCP8-ARIN\\nIsRole:         N\\nLastName:       Pacheco\\nFirstName:      Donaldo\\nStreet:         2100 W Cypress Creek Rd\\nCity:           Fort Lauderdale\\nState/Prov:     FL\\nCountry:        US\\nPostalCode:     33309\\nRegDate:        2015-08-03\\nUpdated:        2022-07-29\\nOfficePhone:    +1-954-417-6745\\nMailbox:        donaldo.pacheco@hotwirecommunication.com\\nSource:         ARIN\\n\n\nPOCHandle:      LAWSO19-ARIN\\nIsRole:         N\\nLastName:       Lawson\\nFirstName:      Jeff\\nStreet:         300 East Lancaster Ave\\nStreet:         Suite 208\\nCity:           Wynnewood\\nState/Prov:     PA\\nCountry:        US\\nPostalCode:     19096\\nRegDate:        2012-10-03\\nUpdated:        2020-04-21\\nOfficePhone:    +1-215-720-4028\\nMobilePhone:    +1-215-720-4028\\nMailbox:        jlawson@hotwiremail.com\\nSource:         ARIN\\n\n\nPOCHandle:      JSL39-ARIN\\nIsRole:         N\\nLastName:       Slattery\\nFirstName:      Jim\\nStreet:         3 Bala Plaza East\\nStreet:         suite 700\\nCity:           Bala Cynwyd\\nState/Prov:     PA\\nCountry:        US\\nPostalCode:     19004\\nRegDate:        2004-05-10\\nUpdated:        2021-11-24\\nOfficePhone:    +1-484-580-9006\\nMailbox:        JSlattery@hotwirecommunication.com\\nSource:         ARIN\\n\n\nPOCHandle:      JSL48-ARIN\\nIsRole:         N\\nLastName:       slattery\\nFirstName:      jim\\nStreet:         3 Bala Plaza East\\nStreet:         suite 700\\nCity:           Bala Cynwyd\\nState/Prov:     PA\\nCountry:        US\\nPostalCode:     19004\\nRegDate:        2005-04-19\\nUpdated:        2021-08-23\\nOfficePhone:    +1-484-580-9006\\nMailbox:        jslattery@hotwiremail.com\\nSource:         ARIN\\n\n\nPOCHandle:      DRK9-ARIN\\nIsRole:         N\\nLastName:       Ketterhagen\\nFirstName:      Donald\\nStreet:         1415 Martin Luther King Jr Ave S\\nCity:           Salisbury\\nState/Prov:     NC\\nCountry:        US\\nPostalCode:     28144\\nRegDate:        2005-03-12\\nUpdated:        2022-03-12\\nFaxPhone:       +1-954-417-3562\\nMobilePhone:    +1-919-609-4669\\nOfficePhone:    +1-704-244-5552\\nMailbox:        bketterhagen@hotwirecommunication.com\\nMailbox:        bob@ketterhagen.com\\nSource:         ARIN\\n"}, {"range": "199.201.221.0/24", "id": "GOODMORT-3325STRYON", "name": "goodmortgage.com", "country": "US", "domain": "goodmortgage.com", "org_id": "BMGL-4", "status": "ALLOCATION", "tech_id": "LUEDE-ARIN", "mnt_id": "LUEDE-ARIN", "admin_id": "LUEDE-ARIN", "abuse_id": "LUEDE-ARIN", "created": "2012-04-30", "updated": "2021-12-14", "source": "arin", "raw": "NetHandle:      NET-199-201-221-0-1\\nOrgID:          BMGL-4\\nParent:         NET-199-0-0-0-0\\nNetName:        GOODMORT-3325STRYON\\nNetRange:       199.201.221.0 - 199.201.221.255\\nNetType:        allocation\\nOriginAS:       54606\\nRegDate:        2012-04-30\\nUpdated:        2021-12-14\\nSource:         ARIN\\n\n\nOrgID:          BMGL-4\\nOrgName:        goodmortgage.com\\nCanAllocate:    \\nStreet:         3325 S TRYON ST\\nCity:           Charlotte\\nState/Prov:     NC\\nCountry:        US\\nPostalCode:     28217\\nComment:        http://www.goodmortgage.com\\nRegDate:        2012-02-16\\nUpdated:        2012-02-16\\nOrgAbuseHandle: LUEDE-ARIN\\nOrgAdminHandle: LUEDE-ARIN\\nOrgNOCHandle:   LUEDE-ARIN\\nOrgTechHandle:  LUEDE-ARIN\\nSource:         ARIN\\n\n\nPOCHandle:      LUEDE-ARIN\\nIsRole:         N\\nLastName:       Luedeman\\nFirstName:      Keith\\nStreet:         3325 S TRYON ST\\nCity:           Charlotte\\nState/Prov:     NC\\nCountry:        US\\nPostalCode:     28217\\nRegDate:        2012-02-13\\nUpdated:        2022-04-20\\nOfficePhone:    +1-757-296-8990\\nMailbox:        fgmcnoc@fgmc.com\\nSource:         ARIN\\n"}, {"range": "162.142.100.0/22", "id": "FL-379", "name": "Fatbeam, LLC", "country": "US", "domain": "fatbeam.com", "org_id": "FL-379", "status": "ALLOCATION", "tech_id": "BARRO151-ARIN\\NFNO21-ARIN", "mnt_id": "FATBE-ARIN", "admin_id": "BUDDG3-ARIN", "abuse_id": "FNO21-ARIN", "created": "2020-03-12", "updated": "2020-03-12", "source": "arin", "raw": "NetHandle:      NET-162-142-100-0-1\\nOrgID:          FL-379\\nParent:         NET-162-0-0-0-0\\nNetName:        FL-379\\nNetRange:       162.142.100.0 - 162.142.103.255\\nNetType:        allocation\\nRegDate:        2020-03-12\\nUpdated:        2020-03-12\\nSource:         ARIN\\n\n\nOrgID:          FL-379\\nOrgName:        Fatbeam, LLC\\nCanAllocate:    \\nStreet:         2065 W Riverstone Drive\\nStreet:         Suite #205\\nCity:           Coeur d Alene\\nState/Prov:     ID\\nCountry:        US\\nPostalCode:     83814\\nComment:        http://www.fatbeam.com\\nComment:        Please Call 1-855-979-8844 -- This will ring our NOC.\\nRegDate:        2017-02-14\\nUpdated:        2022-04-06\\nOrgAbuseHandle: FNO21-ARIN\\nOrgAdminHandle: BUDDG3-ARIN\\nOrgNOCHandle:   FATBE-ARIN\\nOrgTechHandle:  BARRO151-ARIN\\nOrgTechHandle:  FNO21-ARIN\\nSource:         ARIN\\n\n\nPOCHandle:      FNO21-ARIN\\nIsRole:         Y\\nLastName:       Fatbeam Network Operations\\nFirstName:      \\nStreet:         2065 W. Riverstone Drive\\nStreet:         STE 105\\nCity:           Coeur d Alene\\nState/Prov:     ID\\nCountry:        US\\nPostalCode:     83814\\nRegDate:        2019-09-09\\nUpdated:        2021-09-08\\nOfficePhone:    +1-509-344-1008\\nMailbox:        netops@fatbeam.com\\nSource:         ARIN\\n\n\nPOCHandle:      FATBE-ARIN\\nIsRole:         Y\\nLastName:       Fatbeam NOC\\nFirstName:      \\nStreet:         2065 W. Riverstone Dr. \\nStreet:         Suite 105,\\nCity:           Coeur d Alene\\nState/Prov:     ID\\nCountry:        US\\nPostalCode:     83814\\nRegDate:        2019-09-09\\nUpdated:        2021-09-08\\nOfficePhone:    +1-855-979-8844\\nMailbox:        support@fatbeam.com\\nSource:         ARIN\\n\n\nPOCHandle:      BUDDG3-ARIN\\nIsRole:         N\\nLastName:       Budd\\nFirstName:      Gavin\\nStreet:         2065 W. Riverstone Dr.\\nStreet:         Suite 105\\nCity:           Coeur d'Alene\\nState/Prov:     ID\\nCountry:        US\\nPostalCode:     83814\\nRegDate:        2012-11-09\\nUpdated:        2021-09-09\\nOfficePhone:    +1-208-758-7021\\nMailbox:        gavin@fatbeam.com\\nSource:         ARIN\\n\n\nPOCHandle:      BARRO151-ARIN\\nIsRole:         N\\nLastName:       Barron\\nFirstName:      Zac\\nStreet:         2065 W Riverstone Dr \\nStreet:         Suite. 202\\nCity:           Coeur d'Alene\\nState/Prov:     ID\\nCountry:        US\\nPostalCode:     83814\\nRegDate:        2022-03-29\\nUpdated:        2022-03-29\\nOfficePhone:    +1-208-618-9374\\nMailbox:        Zac@fatbeam.com\\nSource:         ARIN\\n"}, {"range": "64.178.225.0/24", "id": "NNS-FTC", "name": "Farmers Telecommunications Cooperative", "country": "US", "domain": "farmerstel.com", "org_id": "FTC-70", "status": "REASSIGNMENT", "tech_id": "DTT4-ARIN", "mnt_id": "DTT4-ARIN", "admin_id": "DTT4-ARIN", "abuse_id": "ABUSE4917-ARIN", "created": "2014-11-06", "updated": "2014-11-06", "source": "arin", "raw": "NetHandle:      NET-64-178-225-0-1\\nOrgID:          FTC-70\\nParent:         NET-64-178-224-0-1\\nNetName:        NNS-FTC\\nNetRange:       64.178.225.0 - 64.178.225.255\\nNetType:        reassignment\\nRegDate:        2014-11-06\\nUpdated:        2014-11-06\\nSource:         ARIN\\n\n\nOrgID:          FTC-70\\nOrgName:        Farmers Telecommunications Cooperative\\nCanAllocate:    \\nStreet:         144 McCurdy Ave N\\nCity:           Rainsville\\nState/Prov:     AL\\nCountry:        US\\nPostalCode:     35986\\nRegDate:        2014-11-05\\nUpdated:        2018-05-07\\nOrgAbuseHandle: ABUSE4917-ARIN\\nOrgAdminHandle: DTT4-ARIN\\nOrgNOCHandle:   DTT4-ARIN\\nOrgTechHandle:  DTT4-ARIN\\nSource:         ARIN\\n\n\nPOCHandle:      DTT4-ARIN\\nIsRole:         N\\nLastName:       Thurmond\\nFirstName:      Dusty\\nStreet:         144 McCurdy Ave N\\nCity:           Rainsville\\nState/Prov:     AL\\nCountry:        US\\nPostalCode:     35986\\nRegDate:        2014-10-30\\nUpdated:        2021-12-14\\nOfficePhone:    +1-256-638-2144\\nMailbox:        dthurmond@staff.farmerstel.com\\nSource:         ARIN\\n\n\nPOCHandle:      ABUSE4917-ARIN\\nIsRole:         Y\\nLastName:       Abuse\\nFirstName:      \\nStreet:         144 McCurdy Ave N\\nCity:           Rainsville\\nState/Prov:     AL\\nCountry:        US\\nPostalCode:     35986\\nRegDate:        2014-11-18\\nUpdated:        2021-08-04\\nOfficePhone:    +1-256-638-2144\\nMailbox:        abuse@farmerstel.com\\nSource:         ARIN\\n"}, {"range": "167.88.80.0/20", "id": "HOTWI", "name": "Hotwire Communications", "country": "US", "domain": "hotwirecommunication.com", "org_id": "HOTWI", "status": "ALLOCATION", "tech_id": "DCP8-ARIN\\NDRK9-ARIN\\NJSL39-ARIN\\NLAWSO19-ARIN\\NLFC16-ARIN\\NLFC17-ARIN\\NPALLA69-ARIN", "mnt_id": "JSL39-ARIN", "admin_id": "JSL39-ARIN", "abuse_id": "JSL39-ARIN", "created": "2014-03-28", "updated": "2014-03-28", "source": "arin", "raw": "NetHandle:      NET-167-88-80-0-1\\nOrgID:          HOTWI\\nParent:         NET-167-0-0-0-0\\nNetName:        HOTWI\\nNetRange:       167.88.80.0 - 167.88.95.255\\nNetType:        allocation\\nOriginAS:       23089\\nRegDate:        2014-03-28\\nUpdated:        2014-03-28\\nSource:         ARIN\\n\n\nOrgID:          HOTWI\\nOrgName:        Hotwire Communications\\nCanAllocate:    \\nStreet:         Three Bala Plaza East, \\nStreet:         Suite 700\\nCity:           Bala Cynwyd\\nState/Prov:     PA\\nCountry:        US\\nPostalCode:     19004\\nComment:        Information regarding this Autonomous System can be found at http://as23089.peeringdb.com\\nRegDate:        2004-05-10\\nUpdated:        2021-09-14\\nReferralServer: rwhois://rwhois.gethotwired.net:4321\\nOrgAbuseHandle: JSL39-ARIN\\nOrgAdminHandle: JSL39-ARIN\\nOrgNOCHandle:   JSL39-ARIN\\nOrgTechHandle:  DCP8-ARIN\\nOrgTechHandle:  DRK9-ARIN\\nOrgTechHandle:  JSL39-ARIN\\nOrgTechHandle:  LAWSO19-ARIN\\nOrgTechHandle:  LFC16-ARIN\\nOrgTechHandle:  LFC17-ARIN\\nOrgTechHandle:  PALLA69-ARIN\\nSource:         ARIN\\n\n\nPOCHandle:      JSL39-ARIN\\nIsRole:         N\\nLastName:       Slattery\\nFirstName:      Jim\\nStreet:         3 Bala Plaza East\\nStreet:         suite 700\\nCity:           Bala Cynwyd\\nState/Prov:     PA\\nCountry:        US\\nPostalCode:     19004\\nRegDate:        2004-05-10\\nUpdated:        2021-11-24\\nOfficePhone:    +1-484-580-9006\\nMailbox:        JSlattery@hotwirecommunication.com\\nSource:         ARIN\\n\n\nPOCHandle:      PALLA69-ARIN\\nIsRole:         N\\nLastName:       Pallais\\nFirstName:      Claudio\\nStreet:         2100 W Cypress Creek Road\\nCity:           Fort Lauderdale\\nState/Prov:     FL\\nCountry:        US\\nPostalCode:     33309\\nRegDate:        2021-08-31\\nUpdated:        2021-08-31\\nOfficePhone:    +1-754-301-4407\\nMailbox:        claudio.pallais@hotwirecommunication.com\\nSource:         ARIN\\n\n\nPOCHandle:      LAWSO19-ARIN\\nIsRole:         N\\nLastName:       Lawson\\nFirstName:      Jeff\\nStreet:         300 East Lancaster Ave\\nStreet:         Suite 208\\nCity:           Wynnewood\\nState/Prov:     PA\\nCountry:        US\\nPostalCode:     19096\\nRegDate:        2012-10-03\\nUpdated:        2020-04-21\\nOfficePhone:    +1-215-720-4028\\nMobilePhone:    +1-215-720-4028\\nMailbox:        jlawson@hotwiremail.com\\nSource:         ARIN\\n\n\nPOCHandle:      LFC16-ARIN\\nIsRole:         N\\nLastName:       CONTRERAS\\nFirstName:      LUIS\\nStreet:         2100 W CYPRESS CREEK RD\\nCity:           FORT LAUDERDALE\\nState/Prov:     FL\\nCountry:        US\\nPostalCode:     33309\\nRegDate:        2017-02-28\\nUpdated:        2021-09-23\\nMobilePhone:    +1-954-668-6981\\nOfficePhone:    +1-754-208-3835\\nMailbox:        LUIS.CONTRERAS@HOTWIRECOMMUNICATION.COM\\nSource:         ARIN\\n\n\nPOCHandle:      DRK9-ARIN\\nIsRole:         N\\nLastName:       Ketterhagen\\nFirstName:      Donald\\nStreet:         1415 Martin Luther King Jr Ave S\\nCity:           Salisbury\\nState/Prov:     NC\\nCountry:        US\\nPostalCode:     28144\\nRegDate:        2005-03-12\\nUpdated:        2022-03-12\\nFaxPhone:       +1-954-417-3562\\nMobilePhone:    +1-919-609-4669\\nOfficePhone:    +1-704-244-5552\\nMailbox:        bketterhagen@hotwirecommunication.com\\nMailbox:        bob@ketterhagen.com\\nSource:         ARIN\\n\n\nPOCHandle:      DCP8-ARIN\\nIsRole:         N\\nLastName:       Pacheco\\nFirstName:      Donaldo\\nStreet:         2100 W Cypress Creek Rd\\nCity:           Fort Lauderdale\\nState/Prov:     FL\\nCountry:        US\\nPostalCode:     33309\\nRegDate:        2015-08-03\\nUpdated:        2022-07-29\\nOfficePhone:    +1-954-417-6745\\nMailbox:        donaldo.pacheco@hotwirecommunication.com\\nSource:         ARIN\\n\n\nPOCHandle:      LFC17-ARIN\\nIsRole:         N\\nLastName:       CONTRERAS\\nFirstName:      LUIS\\nStreet:         2100 W CYPRESS CREEK RD\\nCity:           FORT LAUDERDALE\\nState/Prov:     FL\\nCountry:        US\\nPostalCode:     33309\\nRegDate:        2018-12-20\\nUpdated:        2021-09-23\\nMobilePhone:    +1-954-668-6981\\nOfficePhone:    +1-754-208-3835\\nMailbox:        luis.contreras@hotwirecommunication.com\\nSource:         ARIN\\n"}, {"range": "50.249.59.184/30", "id": "BOA", "name": "Bank of America, National Association", "country": "US", "domain": "bankofamerica.com", "org_id": "BANKOF-2", "status": "REALLOCATION", "tech_id": "LAU-ARIN\\NSPD3-ARIN\\NZB29-ARIN", "mnt_id": "ZB29-ARIN", "admin_id": "ZB29-ARIN", "abuse_id": "ABUSE608-ARIN", "created": "2021-07-03", "updated": "2021-07-03", "source": "arin", "raw": "NetHandle:      NET-50-249-59-184-1\\nOrgID:          BANKOF-2\\nParent:         NET-50-249-0-0-2\\nNetName:        BOA\\nNetRange:       50.249.59.184 - 50.249.59.187\\nNetType:        reallocation\\nRegDate:        2021-07-03\\nUpdated:        2021-07-03\\nSource:         ARIN\\n\n\nOrgID:          BANKOF-2\\nOrgName:        Bank of America, National Association\\nCanAllocate:    \\nStreet:         Bank of America Corporation\\nStreet:         100 North Tryon Street\\nCity:           Charlotte\\nState/Prov:     NC\\nCountry:        US\\nPostalCode:     28255\\nComment:        For abuse issues contact abuse@bankofamerica.com\\nRegDate:        1992-01-06\\nUpdated:        2022-04-25\\nOrgAbuseHandle: ABUSE608-ARIN\\nOrgAdminHandle: ZB29-ARIN\\nOrgNOCHandle:   ZB29-ARIN\\nOrgTechHandle:  LAU-ARIN\\nOrgTechHandle:  SPD3-ARIN\\nOrgTechHandle:  ZB29-ARIN\\nSource:         ARIN\\n\n\nPOCHandle:      SPD3-ARIN\\nIsRole:         N\\nLastName:       Dornan\\nFirstName:      Sean\\nStreet:         30650 23 MILE RD\\nCity:           Chesterfield\\nState/Prov:     MI\\nCountry:        US\\nPostalCode:     48047\\nRegDate:        2016-01-04\\nUpdated:        2021-01-04\\nOfficePhone:    +1-586-273-1444\\nMobilePhone:    +1-586-876-7947\\nMailbox:        sean.dornan@bankofamerica.com\\nSource:         ARIN\\n\n\nPOCHandle:      ZB29-ARIN\\nIsRole:         Y\\nLastName:       HOSTMASTER\\nFirstName:      \\nStreet:         ATTN: Patrick O'Hagerty\\nStreet:         Mailcode NC1-003-03-95\\nStreet:         901 West Trade Street\\nCity:           Charlotte\\nState/Prov:     NC\\nCountry:        US\\nPostalCode:     28255\\nRegDate:        2000-05-09\\nUpdated:        2021-12-10\\nMobilePhone:    +1-518-708-9371\\nOfficePhone:    +1-980-387-3750\\nMailbox:        HOSTMASTER@bankofamerica.com\\nMailbox:        patrick.ohagerty@bofa.com\\nSource:         ARIN\\n\n\nPOCHandle:      LAU-ARIN\\nIsRole:         N\\nLastName:       Uribarri\\nFirstName:      Luis\\nStreet:         330 N Mesa St\\nCity:           El Paso\\nState/Prov:     TX\\nCountry:        US\\nPostalCode:     79901\\nRegDate:        2003-03-19\\nUpdated:        2021-12-07\\nOfficePhone:    +1-646-556-2742\\nMailbox:        luis.a.uribarri@bofa.com\\nSource:         ARIN\\n\n\nPOCHandle:      ABUSE608-ARIN\\nIsRole:         Y\\nLastName:       ABUSE\\nFirstName:      \\nStreet:         200 S. COLLEGE STREET\\nStreet:         NC1-014-14-04\\nCity:           CHARLOTTE\\nState/Prov:     NC\\nCountry:        US\\nPostalCode:     28255\\nRegDate:        2004-04-14\\nUpdated:        2018-11-05\\nOfficePhone:    +1-704-386-5000\\nMailbox:        ABUSE@bankofamerica.com\\nSource:         ARIN\\n"}, {"range": "199.253.63.0/24", "id": "ISC-NET12", "name": "Internet Systems Consortium, Inc.", "country": "US", "domain": "isc.org", "org_id": "ISC-94", "status": "ALLOCATION", "tech_id": "ISCN-ARIN", "mnt_id": "ISCN-ARIN", "admin_id": "ISCN-ARIN", "abuse_id": "ISCAT-ARIN", "created": "2010-10-18", "updated": "2012-02-24", "source": "arin", "raw": "NetHandle:      NET-199-253-63-0-1\\nOrgID:          ISC-94\\nParent:         NET-199-0-0-0-0\\nNetName:        ISC-NET12\\nNetRange:       199.253.63.0 - 199.253.63.255\\nNetType:        allocation\\nComment:        F Root Nameserver Operations\\nRegDate:        2010-10-18\\nUpdated:        2012-02-24\\nAbuseHandle:    ISCAT-ARIN\\nNOCHandle:      ISCN-ARIN\\nTechHandle:     ISCN-ARIN\\nSource:         ARIN\\n\n\nOrgID:          ISC-94\\nOrgName:        Internet Systems Consortium, Inc.\\nCanAllocate:    \\nStreet:         PO Box 360\\nCity:           Newmarket\\nState/Prov:     NH\\nCountry:        US\\nPostalCode:     03857\\nRegDate:        2004-01-09\\nUpdated:        2020-08-25\\nOrgAbuseHandle: ISCAT-ARIN\\nOrgAdminHandle: ISCN-ARIN\\nOrgNOCHandle:   ISCN-ARIN\\nOrgTechHandle:  BELLI82-ARIN\\nOrgTechHandle:  ISCN-ARIN\\nOrgTechHandle:  JSO127-ARIN\\nSource:         ARIN\\n\n\nPOCHandle:      ISCN-ARIN\\nIsRole:         Y\\nLastName:       Internet Systems Consortium NOC\\nFirstName:      \\nStreet:         PO Box 360\\nCity:           Newmarket\\nState/Prov:     NH\\nCountry:        US\\nPostalCode:     03857\\nRegDate:        2003-05-15\\nUpdated:        2021-08-25\\nOfficePhone:    +1-650-423-1310\\nMailbox:        noc@isc.org\\nSource:         ARIN\\n\n\nPOCHandle:      ISCAT-ARIN\\nIsRole:         Y\\nLastName:       Internet Systems Consortium Abuse Team\\nFirstName:      \\nStreet:         PO Box 360\\nCity:           Newmarket\\nState/Prov:     NH\\nCountry:        US\\nPostalCode:     03857\\nRegDate:        2003-05-15\\nUpdated:        2021-08-25\\nOfficePhone:    +1-650-423-1300\\nMailbox:        abuse@isc.org\\nSource:         ARIN\\n\n\nPOCHandle:      BELLI82-ARIN\\nIsRole:         N\\nLastName:       Bellis\\nFirstName:      Ray\\nStreet:         PO Box 360\\nCity:           Newmarket\\nState/Prov:     NH\\nCountry:        US\\nPostalCode:     03857\\nRegDate:        2019-11-11\\nUpdated:        2021-08-25\\nOfficePhone:    +1-650-423-1300\\nMailbox:        ray@isc.org\\nSource:         ARIN\\n\n\nPOCHandle:      JSO127-ARIN\\nIsRole:         N\\nLastName:       Osborn\\nFirstName:      Jeffrey\\nStreet:         60 Exeter Road, Suite 104\\nStreet:         PO Box 360\\nCity:           Newmarket\\nState/Prov:     NH\\nCountry:        US\\nPostalCode:     03824\\nRegDate:        2018-04-16\\nUpdated:        2022-04-15\\nOfficePhone:    +1-408-455-8258\\nOfficePhone:    +1-650-423-1449\\nMailbox:        jeff@isc.org\\nSource:         ARIN\\n"}, {"range": "24.239.73.0/26", "id": "ACS-CGN-CHEASAPEAKEOH", "name": "Armstrong", "country": "US", "domain": "armstrongonewire.com", "org_id": "ARMC", "status": "REALLOCATION", "tech_id": "NOC11973-ARIN", "mnt_id": "NOC11973-ARIN", "admin_id": "NOC11973-ARIN", "abuse_id": "NOC11974-ARIN", "created": "2019-06-28", "updated": "2019-06-28", "source": "arin", "raw": "NetHandle:      NET-24-239-73-0-1\\nOrgID:          ARMC\\nParent:         NET-24-239-64-0-1\\nNetName:        ACS-CGN-CHEASAPEAKEOH\\nNetRange:       24.239.73.0 - 24.239.73.63\\nNetType:        reallocation\\nOriginAS:       27364\\nRegDate:        2019-06-28\\nUpdated:        2019-06-28\\nSource:         ARIN\\n\n\nOrgID:          ARMC\\nOrgName:        Armstrong\\nCanAllocate:    \\nStreet:         ONE Armstrong Place\\nCity:           Butler\\nState/Prov:     PA\\nCountry:        US\\nPostalCode:     16001\\nRegDate:        1997-08-28\\nUpdated:        2022-04-18\\nOrgAbuseHandle: NOC11974-ARIN\\nOrgAdminHandle: NOC11973-ARIN\\nOrgNOCHandle:   NOC11973-ARIN\\nOrgTechHandle:  NOC11973-ARIN\\nSource:         ARIN\\n\n\nPOCHandle:      NOC11974-ARIN\\nIsRole:         Y\\nLastName:       Network Operations Center\\nFirstName:      \\nStreet:         One Armstrong Place\\nCity:           Butler\\nState/Prov:     PA\\nCountry:        US\\nPostalCode:     16001\\nRegDate:        2011-04-28\\nUpdated:        2022-04-20\\nFaxPhone:       +1-724-282-5624\\nOfficePhone:    +1-877-277-5709\\nMailbox:        abuse@zoominternet.net\\nSource:         ARIN\\n\n\nPOCHandle:      NOC11973-ARIN\\nIsRole:         Y\\nLastName:       Network Operations Center\\nFirstName:      \\nStreet:         One Armstrong Place\\nCity:           Butler\\nState/Prov:     PA\\nCountry:        US\\nPostalCode:     16001\\nRegDate:        2011-04-28\\nUpdated:        2022-04-20\\nOfficePhone:    +1-877-277-5709\\nFaxPhone:       +1-724-282-5624\\nMailbox:        noc@zoominternet.net\\nSource:         ARIN\\n"}, {"range": "216.120.148.0/22", "id": "ROOTI", "name": "ROOT, INC.", "country": "US", "domain": "rootinc.com", "org_id": "ROOTI", "status": "ALLOCATION", "tech_id": "POC35-ARIN", "mnt_id": "POC35-ARIN", "admin_id": "POC35-ARIN", "abuse_id": "POC35-ARIN", "created": "2021-04-02", "updated": "2021-12-14", "source": "arin", "raw": "NetHandle:      NET-216-120-148-0-1\\nOrgID:          ROOTI\\nParent:         NET-216-0-0-0-0\\nNetName:        ROOTI\\nNetRange:       216.120.148.0 - 216.120.151.255\\nNetType:        allocation\\nRegDate:        2021-04-02\\nUpdated:        2021-12-14\\nSource:         ARIN\\n\n\nOrgID:          ROOTI\\nOrgName:        ROOT, INC.\\nCanAllocate:    \\nStreet:         80 E Rich St STE 500\\nCity:           Columbus\\nState/Prov:     OH\\nCountry:        US\\nPostalCode:     43215\\nRegDate:        2020-03-25\\nUpdated:        2020-03-25\\nOrgAbuseHandle: POC35-ARIN\\nOrgAdminHandle: POC35-ARIN\\nOrgNOCHandle:   POC35-ARIN\\nOrgTechHandle:  POC35-ARIN\\nSource:         ARIN\\n\n\nPOCHandle:      POC35-ARIN\\nIsRole:         Y\\nLastName:       POC\\nFirstName:      \\nStreet:         80 E Rich St STE 500\\nCity:           Columbus\\nState/Prov:     OH\\nCountry:        US\\nPostalCode:     43215\\nRegDate:        2020-03-02\\nUpdated:        2022-04-04\\nOfficePhone:    +1-866-980-9431\\nMailbox:        arin-noc@joinroot.com\\nSource:         ARIN\\n"}, {"range": "72.14.117.0-72.14.119.255", "id": "ZCORUM", "name": "ZCORUM", "country": "US", "domain": "zcorum.com", "org_id": "VGL-152", "status": "ALLOCATION", "tech_id": "BBE50-ARIN\\NWANGS70-ARIN\\NCROWN51-ARIN\\NENYED1-ARIN\\NPINAF-ARIN\\NSHOEM22-ARIN\\NTSM38-ARIN", "mnt_id": "NOC32011-ARIN", "admin_id": "BBE50-ARIN", "abuse_id": "ABUSE4833-ARIN", "created": "2004-11-05", "updated": "2020-12-21", "source": "arin", "raw": "NetHandle:      NET-72-14-117-0-2\\nOrgID:          VGL-152\\nParent:         NET-72-0-0-0-0\\nNetName:        ZCORUM\\nNetRange:       72.14.117.0 - 72.14.119.255\\nNetType:        allocation\\nOriginAS:       4452\\nRegDate:        2004-11-05\\nUpdated:        2020-12-21\\nSource:         ARIN\\n\n\nOrgID:          VGL-152\\nOrgName:        ZCORUM\\nCanAllocate:    \\nStreet:         4501 NorthPoint Parkway\\nStreet:         Suite 125\\nCity:           Alpharetta\\nState/Prov:     GA\\nCountry:        US\\nPostalCode:     30022\\nComment:        VTRUM Group LLC DBA ZCORUM\\nRegDate:        2020-04-22\\nUpdated:        2020-10-02\\nOrgNOCHandle:   NOC32011-ARIN\\nOrgAbuseHandle: ABUSE4833-ARIN\\nOrgAdminHandle: BBE50-ARIN\\nOrgDNSHandle:   DNSAD18-ARIN\\nOrgRoutingHandle:   TSM38-ARIN\\nOrgTechHandle:  BBE50-ARIN\\nOrgTechHandle:  WANGS70-ARIN\\nOrgTechHandle:  CROWN51-ARIN\\nOrgTechHandle:  ENYED1-ARIN\\nOrgTechHandle:  PINAF-ARIN\\nOrgTechHandle:  SHOEM22-ARIN\\nOrgTechHandle:  TSM38-ARIN\\nSource:         ARIN\\n\n\nPOCHandle:      SHOEM22-ARIN\\nIsRole:         N\\nLastName:       Shoemaker\\nFirstName:      Michael\\nStreet:         120 Milledgeville Hwy\\nCity:           Gordon\\nState/Prov:     GA\\nCountry:        US\\nPostalCode:     31031\\nRegDate:        2014-08-26\\nUpdated:        2021-06-16\\nOfficePhone:    +1-866-408-0071\\nMobilePhone:    +1-478-628-6001\\nMailbox:        shoemake@zcorum.com\\nSource:         ARIN\\n\n\nPOCHandle:      PINAF-ARIN\\nIsRole:         N\\nLastName:       Pina\\nFirstName:      Frank\\nStreet:         4501 Northpoint Parkway\\nStreet:         Suite 125\\nCity:           Alpharetta\\nState/Prov:     GA\\nCountry:        US\\nPostalCode:     30022\\nRegDate:        2014-08-26\\nUpdated:        2020-11-03\\nOfficePhone:    +1-800-909-9441\\nFaxPhone:       +1-678-507-5001\\nOfficePhone:    +1-678-507-5000\\nMailbox:        fpina@zcorum.com\\nSource:         ARIN\\n\n\nPOCHandle:      CROWN51-ARIN\\nIsRole:         N\\nLastName:       Crowner\\nFirstName:      Kevin\\nStreet:         4501 North Point Parkway\\nCity:           Alpharetta\\nState/Prov:     GA\\nCountry:        US\\nPostalCode:     30022\\nRegDate:        2020-10-02\\nUpdated:        2021-10-05\\nOfficePhone:    +1-678-507-5000\\nMailbox:        kcrowner@zcorum.com\\nSource:         ARIN\\n\n\nPOCHandle:      NOC32011-ARIN\\nIsRole:         Y\\nLastName:       NOC\\nFirstName:      \\nStreet:         4501 NorthPoint Parkway\\nStreet:         Suite 125\\nCity:           Alpharetta\\nState/Prov:     GA\\nCountry:        US\\nPostalCode:     30022\\nRegDate:        2014-08-21\\nUpdated:        2022-01-21\\nOfficePhone:    +1-800-909-9441\\nMailbox:        datactr@zcorum.com\\nSource:         ARIN\\n\n\nPOCHandle:      ENYED1-ARIN\\nIsRole:         N\\nLastName:       Enyedi\\nFirstName:      Stefan\\nStreet:         4501 North Point\\nCity:           Alpharetta\\nState/Prov:     GA\\nCountry:        US\\nPostalCode:     30022\\nRegDate:        2017-12-21\\nUpdated:        2021-09-21\\nOfficePhone:    +1-678-507-5000\\nMailbox:        senyedi@zcorum.com\\nSource:         ARIN\\n\n\nPOCHandle:      BBE50-ARIN\\nIsRole:         N\\nLastName:       Bertram\\nFirstName:      Buddy\\nStreet:         4501 North Point Parkway\\nStreet:         Suite 125\\nCity:           Alpharetta\\nState/Prov:     GA\\nCountry:        US\\nPostalCode:     30022\\nRegDate:        2004-08-19\\nUpdated:        2021-01-28\\nOfficePhone:    +1-678-507-5000\\nMailbox:        dbertram@zcorum.com\\nMailbox:        buddy@zcorum.com\\nSource:         ARIN\\n\n\nPOCHandle:      TSM38-ARIN\\nIsRole:         N\\nLastName:       Smith\\nFirstName:      Tim\\nStreet:         4501 Northpoint Parkway\\nStreet:         Suite 125\\nCity:           Alpharetta\\nState/Prov:     GA\\nCountry:        US\\nPostalCode:     30022\\nRegDate:        2004-04-22\\nUpdated:        2021-11-18\\nOfficePhone:    +1-678-507-5000\\nMailbox:        tsmith@zcorum.com\\nSource:         ARIN\\n\n\nPOCHandle:      WANGS70-ARIN\\nIsRole:         N\\nLastName:       Wang\\nFirstName:      Scott\\nStreet:         4501 NorthPoint Parkway\\nStreet:         Suite 125\\nCity:           Alpharetta\\nState/Prov:     GA\\nCountry:        US\\nPostalCode:     30022\\nRegDate:        2017-01-31\\nUpdated:        2021-11-04\\nFaxPhone:       +1-678-507-5001\\nOfficePhone:    +1-678-507-5000\\nMailbox:        swang@zcorum.com\\nSource:         ARIN\\n\n\nPOCHandle:      ABUSE4833-ARIN\\nIsRole:         Y\\nLastName:       ABUSE\\nFirstName:      \\nStreet:         4051 NorthPoint Parkway\\nStreet:         Suite 125\\nCity:           Alpharetta\\nState/Prov:     GA\\nCountry:        US\\nPostalCode:     30022\\nRegDate:        2014-08-22\\nUpdated:        2022-01-21\\nOfficePhone:    +1-866-467-9791\\nMailbox:        abuse@zcorum.com\\nSource:         ARIN\\n"}, {"range": "192.104.157.0/24", "id": "ENWNET", "name": "Energy Northwest", "country": "US", "domain": "energy-northwest.com", "org_id": "ENERG-2", "status": "ALLOCATION", "tech_id": "HOMER5-ARIN\\NNOC1480-ARIN", "mnt_id": "NOC1480-ARIN", "admin_id": "HOMER5-ARIN", "abuse_id": "NOC1480-ARIN", "created": "1991-05-30", "updated": "2021-12-14", "source": "arin", "raw": "NetHandle:      NET-192-104-157-0-1\\nOrgID:          ENERG-2\\nParent:         NET-192-0-0-0-0\\nNetName:        ENWNET\\nNetRange:       192.104.157.0 - 192.104.157.255\\nNetType:        allocation\\nRegDate:        1991-05-30\\nUpdated:        2021-12-14\\nSource:         ARIN\\n\n\nOrgID:          ENERG-2\\nOrgName:        Energy Northwest\\nCanAllocate:    \\nStreet:         Columbia Generating Station\\nStreet:         PO Box 968\\nCity:           Richland\\nState/Prov:     WA\\nCountry:        US\\nPostalCode:     99352\\nRegDate:        2004-01-09\\nUpdated:        2015-06-13\\nOrgAbuseHandle: NOC1480-ARIN\\nOrgAbuseHandle: SCIS-ARIN\\nOrgAdminHandle: HOMER5-ARIN\\nOrgNOCHandle:   NOC1480-ARIN\\nOrgTechHandle:  HOMER5-ARIN\\nOrgTechHandle:  NOC1480-ARIN\\nSource:         ARIN\\n\n\nPOCHandle:      SCIS-ARIN\\nIsRole:         N\\nLastName:       Solution Center\\nFirstName:      Information Services\\nStreet:         76 N. Powerplant Loop\\nCity:           Richland\\nState/Prov:     WA\\nCountry:        US\\nPostalCode:     99354\\nRegDate:        2014-05-15\\nUpdated:        2020-05-26\\nOfficePhone:    +1-509-377-8400\\nMailbox:        ISCALLCENTER@energy-northwest.com\\nSource:         ARIN\\n\n\nPOCHandle:      HOMER5-ARIN\\nIsRole:         N\\nLastName:       Homer\\nFirstName:      Lyle\\nStreet:         PO Box 968\\nCity:           Richland\\nState/Prov:     WA\\nCountry:        US\\nPostalCode:     99352\\nRegDate:        2015-03-26\\nUpdated:        2021-09-13\\nOfficePhone:    +1-509-377-8365\\nMobilePhone:    +1-509-377-8400\\nMailbox:        lehomer@energy-northwest.com\\nSource:         ARIN\\n\n\nPOCHandle:      NOC1480-ARIN\\nIsRole:         Y\\nLastName:       Network Operations Center\\nFirstName:      \\nStreet:         Energy Northwest ATTN Network Operations\\nStreet:         PO Box 968\\nCity:           Richland\\nState/Prov:     WA\\nCountry:        US\\nPostalCode:     99352\\nRegDate:        2004-01-09\\nUpdated:        2022-07-13\\nOfficePhone:    +1-509-377-8400\\nMobilePhone:    +1-509-377-4419\\nMailbox:        noc@energy-northwest.com\\nSource:         ARIN\\n"}, {"range": "8.14.60.0/24", "id": "HWC-BLK-SUMMERWIND", "name": "HWC", "country": "US", "domain": "gethotwired.net", "org_id": "HWC-33", "status": "REALLOCATION", "tech_id": "DCP8-ARIN\\NDRK9-ARIN\\NIPADM737-ARIN\\NJSL39-ARIN\\NLAWSO19-ARIN", "mnt_id": "JSL39-ARIN", "admin_id": "JSL48-ARIN", "abuse_id": "JSL39-ARIN", "created": "2018-03-14", "updated": "2018-03-14", "source": "arin", "raw": "NetHandle:      NET-8-14-60-0-2\\nOrgID:          HWC-33\\nParent:         NET-8-14-60-0-1\\nNetName:        HWC-BLK-SUMMERWIND\\nNetRange:       8.14.60.0 - 8.14.60.255\\nNetType:        reallocation\\nOriginAS:       23089, 31793\\nComment:        Addresses within this range are NON-PORTABLE\\nComment:        In use at development \u00e2\u20ac\u201c US - FL - SUMMERWIND - Summerwind\\nRegDate:        2018-03-14\\nUpdated:        2018-03-14\\nSource:         ARIN\\n\n\nOrgID:          HWC-33\\nOrgName:        HWC\\nCanAllocate:    \\nStreet:         Three Bala Plaza East,\\nStreet:         Suite 700\\nCity:           Bala Cynwyd\\nState/Prov:     PA\\nCountry:        US\\nPostalCode:     19004\\nComment:        Information regarding this Autonomous System can be found at http://as23089.peeringdb.com\\nRegDate:        2015-03-26\\nUpdated:        2021-09-14\\nReferralServer: rwhois://rwhois.gethotwired.net:4321\\nOrgAbuseHandle: JSL39-ARIN\\nOrgAdminHandle: JSL48-ARIN\\nOrgNOCHandle:   JSL39-ARIN\\nOrgTechHandle:  DCP8-ARIN\\nOrgTechHandle:  DRK9-ARIN\\nOrgTechHandle:  IPADM737-ARIN\\nOrgTechHandle:  JSL39-ARIN\\nOrgTechHandle:  LAWSO19-ARIN\\nSource:         ARIN\\n\n\nPOCHandle:      DRK9-ARIN\\nIsRole:         N\\nLastName:       Ketterhagen\\nFirstName:      Donald\\nStreet:         1415 Martin Luther King Jr Ave S\\nCity:           Salisbury\\nState/Prov:     NC\\nCountry:        US\\nPostalCode:     28144\\nRegDate:        2005-03-12\\nUpdated:        2022-03-12\\nFaxPhone:       +1-954-417-3562\\nMobilePhone:    +1-919-609-4669\\nOfficePhone:    +1-704-244-5552\\nMailbox:        bketterhagen@hotwirecommunication.com\\nMailbox:        bob@ketterhagen.com\\nSource:         ARIN\\n\n\nPOCHandle:      IPADM737-ARIN\\nIsRole:         Y\\nLastName:       IP Administrator\\nFirstName:      \\nStreet:         One Belmont Avenue\\nStreet:         Suite 1100\\nCity:           Bala Cynwyd\\nState/Prov:     PA\\nCountry:        US\\nPostalCode:     19004\\nRegDate:        2015-03-26\\nUpdated:        2021-08-31\\nOfficePhone:    +1-484-572-6200\\nMailbox:        ipadmin@hotwirecommunication.com\\nSource:         ARIN\\n\n\nPOCHandle:      DCP8-ARIN\\nIsRole:         N\\nLastName:       Pacheco\\nFirstName:      Donaldo\\nStreet:         2100 W Cypress Creek Rd\\nCity:           Fort Lauderdale\\nState/Prov:     FL\\nCountry:        US\\nPostalCode:     33309\\nRegDate:        2015-08-03\\nUpdated:        2022-07-29\\nOfficePhone:    +1-954-417-6745\\nMailbox:        donaldo.pacheco@hotwirecommunication.com\\nSource:         ARIN\\n\n\nPOCHandle:      JSL48-ARIN\\nIsRole:         N\\nLastName:       slattery\\nFirstName:      jim\\nStreet:         3 Bala Plaza East\\nStreet:         suite 700\\nCity:           Bala Cynwyd\\nState/Prov:     PA\\nCountry:        US\\nPostalCode:     19004\\nRegDate:        2005-04-19\\nUpdated:        2021-08-23\\nOfficePhone:    +1-484-580-9006\\nMailbox:        jslattery@hotwiremail.com\\nSource:         ARIN\\n\n\nPOCHandle:      JSL39-ARIN\\nIsRole:         N\\nLastName:       Slattery\\nFirstName:      Jim\\nStreet:         3 Bala Plaza East\\nStreet:         suite 700\\nCity:           Bala Cynwyd\\nState/Prov:     PA\\nCountry:        US\\nPostalCode:     19004\\nRegDate:        2004-05-10\\nUpdated:        2021-11-24\\nOfficePhone:    +1-484-580-9006\\nMailbox:        JSlattery@hotwirecommunication.com\\nSource:         ARIN\\n\n\nPOCHandle:      LAWSO19-ARIN\\nIsRole:         N\\nLastName:       Lawson\\nFirstName:      Jeff\\nStreet:         300 East Lancaster Ave\\nStreet:         Suite 208\\nCity:           Wynnewood\\nState/Prov:     PA\\nCountry:        US\\nPostalCode:     19096\\nRegDate:        2012-10-03\\nUpdated:        2020-04-21\\nOfficePhone:    +1-215-720-4028\\nMobilePhone:    +1-215-720-4028\\nMailbox:        jlawson@hotwiremail.com\\nSource:         ARIN\\n"}, {"range": "63.149.134.112/29", "id": "Q1119-63-149-134-112", "name": "Bandwidth.com Inc.", "country": "US", "domain": "bandwidth.com", "org_id": "BNO", "status": "REALLOCATION", "tech_id": "BCNO1-ARIN", "mnt_id": "BNO13-ARIN", "admin_id": "BCNO1-ARIN", "abuse_id": "BCNO1-ARIN", "created": "2012-11-19", "updated": "2012-11-19", "source": "arin", "raw": "NetHandle:      NET-63-149-134-112-1\\nOrgID:          BNO\\nParent:         NET-63-144-0-0-1\\nNetName:        Q1119-63-149-134-112\\nNetRange:       63.149.134.112 - 63.149.134.119\\nNetType:        reallocation\\nOriginAS:       209\\nRegDate:        2012-11-19\\nUpdated:        2012-11-19\\nSource:         ARIN\\n\n\nOrgID:          BNO\\nOrgName:        Bandwidth.com Inc.\\nCanAllocate:    \\nStreet:         900 Main Campus Drive\\nCity:           Raleigh\\nState/Prov:     NC\\nCountry:        US\\nPostalCode:     27606\\nRegDate:        2003-11-17\\nUpdated:        2014-03-17\\nOrgAbuseHandle: BCNO1-ARIN\\nOrgAdminHandle: BCNO1-ARIN\\nOrgNOCHandle:   BNO13-ARIN\\nOrgTechHandle:  BCNO1-ARIN\\nSource:         ARIN\\n\n\nPOCHandle:      BNO13-ARIN\\nIsRole:         Y\\nLastName:       Bandwidth Network Operations\\nFirstName:      \\nStreet:         4001 Weston Parkway\\nStreet:         Suite 100\\nCity:           Cary\\nState/Prov:     NC\\nCountry:        US\\nPostalCode:     27513\\nRegDate:        2003-11-17\\nUpdated:        2014-11-07\\nOfficePhone:    +1-800-409-4357\\nMailbox:        networkservices@bandwidth.com\\nSource:         ARIN\\n\n\nPOCHandle:      BCNO1-ARIN\\nIsRole:         Y\\nLastName:       Customer Care Department\\nFirstName:      \\nStreet:         900 Main Campus Drive\\nCity:           Raleigh\\nState/Prov:     NC\\nCountry:        US\\nPostalCode:     27606\\nRegDate:        2003-11-17\\nUpdated:        2015-03-17\\nOfficePhone:    +1-800-808-5150\\nMailbox:        support@broadband.com\\nSource:         ARIN\\n"}, {"range": "205.207.170.0/23", "id": "ALPHANET-NET", "name": "AlphaNet Telecom, Inc.", "country": "US", "domain": "alpha-net.org", "org_id": "INTB", "status": "ALLOCATION", "tech_id": "ADMIN5743-ARIN", "mnt_id": "ADMIN5743-ARIN", "admin_id": "ADMIN5743-ARIN", "abuse_id": "ADMIN5743-ARIN", "created": "1995-09-22", "updated": "2015-07-13", "source": "arin", "raw": "NetHandle:      NET-205-207-170-0-1\\nOrgID:          INTB\\nParent:         NET-205-0-0-0-0\\nNetName:        ALPHANET-NET\\nNetRange:       205.207.170.0 - 205.207.171.255\\nNetType:        allocation\\nOriginAS:       23139, 23148, 2828, 174\\nRegDate:        1995-09-22\\nUpdated:        2015-07-13\\nAbuseHandle:    ADMIN5743-ARIN\\nNOCHandle:      ADMIN5743-ARIN\\nTechHandle:     ADMIN5743-ARIN\\nSource:         ARIN\\n\n\nOrgID:          INTB\\nOrgName:        AlphaNet Telecom, Inc.\\nCanAllocate:    \\nStreet:         1101 West Hamilton Street\\nCity:           Allentown\\nState/Prov:     PA\\nCountry:        US\\nPostalCode:     18101\\nRegDate:        1995-09-22\\nUpdated:        2015-06-30\\nOrgAbuseHandle: ADMIN5743-ARIN\\nOrgAdminHandle: ADMIN5743-ARIN\\nOrgNOCHandle:   ADMIN5743-ARIN\\nOrgTechHandle:  ADMIN5743-ARIN\\nSource:         ARIN\\n\n\nPOCHandle:      ADMIN5743-ARIN\\nIsRole:         Y\\nLastName:       Admin\\nFirstName:      \\nStreet:         1101 West Hamilton Street\\nCity:           Allentown\\nState/Prov:     PA\\nCountry:        US\\nPostalCode:     18101\\nRegDate:        2015-05-08\\nUpdated:        2018-04-18\\nOfficePhone:    +1-215-358-4267\\nMailbox:        joel@alpha-net.org\\nSource:         ARIN\\n"}, {"range": "216.163.120.0/23", "id": "NETBLK-NRTC-DOTNET1", "name": "National Rural Telecommunications Cooperative", "country": "US", "domain": "nrtc.coop", "org_id": "NRTC-2", "status": "REASSIGNMENT", "tech_id": "DUBOS10-ARIN\\NTAA4-ARIN", "mnt_id": "TAT24-ARIN", "admin_id": "ADU40-ARIN", "abuse_id": "TAT24-ARIN", "created": "2002-06-19", "updated": "2006-12-21", "source": "arin", "raw": "NetHandle:      NET-216-163-120-0-1\\nOrgID:          NRTC-2\\nParent:         NET-216-163-96-0-1\\nNetName:        NETBLK-NRTC-DOTNET1\\nNetRange:       216.163.120.0 - 216.163.121.255\\nNetType:        reassignment\\nRegDate:        2002-06-19\\nUpdated:        2006-12-21\\nSource:         ARIN\\n\n\nOrgID:          NRTC-2\\nOrgName:        National Rural Telecommunications Cooperative\\nCanAllocate:    \\nStreet:         2121 Cooperative Way\\nCity:           Herndon\\nState/Prov:     VA\\nCountry:        US\\nPostalCode:     20171\\nRegDate:        2000-03-30\\nUpdated:        2020-07-21\\nOrgAbuseHandle: TAT24-ARIN\\nOrgAdminHandle: ADU40-ARIN\\nOrgNOCHandle:   TAT24-ARIN\\nOrgRoutingHandle:   IPADM503-ARIN\\nOrgTechHandle:  DUBOS10-ARIN\\nOrgTechHandle:  TAA4-ARIN\\nSource:         ARIN\\n\n\nPOCHandle:      ADU40-ARIN\\nIsRole:         N\\nLastName:       DUFFY\\nFirstName:      ANDREW\\nStreet:         1201 Edwards Mill Rd\\nCity:           Raleigh\\nState/Prov:     NC\\nCountry:        US\\nPostalCode:     27607\\nRegDate:        2009-08-04\\nUpdated:        2022-07-19\\nOfficePhone:    +1-919-460-3330\\nMailbox:        apilkington@nrtc.org\\nSource:         ARIN\\n\n\nPOCHandle:      DUBOS10-ARIN\\nIsRole:         N\\nLastName:       DuBose\\nFirstName:      Larry\\nStreet:         2121 Cooperative Way\\nStreet:         Suite 600\\nCity:           Herndon\\nState/Prov:     VA\\nCountry:        US\\nPostalCode:     20171\\nRegDate:        2018-02-05\\nUpdated:        2022-02-18\\nOfficePhone:    +1-703-787-7190\\nMailbox:        ldubose@neonova.net\\nSource:         ARIN\\n\n\nPOCHandle:      TAT24-ARIN\\nIsRole:         Y\\nLastName:       Trueband Abuse Team\\nFirstName:      \\nStreet:         2121 Cooperative Way\\nStreet:         Suite 600\\nCity:           Herndon\\nState/Prov:     VA\\nCountry:        US\\nPostalCode:     20171\\nRegDate:        2009-02-24\\nUpdated:        2022-07-19\\nOfficePhone:    +1-703-787-7190\\nMailbox:        ispwebmaster@nrtc.coop\\nSource:         ARIN\\n\n\nPOCHandle:      TAA4-ARIN\\nIsRole:         Y\\nLastName:       Trueband Arin Admin\\nFirstName:      \\nStreet:         2121 Cooperative Way\\nStreet:         Suite 600\\nCity:           Herndon\\nState/Prov:     VA\\nCountry:        US\\nPostalCode:     20171\\nRegDate:        2009-02-24\\nUpdated:        2021-07-21\\nOfficePhone:    +1-703-787-7190\\nMailbox:        ms-neteng@nrtc.coop\\nMailbox:        apilkington@nrtc.org\\nSource:         ARIN\\n"}, {"range": "8.36.218.0/24", "id": "LPL-141-CLOUD14-8-36-218", "name": "Cloudflare, Inc.", "country": "US", "domain": "cloudflare.com", "org_id": "CLOUD14", "status": "REASSIGNMENT", "tech_id": "ADMIN2521-ARIN", "mnt_id": "CLOUD146-ARIN", "admin_id": "ADMIN2521-ARIN", "abuse_id": "ABUSE2916-ARIN", "created": "2019-06-10", "updated": "2019-06-10", "source": "arin", "raw": "NetHandle:      NET-8-36-218-0-1\\nOrgID:          CLOUD14\\nParent:         NET-8-0-0-0-1\\nNetName:        LPL-141-CLOUD14-8-36-218\\nNetRange:       8.36.218.0 - 8.36.218.255\\nNetType:        reassignment\\nOriginAS:       13335\\nRegDate:        2019-06-10\\nUpdated:        2019-06-10\\nSource:         ARIN\\n\n\nOrgID:          CLOUD14\\nOrgName:        Cloudflare, Inc.\\nCanAllocate:    \\nStreet:         101 Townsend Street\\nCity:           San Francisco\\nState/Prov:     CA\\nCountry:        US\\nPostalCode:     94107\\nRegDate:        2010-07-09\\nUpdated:        2021-07-01\\nOrgAbuseHandle: ABUSE2916-ARIN\\nOrgAdminHandle: ADMIN2521-ARIN\\nOrgNOCHandle:   CLOUD146-ARIN\\nOrgRoutingHandle:   CLOUD146-ARIN\\nOrgTechHandle:  ADMIN2521-ARIN\\nSource:         ARIN\\n\n\nPOCHandle:      CLOUD146-ARIN\\nIsRole:         Y\\nLastName:       Cloudflare-NOC\\nFirstName:      \\nStreet:         101 Townsend St\\nCity:           San Francsico\\nState/Prov:     CA\\nCountry:        US\\nPostalCode:     94107\\nRegDate:        2021-07-01\\nUpdated:        2022-08-09\\nOfficePhone:    +1-650-319-8930\\nMailbox:        noc@cloudflare.com\\nSource:         ARIN\\n\n\nPOCHandle:      ADMIN2521-ARIN\\nIsRole:         Y\\nLastName:       Admin\\nFirstName:      \\nStreet:         101 Townsend Street\\nCity:           San Francisco\\nState/Prov:     CA\\nCountry:        US\\nPostalCode:     94107\\nRegDate:        2011-04-19\\nUpdated:        2022-01-20\\nOfficePhone:    +1-650-319-8930\\nMailbox:        rir@cloudflare.com\\nSource:         ARIN\\n\n\nPOCHandle:      ABUSE2916-ARIN\\nIsRole:         Y\\nLastName:       Abuse\\nFirstName:      \\nStreet:         101 Townsend Street\\nCity:           San Francisco\\nState/Prov:     CA\\nCountry:        US\\nPostalCode:     94107\\nRegDate:        2011-02-14\\nUpdated:        2020-04-23\\nOfficePhone:    +1-650-319-8930\\nMailbox:        abuse@cloudflare.com\\nSource:         ARIN\\n"}, {"range": "69.214.153.152/29", "id": "SBCIS-WYPR-692143416", "name": "Wayport, LLC", "country": "US", "domain": "wayport.net", "org_id": "WYPR", "status": "REASSIGNMENT", "tech_id": "WN25-ARIN", "mnt_id": "AWSN-ARIN", "admin_id": "WN25-ARIN", "abuse_id": "ABUSE670-ARIN", "created": "2005-01-27", "updated": "2017-12-28", "source": "arin", "raw": "NetHandle:      NET-69-214-153-152-1\\nOrgID:          WYPR\\nParent:         NET-69-210-128-0-1\\nNetName:        SBCIS-WYPR-692143416\\nNetRange:       69.214.153.152 - 69.214.153.159\\nNetType:        reassignment\\nRegDate:        2005-01-27\\nUpdated:        2017-12-28\\nAbuseHandle:    ABUSE670-ARIN\\nSource:         ARIN\\n\n\nOrgID:          WYPR\\nOrgName:        Wayport, LLC\\nCanAllocate:    \\nStreet:         4509 Freidrich Lane\\nStreet:         Building III, Suite 300\\nCity:           Austin\\nState/Prov:     TX\\nCountry:        US\\nPostalCode:     78744\\nRegDate:        1997-07-29\\nUpdated:        2020-09-24\\nReferralServer: rwhois://rwhois.wayport.net:4321\\nOrgAbuseHandle: ABUSE670-ARIN\\nOrgAdminHandle: WN25-ARIN\\nOrgNOCHandle:   AWSN-ARIN\\nOrgTechHandle:  WN25-ARIN\\nSource:         ARIN\\n\n\nPOCHandle:      AWSN-ARIN\\nIsRole:         Y\\nLastName:       ATT WiFi Services NOC\\nFirstName:      \\nStreet:         4509 Freidrich Lane\\nStreet:         Building III, Suite 300\\nCity:           Austin\\nState/Prov:     TX\\nCountry:        US\\nPostalCode:     78744\\nRegDate:        2012-05-31\\nUpdated:        2014-05-01\\nOfficePhone:    +1-512-519-6000\\nMailbox:        noc-internal@wayport.net\\nSource:         ARIN\\n\n\nPOCHandle:      WN25-ARIN\\nIsRole:         Y\\nLastName:       ATT WiFi Services IT\\nFirstName:      \\nStreet:         4509 Freidrich Ln\\nStreet:         Building III, Suite 300\\nCity:           Austin\\nState/Prov:     TX\\nCountry:        US\\nPostalCode:     78744\\nRegDate:        2000-01-21\\nUpdated:        2021-12-09\\nFaxPhone:       +1-512-519-6450\\nOfficePhone:    +1-512-519-6000\\nMailbox:        arin-coordinator@wayport.net\\nSource:         ARIN\\n\n\nPOCHandle:      ABUSE670-ARIN\\nIsRole:         Y\\nLastName:       Abuse\\nFirstName:      \\nStreet:         4509 Freidrich Ln\\nStreet:         Building 3, Ste 300\\nCity:           Austin\\nState/Prov:     TX\\nCountry:        US\\nPostalCode:     78744\\nRegDate:        2004-07-13\\nUpdated:        2021-12-09\\nOfficePhone:    +1-512-519-6000\\nMailbox:        abuse@wayport.net\\nSource:         ARIN\\n"}, {"range": "141.193.80.0/22", "id": "PFL-75", "name": "PD Fiber, LLC", "country": "US", "domain": "pdfiber.com", "org_id": "PFL-75", "status": "ALLOCATION", "tech_id": "DAVIS1763-ARIN\\NLINDS290-ARIN", "mnt_id": "DAVIS1763-ARIN", "admin_id": "DAVIS1763-ARIN", "abuse_id": "DAVIS1763-ARIN", "created": "2018-02-22", "updated": "2020-07-17", "source": "arin", "raw": "NetHandle:      NET-141-193-80-0-1\\nOrgID:          PFL-75\\nParent:         NET-141-0-0-0-0\\nNetName:        PFL-75\\nNetRange:       141.193.80.0 - 141.193.83.255\\nNetType:        allocation\\nOriginAS:       53971\\nRegDate:        2018-02-22\\nUpdated:        2020-07-17\\nAbuseHandle:    DAVIS1763-ARIN\\nNOCHandle:      DAVIS1763-ARIN\\nTechHandle:     DAVIS1763-ARIN\\nTechHandle:     LINDS290-ARIN\\nSource:         ARIN\\n\n\nOrgID:          PFL-75\\nOrgName:        PD Fiber, LLC\\nCanAllocate:    \\nStreet:         2801 West State Hwy 84\\nCity:           Bragg City\\nState/Prov:     MO\\nCountry:        US\\nPostalCode:     63827\\nComment:        http://www.pdfiber.com\\nRegDate:        2017-11-22\\nUpdated:        2020-11-04\\nOrgAbuseHandle: DAVIS1763-ARIN\\nOrgAdminHandle: DAVIS1763-ARIN\\nOrgNOCHandle:   DAVIS1763-ARIN\\nOrgTechHandle:  DAVIS1763-ARIN\\nOrgTechHandle:  LINDS290-ARIN\\nSource:         ARIN\\n\n\nPOCHandle:      LINDS290-ARIN\\nIsRole:         N\\nLastName:       Lindsey\\nFirstName:      Tyler\\nStreet:         PO Box 509\\nCity:           Hayti\\nState/Prov:     MO\\nCountry:        US\\nPostalCode:     63851\\nRegDate:        2020-07-17\\nUpdated:        2022-07-20\\nOfficePhone:    +1-573-653-3652\\nMailbox:        tyler@pdec.coop\\nSource:         ARIN\\n\n\nPOCHandle:      DAVIS1763-ARIN\\nIsRole:         N\\nLastName:       Davis\\nFirstName:      Jack\\nStreet:         PO Box 509\\nCity:           Hayti\\nState/Prov:     MO\\nCountry:        US\\nPostalCode:     63851\\nRegDate:        2017-11-19\\nUpdated:        2022-07-19\\nOfficePhone:    +1-573-653-3651\\nMailbox:        pdfiber@pemdunk.com\\nSource:         ARIN\\n"}, {"range": "64.69.128.0/20", "id": "MCDANIEL", "name": "McDaniel College", "country": "US", "domain": "mcdaniel.edu", "org_id": "MCDANI-3", "status": "ALLOCATION", "tech_id": "ARNET37-ARIN\\NOUCHA3-ARIN", "mnt_id": "DAVIS1585-ARIN", "admin_id": "LAWLO15-ARIN", "abuse_id": "ABUSE498-ARIN", "created": "2000-05-04", "updated": "2021-12-14", "source": "arin", "raw": "NetHandle:      NET-64-69-128-0-1\\nOrgID:          MCDANI-3\\nParent:         NET-64-0-0-0-0\\nNetName:        MCDANIEL\\nNetRange:       64.69.128.0 - 64.69.143.255\\nNetType:        allocation\\nRegDate:        2000-05-04\\nUpdated:        2021-12-14\\nTechHandle:     ARNET37-ARIN\\nTechHandle:     OUCHA3-ARIN\\nSource:         ARIN\\n\n\nOrgID:          MCDANI-3\\nOrgName:        McDaniel College\\nCanAllocate:    \\nStreet:         2 College Hill\\nCity:           Westminster\\nState/Prov:     MD\\nCountry:        US\\nPostalCode:     21157\\nRegDate:        1970-01-01\\nUpdated:        2018-07-17\\nOrgAbuseHandle: ABUSE498-ARIN\\nOrgAdminHandle: LAWLO15-ARIN\\nOrgNOCHandle:   DAVIS1585-ARIN\\nOrgTechHandle:  DAVIS1585-ARIN\\nSource:         ARIN\\n\n\nPOCHandle:      LAWLO15-ARIN\\nIsRole:         N\\nLastName:       Lawlor\\nFirstName:      Andrew\\nStreet:         2 College Hill\\nCity:           Westminster\\nState/Prov:     MD\\nCountry:        US\\nPostalCode:     21157\\nRegDate:        2018-07-17\\nUpdated:        2022-07-02\\nOfficePhone:    +1-410-386-4866\\nMailbox:        alawlor@mcdaniel.edu\\nSource:         ARIN\\n\n\nPOCHandle:      ABUSE498-ARIN\\nIsRole:         Y\\nLastName:       Abuse\\nFirstName:      \\nStreet:         2 College Hill\\nCity:           Westminster\\nState/Prov:     MD\\nCountry:        US\\nPostalCode:     21157\\nRegDate:        2003-12-16\\nUpdated:        2022-07-02\\nOfficePhone:    +1-410-386-4866\\nMailbox:        abuse@mcdaniel.edu\\nSource:         ARIN\\n\n\nPOCHandle:      DAVIS1585-ARIN\\nIsRole:         N\\nLastName:       Davis\\nFirstName:      Chris\\nStreet:         2 College Hill\\nCity:           Westminster\\nState/Prov:     MD\\nCountry:        US\\nPostalCode:     21157\\nRegDate:        2017-07-24\\nUpdated:        2017-07-24\\nOfficePhone:    +1-410-871-3115\\nMailbox:        cdavis@mcdaniel.edu\\nSource:         ARIN\\n\n\nPOCHandle:      OUCHA3-ARIN\\nIsRole:         N\\nLastName:       Ouchark\\nFirstName:      William\\nStreet:         2 College Hill\\nCity:           Westminster\\nState/Prov:     MD\\nCountry:        US\\nPostalCode:     21157\\nRegDate:        2017-07-24\\nUpdated:        2022-07-02\\nOfficePhone:    +1-410-386-4867\\nMailbox:        darnett@mcdaniel.edu\\nSource:         ARIN\\n\n\nPOCHandle:      ARNET37-ARIN\\nIsRole:         N\\nLastName:       Arnett\\nFirstName:      David\\nStreet:         2 College Hill\\nCity:           Westminster\\nState/Prov:     MD\\nCountry:        US\\nPostalCode:     21157\\nRegDate:        2020-07-16\\nUpdated:        2022-07-18\\nOfficePhone:    +1-410-386-4867\\nMailbox:        darnett@mcdaniel.edu\\nSource:         ARIN\\n"}, {"range": "67.155.87.176/28", "id": "XOXO-67-155-87-176", "name": "Consolidated Smart Systems LLC", "country": "US", "domain": "consolidatedsmart.com", "org_id": "CSSL-9", "status": "REALLOCATION", "tech_id": "DEBUS5-ARIN\\NTIER3-ARIN", "mnt_id": "NOC33474-ARIN", "admin_id": "TIER3-ARIN", "abuse_id": "NOCAB25-ARIN", "created": "2007-06-28", "updated": "2007-06-28", "source": "arin", "raw": "NetHandle:      NET-67-155-87-176-1\\nOrgID:          CSSL-9\\nParent:         NET-67-152-0-0-1\\nNetName:        XOXO-67-155-87-176\\nNetRange:       67.155.87.176 - 67.155.87.191\\nNetType:        reallocation\\nRegDate:        2007-06-28\\nUpdated:        2007-06-28\\nSource:         ARIN\\n\n\nOrgID:          CSSL-9\\nOrgName:        Consolidated Smart Systems LLC\\nCanAllocate:    \\nStreet:         620 West 135th Street\\nCity:           Gardena\\nState/Prov:     CA\\nCountry:        US\\nPostalCode:     90248\\nRegDate:        2007-05-23\\nUpdated:        2022-06-07\\nOrgAbuseHandle: NOCAB25-ARIN\\nOrgAdminHandle: TIER3-ARIN\\nOrgNOCHandle:   NOC33474-ARIN\\nOrgTechHandle:  DEBUS5-ARIN\\nOrgTechHandle:  TIER3-ARIN\\nSource:         ARIN\\n\n\nPOCHandle:      NOCAB25-ARIN\\nIsRole:         Y\\nLastName:       NOC Abuse \\nFirstName:      \\nStreet:         429 S Main St\\nCity:           Logan\\nState/Prov:     UT\\nCountry:        US\\nPostalCode:     84321\\nRegDate:        2022-05-31\\nUpdated:        2022-05-31\\nOfficePhone:    +1-435-774-2337\\nMailbox:        support@smartaira.com\\nSource:         ARIN\\n\n\nPOCHandle:      DEBUS5-ARIN\\nIsRole:         N\\nLastName:       DeBusk\\nFirstName:      Donanav\\nStreet:         620 w 135th ST\\nCity:           Gardena\\nState/Prov:     CA\\nCountry:        US\\nPostalCode:     90248\\nRegDate:        2018-10-17\\nUpdated:        2022-05-31\\nOfficePhone:    +1-310-200-6243\\nMailbox:        ddebusk@smartaira.com\\nSource:         ARIN\\n\n\nPOCHandle:      TIER3-ARIN\\nIsRole:         Y\\nLastName:       Tier3 Support\\nFirstName:      \\nStreet:         620 West 135th Street\\nCity:           Gardena\\nState/Prov:     CA\\nCountry:        US\\nPostalCode:     90248\\nRegDate:        2007-05-23\\nUpdated:        2022-05-31\\nOfficePhone:    +1-435-774-2337\\nMailbox:        tier3@smartaira.com\\nSource:         ARIN\\n\n\nPOCHandle:      NOC33474-ARIN\\nIsRole:         Y\\nLastName:       NOC\\nFirstName:      \\nStreet:         429 S Main St\\nCity:           Logan\\nState/Prov:     UT\\nCountry:        US\\nPostalCode:     84321\\nRegDate:        2022-05-31\\nUpdated:        2022-05-31\\nOfficePhone:    +1-435-744-2337\\nMailbox:        Noc@smartaira.com\\nSource:         ARIN\\n"}, {"range": "8.225.186.0/23", "id": "LVLT-SUNES-8-225-186", "name": "Sunesys, LLC", "country": "US", "domain": "sunesys.com", "org_id": "SUNES", "status": "REALLOCATION", "tech_id": "HINST-ARIN\\NMDB65-ARIN\\NPJK10-ARIN\\NWILSO336-ARIN", "mnt_id": "IPADM833-ARIN\\NWILSO336-ARIN", "admin_id": "IPENG33-ARIN", "abuse_id": "ABUSE4944-ARIN", "created": "2010-06-02", "updated": "2018-04-23", "source": "arin", "raw": "NetHandle:      NET-8-225-186-0-1\\nOrgID:          SUNES\\nParent:         NET-8-224-0-0-2\\nNetName:        LVLT-SUNES-8-225-186\\nNetRange:       8.225.186.0 - 8.225.187.255\\nNetType:        reallocation\\nRegDate:        2010-06-02\\nUpdated:        2018-04-23\\nSource:         ARIN\\n\n\nOrgID:          SUNES\\nOrgName:        Sunesys, LLC\\nCanAllocate:    \\nStreet:         8020 Katy Freeway\\nCity:           Houston\\nState/Prov:     TX\\nCountry:        US\\nPostalCode:     77024\\nRegDate:        2008-09-05\\nUpdated:        2022-03-01\\nOrgAbuseHandle: ABUSE4944-ARIN\\nOrgAbuseHandle: WILSO336-ARIN\\nOrgAdminHandle: IPENG33-ARIN\\nOrgNOCHandle:   IPADM833-ARIN\\nOrgNOCHandle:   WILSO336-ARIN\\nOrgTechHandle:  HINST-ARIN\\nOrgTechHandle:  MDB65-ARIN\\nOrgTechHandle:  PJK10-ARIN\\nOrgTechHandle:  WILSO336-ARIN\\nSource:         ARIN\\n\n\nPOCHandle:      ABUSE4944-ARIN\\nIsRole:         Y\\nLastName:       Abuse\\nFirstName:      \\nStreet:         8020 Katy Freeway\\nCity:           Houston\\nState/Prov:     TX\\nCountry:        US\\nPostalCode:     77024\\nRegDate:        2014-12-18\\nUpdated:        2022-01-13\\nOfficePhone:    +1-978-264-6000\\nMailbox:        abuse@lightower.com\\nSource:         ARIN\\n\n\nPOCHandle:      PJK10-ARIN\\nIsRole:         N\\nLastName:       Kalogerakos\\nFirstName:      Peter\\nStreet:         80 Central St.\\nCity:           Boxborough\\nState/Prov:     MA\\nCountry:        US\\nPostalCode:     01719\\nRegDate:        2013-08-26\\nUpdated:        2021-04-16\\nMobilePhone:    +1-978-264-6066\\nOfficePhone:    +1-978-264-6066\\nMailbox:        PETERK@LIGHTOWER.COM\\nSource:         ARIN\\n\n\nPOCHandle:      WILSO336-ARIN\\nIsRole:         N\\nLastName:       Wilson\\nFirstName:      Ronald\\nStreet:         185 Titus Avenue\\nCity:           Warrington\\nState/Prov:     PA\\nCountry:        US\\nPostalCode:     18976\\nRegDate:        2014-02-07\\nUpdated:        2020-09-16\\nOfficePhone:    +1-267-927-2142\\nMailbox:        rwilson@sunesys.com\\nMailbox:        ronald.wilson@crowncastle.com\\nSource:         ARIN\\n\n\nPOCHandle:      IPENG33-ARIN\\nIsRole:         Y\\nLastName:       IP Engineering\\nFirstName:      \\nStreet:         8020 Katy Freeway\\nCity:           Houston\\nState/Prov:     TX\\nCountry:        US\\nPostalCode:     77024\\nRegDate:        2014-12-18\\nUpdated:        2022-01-06\\nOfficePhone:    +1-855-933-4237\\nMailbox:        ipadmin@lightower.com\\nSource:         ARIN\\n\n\nPOCHandle:      MDB65-ARIN\\nIsRole:         N\\nLastName:       Beveridge\\nFirstName:      Matthew\\nStreet:         8020 Katy Freeway\\nCity:           Houston\\nState/Prov:     TX\\nCountry:        US\\nPostalCode:     77024\\nRegDate:        2013-05-01\\nUpdated:        2022-04-25\\nOfficePhone:    +1-978-264-6849\\nMailbox:        mbeveridge@lightower.com\\nSource:         ARIN\\n\n\nPOCHandle:      IPADM833-ARIN\\nIsRole:         Y\\nLastName:       IP Administrator\\nFirstName:      \\nStreet:         8020 Katy Freeway\\nCity:           Houston\\nState/Prov:     TX\\nCountry:        US\\nPostalCode:     77024\\nRegDate:        2019-01-07\\nUpdated:        2022-01-06\\nOfficePhone:    +1-855-913-4237\\nMailbox:        ipadmin@crowncastle.com\\nSource:         ARIN\\n\n\nPOCHandle:      HINST-ARIN\\nIsRole:         N\\nLastName:       Hinst\\nFirstName:      Rob\\nStreet:         201 Old Country Road\\nStreet:         Suite 125\\nCity:           Melville\\nState/Prov:     NY\\nCountry:        US\\nPostalCode:     11747\\nRegDate:        2013-09-12\\nUpdated:        2021-04-28\\nMobilePhone:    +1-631-338-1061\\nOfficePhone:    +1-631-300-3795\\nMailbox:        robert.hinst@crowncastle.com\\nSource:         ARIN\\n"}, {"range": "192.139.209.0/24", "id": "GTAINTERNET1", "name": "Shared Services Canada", "country": "CA", "domain": "ssc-spc.gc.ca", "org_id": "SSC-299", "status": "ALLOCATION", "tech_id": "HOSTM227-ARIN", "mnt_id": "GEEMI-ARIN\\NSAUND92-ARIN", "admin_id": "HOSTM227-ARIN", "abuse_id": "GEEMI-ARIN", "created": "1992-08-10", "updated": "2021-12-14", "source": "arin", "raw": "NetHandle:      NET-192-139-209-0-1\\nOrgID:          SSC-299\\nParent:         NET-192-0-0-0-0\\nNetName:        GTAINTERNET1\\nNetRange:       192.139.209.0 - 192.139.209.255\\nNetType:        allocation\\nRegDate:        1992-08-10\\nUpdated:        2021-12-14\\nSource:         ARIN\\n\n\nOrgID:          SSC-299\\nOrgName:        Shared Services Canada\\nCanAllocate:    \\nStreet:         434 Queen Street\\nStreet:         PO Box 9808 STN T CSC\\nCity:           Ottawa\\nState/Prov:     ON\\nCountry:        CA\\nPostalCode:     K1G 4A8\\nRegDate:        2013-11-19\\nUpdated:        2017-01-28\\nOrgAbuseHandle: GEEMI-ARIN\\nOrgAbuseHandle: HOSTM227-ARIN\\nOrgAbuseHandle: SAUND92-ARIN\\nOrgAdminHandle: HOSTM227-ARIN\\nOrgNOCHandle:   GEEMI-ARIN\\nOrgNOCHandle:   SAUND92-ARIN\\nOrgTechHandle:  HOSTM227-ARIN\\nSource:         ARIN\\n\n\nPOCHandle:      HOSTM227-ARIN\\nIsRole:         Y\\nLastName:       Hostmaster\\nFirstName:      \\nStreet:         350 King Edward Avenue\\nCity:           Ottawa\\nState/Prov:     ON\\nCountry:        CA\\nPostalCode:     K1A 0X5\\nRegDate:        2003-04-24\\nUpdated:        2022-07-07\\nOfficePhone:    +1-613-218-1124\\nOfficePhone:    +1-819-697-8032\\nOfficePhone:    +1-613-301-0722\\nMailbox:        michelle.saunders@ssc-spc.gc.ca\\nMailbox:        Geoffrey.Worthing@ssc-spc.gc.ca\\nMailbox:        michel.gee@ssc-spc.gc.ca\\nSource:         ARIN\\n\n\nPOCHandle:      GEEMI-ARIN\\nIsRole:         N\\nLastName:       Gee\\nFirstName:      Michel\\nStreet:         Place du Portage\\nStreet:         PDP3/1B1-36\\nCity:           Gatineau\\nState/Prov:     QC\\nCountry:        CA\\nPostalCode:     K1A 0S5\\nRegDate:        2017-01-10\\nUpdated:        2022-07-07\\nOfficePhone:    +1-613-218-1124\\nMailbox:        michel.gee@ssc-spc.gc.ca\\nSource:         ARIN\\n\n\nPOCHandle:      SAUND92-ARIN\\nIsRole:         N\\nLastName:       Saunders\\nFirstName:      Michelle\\nStreet:         350 King Edward Avenue\\nCity:           Ottawa\\nState/Prov:     ON\\nCountry:        CA\\nPostalCode:     K1A 0X5\\nRegDate:        2017-01-11\\nUpdated:        2022-07-07\\nOfficePhone:    +1-613-301-0722\\nMailbox:        michelle.saunders@ssc-spc.gc.ca\\nSource:         ARIN\\n"}, {"range": "2607:f3f0:2::/48", "id": "SECUREDRAGONNET1", "name": "Secure Dragon LLC.", "country": "US", "domain": "securedragon.net", "org_id": "SDL-33", "status": "REALLOCATION", "tech_id": "SECUR69-ARIN", "mnt_id": "SECUR69-ARIN", "admin_id": "SECUR69-ARIN", "abuse_id": "SDAD1-ARIN", "created": "2012-06-12", "updated": "2015-10-10", "source": "arin", "raw": "V6NetHandle:    NET6-2607-F3F0-2-1\\nOrgID:          SDL-33\\nParent:         NET6-2607-F3F0-1\\nNetName:        SECUREDRAGONNET1\\nNetRange:       2607:F3F0:2:: - 2607:F3F0:2:FFFF:FFFF:FFFF:FFFF:FFFF\\nNetType:        reallocation\\nRegDate:        2012-06-12\\nUpdated:        2015-10-10\\nSource:         ARIN\\n\n\nOrgID:          SDL-33\\nOrgName:        Secure Dragon LLC.\\nCanAllocate:    \\nStreet:         P.O. BOX 423\\nCity:           Pinellas Park\\nState/Prov:     FL\\nCountry:        US\\nPostalCode:     33780\\nComment:        http://securedragon.net\\nRegDate:        2012-01-17\\nUpdated:        2017-01-28\\nOrgAbuseHandle: SDAD1-ARIN\\nOrgAdminHandle: SECUR69-ARIN\\nOrgNOCHandle:   SECUR69-ARIN\\nOrgTechHandle:  SECUR69-ARIN\\nSource:         ARIN\\n\n\nPOCHandle:      SDAD1-ARIN\\nIsRole:         Y\\nLastName:       Secure Dragon Abuse Department\\nFirstName:      \\nStreet:         P.O. BOX 423\\nCity:           Pinellas Park\\nState/Prov:     FL\\nCountry:        US\\nPostalCode:     33780\\nRegDate:        2012-03-30\\nUpdated:        2022-06-07\\nOfficePhone:    +1-888-209-7855\\nMailbox:        abuse@securedragon.net\\nSource:         ARIN\\n\n\nPOCHandle:      SECUR69-ARIN\\nIsRole:         Y\\nLastName:       Secure Dragon\\nFirstName:      \\nStreet:         P.O. BOX 423\\nCity:           Pinellas Park\\nState/Prov:     FL\\nCountry:        US\\nPostalCode:     33780\\nRegDate:        2012-01-15\\nUpdated:        2022-06-10\\nOfficePhone:    +1-888-209-7855\\nMailbox:        contact@securedragon.net\\nSource:         ARIN\\n"}, {"range": "192.111.156.0/22", "id": "ITMNETWORKS-192-111-156-0", "name": "ITMNETWORKS LTDA", "country": "BR", "domain": "itmnetworks.com.br", "org_id": "IL-85", "status": "REALLOCATION", "tech_id": "ARAUJ13-ARIN", "mnt_id": "ARAUJ13-ARIN", "admin_id": "ARAUJ13-ARIN", "abuse_id": "IAT19-ARIN", "created": "2013-03-21", "updated": "2013-03-21", "source": "arin", "raw": "NetHandle:      NET-192-111-156-0-1\\nOrgID:          IL-85\\nParent:         NET-192-111-144-0-1\\nNetName:        ITMNETWORKS-192-111-156-0\\nNetRange:       192.111.156.0 - 192.111.159.255\\nNetType:        reallocation\\nOriginAS:       31863\\nRegDate:        2013-03-21\\nUpdated:        2013-03-21\\nSource:         ARIN\\n\n\nOrgID:          IL-85\\nOrgName:        ITMNETWORKS LTDA\\nCanAllocate:    \\nStreet:         Av. Pres. Wilson, 1473 CJ 101\\nCity:           Sao Vicente\\nState/Prov:     SP\\nCountry:        BR\\nPostalCode:     11320-001\\nComment:        https://www.itmnetworks.com.br\\nComment:        Standard NOC hours are 9am to 6pm UTC-03:00\\nRegDate:        2013-02-06\\nUpdated:        2021-02-25\\nOrgAbuseHandle: IAT19-ARIN\\nOrgAdminHandle: ARAUJ13-ARIN\\nOrgDNSHandle:   ARAUJ13-ARIN\\nOrgNOCHandle:   ARAUJ13-ARIN\\nOrgRoutingHandle:   ARAUJ13-ARIN\\nOrgTechHandle:  ARAUJ13-ARIN\\nSource:         ARIN\\n\n\nPOCHandle:      IAT19-ARIN\\nIsRole:         Y\\nLastName:       ITMNETWORKS - Abuse Team\\nFirstName:      \\nStreet:         23269 State RD 7 STE 119\\nCity:           Boca Raton\\nState/Prov:     FL\\nCountry:        US\\nPostalCode:     33428\\nRegDate:        2019-11-14\\nUpdated:        2022-08-01\\nOfficePhone:    +1-828-394-9160\\nMailbox:        abuse@itmnetworks.net\\nSource:         ARIN\\n\n\nPOCHandle:      ARAUJ13-ARIN\\nIsRole:         N\\nLastName:       Araujo\\nFirstName:      Rodrigo\\nStreet:         23269 State RD 7 STE 119\\nCity:           Boca Raton\\nState/Prov:     FL\\nCountry:        US\\nPostalCode:     33428\\nRegDate:        2019-11-14\\nUpdated:        2022-02-25\\nOfficePhone:    +1-828-394-9160\\nMailbox:        noc@itmnetworks.com\\nSource:         ARIN\\n"}, {"range": "208.93.212.0/22", "id": "AIPSO-RI", "name": "AIPSO", "country": "US", "domain": "aipso.com", "org_id": "AIPSO", "status": "ALLOCATION", "tech_id": "DOMAI455-ARIN", "mnt_id": "DOMAI455-ARIN", "admin_id": "DOMAI455-ARIN", "abuse_id": "DOMAI455-ARIN", "created": "2008-08-08", "updated": "2022-03-31", "source": "arin", "raw": "NetHandle:      NET-208-93-212-0-1\\nOrgID:          AIPSO\\nParent:         NET-208-0-0-0-0\\nNetName:        AIPSO-RI\\nNetRange:       208.93.212.0 - 208.93.215.255\\nNetType:        allocation\\nOriginAS:       22821\\nRegDate:        2008-08-08\\nUpdated:        2022-03-31\\nSource:         ARIN\\n\n\nOrgID:          AIPSO\\nOrgName:        AIPSO\\nCanAllocate:    \\nStreet:         302 Central Ave\\nCity:           Johnston\\nState/Prov:     RI\\nCountry:        US\\nPostalCode:     02919\\nRegDate:        2001-11-28\\nUpdated:        2021-10-27\\nOrgAbuseHandle: DOMAI455-ARIN\\nOrgAdminHandle: DOMAI455-ARIN\\nOrgDNSHandle:   DOMAI455-ARIN\\nOrgNOCHandle:   DOMAI455-ARIN\\nOrgRoutingHandle:   DOMAI455-ARIN\\nOrgTechHandle:  DOMAI455-ARIN\\nSource:         ARIN\\n\n\nPOCHandle:      DOMAI455-ARIN\\nIsRole:         Y\\nLastName:       DomainReg\\nFirstName:      \\nStreet:         302 Central Ave\\nCity:           Johnston\\nState/Prov:     RI\\nCountry:        US\\nPostalCode:     02919\\nRegDate:        2021-01-29\\nUpdated:        2022-01-31\\nOfficePhone:    +1-401-946-2310\\nMailbox:        domainreg@aipso.com\\nSource:         ARIN\\n"}, {"range": "206.168.216.0-206.168.220.255", "id": "RKCI", "name": "Massive Networks", "country": "US", "domain": "massivenetworks.com", "org_id": "RKCI", "status": "ALLOCATION", "tech_id": "LEWIN9-ARIN", "mnt_id": "PM1080-ARIN", "admin_id": "PM1893-ARIN", "abuse_id": "ABUSE7475-ARIN", "created": "2022-03-24", "updated": "2022-03-24", "source": "arin", "raw": "NetHandle:      NET-206-168-216-0-2\\nOrgID:          RKCI\\nParent:         NET-206-0-0-0-0\\nNetName:        RKCI\\nNetRange:       206.168.216.0 - 206.168.220.255\\nNetType:        allocation\\nRegDate:        2022-03-24\\nUpdated:        2022-03-24\\nSource:         ARIN\\n\n\nOrgID:          RKCI\\nOrgName:        Massive Networks\\nCanAllocate:    \\nStreet:         382 S. Arthur Ave\\nStreet:         Ste 120\\nCity:           Louisville\\nState/Prov:     CO\\nCountry:        US\\nPostalCode:     80027\\nRegDate:        1996-08-08\\nUpdated:        2019-04-17\\nOrgAbuseHandle: ABUSE7475-ARIN\\nOrgAdminHandle: PM1893-ARIN\\nOrgNOCHandle:   PM1080-ARIN\\nOrgTechHandle:  LEWIN9-ARIN\\nSource:         ARIN\\n\n\nPOCHandle:      LEWIN9-ARIN\\nIsRole:         N\\nLastName:       Lewinski\\nFirstName:      Mike\\nStreet:         382 S. Arthur Ave\\nStreet:         Suite 120\\nCity:           Louisville\\nState/Prov:     CO\\nCountry:        US\\nPostalCode:     80027\\nRegDate:        2016-02-16\\nUpdated:        2022-02-18\\nOfficePhone:    +1-303-629-2860\\nMailbox:        mlewinski@massivenetworks.com\\nSource:         ARIN\\n\n\nPOCHandle:      PM1893-ARIN\\nIsRole:         N\\nLastName:       mako\\nFirstName:      paul\\nStreet:         382 S. Arthur Ave\\nCity:           Louisville\\nState/Prov:     CO\\nCountry:        US\\nPostalCode:     80027\\nRegDate:        1996-11-20\\nUpdated:        2021-09-16\\nOfficePhone:    +1-303-629-2850\\nMailbox:        pmako@massivenetworks.com\\nSource:         ARIN\\n\n\nPOCHandle:      PM1080-ARIN\\nIsRole:         N\\nLastName:       Mako\\nFirstName:      Paul\\nStreet:         382 S. Arthur Ave #120\\nCity:           Louisville\\nState/Prov:     CO\\nCountry:        US\\nPostalCode:     80027\\nRegDate:        1996-04-29\\nUpdated:        2022-04-17\\nOfficePhone:    +1-303-800-1300\\nMailbox:        support@massivenetworks.com\\nSource:         ARIN\\n\n\nPOCHandle:      ABUSE7475-ARIN\\nIsRole:         Y\\nLastName:       Abuse Department\\nFirstName:      \\nStreet:         382 S. Arthur Ave\\nStreet:         Suite 120\\nCity:           Louisville\\nState/Prov:     CO\\nCountry:        US\\nPostalCode:     80027\\nRegDate:        2019-04-17\\nUpdated:        2022-04-17\\nOfficePhone:    +1-303-800-1300\\nMailbox:        abuse@massivenetworks.com\\nSource:         ARIN\\n"}, {"range": "24.144.201.0/24", "id": "ACS-MEADVILLEPA", "name": "Armstrong", "country": "US", "domain": "armstrongonewire.com", "org_id": "ARMC", "status": "REASSIGNMENT", "tech_id": "NOC11973-ARIN", "mnt_id": "NOC11973-ARIN", "admin_id": "NOC11973-ARIN", "abuse_id": "NOC11974-ARIN", "created": "2013-06-04", "updated": "2013-06-04", "source": "arin", "raw": "NetHandle:      NET-24-144-201-0-1\\nOrgID:          ARMC\\nParent:         NET-24-144-128-0-1\\nNetName:        ACS-MEADVILLEPA\\nNetRange:       24.144.201.0 - 24.144.201.255\\nNetType:        reassignment\\nOriginAS:       27364\\nRegDate:        2013-06-04\\nUpdated:        2013-06-04\\nSource:         ARIN\\n\n\nOrgID:          ARMC\\nOrgName:        Armstrong\\nCanAllocate:    \\nStreet:         ONE Armstrong Place\\nCity:           Butler\\nState/Prov:     PA\\nCountry:        US\\nPostalCode:     16001\\nRegDate:        1997-08-28\\nUpdated:        2022-04-18\\nOrgAbuseHandle: NOC11974-ARIN\\nOrgAdminHandle: NOC11973-ARIN\\nOrgNOCHandle:   NOC11973-ARIN\\nOrgTechHandle:  NOC11973-ARIN\\nSource:         ARIN\\n\n\nPOCHandle:      NOC11974-ARIN\\nIsRole:         Y\\nLastName:       Network Operations Center\\nFirstName:      \\nStreet:         One Armstrong Place\\nCity:           Butler\\nState/Prov:     PA\\nCountry:        US\\nPostalCode:     16001\\nRegDate:        2011-04-28\\nUpdated:        2022-04-20\\nFaxPhone:       +1-724-282-5624\\nOfficePhone:    +1-877-277-5709\\nMailbox:        abuse@zoominternet.net\\nSource:         ARIN\\n\n\nPOCHandle:      NOC11973-ARIN\\nIsRole:         Y\\nLastName:       Network Operations Center\\nFirstName:      \\nStreet:         One Armstrong Place\\nCity:           Butler\\nState/Prov:     PA\\nCountry:        US\\nPostalCode:     16001\\nRegDate:        2011-04-28\\nUpdated:        2022-04-20\\nOfficePhone:    +1-877-277-5709\\nFaxPhone:       +1-724-282-5624\\nMailbox:        noc@zoominternet.net\\nSource:         ARIN\\n"}, {"range": "206.108.180.248/29", "id": "NET-ACCEL-CLIENTS180-248", "name": "Accelerated Connections Inc.", "country": "CA", "domain": "connections.ca", "org_id": "ACLT", "status": "REASSIGNMENT", "tech_id": "DBL7-ARIN", "mnt_id": "NOC2114-ARIN", "admin_id": "AS3251-ARIN", "abuse_id": "GAD46-ARIN", "created": "2006-04-04", "updated": "2006-04-04", "source": "arin", "raw": "NetHandle:      NET-206-108-180-248-1\\nOrgID:          ACLT\\nParent:         NET-206-108-128-0-1\\nNetName:        NET-ACCEL-CLIENTS180-248\\nNetRange:       206.108.180.248 - 206.108.180.255\\nNetType:        reassignment\\nRegDate:        2006-04-04\\nUpdated:        2006-04-04\\nTechHandle:     DBL7-ARIN\\nSource:         ARIN\\n\n\nOrgID:          ACLT\\nOrgName:        Accelerated Connections Inc.\\nCanAllocate:    \\nStreet:         3740 - 155 Wellington St. W.\\nCity:           Toronto\\nState/Prov:     ON\\nCountry:        CA\\nPostalCode:     M5V 3H1\\nComment:        http://www.connections.ca\\nRegDate:        2000-12-19\\nUpdated:        2019-07-03\\nOrgAbuseHandle: GAD46-ARIN\\nOrgAdminHandle: AS3251-ARIN\\nOrgNOCHandle:   NOC2114-ARIN\\nOrgTechHandle:  AS3251-ARIN\\nOrgTechHandle:  NOC2114-ARIN\\nSource:         ARIN\\n\n\nPOCHandle:      AS3251-ARIN\\nIsRole:         Y\\nLastName:       AS3257 Netguard\\nFirstName:      \\nStreet:         Hugenottenallee 167\\nCity:           Neu-Isenburg\\nState/Prov:     \\nCountry:        DE\\nPostalCode:     63263\\nRegDate:        2009-07-03\\nUpdated:        2022-06-07\\nOfficePhone:    +49 6102 8235 381\\nFaxPhone:       +49 6102 8235 389\\nMailbox:        netguard@gtt.net\\nSource:         ARIN\\n\n\nPOCHandle:      DBL7-ARIN\\nIsRole:         N\\nLastName:       Blackwood\\nFirstName:      Dean\\nStreet:         3740 - 155 Wellington St W\\nCity:           Toronto\\nState/Prov:     ON\\nCountry:        CA\\nPostalCode:     M5V 3H1\\nRegDate:        2003-04-17\\nUpdated:        2019-07-03\\nOfficePhone:    +1-416-637-3433\\nMailbox:        support@dsl4u.ca\\nSource:         ARIN\\n\n\nPOCHandle:      GAD46-ARIN\\nIsRole:         Y\\nLastName:       GTT Abuse Department\\nFirstName:      \\nStreet:         7900 Tysons One Place\\nStreet:         Suite 1450\\nCity:           McLean\\nState/Prov:     VA\\nCountry:        US\\nPostalCode:     22102\\nRegDate:        2014-04-16\\nUpdated:        2022-01-19\\nFaxPhone:       +1-703-442-5501\\nOfficePhone:    +1-703-442-5500\\nMailbox:        abuse@gtt.net\\nSource:         ARIN\\n\n\nPOCHandle:      NOC2114-ARIN\\nIsRole:         Y\\nLastName:       Network Operations Center\\nFirstName:      \\nStreet:         155 Wellington St West, Suite 3740\\nCity:           Toronto\\nState/Prov:     ON\\nCountry:        CA\\nPostalCode:     M5V 3H1\\nRegDate:        2006-05-01\\nUpdated:        2019-07-03\\nOfficePhone:    +1-416-637-3433\\nMailbox:        net.eng@connections.ca\\nSource:         ARIN\\n"}, {"range": "8.225.203.0/24", "id": "NET-SUNESYS", "name": "Sunesys, LLC", "country": "US", "domain": "sunesys.com", "org_id": "SUNES", "status": "REALLOCATION", "tech_id": "ABA136-ARIN", "mnt_id": "IPADM833-ARIN\\NWILSO336-ARIN", "admin_id": "IPENG33-ARIN", "abuse_id": "ABUSE4944-ARIN", "created": "2012-07-11", "updated": "2021-09-28", "source": "arin", "raw": "NetHandle:      NET-8-225-203-0-1\\nOrgID:          SUNES\\nParent:         NET-8-224-0-0-2\\nNetName:        NET-SUNESYS\\nNetRange:       8.225.203.0 - 8.225.203.255\\nNetType:        reallocation\\nRegDate:        2012-07-11\\nUpdated:        2021-09-28\\nAbuseHandle:    ABA136-ARIN\\nNOCHandle:      ABA136-ARIN\\nTechHandle:     ABA136-ARIN\\nSource:         ARIN\\n\n\nOrgID:          SUNES\\nOrgName:        Sunesys, LLC\\nCanAllocate:    \\nStreet:         8020 Katy Freeway\\nCity:           Houston\\nState/Prov:     TX\\nCountry:        US\\nPostalCode:     77024\\nRegDate:        2008-09-05\\nUpdated:        2022-03-01\\nOrgAbuseHandle: ABUSE4944-ARIN\\nOrgAbuseHandle: WILSO336-ARIN\\nOrgAdminHandle: IPENG33-ARIN\\nOrgNOCHandle:   IPADM833-ARIN\\nOrgNOCHandle:   WILSO336-ARIN\\nOrgTechHandle:  HINST-ARIN\\nOrgTechHandle:  MDB65-ARIN\\nOrgTechHandle:  PJK10-ARIN\\nOrgTechHandle:  WILSO336-ARIN\\nSource:         ARIN\\n\n\nPOCHandle:      PJK10-ARIN\\nIsRole:         N\\nLastName:       Kalogerakos\\nFirstName:      Peter\\nStreet:         80 Central St.\\nCity:           Boxborough\\nState/Prov:     MA\\nCountry:        US\\nPostalCode:     01719\\nRegDate:        2013-08-26\\nUpdated:        2021-04-16\\nMobilePhone:    +1-978-264-6066\\nOfficePhone:    +1-978-264-6066\\nMailbox:        PETERK@LIGHTOWER.COM\\nSource:         ARIN\\n\n\nPOCHandle:      IPADM833-ARIN\\nIsRole:         Y\\nLastName:       IP Administrator\\nFirstName:      \\nStreet:         8020 Katy Freeway\\nCity:           Houston\\nState/Prov:     TX\\nCountry:        US\\nPostalCode:     77024\\nRegDate:        2019-01-07\\nUpdated:        2022-01-06\\nOfficePhone:    +1-855-913-4237\\nMailbox:        ipadmin@crowncastle.com\\nSource:         ARIN\\n\n\nPOCHandle:      ABA136-ARIN\\nIsRole:         N\\nLastName:       Balkaya\\nFirstName:      Aykut\\nStreet:         185 Titus Ave\\nCity:           Warrington\\nState/Prov:     PA\\nCountry:        US\\nPostalCode:     18976\\nRegDate:        2008-09-04\\nUpdated:        2017-12-02\\nFaxPhone:       +1-267-927-2099\\nOfficePhone:    +1-267-927-2000\\nMailbox:        noc@sunesys.com\\nSource:         ARIN\\n\n\nPOCHandle:      ABUSE4944-ARIN\\nIsRole:         Y\\nLastName:       Abuse\\nFirstName:      \\nStreet:         8020 Katy Freeway\\nCity:           Houston\\nState/Prov:     TX\\nCountry:        US\\nPostalCode:     77024\\nRegDate:        2014-12-18\\nUpdated:        2022-01-13\\nOfficePhone:    +1-978-264-6000\\nMailbox:        abuse@lightower.com\\nSource:         ARIN\\n\n\nPOCHandle:      IPENG33-ARIN\\nIsRole:         Y\\nLastName:       IP Engineering\\nFirstName:      \\nStreet:         8020 Katy Freeway\\nCity:           Houston\\nState/Prov:     TX\\nCountry:        US\\nPostalCode:     77024\\nRegDate:        2014-12-18\\nUpdated:        2022-01-06\\nOfficePhone:    +1-855-933-4237\\nMailbox:        ipadmin@lightower.com\\nSource:         ARIN\\n\n\nPOCHandle:      HINST-ARIN\\nIsRole:         N\\nLastName:       Hinst\\nFirstName:      Rob\\nStreet:         201 Old Country Road\\nStreet:         Suite 125\\nCity:           Melville\\nState/Prov:     NY\\nCountry:        US\\nPostalCode:     11747\\nRegDate:        2013-09-12\\nUpdated:        2021-04-28\\nMobilePhone:    +1-631-338-1061\\nOfficePhone:    +1-631-300-3795\\nMailbox:        robert.hinst@crowncastle.com\\nSource:         ARIN\\n\n\nPOCHandle:      MDB65-ARIN\\nIsRole:         N\\nLastName:       Beveridge\\nFirstName:      Matthew\\nStreet:         8020 Katy Freeway\\nCity:           Houston\\nState/Prov:     TX\\nCountry:        US\\nPostalCode:     77024\\nRegDate:        2013-05-01\\nUpdated:        2022-04-25\\nOfficePhone:    +1-978-264-6849\\nMailbox:        mbeveridge@lightower.com\\nSource:         ARIN\\n\n\nPOCHandle:      WILSO336-ARIN\\nIsRole:         N\\nLastName:       Wilson\\nFirstName:      Ronald\\nStreet:         185 Titus Avenue\\nCity:           Warrington\\nState/Prov:     PA\\nCountry:        US\\nPostalCode:     18976\\nRegDate:        2014-02-07\\nUpdated:        2020-09-16\\nOfficePhone:    +1-267-927-2142\\nMailbox:        rwilson@sunesys.com\\nMailbox:        ronald.wilson@crowncastle.com\\nSource:         ARIN\\n"}, {"range": "204.147.16.0/20", "id": "OXNARDSD-NET", "name": "OXNARD SCHOOL DISTRICT", "country": "US", "domain": "oxnardsd.org", "org_id": "OSD-2", "status": "ALLOCATION", "tech_id": "OSDAR-ARIN", "mnt_id": "OSDAR-ARIN", "admin_id": "OSDAR-ARIN", "abuse_id": "OSDAR-ARIN", "created": "1994-11-18", "updated": "2021-12-14", "source": "arin", "raw": "NetHandle:      NET-204-147-16-0-1\\nOrgID:          OSD-2\\nParent:         NET-204-0-0-0-0\\nNetName:        OXNARDSD-NET\\nNetRange:       204.147.16.0 - 204.147.31.255\\nNetType:        allocation\\nOriginAS:       396979\\nRegDate:        1994-11-18\\nUpdated:        2021-12-14\\nAbuseHandle:    OSDAR-ARIN\\nNOCHandle:      OSDAR-ARIN\\nTechHandle:     OSDAR-ARIN\\nSource:         ARIN\\n\n\nOrgID:          OSD-2\\nOrgName:        OXNARD SCHOOL DISTRICT\\nCanAllocate:    \\nStreet:         1041 South A St\\nCity:           Oxnard\\nState/Prov:     CA\\nCountry:        US\\nPostalCode:     93030\\nRegDate:        1994-11-18\\nUpdated:        2018-09-05\\nOrgAbuseHandle: OSDAR-ARIN\\nOrgAdminHandle: OSDAR-ARIN\\nOrgTechHandle:  OSDAR-ARIN\\nSource:         ARIN\\n\n\nPOCHandle:      OSDAR-ARIN\\nIsRole:         Y\\nLastName:       OSD-Arin\\nFirstName:      \\nStreet:         1051 South A st.\\nCity:           Oxnard\\nState/Prov:     CA\\nCountry:        US\\nPostalCode:     93030\\nRegDate:        2018-02-26\\nUpdated:        2022-02-25\\nOfficePhone:    +1-805-385-1501\\nMailbox:        arinAdmin@oxnardsd.org\\nSource:         ARIN\\n"}]