{"range": "218.211.34.32/28", "id": "LIBERTYTIMES-TW", "name": "New Century InfoComm Tech. Co., Ltd.", "country": "TW", "domain": "seed.net.tw", "org_id": "", "status": "ASSIGNED NON-PORTABLE", "tech_id": "WX136-TW", "mnt_id": "MAINT-TW-TWNIC", "admin_id": "WX136-TW", "abuse_id": "", "created": "", "updated": "2007-02-14", "source": "twnic", "raw": "inetnum:        218.211.34.32 - 218.211.34.47\\nnetname:        LibertyTimes-TW\\ndescr:          New Century InfoComm Tech. Co., Ltd.\\ndescr:          1F~11F, No. 218, Rueiguang Road\\ndescr:          Taipei Taiwan\\ncountry:        TW\\nadmin-c:        WX136-TW\\ntech-c:         WX136-TW\\nmnt-by:         MAINT-TW-TWNIC\\nchanged:        antispam@seed.net.tw 20070214\\nstatus:         ASSIGNED NON-PORTABLE\\nremarks:        This information has been partially mirrored by APNIC from\\nremarks:        TWNIC. To obtain more specific information, please use the\\nremarks:        TWNIC whois server at whois.twnic.net.\\nsource:         TWNIC\\n\\n\\nperson:         Shang Sheng Lee\\naddress:        One hundred twenty-three Life Technology Co., Ltd.\\naddress:        14F., No.399, Ruiguang Rd., Neihu Dist.\\naddress:        Taipei City Taiwan\\ncountry:        TW\\nphone:          +886-2-2656-2828 ext. 1208\\nfax-no:         +886-2-2656-1010\\ne-mail:         brad@libertytimes.com.tw\\nnic-hdl:        WX136-TW\\nchanged:        hostmaster@twnic.net 20141027\\nremarks:        This information has been partially mirrored by APNIC from\\nremarks:        TWNIC. To obtain more specific information, please use the\\nremarks:        TWNIC whois server at whois.twnic.net.\\nsource:         TWNIC\\n"}
{"range": "78.5.0.248/30", "id": "EAHG", "name": "RAICEN S.R.L.", "country": "IT", "domain": "bt.com", "org_id": "ORG-AA37-RIPE", "status": "ASSIGNED PA", "tech_id": "BTI7-RIPE", "mnt_id": "BTI-MNT", "admin_id": "BTI7-RIPE", "abuse_id": "BA5167-RIPE", "created": "2020-09-22", "updated": "2020-09-22", "source": "ripe", "raw": "inetnum:        78.5.0.248 - 78.5.0.251\\nnetname:        EAHG\\ndescr:          RAICEN S.R.L.\\ncountry:        IT\\nadmin-c:        BTI7-RIPE\\ntech-c:         BTI7-RIPE\\nstatus:         ASSIGNED PA\\nremarks:        ------------------SG-----------------\\nmnt-by:         BTI-MNT\\ncreated:        2020-09-22T17:15:20Z\\nlast-modified:  2020-09-22T17:15:20Z\\nsource:         RIPE\\nabuse-email:    abuse.italy.g@bt.com\\nabuse-c:        BA5167-RIPE\\nabuse-org:      ORG-AA37-RIPE\\n\\nrole:           BTI Staff\\naddress:        BT Italia S.p.A. (formerly Albacom S.p.A)\\naddress:        Via M. Bianchini, 15 - 00142 Roma (IT)\\nphone:          +39 068741.1111\\nadmin-c:        PP20508-RIPE\\nadmin-c:        VC6697-RIPE\\nadmin-c:        DR11096-RIPE\\ne-mail:         ipstaff.italy@bt.com\\nremarks:        -------------------------------------------------------\\nremarks:        For any network or spamming abuse issue please contact:\\nabuse-mailbox:  abuse.italy.g@bt.com\\nremarks:        --------------------\\nremarks:        For any network or peering issues please contact:\\nremarks:        ipstaff.italy@bt.com\\nremarks:        -------------------------------------------------------\\ntech-c:         FR3852-RIPE\\ntech-c:         PP20508-RIPE\\ntech-c:         DR11096-RIPE\\nnic-hdl:        BTI7-RIPE\\nmnt-by:         BTI-MNT\\ncreated:        2006-12-13T15:33:27Z\\nlast-modified:  2024-12-04T12:32:19Z\\nsource:         RIPE\\n\\nroute:          78.5.0.0/16\\ndescr:          BT Italia (formerly Albacom)\\norigin:         AS8968\\nmnt-by:         ALBACOM-MNT\\ncreated:        2007-02-21T13:22:46Z\\nlast-modified:  2007-02-21T13:22:46Z\\nsource:         RIPE"}
{"range": "198.101.135.188/30", "id": "RACKS-8-1338467294595669", "name": "son information systems", "country": "US", "domain": "", "org_id": "C02983326", "status": "REASSIGNMENT", "tech_id": "", "mnt_id": "", "admin_id": "", "abuse_id": "", "created": "2012-05-31", "updated": "2012-05-31", "source": "arin", "raw": "NetHandle:      NET-198-101-135-188-1\\nOrgID:          C02983326\\nParent:         NET-198-101-128-0-1\\nNetName:        RACKS-8-1338467294595669\\nNetRange:       198.101.135.188 - 198.101.135.191\\nNetType:        reassignment\\nRegDate:        2012-05-31\\nUpdated:        2012-05-31\\nSource:         ARIN\\n\\n\\nOrgID:          C02983326\\nOrgName:        son information systems\\nCanAllocate:    \\nStreet:         9725 Datapoint Dr\\nCity:           San Antonio\\nState/Prov:     TX\\nCountry:        US\\nPostalCode:     78229\\nRegDate:        2012-05-31\\nUpdated:        2012-05-31\\nSource:         ARIN\\n"}
{"range": "78.251.112.0/24", "id": "FR-PROXAD-WIFI", "name": "Proxad / Free SAS", "country": "FR", "domain": "proxad.net", "org_id": "ORG-PISP1-RIPE", "status": "ASSIGNED PA", "tech_id": "TCP8-RIPE", "mnt_id": "PROXAD-MNT", "admin_id": "ACP23-RIPE", "abuse_id": "ACP23-RIPE", "created": "2011-06-09", "updated": "2011-06-09", "source": "ripe", "raw": "inetnum:        78.251.112.0 - 78.251.112.255\\nnetname:        FR-PROXAD-WIFI\\ndescr:          Proxad / Free SAS\\ndescr:          Wifi Address Pool\\ncountry:        FR\\nadmin-c:        ACP23-RIPE\\ntech-c:         TCP8-RIPE\\nstatus:         ASSIGNED PA\\nremarks:        Spam/Abuse requests: mailto:abuse@proxad.net\\nmnt-by:         PROXAD-MNT\\ncreated:        2011-06-09T00:30:37Z\\nlast-modified:  2011-06-09T00:30:37Z\\nsource:         RIPE\\nabuse-email:    abuse@proxad.net\\nabuse-c:        ACP23-RIPE\\nabuse-org:      ORG-PISP1-RIPE\\n\\nrole:           Administrative Contact for ProXad\\naddress:        Free SAS / ProXad\\naddress:        8, rue de la Ville L'Eveque\\naddress:        75008 Paris\\nphone:          +33 1 73 50 20 00\\nfax-no:         +33 1 73 92 25 69\\nremarks:        trouble: Information: http://www.proxad.net/\\nremarks:        trouble: Spam/Abuse requests: mailto:abuse@proxad.net\\nadmin-c:        APfP1-RIPE\\ntech-c:         TPfP1-RIPE\\nnic-hdl:        ACP23-RIPE\\nmnt-by:         PROXAD-MNT\\ne-mail:         ripe-misc@proxad.net\\nabuse-mailbox:  abuse@proxad.net\\ncreated:        2002-06-26T12:46:56Z\\nlast-modified:  2013-08-01T12:16:00Z\\nsource:         RIPE\\n\\nrole:           Technical Contact for ProXad\\naddress:        Free SAS / ProXad\\naddress:        8, rue de la Ville L'Eveque\\naddress:        75008 Paris\\nphone:          +33 1 73 50 20 00\\nfax-no:         +33 1 73 92 25 69\\ne-mail:         ripemaster@proxad.net\\nremarks:        trouble: Information: http://www.proxad.net/\\nremarks:        trouble: Spam/Abuse requests: mailto:abuse@proxad.net\\nadmin-c:        APfP1-RIPE\\ntech-c:         TPfP1-RIPE\\nnic-hdl:        TCP8-RIPE\\nnotify:         ripe-notify@proxad.net\\nmnt-by:         PROXAD-MNT\\ncreated:        2002-06-26T12:29:10Z\\nlast-modified:  2011-06-14T09:03:07Z\\nsource:         RIPE\\nabuse-mailbox:  abuse@proxad.net\\n\\nroute:          78.192.0.0/10\\ndescr:          ProXad network / Free SAS\\ndescr:          Paris, France\\norigin:         AS12322\\nnotify:         ripe-notify@proxad.net\\nmnt-by:         PROXAD-MNT\\ncreated:        2007-03-15T13:39:58Z\\nlast-modified:  2007-03-15T13:39:58Z\\nsource:         RIPE"}
{"range": "213.104.98.160/27", "id": "ASHLEY-JAY-LTD", "name": "ASHLEY JAY LTD", "country": "GB", "domain": "virginmedia.com", "org_id": "ORG-NI9-RIPE", "status": "ASSIGNED PA", "tech_id": "NNMC1-RIPE", "mnt_id": "AS5089-MNT", "admin_id": "NNMC1-RIPE", "abuse_id": "AR17821-RIPE", "created": "2018-12-19", "updated": "2019-03-04", "source": "ripe", "raw": "inetnum:        213.104.98.160 - 213.104.98.191\\nnetname:        ASHLEY-JAY-LTD\\ndescr:          ASHLEY JAY LTD\\ncountry:        GB\\nadmin-c:        NNMC1-RIPE\\ntech-c:         NNMC1-RIPE\\nstatus:         ASSIGNED PA\\nmnt-by:         AS5089-MNT\\nremarks:        VirginMedia Business Customer\\nremarks:        Virgin Media Business Customer UK remarks:Report Abuse via http://www.virginmedia.com/netreport\\nnotify:         ipam@virginmedia.co.uk\\nnotify:         Email Abuse & Blacklist & SPF contact <postmaster@virginmedia.com>\\ncreated:        2018-12-19T16:06:57Z\\nlast-modified:  2019-03-04T19:59:10Z\\nsource:         RIPE\\nabuse-email:    abuse@virginmedia.com\\nabuse-c:        AR17821-RIPE\\nabuse-org:      ORG-NI9-RIPE\\n\\nrole:           Virgin Media Network Management Centre\\norg:            ORG-CIL2-RIPE\\naddress:        Virgin Media\\naddress:        500 Brook Drive Green Park\\naddress:        Reading\\naddress:        Berkshire\\naddress:        RG2 6UU\\nadmin-c:        IPAM2-RIPE\\ntech-c:         IPAM2-RIPE\\nnic-hdl:        NNMC1-RIPE\\nmnt-by:         AS5089-MNT\\ne-mail:         ipam@virginmedia.co.uk\\ne-mail:         hostmaster@virginmedia.net\\ncreated:        2002-09-13T13:38:42Z\\nlast-modified:  2019-12-19T16:18:20Z\\nsource:         RIPE\\n\\nroute:          213.104.0.0/17\\ndescr:          VIRGIN-MEDIA-UK-IP-BLOCK\\nremarks:        Report Abuse via http://www.virginmedia.com/netreport\\nnotify:         Email Abuse & Blacklist & SPF contact <postmaster@virginmedia.com>\\norigin:         AS5089\\nmnt-by:         AS5089-MNT\\ncreated:        2004-09-29T14:28:12Z\\nlast-modified:  2019-03-04T16:44:32Z\\nsource:         RIPE"}
{"range": "68.253.127.16/29", "id": "SBC06825312701629041007033511", "name": "Our Saviors Lutheran Church E L C A-041007033507", "country": "US", "domain": "", "org_id": "C00925205", "status": "REASSIGNMENT", "tech_id": "", "mnt_id": "", "admin_id": "", "abuse_id": "", "created": "2004-10-07", "updated": "2004-10-07", "source": "arin", "raw": "NetHandle:      NET-68-253-127-16-1\\nOrgID:          C00925205\\nParent:         NET-68-248-0-0-1\\nNetName:        SBC06825312701629041007033511\\nNetRange:       68.253.127.16 - 68.253.127.23\\nNetType:        reassignment\\nRegDate:        2004-10-07\\nUpdated:        2004-10-07\\nSource:         ARIN\\n\\n\\nOrgID:          C00925205\\nOrgName:        Our Saviors Lutheran Church E L C A-041007033507\\nCanAllocate:    \\nStreet:         Private Address\\nCity:           Plano\\nState/Prov:     TX\\nCountry:        US\\nPostalCode:     75075\\nRegDate:        2004-10-07\\nUpdated:        2018-07-19\\nSource:         ARIN\\n"}
{"range": "81.173.213.160/29", "id": "FUTURETEC-1", "name": "FUTUREtec GmbH", "country": "DE", "domain": "futuretec-gmbh.de", "org_id": "ORG-NG11-RIPE", "status": "ASSIGNED PA", "tech_id": "NC1424-RIPE", "mnt_id": "NETCOLOGNE-MNT", "admin_id": "WOR4061-RIPE", "abuse_id": "ACN23-RIPE", "created": "2010-02-18", "updated": "2010-02-18", "source": "ripe", "raw": "inetnum:        81.173.213.160 - 81.173.213.167\\nnetname:        FUTURETEC-1\\ndescr:          FUTUREtec GmbH\\ndescr:          Hauptstr. 218-220\\ndescr:          D-51465 Bergisch Gladbach\\ncountry:        DE\\nadmin-c:        WOR4061-RIPE\\ntech-c:         NC1424-RIPE\\nstatus:         ASSIGNED PA\\nmnt-by:         NETCOLOGNE-MNT\\nmnt-lower:      NETCOLOGNE-MNT\\ncreated:        2010-02-18T15:18:08Z\\nlast-modified:  2010-02-18T15:18:08Z\\nsource:         RIPE\\nabuse-email:    abuse@netcologne.de\\nabuse-c:        ACN23-RIPE\\nabuse-org:      ORG-NG11-RIPE\\n\\nrole:           Administrator Contact NetCologne\\naddress:        NetCologne Gesellschaft fuer Telekommunikation mbH\\naddress:        Am Coloneum 9\\naddress:        D-50829 Koeln\\naddress:        Germany\\nphone:          +49 221 2222-0\\nfax-no:         +49-221-2222-620\\nnic-hdl:        NC1424-RIPE\\nadmin-c:        MR111-RIPE\\ntech-c:         GN194-RIPE\\ntech-c:         MA1830-RIPE\\ne-mail:         hostmaster@netcologne.de\\nremarks:        + + + + + + + + + + + + + + + + + + + + + + + + + + + + + + + +\\nremarks:        + abuse@netcologne.de is contact for criminal use, spam, etc. +\\nremarks:        + + + + + + + + + + + + + + + + + + + + + + + + + + + + + + + +\\nnotify:         dns-reg@netcologne.de\\nabuse-mailbox:  abuse@netcologne.de\\nmnt-by:         NETCOLOGNE-MNT\\ncreated:        1970-01-01T00:00:00Z\\nlast-modified:  2021-11-19T13:31:09Z\\nsource:         RIPE\\n\\nperson:         Wolf Rehm\\naddress:        FUTUREtec GmbH\\naddress:        Hauptstr. 218-220\\naddress:        D-51465 Bergisch Gladbach\\naddress:        GERMANY\\nphone:          +49-2202-932165\\ne-mail:         wrehm@futuretec-gmbh.de\\nnic-hdl:        WOR4061-RIPE\\nmnt-by:         NETCOLOGNE-MNT\\ncreated:        2010-02-18T15:18:08Z\\nlast-modified:  2010-02-18T15:18:08Z\\nsource:         RIPE\\n\\nroute:          81.173.128.0/17\\ndescr:          NetCologne PA space\\norigin:         AS8422\\nmnt-by:         NETCOLOGNE-MNT\\ncreated:        2003-02-20T11:05:47Z\\nlast-modified:  2003-02-20T11:05:47Z\\nsource:         RIPE"}
{"range": "2a00:2381:4b14::/56", "id": "BTNET-CUSTOMER", "name": "FTIP006918033 IP MASTER", "country": "GB", "domain": "bt.com", "org_id": "ORG-BT4-RIPE", "status": "ASSIGNED", "tech_id": "BY73-RIPE", "mnt_id": "BTNET-MNT", "admin_id": "BY73-RIPE", "abuse_id": "BTCR3-RIPE", "created": "2022-05-24", "updated": "2022-05-24", "source": "ripe", "raw": "inet6num:       2a00:2381:4b14::/56\\nnetname:        BTNET-CUSTOMER\\ndescr:          FTIP006918033 IP MASTER\\ncountry:        GB\\nadmin-c:        BY73-RIPE\\ntech-c:         BY73-RIPE\\nstatus:         ASSIGNED\\nmnt-by:         BTNET-MNT\\nmnt-lower:      BTNET-MNT\\nmnt-routes:     BTNET-MNT\\nremarks:        Please send abuse notification to abuse@bt.com\\nremarks:        Please send delisting issues to ip.address.management.account@bt.com\\nremarks:        Please send delisting issues to ip.address.management.account@bt.com\\nremarks:        This range is statically assigned\\ncreated:        2022-05-24T11:01:28Z\\nlast-modified:  2022-05-24T11:01:28Z\\nsource:         RIPE\\nabuse-email:    protect@bt.com\\nabuse-c:        BTCR3-RIPE\\nabuse-org:      ORG-BT4-RIPE\\n\\nperson:         IP MASTER TEAM\\naddress:        pp HWG298\\naddress:        Virtual Postbox (HOM-NX)\\naddress:        PO Box 400\\naddress:        London\\naddress:        N18 1XU\\naddress:        UK\\nphone:          +448000850223\\nnic-hdl:        BY73-RIPE\\nmnt-by:         BTNET-MNT\\nremarks:        Please send abuse notification to btnet.abuse@bt.com\\ncreated:        2009-11-09T08:39:01Z\\nlast-modified:  2023-03-07T12:38:29Z\\nsource:         RIPE\\n\\nroute6:         2a00:2380::/25\\ndescr:          BT UK aggregate\\norigin:         AS2856\\nmnt-by:         CIP-MNT\\nmnt-by:         BTNET-MNT\\nmnt-by:         BTENT-MNT\\ncreated:        2013-11-18T09:53:59Z\\nlast-modified:  2013-11-18T09:53:59Z\\nsource:         RIPE"}
{"range": "201.217.131.72/29", "id": "ANU", "name": "CLIENTE ANTEL URUGUAY", "country": "UY", "domain": "antel.net.uy", "org_id": "", "status": "REALLOCATED", "tech_id": "ANU", "mnt_id": "", "admin_id": "", "abuse_id": "ANU", "created": "2014-01-21", "updated": "2014-01-21", "source": "lacnic", "raw": "inetnum:     201.217.131.72/29\\nstatus:      reallocated\\naut-num:     N/A\\nowner:       CLIENTE ANTEL URUGUAY\\nownerid:     UY-CAUR-LACNIC\\nresponsible: CLIENTE ANTEL URUGUAY\\naddress:     Mercedes 876, , P.2\\naddress:     11000 - Montevideo - \\ncountry:     UY\\nphone:       +598 2 9002877\\nowner-c:     ANU\\ntech-c:      ANU\\nabuse-c:     ANU\\ncreated:     20140121\\nchanged:     20140121\\ninetnum-up:  201.217.128.0/19\\n\\nnic-hdl:     ANU\\nperson:      ANTEL URUGUAY\\ne-mail:      ipadmin@antel.net.uy\\naddress:     Mercedes, 876, P. 2\\naddress:     11100 - Montevideo - \\ncountry:     UY\\nphone:       +598  29002877 [0000]\\ncreated:     20020910\\nchanged:     20240117"}
{"range": "217.219.121.104/30", "id": "FARMANDARI", "name": "farmandari bandaabbas", "country": "IR", "domain": "tci.ir", "org_id": "ORG-TCOH2-RIPE", "status": "ASSIGNED PA", "tech_id": "NA6335-RIPE", "mnt_id": "TCI-RIPE-MNT", "admin_id": "NA6202-RIPE", "abuse_id": "AC27092-RIPE", "created": "2021-02-09", "updated": "2021-02-09", "source": "ripe", "raw": "inetnum:        217.219.121.104 - 217.219.121.107\\norg:            ORG-TCOH2-RIPE\\ndescr:          farmandari bandaabbas\\nnetname:        FARMANDARI\\ncountry:        IR\\nadmin-c:        NA6202-RIPE\\ntech-c:         NA6335-RIPE\\ntech-c:         DP14868-RIPE\\ntech-c:         TK9177-RIPE\\nstatus:         ASSIGNED PA\\nmnt-by:         TCI-RIPE-MNT\\ncreated:        2021-02-09T08:38:06Z\\nlast-modified:  2021-02-09T08:39:27Z\\nsource:         RIPE\\nabuse-email:    s.r.afshar@tci.ir\\nabuse-c:        AC27092-RIPE\\nabuse-org:      ORG-TCOH2-RIPE\\n\\norganisation:   ORG-TCOH2-RIPE\\norg-name:       Telecommunication Company of Hormozgan\\norg-type:       other\\naddress:        Hormozgan Telecom\\nadmin-c:        NA6202-RIPE\\ntech-c:         DP14868-RIPE\\nabuse-c:        AC27092-RIPE\\ne-mail:         h.moridinezhad@tci.ir\\nmnt-ref:        TCI-RIPE-MNT\\nmnt-by:         TCI-RIPE-MNT\\ncreated:        2015-06-10T07:39:21Z\\nlast-modified:  2019-03-02T08:06:15Z\\nsource:         RIPE\\n\\nrole:           Data Planner (Hormozgan)\\naddress:        Hormozgan - Telecommunication Company of Hormozgan\\ne-mail:         z.moayedi@tci.ir\\nadmin-c:        ZM1641-RIPE\\nnic-hdl:        DP14868-RIPE\\nmnt-by:         TCI-RIPE-MNT\\ncreated:        2019-03-02T07:53:01Z\\nlast-modified:  2019-03-02T07:53:01Z\\nsource:         RIPE\\n\\nrole:           Network Admin (Hormozgan)\\naddress:        Hormozgan - Telecommunication Company of Hormozgan\\ne-mail:         h.moridinezhad@tci.ir\\nadmin-c:        HMN22-RIPE\\nnic-hdl:        NA6202-RIPE\\nmnt-by:         TCI-RIPE-MNT\\ncreated:        2019-03-02T07:43:30Z\\nlast-modified:  2019-03-02T07:43:30Z\\nsource:         RIPE\\n\\nrole:           NOC (Hormozgan)\\naddress:        Hormozgan - Telecommunication Company of Hormozgan\\ne-mail:         Mt.karimi@tci.ir\\nadmin-c:        MTK34-RIPE\\nnic-hdl:        NA6335-RIPE\\nmnt-by:         TCI-RIPE-MNT\\ncreated:        2019-06-24T06:37:46Z\\nlast-modified:  2019-06-24T06:37:46Z\\nsource:         RIPE\\n\\nperson:         TAHA KARIMI\\naddress:        AZADEGAN BLVD,GHESHM,Hormozgan, IRAN\\nphone:          +98 763 522 2353\\nphone:          +98 763 522 4543\\ne-mail:         tahakarimi@yahoo.com\\nmnt-by:         TCI-RIPE-MNT\\nnic-hdl:        TK9177-RIPE\\ncreated:        2021-02-09T08:37:03Z\\nlast-modified:  2021-02-09T08:37:03Z\\nsource:         RIPE\\n\\nroute:          217.219.121.0/24\\norigin:         AS58224\\nmnt-by:         TCI-RIPE-MNT\\ncreated:        2018-02-19T11:00:18Z\\nlast-modified:  2018-02-19T11:00:18Z\\nsource:         RIPE"}
{"range": "200.168.253.160/27", "id": "JPB4", "name": "Sacotem Embalagens Ltda.", "country": "BR", "domain": "", "org_id": "", "status": "REALLOCATED", "tech_id": "ARS574", "mnt_id": "", "admin_id": "", "abuse_id": "STE21", "created": "2003-08-26", "updated": "2013-03-07", "source": "lacnic", "raw": "inetnum:     200.168.253.160/27\\naut-num:     AS10429\\nabuse-c:     STE21\\nowner:       Sacotem Embalagens Ltda.\\nownerid:     53.888.178/0001-87\\nresponsible: Fernando Silva\\nowner-c:     JOPBE\\ntech-c:      ARS574\\ncreated:     20030826\\nchanged:     20130307\\ninetnum-up:  200.168.192.0/18\\n\\nnic-hdl-br:  JOPBE\\nperson:      Jo\u00e3o Paulo Beneciuti\\ncreated:     20060819\\nchanged:     20161231\\n\\nnic-hdl-br:  ARS574\\nperson:      ANTONIO RAYES SAKR\\ncreated:     20030630\\nchanged:     20080215\\n\\nnic-hdl-br:  STE21\\nperson:      SOC - Telefonica Empresas\\ncreated:     20041207\\nchanged:     20070606"}
{"range": "192.206.12.0/24", "id": "NUM9", "name": "Number Nine Computer Corp.", "country": "US", "domain": "", "org_id": "NNCC-1", "status": "ALLOCATION", "tech_id": "JM375-ARIN", "mnt_id": "", "admin_id": "JM375-ARIN", "abuse_id": "JM375-ARIN", "created": "1992-08-04", "updated": "2021-12-14", "source": "arin", "raw": "NetHandle:      NET-192-206-12-0-1\\nOrgID:          NNCC-1\\nParent:         NET-192-0-0-0-0\\nNetName:        NUM9\\nNetRange:       192.206.12.0 - 192.206.12.255\\nNetType:        allocation\\nRegDate:        1992-08-04\\nUpdated:        2021-12-14\\nTechHandle:     JM375-ARIN\\nSource:         ARIN\\n\\n\\nOrgID:          NNCC-1\\nOrgName:        Number Nine Computer Corp.\\nCanAllocate:    \\nStreet:         18 Hartwell Avenue\\nCity:           Lexington\\nState/Prov:     MA\\nCountry:        US\\nPostalCode:     02173\\nRegDate:        1992-08-04\\nUpdated:        2011-09-24\\nOrgAdminHandle: JM375-ARIN\\nOrgTechHandle:  JM375-ARIN\\nOrgAbuseHandle: JM375-ARIN\\nSource:         ARIN\\n\\n\\nPOCHandle:      JM375-ARIN\\nIsRole:         N\\nLastName:       MacLeod\\nFirstName:      James\\nStreet:         Number Nine Computer Corporation\\nStreet:         18 Hartwell Avenue\\nCity:           Lexington\\nState/Prov:     MA\\nCountry:        US\\nPostalCode:     02173\\nRegDate:        1992-08-04\\nUpdated:        1992-08-04\\nOfficePhone:    +1-617-674-0009\\nSource:         ARIN\\n"}
{"range": "146.247.24.0/21", "id": "SI-DHH-20110713", "name": "Webtasy, d.o.o.", "country": "SI", "domain": "webtasy.com", "org_id": "ORG-DD4-RIPE", "status": "ALLOCATED PA", "tech_id": "DHH-RIPE", "mnt_id": "DHH-MNT", "admin_id": "DHH-RIPE", "abuse_id": "DHH-RIPE", "created": "2019-12-23", "updated": "2019-12-23", "source": "ripe", "raw": "inetnum:        146.247.24.0 - 146.247.31.255\\nnetname:        SI-DHH-20110713\\ncountry:        SI\\norg:            ORG-DD4-RIPE\\nadmin-c:        DHH-RIPE\\ntech-c:         DHH-RIPE\\nstatus:         ALLOCATED PA\\nmnt-by:         DHH-MNT\\nmnt-by:         RIPE-NCC-HM-MNT\\ncreated:        2019-12-23T14:39:28Z\\nlast-modified:  2019-12-23T14:39:28Z\\nsource:         RIPE\\nabuse-email:    abuse@webtasy.com\\nabuse-c:        DHH-RIPE\\nabuse-org:      ORG-DD4-RIPE\\n\\norganisation:   ORG-DD4-RIPE\\norg-name:       Webtasy, d.o.o.\\ncountry:        SI\\norg-type:       LIR\\naddress:        Dunajska cesta 110\\naddress:        1000\\naddress:        Ljubljana\\naddress:        SLOVENIA\\nphone:          +38617777877\\nadmin-c:        MR16248-RIPE\\ntech-c:         MR16248-RIPE\\nadmin-c:        DS25141-RIPE\\ntech-c:         DS25141-RIPE\\nmnt-ref:        DHH-MNT\\nmnt-ref:        RIPE-NCC-HM-MNT\\nmnt-by:         RIPE-NCC-HM-MNT\\nmnt-by:         DHH-MNT\\nabuse-c:        DHH-RIPE\\ncreated:        2007-04-05T12:46:47Z\\nlast-modified:  2024-08-09T10:55:41Z\\nsource:         RIPE\\ne-mail:         ripe@webtasy.com\\n\\nrole:           Webtasy RIPE Team\\naddress:        Dunajska cesta 110\\naddress:        SI-1000 Ljubljana\\naddress:        Slovenia\\ne-mail:         ripe@webtasy.com\\ntech-c:         MR16248-RIPE\\ntech-c:         DS25141-RIPE\\nadmin-c:        MR16248-RIPE\\nadmin-c:        DS25141-RIPE\\nnic-hdl:        DHH-RIPE\\nmnt-by:         DHH-MNT\\ncreated:        2017-06-09T11:44:50Z\\nlast-modified:  2024-08-19T11:14:36Z\\nsource:         RIPE\\nabuse-mailbox:  abuse@webtasy.com"}
{"range": "185.19.234.168/30", "id": "CUST-GCDE-NET-0159", "name": "IBAF GmbH", "country": "DE", "domain": "ibaf.de", "org_id": "ORG-GG34-RIPE", "status": "ASSIGNED PA", "tech_id": "JL9676-RIPE", "mnt_id": "GCNET-MNT", "admin_id": "JL9676-RIPE", "abuse_id": "GA7493-RIPE", "created": "2015-07-08", "updated": "2015-07-08", "source": "ripe", "raw": "inetnum:        185.19.234.168 - 185.19.234.171\\nnetname:        CUST-GCDE-NET-0159\\ndescr:          IBAF GmbH\\ncountry:        DE\\nadmin-c:        JL9676-RIPE\\ntech-c:         JL9676-RIPE\\nstatus:         ASSIGNED PA\\nmnt-by:         GCNET-MNT\\ncreated:        2015-07-08T09:35:47Z\\nlast-modified:  2015-07-08T09:35:47Z\\nsource:         RIPE\\nabuse-email:    abuse@globalconnect.dk\\nabuse-c:        GA7493-RIPE\\nabuse-org:      ORG-GG34-RIPE\\n\\nperson:         Joerg Loewenstein\\naddress:        IBAF GmbH\\naddress:        Kanalufer 48\\naddress:        D-24768 Rendsburg\\naddress:        Germany\\nphone:          +49 4331130672\\nfax-no:         +49 4331 1306-70\\ne-mail:         edv@ibaf.de\\nnic-hdl:        JL9676-RIPE\\nmnt-by:         GCNET-MNT\\ncreated:        2015-07-08T09:34:20Z\\nlast-modified:  2015-07-08T09:34:20Z\\nsource:         RIPE\\n\\nroute:          185.19.232.0/22\\ndescr:          GlobalConnect GmbH Network\\norigin:         AS42525\\nmnt-by:         AS42525-MNT\\ncreated:        2013-02-27T16:12:57Z\\nlast-modified:  2013-02-27T16:12:57Z\\nsource:         RIPE"}
{"range": "213.209.225.224/28", "id": "EATALYWORLDBOLOGNA-ACANTHO", "name": "Acantho S.p.a", "country": "IT", "domain": "acantho.it", "org_id": "ORG-AS22-RIPE", "status": "ASSIGNED PA", "tech_id": "RB19785-RIPE", "mnt_id": "CASAWEB-MNT", "admin_id": "RB19785-RIPE", "abuse_id": "AA25964-RIPE", "created": "2016-05-05", "updated": "2016-05-05", "source": "ripe", "raw": "inetnum:        213.209.225.224 - 213.209.225.239\\nnetname:        EATALYWORLDBOLOGNA-ACANTHO\\ncountry:        IT\\nadmin-c:        RB19785-RIPE\\ntech-c:         RB19785-RIPE\\nstatus:         ASSIGNED PA\\nmnt-by:         CASAWEB-MNT\\ncreated:        2016-05-05T12:37:32Z\\nlast-modified:  2016-05-05T12:37:32Z\\nsource:         RIPE\\n\\nperson:         ROBERTO BAZZANO\\naddress:        VIA PAOLO CANALI, 1 - 40127 - BOLOGNA\\nphone:          +39 335 8100898\\nnic-hdl:        RB19785-RIPE\\nmnt-by:         CASAWEB-MNT\\ncreated:        2016-05-05T12:34:57Z\\nlast-modified:  2016-05-05T12:34:57Z\\nsource:         RIPE\\n\\nroute:          213.209.224.0/20\\ndescr:          Acantho Network\\nremarks:        *************************************************\\nremarks:        **for net abuse or spam: abuse@acantho.net**\\nremarks:        *************************************************\\norigin:         AS21309\\nmnt-by:         CASAWEB-MNT\\ncreated:        2011-01-18T14:18:16Z\\nlast-modified:  2011-01-18T14:18:16Z\\nsource:         RIPE"}
{"range": "108.178.166.120/30", "id": "TELEPACIFIC-CORP", "name": "TELEPACIFIC CORP", "country": "US", "domain": "tpx.com", "org_id": "C10733072", "status": "REASSIGNMENT", "tech_id": "", "mnt_id": "", "admin_id": "", "abuse_id": "", "created": "2024-02-29", "updated": "2024-02-29", "source": "arin", "raw": "NetHandle:      NET-108-178-166-120-1\\nOrgID:          C10733072\\nParent:         NET-108-178-128-0-1\\nNetName:        TELEPACIFIC-CORP\\nNetRange:       108.178.166.120 - 108.178.166.123\\nNetType:        reassignment\\nRegDate:        2024-02-29\\nUpdated:        2024-02-29\\nSource:         ARIN\\n\\n\\nOrgID:          C10733072\\nOrgName:        TELEPACIFIC CORP\\nCanAllocate:    \\nStreet:         5451 WALNUT AVE\\nCity:           CHINO\\nState/Prov:     CA\\nCountry:        US\\nPostalCode:     91710\\nRegDate:        2024-02-29\\nUpdated:        2024-02-29\\nSource:         ARIN\\n"}
{"range": "2001:1890:1f14:fb00::/56", "id": "ATT-EIPAM", "name": "U.S. TELEPACIFIC CORP.", "country": "US", "domain": "tpx.com", "org_id": "C09905713", "status": "REASSIGNMENT", "tech_id": "", "mnt_id": "", "admin_id": "", "abuse_id": "", "created": "2023-07-31", "updated": "2023-07-31", "source": "arin", "raw": "V6NetHandle:    NET6-2001-1890-1F14-FB00-1\\nOrgID:          C09905713\\nParent:         NET6-2001-1890-1\\nNetName:        ATT-EIPAM\\nNetRange:       2001:1890:1F14:FB00:: - 2001:1890:1F14:FBFF:FFFF:FFFF:FFFF:FFFF\\nNetType:        reassignment\\nRegDate:        2023-07-31\\nUpdated:        2023-07-31\\nSource:         ARIN\\n\\n\\nOrgID:          C09905713\\nOrgName:        U.S. TELEPACIFIC CORP.\\nCanAllocate:    \\nStreet:         S FLOWER ST\\nCity:           LOS ANGELES\\nState/Prov:     CA\\nCountry:        US\\nPostalCode:     90017-4101\\nRegDate:        2023-07-31\\nUpdated:        2023-07-31\\nSource:         ARIN\\n"}
{"range": "62.80.197.32/28", "id": "TEAB-LADDSTATION-ACCESS", "name": "Leissner Data AB", "country": "SE", "domain": "leissner.se", "org_id": "ORG-LDA2-RIPE", "status": "ASSIGNED PA", "tech_id": "LDCR1-RIPE", "mnt_id": "LEISSNER-MNT", "admin_id": "LDAR1-RIPE", "abuse_id": "LDCR1-RIPE", "created": "2014-01-17", "updated": "2017-07-25", "source": "ripe", "raw": "inetnum:        62.80.197.32 - 62.80.197.47\\nnetname:        TEAB-LADDSTATION-ACCESS\\ncountry:        SE\\nadmin-c:        LDAR1-RIPE\\ntech-c:         LDCR1-RIPE\\nnotify:         ripe@leissner.se\\nremarks:        Please send abuse reports to abuse@leissner.se\\nremarks:        For other queries contact ripe@leissner.se\\nstatus:         ASSIGNED PA\\nmnt-by:         LEISSNER-MNT\\ncreated:        2014-01-17T10:46:37Z\\nlast-modified:  2017-07-25T11:14:21Z\\nsource:         RIPE\\n\\nrole:           Leissner Data Admin Role\\naddress:        Leissner Data AB\\ne-mail:         registry@leissner.se\\nadmin-c:        PF96\\ntech-c:         PO362\\nremarks:        Please send abuse reports to abuse@leissner.se\\nremarks:        For other queries contact ripe@leissner.se\\nabuse-mailbox:  abuse@leissner.se\\nnic-hdl:        LDAR1-RIPE\\nmnt-by:         LEISSNER-MNT\\ncreated:        2009-09-18T12:35:26Z\\nlast-modified:  2015-07-06T15:42:23Z\\nsource:         RIPE\\n\\nrole:           Leissner Data Contact Role\\naddress:        Leissner Data AB\\ne-mail:         registry@leissner.se\\nadmin-c:        PF96\\ntech-c:         PO362\\nremarks:        Please send abuse reports to abuse@leissner.se\\nremarks:        For other queries contact ripe@leissner.se\\nabuse-mailbox:  abuse@leissner.se\\nnic-hdl:        LDCR1-RIPE\\nmnt-by:         LEISSNER-MNT\\ncreated:        2009-07-24T12:22:11Z\\nlast-modified:  2015-07-06T15:46:44Z\\nsource:         RIPE\\n\\nroute:          62.80.192.0/21\\ndescr:          THN-6\\norigin:         AS12597\\nmnt-by:         LEISSNER-MNT\\ncreated:        2010-03-03T14:11:45Z\\nlast-modified:  2010-03-03T14:11:45Z\\nsource:         RIPE"}
{"range": "68.92.43.32/29", "id": "SBC068092043032031015", "name": "Clear Lake Area Chamber", "country": "US", "domain": "", "org_id": "C00687117", "status": "REASSIGNMENT", "tech_id": "", "mnt_id": "", "admin_id": "", "abuse_id": "", "created": "2003-10-15", "updated": "2003-10-15", "source": "arin", "raw": "NetHandle:      NET-68-92-43-32-1\\nOrgID:          C00687117\\nParent:         NET-68-88-0-0-1\\nNetName:        SBC068092043032031015\\nNetRange:       68.92.43.32 - 68.92.43.39\\nNetType:        reassignment\\nComment:        For Policy Abuse issues, contact: abuse@swbell.net\\nComment:        For Technical issues, contact: noc@swbell.net\\nRegDate:        2003-10-15\\nUpdated:        2003-10-15\\nSource:         ARIN\\n\\n\\nOrgID:          C00687117\\nOrgName:        Clear Lake Area Chamber\\nCanAllocate:    \\nStreet:         1701 Alma St.\\nCity:           Plano\\nState/Prov:     TX\\nCountry:        US\\nPostalCode:     75075\\nRegDate:        2003-10-15\\nUpdated:        2018-07-19\\nSource:         ARIN\\n"}
{"range": "193.65.170.20/30", "id": "GOFILEXNORDICOY", "name": "GOFILEXNORDICOY", "country": "FI", "domain": "elisa.fi", "org_id": "ORG-EO1-RIPE", "status": "ASSIGNED PA", "tech_id": "KH-RIPE", "mnt_id": "ELISA-MNT", "admin_id": "KH-RIPE", "abuse_id": "KH-RIPE", "created": "2021-10-06", "updated": "2021-10-06", "source": "ripe", "raw": "inetnum:        193.65.170.20 - 193.65.170.23\\nnetname:        GOFILEXNORDICOY\\ndescr:          GOFILEXNORDICOY\\ncountry:        FI\\nadmin-c:        KH-RIPE\\ntech-c:         KH-RIPE\\nstatus:         ASSIGNED PA\\nmnt-by:         ELISA-MNT\\ncreated:        2021-10-06T05:52:24Z\\nlast-modified:  2021-10-06T05:52:24Z\\nsource:         RIPE\\nabuse-email:    abuse@elisa.fi\\nabuse-c:        KH-RIPE\\nabuse-org:      ORG-EO1-RIPE\\n\\nrole:           Elisa Hostmaster\\naddress:        Elisa Oyj\\ne-mail:         hostmaster@elisa.fi\\nadmin-c:        RJ390-RIPE\\ntech-c:         RJ390-RIPE\\nnic-hdl:        KH-RIPE\\nabuse-mailbox:  abuse@elisa.fi\\nmnt-by:         ELISA-MNT\\ncreated:        2002-05-24T07:04:09Z\\nlast-modified:  2016-10-22T08:41:17Z\\nsource:         RIPE\\n\\nroute:          193.64.0.0/15\\ndescr:          ELISA\\norigin:         AS719\\nholes:          193.64.10.0/24\\nholes:          193.64.11.0/24\\nnotify:         lir-updates@elisa.fi\\nmnt-by:         ELISA-MNT\\ncreated:        2020-05-25T11:54:10Z\\nlast-modified:  2020-05-25T12:02:39Z\\nsource:         RIPE"}
{"range": "202.238.155.112/28", "id": "DK-WAN-TEST", "name": "DAIICHIKOSHO CO., LTD.", "country": "JP", "domain": "dkkaraoke.co.jp", "org_id": "", "status": "", "tech_id": "TN40829JP", "mnt_id": "", "admin_id": "TN40829JP", "abuse_id": "", "created": "", "updated": "2021-12-07", "source": "jpnic", "raw": "inetnum:        202.238.155.112 - 202.238.155.127\\nnetname:        DK-WAN-TEST\\ndescr:          DAIICHIKOSHO CO., LTD.\\ncountry:        JP\\nadmin-c:        TN40829JP\\ntech-c:         TN40829JP\\nlast-modified:  2021-12-07T17:41:02Z\\nremarks:        This information has been partially mirrored by APNIC from\\nremarks:        JPNIC. To obtain more specific information, please use the\\nremarks:        JPNIC WHOIS Gateway at\\nremarks:        http://www.nic.ad.jp/en/db/whois/en-gateway.html or\\nremarks:        whois.nic.ad.jp for WHOIS client. (The WHOIS client\\nremarks:        defaults to Japanese output, use the /e switch for English\\nremarks:        output)\\nsource:         JPNIC\\n"}
{"range": "202.232.189.128/28", "id": "M365GW", "name": "Nippon Seisen Co., Ltd.", "country": "JP", "domain": "n-seisen.co.jp", "org_id": "", "status": "", "tech_id": "TS83616JP", "mnt_id": "", "admin_id": "MM37106JP", "abuse_id": "", "created": "", "updated": "2024-06-06", "source": "jpnic", "raw": "inetnum:        202.232.189.128 - 202.232.189.143\\nnetname:        M365GW\\ndescr:          Nippon Seisen Co., Ltd.\\ncountry:        JP\\nadmin-c:        MM37106JP\\ntech-c:         TS83616JP\\nlast-modified:  2024-06-06T01:29:02Z\\nremarks:        This information has been partially mirrored by APNIC from\\nremarks:        JPNIC. To obtain more specific information, please use the\\nremarks:        JPNIC WHOIS Gateway at\\nremarks:        http://www.nic.ad.jp/en/db/whois/en-gateway.html or\\nremarks:        whois.nic.ad.jp for WHOIS client. (The WHOIS client\\nremarks:        defaults to Japanese output, use the /e switch for English\\nremarks:        output)\\nsource:         JPNIC\\n"}
{"range": "5.254.117.248/30", "id": "NET-TUL-DEDICATED", "name": "Tulipa Ent Limited", "country": "NL", "domain": "comeon.com", "org_id": "ORG-TEL31-RIPE", "status": "ASSIGNED PA", "tech_id": "TOT14-RIPE", "mnt_id": "VOXILITY-MNT", "admin_id": "TOT14-RIPE", "abuse_id": "ACRO47725-RIPE", "created": "2022-04-19", "updated": "2022-04-19", "source": "ripe", "raw": "inetnum:        5.254.117.248 - 5.254.117.251\\nnetname:        net-tul-dedicated\\ncountry:        NL\\nadmin-c:        TOT14-RIPE\\norg:            ORG-TEL31-RIPE\\ntech-c:         TOT14-RIPE\\nstatus:         ASSIGNED PA\\nmnt-by:         VOXILITY-MNT\\ncreated:        2022-04-19T11:21:03Z\\nlast-modified:  2022-04-19T11:21:03Z\\nsource:         RIPE\\nabuse-email:    legal@comeon.com\\nabuse-c:        ACRO47725-RIPE\\nabuse-org:      ORG-TEL31-RIPE\\n\\norganisation:   ORG-TEL31-RIPE\\norg-name:       Tulipa Ent Limited\\norg-type:       OTHER\\naddress:        3rd Floor, Spinola Park, Triq Mikiel Ang Borg, St. Julians, SPK1000, Malta.\\ne-mail:         techopsexec-team@comeon.com\\nabuse-c:        ACRO47725-RIPE\\nmnt-ref:        VOXILITY-MNT\\nmnt-by:         VOXILITY-MNT\\ncreated:        2022-04-19T11:20:02Z\\nlast-modified:  2022-04-19T11:20:02Z\\nsource:         RIPE\\n\\nperson:         Technical Operations Team\\naddress:        3rd Floor, Spinola Park, Triq Mikiel Ang Borg, St. Julians, SPK1000, Malta.\\nphone:          +491725766128\\nnic-hdl:        TOT14-RIPE\\nmnt-by:         VOXILITY-MNT\\ncreated:        2022-04-19T11:19:09Z\\nlast-modified:  2022-04-19T11:19:09Z\\nsource:         RIPE\\n\\nroute:          5.254.117.0/24\\ndescr:          Voxility\\norigin:         AS3223\\nmnt-by:         VOXILITY-MNT\\ncreated:        2015-01-14T13:45:20Z\\nlast-modified:  2020-11-13T14:27:09Z\\nsource:         RIPE"}
{"range": "113.39.204.248/29", "id": "G-TK0314N24M", "name": "UCOM Corporation", "country": "JP", "domain": "", "org_id": "", "status": "", "tech_id": "JP00022296", "mnt_id": "", "admin_id": "JP00022296", "abuse_id": "", "created": "", "updated": "2011-11-13", "source": "jpnic", "raw": "inetnum:        113.39.204.248 - 113.39.204.255\\nnetname:        G-TK0314N24M\\ndescr:          UCOM Corporation\\ncountry:        JP\\nadmin-c:        JP00022296\\ntech-c:         JP00022296\\nlast-modified:  2011-11-13T10:07:55Z\\nremarks:        This information has been partially mirrored by APNIC from\\nremarks:        JPNIC. To obtain more specific information, please use the\\nremarks:        JPNIC WHOIS Gateway at\\nremarks:        http://www.nic.ad.jp/en/db/whois/en-gateway.html or\\nremarks:        whois.nic.ad.jp for WHOIS client. (The WHOIS client\\nremarks:        defaults to Japanese output, use the /e switch for English\\nremarks:        output)\\nsource:         JPNIC\\n"}
{"range": "99.169.32.152/29", "id": "SBCIS-072608160734", "name": "Private Customer - SBC Internet Services", "country": "US", "domain": "", "org_id": "C01965946", "status": "REASSIGNMENT", "tech_id": "", "mnt_id": "", "admin_id": "", "abuse_id": "", "created": "2008-07-26", "updated": "2018-01-10", "source": "arin", "raw": "NetHandle:      NET-99-169-32-152-1\\nOrgID:          C01965946\\nParent:         NET-99-157-0-0-1\\nNetName:        SBCIS-072608160734\\nNetRange:       99.169.32.152 - 99.169.32.159\\nNetType:        reassignment\\nRegDate:        2008-07-26\\nUpdated:        2018-01-10\\nSource:         ARIN\\n\\n\\nOrgID:          C01965946\\nOrgName:        Private Customer - SBC Internet Services\\nCanAllocate:    \\nStreet:         Private Residence\\nCity:           Richardson\\nState/Prov:     TX\\nCountry:        US\\nPostalCode:     75080\\nRegDate:        2008-07-26\\nUpdated:        2018-07-19\\nSource:         ARIN\\n"}
{"range": "2c0f:f8f0:b5c1::/48", "id": "ZOL-CUST-B5C1", "name": "ZOL V6 SK 383523", "country": "ZW", "domain": "liquidtelecom.com", "org_id": "", "status": "ASSIGNED PA", "tech_id": "AA110-AFRINIC", "mnt_id": "LIQUID-TOL-MNT", "admin_id": "AA110-AFRINIC", "abuse_id": "", "created": "2017-07-22", "updated": "2017-07-22", "source": "afrinic", "raw": "inet6num:       2c0f:f8f0:b5c1::/48\\nnetname:        ZOL-CUST-b5c1\\ndescr:          ZOL V6 SK 383523\\ncountry:        ZW\\nadmin-c:        AA110-AFRINIC\\ntech-c:         AA110-AFRINIC\\nstatus:         ASSIGNED PA\\nmnt-by:         LIQUID-TOL-MNT\\nchanged:        andrew.alston@liquidtelecom.com 20170722\\nsource:         AFRINIC\\nparent:         2c0f:f8f0::/32\\n\\nperson:         Andrew Alston\\naddress:        Block A, Sameer Business Park,\\naddress:        Mombasa Road,\\naddress:        Nairobi\\naddress:        Kenya\\nphone:          +254 20 5000000\\ne-mail:         andrew.alston@liquidtelecom.com\\nnic-hdl:        AA110-AFRINIC\\nmnt-by:         AA110-MNTR\\nchanged:        andrew.alston@liquidtelecom.com 20170208\\nsource:         AFRINIC"}
{"range": "80.48.244.32/29", "id": "DR-MAX", "name": "Dr.Max Sp. z o.o.", "country": "PL", "domain": "drmax.com.pl", "org_id": "ORG-PT1-RIPE", "status": "ASSIGNED PA", "tech_id": "WK2914-RIPE", "mnt_id": "TPNET", "admin_id": "TL6414-RIPE", "abuse_id": "OPHT", "created": "2022-03-17", "updated": "2022-03-17", "source": "ripe", "raw": "inetnum:        80.48.244.32 - 80.48.244.39\\nnetname:        DR-MAX\\ndescr:          Dr.Max Sp. z o.o.\\ndescr:          27 STYCZNIA 9\\ndescr:          34-120 ANDRYCHOW\\ncountry:        PL\\nadmin-c:        TL6414-RIPE\\ntech-c:         WK2914-RIPE\\nstatus:         ASSIGNED PA\\nmnt-by:         TPNET\\ncreated:        2022-03-17T13:47:27Z\\nlast-modified:  2022-03-17T13:48:55Z\\nsource:         RIPE\\nabuse-email:    cert.opl@orange.com\\nabuse-c:        OPHT\\nabuse-org:      ORG-PT1-RIPE\\n\\nperson:         Tomasz Lech\\naddress:        Dr.Max Sp. z o.o.\\naddress:        ul. Krzemieniecka 60a\\naddress:        54-613 Wroclaw\\naddress:        POLAND\\nphone:          +48 723 222452\\ne-mail:         tomasz.lech@drmax.com.pl\\nnic-hdl:        TL6414-RIPE\\nmnt-by:         TPNET\\nnotify:         hostmaster@tpnet.pl\\ncreated:        2021-12-23T08:52:22Z\\nlast-modified:  2021-12-23T08:52:22Z\\nsource:         RIPE\\n\\nperson:         Wojciech Koscielniak\\naddress:        Viapharma Hurtownia Farmaceutyczna Sp. z o.o.\\naddress:        ul. Krzemieniecka 60a\\naddress:        54-613 Wroclaw\\naddress:        Polska\\nphone:          +48 515 080363\\ne-mail:         wojciech.koscielniak@drmax.com.pl\\nnic-hdl:        WK2914-RIPE\\nmnt-by:         TPNET\\nnotify:         hostmaster@tpnet.pl\\ncreated:        2021-12-23T08:52:22Z\\nlast-modified:  2024-06-20T08:29:09Z\\nsource:         RIPE\\n\\nroute:          80.48.0.0/14\\ndescr:          Orange Polska SA\\ndescr:          for abuse: abuse@tpnet.pl\\norigin:         AS5617\\nmnt-by:         AS5617-MNT\\ncreated:        2014-08-13T12:11:18Z\\nlast-modified:  2014-08-13T12:11:18Z\\nsource:         RIPE"}
{"range": "89.19.26.128/29", "id": "ALI-ISIK-NET", "name": "Ali Isik", "country": "TR", "domain": "fiskobirlik.org.tr", "org_id": "ORG-CBSS1-RIPE", "status": "ASSIGNED PA", "tech_id": "AI5116-RIPE", "mnt_id": "CIZGI-MNT", "admin_id": "AI5116-RIPE", "abuse_id": "CTA12-RIPE", "created": "2020-12-28", "updated": "2020-12-28", "source": "ripe", "raw": "inetnum:        89.19.26.128 - 89.19.26.135\\nnetname:        Ali-Isik-NET\\ndescr:          Ali Isik\\ncountry:        TR\\nadmin-c:        AI5116-RIPE\\ntech-c:         AI5116-RIPE\\nremarks:        Please abuse mail to Bilgi.islem@fiskobirlik.org.tr\\nstatus:         ASSIGNED PA\\nmnt-by:         CIZGI-MNT\\ncreated:        2020-12-28T12:52:21Z\\nlast-modified:  2020-12-28T12:52:21Z\\nsource:         RIPE\\nabuse-email:    abuse@cizgi.net.tr\\nabuse-c:        CTA12-RIPE\\nabuse-org:      ORG-CBSS1-RIPE\\n\\nperson:         Ali Isik\\naddress:        HACISIYAM MAH FATIH CAD NO.59\\naddress:        MERKEZ\\naddress:        TR\\nphone:          +04542164240\\nfax-no:         +04542160380\\ne-mail:         bilgi.islem@fiskobirlik.org.tr\\nnic-hdl:        AI5116-RIPE\\nmnt-by:         CIZGI-MNT\\ncreated:        2020-12-28T12:52:20Z\\nlast-modified:  2020-12-28T12:52:20Z\\nsource:         RIPE\\n\\nroute:          89.19.26.0/24\\ndescr:          Cizgi Telekom Block\\norigin:         AS34619\\nmnt-by:         CIZGI-MNT\\ncreated:        2011-04-04T14:15:49Z\\nlast-modified:  2011-04-04T14:15:49Z\\nsource:         RIPE"}
{"range": "81.252.202.128/29", "id": "FR-SOBIO", "name": "Orange Business Services", "country": "FR", "domain": "orange-business.com", "org_id": "ORG-OBS3-RIPE", "status": "ASSIGNED PA", "tech_id": "NL5432-RIPE", "mnt_id": "PC80199-MNT", "admin_id": "NL5432-RIPE", "abuse_id": "BRX1-RIPE", "created": "2024-01-18", "updated": "2024-01-18", "source": "ripe", "raw": "inetnum:        81.252.202.128 - 81.252.202.135\\nnetname:        FR-SOBIO\\ncountry:        FR\\nstatus:         ASSIGNED PA\\nadmin-c:        NL5432-RIPE\\ntech-c:         NL5432-RIPE\\nmnt-by:         PC80199-MNT\\ncreated:        2024-01-18T11:40:08Z\\nlast-modified:  2024-01-18T11:40:08Z\\nsource:         RIPE\\nabuse-email:    gestionip.ft@orange.com\\nabuse-c:        BRX1-RIPE\\nabuse-org:      ORG-FT2-RIPE\\n\\nperson:         Nathalie Lequeux\\nnic-hdl:        NL5432-RIPE\\ne-mail:         nlequeux@sobio.fr\\naddress:        17 RUE DU PARC MANCEAU 72000 LE MANS FRA\\nphone:          +33 643029716\\nmnt-by:         PC80199-MNT\\ncreated:        2024-01-18T11:40:08Z\\nlast-modified:  2024-01-18T11:40:08Z\\nsource:         RIPE\\n\\nroute:          81.252.0.0/16\\ndescr:          ORANGE Business Services\\norigin:         AS3215\\nmnt-by:         PC80199-MNT\\norg:            ORG-OBS3-RIPE\\ncreated:        2006-03-30T11:45:06Z\\nlast-modified:  2014-12-31T08:34:08Z\\nsource:         RIPE\\n\\norganisation:   ORG-OBS3-RIPE\\norg-name:       Orange Business Services\\norg-type:       Other\\naddress:        6 avenue Albert Durand\\naddress:        31700 Blagnac France\\ne-mail:         gestip.rain@orange.com\\nremarks:        **************************************\\nremarks:        * Pour les obligations legale *\\nremarks:        * Contacter uniquement les poles OL *\\nremarks:        * de France Telecom/Orange *\\nremarks:        * *\\nremarks:        * For legal issus joint only *\\nremarks:        * France telecom/orange legal team *\\nremarks:        **************************************\\nadmin-c:        AA2914-RIPE\\ntech-c:         AA2914-RIPE\\nabuse-c:        AA2914-RIPE\\nmnt-ref:        OLEANE-NOC\\nmnt-ref:        FT-BRX\\nmnt-ref:        RAIN-TRANSPAC\\nmnt-ref:        RIPE-NCC-HM-MNT\\nmnt-by:         RAIN-TRANSPAC\\ncreated:        2010-11-08T15:39:40Z\\nlast-modified:  2017-10-30T14:39:03Z\\nsource:         RIPE"}
{"range": "194.218.149.232/29", "id": "SE-ELLTEBILOCHFORSALJNINGS", "name": "Ellte Bil och Forsaljnings AB", "country": "SE", "domain": "elltebil.se", "org_id": "ORG-EBOF2-RIPE", "status": "ASSIGNED PA", "tech_id": "JT5659-RIPE", "mnt_id": "TELIANET-LIR", "admin_id": "JT5659-RIPE", "abuse_id": "AR13670-RIPE", "created": "2014-04-17", "updated": "2014-04-17", "source": "ripe", "raw": "inetnum:        194.218.149.232 - 194.218.149.239\\nnetname:        SE-ELLTEBILOCHFORSALJNINGS\\ndescr:          Ellte Bil och Forsaljnings AB\\norg:            ORG-EBOF2-RIPE\\ncountry:        SE\\nadmin-c:        JT5659-RIPE\\ntech-c:         JT5659-RIPE\\nstatus:         ASSIGNED PA\\nnotify:         mntripe@telia.net\\nmnt-by:         TELIANET-LIR\\ncreated:        2014-04-17T07:25:39Z\\nlast-modified:  2014-04-17T07:25:39Z\\nsource:         RIPE\\nabuse-email:    abuse@telia.com\\nabuse-c:        AR13670-RIPE\\nabuse-org:      ORG-EBOF2-RIPE\\n\\norganisation:   ORG-EBOF2-RIPE\\norg-name:       Ellte Bil och Forsaljnings AB\\norg-type:       OTHER\\ndescr:          Bilverkstad\\naddress:        Skyttbrinksvagen 33\\naddress:        147 39 Tumba\\naddress:        SE\\nphone:          +46853037960\\nfax-no:         +46853037925\\ne-mail:         info@elltebil.se\\nadmin-c:        JT5659-RIPE\\ntech-c:         JT5659-RIPE\\nref-nfy:        mntripe@telia.net\\nnotify:         mntripe@telia.net\\nmnt-by:         TELIANET-LIR\\nmnt-ref:        TELIANET-LIR\\ncreated:        2014-04-17T07:25:39Z\\nlast-modified:  2017-10-30T16:27:59Z\\nsource:         RIPE\\n\\nperson:         Jan Thorstenson\\naddress:        Ellte Bil och Forsaljnings AB\\naddress:        Skyttbrinksvagen 33\\naddress:        147 39 Tumba\\naddress:        SE\\nphone:          +46853037960\\ne-mail:         info@elltebil.se\\nnic-hdl:        JT5659-RIPE\\nnotify:         mntripe@telia.net\\nmnt-by:         TELIANET-LIR\\ncreated:        2014-04-17T07:25:39Z\\nlast-modified:  2014-04-17T07:25:39Z\\nsource:         RIPE\\n\\nroute:          194.218.0.0/16\\ndescr:          TELIANET-BLK\\norigin:         AS3301\\nmnt-by:         TELIANET-RR\\ncreated:        2002-01-09T08:57:28Z\\nlast-modified:  2003-06-26T08:06:13Z\\nsource:         RIPE"}
{"range": "14.200.189.12/30", "id": "TPGINTERNETPTYLTD", "name": "TPG Internet Pty Ltd.", "country": "AU", "domain": "tpg.com.au", "org_id": "", "status": "ASSIGNED NON-PORTABLE", "tech_id": "TH178-AP", "mnt_id": "MAINT-AU-TPGCOM", "admin_id": "TH178-AP", "abuse_id": "AT937-AP", "created": "", "updated": "2020-07-15", "source": "apnic", "raw": "inetnum:        14.200.189.12 - 14.200.189.15\\nnetname:        TPGInternetPtyLtd\\ndescr:          TPG Internet Pty Ltd.\\ncountry:        AU\\nadmin-c:        TH178-AP\\ntech-c:         TH178-AP\\nabuse-c:        AT937-AP\\nstatus:         ASSIGNED NON-PORTABLE\\nmnt-by:         MAINT-AU-TPGCOM\\nmnt-irt:        IRT-TPGCOM-AU\\nlast-modified:  2020-07-15T01:16:22Z\\nsource:         APNIC\\n\\nirt:            IRT-TPGCOM-AU\\naddress:        TPG Internet Pty Ltd.\\naddress:        (Part of the Total Peripherals Group)\\naddress:        65 Waterloo Road\\naddress:        North Ryde NSW 2113\\ne-mail:         hostmaster@tpgtelecom.com.au\\nabuse-mailbox:  hostmaster@tpgtelecom.com.au\\nadmin-c:        TH178-AP\\ntech-c:         TH178-AP\\nauth:           # Filtered\\nremarks:        hostmaster@tpgtelecom.com.au was validated on 2024-11-29\\nmnt-by:         MAINT-AU-TPGCOM\\nlast-modified:  2024-11-29T06:23:17Z\\nsource:         APNIC\\n\\nrole:           ABUSE TPGCOMAU\\ncountry:        ZZ\\naddress:        TPG Internet Pty Ltd.\\naddress:        (Part of the Total Peripherals Group)\\naddress:        65 Waterloo Road\\naddress:        North Ryde NSW 2113\\nphone:          +000000000\\ne-mail:         hostmaster@tpgtelecom.com.au\\nadmin-c:        TH178-AP\\ntech-c:         TH178-AP\\nnic-hdl:        AT937-AP\\nremarks:        Generated from irt object IRT-TPGCOM-AU\\nremarks:        hostmaster@tpgtelecom.com.au was validated on 2024-11-29\\nabuse-mailbox:  hostmaster@tpgtelecom.com.au\\nmnt-by:         APNIC-ABUSE\\nlast-modified:  2024-11-29T06:24:15Z\\nsource:         APNIC\\n\\nrole:           TPG Hostmaster\\naddress:        TPG Telecom Limited\\naddress:        65 Waterloo Road\\naddress:        North Ryde NSW 2113\\ncountry:        AU\\nphone:          +61 2 9850 0800\\nfax-no:         +61 2 9850 0817\\ne-mail:         hostmaster@tpgtelecom.com.au\\nremarks:        -+-+-+-+-+-+-+-+-+-+-+-++-+-+-+-+-+-+-+-+-+-+-+-+-+-+-+-+-+-+-\\nremarks:        Send all spam and abuse reports to abuse@tpg.com.au or\\nremarks:        via our web interface at the link provided below:\\nremarks:        http://www.tpg.com.au/about/enquiry.php?type=Report%20Spamming\\nremarks:        .\\nremarks:        Please include detailed information such as full message\\nremarks:        headers and times in UTC\\nremarks:        --\\nremarks:        Send all network related issues such as routing to\\nremarks:        ipnoc@tpgtelecom.com.au\\nremarks:        -+-+-+-+-+-+-+-+-+-+-+-++-+-+-+-+-+-+-+-+-+-+-+-+-+-+-+-+-+-+-\\nremarks:        Australian Internet Service Provider (ISP)\\nremarks:        http://www.tpg.com.au\\nadmin-c:        TPG3-AP\\ntech-c:         TPG2-AP\\ntech-c:         TA56-AP\\nnic-hdl:        TH178-AP\\nnotify:         hostmaster@tpgtelecom.com.au\\nmnt-by:         MAINT-AU-TPGCOM\\nlast-modified:  2024-12-23T03:41:13Z\\nsource:         APNIC"}
{"range": "112.95.212.68", "id": "PENG-BILLION-HAIR-MOLD", "name": "Peng-billion-hair-Mold, Shenzhen, Guangdong province", "country": "CN", "domain": "chinaunicom.cn", "org_id": "", "status": "ASSIGNED NON-PORTABLE", "tech_id": "CG272-AP", "mnt_id": "MAINT-CNCGROUP-GD", "admin_id": "CG272-AP", "abuse_id": "AC1718-AP", "created": "", "updated": "2023-10-21", "source": "apnic", "raw": "inetnum:        112.95.212.68 - 112.95.212.68\\nnetname:        Peng-billion-hair-Mold\\ndescr:          Peng-billion-hair-Mold, Shenzhen, Guangdong province\\ncountry:        CN\\nadmin-c:        CG272-AP\\ntech-c:         CG272-AP\\nabuse-c:        AC1718-AP\\nstatus:         ASSIGNED NON-PORTABLE\\nmnt-by:         MAINT-CNCGROUP-GD\\nmnt-irt:        IRT-CU-CN\\nlast-modified:  2023-10-21T03:37:31Z\\nsource:         APNIC\\n\\nirt:            IRT-CU-CN\\naddress:        No.21,Financial Street\\naddress:        Beijing,100033\\naddress:        P.R.China\\ne-mail:         zhaoyz3@chinaunicom.cn\\nabuse-mailbox:  zhaoyz3@chinaunicom.cn\\nadmin-c:        CH1302-AP\\ntech-c:         CH1302-AP\\nauth:           # Filtered\\nremarks:        zhaoyz3@chinaunicom.cn was validated on 2025-02-24\\nmnt-by:         MAINT-CNCGROUP\\nlast-modified:  2025-02-24T06:16:57Z\\nsource:         APNIC\\n\\nrole:           ABUSE CUCN\\ncountry:        ZZ\\naddress:        No.21,Financial Street\\naddress:        Beijing,100033\\naddress:        P.R.China\\nphone:          +000000000\\ne-mail:         zhaoyz3@chinaunicom.cn\\nadmin-c:        CH1302-AP\\ntech-c:         CH1302-AP\\nnic-hdl:        AC1718-AP\\nremarks:        Generated from irt object IRT-CU-CN\\nremarks:        zhaoyz3@chinaunicom.cn was validated on 2025-02-24\\nabuse-mailbox:  zhaoyz3@chinaunicom.cn\\nmnt-by:         APNIC-ABUSE\\nlast-modified:  2025-02-24T06:17:45Z\\nsource:         APNIC\\n\\nrole:           CNCGROUP GD\\nnic-hdl:        CG272-AP\\ne-mail:         gdipnoc@chinaunicom.cn\\naddress:        XinShiKong Plaza,No 666 Huangpu Rd. Guangzhou 510627,China\\nphone:          +86-20-22214226\\nfax-no:         +86-20-22214228\\nadmin-c:        RP181-AP\\ntech-c:         RP181-AP\\ncountry:        CN\\nmnt-by:         MAINT-CNCGROUP-GD\\nlast-modified:  2009-04-14T08:33:40Z\\nsource:         APNIC\\n\\nroute:          112.95.212.0/24\\norigin:         AS17623\\ndescr:          China Unicom B811&A1218, China Unicom No.21, Jin-Rong Street\\nmnt-by:         MAINT-CNCGROUP-RR\\nlast-modified:  2023-06-08T07:57:24Z\\nsource:         APNIC"}
{"range": "80.52.200.196/30", "id": "CUSTOMER-IDSL-134174", "name": "static IP", "country": "PL", "domain": "tpnet.pl", "org_id": "ORG-PT1-RIPE", "status": "ASSIGNED PA", "tech_id": "TPHT", "mnt_id": "TPNET", "admin_id": "TPHT", "abuse_id": "OPHT", "created": "2010-09-25", "updated": "2010-09-25", "source": "ripe", "raw": "inetnum:        80.52.200.196 - 80.52.200.199\\nnetname:        CUSTOMER-IDSL-134174\\ndescr:          static IP\\ndescr:          WIELUN\\ndescr:          POLAND\\ncountry:        PL\\nadmin-c:        TPHT\\ntech-c:         TPHT\\nstatus:         ASSIGNED PA\\nmnt-by:         TPNET\\ncreated:        2010-09-25T11:46:12Z\\nlast-modified:  2010-09-25T11:46:12Z\\nsource:         RIPE\\nabuse-email:    cert.opl@orange.com\\nabuse-c:        OPHT\\nabuse-org:      ORG-PT1-RIPE\\n\\nrole:           TP S.A. Hostmaster\\naddress:        Orange Polska S.A.\\naddress:        ul. Nowogrodzka 47A\\naddress:        00-695 Warszawa\\naddress:        Poland\\nphone:          +48 800 120810\\nphone:          +48 801 600006\\nphone:          +48 22 5039000\\nfax-no:         +48 22 6225182\\norg:            ORG-PT1-RIPE\\nadmin-c:        EHD2-RIPE\\ntech-c:         KP21-RIPE\\nnic-hdl:        TPHT\\nmnt-by:         TPNET\\ne-mail:         hostmaster@orange.com\\nabuse-mailbox:  cert.opl@orange.com\\naddress:        hostmaster@tpnet.pl 20130506\\ncreated:        2003-01-28T07:54:15Z\\nlast-modified:  2022-10-13T08:19:33Z\\nsource:         RIPE\\n\\nroute:          80.48.0.0/13\\ndescr:          TPNET\\ndescr:          for abuse: abuse@tpnet.pl\\norigin:         AS5617\\nmnt-by:         AS5617-MNT\\ncreated:        2001-12-19T13:09:18Z\\nlast-modified:  2003-03-03T11:45:11Z\\nsource:         RIPE"}
{"range": "68.251.248.240/29", "id": "SBC-68-251-248-240-29-2009145837", "name": "Private Customer - AT&T Internet Services", "country": "US", "domain": "", "org_id": "C07638874", "status": "REASSIGNMENT", "tech_id": "", "mnt_id": "", "admin_id": "", "abuse_id": "", "created": "2020-09-14", "updated": "2020-09-14", "source": "arin", "raw": "NetHandle:      NET-68-251-248-240-1\\nOrgID:          C07638874\\nParent:         NET-68-248-0-0-1\\nNetName:        SBC-68-251-248-240-29-2009145837\\nNetRange:       68.251.248.240 - 68.251.248.247\\nNetType:        reassignment\\nRegDate:        2020-09-14\\nUpdated:        2020-09-14\\nSource:         ARIN\\n\\n\\nOrgID:          C07638874\\nOrgName:        Private Customer - AT&T Internet Services\\nCanAllocate:    \\nStreet:         Private Residence\\nCity:           Richardson\\nState/Prov:     TX\\nCountry:        US\\nPostalCode:     75082\\nRegDate:        2020-09-14\\nUpdated:        2020-09-14\\nSource:         ARIN\\n"}
{"range": "12.155.80.24/29", "id": "WOODFORE21-80-24", "name": "WOODFOREST NATIONAL BANK", "country": "US", "domain": "woodforest.com", "org_id": "WNB-54", "status": "REASSIGNMENT", "tech_id": "HECKJ1-ARIN", "mnt_id": "", "admin_id": "HECKJ1-ARIN", "abuse_id": "HECKJ1-ARIN", "created": "2020-05-05", "updated": "2020-05-05", "source": "arin", "raw": "NetHandle:      NET-12-155-80-24-1\\nOrgID:          WNB-54\\nParent:         NET-12-0-0-0-1\\nNetName:        WOODFORE21-80-24\\nNetRange:       12.155.80.24 - 12.155.80.31\\nNetType:        reassignment\\nRegDate:        2020-05-05\\nUpdated:        2020-05-05\\nSource:         ARIN\\n\\n\\nOrgID:          WNB-54\\nOrgName:        WOODFOREST NATIONAL BANK\\nCanAllocate:    \\nStreet:         550 W MONTGOMERY ST\\nCity:           WILLIS\\nState/Prov:     TX\\nCountry:        US\\nPostalCode:     77378\\nRegDate:        2020-02-08\\nUpdated:        2020-02-08\\nOrgAdminHandle: HECKJ1-ARIN\\nOrgTechHandle:  HECKJ1-ARIN\\nOrgAbuseHandle: HECKJ1-ARIN\\nSource:         ARIN\\n\\n\\nPOCHandle:      HECKJ1-ARIN\\nIsRole:         N\\nLastName:       Heck\\nFirstName:      James\\nStreet:         645 PHILADELPHIA BLVD\\nCity:           ABERDEEN\\nState/Prov:     MD\\nCountry:        US\\nPostalCode:     21001\\nRegDate:        2020-02-08\\nUpdated:        2020-02-08\\nOfficePhone:    +1-832-472-2240\\nMailbox:        jheck@woodforest.com\\nSource:         ARIN\\n"}
{"range": "2a01:4f8:221:330a::/64", "id": "ZIMMERMANN-GILBERT", "name": "Zimmermann Gilbert", "country": "DE", "domain": "datazimmermann.at", "org_id": "ORG-HOA1-RIPE", "status": "ASSIGNED", "tech_id": "GZ2888-RIPE", "mnt_id": "HOS-GUN", "admin_id": "GZ2888-RIPE", "abuse_id": "HOAC1-RIPE", "created": "2023-12-16", "updated": "2023-12-16", "source": "ripe", "raw": "inet6num:       2a01:4f8:221:330a::/64\\nnetname:        ZIMMERMANN-GILBERT\\ndescr:          Zimmermann Gilbert\\ncountry:        DE\\nadmin-c:        GZ2888-RIPE\\ntech-c:         GZ2888-RIPE\\nstatus:         ASSIGNED\\nnotify:         ripe-mntner@hetzner.com\\nmnt-by:         HOS-GUN\\ncreated:        2023-12-16T02:20:47Z\\nlast-modified:  2023-12-16T02:20:47Z\\nsource:         RIPE\\nabuse-email:    abuse@hetzner.com\\nabuse-c:        HOAC1-RIPE\\nabuse-org:      ORG-HOA1-RIPE\\n\\nperson:         Gilbert Zimmermann\\naddress:        DataZimmermann\\naddress:        Unterer Aubachweg 35\\naddress:        6300 W\u00f6rgl\\naddress:        AUSTRIA\\nphone:          +436642148684\\ne-mail:         g.zimmermann@datazimmermann.at\\nnic-hdl:        GZ2888-RIPE\\nnotify:         ripe-mntner@hetzner.com\\nmnt-by:         HOS-GUN\\ncreated:        2013-07-05T04:00:26Z\\nlast-modified:  2019-02-28T19:08:24Z\\nsource:         RIPE\\n\\nroute6:         2a01:4f8::/32\\ndescr:          HETZNER-IPv6-BLK\\norigin:         AS24940\\norg:            ORG-HOA1-RIPE\\nmnt-by:         HOS-GUN\\ncreated:        2021-04-07T15:46:51Z\\nlast-modified:  2021-04-07T15:46:51Z\\nsource:         RIPE\\n\\norganisation:   ORG-HOA1-RIPE\\norg-name:       Hetzner Online GmbH\\ncountry:        DE\\norg-type:       LIR\\naddress:        Industriestrasse 25\\naddress:        D-91710\\naddress:        Gunzenhausen\\naddress:        GERMANY\\nphone:          +49 9831 5050\\nfax-no:         +49 9831 5053\\ne-mail:         info@hetzner.de\\nadmin-c:        MF1400-RIPE\\nadmin-c:        GM834-RIPE\\nadmin-c:        HOAC1-RIPE\\nadmin-c:        MH375-RIPE\\nadmin-c:        SK2374-RIPE\\nadmin-c:        SK8441-RIPE\\nabuse-c:        HOAC1-RIPE\\nmnt-ref:        RIPE-NCC-HM-MNT\\nmnt-ref:        HOS-GUN\\nmnt-by:         RIPE-NCC-HM-MNT\\nmnt-by:         HOS-GUN\\ncreated:        2004-04-17T11:07:58Z\\nlast-modified:  2022-11-22T18:32:44Z\\nsource:         RIPE"}
{"range": "81.72.75.240/29", "id": "TIWS-37361301", "name": "PROVINCIA DI CREMONA", "country": "IT", "domain": "interbusiness.it", "org_id": "ORG-TIWS1-RIPE", "status": "ASSIGNED PA", "tech_id": "NT1116-RIPE", "mnt_id": "TIWS-MNT", "admin_id": "NT1116-RIPE", "abuse_id": "ACT359-RIPE", "created": "2003-02-03", "updated": "2005-09-20", "source": "ripe", "raw": "inetnum:        81.72.75.240 - 81.72.75.247\\nnetname:        TIWS-37361301\\ndescr:          PROVINCIA DI CREMONA\\ncountry:        IT\\nadmin-c:        NT1116-RIPE\\ntech-c:         NT1116-RIPE\\nstatus:         ASSIGNED PA\\nremarks:        ************************************************\\nremarks:        Pay attention\\nremarks:        Any communication sent to email different\\nremarks:        from the following will be ignored!\\nremarks:        Any abuse reports, please send them to\\nremarks:        abuse@business.telecomitalia.it\\nremarks:        ************************************************\\nmnt-by:         TIWS-MNT\\ncreated:        2003-02-03T14:12:39Z\\nlast-modified:  2005-09-20T10:33:32Z\\nsource:         RIPE\\nabuse-email:    abuse@retail.telecomitalia.it\\nabuse-c:        ACT359-RIPE\\nabuse-org:      ORG-TIWS1-RIPE\\n\\nperson:         NetEconomy TI\\naddress:        Via Val Cannuta, 250\\naddress:        00100 Roma Italy\\nphone:          +39-06-36881\\nnic-hdl:        NT1116-RIPE\\ncreated:        2001-12-14T22:41:31Z\\nlast-modified:  2013-03-19T14:25:11Z\\nsource:         RIPE\\nmnt-by:         TIWS-MNT\\n\\nroute:          81.72.0.0/16\\ndescr:          INTERBUSINESS\\norigin:         AS3269\\nnotify:         network@cgi.interbusiness.it\\nmnt-by:         INTERB-MNT\\ncreated:        2002-01-22T07:43:12Z\\nlast-modified:  2002-01-22T07:43:12Z\\nsource:         RIPE"}
{"range": "64.24.69.138/31", "id": "64-24-69-138", "name": "PILKINGTON NORTH AMERICA", "country": "US", "domain": "pilkington.com", "org_id": "C08736408", "status": "REASSIGNMENT", "tech_id": "", "mnt_id": "", "admin_id": "", "abuse_id": "", "created": "2022-07-09", "updated": "2022-07-09", "source": "arin", "raw": "NetHandle:      NET-64-24-69-138-1\\nOrgID:          C08736408\\nParent:         NET-64-24-0-0-1\\nNetName:        64-24-69-138\\nNetRange:       64.24.69.138 - 64.24.69.139\\nNetType:        reassignment\\nOriginAS:       11349\\nRegDate:        2022-07-09\\nUpdated:        2022-07-09\\nSource:         ARIN\\n\\n\\nOrgID:          C08736408\\nOrgName:        PILKINGTON NORTH AMERICA\\nCanAllocate:    \\nStreet:         510  WINDY POINT DR\\nCity:           GLENDALE HEIGHTS\\nState/Prov:     IL\\nCountry:        US\\nPostalCode:     60139-2178\\nRegDate:        2022-07-09\\nUpdated:        2022-07-09\\nSource:         ARIN\\n"}
{"range": "2a00:2381:a9d7::/56", "id": "BTNET-CUSTOMER", "name": "FTIP008290281 IP MASTER", "country": "GB", "domain": "bt.com", "org_id": "ORG-BT4-RIPE", "status": "ASSIGNED", "tech_id": "BY73-RIPE", "mnt_id": "BTNET-MNT", "admin_id": "BY73-RIPE", "abuse_id": "BTCR3-RIPE", "created": "2024-04-23", "updated": "2024-04-23", "source": "ripe", "raw": "inet6num:       2a00:2381:a9d7::/56\\nnetname:        BTNET-CUSTOMER\\ndescr:          FTIP008290281 IP MASTER\\ncountry:        GB\\nadmin-c:        BY73-RIPE\\ntech-c:         BY73-RIPE\\nstatus:         ASSIGNED\\nmnt-by:         BTNET-MNT\\nmnt-lower:      BTNET-MNT\\nmnt-routes:     BTNET-MNT\\nremarks:        Please send abuse notification to btnet.abuse@bt.com\\nremarks:        Please send delisting issues to ip.address.management.account@bt.com\\nremarks:        Please send delisting issues to ip.address.management.account@bt.com\\nremarks:        This range is statically assigned\\ncreated:        2024-04-23T11:05:21Z\\nlast-modified:  2024-04-23T11:05:21Z\\nsource:         RIPE\\nabuse-email:    protect@bt.com\\nabuse-c:        BTCR3-RIPE\\nabuse-org:      ORG-BT4-RIPE\\n\\nperson:         IP MASTER TEAM\\naddress:        pp HWG298\\naddress:        Virtual Postbox (HOM-NX)\\naddress:        PO Box 400\\naddress:        London\\naddress:        N18 1XU\\naddress:        UK\\nphone:          +448000850223\\nnic-hdl:        BY73-RIPE\\nmnt-by:         BTNET-MNT\\nremarks:        Please send abuse notification to btnet.abuse@bt.com\\ncreated:        2009-11-09T08:39:01Z\\nlast-modified:  2023-03-07T12:38:29Z\\nsource:         RIPE\\n\\nroute6:         2a00:2380::/25\\ndescr:          BT UK aggregate\\norigin:         AS2856\\nmnt-by:         CIP-MNT\\nmnt-by:         BTNET-MNT\\nmnt-by:         BTENT-MNT\\ncreated:        2013-11-18T09:53:59Z\\nlast-modified:  2013-11-18T09:53:59Z\\nsource:         RIPE"}
{"range": "195.215.250.128/30", "id": "STATOIL-NET-SITE-27", "name": "Statoil", "country": "DK", "domain": "tdc.dk", "org_id": "ORG-TD1-RIPE", "status": "ASSIGNED PA", "tech_id": "PEJ1-RIPE", "mnt_id": "TDK-MNT", "admin_id": "PEJ1-RIPE", "abuse_id": "TDCA2-RIPE", "created": "1970-01-01", "updated": "2005-03-22", "source": "ripe", "raw": "inetnum:        195.215.250.128 - 195.215.250.131\\nnetname:        STATOIL-NET-SITE-27\\ndescr:          Statoil\\ndescr:          Aalborgvej 241\\ndescr:          9690 Fjerritslev\\ncountry:        DK\\nadmin-c:        PEJ1-RIPE\\ntech-c:         PEJ1-RIPE\\nstatus:         ASSIGNED PA\\nmnt-by:         TDK-MNT\\ncreated:        1970-01-01T00:00:00Z\\nlast-modified:  2005-03-22T14:25:17Z\\nsource:         RIPE\\n\\nperson:         Poul Erik Jensen\\naddress:        Statoil\\naddress:        Aalborgvej 241\\naddress:        9690 Fjerritslev\\naddress:        DK\\nphone:          +45 98211280\\nnic-hdl:        PEJ1-RIPE\\nmnt-by:         TDK-MNT\\nmnt-by:         DKNET-MNT\\ncreated:        2001-10-01T17:13:11Z\\nlast-modified:  2001-10-01T17:13:11Z\\nsource:         RIPE\\n\\nroute:          195.215.0.0/16\\ndescr:          Tele Danmark\\norigin:         AS3292\\nremarks:        +---------------------------------------+\\nremarks:        | For abuse and security issues please |\\nremarks:        | see http://postmaster.tdc.dk or |\\nremarks:        | contact postmaster@abuse.mail.dk |\\nremarks:        +---------------------------------------+\\nmnt-by:         AS3292-MNT\\ncreated:        2002-07-30T18:29:18Z\\nlast-modified:  2010-10-28T13:04:08Z\\nsource:         RIPE"}
{"range": "62.242.141.16/28", "id": "TDC-BREDBAANDSADSL-PROF-NET", "name": "TDC Bredbaand Professional users", "country": "DK", "domain": "tdc.dk", "org_id": "ORG-TD1-RIPE", "status": "ASSIGNED PA", "tech_id": "AS5071-RIPE", "mnt_id": "TDK-MNT", "admin_id": "AS5071-RIPE", "abuse_id": "TDCA2-RIPE", "created": "2003-11-17", "updated": "2003-12-04", "source": "ripe", "raw": "inetnum:        62.242.141.16 - 62.242.141.31\\nnetname:        TDC-BREDBAANDSADSL-PROF-NET\\ndescr:          TDC Bredbaand Professional users\\ncountry:        DK\\nremarks:        +---------------------------------------+\\nremarks:        | For abuse and security issues contact |\\nremarks:        | csirt@csirt.dk, http://www.csirt.dk |\\nremarks:        +---------------------------------------+\\nremarks:        RIPE-update project Dec 2003 (Morten Madsen)\\nadmin-c:        AS5071-RIPE\\ntech-c:         AS5071-RIPE\\nstatus:         ASSIGNED PA\\nmnt-by:         TDK-MNT\\ncreated:        2003-11-17T05:28:28Z\\nlast-modified:  2003-12-04T22:26:38Z\\nsource:         RIPE\\nabuse-email:    postmaster@abuse.mail.dk\\nabuse-c:        TDCA2-RIPE\\nabuse-org:      ORG-TD1-RIPE\\n\\nrole:           AS3292 Staff\\naddress:        TDC A/S\\naddress:        Sletvej 30, 8-062\\naddress:        DK-8310 Tranbjerg\\naddress:        Denmark\\ne-mail:         staff@eng.tdc.net\\nremarks:        contact info: http://as3292.peeringdb.com\\nadmin-c:        NCB1-RIPE\\nadmin-c:        MBP137-RIPE\\ntech-c:         NCB1-RIPE\\ntech-c:         CP11490-RIPE\\ntech-c:         MBP137-RIPE\\nnotify:         staff@eng.tdc.net\\nnic-hdl:        AS5071-RIPE\\nmnt-by:         AS3292-MNT\\ncreated:        2002-07-02T13:36:00Z\\nlast-modified:  2024-05-21T09:07:14Z\\nsource:         RIPE\\n\\nroute:          62.242.0.0/15\\ndescr:          TDC Tele Danmark\\norigin:         AS3292\\nremarks:        +---------------------------------------+\\nremarks:        | For abuse and security issues please |\\nremarks:        | see http://postmaster.tdc.dk or |\\nremarks:        | contact postmaster@abuse.mail.dk |\\nremarks:        +---------------------------------------+\\nnotify:         notify@ip.tele.dk\\nmnt-by:         AS3292-MNT\\ncreated:        2002-07-30T18:28:38Z\\nlast-modified:  2010-10-28T13:04:08Z\\nsource:         RIPE"}
{"range": "94.92.6.24/29", "id": "GEMEAZCUSINRISTORAZIONESRL", "name": "GEMEAZ CUSIN RISTORAZIONE SRL", "country": "IT", "domain": "telecomitalia.it", "org_id": "ORG-IA34-RIPE", "status": "ASSIGNED PA", "tech_id": "EM204-RIPE", "mnt_id": "INTERB-MNT", "admin_id": "EM204-RIPE", "abuse_id": "ABT49-RIPE", "created": "2009-03-25", "updated": "2020-04-09", "source": "ripe", "raw": "inetnum:        94.92.6.24 - 94.92.6.31\\nnetname:        GEMEAZCUSINRISTORAZIONESRL\\ndescr:          GEMEAZ CUSIN RISTORAZIONE SRL\\ncountry:        IT\\nadmin-c:        EM204-RIPE\\ntech-c:         EM204-RIPE\\nstatus:         ASSIGNED PA\\nmnt-by:         INTERB-MNT\\nnotify:         datacomnet@telecomitalia.it\\ncreated:        2009-03-25T20:07:24Z\\nlast-modified:  2020-04-09T13:36:45Z\\nsource:         RIPE\\nabuse-email:    abuse@business.telecomitalia.it\\nabuse-c:        ABT49-RIPE\\nabuse-org:      ORG-IA34-RIPE\\n\\nperson:         ELISA MAIOCCHI\\naddress:        GEMEAZ CUSIN RISTORAZIONE SRL\\naddress:        VIALE FAMAGOSTA 75\\naddress:        20100 MILANO\\naddress:        Italy\\nphone:          +39281881599\\nfax-no:         +39281881607\\nnic-hdl:        EM204-RIPE\\ncreated:        2009-07-02T19:07:27Z\\nlast-modified:  2020-06-04T03:29:01Z\\nsource:         RIPE\\nmnt-by:         INTERB-MNT\\n\\nroute:          94.92.0.0/16\\ndescr:          INTERBUSINESS\\norigin:         AS3269\\nremarks:        ************************************************\\nremarks:        * Pay attention *\\nremarks:        * Any communication sent to email different *\\nremarks:        * from the following will be ignored! *\\nremarks:        * Any abuse reports, please send them to *\\nremarks:        * abuse@business.telecomitalia.it *\\nremarks:        ************************************************\\nnotify:         datacomnet@telecomitalia.it\\nmnt-by:         INTERB-MNT\\ncreated:        2009-03-05T09:20:45Z\\nlast-modified:  2017-07-17T12:38:30Z\\nsource:         RIPE"}
{"range": "82.132.13.120/29", "id": "CARNET-PSKULJEVCICA", "name": "Podrucna skola Kuljevcica", "country": "HR", "domain": "carnet.hr", "org_id": "ORG-CAAR1-RIPE", "status": "ASSIGNED PA", "tech_id": "CIA22-RIPE", "mnt_id": "CARNET-MNT", "admin_id": "CIA22-RIPE", "abuse_id": "CN1130-RIPE", "created": "2020-11-23", "updated": "2020-11-23", "source": "ripe", "raw": "inetnum:        82.132.13.120 - 82.132.13.127\\nnetname:        CARNET-PSKULJEVCICA\\ndescr:          Podrucna skola Kuljevcica\\ndescr:          Jerovec 197, 42240 Ivanec\\ncountry:        HR\\nadmin-c:        CIa22-RIPE\\ntech-c:         CIa22-RIPE\\nstatus:         ASSIGNED PA\\nmnt-by:         CARNET-MNT\\nmnt-by:         AS2108-MNT\\ncreated:        2020-11-23T08:14:04Z\\nlast-modified:  2020-11-23T08:14:04Z\\nsource:         RIPE\\nabuse-email:    abuse@carnet.hr\\nabuse-c:        CN1130-RIPE\\nabuse-org:      ORG-CAaR1-RIPE\\n\\nrole:           CARNet IP administrator\\naddress:        CARNet\\naddress:        J.Marohnica 5\\naddress:        10000 Zagreb\\naddress:        Croatia\\nabuse-mailbox:  abuse@carnet.hr\\ne-mail:         ripe@carnet.hr\\nadmin-c:        IV762-RIPE\\nadmin-c:        DK2798-RIPE\\ntech-c:         IV762-RIPE\\ntech-c:         DK2798-RIPE\\nnic-hdl:        CIa22-RIPE\\nmnt-by:         AS2108-MNT\\ncreated:        2010-05-24T12:50:34Z\\nlast-modified:  2010-05-24T12:50:34Z\\nsource:         RIPE\\n\\nroute:          82.132.0.0/17\\ndescr:          CARNET\\norigin:         AS2108\\nmnt-by:         AS2108-MNT\\nmnt-by:         CARNET-MNT\\ncreated:        2018-11-19T14:19:25Z\\nlast-modified:  2018-11-19T14:19:51Z\\nsource:         RIPE"}
{"range": "99.187.160.160/29", "id": "SBC-99-187-160-160-29-0808052445", "name": "BRAUMS ICE CRM DAIRY-080805212410", "country": "US", "domain": "", "org_id": "C02006942", "status": "REASSIGNMENT", "tech_id": "", "mnt_id": "", "admin_id": "", "abuse_id": "", "created": "2008-08-05", "updated": "2018-01-10", "source": "arin", "raw": "NetHandle:      NET-99-187-160-160-1\\nOrgID:          C02006942\\nParent:         NET-99-181-128-0-1\\nNetName:        SBC-99-187-160-160-29-0808052445\\nNetRange:       99.187.160.160 - 99.187.160.167\\nNetType:        reassignment\\nRegDate:        2008-08-05\\nUpdated:        2018-01-10\\nSource:         ARIN\\n\\n\\nOrgID:          C02006942\\nOrgName:        BRAUMS ICE CRM DAIRY-080805212410\\nCanAllocate:    \\nStreet:         Private Address\\nCity:           Plano\\nState/Prov:     TX\\nCountry:        US\\nPostalCode:     75075\\nRegDate:        2008-08-05\\nUpdated:        2018-07-19\\nSource:         ARIN\\n"}
{"range": "2a01:4f8:252:568::/64", "id": "HOS-583385", "name": "HOS-583385", "country": "DE", "domain": "hetzner.de", "org_id": "ORG-HOA1-RIPE", "status": "ASSIGNED", "tech_id": "HOAC1-RIPE", "mnt_id": "HOS-GUN", "admin_id": "HOAC1-RIPE", "abuse_id": "HOAC1-RIPE", "created": "2025-03-18", "updated": "2025-03-18", "source": "ripe", "raw": "inet6num:       2a01:4f8:252:568::/64\\nnetname:        HOS-583385\\ndescr:          HOS-583385\\ncountry:        DE\\nadmin-c:        HOAC1-RIPE\\ntech-c:         HOAC1-RIPE\\nstatus:         ASSIGNED\\nnotify:         ripe-mntner@hetzner.com\\nmnt-by:         HOS-GUN\\ncreated:        2025-03-18T02:25:56Z\\nlast-modified:  2025-03-18T02:25:56Z\\nsource:         RIPE\\nabuse-email:    abuse@hetzner.com\\nabuse-c:        HOAC1-RIPE\\nabuse-org:      ORG-HOA1-RIPE\\n\\nrole:           Hetzner Online GmbH - Contact Role\\naddress:        Hetzner Online GmbH\\naddress:        Industriestrasse 25\\naddress:        D-91710 Gunzenhausen\\naddress:        Germany\\nphone:          +49 9831 505-0\\nfax-no:         +49 9831 505-3\\ne-mail:         ripe@hetzner.com\\nabuse-mailbox:  abuse@hetzner.com\\nremarks:        *************************************************\\nremarks:        * For spam/abuse/security issues please contact *\\nremarks:        * abuse@hetzner.com, or fill out the form at *\\nremarks:        * abuse.hetzner.com, thank you. *\\nremarks:        *************************************************\\nremarks:        \\nremarks:        *************************************************\\nremarks:        * Any questions on Peering please send to *\\nremarks:        * peering@hetzner.com *\\nremarks:        *************************************************\\norg:            ORG-HOA1-RIPE\\nadmin-c:        MH375-RIPE\\ntech-c:         GM834-RIPE\\ntech-c:         SK2374-RIPE\\ntech-c:         MF1400-RIPE\\ntech-c:         SK8441-RIPE\\ntech-c:         DD15478-RIPE\\nnic-hdl:        HOAC1-RIPE\\nnotify:         ripe-mntner@hetzner.com\\nmnt-by:         HOS-GUN\\ncreated:        2004-08-12T09:40:20Z\\nlast-modified:  2022-11-22T18:33:55Z\\nsource:         RIPE\\n\\nroute6:         2a01:4f8::/32\\ndescr:          HETZNER-IPv6-BLK\\norigin:         AS24940\\norg:            ORG-HOA1-RIPE\\nmnt-by:         HOS-GUN\\ncreated:        2021-04-07T15:46:51Z\\nlast-modified:  2021-04-07T15:46:51Z\\nsource:         RIPE\\n\\norganisation:   ORG-HOA1-RIPE\\norg-name:       Hetzner Online GmbH\\ncountry:        DE\\norg-type:       LIR\\naddress:        Industriestrasse 25\\naddress:        D-91710\\naddress:        Gunzenhausen\\naddress:        GERMANY\\nphone:          +49 9831 5050\\nfax-no:         +49 9831 5053\\ne-mail:         info@hetzner.de\\nadmin-c:        MF1400-RIPE\\nadmin-c:        GM834-RIPE\\nadmin-c:        HOAC1-RIPE\\nadmin-c:        MH375-RIPE\\nadmin-c:        SK2374-RIPE\\nadmin-c:        SK8441-RIPE\\nabuse-c:        HOAC1-RIPE\\nmnt-ref:        RIPE-NCC-HM-MNT\\nmnt-ref:        HOS-GUN\\nmnt-by:         RIPE-NCC-HM-MNT\\nmnt-by:         HOS-GUN\\ncreated:        2004-04-17T11:07:58Z\\nlast-modified:  2022-11-22T18:32:44Z\\nsource:         RIPE\\nabuse-email:    abuse@hetzner.com\\nabuse-c:        HOAC1-RIPE\\nabuse-org:      undefined"}
{"range": "92.240.236.164", "id": "SK-VNET", "name": "VNET a.s.", "country": "SK", "domain": "vnet.sk", "org_id": "ORG-VA31548-RIPE", "status": "ASSIGNED PA", "tech_id": "VN666-RIPE", "mnt_id": "VNET-MNT", "admin_id": "VN666-RIPE", "abuse_id": "VA36263-RIPE", "created": "2024-01-24", "updated": "2024-01-24", "source": "ripe", "raw": "inetnum:        92.240.236.164 - 92.240.236.164\\nnetname:        SK-VNET\\ndescr:          VNET a.s.\\ncountry:        SK\\norg:            ORG-VA31548-RIPE\\nadmin-c:        VN666-RIPE\\ntech-c:         VN666-RIPE\\nstatus:         ASSIGNED PA\\nmnt-by:         VNET-MNT\\ncreated:        2024-01-24T12:28:10Z\\nlast-modified:  2024-01-24T12:28:10Z\\nsource:         RIPE\\nabuse-email:    92.240.236.164@abuse.vnet.sk\\nabuse-c:        VA36263-RIPE\\nabuse-org:      ORG-VA31548-RIPE\\n\\norganisation:   ORG-VA31548-RIPE\\norg-name:       VNET-org-92.240.236.164\\norg-type:       OTHER\\naddress:        Cernysevskeho 48\\naddress:        Bratislava\\naddress:        851 01 Slovakia\\nabuse-c:        VA36263-RIPE\\ne-mail:         92.240.236.164@abuse.vnet.sk\\nmnt-by:         VNET-MNT\\nmnt-ref:        VNET-MNT\\ncreated:        2024-01-24T12:28:10Z\\nlast-modified:  2024-01-24T12:28:10Z\\nsource:         RIPE\\n\\nperson:         Vojtech Nemeth\\naddress:        VNET a.s.\\naddress:        Nam. Hraniciarov 39\\naddress:        Bratislava\\naddress:        85103\\naddress:        Slovakia\\nphone:          +421 2 5292 6151\\nfax-no:         +421 2 5296 3540\\ne-mail:         abuse@vnet.sk\\nnic-hdl:        VN666-RIPE\\nmnt-by:         VNET-MNT\\ncreated:        2003-07-16T19:00:18Z\\nlast-modified:  2018-02-27T12:25:39Z\\nsource:         RIPE\\n\\nroute:          92.240.236.0/24\\norigin:         AS29405\\nmnt-by:         VNET-MNT\\ncreated:        2021-08-17T12:16:37Z\\nlast-modified:  2022-11-11T09:58:30Z\\nsource:         RIPE"}
{"range": "60.191.243.160/29", "id": "YONGKANG-ZHU-WENBING", "name": "Zhu Wenbing", "country": "CN", "domain": "hz.zj.cn", "org_id": "", "status": "ASSIGNED NON-PORTABLE", "tech_id": "CJ54-AP", "mnt_id": "MAINT-CN-CHINANET-ZJ-JH", "admin_id": "ZW2272-AP", "abuse_id": "AC1602-AP", "created": "", "updated": "2021-06-24", "source": "apnic", "raw": "inetnum:        60.191.243.160 - 60.191.243.167\\nnetname:        YONGKANG-ZHU-WENBING\\ndescr:          Zhu Wenbing\\ndescr:          null\\ncountry:        CN\\nadmin-c:        ZW2272-AP\\ntech-c:         CJ54-AP\\nabuse-c:        AC1602-AP\\nstatus:         ASSIGNED NON-PORTABLE\\nmnt-by:         MAINT-CN-CHINANET-ZJ-JH\\nmnt-irt:        IRT-CHINANET-ZJ\\nlast-modified:  2021-06-24T07:42:40Z\\nsource:         APNIC\\n\\nirt:            IRT-CHINANET-ZJ\\naddress:        Hangzhou, 288 fucun Road, China\\ne-mail:         antispam_zjnoc@163.com\\nabuse-mailbox:  antispam_zjnoc@163.com\\nadmin-c:        CZ61-AP\\ntech-c:         CZ61-AP\\nauth:           # Filtered\\nremarks:        antispam_zjnoc@163.com was validated on 2024-10-17\\nmnt-by:         MAINT-CHINANET-ZJ\\nlast-modified:  2024-10-17T07:16:43Z\\nsource:         APNIC\\n\\nrole:           ABUSE CHINANETZJ\\ncountry:        ZZ\\naddress:        Hangzhou, 288 fucun Road, China\\nphone:          +000000000\\ne-mail:         antispam_zjnoc@163.com\\nadmin-c:        CZ61-AP\\ntech-c:         CZ61-AP\\nnic-hdl:        AC1602-AP\\nremarks:        Generated from irt object IRT-CHINANET-ZJ\\nremarks:        antispam_zjnoc@163.com was validated on 2024-10-17\\nabuse-mailbox:  antispam_zjnoc@163.com\\nmnt-by:         APNIC-ABUSE\\nlast-modified:  2024-10-17T07:18:12Z\\nsource:         APNIC\\n\\nrole:           CHINANET-ZJ Jinhua\\naddress:        No.155 Xishi street,Jinhua,Zhejiang.321000\\ncountry:        CN\\nphone:          +86-579-2300779\\nfax-no:         +86-579-2330035\\ne-mail:         antispam_jh@zjnoc.hz.zj.cn\\nremarks:        send spam reports to antispam_jh@zjnoc.hz.zj.cn\\nremarks:        and abuse reports to antispam_jh@zjnoc.hz.zj.cn\\nremarks:        Please include detailed information and times in UTC\\nadmin-c:        CH55-AP\\ntech-c:         CH55-AP\\nnic-hdl:        CJ54-AP\\nmnt-by:         MAINT-CHINANET-ZJ\\nlast-modified:  2020-06-03T08:38:41Z\\nsource:         APNIC\\n\\nperson:         Zhu Wenbing\\nnic-hdl:        ZW2272-AP\\ne-mail:         anti_spam@mail.jhptt.zj.cn\\naddress:        Lizhou Road No.50,Yongkang,Jinhua,Zhejiang.Postcode:321300\\nphone:          +86-15267933777\\ncountry:        CN\\nmnt-by:         MAINT-CN-CHINANET-ZJ-JH\\nlast-modified:  2014-01-16T16:26:02Z\\nsource:         APNIC"}
{"range": "87.213.213.184/29", "id": "VERSATEL-CUST-OS-221437-A-1", "name": "OS-221437#A#1", "country": "NL", "domain": "odido.nl", "org_id": "ORG-TNB2-RIPE", "status": "ASSIGNED PA", "tech_id": "VT1029-RIPE", "mnt_id": "VERSANIS-MNT", "admin_id": "VT1029-RIPE", "abuse_id": "AR16288-RIPE", "created": "2015-05-18", "updated": "2015-05-18", "source": "ripe", "raw": "inetnum:        87.213.213.184 - 87.213.213.191\\nnetname:        VERSATEL-CUST-OS-221437-A-1\\ndescr:          OS-221437\\ncountry:        NL\\nadmin-c:        VT1029-RIPE\\ntech-c:         VT1029-RIPE\\nstatus:         ASSIGNED PA\\nmnt-by:         VERSANIS-MNT\\nnotify:         AMS-RIPE-HOSTMASTER@tele2.com\\ncreated:        2015-05-18T12:42:29Z\\nlast-modified:  2015-05-18T12:42:29Z\\nsource:         RIPE\\nabuse-email:    abuse@odido.nl\\nabuse-c:        AR16288-RIPE\\nabuse-org:      ORG-TNb2-RIPE\\n\\nrole:           ODIDO AS13127 HOSTMASTER\\nremarks:        AS13127 is an Odido AS number\\naddress:        Waldorpstraat 60\\naddress:        2521 CC\\naddress:        The Hague\\naddress:        The Netherlands\\ne-mail:         AMS-RIPE-HOSTMASTER@odido.nl\\nadmin-c:        RH3392-RIPE\\nadmin-c:        MK24957-RIPE\\nadmin-c:        DG12330-RIPE\\nadmin-c:        TB9837-RIPE\\nadmin-c:        BB12660-RIPE\\nadmin-c:        SP19295-RIPE\\ntech-c:         DG12330-RIPE\\ntech-c:         MK24957-RIPE\\ntech-c:         BB12660-RIPE\\ntech-c:         RH3392-RIPE\\ntech-c:         JB6646-RIPE\\ntech-c:         TB9837-RIPE\\ntech-c:         SP19295-RIPE\\nnic-hdl:        VT1029-RIPE\\nremarks:        This is the Odido AS13127 hostmaster role\\nremarks:        Please direct all queries to this role and *not* to person objects\\nnotify:         AMS-RIPE-HOSTMASTER@odido.nl\\nabuse-mailbox:  abuse@odido.nl\\nremarks:        abuse-mailbox: abuse@odido.nl\\nmnt-by:         AS13127-MNT\\ncreated:        2002-05-23T12:58:47Z\\nlast-modified:  2024-12-02T12:16:19Z\\nsource:         RIPE\\n\\nroute:          87.213.0.0/16\\ndescr:          Consumer 3p Services\\norigin:         AS13127\\nmnt-by:         AS13127-MNT\\nmnt-by:         MNT-TMONL\\ncreated:        2021-04-29T05:03:33Z\\nlast-modified:  2021-04-29T05:03:33Z\\nsource:         RIPE"}
{"range": "2a09:4c0:fe0:403::/64", "id": "TW-C10553-20240725", "name": "SecurebitTunnelBrokerService", "country": "TW", "domain": "securebit.ch", "org_id": "ORG-SA4302-RIPE", "status": "ASSIGNED", "tech_id": "SBTC-RIPE", "mnt_id": "SBMT", "admin_id": "SBAC-RIPE", "abuse_id": "SBAM-RIPE", "created": "2024-07-25", "updated": "2024-07-25", "source": "ripe", "raw": "inet6num:       2a09:4c0:fe0:403::/64\\nnetname:        TW-C10553-20240725\\ndescr:          SecurebitTunnelBrokerService\\ncountry:        TW\\nadmin-c:        SBAC-RIPE\\ntech-c:         SBTC-RIPE\\nstatus:         ASSIGNED\\nremarks:        NetworkC10553T17909\\nmnt-by:         SBMT\\ncreated:        2024-07-25T05:00:31Z\\nlast-modified:  2024-07-25T05:00:31Z\\nsource:         RIPE\\nabuse-email:    abuse@securebit.ch\\nabuse-c:        SBAM-RIPE\\nabuse-org:      ORG-SA4302-RIPE\\n\\nrole:           Securebit Administrative Contact\\naddress:        Securebit AG\\naddress:        Industriestrasse 3\\naddress:        6345 Neuheim\\naddress:        Switzerland\\ne-mail:         info@securebit.ch\\norg:            ORG-SA4302-RIPE\\nadmin-c:        KBPS\\ntech-c:         KBPS\\nnic-hdl:        SBAC-RIPE\\nmnt-by:         SBMT\\ncreated:        2017-12-12T10:44:51Z\\nlast-modified:  2019-04-04T04:04:09Z\\nsource:         RIPE\\n\\nrole:           Securebit Technical Contact\\naddress:        Securebit AG\\naddress:        Industriestrasse 3\\naddress:        6345 Neuheim\\naddress:        Switzerland\\ne-mail:         info@securebit.ch\\norg:            ORG-SA4302-RIPE\\nadmin-c:        KBPS\\ntech-c:         KBPS\\nnic-hdl:        SBTC-RIPE\\nmnt-by:         SBMT\\ncreated:        2017-12-12T10:46:29Z\\nlast-modified:  2019-04-04T04:04:09Z\\nsource:         RIPE\\n\\nroute6:         2a09:4c0:fe0::/44\\ndescr:          Securebit Tunnelbroker United States\\norigin:         AS58057\\nmnt-by:         SBMT\\ncreated:        2020-12-12T12:18:16Z\\nlast-modified:  2020-12-12T12:18:16Z\\nsource:         RIPE"}
{"range": "99.59.155.48/29", "id": "SBC-99-59-155-48-29-2304103247", "name": "Private Customer - AT&T Internet Services", "country": "US", "domain": "", "org_id": "C09366981", "status": "REASSIGNMENT", "tech_id": "", "mnt_id": "", "admin_id": "", "abuse_id": "", "created": "2023-04-10", "updated": "2023-04-10", "source": "arin", "raw": "NetHandle:      NET-99-59-155-48-1\\nOrgID:          C09366981\\nParent:         NET-99-10-64-0-1\\nNetName:        SBC-99-59-155-48-29-2304103247\\nNetRange:       99.59.155.48 - 99.59.155.55\\nNetType:        reassignment\\nRegDate:        2023-04-10\\nUpdated:        2023-04-10\\nSource:         ARIN\\n\\n\\nOrgID:          C09366981\\nOrgName:        Private Customer - AT&T Internet Services\\nCanAllocate:    \\nStreet:         Private Residence\\nCity:           Richardson\\nState/Prov:     TX\\nCountry:        US\\nPostalCode:     75082\\nRegDate:        2023-04-10\\nUpdated:        2023-04-10\\nSource:         ARIN\\n"}
{"range": "40.128.14.218/31", "id": "40-128-14-218", "name": "ALERIS LIFE (EXPEDIENT DATACENTER)", "country": "US", "domain": "", "org_id": "C11010154", "status": "REASSIGNMENT", "tech_id": "", "mnt_id": "", "admin_id": "", "abuse_id": "", "created": "2024-11-07", "updated": "2024-11-07", "source": "arin", "raw": "NetHandle:      NET-40-128-14-218-1\\nOrgID:          C11010154\\nParent:         NET-40-128-0-0-1\\nNetName:        40-128-14-218\\nNetRange:       40.128.14.218 - 40.128.14.219\\nNetType:        reassignment\\nOriginAS:       11349\\nRegDate:        2024-11-07\\nUpdated:        2024-11-07\\nSource:         ARIN\\n\\n\\nOrgID:          C11010154\\nOrgName:        ALERIS LIFE (EXPEDIENT DATACENTER)\\nCanAllocate:    \\nStreet:         5700  INNOVATION DR\\nCity:           DUBLIN\\nState/Prov:     OH\\nCountry:        US\\nPostalCode:     43016-3271\\nRegDate:        2024-11-07\\nUpdated:        2024-11-07\\nSource:         ARIN\\n"}
{"range": "81.119.153.169", "id": "MPI-DST-D-G-PERSONALEDELLASCUO", "name": "MPI-DST-D.G.PERSONALEDELLASCUO", "country": "IT", "domain": "telecomitalia.it", "org_id": "ORG-TID1-RIPE", "status": "ASSIGNED PA", "tech_id": "SF1059-RIPE", "mnt_id": "TIG-MNT", "admin_id": "SF1059-RIPE", "abuse_id": "ABT49-RIPE", "created": "2003-10-16", "updated": "2010-08-02", "source": "ripe", "raw": "inetnum:        81.119.153.169 - 81.119.153.169\\nnetname:        MPI-DST-D-G-PERSONALEDELLASCUO\\ndescr:          MPI-DST-D.G.PERSONALEDELLASCUO\\ncountry:        IT\\nadmin-c:        SF1059-RIPE\\ntech-c:         SF1059-RIPE\\nstatus:         ASSIGNED PA\\nmnt-by:         TIG-MNT\\nnotify:         order.manager@telecomitalia.it\\ncreated:        2003-10-16T14:46:31Z\\nlast-modified:  2010-08-02T12:43:16Z\\nsource:         RIPE\\nabuse-email:    abuse@business.telecomitalia.it\\nabuse-c:        ABT49-RIPE\\nabuse-org:      ORG-TID1-RIPE\\n\\nperson:         Salvatore Ferraro\\naddress:        COMUNE DI TERRASINI\\naddress:        VIALE CONSIGLIO SNC\\naddress:        90049 TERRASINI\\naddress:        Italy\\nphone:          +39 0918681266\\nfax-no:         +39 0918681266\\nnic-hdl:        SF1059-RIPE\\ncreated:        2003-07-24T09:05:49Z\\nlast-modified:  2020-06-04T06:20:14Z\\nsource:         RIPE\\nmnt-by:         INTERB-MNT\\n\\nroute:          81.119.0.0/16\\ndescr:          DATACOM\\ndescr:          INTERBUSINESS\\norigin:         AS20959\\nremarks:        ************************************************\\nremarks:        * Pay attention *\\nremarks:        * Any communication sent to email different *\\nremarks:        * from the following will be ignored! *\\nremarks:        * Any abuse reports, please send them to *\\nremarks:        * abuse@business.telecomitalia.it *\\nremarks:        ************************************************\\nnotify:         datacomnet@telecomitalia.it\\nmnt-by:         TIG-MNT\\ncreated:        2003-05-23T13:38:29Z\\nlast-modified:  2017-07-17T09:40:27Z\\nsource:         RIPE"}
{"range": "27.33.22.40/30", "id": "TPGINTERNETPTYLTD", "name": "TPG Internet Pty Ltd.", "country": "AU", "domain": "tpg.com.au", "org_id": "", "status": "ASSIGNED NON-PORTABLE", "tech_id": "TH178-AP", "mnt_id": "MAINT-AU-TPGCOM", "admin_id": "TH178-AP", "abuse_id": "AT937-AP", "created": "", "updated": "2022-01-20", "source": "apnic", "raw": "inetnum:        27.33.22.40 - 27.33.22.43\\nnetname:        TPGInternetPtyLtd\\ndescr:          TPG Internet Pty Ltd.\\ncountry:        AU\\nadmin-c:        TH178-AP\\ntech-c:         TH178-AP\\nabuse-c:        AT937-AP\\nstatus:         ASSIGNED NON-PORTABLE\\nmnt-by:         MAINT-AU-TPGCOM\\nmnt-irt:        IRT-TPGCOM-AU\\nlast-modified:  2022-01-20T05:26:32Z\\nsource:         APNIC\\n\\nirt:            IRT-TPGCOM-AU\\naddress:        TPG Internet Pty Ltd.\\naddress:        (Part of the Total Peripherals Group)\\naddress:        65 Waterloo Road\\naddress:        North Ryde NSW 2113\\ne-mail:         hostmaster@tpgtelecom.com.au\\nabuse-mailbox:  hostmaster@tpgtelecom.com.au\\nadmin-c:        TH178-AP\\ntech-c:         TH178-AP\\nauth:           # Filtered\\nremarks:        hostmaster@tpgtelecom.com.au was validated on 2024-11-29\\nmnt-by:         MAINT-AU-TPGCOM\\nlast-modified:  2024-11-29T06:23:17Z\\nsource:         APNIC\\n\\nrole:           ABUSE TPGCOMAU\\ncountry:        ZZ\\naddress:        TPG Internet Pty Ltd.\\naddress:        (Part of the Total Peripherals Group)\\naddress:        65 Waterloo Road\\naddress:        North Ryde NSW 2113\\nphone:          +000000000\\ne-mail:         hostmaster@tpgtelecom.com.au\\nadmin-c:        TH178-AP\\ntech-c:         TH178-AP\\nnic-hdl:        AT937-AP\\nremarks:        Generated from irt object IRT-TPGCOM-AU\\nremarks:        hostmaster@tpgtelecom.com.au was validated on 2024-11-29\\nabuse-mailbox:  hostmaster@tpgtelecom.com.au\\nmnt-by:         APNIC-ABUSE\\nlast-modified:  2024-11-29T06:24:15Z\\nsource:         APNIC\\n\\nrole:           TPG Hostmaster\\naddress:        TPG Telecom Limited\\naddress:        65 Waterloo Road\\naddress:        North Ryde NSW 2113\\ncountry:        AU\\nphone:          +61 2 9850 0800\\nfax-no:         +61 2 9850 0817\\ne-mail:         hostmaster@tpgtelecom.com.au\\nremarks:        -+-+-+-+-+-+-+-+-+-+-+-++-+-+-+-+-+-+-+-+-+-+-+-+-+-+-+-+-+-+-\\nremarks:        Send all spam and abuse reports to abuse@tpg.com.au or\\nremarks:        via our web interface at the link provided below:\\nremarks:        http://www.tpg.com.au/about/enquiry.php?type=Report%20Spamming\\nremarks:        .\\nremarks:        Please include detailed information such as full message\\nremarks:        headers and times in UTC\\nremarks:        --\\nremarks:        Send all network related issues such as routing to\\nremarks:        ipnoc@tpgtelecom.com.au\\nremarks:        -+-+-+-+-+-+-+-+-+-+-+-++-+-+-+-+-+-+-+-+-+-+-+-+-+-+-+-+-+-+-\\nremarks:        Australian Internet Service Provider (ISP)\\nremarks:        http://www.tpg.com.au\\nadmin-c:        TPG3-AP\\ntech-c:         TPG2-AP\\ntech-c:         TA56-AP\\nnic-hdl:        TH178-AP\\nnotify:         hostmaster@tpgtelecom.com.au\\nmnt-by:         MAINT-AU-TPGCOM\\nlast-modified:  2024-12-23T03:41:13Z\\nsource:         APNIC"}
{"range": "2600:5c00:4ef5::/48", "id": "DSR-FIBER", "name": "DSR FIBER", "country": "US", "domain": "", "org_id": "C08745002", "status": "REASSIGNMENT", "tech_id": "", "mnt_id": "", "admin_id": "", "abuse_id": "", "created": "2022-07-13", "updated": "2022-07-13", "source": "arin", "raw": "V6NetHandle:    NET6-2600-5C00-4EF5-1\\nOrgID:          C08745002\\nParent:         NET6-2600-5C00-1\\nNetName:        DSR-FIBER\\nNetRange:       2600:5C00:4EF5:: - 2600:5C00:4EF5:FFFF:FFFF:FFFF:FFFF:FFFF\\nNetType:        reassignment\\nRegDate:        2022-07-13\\nUpdated:        2022-07-13\\nSource:         ARIN\\n\\n\\nOrgID:          C08745002\\nOrgName:        DSR FIBER\\nCanAllocate:    \\nStreet:         2851 E EASTLAND CENTER DR\\nCity:           WEST COVINA\\nState/Prov:     CA\\nCountry:        US\\nPostalCode:     91791\\nRegDate:        2022-07-13\\nUpdated:        2022-07-13\\nSource:         ARIN\\n"}
{"range": "88.61.158.120/29", "id": "AUTORICAMBIVANNIDIVANNIRCPSAS", "name": "AUTORICAMBI VANNI DI VANNI R.C. & P. SAS", "country": "IT", "domain": "telecomitalia.it", "org_id": "ORG-IA34-RIPE", "status": "ASSIGNED PA", "tech_id": "RV3477-RIPE", "mnt_id": "INTERB-MNT", "admin_id": "RV3477-RIPE", "abuse_id": "ABT49-RIPE", "created": "2007-10-23", "updated": "2007-11-04", "source": "ripe", "raw": "inetnum:        88.61.158.120 - 88.61.158.127\\nnetname:        AUTORICAMBIVANNIDIVANNIRCPSAS\\ndescr:          AUTORICAMBI VANNI DI VANNI R.C. & P. SAS\\ncountry:        IT\\nadmin-c:        RV3477-RIPE\\ntech-c:         RV3477-RIPE\\nstatus:         ASSIGNED PA\\nmnt-by:         INTERB-MNT\\nnotify:         order.manager2@telecomitalia.it\\ncreated:        2007-10-23T19:02:38Z\\nlast-modified:  2007-11-04T06:02:33Z\\nsource:         RIPE\\nabuse-email:    abuse@business.telecomitalia.it\\nabuse-c:        ABT49-RIPE\\nabuse-org:      ORG-IA34-RIPE\\n\\nperson:         RICCARDO VANNI\\naddress:        AUTORICAMBI VANNI DI VANNI R.C. & P. SAS\\naddress:        VIA SCANSANESE 33\\naddress:        58100 GROSSETO\\naddress:        Italy\\nphone:          +39056423331\\nfax-no:         +390564415664\\nnic-hdl:        RV3477-RIPE\\ncreated:        2007-11-04T06:02:32Z\\nlast-modified:  2020-06-03T16:23:50Z\\nsource:         RIPE\\nmnt-by:         INTERB-MNT\\n\\nroute:          88.61.0.0/16\\ndescr:          INTERBUSINESS\\norigin:         AS3269\\nremarks:        ************************************************\\nremarks:        * Pay attention *\\nremarks:        * Any communication sent to email different *\\nremarks:        * from the following will be ignored! *\\nremarks:        * Any abuse reports, please send them to *\\nremarks:        * abuse@business.telecomitalia.it *\\nremarks:        ************************************************\\nnotify:         datacomnet@telecomitalia.it\\nmnt-by:         INTERB-MNT\\ncreated:        2007-06-11T07:41:34Z\\nlast-modified:  2017-07-17T12:44:16Z\\nsource:         RIPE"}
{"range": "208.124.198.216/29", "id": "ARTS-MARKETING", "name": "ARTS MARKETING 333 BLOOR", "country": "CA", "domain": "", "org_id": "C02257995", "status": "REASSIGNMENT", "tech_id": "", "mnt_id": "", "admin_id": "", "abuse_id": "", "created": "2009-06-23", "updated": "2009-06-23", "source": "arin", "raw": "NetHandle:      NET-208-124-198-216-1\\nOrgID:          C02257995\\nParent:         NET-208-124-128-0-1\\nNetName:        ARTS-MARKETING\\nNetRange:       208.124.198.216 - 208.124.198.223\\nNetType:        reassignment\\nRegDate:        2009-06-23\\nUpdated:        2009-06-23\\nSource:         ARIN\\n\\n\\nOrgID:          C02257995\\nOrgName:        ARTS MARKETING 333 BLOOR\\nCanAllocate:    \\nStreet:         260 KING ST\\nCity:           TORONTO\\nState/Prov:     ON\\nCountry:        CA\\nPostalCode:     M5A-4L5\\nRegDate:        2009-06-23\\nUpdated:        2017-01-06\\nSource:         ARIN\\n"}
{"range": "193.130.123.0/28", "id": "NUIL", "name": "Norwich Union Insurance Limited", "country": "GB", "domain": "norwich-union.co.uk", "org_id": "ORG-UA24-RIPE", "status": "ASSIGNED PA", "tech_id": "JY40-RIPE", "mnt_id": "AS1849-MNT", "admin_id": "SG1270-RIPE", "abuse_id": "AVE253-RIPE", "created": "1970-01-01", "updated": "2001-09-21", "source": "ripe", "raw": "inetnum:        193.130.123.0 - 193.130.123.15\\nnetname:        NUIL\\ndescr:          Norwich Union Insurance Limited\\ncountry:        GB\\nadmin-c:        SG1270-RIPE\\ntech-c:         JY40-RIPE\\nstatus:         ASSIGNED PA\\nmnt-by:         AS1849-MNT\\ncreated:        1970-01-01T00:00:00Z\\nlast-modified:  2001-09-21T22:14:43Z\\nsource:         RIPE\\nabuse-email:    abuse.emea@verizon.com\\nabuse-c:        AVE253-RIPE\\nabuse-org:      ORG-UA24-RIPE\\n\\nperson:         Jeremy Youngman\\naddress:        Norwich Union Insurance Limited\\naddress:        40 Barnard Road\\naddress:        Bowthorpe\\naddress:        Norwich\\naddress:        Norfolk\\naddress:        NR5 9JB\\naddress:        UK\\nphone:          +44 1603 686258\\nfax-no:         +44 1603 680637\\ne-mail:         webmaster@norwich-union.co.uk\\nnic-hdl:        JY40-RIPE\\nmnt-by:         AS1849-MNT\\ncreated:        1970-01-01T00:00:00Z\\nlast-modified:  2001-09-22T00:46:14Z\\nsource:         RIPE\\n\\nperson:         Sarah Green\\naddress:        Norwich Union Insurance Limited\\naddress:        Group Internet Project\\naddress:        25-27 Surrey Street (Floor 4)\\naddress:        PO Box 4\\naddress:        Norwich\\naddress:        NR1 3NG\\naddress:        UK\\nphone:          +44 1603 681445\\nfax-no:         +44 1603 681348\\ne-mail:         webmaster@norwich-union.co.uk\\nnic-hdl:        SG1270-RIPE\\nmnt-by:         AS1849-MNT\\ncreated:        1970-01-01T00:00:00Z\\nlast-modified:  2001-09-22T00:46:14Z\\nsource:         RIPE\\n\\nroute:          193.130.64.0/18\\ndescr:          UK PA route\\norigin:         AS702\\nmember-of:      AS702:RS-UK\\nmember-of:      AS702:RS-UK-PA\\ninject:         upon static\\naggr-mtd:       outbound\\nmnt-by:         WCOM-EMEA-RICE-MNT\\ncreated:        2018-04-16T14:25:12Z\\nlast-modified:  2018-04-16T14:25:12Z\\nsource:         RIPE"}
{"range": "2001:41f0:7000::/48", "id": "DIOCON_INGENIEURS_BV", "name": "Diocon Ingenieurs Bv", "country": "NL", "domain": "diocon.nl", "org_id": "ORG-BA22-RIPE", "status": "ASSIGNED", "tech_id": "ZBTB1-RIPE", "mnt_id": "ZIGGO-AUTOREG1", "admin_id": "DD13559-RIPE", "abuse_id": "ZBBS1-RIPE", "created": "2018-04-18", "updated": "2018-04-18", "source": "ripe", "raw": "inet6num:       2001:41f0:7000::/48\\nnetname:        DIOCON_INGENIEURS_BV\\ndescr:          Diocon Ingenieurs Bv\\ndescr:          Limmen\\ndescr:          This space is statically assigned.\\ncountry:        NL\\nadmin-c:        DD13559-RIPE\\ntech-c:         ZBTB1-RIPE\\nstatus:         ASSIGNED\\nmnt-by:         ZIGGO-AUTOREG1\\ncreated:        2018-04-18T12:35:24Z\\nlast-modified:  2018-04-18T12:35:24Z\\nsource:         RIPE\\nabuse-email:    abuse@ziggo.nl\\nabuse-c:        ZBBS1-RIPE\\nabuse-org:      ORG-BA22-RIPE\\n\\nrole:           VODAFONEZIGGO IP AUTHORITY\\naddress:        Kabelweg 51\\naddress:        1014BA Amsterdam\\naddress:        The Netherlands\\nphone:          +31887170000\\ne-mail:         ip-admin@vodafoneziggo.com\\nadmin-c:        ZIPA1-RIPE\\ntech-c:         MB5261-RIPE\\ntech-c:         BH4773-RIPE\\nnic-hdl:        ZBTB1-RIPE\\nnotify:         ip-admin@vodafoneziggo.com\\nabuse-mailbox:  abuse@ziggo.nl\\nmnt-by:         ZIGGO-MNT\\ncreated:        2009-05-28T09:33:44Z\\nlast-modified:  2023-06-26T14:01:22Z\\nsource:         RIPE\\n\\nperson:         D Dol\\naddress:        Rijksweg 102\\naddress:        1906 BK Limmen\\ne-mail:         dd@diocon.nl\\nphone:          +31653892987\\nmnt-by:         ZIGGO-AUTOREG1\\ncreated:        2018-04-18T12:35:23Z\\nlast-modified:  2018-04-18T12:35:23Z\\nsource:         RIPE\\nnic-hdl:        DD13559-RIPE\\n\\nroute6:         2001:41f0::/33\\ndescr:          VODAFONE_ZIGGO\\norigin:         AS33915\\nnotify:         ripe-mnt@as9143.net\\nmnt-by:         TNF-MNT\\nmnt-by:         ZIGGO-RTRMGMT\\ncreated:        2018-05-22T08:31:15Z\\nlast-modified:  2020-09-14T08:22:41Z\\nsource:         RIPE"}
{"range": "63.200.40.144/29", "id": "SBCIS74217", "name": "Asian Inc", "country": "US", "domain": "", "org_id": "C00051551", "status": "REASSIGNMENT", "tech_id": "", "mnt_id": "", "admin_id": "", "abuse_id": "", "created": "1999-12-25", "updated": "1999-12-25", "source": "arin", "raw": "NetHandle:      NET-63-200-40-144-1\\nOrgID:          C00051551\\nParent:         NET-63-192-0-0-1\\nNetName:        SBCIS74217\\nNetRange:       63.200.40.144 - 63.200.40.151\\nNetType:        reassignment\\nRegDate:        1999-12-25\\nUpdated:        1999-12-25\\nSource:         ARIN\\n\\n\\nOrgID:          C00051551\\nOrgName:        Asian Inc\\nCanAllocate:    \\nStreet:         1670 Pine\\nCity:           San Francisco\\nState/Prov:     CA\\nCountry:        US\\nPostalCode:     94109\\nRegDate:        1999-12-25\\nUpdated:        2018-07-19\\nSource:         ARIN\\n"}
{"range": "2001:920:3066::/48", "id": "NET-GB-REGUS-MANAGEMENT", "name": "Regus Management", "country": "GB", "domain": "therowansscotland.com", "org_id": "ORG-CI9-RIPE", "status": "ASSIGNED", "tech_id": "SK11718-RIPE", "mnt_id": "COLT-UK", "admin_id": "SK11718-RIPE", "abuse_id": "CHM4-RIPE", "created": "2016-03-31", "updated": "2016-03-31", "source": "ripe", "raw": "inet6num:       2001:920:3066::/48\\nnetname:        NET-GB-REGUS-MANAGEMENT\\ndescr:          Regus Management\\ncountry:        GB\\nadmin-c:        SK11718-RIPE\\ntech-c:         SK11718-RIPE\\nstatus:         ASSIGNED\\nmnt-by:         COLT-UK\\ncreated:        2016-03-31T11:43:28Z\\nlast-modified:  2016-03-31T11:43:28Z\\nsource:         RIPE\\nabuse-email:    abuse@colt.net\\nabuse-c:        CHM4-RIPE\\nabuse-org:      ORG-CI9-RIPE\\n\\nperson:         STEVE KEELING\\naddress:        Regus Management\\naddress:        1 WEST GARDEN PLACE\\naddress:        London, W2 2AQ, United Kingdom\\nphone:          +44 7795665432\\nnic-hdl:        SK11718-RIPE\\nmnt-by:         COLT-UK\\ncreated:        2016-03-31T11:43:28Z\\nlast-modified:  2016-03-31T11:43:28Z\\nsource:         RIPE\\n\\nroute6:         2001:920::/32\\ndescr:          COLT IPv6 network\\norigin:         AS8220\\nnotify:         ipv6@colt.net\\nmnt-by:         DE-COLT-MNT\\ncreated:        2005-01-26T08:51:59Z\\nlast-modified:  2005-01-26T08:51:59Z\\nsource:         RIPE"}
{"range": "194.206.177.236", "id": "FR-PHARMACIE-PEYROUX--LB_INTERNET", "name": "OBS Customer", "country": "FR", "domain": "orange-business.com", "org_id": "ORG-OBS3-RIPE", "status": "ASSIGNED PA", "tech_id": "AA2914-RIPE", "mnt_id": "PC80199-MNT", "admin_id": "AA2914-RIPE", "abuse_id": "BRX1-RIPE", "created": "2009-04-10", "updated": "2021-11-07", "source": "ripe", "raw": "inetnum:        194.206.177.236 - 194.206.177.236\\nnetname:        FR-PHARMACIE-PEYROUX--LB_INTERNET\\ncountry:        FR\\nadmin-c:        AA2914-RIPE\\ntech-c:         AA2914-RIPE\\nstatus:         ASSIGNED PA\\ndescr:          OBS Customer\\nmnt-by:         PC80199-MNT\\ncreated:        2009-04-10T08:58:12Z\\nlast-modified:  2021-11-07T05:07:06Z\\nsource:         RIPE\\nabuse-email:    gestionip.ft@orange.com\\nabuse-c:        BRX1-RIPE\\nabuse-org:      ORG-FT2-RIPE\\n\\nrole:           Administration Adresses\\nremarks:        Internet Support Center\\naddress:        Orange Business Services\\naddress:        6 avenue Albert Durand\\naddress:        31700 Blagnac France\\nphone:          +33969397520\\ne-mail:         gestip.rain@orange.com\\nabuse-mailbox:  abuse.orange-business@orange.com\\nnic-hdl:        AA2914-RIPE\\nremarks:        http://www.orange-business.com\\nmnt-by:         RAIN-TRANSPAC\\ncreated:        2004-03-12T12:24:14Z\\nlast-modified:  2024-11-26T14:37:29Z\\nsource:         RIPE\\n\\nroute:          194.206.0.0/16\\ndescr:          RAIN\\ndescr:          Reseaux d'Acces a l'INternet\\nremarks:        -------------------------------------------\\nremarks:        For Hacking, Spamming or Security problems\\nremarks:        send mail to abuse.orange-business@orange.com\\nremarks:        -------------------------------------------\\norigin:         AS3215\\nmnt-by:         RAIN-TRANSPAC\\norg:            ORG-OBS3-RIPE\\ncreated:        1970-01-01T00:00:00Z\\nlast-modified:  2024-11-26T14:33:50Z\\nsource:         RIPE\\n\\norganisation:   ORG-OBS3-RIPE\\norg-name:       Orange Business Services\\norg-type:       Other\\naddress:        6 avenue Albert Durand\\naddress:        31700 Blagnac France\\ne-mail:         gestip.rain@orange.com\\nremarks:        **************************************\\nremarks:        * Pour les obligations legale *\\nremarks:        * Contacter uniquement les poles OL *\\nremarks:        * de France Telecom/Orange *\\nremarks:        * *\\nremarks:        * For legal issus joint only *\\nremarks:        * France telecom/orange legal team *\\nremarks:        **************************************\\nadmin-c:        AA2914-RIPE\\ntech-c:         AA2914-RIPE\\nabuse-c:        AA2914-RIPE\\nmnt-ref:        OLEANE-NOC\\nmnt-ref:        FT-BRX\\nmnt-ref:        RAIN-TRANSPAC\\nmnt-ref:        RIPE-NCC-HM-MNT\\nmnt-by:         RAIN-TRANSPAC\\ncreated:        2010-11-08T15:39:40Z\\nlast-modified:  2017-10-30T14:39:03Z\\nsource:         RIPE"}
{"range": "68.20.135.240/29", "id": "SBC068020135240020806", "name": "NORHTSIDE CYLCLES", "country": "US", "domain": "", "org_id": "C00353435", "status": "REASSIGNMENT", "tech_id": "", "mnt_id": "", "admin_id": "", "abuse_id": "", "created": "2002-08-07", "updated": "2002-08-07", "source": "arin", "raw": "NetHandle:      NET-68-20-135-240-1\\nOrgID:          C00353435\\nParent:         NET-68-20-0-0-1\\nNetName:        SBC068020135240020806\\nNetRange:       68.20.135.240 - 68.20.135.247\\nNetType:        reassignment\\nRegDate:        2002-08-07\\nUpdated:        2002-08-07\\nSource:         ARIN\\n\\n\\nOrgID:          C00353435\\nOrgName:        NORHTSIDE CYLCLES\\nCanAllocate:    \\nStreet:         2701 West 15th Street PMB 236\\nCity:           PLANO\\nState/Prov:     TX\\nCountry:        US\\nPostalCode:     75075\\nRegDate:        2002-08-07\\nUpdated:        2018-07-19\\nSource:         ARIN\\n"}
{"range": "194.84.98.196/30", "id": "KATREN-OMSK02-GW01", "name": "(NS000638J) KATREN", "country": "RU", "domain": "katren.ru", "org_id": "ORG-GORC1-RIPE", "status": "ASSIGNED PA", "tech_id": "NOK22-RIPE", "mnt_id": "ROSPRINT-NCC", "admin_id": "NOK22-RIPE", "abuse_id": "AR16895-RIPE", "created": "2024-09-13", "updated": "2024-09-13", "source": "ripe", "raw": "inetnum:        194.84.98.196 - 194.84.98.199\\nnetname:        KATREN-OMSK02-GW01\\ndescr:          (NS000638J) KATREN\\ncountry:        RU\\nadmin-c:        NOK22-RIPE\\ntech-c:         NOK22-RIPE\\nstatus:         ASSIGNED PA\\nmnt-by:         ROSPRINT-NCC\\ncreated:        2024-09-13T10:44:02Z\\nlast-modified:  2024-09-13T10:44:02Z\\nsource:         RIPE\\nabuse-email:    rus-hd@orange.com\\nabuse-c:        AR16895-RIPE\\nabuse-org:      ORG-GORC1-RIPE\\n\\nperson:         NOC of KATREN\\naddress:        Russia\\naddress:        Novosibirsk Region, Koltsovo Workmen's Settlement\\naddress:        Prospekt Akademika Sandakhchiyeva, Building 11\\nphone:          +7 383 227 7118\\nfax-no:         +7 383 227 7118\\ne-mail:         noc@katren.ru\\nnic-hdl:        NOK22-RIPE\\nmnt-by:         ROSPRINT-NCC\\ncreated:        2024-09-13T10:44:02Z\\nlast-modified:  2024-09-13T10:44:02Z\\nsource:         RIPE\\n\\nroute:          194.84.0.0/16\\ndescr:          RU-ROSPRINT BLOCK\\norigin:         AS2854\\nmnt-by:         ROSPRINT-NCC\\ncreated:        1970-01-01T00:00:00Z\\nlast-modified:  2001-09-22T09:32:08Z\\nsource:         RIPE"}
{"range": "12.17.157.192/29", "id": "VCOM-SOL23-157-192", "name": "VCOM SOLUTIONS-LAM RESEARCH", "country": "US", "domain": "", "org_id": "VSR-22", "status": "REASSIGNMENT", "tech_id": "OPSEB24325-ARIN", "mnt_id": "", "admin_id": "OPSEB24325-ARIN", "abuse_id": "OPSEB24325-ARIN", "created": "2020-07-11", "updated": "2020-07-11", "source": "arin", "raw": "NetHandle:      NET-12-17-157-192-1\\nOrgID:          VSR-22\\nParent:         NET-12-17-156-0-1\\nNetName:        VCOM-SOL23-157-192\\nNetRange:       12.17.157.192 - 12.17.157.199\\nNetType:        reassignment\\nRegDate:        2020-07-11\\nUpdated:        2020-07-11\\nSource:         ARIN\\n\\n\\nOrgID:          VSR-22\\nOrgName:        VCOM SOLUTIONS-LAM RESEARCH\\nCanAllocate:    \\nStreet:         4650 CUSHING PKWY\\nCity:           FMT\\nState/Prov:     CA\\nCountry:        US\\nPostalCode:     94538\\nRegDate:        2019-08-07\\nUpdated:        2019-08-07\\nOrgAdminHandle: OPSEB24325-ARIN\\nOrgTechHandle:  OPSEB24325-ARIN\\nOrgAbuseHandle: OPSEB24325-ARIN\\nSource:         ARIN\\n\\n\\nPOCHandle:      OPSEB24325-ARIN\\nIsRole:         N\\nLastName:       Ops\\nFirstName:      EBM\\nStreet:         2900 W PLANO PKWY\\nCity:           PLANO\\nState/Prov:     TX\\nCountry:        US\\nPostalCode:     75075\\nRegDate:        2019-08-07\\nUpdated:        2019-08-07\\nOfficePhone:    +1-855-277-8686\\nMailbox:        dl-ebm_sd@att.com\\nSource:         ARIN\\n"}
{"range": "190.215.50.168/29", "id": "ADR", "name": "Direccion General Del Personal De La Armada", "country": "CL", "domain": "grupogtd.com", "org_id": "", "status": "REALLOCATED", "tech_id": "ADR", "mnt_id": "", "admin_id": "", "abuse_id": "ADR", "created": "2014-04-22", "updated": "2014-04-22", "source": "lacnic", "raw": "inetnum:     190.215.50.168/29\\nstatus:      reallocated\\nowner:       Direccion General Del Personal De La Armada\\nownerid:     CL-DGPL-LACNIC\\nresponsible: John Jessop Del Canto\\naddress:     Moneda, , \\naddress:      - Santiago - \\ncountry:     CL\\nphone:       +56 02 1234567 []\\nowner-c:     ADR\\ntech-c:      ADR\\nabuse-c:     ADR\\ncreated:     20140422\\nchanged:     20140422\\ninetnum-up:  190.215.0/17\\n\\nnic-hdl:     ADR\\nperson:      Administrador de Red\\ne-mail:      netadmin@GRUPOGTD.COM\\naddress:     Moneda, 920, Piso 11\\naddress:     6500712 - Santiago - RM\\ncountry:     CL\\nphone:       +56 2 4139742 []\\ncreated:     20020930\\nchanged:     20190211"}
{"range": "81.221.23.32/29", "id": "SOFTXS-G-CH-NET", "name": "SoftXS  GmBH, Zug", "country": "CH", "domain": "softxs.ch", "org_id": "ORG-GCA1-RIPE", "status": "ASSIGNED PA", "tech_id": "HES12-RIPE", "mnt_id": "CH-GREEN-MNT", "admin_id": "AH2967-RIPE", "abuse_id": "ACGA1-RIPE", "created": "2005-07-29", "updated": "2011-07-14", "source": "ripe", "raw": "inetnum:        81.221.23.32 - 81.221.23.39\\nnetname:        SOFTXS-G-CH-NET\\ndescr:          SoftXS GmBH, Zug\\ncountry:        CH\\nadmin-c:        AH2967-RIPE\\ntech-c:         HES12-RIPE\\nstatus:         ASSIGNED PA\\nmnt-by:         CH-GREEN-MNT\\ncreated:        2005-07-29T15:05:47Z\\nlast-modified:  2011-07-14T18:52:25Z\\nsource:         RIPE\\nabuse-email:    abuse@green.ch\\nabuse-c:        ACGA1-RIPE\\nabuse-org:      ORG-GCA1-RIPE\\n\\nrole:           Hostmaster green.ch AG\\naddress:        green.ch AG Industriestrasse 33 CH-5242 Lupfig Schweiz\\nphone:          +41 56 460 23 23\\nfax-no:         +41 56 460 23 00\\ne-mail:         noc@green.ch\\nremarks:        ****************************************\\nremarks:        General Contacts\\nremarks:        \\nremarks:        Information: info@green.ch\\nremarks:        Sales: sales@green.ch\\nremarks:        ****************************************\\nremarks:        Technical Contacts\\nremarks:        \\nremarks:        Network: noc@green.ch\\nremarks:        Peering: peering@green.ch\\nremarks:        ****************************************\\nremarks:        AS1836 BGP4 Looking Glass\\nremarks:        \\nremarks:        http://lg.ch.as1836.net\\nremarks:        ****************************************\\nadmin-c:        RB9527-RIPE\\ntech-c:         LS16114-RIPE\\ntech-c:         RB9527-RIPE\\nnic-hdl:        HES12-RIPE\\nmnt-by:         AS1836-MNT\\ncreated:        2002-07-18T12:29:27Z\\nlast-modified:  2024-07-15T13:12:20Z\\nsource:         RIPE\\n\\nperson:         Alan Hodkinson\\naddress:        SoftXS GMBH\\naddress:        Alpenstr. 14\\naddress:        6300 Zug\\naddress:        Switzerland\\ne-mail:         alan@softxs.ch\\nphone:          +41794321014\\nnic-hdl:        AH2967-RIPE\\ncreated:        2005-07-29T15:03:55Z\\nlast-modified:  2020-06-04T10:53:54Z\\nsource:         RIPE\\nmnt-by:         CH-GREEN-MNT\\n\\nroute:          81.221.0.0/16\\ndescr:          green.ch ag, Lupfig, Switzerland\\norigin:         AS1836\\nmnt-by:         AS1836-MNT\\ncreated:        2008-11-19T07:33:46Z\\nlast-modified:  2024-04-04T09:46:27Z\\nsource:         RIPE"}
{"range": "2a02:1630:ca00:156::/64", "id": "TWT-CUST-P-53834", "name": "Z1 SRL", "country": "IT", "domain": "twt.it", "org_id": "ORG-TWTS1-RIPE", "status": "ASSIGNED", "tech_id": "TCR5-RIPE", "mnt_id": "IT-TWT-MNT", "admin_id": "ZS1560-RIPE", "abuse_id": "TCR5-RIPE", "created": "2017-02-15", "updated": "2017-02-15", "source": "ripe", "raw": "inet6num:       2a02:1630:ca00:156::/64\\nnetname:        TWT-CUST-P-53834\\ndescr:          Z1 SRL\\ncountry:        IT\\nadmin-c:        ZS1560-RIPE\\ntech-c:         TCR5-RIPE\\nstatus:         ASSIGNED\\nmnt-by:         IT-TWT-MNT\\ncreated:        2017-02-15T16:24:50Z\\nlast-modified:  2017-02-15T16:24:50Z\\nsource:         RIPE\\nabuse-email:    abuse@twt.it\\nabuse-c:        TCR5-RIPE\\nabuse-org:      ORG-TWTS1-RIPE\\n\\nrole:           TWT Contact Role\\naddress:        TWT S.p.A.\\naddress:        viale jenner 33\\naddress:        20139 Milano\\naddress:        Italy\\nphone:          +39 02 890891\\nfax-no:         +39 02 89089211\\ne-mail:         ripe@twt.it\\nabuse-mailbox:  abuse@twt.it\\nadmin-c:        MR3040-RIPE\\ntech-c:         FA558-RIPE\\ntech-c:         BT538-RIPE\\nnic-hdl:        TCR5-RIPE\\nremarks:        +------------------------------------------------------\\nremarks:        | |\\nremarks:        | PLEASE CONTACT OUR ABUSE DIVISION (abuse@twt.it) |\\nremarks:        | FOR ABUSE and-or SPAM COMPLAINTS. |\\nremarks:        | |\\nremarks:        | Please note that all complaints regarding abuse which|\\nremarks:        | are sent to other email addresses WILL BE IGNORED! |\\nremarks:        | |\\nremarks:        +------------------------------------------------------\\nnotify:         ripe@twt.it\\nmnt-by:         IT-TWT-MNT\\ncreated:        2003-11-21T13:20:05Z\\nlast-modified:  2020-06-30T14:43:45Z\\nsource:         RIPE\\n\\nperson:         Z1 SRL\\naddress:        GIACOMO\\naddress:        XXV APRILE\\naddress:        ERBA\\naddress:        Italy\\nphone:          +390331651844\\nnic-hdl:        ZS1560-RIPE\\nmnt-by:         IT-TWT-MNT\\ncreated:        2017-02-15T16:24:50Z\\nlast-modified:  2017-02-15T16:24:50Z\\nsource:         RIPE\\n\\nroute6:         2a02:1630::/32\\ndescr:          TWT IPV6-route object 2a02:1630\\norigin:         AS30848\\nmnt-by:         IT-TWT-MNT\\ncreated:        2012-11-05T15:09:55Z\\nlast-modified:  2012-11-05T15:09:55Z\\nsource:         RIPE"}
{"range": "202.179.190.128/28", "id": "TDS-JKT-CLOUD-37", "name": "PT Telemedia Dinamika Sarana", "country": "ID", "domain": "tds.net.id", "org_id": "", "status": "ASSIGNED NON-PORTABLE", "tech_id": "TDS2-AP", "mnt_id": "MAINT-ID-TDS", "admin_id": "TDS2-AP", "abuse_id": "IRT-TDS-ID", "created": "", "updated": "2018-10-26", "source": "apnic", "raw": "inetnum:        202.179.190.128 - 202.179.190.143\\nnetname:        TDS-JKT-CLOUD-37\\ndescr:          PT Telemedia Dinamika Sarana\\ncountry:        ID\\nadmin-c:        TDS2-AP\\ntech-c:         TDS2-AP\\nstatus:         ASSIGNED NON-PORTABLE\\nmnt-by:         MAINT-ID-TDS\\nmnt-irt:        IRT-TDS-ID\\nlast-modified:  2018-10-26T04:36:24Z\\nsource:         APNIC\\n\\nirt:            IRT-TDS-ID\\naddress:        PT Telemedia Dinamika Sarana\\naddress:        Komplek Perkantoran PGN Gedung C Lantai 1\\naddress:        Jl. KH Zainul Arifin No. 20 Krukut\\naddress:        Taman Sari Jakarta, 11140\\ne-mail:         noc@gasnet.id\\nabuse-mailbox:  abuse@tds.net.id\\nadmin-c:        TDS2-AP\\ntech-c:         TDS2-AP\\nauth:           # Filtered\\nmnt-by:         MAINT-ID-TDS\\nlast-modified:  2023-11-29T02:50:13Z\\nsource:         APNIC\\n\\nrole:           TDS-NET NOC\\naddress:        NOC PT. Telemedia Dinamika Sarana\\naddress:        Perkantoran Nias Raya\\naddress:        Jl. Pelepah Elok I /GN1/27 Kelapa Gading Jakarta 14241\\ncountry:        ID\\nphone:          +62-21-4507447\\nfax-no:         +62-21-45850470\\ne-mail:         noc@tds.net.id\\nadmin-c:        WAB2-AP\\ntech-c:         IKR2-AP\\nnic-hdl:        TDS2-AP\\nmnt-by:         MAINT-ID-TDS\\nlast-modified:  2010-02-16T08:38:01Z\\nsource:         APNIC\\n\\nroute:          202.179.184.0/21\\ndescr:          Route Object of PT. Telemedia Dinamika Sarana\\ndescr:          Jakarta\\ncountry:        ID\\norigin:         AS38750\\nnotify:         hostmaster@idnic.net\\nmnt-by:         MAINT-ID-TDS\\nlast-modified:  2008-09-04T07:55:25Z\\nsource:         APNIC\\n\\ninetnum:        202.179.190.0 - 202.179.190.255\\nnetname:        TDS-JKT-23\\ndescr:          PT Telemedia Dinamika Sarana\\ncountry:        ID\\nadmin-c:        TDS2-AP\\ntech-c:         TDS2-AP\\nstatus:         ASSIGNED NON-PORTABLE\\nremarks:        Send Spam & Abuse report to: abuse@tds.net.id\\nmnt-by:         MAINT-ID-TDS\\nmnt-irt:        IRT-TDS-ID\\nlast-modified:  2015-08-10T10:00:01Z\\nsource:         IDNIC\\n\\nirt:            IRT-TDS-ID\\naddress:        PT Telemedia Dinamika Sarana\\naddress:        Komplek Perkantoran PGN Gedung C Lantai 1\\naddress:        Jl. KH Zainul Arifin No. 20 Krukut\\naddress:        Taman Sari Jakarta, 11140\\ne-mail:         noc@gasnet.id\\nabuse-mailbox:  abuse@tds.net.id\\nadmin-c:        TDS2-AP\\ntech-c:         TDS2-AP\\nauth:           # Filtered\\nmnt-by:         MAINT-ID-TDS\\nlast-modified:  2023-11-28T08:46:26Z\\nsource:         IDNIC\\n\\nrole:           TDS-NET NOC\\naddress:        NOC PT. Telemedia Dinamika Sarana\\naddress:        Perkantoran Nias Raya\\naddress:        Jl. Pelepah Elok I /GN1/27 Kelapa Gading Jakarta 14241\\ncountry:        ID\\nphone:          +62-21-4507447\\nfax-no:         +62-21-45850470\\ne-mail:         noc@tds.net.id\\nadmin-c:        WAB2-AP\\ntech-c:         IKR2-AP\\nnic-hdl:        TDS2-AP\\nmnt-by:         MAINT-ID-TDS\\nlast-modified:  2010-02-16T08:38:01Z\\nsource:         IDNIC\\n\\nroute:          202.179.184.0/21\\ndescr:          Route Object of PT. Telemedia Dinamika Sarana\\ndescr:          Jakarta\\ncountry:        ID\\norigin:         AS38750\\nnotify:         hostmaster@idnic.net\\nmnt-by:         MAINT-ID-TDS\\nlast-modified:  2008-09-04T07:55:25Z\\nsource:         IDNIC"}
{"range": "2a02:f8:5:2c::/64", "id": "RWEIESRMULLER-NET-1", "name": "RUTH WEIESRMULLE", "country": "IT", "domain": "as28929.net", "org_id": "ORG-TDI1-RIPE", "status": "ASSIGNED", "tech_id": "AN1688-RIPE", "mnt_id": "ASDASD-MNT", "admin_id": "RW3077-RIPE", "abuse_id": "AN1688-RIPE", "created": "2012-01-02", "updated": "2012-01-02", "source": "ripe", "raw": "inet6num:       2a02:f8:5:2c::/64\\nnetname:        RWEIESRMULLER-NET-1\\ndescr:          RUTH WEIESRMULLE\\ndescr:          VIA STABIE N 8\\ndescr:          32020 LENTIAI (BL\\ncountry:        IT\\nadmin-c:        RW3077-RIPE\\ntech-c:         AN1688-RIPE\\nstatus:         ASSIGNED\\nmnt-by:         ASDASD-MNT\\ncreated:        2012-01-02T17:30:15Z\\nlast-modified:  2012-01-02T17:30:15Z\\nsource:         RIPE\\nremarks:        generated automagically\\nabuse-email:    abuse@asdasd.it\\nabuse-c:        AN1688-RIPE\\nabuse-org:      ORG-TDI1-RIPE\\n\\nrole:           ASDASD NOC\\naddress:        Banchina Molini 14\\naddress:        30175 Venezia (VE)\\naddress:        ITALY\\nphone:          +39 041 9636500\\nremarks:        \\nremarks:        Customer service: support@asdasd.it\\nremarks:        Operational issues: operations@as28929.net\\nremarks:        Peering issues: peering@asdasd.it\\nremarks:        24/7 NOC Telephone : +39 041 9636500\\nremarks:        Please do NOT e-mail abuse to the contacts given above,\\nremarks:        e-mail them to mailto:abuse@asdasd.it instead.\\nremarks:        \\nadmin-c:        TD596-RIPE\\ntech-c:         TD596-RIPE\\nnic-hdl:        AN1688-RIPE\\ne-mail:         ripe@asdasd.it\\nmnt-by:         ASDASD-MNT\\ncreated:        2008-03-01T18:17:59Z\\nlast-modified:  2022-12-23T15:46:45Z\\nsource:         RIPE\\nabuse-mailbox:  abuse@asdasd.it\\n\\nperson:         RUTH WEIESRMULLER\\naddress:        VIA STABIE N 8\\naddress:        32020 LENTIAI (BL\\naddress:        IT\\nphone:          +39 329897736\\nmnt-by:         ASDASD-MNT\\nnic-hdl:        RW3077-RIPE\\ncreated:        2012-01-02T17:30:15Z\\nlast-modified:  2012-01-02T17:30:15Z\\nsource:         RIPE\\n\\nroute6:         2a02:f8::/32\\ndescr:          asdasd.it first ipv6 block\\norigin:         AS28929\\nmnt-by:         ASDASD-MNT\\ncreated:        2008-03-03T23:49:32Z\\nlast-modified:  2008-03-03T23:49:32Z\\nsource:         RIPE"}
{"range": "124.106.212.84", "id": "ADSL", "name": "SMEMRD2020102020238_ENTERPRISE Client", "country": "PH", "domain": "pldt.com.ph", "org_id": "", "status": "ASSIGNED NON-PORTABLE", "tech_id": "NOC36-AP", "mnt_id": "PHIX-NOC-AP", "admin_id": "NOC36-AP", "abuse_id": "AP713-AP", "created": "", "updated": "2021-01-15", "source": "apnic", "raw": "inetnum:        124.106.212.84 - 124.106.212.84\\nnetname:        ADSL\\ndescr:          SMEMRD2020102020238_ENTERPRISE Client\\ndescr:          This space has been assigned as STATIC\\ncountry:        PH\\nadmin-c:        NOC36-AP\\ntech-c:         NOC36-AP\\nabuse-c:        AP713-AP\\nstatus:         ASSIGNED NON-PORTABLE\\nremarks:        assigned 20201027\\nmnt-by:         PHIX-NOC-AP\\nmnt-irt:        IRT-PLDT-PH\\nlast-modified:  2021-01-15T10:22:04Z\\nsource:         APNIC\\n\\nirt:            IRT-PLDT-PH\\naddress:        Philippine Long Distance Telephone Company\\naddress:        6/F Innolab Building\\naddress:        Boni Avenue, Mandaluyong City\\naddress:        Philippines\\ne-mail:         abuse@pldt.net\\nabuse-mailbox:  abuse@pldt.net\\nadmin-c:        NA185-AP\\ntech-c:         NA185-AP\\nauth:           # Filtered\\nremarks:        abuse@pldt.net was validated on 2025-01-10\\nmnt-by:         PHIX-NOC-AP\\nlast-modified:  2025-01-10T03:04:53Z\\nsource:         APNIC\\n\\nrole:           ABUSE PLDTPH\\ncountry:        ZZ\\naddress:        Philippine Long Distance Telephone Company\\naddress:        6/F Innolab Building\\naddress:        Boni Avenue, Mandaluyong City\\naddress:        Philippines\\nphone:          +000000000\\ne-mail:         abuse@pldt.net\\nadmin-c:        NA185-AP\\ntech-c:         NA185-AP\\nnic-hdl:        AP713-AP\\nremarks:        Generated from irt object IRT-PLDT-PH\\nremarks:        abuse@pldt.net was validated on 2025-01-10\\nabuse-mailbox:  abuse@pldt.net\\nmnt-by:         APNIC-ABUSE\\nlast-modified:  2025-01-10T03:05:13Z\\nsource:         APNIC\\n\\nperson:         PLDT APNIC NOC\\nnic-hdl:        NOC36-AP\\ne-mail:         Noc_pldt@pldt.com.ph\\naddress:        NFCSM-PLDT, 6/F Innolab Bldg, Boni Ave, Mandaluyong City, MM, Philippnes  1550\\nphone:          +632-584-0201\\ncountry:        PH\\nmnt-by:         PHIX-NOC-AP\\nlast-modified:  2017-02-01T02:28:01Z\\nsource:         APNIC"}
{"range": "88.204.146.20/30", "id": "VKODT", "name": "VK ODT", "country": "KZ", "domain": "telecom.kz", "org_id": "ORG-KDNA1-RIPE", "status": "ASSIGNED PA", "tech_id": "SGB41-RIPE", "mnt_id": "KNIC-MNT", "admin_id": "SGB41-RIPE", "abuse_id": "KNIC1-RIPE", "created": "2013-06-05", "updated": "2013-06-05", "source": "ripe", "raw": "inetnum:        88.204.146.20 - 88.204.146.23\\nnetname:        VKODT\\ndescr:          VK ODT\\ndescr:          in Glubokoe\\ncountry:        KZ\\nadmin-c:        SGB41-RIPE\\ntech-c:         SGB41-RIPE\\nstatus:         ASSIGNED PA\\nmnt-by:         KNIC-MNT\\ncreated:        2013-06-05T08:35:20Z\\nlast-modified:  2013-06-05T08:35:20Z\\nsource:         RIPE\\nabuse-email:    abuse@telecom.kz\\nabuse-c:        KNIC1-RIPE\\nabuse-org:      ORG-KDNA1-RIPE\\n\\nperson:         Shprenger Galina Borisovna\\naddress:        selo Gorno-Ulbinka, Glubokoe, str. Beregovaya, 1\\naddress:        KZ\\nphone:          +7 7232 50547\\nnic-hdl:        SGB41-RIPE\\nmnt-by:         KNIC-MNT\\ncreated:        2013-06-05T08:35:20Z\\nlast-modified:  2013-06-05T08:35:20Z\\nsource:         RIPE\\n\\nroute:          88.204.146.0/24\\ndescr:          Kazakhtelecom Megaline Almaty Network\\norigin:         AS9198\\nmnt-by:         KNIC-MNT\\ncreated:        2008-05-14T03:40:20Z\\nlast-modified:  2008-05-14T03:40:20Z\\nsource:         RIPE"}
{"range": "2a07:bd83::/36", "id": "US-NJBBRANDS-20160722", "name": "NJB Brands LLC", "country": "RU", "domain": "njbbrands.com", "org_id": "ORG-NBL11-RIPE", "status": "AGGREGATED-BY-LIR", "tech_id": "TA5576-RIPE", "mnt_id": "US-NJBBRANDS-1-MNT", "admin_id": "SA36693-RIPE", "abuse_id": "AR37002-RIPE", "created": "2016-09-07", "updated": "2019-04-03", "source": "ripe", "raw": "inet6num:       2a07:bd83::/36\\nnetname:        US-NJBBRANDS-20160722\\ncountry:        RU\\ngeoloc:         55.7558 37.6173\\nadmin-c:        SA36693-RIPE\\ntech-c:         TA5576-RIPE\\nmnt-by:         us-njbbrands-1-mnt\\nstatus:         AGGREGATED-BY-LIR\\ncreated:        2016-09-07T01:06:37Z\\nlast-modified:  2019-04-03T20:18:14Z\\nsource:         RIPE\\nassignment-size: 48\\nabuse-c:        AR37002-RIPE\\nabuse-email:    shane@njbbrands.com\\nabuse-c:        AR37002-RIPE\\nabuse-org:      ORG-NBL11-RIPE\\n\\nperson:         Shane Munroe\\naddress:        1734 Clarkson Road, Suite 251\\naddress:        63017\\naddress:        Chesterfield\\naddress:        UNITED STATES\\nphone:          +1 314-520-9942\\nnic-hdl:        SA36693-RIPE\\nmnt-by:         us-njbbrands-1-mnt\\ncreated:        2016-07-18T15:47:12Z\\nlast-modified:  2019-04-03T17:55:03Z\\nsource:         RIPE\\n\\nperson:         Shane Munroe\\naddress:        1734 Clarkson Road, Suite 251\\naddress:        63017\\naddress:        Chesterfield\\naddress:        UNITED STATES\\nphone:          +1 314-520-9942\\nnic-hdl:        TA5576-RIPE\\nmnt-by:         us-njbbrands-1-mnt\\ncreated:        2016-07-18T15:47:11Z\\nlast-modified:  2019-04-03T17:54:46Z\\nsource:         RIPE\\n\\nroute6:         2a07:bd80::/29\\norigin:         AS43350\\nmnt-by:         MNT-NFORCE\\ncreated:        2016-07-28T06:15:08Z\\nlast-modified:  2016-07-28T06:15:08Z\\nsource:         RIPE"}
{"range": "202.127.76.44/30", "id": "TELSTRA_INTEROUTE", "name": "Telstra_Interoute", "country": "HK", "domain": "telstra.com", "org_id": "", "status": "ASSIGNED NON-PORTABLE", "tech_id": "TI54-AP", "mnt_id": "MAINT-HK-TI", "admin_id": "TI55-AP", "abuse_id": "AT940-AP", "created": "", "updated": "2021-01-06", "source": "apnic", "raw": "inetnum:        202.127.76.44 - 202.127.76.47\\nnetname:        Telstra_Interoute\\ndescr:          Telstra_Interoute\\ncountry:        HK\\nadmin-c:        TI55-AP\\ntech-c:         TI54-AP\\nabuse-c:        AT940-AP\\nstatus:         ASSIGNED NON-PORTABLE\\nmnt-by:         MAINT-HK-TI\\nmnt-irt:        IRT-TELSTRA-INTL-HK\\nlast-modified:  2021-01-06T13:37:54Z\\nsource:         APNIC\\n\\nirt:            IRT-TELSTRA-INTL-HK\\naddress:        Internet and Private Networks\\naddress:        Telecom House,\\naddress:        3 Gloucester Rd,\\naddress:        Wanchai, Hong Kong.\\ne-mail:         IRT@team.telstra.com\\nabuse-mailbox:  abuse@intl.telstra.com\\nadmin-c:        TI55-AP\\ntech-c:         TI54-AP\\nauth:           # Filtered\\nremarks:        abuse@intl.telstra.com was validated on 2024-10-14\\nremarks:        irt@team.telstra.com was validated on 2025-01-14\\nmnt-by:         MAINT-HK-TI\\nlast-modified:  2025-01-14T21:09:00Z\\nsource:         APNIC\\n\\nrole:           ABUSE TELSTRAINTLHK\\ncountry:        ZZ\\naddress:        Internet and Private Networks\\naddress:        Telecom House,\\naddress:        3 Gloucester Rd,\\naddress:        Wanchai, Hong Kong.\\nphone:          +000000000\\ne-mail:         IRT@team.telstra.com\\nadmin-c:        TI55-AP\\ntech-c:         TI54-AP\\nnic-hdl:        AT940-AP\\nremarks:        Generated from irt object IRT-TELSTRA-INTL-HK\\nremarks:        abuse@intl.telstra.com was validated on 2024-10-14\\nremarks:        irt@team.telstra.com was validated on 2025-01-14\\nabuse-mailbox:  abuse@intl.telstra.com\\nmnt-by:         APNIC-ABUSE\\nlast-modified:  2025-01-14T21:09:12Z\\nsource:         APNIC\\n\\nperson:         Telstra-International IPNOC\\nnic-hdl:        TI54-AP\\ne-mail:         ipnoc@team.telstra.com\\naddress:        Telecom House,\\naddress:        3 Gloucester Rd,\\naddress:        Wanchai, Hong Kong.\\nphone:          +852 2983 3388\\nfax-no:         +852 2597 5896\\ncountry:        HK\\nremarks:        For SPAM/ABUSE Issue: ipnoc@team.telstra.com\\nremarks:        For Network Related Issue: ipnoc@team.telstra.com\\nmnt-by:         MAINT-AP-ANC\\nlast-modified:  2019-09-11T04:30:26Z\\nsource:         APNIC\\n\\nperson:         Telstra-International IPNPD\\naddress:        14/F Telecom House, 3 Gloucester Road, Wanchai\\ncountry:        HK\\nphone:          +852 2983 3388\\nfax-no:         +852 2597 5896\\ne-mail:         ipnpd@team.telstra.com\\nnic-hdl:        TI55-AP\\nabuse-mailbox:  abuse@intl.telstra.com\\nmnt-by:         MAINT-HK-TI\\nlast-modified:  2019-04-15T01:08:26Z\\nsource:         APNIC\\n\\nroute:          202.127.76.0/24\\norigin:         AS4637\\ndescr:          Telstra International Limited 19/F Telecom House 3 Gloucester Road\\nmnt-by:         MAINT-HK-TI\\nlast-modified:  2023-08-11T05:53:47Z\\nsource:         APNIC"}
{"range": "62.176.28.0/22", "id": "RIALCOM-NET", "name": "Sares clients networks Moscow reg. Puschino", "country": "RU", "domain": "rialcom.ru", "org_id": "ORG-RCJ1-RIPE", "status": "ASSIGNED PA", "tech_id": "AVK777-RIPE", "mnt_id": "RCM-MNT", "admin_id": "YVK-RIPE", "abuse_id": "RCCD-RIPE", "created": "2010-11-26", "updated": "2013-06-28", "source": "ripe", "raw": "inetnum:        62.176.28.0 - 62.176.31.255\\nnetname:        RIALCOM-NET\\ngeoloc:         54.83708187820751 37.624053955078125\\ndescr:          Sares clients networks Moscow reg. Puschino\\ncountry:        RU\\nadmin-c:        YVK-RIPE\\ntech-c:         AVK777-RIPE\\nstatus:         ASSIGNED PA\\nmnt-by:         RCM-MNT\\ncreated:        2010-11-26T10:10:09Z\\nlast-modified:  2013-06-28T08:16:24Z\\nsource:         RIPE\\nabuse-email:    abuse@rialcom.ru\\nabuse-c:        RCCD-RIPE\\nabuse-org:      ORG-RCJ1-RIPE\\n\\nperson:         Andrey Gribov\\nnic-hdl:        AVK777-RIPE\\nmnt-by:         RCM-MNT\\naddress:        Rial Com JSC.\\naddress:        Bolshaya Serpuhovskaya street 48/1\\naddress:        142105 Moscow reg. Podolsk\\nphone:          +7 (495) 544-00-04\\nfax-no:         +7 (495) 544-00-04\\ne-mail:         andrey@rialcom.ru\\ncreated:        2008-04-29T11:19:34Z\\nlast-modified:  2024-10-21T16:52:44Z\\nsource:         RIPE\\n\\nperson:         Yuri V. Krivitsky\\nnic-hdl:        YVK-RIPE\\nmnt-by:         RCM-MNT\\naddress:        Rial Com JSC.\\naddress:        Bolshaya Serpuhovskaya street 48/1\\naddress:        142105 Moscow reg. Podolsk\\nphone:          +7 (495) 502-79-46\\nphone:          +7 (4967) 69-24-01\\nfax-no:         +7 (495) 502-79-46\\ne-mail:         yk@rialcom.ru\\ncreated:        2002-07-17T10:35:03Z\\nlast-modified:  2024-10-21T16:51:18Z\\nsource:         RIPE\\n\\nroute:          62.176.16.0/20\\ndescr:          Rial Com JSC\\norigin:         AS34456\\nmnt-by:         RCM-MNT\\ncreated:        2012-07-13T07:18:11Z\\nlast-modified:  2012-07-13T07:18:11Z\\nsource:         RIPE"}
{"range": "182.50.254.0/24", "id": "HTS-YOGYAKARTA", "name": "PT. Hawk Teknologi Solusi", "country": "ID", "domain": "hts.net.id", "org_id": "", "status": "ASSIGNED NON-PORTABLE", "tech_id": "HP371-AP", "mnt_id": "MAINT-ID-HTS", "admin_id": "HP371-AP", "abuse_id": "IRT-HTS-ID", "created": "", "updated": "2012-09-18", "source": "apnic", "raw": "inetnum:        182.50.240.0 - 182.50.255.255\\nnetname:        HTS-ID\\ndescr:          PT Hawk Teknologi Solusi\\ndescr:          Internet Service Provider\\ndescr:          Jl. Merkurius IV/9 RT.06/07 Lobunta\\ndescr:          Desa Banjarwangunan Kec. Mundu Kab. Cirebon\\ncountry:        ID\\nadmin-c:        HP371-AP\\ntech-c:         HP371-AP\\nstatus:         ALLOCATED PORTABLE\\nremarks:        # ATP-ID Merger to HTS-ID #\\nremarks:        Send Spam & Abuse Reports to harijanto@gmail.com\\nmnt-by:         MNT-APJII-ID\\nmnt-lower:      MAINT-ID-HTS\\nmnt-routes:     MAINT-ID-HTS\\nmnt-irt:        IRT-IDNIC-ID\\nlast-modified:  2011-02-28T11:38:09Z\\nsource:         APNIC\\n\\nirt:            IRT-IDNIC-ID\\naddress:        INDONESIA NETWORK INFORMATION CENTER\\naddress:        Cyber Building 11th Floor\\naddress:        Jl. Kuningan Barat No.8\\naddress:        Jakarta Selatan 12710\\ne-mail:         abuse@idnic.net\\nabuse-mailbox:  abuse@idnic.net\\nadmin-c:        IA55-AP\\ntech-c:         IH123-AP\\nauth:           # Filtered\\nmnt-by:         MNT-APJII-ID\\nlast-modified:  2018-05-31T22:29:03Z\\nsource:         APNIC\\n\\nperson:         Harijanto Pribadi\\nnic-hdl:        HP371-AP\\ne-mail:         harijanto@gmail.com\\naddress:        Metro Permata I Blok N5 / 24\\naddress:        Pondok Pucung\\naddress:        Karang Tengah\\naddress:        Tangerang\\nphone:          +62-21-2599-3104\\nfax-no:         +62-21-5367-7047\\ncountry:        ID\\nmnt-by:         MAINT-ID-HTS\\nlast-modified:  2010-10-07T06:58:02Z\\nsource:         APNIC\\n\\ninetnum:        182.50.254.0 - 182.50.254.255\\nnetname:        HTS-YOGYAKARTA\\ncountry:        ID\\ndescr:          PT. Hawk Teknologi Solusi\\ndescr:          Internet Service Provider\\nadmin-c:        HP371-AP\\ntech-c:         HP371-AP\\nstatus:         ASSIGNED NON-PORTABLE\\nmnt-by:         MAINT-ID-HTS\\nmnt-irt:        IRT-HTS-ID\\nlast-modified:  2012-09-18T16:34:01Z\\nsource:         IDNIC\\n\\nirt:            IRT-HTS-ID\\naddress:        Jl Pos Pengumben No 20A\\naddress:        Sukabumi Selatan Kebon Jeruk\\naddress:        Jakarta Barat\\naddress:        DKI Jakarta\\ne-mail:         noc@hts.net.id\\nabuse-mailbox:  abuse@hts.net.id\\nadmin-c:        HP371-AP\\ntech-c:         HP371-AP\\nauth:           # Filtered\\nmnt-by:         MAINT-ID-HTS\\nphone:          +62-21-5366-5477\\nlast-modified:  2024-10-16T07:34:52Z\\nsource:         IDNIC\\n\\nperson:         Harijanto Pribadi\\nnic-hdl:        HP371-AP\\ne-mail:         abuse@hts.net.id\\naddress:        Jl Pos Pengumben No 20A\\naddress:        Sukabumi Selatan, Kebon Jeruk\\naddress:        Jakarta Barat\\naddress:        DKI Jakarta\\nphone:          +62-21-5366-5477\\ncountry:        ID\\nmnt-by:         MAINT-ID-HTS\\nlast-modified:  2024-10-16T07:39:59Z\\nsource:         IDNIC\\n\\nroute:          182.50.254.0/24\\ndescr:          PT. Hawk Teknologi Solusi\\norigin:         as45786\\nmnt-by:         MAINT-ID-HTS\\nlast-modified:  2020-05-14T12:22:11Z\\nsource:         IDNIC"}
{"range": "2a0a:4940:3b5b::/48", "id": "GIBIRNET-TURKEY", "name": "GIBIRNET ILETISIM HIZMETLERI SANAYI VE TICARET LIMITED SIRKETI", "country": "TR", "domain": "gibir.net.tr", "org_id": "ORG-GIHS2-RIPE", "status": "ASSIGNED", "tech_id": "AA31992-RIPE", "mnt_id": "MNT-TR-GIBIRNET-TR-1", "admin_id": "HA4255-RIPE", "abuse_id": "AR52321-RIPE", "created": "2022-04-01", "updated": "2022-04-01", "source": "ripe", "raw": "inet6num:       2a0a:4940:3b5b::/48\\nnetname:        GIBIRNET-TURKEY\\ngeoloc:         37.8746 32.4932\\ncountry:        TR\\ncreated:        2022-04-01T11:26:25Z\\nlast-modified:  2022-04-01T11:26:25Z\\nsource:         RIPE\\nadmin-c:        HA4255-RIPE\\ntech-c:         AA31992-RIPE\\nmnt-by:         mnt-tr-gibirnet-tr-1\\nstatus:         ASSIGNED\\nabuse-email:    sikayet@gibir.net.tr\\nabuse-c:        AR52321-RIPE\\nabuse-org:      ORG-GIHS2-RIPE\\n\\nperson:         Ahmet AK\\naddress:        Loras Mah. 15389. Sok. No: 13/A\\naddress:        42010\\naddress:        Konya\\naddress:        TURKEY\\nphone:          +90 332 606 0333\\nnic-hdl:        AA31992-RIPE\\nmnt-by:         tr-gibirnet-1-mnt\\ncreated:        2017-03-11T07:19:52Z\\nlast-modified:  2017-03-11T07:19:52Z\\nsource:         RIPE\\n\\nperson:         Halim AK\\naddress:        seker Mah. Kerbela Sok. No:2 i\u00e7 Kapi No:803\\naddress:        42010\\naddress:        Konya/Meram\\naddress:        TURKEY\\nphone:          +905494272009\\nnic-hdl:        HA4255-RIPE\\nmnt-by:         mnt-tr-gibirnet-tr-1\\ncreated:        2019-04-29T10:52:13Z\\nlast-modified:  2024-08-30T14:16:35Z\\nsource:         RIPE\\n\\nroute6:         2a0a:4940::/29\\norigin:         AS208972\\nmnt-by:         tr-gibirnet-1-mnt\\nmnt-by:         mnt-tr-gibirnet-tr-1\\ncreated:        2019-05-02T13:04:20Z\\nlast-modified:  2019-05-02T13:04:20Z\\nsource:         RIPE"}
{"range": "122.54.102.99", "id": "ADSL", "name": "SMEPVE2023032177868_ENTERPRISE CLIENT", "country": "PH", "domain": "pldt.com.ph", "org_id": "", "status": "ASSIGNED NON-PORTABLE", "tech_id": "NOC36-AP", "mnt_id": "PHIX-NOC-AP", "admin_id": "NOC36-AP", "abuse_id": "AP713-AP", "created": "", "updated": "2023-03-22", "source": "apnic", "raw": "inetnum:        122.54.102.99 - 122.54.102.99\\nnetname:        ADSL\\ndescr:          SMEPVE2023032177868_ENTERPRISE CLIENT\\ndescr:          This space has been assigned as STATIC\\ncountry:        PH\\nadmin-c:        NOC36-AP\\ntech-c:         NOC36-AP\\nabuse-c:        AP713-AP\\nstatus:         ASSIGNED NON-PORTABLE\\nremarks:        assigned 20230321\\nmnt-by:         PHIX-NOC-AP\\nmnt-irt:        IRT-PLDT-PH\\nlast-modified:  2023-03-22T04:18:13Z\\nsource:         APNIC\\n\\nirt:            IRT-PLDT-PH\\naddress:        Philippine Long Distance Telephone Company\\naddress:        6/F Innolab Building\\naddress:        Boni Avenue, Mandaluyong City\\naddress:        Philippines\\ne-mail:         abuse@pldt.net\\nabuse-mailbox:  abuse@pldt.net\\nadmin-c:        NA185-AP\\ntech-c:         NA185-AP\\nauth:           # Filtered\\nremarks:        abuse@pldt.net was validated on 2025-01-10\\nmnt-by:         PHIX-NOC-AP\\nlast-modified:  2025-01-10T03:04:53Z\\nsource:         APNIC\\n\\nrole:           ABUSE PLDTPH\\ncountry:        ZZ\\naddress:        Philippine Long Distance Telephone Company\\naddress:        6/F Innolab Building\\naddress:        Boni Avenue, Mandaluyong City\\naddress:        Philippines\\nphone:          +000000000\\ne-mail:         abuse@pldt.net\\nadmin-c:        NA185-AP\\ntech-c:         NA185-AP\\nnic-hdl:        AP713-AP\\nremarks:        Generated from irt object IRT-PLDT-PH\\nremarks:        abuse@pldt.net was validated on 2025-01-10\\nabuse-mailbox:  abuse@pldt.net\\nmnt-by:         APNIC-ABUSE\\nlast-modified:  2025-01-10T03:05:13Z\\nsource:         APNIC\\n\\nperson:         PLDT APNIC NOC\\nnic-hdl:        NOC36-AP\\ne-mail:         Noc_pldt@pldt.com.ph\\naddress:        NFCSM-PLDT, 6/F Innolab Bldg, Boni Ave, Mandaluyong City, MM, Philippnes  1550\\nphone:          +632-584-0201\\ncountry:        PH\\nmnt-by:         PHIX-NOC-AP\\nlast-modified:  2017-02-01T02:28:01Z\\nsource:         APNIC"}
{"range": "131.164.120.0/24", "id": "TDC-BREDBAANDSADSL-STATIC-NET", "name": "TDC BB-ADSL users", "country": "DK", "domain": "tdc.dk", "org_id": "ORG-TD1-RIPE", "status": "LEGACY", "tech_id": "AS5071-RIPE", "mnt_id": "TDK-MNT", "admin_id": "AS5071-RIPE", "abuse_id": "TDCA2-RIPE", "created": "2012-03-22", "updated": "2019-12-04", "source": "ripe", "raw": "inetnum:        131.164.120.0 - 131.164.120.255\\nnetname:        TDC-BREDBAANDSADSL-STATIC-NET\\ndescr:          TDC BB-ADSL users\\ncountry:        DK\\nstatus:         LEGACY\\nremarks:        +---------------------------------------+\\nremarks:        | For abuse and security issues please |\\nremarks:        | see http://postmaster.tdc.dk or |\\nremarks:        | contact postmaster@abuse.mail.dk |\\nremarks:        +---------------------------------------+\\nadmin-c:        AS5071-RIPE\\ntech-c:         AS5071-RIPE\\nmnt-by:         TDK-MNT\\ncreated:        2012-03-22T14:31:51Z\\nlast-modified:  2019-12-04T13:47:55Z\\nsource:         RIPE\\nabuse-email:    postmaster@abuse.mail.dk\\nabuse-c:        TDCA2-RIPE\\nabuse-org:      ORG-TD1-RIPE\\n\\nrole:           AS3292 Staff\\naddress:        TDC A/S\\naddress:        Sletvej 30, 8-062\\naddress:        DK-8310 Tranbjerg\\naddress:        Denmark\\ne-mail:         staff@eng.tdc.net\\nremarks:        contact info: http://as3292.peeringdb.com\\nadmin-c:        NCB1-RIPE\\nadmin-c:        MBP137-RIPE\\ntech-c:         NCB1-RIPE\\ntech-c:         CP11490-RIPE\\ntech-c:         MBP137-RIPE\\nnotify:         staff@eng.tdc.net\\nnic-hdl:        AS5071-RIPE\\nmnt-by:         AS3292-MNT\\ncreated:        2002-07-02T13:36:00Z\\nlast-modified:  2024-05-21T09:07:14Z\\nsource:         RIPE\\n\\nroute:          131.164.0.0/16\\ndescr:          Tele Danmark\\norigin:         AS3292\\nmnt-by:         AS3292-MNT\\nremarks:        +---------------------------------------+\\nremarks:        | For abuse and security issues contact |\\nremarks:        | csirt@csirt.dk, http://www.csirt.dk |\\nremarks:        +---------------------------------------+\\nnotify:         notify@ip.tele.dk\\ncreated:        2002-07-30T18:28:41Z\\nlast-modified:  2002-07-30T18:28:41Z\\nsource:         RIPE"}
{"range": "113.41.72.64/26", "id": "V-TK7552-1", "name": "ARTERIA Networks Corp.", "country": "JP", "domain": "arteria-net.com", "org_id": "", "status": "", "tech_id": "JP00022296", "mnt_id": "", "admin_id": "JP00022296", "abuse_id": "", "created": "", "updated": "2022-07-21", "source": "jpnic", "raw": "inetnum:        113.41.72.64 - 113.41.72.127\\nnetname:        V-TK7552-1\\ndescr:          ARTERIA Networks Corp.\\ncountry:        JP\\nadmin-c:        JP00022296\\ntech-c:         JP00022296\\nlast-modified:  2022-07-21T22:10:25Z\\nremarks:        This information has been partially mirrored by APNIC from\\nremarks:        JPNIC. To obtain more specific information, please use the\\nremarks:        JPNIC WHOIS Gateway at\\nremarks:        http://www.nic.ad.jp/en/db/whois/en-gateway.html or\\nremarks:        whois.nic.ad.jp for WHOIS client. (The WHOIS client\\nremarks:        defaults to Japanese output, use the /e switch for English\\nremarks:        output)\\nsource:         JPNIC\\n"}
{"range": "2a02:1630:c102:bc00::/56", "id": "TWT-CUST-GO-1121621", "name": "Reale Mutua Macerata", "country": "IT", "domain": "twt.it", "org_id": "ORG-TWTS1-RIPE", "status": "ASSIGNED", "tech_id": "TCR5-RIPE", "mnt_id": "IT-TWT-MNT", "admin_id": "RMM181-RIPE", "abuse_id": "TCR5-RIPE", "created": "2022-03-08", "updated": "2022-03-08", "source": "ripe", "raw": "inet6num:       2a02:1630:c102:bc00::/56\\nnetname:        TWT-CUST-GO-1121621\\ndescr:          Reale Mutua Macerata\\ncountry:        IT\\nadmin-c:        RMM181-RIPE\\ntech-c:         TCR5-RIPE\\nstatus:         ASSIGNED\\nmnt-by:         IT-TWT-MNT\\ncreated:        2022-03-08T13:37:22Z\\nlast-modified:  2022-03-08T13:37:22Z\\nsource:         RIPE\\nabuse-email:    abuse@twt.it\\nabuse-c:        TCR5-RIPE\\nabuse-org:      ORG-TWTS1-RIPE\\n\\nrole:           TWT Contact Role\\naddress:        TWT S.p.A.\\naddress:        viale jenner 33\\naddress:        20139 Milano\\naddress:        Italy\\nphone:          +39 02 890891\\nfax-no:         +39 02 89089211\\ne-mail:         ripe@twt.it\\nabuse-mailbox:  abuse@twt.it\\nadmin-c:        MR3040-RIPE\\ntech-c:         FA558-RIPE\\ntech-c:         BT538-RIPE\\nnic-hdl:        TCR5-RIPE\\nremarks:        +------------------------------------------------------\\nremarks:        | |\\nremarks:        | PLEASE CONTACT OUR ABUSE DIVISION (abuse@twt.it) |\\nremarks:        | FOR ABUSE and-or SPAM COMPLAINTS. |\\nremarks:        | |\\nremarks:        | Please note that all complaints regarding abuse which|\\nremarks:        | are sent to other email addresses WILL BE IGNORED! |\\nremarks:        | |\\nremarks:        +------------------------------------------------------\\nnotify:         ripe@twt.it\\nmnt-by:         IT-TWT-MNT\\ncreated:        2003-11-21T13:20:05Z\\nlast-modified:  2020-06-30T14:43:45Z\\nsource:         RIPE\\n\\nperson:         Reale Mutua Macerata\\naddress:        Massimiliano\\naddress:        VIA TRENTO\\naddress:        MACERATA\\naddress:        Italy\\nphone:          +390163202885\\nnic-hdl:        RMM181-RIPE\\nmnt-by:         IT-TWT-MNT\\ncreated:        2022-03-08T13:37:22Z\\nlast-modified:  2022-03-08T13:37:22Z\\nsource:         RIPE\\n\\nroute6:         2a02:1630::/32\\ndescr:          TWT IPV6-route object 2a02:1630\\norigin:         AS30848\\nmnt-by:         IT-TWT-MNT\\ncreated:        2012-11-05T15:09:55Z\\nlast-modified:  2012-11-05T15:09:55Z\\nsource:         RIPE"}
{"range": "194.74.32.216/29", "id": "BTNET-CUSTOMER", "name": "FTIP007149825 IP MASTER", "country": "GB", "domain": "bt.net", "org_id": "ORG-BPIS1-RIPE", "status": "ASSIGNED PA", "tech_id": "BY73-RIPE", "mnt_id": "BTNET-MNT", "admin_id": "BY73-RIPE", "abuse_id": "AR13878-RIPE", "created": "2022-09-23", "updated": "2022-09-23", "source": "ripe", "raw": "inetnum:        194.74.32.216 - 194.74.32.223\\nnetname:        BTNET-CUSTOMER\\ndescr:          FTIP007149825 IP MASTER\\ncountry:        GB\\nadmin-c:        BY73-RIPE\\ntech-c:         BY73-RIPE\\nstatus:         ASSIGNED PA\\nmnt-by:         BTNET-MNT\\nmnt-lower:      BTNET-MNT\\nmnt-routes:     BTNET-MNT\\nremarks:        Please send abuse notification to btnet.abuse@bt.com\\nremarks:        Please send delisting issues to btnetdns@bt.net\\nremarks:        This range is statically assigned\\ncreated:        2022-09-23T08:54:25Z\\nlast-modified:  2022-09-23T08:54:25Z\\nsource:         RIPE\\nabuse-email:    abuse@bt.com\\nabuse-c:        AR13878-RIPE\\nabuse-org:      ORG-BPIS1-RIPE\\n\\nperson:         IP MASTER TEAM\\naddress:        pp HWG298\\naddress:        Virtual Postbox (HOM-NX)\\naddress:        PO Box 400\\naddress:        London\\naddress:        N18 1XU\\naddress:        UK\\nphone:          +448000850223\\nnic-hdl:        BY73-RIPE\\nmnt-by:         BTNET-MNT\\nremarks:        Please send abuse notification to btnet.abuse@bt.com\\ncreated:        2009-11-09T08:39:01Z\\nlast-modified:  2023-03-07T12:38:29Z\\nsource:         RIPE\\n\\nroute:          194.72.0.0/14\\ndescr:          BTnet\\norigin:         AS2856\\nmnt-by:         BTNET-INFRA-MNT\\nnotify:         ipaddman@bt.com\\ncreated:        1970-01-01T00:00:00Z\\nlast-modified:  2022-09-15T10:33:50Z\\nsource:         RIPE"}
{"range": "2605:ed00:6d7b::/48", "id": "FORTRESS-INVESTMENT-GROUP-LLC-EE", "name": "FORTRESS INVESTMENT GROUP LLC EE", "country": "US", "domain": "", "org_id": "C08072827", "status": "REASSIGNMENT", "tech_id": "", "mnt_id": "", "admin_id": "", "abuse_id": "", "created": "2021-10-20", "updated": "2021-10-20", "source": "arin", "raw": "V6NetHandle:    NET6-2605-ED00-6D7B-1\\nOrgID:          C08072827\\nParent:         NET6-2605-ED00-1\\nNetName:        FORTRESS-INVESTMENT-GROUP-LLC-EE\\nNetRange:       2605:ED00:6D7B:: - 2605:ED00:6D7B:FFFF:FFFF:FFFF:FFFF:FFFF\\nNetType:        reassignment\\nRegDate:        2021-10-20\\nUpdated:        2021-10-20\\nSource:         ARIN\\n\\n\\nOrgID:          C08072827\\nOrgName:        FORTRESS INVESTMENT GROUP LLC EE \\nCanAllocate:    \\nStreet:         3219 KNOX ST\\nCity:           DALLAS\\nState/Prov:     TX\\nCountry:        US\\nPostalCode:     75205\\nRegDate:        2021-10-20\\nUpdated:        2021-10-20\\nSource:         ARIN\\n"}
{"range": "12.50.19.64/29", "id": "CH-INVES94-19-64", "name": "CH INVESTMENT PARTNERS", "country": "US", "domain": "chinvestments.com", "org_id": "CIP-102", "status": "REASSIGNMENT", "tech_id": "TOBIN46-ARIN", "mnt_id": "", "admin_id": "TOBIN46-ARIN", "abuse_id": "TOBIN46-ARIN", "created": "2020-02-06", "updated": "2020-02-06", "source": "arin", "raw": "NetHandle:      NET-12-50-19-64-1\\nOrgID:          CIP-102\\nParent:         NET-12-0-0-0-1\\nNetName:        CH-INVES94-19-64\\nNetRange:       12.50.19.64 - 12.50.19.71\\nNetType:        reassignment\\nRegDate:        2020-02-06\\nUpdated:        2020-02-06\\nSource:         ARIN\\n\\n\\nOrgID:          CIP-102\\nOrgName:        CH INVESTMENT PARTNERS\\nCanAllocate:    \\nStreet:         3953 MAPLE AVE\\nCity:           DALLAS\\nState/Prov:     TX\\nCountry:        US\\nPostalCode:     75219\\nRegDate:        2020-02-06\\nUpdated:        2020-02-06\\nOrgAdminHandle: TOBIN46-ARIN\\nOrgTechHandle:  TOBIN46-ARIN\\nOrgAbuseHandle: TOBIN46-ARIN\\nSource:         ARIN\\n\\n\\nPOCHandle:      TOBIN46-ARIN\\nIsRole:         N\\nLastName:       Tobin\\nFirstName:      Diane\\nStreet:         3953 MAPLE AVE  UNIT 250\\nCity:           DALLAS\\nState/Prov:     TX\\nCountry:        US\\nPostalCode:     75219\\nRegDate:        2020-02-06\\nUpdated:        2020-02-06\\nOfficePhone:    +1-214-661-8173\\nMailbox:        dtobin@chinvestments.com\\nSource:         ARIN\\n"}
{"range": "24.39.131.176/28", "id": "NET-24-39-131-176-1", "name": "CATHAY HOME INC", "country": "US", "domain": "cathayhome.com", "org_id": "C07112254", "status": "REASSIGNMENT", "tech_id": "", "mnt_id": "", "admin_id": "", "abuse_id": "", "created": "2018-10-24", "updated": "2018-10-24", "source": "arin", "raw": "NetHandle:      NET-24-39-131-176-1\\nOrgID:          C07112254\\nParent:         NET-24-39-0-0-1\\nNetName:        NET-24-39-131-176-1\\nNetRange:       24.39.131.176 - 24.39.131.191\\nNetType:        reassignment\\nRegDate:        2018-10-24\\nUpdated:        2018-10-24\\nSource:         ARIN\\n\\n\\nOrgID:          C07112254\\nOrgName:        CATHAY HOME INC\\nCanAllocate:    \\nStreet:         230 5TH AVE #215\\nCity:           NEW YORK\\nState/Prov:     NY\\nCountry:        US\\nPostalCode:     10001\\nRegDate:        2018-10-24\\nUpdated:        2018-10-24\\nSource:         ARIN\\n"}
{"range": "209.253.235.112/29", "id": "209-253-235-112", "name": "THE TRUST BANK", "country": "US", "domain": "trustbank.com.gh", "org_id": "C10856292", "status": "REASSIGNMENT", "tech_id": "", "mnt_id": "", "admin_id": "", "abuse_id": "", "created": "2024-05-28", "updated": "2024-05-28", "source": "arin", "raw": "NetHandle:      NET-209-253-235-112-1\\nOrgID:          C10856292\\nParent:         NET-209-252-0-0-1\\nNetName:        209-253-235-112\\nNetRange:       209.253.235.112 - 209.253.235.119\\nNetType:        reassignment\\nOriginAS:       11349\\nRegDate:        2024-05-28\\nUpdated:        2024-05-28\\nSource:         ARIN\\n\\n\\nOrgID:          C10856292\\nOrgName:        THE TRUST BANK\\nCanAllocate:    \\nStreet:         607 W 4TH ST\\nCity:           ADEL\\nState/Prov:     GA\\nCountry:        US\\nPostalCode:     31620-2655\\nRegDate:        2024-05-28\\nUpdated:        2024-05-28\\nSource:         ARIN\\n"}
{"range": "99.166.29.192/29", "id": "SBC-99-166-29-192-29-0712050746", "name": "CLASSIC REAL EST LTD-071205030733", "country": "US", "domain": "", "org_id": "C01823590", "status": "REASSIGNMENT", "tech_id": "", "mnt_id": "", "admin_id": "", "abuse_id": "", "created": "2007-12-05", "updated": "2018-01-10", "source": "arin", "raw": "NetHandle:      NET-99-166-29-192-1\\nOrgID:          C01823590\\nParent:         NET-99-157-0-0-1\\nNetName:        SBC-99-166-29-192-29-0712050746\\nNetRange:       99.166.29.192 - 99.166.29.199\\nNetType:        reassignment\\nRegDate:        2007-12-05\\nUpdated:        2018-01-10\\nSource:         ARIN\\n\\n\\nOrgID:          C01823590\\nOrgName:        CLASSIC REAL EST LTD-071205030733\\nCanAllocate:    \\nStreet:         Private Address\\nCity:           Plano\\nState/Prov:     TX\\nCountry:        US\\nPostalCode:     75075\\nRegDate:        2007-12-05\\nUpdated:        2018-07-19\\nSource:         ARIN\\n"}
{"range": "180.130.223.40/29", "id": "YUNNAN-BN-XIANG-SCHOOL", "name": "Yunnan-BN-Xiang-School", "country": "CN", "domain": "yncnc.net", "org_id": "", "status": "ASSIGNED NON-PORTABLE", "tech_id": "JH1190-AP", "mnt_id": "MAINT-CNCGROUP-YN", "admin_id": "CH1302-AP", "abuse_id": "", "created": "", "updated": "2010-08-09", "source": "apnic", "raw": "inetnum:        180.130.223.40 - 180.130.223.47\\nnetname:        Yunnan-BN-Xiang-School\\ncountry:        cn\\ndescr:          Yunnan-BN-Xiang-School\\nadmin-c:        CH1302-AP\\ntech-c:         JH1190-AP\\nstatus:         ASSIGNED NON-PORTABLE\\nmnt-by:         MAINT-CNCGROUP-YN\\nmnt-lower:      MAINT-CNCGROUP\\nmnt-routes:     MAINT-CNCGROUP-RR\\nlast-modified:  2010-08-09T03:30:03Z\\nsource:         APNIC\\n\\nperson:         ChinaUnicom Hostmaster\\nnic-hdl:        CH1302-AP\\ne-mail:         hqs-ipabuse@chinaunicom.cn\\naddress:        No.21,Jin-Rong Street\\naddress:        Beijing,100033\\naddress:        P.R.China\\nphone:          +86-10-66259764\\nfax-no:         +86-10-66259764\\ncountry:        CN\\nmnt-by:         MAINT-CNCGROUP\\nlast-modified:  2017-08-17T06:13:16Z\\nsource:         APNIC\\n\\nperson:         JinLong He\\nnic-hdl:        JH1190-AP\\ne-mail:         hjl@yncnc.net\\naddress:        Add: 29/F,Stock Building , 62 Chuncheng Road, Kunming, Yunnan  P.R.C.\\nphone:          +86-0871-8880103\\nfax-no:         +86-0871-8881300\\ncountry:        cn\\nmnt-by:         MAINT-CNCGROUP-YN\\nlast-modified:  2008-09-04T07:46:25Z\\nsource:         APNIC\\n\\nroute:          180.130.0.0/16\\ndescr:          China Unicom Yunnan Province Network\\ncountry:        CN\\norigin:         AS4837\\nmnt-by:         MAINT-CNCGROUP-RR\\nlast-modified:  2009-08-19T10:07:00Z\\nsource:         APNIC"}
{"range": "81.168.51.64/29", "id": "UK-ECLIPSE-SYC5CYG9SMDLHEWF", "name": "Greenfield Television Ltd", "country": "GB", "domain": "eclipse.net.uk", "org_id": "ORG-GNSL2-RIPE", "status": "ASSIGNED PA", "tech_id": "EIR3-RIPE", "mnt_id": "ECLINET-NMC", "admin_id": "EIR3-RIPE", "abuse_id": "GCI1-RIPE", "created": "2005-11-01", "updated": "2005-11-01", "source": "ripe", "raw": "inetnum:        81.168.51.64 - 81.168.51.71\\nnetname:        UK-ECLIPSE-SYC5CYG9SMDLHEWF\\ndescr:          Greenfield Television Ltd\\ncountry:        GB\\nadmin-c:        EIR3-RIPE\\ntech-c:         EIR3-RIPE\\nnotify:         as-guardian@eclipse.net.uk\\nmnt-by:         ECLINET-NMC\\ncreated:        2005-11-01T15:50:36Z\\nlast-modified:  2005-11-01T15:50:36Z\\nsource:         RIPE\\nstatus:         ASSIGNED PA\\nabuse-email:    abuse@gcicom.net\\nabuse-c:        GCI1-RIPE\\nabuse-org:      ORG-GNSL2-RIPE\\n\\nrole:           Eclipse Internet - Ripe Admin\\naddress:        Eclipse Internet,\\naddress:        Osprey House, Osprey Road,\\naddress:        Exeter, Devon EX2 7JG\\naddress:        GB\\nphone:          +44 1392 333333\\nfax-no:         +44 1392 333310\\ne-mail:         support@eclipse.net.uk\\nremarks:        spam and abuse complaints = mailto:abuse@eclipse.net.uk\\nadmin-c:        JT5873-RIPE\\nadmin-c:        AR20994-RIPE\\ntech-c:         ECHM1-RIPE\\ntech-c:         JT5873-RIPE\\nnic-hdl:        EIR3-RIPE\\nremarks:        Eclipse Internet\\nnotify:         jim@eclipse.net.uk\\nmnt-by:         ECLINET-NMC\\ncreated:        2002-08-19T14:56:52Z\\nlast-modified:  2020-08-04T11:09:58Z\\nsource:         RIPE\\nabuse-mailbox:  abuse@eclipse.net.uk\\n\\nroute:          81.168.0.0/17\\ndescr:          Eclipse Networking Ltd.\\norigin:         AS12513\\nnotify:         as-guardian@eclipse.net.uk\\nmnt-by:         ECLINET-NMC\\ncreated:        2003-04-04T13:26:56Z\\nlast-modified:  2003-04-04T13:26:56Z\\nsource:         RIPE\\n\\nroute:          81.168.0.0/17\\norigin:         AS206509\\nmnt-by:         ECLINET-NMC\\ncreated:        2020-08-03T08:59:40Z\\nlast-modified:  2020-08-03T08:59:40Z\\nsource:         RIPE"}
{"range": "208.189.88.120/29", "id": "SBCIS53593", "name": "Dallas Cotton Belt Credit Union", "country": "US", "domain": "", "org_id": "C00042731", "status": "REASSIGNMENT", "tech_id": "", "mnt_id": "", "admin_id": "", "abuse_id": "", "created": "1999-10-27", "updated": "1999-10-27", "source": "arin", "raw": "NetHandle:      NET-208-189-88-120-1\\nOrgID:          C00042731\\nParent:         NET-208-188-0-0-1\\nNetName:        SBCIS53593\\nNetRange:       208.189.88.120 - 208.189.88.127\\nNetType:        reassignment\\nRegDate:        1999-10-27\\nUpdated:        1999-10-27\\nSource:         ARIN\\n\\n\\nOrgID:          C00042731\\nOrgName:        Dallas Cotton Belt Credit Union\\nCanAllocate:    \\nStreet:         2650 Lou Menk Drive\\nCity:           Fort Worth\\nState/Prov:     TX\\nCountry:        US\\nPostalCode:     76161\\nRegDate:        1999-10-27\\nUpdated:        2018-07-19\\nSource:         ARIN\\n"}
{"range": "90.83.85.232/29", "id": "FR-ECOL-PRIM-BOURG", "name": "Orange Business Services", "country": "FR", "domain": "orange-business.com", "org_id": "ORG-OBS3-RIPE", "status": "ASSIGNED PA", "tech_id": "VB7783-RIPE", "mnt_id": "PC80199-MNT", "admin_id": "VB7783-RIPE", "abuse_id": "BRX1-RIPE", "created": "2023-12-20", "updated": "2023-12-20", "source": "ripe", "raw": "inetnum:        90.83.85.232 - 90.83.85.239\\nnetname:        FR-ECOL-PRIM-BOURG\\ncountry:        FR\\nstatus:         ASSIGNED PA\\nadmin-c:        VB7783-RIPE\\ntech-c:         VB7783-RIPE\\nmnt-by:         PC80199-MNT\\ncreated:        2023-12-20T08:37:33Z\\nlast-modified:  2023-12-20T08:37:33Z\\nsource:         RIPE\\nabuse-email:    gestionip.ft@orange.com\\nabuse-c:        BRX1-RIPE\\nabuse-org:      ORG-FT2-RIPE\\n\\nperson:         Vincent Bidegorry\\nnic-hdl:        VB7783-RIPE\\ne-mail:         juridique@mouguerre.fr\\naddress:        32 AV DE LA CROIX DE MOUGUERRE 64990 MOUGUERRE FRA\\nphone:          +33 788516308\\nmnt-by:         PC80199-MNT\\ncreated:        2023-12-20T08:37:32Z\\nlast-modified:  2023-12-20T08:37:32Z\\nsource:         RIPE\\n\\nroute:          90.83.0.0/16\\ndescr:          France Telecom SCE\\ndescr:          FT-SCE\\norigin:         AS3215\\nremarks:        -------------------------------------------\\nremarks:        For Hacking, Spamming or Security problems\\nremarks:        send mail ONLY to abuse@orange-business.com\\nremarks:        -------------------------------------------\\nmnt-by:         RAIN-TRANSPAC\\norg:            ORG-OBS3-RIPE\\ncreated:        2010-11-10T17:03:45Z\\nlast-modified:  2010-11-10T17:03:45Z\\nsource:         RIPE\\n\\norganisation:   ORG-OBS3-RIPE\\norg-name:       Orange Business Services\\norg-type:       Other\\naddress:        6 avenue Albert Durand\\naddress:        31700 Blagnac France\\ne-mail:         gestip.rain@orange.com\\nremarks:        **************************************\\nremarks:        * Pour les obligations legale *\\nremarks:        * Contacter uniquement les poles OL *\\nremarks:        * de France Telecom/Orange *\\nremarks:        * *\\nremarks:        * For legal issus joint only *\\nremarks:        * France telecom/orange legal team *\\nremarks:        **************************************\\nadmin-c:        AA2914-RIPE\\ntech-c:         AA2914-RIPE\\nabuse-c:        AA2914-RIPE\\nmnt-ref:        OLEANE-NOC\\nmnt-ref:        FT-BRX\\nmnt-ref:        RAIN-TRANSPAC\\nmnt-ref:        RIPE-NCC-HM-MNT\\nmnt-by:         RAIN-TRANSPAC\\ncreated:        2010-11-08T15:39:40Z\\nlast-modified:  2017-10-30T14:39:03Z\\nsource:         RIPE"}
{"range": "12.168.145.128/27", "id": "MARRIOTT93-145-128", "name": "MARRIOTT CORPORATIONATTN JOH", "country": "US", "domain": "", "org_id": "C11002660", "status": "REASSIGNMENT", "tech_id": "", "mnt_id": "", "admin_id": "", "abuse_id": "", "created": "2024-10-30", "updated": "2024-10-30", "source": "arin", "raw": "NetHandle:      NET-12-168-145-128-1\\nOrgID:          C11002660\\nParent:         NET-12-0-0-0-1\\nNetName:        MARRIOTT93-145-128\\nNetRange:       12.168.145.128 - 12.168.145.159\\nNetType:        reassignment\\nRegDate:        2024-10-30\\nUpdated:        2024-10-30\\nSource:         ARIN\\n\\n\\nOrgID:          C11002660\\nOrgName:        MARRIOTT CORPORATIONATTN JOH\\nCanAllocate:    \\nStreet:         4300 INTERNATIONAL GATEWAY\\nCity:           COLUMBUS\\nState/Prov:     OH\\nCountry:        US\\nPostalCode:     43219\\nRegDate:        2024-10-30\\nUpdated:        2024-10-30\\nSource:         ARIN\\n"}
{"range": "212.200.105.232/29", "id": "KUHNE_NAGEL-BG", "name": "Beograd, UGRINOVCI, PARTIZANSKA 228", "country": "RS", "domain": "kuehne-nagel.com", "org_id": "ORG-TS21-RIPE", "status": "ASSIGNED PA", "tech_id": "MB41608-RIPE", "mnt_id": "TELEKOM-MNT", "admin_id": "TC5349-RIPE", "abuse_id": "TSA44-RIPE", "created": "2018-01-30", "updated": "2018-01-30", "source": "ripe", "raw": "inetnum:        212.200.105.232 - 212.200.105.239\\nnetname:        KUHNE_NAGEL-BG\\ndescr:          Beograd, UGRINOVCI, PARTIZANSKA 228\\ncountry:        RS\\nadmin-c:        TC5349-RIPE\\ntech-c:         MB41608-RIPE\\nstatus:         ASSIGNED PA\\nmnt-by:         TELEKOM-MNT\\ncreated:        2018-01-30T10:35:29Z\\nlast-modified:  2018-01-30T10:35:29Z\\nsource:         RIPE\\nabuse-email:    abuse@telekom.rs\\nabuse-c:        TSA44-RIPE\\nabuse-org:      ORG-TS21-RIPE\\n\\nperson:         Marko Bozovic\\naddress:        Partizanska 228, 11277 Ugrinovci, Beograd\\ne-mail:         marko.bozovic@kuehne-nagel.com\\nphone:          +381 64 8822733\\nfax-no:         +381 11 3715193\\nnic-hdl:        MB41608-RIPE\\ncreated:        2016-05-10T08:42:34Z\\nlast-modified:  2016-05-10T08:42:34Z\\nsource:         RIPE\\nmnt-by:         TELEKOM-MNT\\n\\nperson:         TIJANA CVETKOVIC\\naddress:        PARTIZANSKA 228, UGRINOVCI\\nphone:          +381113715166\\nnic-hdl:        TC5349-RIPE\\nmnt-by:         TELEKOM-MNT\\ncreated:        2016-12-16T08:13:02Z\\nlast-modified:  2016-12-16T08:13:02Z\\nsource:         RIPE\\n\\nroute:          212.200.0.0/17\\norigin:         AS8400\\nmnt-by:         TELEKOM-MNT\\nmnt-by:         MTS-DOO-MNT\\ncreated:        2020-04-24T09:02:42Z\\nlast-modified:  2020-04-24T09:02:42Z\\nsource:         RIPE"}
{"range": "2a01:4f9:3071:152e::/64", "id": "HOS-696181", "name": "HOS-696181", "country": "DE", "domain": "hetzner.de", "org_id": "ORG-HOA1-RIPE", "status": "ASSIGNED", "tech_id": "HOAC1-RIPE", "mnt_id": "HOS-GUN", "admin_id": "HOAC1-RIPE", "abuse_id": "HOAC1-RIPE", "created": "2024-06-13", "updated": "2024-06-13", "source": "ripe", "raw": "inet6num:       2a01:4f9:3071:152e::/64\\nnetname:        HOS-696181\\ndescr:          HOS-696181\\ncountry:        DE\\nadmin-c:        HOAC1-RIPE\\ntech-c:         HOAC1-RIPE\\nstatus:         ASSIGNED\\nnotify:         ripe-mntner@hetzner.com\\nmnt-by:         HOS-GUN\\ncreated:        2024-06-13T01:35:09Z\\nlast-modified:  2024-06-13T01:35:09Z\\nsource:         RIPE\\nabuse-email:    abuse@hetzner.com\\nabuse-c:        HOAC1-RIPE\\nabuse-org:      ORG-HOA1-RIPE\\n\\nrole:           Hetzner Online GmbH - Contact Role\\naddress:        Hetzner Online GmbH\\naddress:        Industriestrasse 25\\naddress:        D-91710 Gunzenhausen\\naddress:        Germany\\nphone:          +49 9831 505-0\\nfax-no:         +49 9831 505-3\\ne-mail:         ripe@hetzner.com\\nabuse-mailbox:  abuse@hetzner.com\\nremarks:        *************************************************\\nremarks:        * For spam/abuse/security issues please contact *\\nremarks:        * abuse@hetzner.com, or fill out the form at *\\nremarks:        * abuse.hetzner.com, thank you. *\\nremarks:        *************************************************\\nremarks:        \\nremarks:        *************************************************\\nremarks:        * Any questions on Peering please send to *\\nremarks:        * peering@hetzner.com *\\nremarks:        *************************************************\\norg:            ORG-HOA1-RIPE\\nadmin-c:        MH375-RIPE\\ntech-c:         GM834-RIPE\\ntech-c:         SK2374-RIPE\\ntech-c:         MF1400-RIPE\\ntech-c:         SK8441-RIPE\\ntech-c:         DD15478-RIPE\\nnic-hdl:        HOAC1-RIPE\\nnotify:         ripe-mntner@hetzner.com\\nmnt-by:         HOS-GUN\\ncreated:        2004-08-12T09:40:20Z\\nlast-modified:  2022-11-22T18:33:55Z\\nsource:         RIPE\\n\\nroute6:         2a01:4f9::/32\\ndescr:          HETZNER-IPv6-BLK\\norigin:         AS24940\\norg:            ORG-HOA1-RIPE\\nmnt-by:         HOS-GUN\\ncreated:        2021-04-07T15:46:51Z\\nlast-modified:  2021-04-07T15:46:51Z\\nsource:         RIPE\\n\\norganisation:   ORG-HOA1-RIPE\\norg-name:       Hetzner Online GmbH\\ncountry:        DE\\norg-type:       LIR\\naddress:        Industriestrasse 25\\naddress:        D-91710\\naddress:        Gunzenhausen\\naddress:        GERMANY\\nphone:          +49 9831 5050\\nfax-no:         +49 9831 5053\\ne-mail:         info@hetzner.de\\nadmin-c:        MF1400-RIPE\\nadmin-c:        GM834-RIPE\\nadmin-c:        HOAC1-RIPE\\nadmin-c:        MH375-RIPE\\nadmin-c:        SK2374-RIPE\\nadmin-c:        SK8441-RIPE\\nabuse-c:        HOAC1-RIPE\\nmnt-ref:        RIPE-NCC-HM-MNT\\nmnt-ref:        HOS-GUN\\nmnt-by:         RIPE-NCC-HM-MNT\\nmnt-by:         HOS-GUN\\ncreated:        2004-04-17T11:07:58Z\\nlast-modified:  2022-11-22T18:32:44Z\\nsource:         RIPE"}
{"range": "37.130.250.176/28", "id": "UK-DOTTEDEYES-NETA", "name": "Dotted Eyes", "country": "GB", "domain": "pxc.co.uk", "org_id": "ORG-VA139-RIPE", "status": "ASSIGNED PA", "tech_id": "VONE-RIPE", "mnt_id": "MNT-VIRTUAL1", "admin_id": "VONE-RIPE", "abuse_id": "VONE-RIPE", "created": "2012-06-25", "updated": "2012-06-25", "source": "ripe", "raw": "inetnum:        37.130.250.176 - 37.130.250.191\\nnetname:        UK-DOTTEDEYES-NETA\\ndescr:          Dotted Eyes\\ncountry:        GB\\nadmin-c:        VONE-RIPE\\ntech-c:         VONE-RIPE\\nstatus:         ASSIGNED PA\\nmnt-by:         MNT-VIRTUAL1\\ncreated:        2012-06-25T11:23:16Z\\nlast-modified:  2012-06-25T11:23:16Z\\nsource:         RIPE\\nabuse-email:    abuse-reports@pxc.co.uk\\nabuse-c:        VONE-RIPE\\nabuse-org:      ORG-VA139-RIPE\\n\\nrole:           Virtual1 Network Operations\\naddress:        6th Floor Alphabeta, 14-18 Finsbury Square\\naddress:        London\\naddress:        EC2A 1BR\\nmnt-by:         MNT-VIRTUAL1\\ne-mail:         support@virtual1.com\\nadmin-c:        JH4887-RIPE\\ntech-c:         PW169-RIPE\\ntech-c:         SB11990-RIPE\\norg:            ORG-VA139-RIPE\\nnic-hdl:        VONE-RIPE\\ncreated:        2010-03-30T13:17:14Z\\nlast-modified:  2025-02-06T13:00:28Z\\nsource:         RIPE\\nabuse-mailbox:  abuse-reports@pxc.co.uk\\n\\nroute:          37.130.248.0/21\\ndescr:          Virtual1\\norigin:         AS47474\\nmnt-by:         MNT-VIRTUAL1\\ncreated:        2012-03-13T14:52:21Z\\nlast-modified:  2012-03-13T14:52:21Z\\nsource:         RIPE"}
{"range": "153.246.109.104/29", "id": "IBO-01", "name": "Mitsubishi Chemical Systems,Inc.", "country": "JP", "domain": "mitsubishichem-sys.co.jp", "org_id": "", "status": "", "tech_id": "JP00222021", "mnt_id": "", "admin_id": "JP00222021", "abuse_id": "", "created": "", "updated": "2023-01-30", "source": "jpnic", "raw": "inetnum:        153.246.109.104 - 153.246.109.111\\nnetname:        IBO-01\\ndescr:          Mitsubishi Chemical Systems,Inc.\\ncountry:        JP\\nadmin-c:        JP00222021\\ntech-c:         JP00222021\\nlast-modified:  2023-01-30T22:59:03Z\\nremarks:        This information has been partially mirrored by APNIC from\\nremarks:        JPNIC. To obtain more specific information, please use the\\nremarks:        JPNIC WHOIS Gateway at\\nremarks:        http://www.nic.ad.jp/en/db/whois/en-gateway.html or\\nremarks:        whois.nic.ad.jp for WHOIS client. (The WHOIS client\\nremarks:        defaults to Japanese output, use the /e switch for English\\nremarks:        output)\\nsource:         JPNIC\\n"}
{"range": "80.227.218.0/27", "id": "DUBAIINTERNATIONALFINANCIALCENTRE-NET", "name": "Dubai International Financial Centre", "country": "AE", "domain": "difc.ae", "org_id": "ORG-DIC1-RIPE", "status": "ASSIGNED PA", "tech_id": "HZ482-RIPE", "mnt_id": "DIC-MNT", "admin_id": "HZ482-RIPE", "abuse_id": "EITC2-RIPE", "created": "2007-04-03", "updated": "2008-05-29", "source": "ripe", "raw": "inetnum:        80.227.218.0 - 80.227.218.31\\nnetname:        DubaiInternationalFinancialCentre-NET\\ndescr:          Dubai International Financial Centre\\ncountry:        AE\\nremarks:        *******************************************************************\\nremarks:        * For any kind of illegal activity originating from our network *\\nremarks:        * Please Contact: abuse@du.ae *\\nremarks:        *******************************************************************\\nadmin-c:        HZ482-RIPE\\ntech-c:         HZ482-RIPE\\nstatus:         ASSIGNED PA\\nmnt-by:         DIC-MNT\\nmnt-lower:      DIC-MNT\\nmnt-routes:     DIC-MNT\\nnotify:         notify@du.ae\\ncreated:        2007-04-03T17:37:51Z\\nlast-modified:  2008-05-29T08:05:28Z\\nsource:         RIPE\\nabuse-email:    abuse@du.ae\\nabuse-c:        EITC2-RIPE\\nabuse-org:      ORG-DIC1-RIPE\\n\\nperson:         Humayun Zameer\\naddress:        Dubai International Financial Center\\naddress:        P.O.Box 74777\\naddress:        Dubai,UAE\\ne-mail:         humayunz@difc.ae\\nphone:          +9714 3191969\\nnotify:         humayunz@difc.ae\\nnic-hdl:        HZ482-RIPE\\ncreated:        2007-04-02T19:07:24Z\\nlast-modified:  2020-06-04T07:54:13Z\\nsource:         RIPE\\nmnt-by:         DIC-MNT\\n\\nroute:          80.227.216.0/21\\ndescr:          Emirates Integrated Telecommunications Company PJSC\\ndescr:          DIFC\\norigin:         AS15802\\nmnt-by:         DIC-MNT\\ncreated:        2006-11-20T12:38:51Z\\nlast-modified:  2006-11-30T07:11:24Z\\nsource:         RIPE"}
{"range": "203.186.112.88/30", "id": "GLOBALBLD", "name": "GLOBALBLDGMATELTD", "country": "HK", "domain": "ctihk.com", "org_id": "", "status": "ASSIGNED NON-PORTABLE", "tech_id": "SL113-AP", "mnt_id": "MAINT-HK-CTI", "admin_id": "CH134-AP", "abuse_id": "", "created": "", "updated": "2008-09-04", "source": "apnic", "raw": "inetnum:        203.186.112.88 - 203.186.112.91\\nnetname:        GLOBALBLD\\ncountry:        HK\\ndescr:          GLOBALBLDGMATELTD\\nadmin-c:        CH134-AP\\ntech-c:         SL113-AP\\nstatus:         ASSIGNED NON-PORTABLE\\nchanged:        hostmaster@ctihk.com 20061123\\nmnt-by:         MAINT-HK-CTI\\nsource:         APNIC\\n\\nperson:         CTINETS HOSTMASTER\\naddress:        15/F, Trans Asia Centre,\\naddress:        18 Kin Hong Street,\\naddress:        Kwai Chung, N.T.,\\naddress:        Hong Kong\\ncountry:        HK\\nphone:          +852-3999-3888\\nfax-no:         +852-2199-8542\\ne-mail:         hostmaster@hkbn.com.hk\\nnic-hdl:        CH134-AP\\nmnt-by:         MAINT-HK-HKBN\\nchanged:        hostmaster@hkbn.com.hk 20130731\\nsource:         APNIC\\n\\nperson:         Sam Leung\\nnic-hdl:        SL113-AP\\ne-mail:         abuse@hkbn.com.hk\\naddress:        15/F, Trans Asia Centre,\\naddress:        18 Kin Hong Street,\\naddress:        Kwai Chung, N.T.,\\naddress:        Hong Kong\\nphone:          +852-3999-3888\\nfax-no:         +852-2199-8542\\ncountry:        HK\\nchanged:        hostmaster@hkbn.com.hk 20130731\\nmnt-by:         MAINT-HK-HKBN\\nsource:         APNIC"}
{"range": "189.109.28.32/29", "id": "PBS10", "name": "IFF Ess\u00eancias e Fragr\u00e2ncias Ltda", "country": "BR", "domain": "iff.com", "org_id": "", "status": "REALLOCATED", "tech_id": "PSB51", "mnt_id": "", "admin_id": "", "abuse_id": "STE21", "created": "2008-10-27", "updated": "2013-03-07", "source": "lacnic", "raw": "inetnum:     189.109.28.32/29\\naut-num:     AS10429\\nabuse-c:     STE21\\nowner:       IFF Ess\u00eancias e Fragr\u00e2ncias Ltda\\nownerid:     33.043.951/0001-05\\nresponsible: Joel Campos\\nowner-c:     PSB51\\ntech-c:      PSB51\\ncreated:     20081027\\nchanged:     20130307\\ninetnum-up:  189.108.0.0/15\\n\\nnic-hdl-br:  PSB51\\nperson:      PSINet do Brasil S/A\\ncreated:     20010702\\nchanged:     20020814\\n\\nnic-hdl-br:  STE21\\nperson:      SOC - Telefonica Empresas\\ncreated:     20041207\\nchanged:     20070606"}
{"range": "103.147.150.0/24", "id": "EMPL-IN", "name": "Esto Broadband", "country": "IN", "domain": "esto.network", "org_id": "", "status": "ALLOCATED NON-PORTABLE", "tech_id": "EMPL1-AP", "mnt_id": "MAINT-EMPL-IN", "admin_id": "EMPL1-AP", "abuse_id": "IRT-EMPL-IN", "created": "", "updated": "2024-07-01", "source": "apnic", "raw": "inetnum:        103.147.150.0 - 103.147.150.255\\nnetname:        EMPL-IN\\ndescr:          Esto Broadband\\ncountry:        IN\\nadmin-c:        EMPL1-AP\\ntech-c:         EMPL1-AP\\nstatus:         ALLOCATED NON-PORTABLE\\nmnt-by:         MAINT-EMPL-IN\\nmnt-irt:        IRT-EMPL-IN\\nlast-modified:  2024-07-01T10:33:14Z\\ngeofeed:        https://esto.network/ipgeofeed\\nsource:         APNIC\\n\\nirt:            IRT-EMPL-IN\\naddress:        239 Tricity Plaza Peer Mushala, Zirakpur, Mohali Punjab 140603\\ne-mail:         erinmedia.in@gmail.com\\nabuse-mailbox:  erinmedia.in@gmail.com\\nadmin-c:        EMPL1-AP\\ntech-c:         EMPL1-AP\\nauth:           # Filtered\\nremarks:        erinmedia.in@gmail.com was validated on 2020-12-23\\nmnt-by:         MAINT-EMPL-IN\\nlast-modified:  2021-02-25T05:58:38Z\\nsource:         APNIC\\n\\nrole:           ERIN MEDIA Private Limited administrator\\naddress:        239 Tricity Plaza Peer Mushala, Zirakpur, Mohali Punjab 140603\\ncountry:        IN\\nphone:          +918352813528\\ne-mail:         erinmedia.in@gmail.com\\nadmin-c:        EMPL1-AP\\ntech-c:         EMPL1-AP\\nnic-hdl:        EMPL1-AP\\nmnt-by:         MAINT-EMPL-IN\\nlast-modified:  2020-01-13T03:35:15Z\\nsource:         APNIC\\n\\nroute:          103.147.150.0/24\\norigin:         AS135817\\ndescr:          ERIN MEDIA Private Limited 239 Tricity Plaza Peer Mushala Zirakpur\\nmnt-by:         MAINT-EMPL-IN\\nlast-modified:  2020-01-14T02:46:18Z\\nsource:         APNIC"}
{"range": "81.2.23.0/27", "id": "POL-ALTEKS-NET", "name": "Alteks, LTD", "country": "RU", "domain": "rt.ru", "org_id": "ORG-JR8-RIPE", "status": "ASSIGNED PA", "tech_id": "DSV2-RIPE", "mnt_id": "PRIMORYE-NCC-MNT", "admin_id": "DSV2-RIPE", "abuse_id": "RTNC-RIPE", "created": "2009-06-22", "updated": "2009-06-22", "source": "ripe", "raw": "inetnum:        81.2.23.0 - 81.2.23.31\\nnetname:        POL-ALTEKS-NET\\ndescr:          Alteks, LTD\\ndescr:          81, Okeansky ave., Vladivostok, Russia\\ndescr:          +7 4232 463704\\ncountry:        RU\\nadmin-c:        DSV2-RIPE\\ntech-c:         DSV2-RIPE\\nstatus:         ASSIGNED PA\\nmnt-by:         PRIMORYE-NCC-MNT\\ncreated:        2009-06-22T03:37:40Z\\nlast-modified:  2009-06-22T03:37:40Z\\nsource:         RIPE\\nabuse-email:    abuse@rt.ru\\nabuse-c:        RTNC-RIPE\\nabuse-org:      ORG-JR8-RIPE\\n\\nperson:         Sergey V. Demin\\naddress:        81, Okeansky ave., Vladivostok, Russia\\nphone:          +7 4232 744384\\nnic-hdl:        DSV2-RIPE\\nmnt-by:         PRIMORYE-NCC-MNT\\ncreated:        2009-06-22T03:37:39Z\\nlast-modified:  2009-06-22T03:37:39Z\\nsource:         RIPE\\n\\nroute:          81.2.0.0/19\\ndescr:          PRIMORYE NET\\norigin:         AS12332\\nnotify:         noc@dv.rt.ru\\nmnt-by:         PRIMORYE-NCC-MNT\\nmnt-by:         ROSTELECOM-MNT\\ncreated:        2003-01-29T09:40:29Z\\nlast-modified:  2019-03-14T22:34:39Z\\nsource:         RIPE"}