{"id": "KONTE", "name": "Kontera Technologies, Inc.", "address": "", "street": "1550 Bryant Street\\nSuite 975", "city": "San Francisco", "state": "CA", "postalcode": "94103", "country": "US", "admin_id": "NETAD117-ARIN", "tech_id": "NETAD117-ARIN", "abuse_id": "NETAD117-ARIN", "mnt_id": "NETAD117-ARIN", "email": "", "domain": "kontera.com", "created": "2009-07-14", "updated": "2009-07-14", "source": "arin", "raw": "OrgID:          KONTE\\nOrgName:        Kontera Technologies, Inc.\\nCanAllocate:    \\nStreet:         1550 Bryant Street\\nStreet:         Suite 975\\nCity:           San Francisco\\nState/Prov:     CA\\nCountry:        US\\nPostalCode:     94103\\nRegDate:        2009-07-14\\nUpdated:        2009-07-14\\nOrgAbuseHandle: NETAD117-ARIN\\nOrgAdminHandle: NETAD117-ARIN\\nOrgNOCHandle:   NETAD117-ARIN\\nOrgTechHandle:  NETAD117-ARIN\\nSource:         ARIN\\n\n\nPOCHandle:      NETAD117-ARIN\\nIsRole:         Y\\nLastName:       netadmin\\nFirstName:      \\nStreet:         1550 Bryant Street\\nStreet:         Suite 975\\nCity:           San Francisco\\nState/Prov:     CA\\nCountry:        US\\nPostalCode:     94103\\nRegDate:        2009-07-10\\nUpdated:        2009-12-09\\nOfficePhone:    +1-415-558-7780\\nMailbox:        jharris@kontera.com\\nSource:         ARIN\\n"}
{"id": "CL-2043", "name": "Proxy Services", "address": "", "street": "1136 Seashell Ave", "city": "Manahawkin", "state": "NJ", "postalcode": "08050", "country": "US", "admin_id": "SUPPO2242-ARIN", "tech_id": "SUPPO2242-ARIN", "abuse_id": "SUPPO2242-ARIN", "mnt_id": "SUPPO2242-ARIN", "email": "", "domain": "proxy.services", "created": "2019-12-09", "updated": "2019-12-09", "source": "arin", "raw": "OrgID:          CL-2043\\nOrgName:        Proxy Services\\nCanAllocate:    \\nStreet:         1136 Seashell Ave\\nCity:           Manahawkin\\nState/Prov:     NJ\\nCountry:        US\\nPostalCode:     08050\\nRegDate:        2019-12-09\\nUpdated:        2019-12-09\\nOrgAbuseHandle: SUPPO2242-ARIN\\nOrgAdminHandle: SUPPO2242-ARIN\\nOrgDNSHandle:   SUPPO2242-ARIN\\nOrgNOCHandle:   SUPPO2242-ARIN\\nOrgRoutingHandle:   SUPPO2242-ARIN\\nOrgTechHandle:  SUPPO2242-ARIN\\nSource:         ARIN\\n\n\nPOCHandle:      SUPPO2242-ARIN\\nIsRole:         Y\\nLastName:       Support\\nFirstName:      \\nStreet:         1136 Seashell Ave\\nCity:           Manahawkin\\nState/Prov:     NJ\\nCountry:        US\\nPostalCode:     08050\\nRegDate:        2019-12-07\\nUpdated:        2019-12-07\\nMobilePhone:    +1-609-389-4306\\nOfficePhone:    +1-609-389-4306\\nMailbox:        support@proxy.services\\nSource:         ARIN\\n"}
{"id": "APPTI-11", "name": "Apptio, Inc.", "address": "", "street": "11100 NE 8TH ST\\nSUITE 600", "city": "Bellevue", "state": "WA", "postalcode": "98004", "country": "US", "admin_id": "APPTI-ARIN", "tech_id": "NETWO8484-ARIN", "abuse_id": "ABUSE7045-ARIN", "mnt_id": "NETWO8484-ARIN", "email": "", "domain": "apptio.com", "created": "2014-12-03", "updated": "2018-03-22", "source": "arin", "raw": "OrgID:          APPTI-11\\nOrgName:        Apptio, Inc.\\nCanAllocate:    \\nStreet:         11100 NE 8TH ST\\nStreet:         SUITE 600\\nCity:           Bellevue\\nState/Prov:     WA\\nCountry:        US\\nPostalCode:     98004\\nRegDate:        2014-12-03\\nUpdated:        2018-03-22\\nOrgAbuseHandle: ABUSE7045-ARIN\\nOrgAdminHandle: APPTI-ARIN\\nOrgNOCHandle:   NETWO8484-ARIN\\nOrgTechHandle:  NETWO8484-ARIN\\nSource:         ARIN\\n\n\nPOCHandle:      NETWO8484-ARIN\\nIsRole:         Y\\nLastName:       Network Engineering\\nFirstName:      \\nStreet:         11100 NE 8th Street\\nStreet:         Suite 600\\nCity:           Bellevue\\nState/Prov:     WA\\nCountry:        US\\nPostalCode:     98004\\nRegDate:        2018-03-19\\nUpdated:        2022-01-27\\nOfficePhone:    +1-866-470-0320\\nMailbox:        neteng@apptio.com\\nSource:         ARIN\\n\n\nPOCHandle:      APPTI-ARIN\\nIsRole:         Y\\nLastName:       Apptio Admin\\nFirstName:      \\nStreet:         11100 NE 8th Street\\nStreet:         Suite 600\\nCity:           Bellevue\\nState/Prov:     WA\\nCountry:        US\\nPostalCode:     98004\\nRegDate:        2018-03-22\\nUpdated:        2022-07-12\\nOfficePhone:    +1-866-470-0320\\nMailbox:        netops-admin@apptio.com\\nSource:         ARIN\\n\n\nPOCHandle:      ABUSE7045-ARIN\\nIsRole:         Y\\nLastName:       Abuse\\nFirstName:      \\nStreet:         11100 NE 8th Street\\nStreet:         Suite 600\\nCity:           Bellevue\\nState/Prov:     WA\\nCountry:        US\\nPostalCode:     98004\\nRegDate:        2018-03-22\\nUpdated:        2022-01-27\\nOfficePhone:    +1-866-470-0320\\nMailbox:        netops-abuse@apptio.com\\nSource:         ARIN\\n"}
{"id": "ALIME", "name": "AliMed, Inc.", "address": "", "street": "297 High St.", "city": "Dedham", "state": "MA", "postalcode": "02026", "country": "US", "admin_id": "FISHF-ARIN", "tech_id": "VJD1-ARIN", "abuse_id": "FISHF-ARIN", "mnt_id": "FISHF-ARIN", "email": "", "domain": "alimed.com", "created": "2012-10-04", "updated": "2012-10-04", "source": "arin", "raw": "OrgID:          ALIME\\nOrgName:        AliMed, Inc.\\nCanAllocate:    \\nStreet:         297 High St.\\nCity:           Dedham\\nState/Prov:     MA\\nCountry:        US\\nPostalCode:     02026\\nRegDate:        2012-10-04\\nUpdated:        2012-10-04\\nOrgAbuseHandle: FISHF-ARIN\\nOrgAdminHandle: FISHF-ARIN\\nOrgNOCHandle:   FISHF-ARIN\\nOrgTechHandle:  VJD1-ARIN\\nSource:         ARIN\\n\n\nPOCHandle:      VJD1-ARIN\\nIsRole:         N\\nLastName:       DiPippo\\nFirstName:      Vincent\\nStreet:         575 Park Avenue\\nCity:           Cranston\\nState/Prov:     RI\\nCountry:        US\\nPostalCode:     02910\\nRegDate:        2001-10-03\\nUpdated:        2016-11-21\\nOfficePhone:    +1-401-781-0300\\nMailbox:        vdipippo@focus24.com\\nSource:         ARIN\\n\n\nPOCHandle:      FISHF-ARIN\\nIsRole:         N\\nLastName:       Fish\\nFirstName:      Fred\\nStreet:         297 High St.\\nCity:           Dedham\\nState/Prov:     MA\\nCountry:        US\\nPostalCode:     02026\\nRegDate:        2012-10-04\\nUpdated:        2022-03-24\\nOfficePhone:    +1-781-329-2900\\nMailbox:        helpdesk@alimed.com\\nSource:         ARIN\\n"}
{"id": "CEL-54", "name": "Columbia Energy L.L.C", "address": "", "street": "2929 Melrose St", "city": "Walla Walla", "state": "WA", "postalcode": "99362", "country": "US", "admin_id": "DAWES99-ARIN", "tech_id": "DAWES99-ARIN\\NNNNO1-ARIN", "abuse_id": "NNNO1-ARIN", "mnt_id": "NNNO1-ARIN", "email": "", "domain": "columbiarea.coop", "created": "2011-01-04", "updated": "2022-06-27", "source": "arin", "raw": "OrgID:          CEL-54\\nOrgName:        Columbia Energy L.L.C\\nCanAllocate:    \\nStreet:         2929 Melrose St\\nCity:           Walla Walla\\nState/Prov:     WA\\nCountry:        US\\nPostalCode:     99362\\nRegDate:        2011-01-04\\nUpdated:        2022-06-27\\nOrgAbuseHandle: NNNO1-ARIN\\nOrgAdminHandle: DAWES99-ARIN\\nOrgDNSHandle:   HAYES500-ARIN\\nOrgNOCHandle:   NNNO1-ARIN\\nOrgRoutingHandle:   DAWES99-ARIN\\nOrgRoutingHandle:   NNNO1-ARIN\\nOrgTechHandle:  DAWES99-ARIN\\nOrgTechHandle:  NNNO1-ARIN\\nSource:         ARIN\\n\n\nPOCHandle:      DAWES99-ARIN\\nIsRole:         N\\nLastName:       Dawes\\nFirstName:      Gene\\nStreet:         2929 Melrose St\\nCity:           Walla Walla\\nState/Prov:     WA\\nCountry:        US\\nPostalCode:     99362\\nRegDate:        2019-05-24\\nUpdated:        2022-02-07\\nOfficePhone:    +1-509-526-1017\\nMailbox:        gdawes@columbiarea.coop\\nSource:         ARIN\\n\n\nPOCHandle:      NNNO1-ARIN\\nIsRole:         N\\nLastName:       Network Operations\\nFirstName:      NOC\\nStreet:         2929 Melrose St\\nCity:           Walla Walla\\nState/Prov:     WA\\nCountry:        US\\nPostalCode:     99362\\nRegDate:        2015-05-18\\nUpdated:        2020-11-03\\nOfficePhone:    +1-509-526-4041\\nFaxPhone:       +1-509-526-3666\\nMailbox:        cellc@columbiarea.coop\\nSource:         ARIN\\n"}
{"id": "CDS-370", "name": "CDNS", "address": "", "street": "2655 Seely Ave\\nBuilding 7", "city": "San Jose", "state": "CA", "postalcode": "95134", "country": "US", "admin_id": "HOSTM2078-ARIN", "tech_id": "HOSTM2078-ARIN", "abuse_id": "HOSTM2078-ARIN", "mnt_id": "HOSTM2078-ARIN", "email": "", "domain": "cadence.com", "created": "2018-03-22", "updated": "2018-03-22", "source": "arin", "raw": "OrgID:          CDS-370\\nOrgName:        CDNS\\nCanAllocate:    \\nStreet:         2655 Seely Ave\\nStreet:         Building 7\\nCity:           San Jose\\nState/Prov:     CA\\nCountry:        US\\nPostalCode:     95134\\nRegDate:        2018-03-22\\nUpdated:        2018-03-22\\nOrgAbuseHandle: HOSTM2078-ARIN\\nOrgAdminHandle: HOSTM2078-ARIN\\nOrgNOCHandle:   HOSTM2078-ARIN\\nOrgTechHandle:  HOSTM2078-ARIN\\nSource:         ARIN\\n\n\nPOCHandle:      HOSTM2078-ARIN\\nIsRole:         Y\\nLastName:       Hostmaster\\nFirstName:      \\nStreet:         2655 Seely Ave\\nStreet:         Building 7\\nCity:           San Jose\\nState/Prov:     CA\\nCountry:        US\\nPostalCode:     95134\\nRegDate:        2018-02-12\\nUpdated:        2022-03-22\\nOfficePhone:    +1-408-428-4070\\nMailbox:        hostmaster@cadence.com\\nSource:         ARIN\\n"}
{"id": "MH-101", "name": "Mission Regional Medical Center", "address": "", "street": "900 S Bryan Rd", "city": "Mission", "state": "TX", "postalcode": "78572", "country": "US", "admin_id": "NOC12776-ARIN", "tech_id": "NOC12776-ARIN", "abuse_id": "NOC12776-ARIN", "mnt_id": "NOC12776-ARIN", "email": "", "domain": "missionrmc.org", "created": "2012-09-10", "updated": "2012-09-10", "source": "arin", "raw": "OrgID:          MH-101\\nOrgName:        Mission Regional Medical Center\\nCanAllocate:    \\nStreet:         900 S Bryan Rd\\nCity:           Mission\\nState/Prov:     TX\\nCountry:        US\\nPostalCode:     78572\\nRegDate:        2012-09-10\\nUpdated:        2012-09-10\\nOrgAbuseHandle: NOC12776-ARIN\\nOrgAdminHandle: NOC12776-ARIN\\nOrgNOCHandle:   NOC12776-ARIN\\nOrgTechHandle:  NOC12776-ARIN\\nSource:         ARIN\\n\n\nPOCHandle:      NOC12776-ARIN\\nIsRole:         Y\\nLastName:       Network Operations Center\\nFirstName:      \\nStreet:         900 S. Bryan Road\\nCity:           Mission\\nState/Prov:     TX\\nCountry:        US\\nPostalCode:     78572\\nRegDate:        2012-08-28\\nUpdated:        2020-05-15\\nFaxPhone:       +1-956-323-1360\\nMobilePhone:    +1-909-319-3333\\nOfficePhone:    +1-956-323-1350\\nMailbox:        SLazarus@Primehealthcare.com\\nMailbox:        noc@missionrmc.org\\nSource:         ARIN\\n"}
{"id": "AG-506", "name": "Assurity Group Inc", "address": "", "street": "2000 Q Street", "city": "Lincoln", "state": "NE", "postalcode": "68503", "country": "US", "admin_id": "JANOU4-ARIN", "tech_id": "JANOU4-ARIN", "abuse_id": "JANOU4-ARIN", "mnt_id": "JANOU4-ARIN", "email": "", "domain": "assurity.com", "created": "2015-10-30", "updated": "2015-10-30", "source": "arin", "raw": "OrgID:          AG-506\\nOrgName:        Assurity Group Inc\\nCanAllocate:    \\nStreet:         2000 Q Street\\nCity:           Lincoln\\nState/Prov:     NE\\nCountry:        US\\nPostalCode:     68503\\nRegDate:        2015-10-30\\nUpdated:        2015-10-30\\nOrgAbuseHandle: JANOU4-ARIN\\nOrgAdminHandle: JANOU4-ARIN\\nOrgNOCHandle:   JANOU4-ARIN\\nOrgTechHandle:  JANOU4-ARIN\\nSource:         ARIN\\n\n\nPOCHandle:      JANOU4-ARIN\\nIsRole:         N\\nLastName:       Janousek\\nFirstName:      Tim\\nStreet:         2000 Q Street\\nCity:           Lincoln\\nState/Prov:     NE\\nCountry:        US\\nPostalCode:     68503\\nRegDate:        2015-10-26\\nUpdated:        2021-11-09\\nOfficePhone:    +1-402-437-4329\\nMailbox:        TJanousek@assurity.com\\nSource:         ARIN\\n"}
{"id": "MA-478", "name": "MedQuest Associates, Inc.", "address": "", "street": "3480 Preston Ridge Road\\nSuite 500", "city": "Alpharetta", "state": "GA", "postalcode": "30005", "country": "US", "admin_id": "CAB33-ARIN", "tech_id": "NETWO8366-ARIN", "abuse_id": "NETWO8366-ARIN", "mnt_id": "NETWO8366-ARIN", "email": "", "domain": "mqimaging.com", "created": "2015-11-10", "updated": "2017-11-09", "source": "arin", "raw": "OrgID:          MA-478\\nOrgName:        MedQuest Associates, Inc.\\nCanAllocate:    \\nStreet:         3480 Preston Ridge Road\\nStreet:         Suite 500\\nCity:           Alpharetta\\nState/Prov:     GA\\nCountry:        US\\nPostalCode:     30005\\nRegDate:        2015-11-10\\nUpdated:        2017-11-09\\nOrgAbuseHandle: NETWO8366-ARIN\\nOrgAdminHandle: CAB33-ARIN\\nOrgNOCHandle:   NETWO8366-ARIN\\nOrgTechHandle:  NETWO8366-ARIN\\nSource:         ARIN\\n\n\nPOCHandle:      CAB33-ARIN\\nIsRole:         N\\nLastName:       Bermudez\\nFirstName:      Carlos\\nStreet:         3480 Preston Ridge Road\\nCity:           Alpharetta\\nState/Prov:     GA\\nCountry:        US\\nPostalCode:     30005\\nRegDate:        2015-11-09\\nUpdated:        2020-11-23\\nOfficePhone:    +1-678-992-7293\\nMobilePhone:    +1-678-768-4854\\nMailbox:        aalmassud@medquestmail.com\\nSource:         ARIN\\n\n\nPOCHandle:      NETWO8366-ARIN\\nIsRole:         Y\\nLastName:       Network Admin\\nFirstName:      \\nStreet:         3480 Preston Ridge Road\\nStreet:         Suite 500\\nCity:           Alpharetta\\nState/Prov:     GA\\nCountry:        US\\nPostalCode:     30005\\nRegDate:        2017-11-09\\nUpdated:        2021-11-23\\nOfficePhone:    +1-678-992-7500\\nMailbox:        networkadmin@medquestmail.com\\nSource:         ARIN\\n"}
{"id": "ISC-114", "name": "International Speedway Corp.", "address": "", "street": "1801 W. Int'l Speedway Blvd.", "city": "Daytona Beach", "state": "FL", "postalcode": "32114", "country": "US", "admin_id": "ARINA281-ARIN", "tech_id": "ARINA281-ARIN", "abuse_id": "ARINA282-ARIN", "mnt_id": "ARINA281-ARIN", "email": "", "domain": "internationalspeedwaycorporation.com", "created": "2007-08-13", "updated": "2021-01-08", "source": "arin", "raw": "OrgID:          ISC-114\\nOrgName:        International Speedway Corp.\\nCanAllocate:    \\nStreet:         1801 W. Int'l Speedway Blvd.\\nCity:           Daytona Beach\\nState/Prov:     FL\\nCountry:        US\\nPostalCode:     32114\\nRegDate:        2007-08-13\\nUpdated:        2021-01-08\\nOrgAbuseHandle: ARINA282-ARIN\\nOrgAdminHandle: ARINA281-ARIN\\nOrgDNSHandle:   ARINA281-ARIN\\nOrgNOCHandle:   ARINA281-ARIN\\nOrgRoutingHandle:   ARINA281-ARIN\\nOrgTechHandle:  ARINA281-ARIN\\nSource:         ARIN\\n\n\nPOCHandle:      ARINA282-ARIN\\nIsRole:         Y\\nLastName:       ARIN-Abuse\\nFirstName:      \\nStreet:         One Daytona Blvd\\nCity:           Daytona Beach\\nState/Prov:     FL\\nCountry:        US\\nPostalCode:     32114\\nRegDate:        2021-01-08\\nUpdated:        2022-01-11\\nOfficePhone:    +1-386-681-5797\\nMailbox:        ARIN-Abuse@nascar.com\\nSource:         ARIN\\n\n\nPOCHandle:      ARINA281-ARIN\\nIsRole:         Y\\nLastName:       ARIN-Admin\\nFirstName:      \\nStreet:         One Daytona Blvd\\nCity:           Daytona Beach\\nState/Prov:     FL\\nCountry:        US\\nPostalCode:     32114\\nRegDate:        2021-01-08\\nUpdated:        2022-01-11\\nOfficePhone:    +1-386-681-5797\\nMailbox:        ARIN-Admin@nascar.com\\nSource:         ARIN\\n"}
{"id": "KTL-29", "name": "Kalleo Technologies, LLC", "address": "", "street": "1640 McCracken Blvd. Suite 114", "city": "Paducah", "state": "KY", "postalcode": "42001", "country": "US", "admin_id": "TRUIT-ARIN", "tech_id": "TRUIT-ARIN", "abuse_id": "TRUIT-ARIN", "mnt_id": "TRUIT-ARIN", "email": "", "domain": "kalleo.net", "created": "2012-02-21", "updated": "2012-02-21", "source": "arin", "raw": "OrgID:          KTL-29\\nOrgName:        Kalleo Technologies, LLC\\nCanAllocate:    \\nStreet:         1640 McCracken Blvd. Suite 114\\nCity:           Paducah\\nState/Prov:     KY\\nCountry:        US\\nPostalCode:     42001\\nRegDate:        2012-02-21\\nUpdated:        2012-02-21\\nOrgAbuseHandle: TRUIT-ARIN\\nOrgAdminHandle: TRUIT-ARIN\\nOrgNOCHandle:   TRUIT-ARIN\\nOrgTechHandle:  TRUIT-ARIN\\nSource:         ARIN\\n\n\nPOCHandle:      TRUIT-ARIN\\nIsRole:         N\\nLastName:       Truitt\\nFirstName:      Doug\\nStreet:         1640 McCracken Blvd. Suite 114\\nCity:           Paducah\\nState/Prov:     KY\\nCountry:        US\\nPostalCode:     42001\\nRegDate:        2012-02-17\\nUpdated:        2014-09-24\\nOfficePhone:    +1-270-908-4136\\nMailbox:        dtruitt@kalleo.net\\nSource:         ARIN\\n"}
{"id": "ACLD", "name": "Alachua County Library District", "address": "", "street": "401 E. University Ave", "city": "Gainesville", "state": "FL", "postalcode": "32601", "country": "US", "admin_id": "COCHR68-ARIN", "tech_id": "COCHR68-ARIN", "abuse_id": "COCHR68-ARIN", "mnt_id": "COCHR68-ARIN", "email": "", "domain": "aclib.us", "created": "1988-09-12", "updated": "2018-12-20", "source": "arin", "raw": "OrgID:          ACLD\\nOrgName:        Alachua County Library District\\nCanAllocate:    \\nStreet:         401 E. University Ave\\nCity:           Gainesville\\nState/Prov:     FL\\nCountry:        US\\nPostalCode:     32601\\nComment:        For questions or comments please contact \\nComment:        Automated Services at 352-334-3998\\nRegDate:        1988-09-12\\nUpdated:        2018-12-20\\nOrgAbuseHandle: COCHR68-ARIN\\nOrgAdminHandle: COCHR68-ARIN\\nOrgNOCHandle:   COCHR68-ARIN\\nOrgTechHandle:  COCHR68-ARIN\\nSource:         ARIN\\n\n\nPOCHandle:      COCHR68-ARIN\\nIsRole:         N\\nLastName:       Cochran\\nFirstName:      Chris\\nStreet:         401 E. University Ave.\\nCity:           Gainesville\\nState/Prov:     FL\\nCountry:        US\\nPostalCode:     32601\\nRegDate:        2017-02-06\\nUpdated:        2019-12-20\\nOfficePhone:    +1-352-334-3998\\nOfficePhone:    +1-352-334-3995\\nMailbox:        ccochran@aclib.us\\nSource:         ARIN\\n"}
{"id": "CT-3", "name": "CIK Telecom INC", "address": "", "street": "241 Whitehall Drive", "city": "Markham", "state": "ON", "postalcode": "L3R 5G5", "country": "CA", "admin_id": "DENGJ1-ARIN", "tech_id": "DENGJ1-ARIN", "abuse_id": "DENGJ1-ARIN", "mnt_id": "DENGJ1-ARIN", "email": "", "domain": "ciktel.com", "created": "2011-03-29", "updated": "2018-07-18", "source": "arin", "raw": "OrgID:          CT-3\\nOrgName:        CIK Telecom INC\\nCanAllocate:    \\nStreet:         241 Whitehall Drive\\nCity:           Markham\\nState/Prov:     ON\\nCountry:        CA\\nPostalCode:     L3R 5G5\\nComment:        www.ciktel.com NOC working hours 7x24\\nRegDate:        2011-03-29\\nUpdated:        2018-07-18\\nOrgAbuseHandle: DENGJ1-ARIN\\nOrgAdminHandle: DENGJ1-ARIN\\nOrgNOCHandle:   DENGJ1-ARIN\\nOrgTechHandle:  DENGJ1-ARIN\\nSource:         ARIN\\n\n\nPOCHandle:      DENGJ1-ARIN\\nIsRole:         N\\nLastName:       deng\\nFirstName:      jordan\\nStreet:         282 consumers road\\nCity:           Toronto\\nState/Prov:     ON\\nCountry:        CA\\nPostalCode:     M2J 1P8\\nRegDate:        2011-03-25\\nUpdated:        2017-11-18\\nOfficePhone:    +1-416-800-4111\\nFaxPhone:       +1-416-637-6999\\nOfficePhone:    +1-416-848-1517\\nMailbox:        abuse@ciktel.com\\nSource:         ARIN\\n"}
{"id": "PEAK", "name": "PEAK 10", "address": "", "street": "8910 LENOX POINTE DR\\nBLDG MAIN FLR 1 RM ACCESS", "city": "CHARLOTTE", "state": "NC", "postalcode": "28273", "country": "US", "admin_id": "DTR20-ARIN", "tech_id": "NETWO1470-ARIN", "abuse_id": "ZP76-ARIN", "mnt_id": "ZP63-ARIN", "email": "", "domain": "peak10.com", "created": "2013-02-22", "updated": "2019-05-17", "source": "arin", "raw": "OrgID:          PEAK\\nOrgName:        PEAK 10\\nCanAllocate:    \\nStreet:         8910 LENOX POINTE DR\\nStreet:         BLDG MAIN FLR 1 RM ACCESS\\nCity:           CHARLOTTE\\nState/Prov:     NC\\nCountry:        US\\nPostalCode:     28273\\nRegDate:        2013-02-22\\nUpdated:        2019-05-17\\nOrgAbuseHandle: ZP76-ARIN\\nOrgAdminHandle: DTR20-ARIN\\nOrgNOCHandle:   ZP63-ARIN\\nOrgTechHandle:  NETWO1470-ARIN\\nSource:         ARIN\\n\n\nPOCHandle:      NETWO1470-ARIN\\nIsRole:         Y\\nLastName:       Network Engineering\\nFirstName:      \\nStreet:         600 Forest Point Circle, Suite 100\\nCity:           Charlotte\\nState/Prov:     NC\\nCountry:        US\\nPostalCode:     28273\\nRegDate:        2006-12-13\\nUpdated:        2022-05-20\\nOfficePhone:    +1-833-264-3539\\nMailbox:        dl-arin@flexential.com\\nSource:         ARIN\\n\n\nPOCHandle:      ZP76-ARIN\\nIsRole:         Y\\nLastName:       Abuse\\nFirstName:      \\nStreet:         600 Forest Point Circle, Suite 100\\nCity:           Charlotte\\nState/Prov:     NC\\nCountry:        US\\nPostalCode:     28273\\nRegDate:        2001-09-18\\nUpdated:        2022-05-20\\nOfficePhone:    +1-833-264-3539\\nMailbox:        abuse@flexential.com\\nSource:         ARIN\\n\n\nPOCHandle:      ZP63-ARIN\\nIsRole:         Y\\nLastName:       Support\\nFirstName:      \\nStreet:         600 Forest Point Circle, Suite 100\\nCity:           Charlotte\\nState/Prov:     NC\\nCountry:        US\\nPostalCode:     28273\\nRegDate:        2001-05-16\\nUpdated:        2022-05-20\\nOfficePhone:    +1-833-264-3539\\nMailbox:        support@flexential.com\\nSource:         ARIN\\n\n\nPOCHandle:      DTR20-ARIN\\nIsRole:         N\\nLastName:       True\\nFirstName:      Devon\\nStreet:         600 Forest Point Circle, Suite 100\\nCity:           Charlotte\\nState/Prov:     NC\\nCountry:        US\\nPostalCode:     28273\\nRegDate:        2005-07-29\\nUpdated:        2022-05-20\\nOfficePhone:    +1-833-264-3539\\nMailbox:        devon.true@flexential.com\\nSource:         ARIN\\n"}
{"id": "APP-75", "name": "AdvantageCare Physicians, P.C.", "address": "", "street": "55 Water Street", "city": "New York", "state": "NY", "postalcode": "10041", "country": "US", "admin_id": "CJP1-ARIN", "tech_id": "CJP1-ARIN", "abuse_id": "CJP1-ARIN\\NTMM21-ARIN", "mnt_id": "CJP1-ARIN", "email": "", "domain": "acpny.com", "created": "2014-04-09", "updated": "2020-08-27", "source": "arin", "raw": "OrgID:          APP-75\\nOrgName:        AdvantageCare Physicians, P.C.\\nCanAllocate:    \\nStreet:         55 Water Street\\nCity:           New York\\nState/Prov:     NY\\nCountry:        US\\nPostalCode:     10041\\nRegDate:        2014-04-09\\nUpdated:        2020-08-27\\nOrgAbuseHandle: CJP1-ARIN\\nOrgAbuseHandle: TMM21-ARIN\\nOrgAdminHandle: CJP1-ARIN\\nOrgDNSHandle:   CJP1-ARIN\\nOrgNOCHandle:   CJP1-ARIN\\nOrgRoutingHandle:   CJP1-ARIN\\nOrgTechHandle:  CJP1-ARIN\\nSource:         ARIN\\n\n\nPOCHandle:      CJP1-ARIN\\nIsRole:         N\\nLastName:       Pilkington\\nFirstName:      Christopher\\nStreet:         55 Water Street\\nCity:           New York\\nState/Prov:     NY\\nCountry:        US\\nPostalCode:     10041\\nRegDate:        2002-05-28\\nUpdated:        2021-11-01\\nMobilePhone:    +1-315-935-9552\\nOfficePhone:    +1-646-680-1226\\nMailbox:        cpilkington@emblemhealth.com\\nSource:         ARIN\\n\n\nPOCHandle:      TMM21-ARIN\\nIsRole:         N\\nLastName:       mcdermott\\nFirstName:      Thomas\\nStreet:         55 Water St\\nCity:           New York\\nState/Prov:     NY\\nCountry:        US\\nPostalCode:     10956\\nRegDate:        2017-01-26\\nUpdated:        2021-09-01\\nMobilePhone:    +1-917-843-4521\\nOfficePhone:    +1-646-447-4110\\nMailbox:        tmcdermott@emblemhealth.com\\nSource:         ARIN\\n"}
{"id": "BSC-101", "name": "Buffalo State College", "address": "", "street": "1300 Elmwood Ave.", "city": "Buffalo", "state": "NY", "postalcode": "14222", "country": "US", "admin_id": "TDK1-ARIN", "tech_id": "TDK1-ARIN", "abuse_id": "TDK1-ARIN", "mnt_id": "TDK1-ARIN", "email": "", "domain": "buffalostate.edu", "created": "2007-11-06", "updated": "2017-12-26", "source": "arin", "raw": "OrgID:          BSC-101\\nOrgName:        Buffalo State College\\nCanAllocate:    \\nStreet:         1300 Elmwood Ave.\\nCity:           Buffalo\\nState/Prov:     NY\\nCountry:        US\\nPostalCode:     14222\\nRegDate:        2007-11-06\\nUpdated:        2017-12-26\\nOrgAbuseHandle: TDK1-ARIN\\nOrgAdminHandle: TDK1-ARIN\\nOrgNOCHandle:   TDK1-ARIN\\nOrgTechHandle:  TDK1-ARIN\\nSource:         ARIN\\n\n\nPOCHandle:      TDK1-ARIN\\nIsRole:         N\\nLastName:       Killian\\nFirstName:      Thomas\\nStreet:         1300 Elmwood Ave.\\nStreet:         TR C3\\nCity:           Buffalo\\nState/Prov:     NY\\nCountry:        US\\nPostalCode:     14222\\nRegDate:        2007-09-26\\nUpdated:        2021-11-23\\nOfficePhone:    +1-716-878-5122\\nMailbox:        killiatd@buffalostate.edu\\nSource:         ARIN\\n"}
{"id": "IG-308", "name": "InterLIR GmbH", "address": "", "street": "54 Josef-Orlopp-Strasse", "city": "Berlin", "state": "Berlin", "postalcode": "10365", "country": "DE", "admin_id": "NOC33466-ARIN", "tech_id": "NOC33466-ARIN", "abuse_id": "NOC33466-ARIN", "mnt_id": "NOC33466-ARIN", "email": "", "domain": "interlir.com", "created": "2022-05-09", "updated": "2022-06-10", "source": "arin", "raw": "OrgID:          IG-308\\nOrgName:        InterLIR GmbH\\nCanAllocate:    \\nStreet:         54 Josef-Orlopp-Strasse\\nCity:           Berlin\\nState/Prov:     Berlin\\nCountry:        DE\\nPostalCode:     10365\\nRegDate:        2022-05-09\\nUpdated:        2022-06-10\\nOrgAbuseHandle: NOC33466-ARIN\\nOrgAdminHandle: NOC33466-ARIN\\nOrgNOCHandle:   NOC33466-ARIN\\nOrgRoutingHandle:   NOC33466-ARIN\\nOrgTechHandle:  NOC33466-ARIN\\nSource:         ARIN\\n\n\nPOCHandle:      NOC33466-ARIN\\nIsRole:         Y\\nLastName:       NOC\\nFirstName:      \\nStreet:         Josef-Orlopp-Strasse, 54\\nCity:           Berlin\\nState/Prov:     Berlin\\nCountry:        DE\\nPostalCode:     10365\\nRegDate:        2022-05-09\\nUpdated:        2022-05-09\\nOfficePhone:    +49 (0) 176 30 50 27 96\\nMailbox:        ripe@interlir.com\\nSource:         ARIN\\n"}
{"id": "MINDB-8", "name": "MindBody, Inc.", "address": "", "street": "4051 Broad Street", "city": "San Luis Obispo", "state": "CA", "postalcode": "93401", "country": "US", "admin_id": "LIVIN98-ARIN", "tech_id": "CLOUD110-ARIN", "abuse_id": "CLOUD110-ARIN", "mnt_id": "MINDB-ARIN", "email": "", "domain": "mindbodyonline.com", "created": "2018-10-23", "updated": "2018-12-05", "source": "arin", "raw": "OrgID:          MINDB-8\\nOrgName:        MindBody, Inc.\\nCanAllocate:    \\nStreet:         4051 Broad Street\\nCity:           San Luis Obispo\\nState/Prov:     CA\\nCountry:        US\\nPostalCode:     93401\\nRegDate:        2018-10-23\\nUpdated:        2018-12-05\\nOrgAbuseHandle: CLOUD110-ARIN\\nOrgAdminHandle: LIVIN98-ARIN\\nOrgNOCHandle:   MINDB-ARIN\\nOrgTechHandle:  CLOUD110-ARIN\\nSource:         ARIN\\n\n\nPOCHandle:      MINDB-ARIN\\nIsRole:         Y\\nLastName:       MINDBODY EOC\\nFirstName:      \\nStreet:         4051 Broad Steet\\nCity:           San Luis Obispo\\nState/Prov:     CA\\nCountry:        US\\nPostalCode:     93401\\nRegDate:        2018-12-04\\nUpdated:        2018-12-04\\nOfficePhone:    +1-805-465-7911\\nMailbox:        mindbodynoc@mindbodyonline.com\\nSource:         ARIN\\n\n\nPOCHandle:      CLOUD110-ARIN\\nIsRole:         Y\\nLastName:       Cloud Engineering\\nFirstName:      \\nStreet:         4051 Broad St\\nCity:           San Luis Obispo\\nState/Prov:     CA\\nCountry:        US\\nPostalCode:     93401\\nRegDate:        2018-11-28\\nUpdated:        2021-12-10\\nOfficePhone:    +1-805-586-2503\\nMailbox:        cloud@mindbodyonline.com\\nSource:         ARIN\\n\n\nPOCHandle:      LIVIN98-ARIN\\nIsRole:         N\\nLastName:       Livingston\\nFirstName:      John\\nStreet:         4051 Broad Street\\nCity:           San Luis Obispo\\nState/Prov:     CA\\nCountry:        US\\nPostalCode:     93401\\nRegDate:        2018-10-17\\nUpdated:        2022-03-03\\nOfficePhone:    +1-805-706-8522\\nMobilePhone:    +1-949-338-8943\\nMailbox:        john.livingston@mindbodyonline.com\\nSource:         ARIN\\n"}
{"id": "HR-233", "name": "Hammerhead Resources Inc.", "address": "", "street": "Eighth Avenue Place\\nEast Tower, Suite 2700\\n525 8th Avenue SW", "city": "Calgary", "state": "AB", "postalcode": "T2P 1G1", "country": "CA", "admin_id": "ADMIN7364-ARIN", "tech_id": "ADMIN7364-ARIN", "abuse_id": "ADMIN7364-ARIN", "mnt_id": "ADMIN7364-ARIN", "email": "", "domain": "hhres.com", "created": "2019-07-23", "updated": "2020-02-06", "source": "arin", "raw": "OrgID:          HR-233\\nOrgName:        Hammerhead Resources Inc.\\nCanAllocate:    \\nStreet:         Eighth Avenue Place\\nStreet:         East Tower, Suite 2700 \\nStreet:         525 8th Avenue SW\\nCity:           Calgary\\nState/Prov:     AB\\nCountry:        CA\\nPostalCode:     T2P 1G1\\nRegDate:        2019-07-23\\nUpdated:        2020-02-06\\nOrgAbuseHandle: ADMIN7364-ARIN\\nOrgAdminHandle: ADMIN7364-ARIN\\nOrgDNSHandle:   ADMIN7364-ARIN\\nOrgNOCHandle:   ADMIN7364-ARIN\\nOrgRoutingHandle:   ADMIN7364-ARIN\\nOrgTechHandle:  ADMIN7364-ARIN\\nSource:         ARIN\\n\n\nPOCHandle:      ADMIN7364-ARIN\\nIsRole:         N\\nLastName:       Admin\\nFirstName:      IP\\nStreet:         Eighth Avenue Place\\nStreet:         East Tower, Suite 2700 \\nStreet:         525 8th Avenue SW\\nCity:           Calgary\\nState/Prov:     AB\\nCountry:        CA\\nPostalCode:     T2P 1G1\\nRegDate:        2020-02-06\\nUpdated:        2022-02-04\\nOfficePhone:    +1-403-910-5800\\nMailbox:        support@hhres.com\\nSource:         ARIN\\n"}
{"id": "FLHL-2", "name": "FAST LANE HD LLC", "address": "", "street": "PO BOX 633", "city": "Francesville", "state": "TX", "postalcode": "47946", "country": "US", "admin_id": "FLS2-ARIN", "tech_id": "SUPPO2315-ARIN", "abuse_id": "ABUSE8121-ARIN", "mnt_id": "NOC33274-ARIN", "email": "", "domain": "fastlanehd.com", "created": "2021-03-30", "updated": "2021-03-30", "source": "arin", "raw": "OrgID:          FLHL-2\\nOrgName:        FAST LANE HD LLC\\nCanAllocate:    \\nStreet:         PO BOX 633\\nCity:           Francesville\\nState/Prov:     TX\\nCountry:        US\\nPostalCode:     47946\\nRegDate:        2021-03-30\\nUpdated:        2021-03-30\\nOrgAbuseHandle: ABUSE8121-ARIN\\nOrgAdminHandle: FLS2-ARIN\\nOrgDNSHandle:   SUPPO2315-ARIN\\nOrgNOCHandle:   NOC33274-ARIN\\nOrgRoutingHandle:   SUPPO2315-ARIN\\nOrgTechHandle:  SUPPO2315-ARIN\\nSource:         ARIN\\n\n\nPOCHandle:      SUPPO2315-ARIN\\nIsRole:         Y\\nLastName:       Support\\nFirstName:      \\nStreet:         PO BOX 633\\nCity:           Francesville\\nState/Prov:     IN\\nCountry:        US\\nPostalCode:     47946\\nRegDate:        2021-03-08\\nUpdated:        2021-03-08\\nOfficePhone:    +1-972-775-8888\\nMailbox:        support@fastlanehd.com\\nSource:         ARIN\\n\n\nPOCHandle:      FLS2-ARIN\\nIsRole:         Y\\nLastName:       Fast Lane Support\\nFirstName:      \\nStreet:         PO BOX 633\\nCity:           Francesville\\nState/Prov:     IN\\nCountry:        US\\nPostalCode:     47946\\nRegDate:        2021-03-08\\nUpdated:        2021-03-08\\nOfficePhone:    +1-972-775-8888\\nMailbox:        support@fastlanehd.com\\nSource:         ARIN\\n\n\nPOCHandle:      ABUSE8121-ARIN\\nIsRole:         Y\\nLastName:       Abuse\\nFirstName:      \\nStreet:         PO Box 633\\nCity:           Francesville\\nState/Prov:     IN\\nCountry:        US\\nPostalCode:     47946\\nRegDate:        2021-03-08\\nUpdated:        2021-03-08\\nOfficePhone:    +1-972-775-8888\\nMailbox:        abuse@fastlanehd.com\\nSource:         ARIN\\n\n\nPOCHandle:      NOC33274-ARIN\\nIsRole:         Y\\nLastName:       NOC\\nFirstName:      \\nStreet:         PO BOX 633\\nCity:           Francesville\\nState/Prov:     IN\\nCountry:        US\\nPostalCode:     47946\\nRegDate:        2021-03-08\\nUpdated:        2021-03-08\\nOfficePhone:    +1-972-775-8888\\nMailbox:        NOC@FastLaneHD.com\\nSource:         ARIN\\n"}
{"id": "TI-31", "name": "Toastmasters International", "address": "", "street": "23182 Arroyo Vista", "city": "Rancho Santa Margarita", "state": "CA", "postalcode": "92688", "country": "US", "admin_id": "TECHN1108-ARIN", "tech_id": "TECHN1108-ARIN", "abuse_id": "TECHN1108-ARIN", "mnt_id": "TECHN1108-ARIN", "email": "", "domain": "toastmasters.org", "created": "2012-05-01", "updated": "2012-05-01", "source": "arin", "raw": "OrgID:          TI-31\\nOrgName:        Toastmasters International\\nCanAllocate:    \\nStreet:         23182 Arroyo Vista\\nCity:           Rancho Santa Margarita\\nState/Prov:     CA\\nCountry:        US\\nPostalCode:     92688\\nRegDate:        2012-05-01\\nUpdated:        2012-05-01\\nOrgAbuseHandle: TECHN1108-ARIN\\nOrgAdminHandle: TECHN1108-ARIN\\nOrgNOCHandle:   TECHN1108-ARIN\\nOrgTechHandle:  TECHN1108-ARIN\\nSource:         ARIN\\n\n\nPOCHandle:      TECHN1108-ARIN\\nIsRole:         Y\\nLastName:       Technology Services\\nFirstName:      \\nStreet:         9127 S. Jamaica Street, Suite 400\\nCity:           Englewood\\nState/Prov:     CO\\nCountry:        US\\nPostalCode:     80112\\nRegDate:        2012-04-30\\nUpdated:        2019-11-18\\nOfficePhone:    +1-720-439-5050\\nMailbox:        pinoyinbox@toastmasters.org\\nSource:         ARIN\\n"}
{"id": "RR-27", "name": "Rosetta Resources Inc.", "address": "", "street": "1111 Bagby St.\\nSuite 1600", "city": "Houston", "state": "TX", "postalcode": "77002", "country": "US", "admin_id": "RAJAS8-ARIN", "tech_id": "RAJAS8-ARIN", "abuse_id": "RAJAS8-ARIN", "mnt_id": "RAJAS8-ARIN", "email": "", "domain": "rosettaresources.com", "created": "2013-01-03", "updated": "2015-06-29", "source": "arin", "raw": "OrgID:          RR-27\\nOrgName:        Rosetta Resources Inc.\\nCanAllocate:    \\nStreet:         1111 Bagby St.\\nStreet:         Suite 1600\\nCity:           Houston\\nState/Prov:     TX\\nCountry:        US\\nPostalCode:     77002\\nRegDate:        2013-01-03\\nUpdated:        2015-06-29\\nOrgAbuseHandle: RAJAS8-ARIN\\nOrgAdminHandle: RAJAS8-ARIN\\nOrgNOCHandle:   RAJAS8-ARIN\\nOrgTechHandle:  RAJAS8-ARIN\\nSource:         ARIN\\n\n\nPOCHandle:      RAJAS8-ARIN\\nIsRole:         N\\nLastName:       Raja\\nFirstName:      Shahab\\nStreet:         1111 Bagby St\\nStreet:         Suite 1600\\nCity:           Houston\\nState/Prov:     TX\\nCountry:        US\\nPostalCode:     77002\\nRegDate:        2015-06-26\\nUpdated:        2015-06-26\\nOfficePhone:    +1-713-335-4183\\nMobilePhone:    +1-281-904-1025\\nMailbox:        shahab.raja@rosettaresources.com\\nSource:         ARIN\\n"}
{"id": "JLP-8", "name": "jackson lewis p.c.", "address": "", "street": "One North Broadway", "city": "White Plains", "state": "NY", "postalcode": "10601", "country": "US", "admin_id": "CHAND68-ARIN", "tech_id": "CHAND68-ARIN", "abuse_id": "CHAND68-ARIN", "mnt_id": "CHAND68-ARIN", "email": "", "domain": "jacksonlewis.com", "created": "2014-05-06", "updated": "2018-07-17", "source": "arin", "raw": "OrgID:          JLP-8\\nOrgName:        jackson lewis p.c.\\nCanAllocate:    \\nStreet:         One North Broadway\\nCity:           White Plains\\nState/Prov:     NY\\nCountry:        US\\nPostalCode:     10601\\nRegDate:        2014-05-06\\nUpdated:        2018-07-17\\nOrgAbuseHandle: CHAND68-ARIN\\nOrgAdminHandle: CHAND68-ARIN\\nOrgNOCHandle:   CHAND68-ARIN\\nOrgTechHandle:  CHAND68-ARIN\\nSource:         ARIN\\n\n\nPOCHandle:      CHAND68-ARIN\\nIsRole:         N\\nLastName:       chandroo\\nFirstName:      charles\\nStreet:         725 South Figueroa Street \\nStreet:         Suite 2500\\nCity:           Los Angeles\\nState/Prov:     CA\\nCountry:        US\\nPostalCode:     90017\\nRegDate:        2014-05-01\\nUpdated:        2021-06-25\\nOfficePhone:    +1-213-630-8221\\nMailbox:        chandroc@jacksonlewis.com\\nSource:         ARIN\\n"}
{"id": "CCI-3", "name": "California Capital Insurance Company", "address": "", "street": "P.O. Box 3110\\n2300 Garden Road", "city": "Monterey", "state": "CA", "postalcode": "93940-3110", "country": "US", "admin_id": "BROSS8-ARIN", "tech_id": "BROSS8-ARIN\\NSCHWA22-ARIN", "abuse_id": "BROSS8-ARIN\\NSCHWA22-ARIN", "mnt_id": "BROSS8-ARIN", "email": "", "domain": "ciginsurance.com", "created": "1995-07-25", "updated": "2016-02-04", "source": "arin", "raw": "OrgID:          CCI-3\\nOrgName:        California Capital Insurance Company\\nCanAllocate:    \\nStreet:         P.O. Box 3110\\nStreet:         2300 Garden Road\\nCity:           Monterey\\nState/Prov:     CA\\nCountry:        US\\nPostalCode:     93940-3110\\nRegDate:        1995-07-25\\nUpdated:        2016-02-04\\nOrgAbuseHandle: BROSS8-ARIN\\nOrgAbuseHandle: SCHWA22-ARIN\\nOrgAdminHandle: BROSS8-ARIN\\nOrgNOCHandle:   BROSS8-ARIN\\nOrgTechHandle:  BROSS8-ARIN\\nOrgTechHandle:  SCHWA22-ARIN\\nSource:         ARIN\\n\n\nPOCHandle:      BROSS8-ARIN\\nIsRole:         N\\nLastName:       Brosseau\\nFirstName:      Jonathan\\nStreet:         1 Lower Ragsdale Drive\\nCity:           Monterey\\nState/Prov:     CA\\nCountry:        US\\nPostalCode:     93940\\nRegDate:        2016-02-04\\nUpdated:        2022-02-11\\nOfficePhone:    +1-831-233-5500\\nMailbox:        jbrosseau@ciginsurance.com\\nSource:         ARIN\\n\n\nPOCHandle:      SCHWA22-ARIN\\nIsRole:         N\\nLastName:       Schwarz\\nFirstName:      Carolyn\\nStreet:         CIG\\nStreet:         2300 Garden Road\\nCity:           Monterey\\nState/Prov:     CA\\nCountry:        US\\nPostalCode:     93940\\nRegDate:        2011-04-11\\nUpdated:        2016-02-04\\nOfficePhone:    +1-831-233-5486\\nOfficePhone:    +1-831-233-5500\\nFaxPhone:       +1-831-647-8649\\nMailbox:        cschwarz@ciginsurance.com\\nMailbox:        jbrosseau@ciginsurance.com\\nSource:         ARIN\\n"}
{"id": "SNCI", "name": "StormCloud Network (Canada) Incorporated", "address": "", "street": "205 - 910 Richards St", "city": "Vancouver", "state": "BC", "postalcode": "V6B 3C1", "country": "CA", "admin_id": "BALFO15-ARIN", "tech_id": "GOLIN12-ARIN", "abuse_id": "ABUSE4620-ARIN", "mnt_id": "NOC31731-ARIN", "email": "", "domain": "stormcloudnetwork.net", "created": "2014-02-19", "updated": "2022-08-09", "source": "arin", "raw": "OrgID:          SNCI\\nOrgName:        StormCloud Network (Canada) Incorporated\\nCanAllocate:    \\nStreet:         205 - 910 Richards St\\nCity:           Vancouver\\nState/Prov:     BC\\nCountry:        CA\\nPostalCode:     V6B 3C1\\nRegDate:        2014-02-19\\nUpdated:        2022-08-09\\nOrgAbuseHandle: ABUSE4620-ARIN\\nOrgAdminHandle: BALFO15-ARIN\\nOrgNOCHandle:   NOC31731-ARIN\\nOrgTechHandle:  GOLIN12-ARIN\\nSource:         ARIN\\n\n\nPOCHandle:      NOC31731-ARIN\\nIsRole:         Y\\nLastName:       NOC\\nFirstName:      \\nStreet:         909 Monashee Place\\nCity:           Kelowna\\nState/Prov:     BC\\nCountry:        CA\\nPostalCode:     V1V 1J6\\nRegDate:        2014-02-18\\nUpdated:        2014-02-18\\nOfficePhone:    +1-250-980-4201\\nMailbox:        noc@stormcloudnetwork.net\\nSource:         ARIN\\n\n\nPOCHandle:      BALFO15-ARIN\\nIsRole:         N\\nLastName:       Balfour\\nFirstName:      Dell\\nStreet:         205 - 910 Richards Street\\nCity:           Vancouver\\nState/Prov:     BC\\nCountry:        CA\\nPostalCode:     V6B 3C1\\nRegDate:        2022-08-02\\nUpdated:        2022-08-02\\nOfficePhone:    +1-604-695-7677\\nMailbox:        dbalfour@stormcloud.ca\\nSource:         ARIN\\n\n\nPOCHandle:      ABUSE4620-ARIN\\nIsRole:         Y\\nLastName:       Abuse\\nFirstName:      \\nStreet:         909 Monashee Place\\nCity:           Kelowna\\nState/Prov:     BC\\nCountry:        CA\\nPostalCode:     V1V 1J6\\nRegDate:        2014-02-18\\nUpdated:        2014-02-18\\nOfficePhone:    +1-250-980-4201\\nMailbox:        abuse@stormcloudnetwork.net\\nSource:         ARIN\\n\n\nPOCHandle:      GOLIN12-ARIN\\nIsRole:         N\\nLastName:       Golin\\nFirstName:      Sasha \\nStreet:         205-910 RIchards St\\nCity:           Vancouver\\nState/Prov:     BC\\nCountry:        CA\\nPostalCode:     V6B 3C1\\nRegDate:        2022-08-03\\nUpdated:        2022-08-03\\nOfficePhone:    +1-604-695-7699\\nMailbox:        sgolin@stormcloud.ca\\nSource:         ARIN\\n"}
{"id": "MEDLIN-1", "name": "Medline Industries", "address": "", "street": "3 Three Lakes Drive", "city": "Northfield", "state": "IL", "postalcode": "54562", "country": "US", "admin_id": "COHEN289-ARIN", "tech_id": "BD709-ARIN", "abuse_id": "LANWA1-ARIN", "mnt_id": "LANWA1-ARIN", "email": "", "domain": "medline.com", "created": "1998-08-03", "updated": "2021-08-17", "source": "arin", "raw": "OrgID:          MEDLIN-1\\nOrgName:        Medline Industries\\nCanAllocate:    \\nStreet:         3 Three Lakes Drive\\nCity:           Northfield\\nState/Prov:     IL\\nCountry:        US\\nPostalCode:     54562\\nRegDate:        1998-08-03\\nUpdated:        2021-08-17\\nOrgAbuseHandle: LANWA1-ARIN\\nOrgAdminHandle: COHEN289-ARIN\\nOrgDNSHandle:   LANWA1-ARIN\\nOrgNOCHandle:   LANWA1-ARIN\\nOrgRoutingHandle:   LANWA1-ARIN\\nOrgTechHandle:  BD709-ARIN\\nSource:         ARIN\\n\n\nPOCHandle:      COHEN289-ARIN\\nIsRole:         N\\nLastName:       Cohen\\nFirstName:      Craig\\nStreet:         1200 Townline Rd\\nCity:           Mundelein\\nState/Prov:     IL\\nCountry:        US\\nPostalCode:     60060\\nRegDate:        2021-08-17\\nUpdated:        2021-08-17\\nOfficePhone:    +1-847-643-4930\\nMailbox:        ccohen@medline.com\\nSource:         ARIN\\n\n\nPOCHandle:      LANWA1-ARIN\\nIsRole:         Y\\nLastName:       LAN-WAN\\nFirstName:      \\nStreet:         3 Three Lakes Drive\\nCity:           Northfield\\nState/Prov:     IL\\nCountry:        US\\nPostalCode:     54562\\nRegDate:        2008-11-17\\nUpdated:        2021-07-29\\nOfficePhone:    +1-847-949-5500\\nMailbox:        NetworkCoreTeam@medline.com\\nSource:         ARIN\\n\n\nPOCHandle:      BD709-ARIN\\nIsRole:         N\\nLastName:       Dantzig\\nFirstName:      Brian\\nStreet:         3 Three Lakes Drive\\nCity:           Northfield\\nState/Prov:     IL\\nCountry:        US\\nPostalCode:     54562\\nRegDate:        2001-09-27\\nUpdated:        2021-07-29\\nOfficePhone:    +1-847-837-2795\\nMailbox:        bdantzig@medline.com\\nSource:         ARIN\\n"}
{"id": "CNSL-21", "name": "Cultro Network Services, LLC", "address": "", "street": "3824 Cedar Springs Road\\nUnit 192", "city": "Dallas", "state": "TX", "postalcode": "75219", "country": "US", "admin_id": "ERCUL-ARIN", "tech_id": "ERCUL-ARIN", "abuse_id": "ERCUL-ARIN", "mnt_id": "ERCUL-ARIN", "email": "", "domain": "cultro.net", "created": "2017-12-01", "updated": "2017-12-15", "source": "arin", "raw": "OrgID:          CNSL-21\\nOrgName:        Cultro Network Services, LLC\\nCanAllocate:    \\nStreet:         3824 Cedar Springs Road\\nStreet:         Unit 192\\nCity:           Dallas\\nState/Prov:     TX\\nCountry:        US\\nPostalCode:     75219\\nRegDate:        2017-12-01\\nUpdated:        2017-12-15\\nOrgAbuseHandle: ERCUL-ARIN\\nOrgAdminHandle: ERCUL-ARIN\\nOrgNOCHandle:   ERCUL-ARIN\\nOrgTechHandle:  ERCUL-ARIN\\nSource:         ARIN\\n\n\nPOCHandle:      ERCUL-ARIN\\nIsRole:         N\\nLastName:       Erculiani\\nFirstName:      Matthew\\nStreet:         3824 Cedar Springs Road\\nStreet:         Unit 192\\nCity:           Dallas\\nState/Prov:     TX\\nCountry:        US\\nPostalCode:     75219\\nRegDate:        2017-10-26\\nUpdated:        2022-02-10\\nOfficePhone:    +1-240-415-8734\\nMailbox:        matt@cultro.net\\nSource:         ARIN\\n"}
{"id": "CPS-326", "name": "Cooperative Personnel Services", "address": "", "street": "2450 Del Paso Rd.", "city": "Sacramento", "state": "CA", "postalcode": "95834", "country": "US", "admin_id": "ISDAD-ARIN", "tech_id": "NOC32173-ARIN", "abuse_id": "NOC32173-ARIN", "mnt_id": "NOC32173-ARIN", "email": "", "domain": "cpshr.us", "created": "2015-01-14", "updated": "2018-02-12", "source": "arin", "raw": "OrgID:          CPS-326\\nOrgName:        Cooperative Personnel Services\\nCanAllocate:    \\nStreet:         2450 Del Paso Rd.\\nCity:           Sacramento\\nState/Prov:     CA\\nCountry:        US\\nPostalCode:     95834\\nRegDate:        2015-01-14\\nUpdated:        2018-02-12\\nOrgAbuseHandle: NOC32173-ARIN\\nOrgAdminHandle: ISDAD-ARIN\\nOrgNOCHandle:   NOC32173-ARIN\\nOrgTechHandle:  NOC32173-ARIN\\nSource:         ARIN\\n\n\nPOCHandle:      ISDAD-ARIN\\nIsRole:         Y\\nLastName:       ISD ADMIN\\nFirstName:      \\nStreet:         2450 Del Paso Rd.\\nCity:           Sacramento\\nState/Prov:     CA\\nCountry:        US\\nPostalCode:     95834\\nRegDate:        2015-01-08\\nUpdated:        2022-02-11\\nOfficePhone:    +1-916-263-3600\\nMailbox:        isdadmin@cpshr.us\\nSource:         ARIN\\n\n\nPOCHandle:      NOC32173-ARIN\\nIsRole:         Y\\nLastName:       NOC\\nFirstName:      \\nStreet:         2450 Del Paso Road\\nCity:           Sacramento\\nState/Prov:     CA\\nCountry:        US\\nPostalCode:     95834\\nRegDate:        2015-01-08\\nUpdated:        2022-02-11\\nOfficePhone:    +1-916-263-3600\\nMailbox:        abuse@cpshr.us\\nSource:         ARIN\\n"}
{"id": "HFCU-30", "name": "Hughes Federal Credit Union", "address": "", "street": "971 W. Wetmore Road", "city": "Tucson", "state": "AZ", "postalcode": "85705", "country": "US", "admin_id": "FRIED96-ARIN", "tech_id": "FRIED96-ARIN", "abuse_id": "FRIED96-ARIN", "mnt_id": "FRIED96-ARIN", "email": "", "domain": "hughesfcu.org", "created": "2016-04-11", "updated": "2016-05-09", "source": "arin", "raw": "OrgID:          HFCU-30\\nOrgName:        Hughes Federal Credit Union\\nCanAllocate:    \\nStreet:         971 W. Wetmore Road\\nCity:           Tucson\\nState/Prov:     AZ\\nCountry:        US\\nPostalCode:     85705\\nRegDate:        2016-04-11\\nUpdated:        2016-05-09\\nOrgAbuseHandle: FRIED96-ARIN\\nOrgAdminHandle: FRIED96-ARIN\\nOrgNOCHandle:   FRIED96-ARIN\\nOrgTechHandle:  FRIED96-ARIN\\nSource:         ARIN\\n\n\nPOCHandle:      FRIED96-ARIN\\nIsRole:         N\\nLastName:       Frieden\\nFirstName:      Mark\\nStreet:         971 W. Wetmore Road\\nCity:           Tucson\\nState/Prov:     AZ\\nCountry:        US\\nPostalCode:     85705\\nRegDate:        2016-04-08\\nUpdated:        2021-03-08\\nOfficePhone:    +1-520-205-5629\\nMailbox:        mfrieden@hughesfcu.org\\nSource:         ARIN\\n"}
{"id": "SLC-5", "name": "Salt Lake County", "address": "", "street": "2001 South State Street\\nNL300", "city": "Salt Lake City", "state": "UT", "postalcode": "84190", "country": "US", "admin_id": "MLE1-ARIN", "tech_id": "HESSC8-ARIN\\NMLE1-ARIN", "abuse_id": "HESSC8-ARIN\\NMLE1-ARIN", "mnt_id": "HESSC8-ARIN", "email": "", "domain": "slco.org", "created": "1993-01-25", "updated": "2017-12-06", "source": "arin", "raw": "OrgID:          SLC-5\\nOrgName:        Salt Lake County\\nCanAllocate:    \\nStreet:         2001 South State Street\\nStreet:         NL300\\nCity:           Salt Lake City\\nState/Prov:     UT\\nCountry:        US\\nPostalCode:     84190\\nRegDate:        1993-01-25\\nUpdated:        2017-12-06\\nOrgAbuseHandle: HESSC8-ARIN\\nOrgAbuseHandle: MLE1-ARIN\\nOrgAdminHandle: MLE1-ARIN\\nOrgNOCHandle:   HESSC8-ARIN\\nOrgTechHandle:  HESSC8-ARIN\\nOrgTechHandle:  MLE1-ARIN\\nSource:         ARIN\\n\n\nPOCHandle:      MLE1-ARIN\\nIsRole:         N\\nLastName:       Evans\\nFirstName:      Mark\\nStreet:         2001 South State Street S3-610\\nCity:           Salt Lake City\\nState/Prov:     UT\\nCountry:        US\\nPostalCode:     84190\\nRegDate:        1999-11-19\\nUpdated:        2022-07-05\\nOfficePhone:    +1-385-468-0666\\nMobilePhone:    +1-801-599-2675\\nMailbox:        omears@outlook.com\\nMailbox:        mevans@slco.org\\nSource:         ARIN\\n\n\nPOCHandle:      HESSC8-ARIN\\nIsRole:         N\\nLastName:       Hess\\nFirstName:      Corey\\nStreet:         2001 S State St. SuiteNL400\\nCity:           Salt Lake City\\nState/Prov:     UT\\nCountry:        US\\nPostalCode:     84190\\nRegDate:        2017-12-06\\nUpdated:        2021-12-10\\nOfficePhone:    +1-384-468-0601\\nMailbox:        chess@slco.org\\nSource:         ARIN\\n"}
{"id": "BDL-37", "name": "Broadband Dynamics LLC", "address": "", "street": "8757 E Via De Commercio", "city": "Scottsdale", "state": "AZ", "postalcode": "85258", "country": "US", "admin_id": "BBDEN-ARIN", "tech_id": "ADA84-ARIN\\NBBDEN-ARIN\\NCOLEM605-ARIN", "abuse_id": "BBDEN-ARIN", "mnt_id": "BBDEN-ARIN", "email": "", "domain": "broadbanddynamics.com", "created": "2012-03-08", "updated": "2021-08-17", "source": "arin", "raw": "OrgID:          BDL-37\\nOrgName:        Broadband Dynamics LLC\\nCanAllocate:    \\nStreet:         8757 E Via De Commercio\\nCity:           Scottsdale\\nState/Prov:     AZ\\nCountry:        US\\nPostalCode:     85258\\nRegDate:        2012-03-08\\nUpdated:        2021-08-17\\nOrgAbuseHandle: BBDEN-ARIN\\nOrgAdminHandle: BBDEN-ARIN\\nOrgNOCHandle:   BBDEN-ARIN\\nOrgTechHandle:  ADA84-ARIN\\nOrgTechHandle:  BBDEN-ARIN\\nOrgTechHandle:  COLEM605-ARIN\\nSource:         ARIN\\n\n\nPOCHandle:      ADA84-ARIN\\nIsRole:         N\\nLastName:       Day\\nFirstName:      Andy\\nStreet:         8757 E. Via De Commercio 1st Floor\\nCity:           Scottsdale\\nState/Prov:     AZ\\nCountry:        US\\nPostalCode:     85258\\nRegDate:        2007-05-16\\nUpdated:        2021-12-09\\nOfficePhone:    +1-801-783-7165\\nMailbox:        andyday75@gmail.com\\nMailbox:        andy@broadbanddynamics.net\\nSource:         ARIN\\n\n\nPOCHandle:      COLEM605-ARIN\\nIsRole:         N\\nLastName:       Coleman\\nFirstName:      Steve\\nStreet:         179 Social Hall Ave\\nCity:           Salt Lake City\\nState/Prov:     UT\\nCountry:        US\\nPostalCode:     84111\\nRegDate:        2021-08-17\\nUpdated:        2021-08-17\\nOfficePhone:    +1-801-990-1070\\nMailbox:        scoleman@csolutions.net\\nSource:         ARIN\\n\n\nPOCHandle:      BBDEN-ARIN\\nIsRole:         Y\\nLastName:       BBD Engineering\\nFirstName:      \\nStreet:         8757 E Via De Commercio\\nCity:           Scottsdale\\nState/Prov:     AZ\\nCountry:        US\\nPostalCode:     85258\\nRegDate:        2014-12-05\\nUpdated:        2021-12-06\\nOfficePhone:    +1-602-357-3620\\nOfficePhone:    +1-801-618-0303\\nOfficePhone:    +1-480-941-0444\\nFaxPhone:       +1-480-941-1143\\nOfficePhone:    +1-602-357-3600\\nMailbox:        engineering@broadbanddynamics.com\\nSource:         ARIN\\n"}
{"id": "LMH-24", "name": "Listowel Memorial Hospital", "address": "", "street": "255 Elizabeth St. E.", "city": "Listowel", "state": "ON", "postalcode": "N4W 2P5", "country": "CA", "admin_id": "BOLOG1-ARIN", "tech_id": "BOLOG1-ARIN", "abuse_id": "BOLOG1-ARIN", "mnt_id": "BOLOG1-ARIN", "email": "", "domain": "lwha.ca", "created": "2014-06-18", "updated": "2014-06-18", "source": "arin", "raw": "OrgID:          LMH-24\\nOrgName:        Listowel Memorial Hospital\\nCanAllocate:    \\nStreet:         255 Elizabeth St. E.\\nCity:           Listowel\\nState/Prov:     ON\\nCountry:        CA\\nPostalCode:     N4W 2P5\\nRegDate:        2014-06-18\\nUpdated:        2014-06-18\\nOrgAbuseHandle: BOLOG1-ARIN\\nOrgAdminHandle: BOLOG1-ARIN\\nOrgNOCHandle:   BOLOG1-ARIN\\nOrgTechHandle:  BOLOG1-ARIN\\nSource:         ARIN\\n\n\nPOCHandle:      BOLOG1-ARIN\\nIsRole:         N\\nLastName:       Bolognone\\nFirstName:      John-Mike\\nStreet:         255 Elizabeth St. E.\\nCity:           Listowel\\nState/Prov:     ON\\nCountry:        CA\\nPostalCode:     N4W 2P5\\nRegDate:        2014-06-13\\nUpdated:        2015-09-28\\nOfficePhone:    +1-519-292-2130\\nMailbox:        john-mike.bolognone@lwha.ca\\nMailbox:        john-miek.bolognone@lwha.ca\\nSource:         ARIN\\n"}
{"id": "MCCD-4", "name": "McHenry County College District 528", "address": "", "street": "8900 US Hwy 14", "city": "Crystal Lake", "state": "IL", "postalcode": "60012", "country": "US", "admin_id": "RASMU25-ARIN", "tech_id": "RASMU25-ARIN", "abuse_id": "RASMU25-ARIN", "mnt_id": "RASMU25-ARIN", "email": "", "domain": "mchenry.edu", "created": "2016-03-09", "updated": "2016-03-09", "source": "arin", "raw": "OrgID:          MCCD-4\\nOrgName:        McHenry County College District 528\\nCanAllocate:    \\nStreet:         8900 US Hwy 14\\nCity:           Crystal Lake\\nState/Prov:     IL\\nCountry:        US\\nPostalCode:     60012\\nRegDate:        2016-03-09\\nUpdated:        2016-03-09\\nOrgAbuseHandle: RASMU25-ARIN\\nOrgAdminHandle: RASMU25-ARIN\\nOrgNOCHandle:   RASMU25-ARIN\\nOrgTechHandle:  RASMU25-ARIN\\nSource:         ARIN\\n\n\nPOCHandle:      RASMU25-ARIN\\nIsRole:         N\\nLastName:       Rasmussen\\nFirstName:      Robert\\nStreet:         8900 US Hwy 14\\nCity:           Crystal Lake\\nState/Prov:     IL\\nCountry:        US\\nPostalCode:     60012\\nRegDate:        2016-03-07\\nUpdated:        2022-03-08\\nOfficePhone:    +1-815-479-7599\\nMailbox:        rrasmussen@mchenry.edu\\nSource:         ARIN\\n"}
{"id": "NT-462", "name": "N5 Tech, Inc.", "address": "", "street": "PO Box 86272", "city": "Tucson", "state": "AZ", "postalcode": "85754", "country": "US", "admin_id": "CRANE64-ARIN", "tech_id": "CRANE64-ARIN", "abuse_id": "ABUSE3316-ARIN", "mnt_id": "NOC32177-ARIN", "email": "", "domain": "n5tech.com", "created": "2019-02-15", "updated": "2019-02-15", "source": "arin", "raw": "OrgID:          NT-462\\nOrgName:        N5 Tech, Inc.\\nCanAllocate:    \\nStreet:         PO Box 86272\\nCity:           Tucson\\nState/Prov:     AZ\\nCountry:        US\\nPostalCode:     85754\\nRegDate:        2019-02-15\\nUpdated:        2019-02-15\\nOrgAbuseHandle: ABUSE3316-ARIN\\nOrgAdminHandle: CRANE64-ARIN\\nOrgNOCHandle:   NOC32177-ARIN\\nOrgTechHandle:  CRANE64-ARIN\\nSource:         ARIN\\n\n\nPOCHandle:      CRANE64-ARIN\\nIsRole:         N\\nLastName:       Crane\\nFirstName:      Todd\\nStreet:         PO Box 86272\\nCity:           Tucson\\nState/Prov:     AZ\\nCountry:        US\\nPostalCode:     85754\\nRegDate:        2016-10-11\\nUpdated:        2021-11-02\\nOfficePhone:    +1-520-379-7500\\nMailbox:        todd.crane@simeonnetworks.com\\nSource:         ARIN\\n\n\nPOCHandle:      ABUSE3316-ARIN\\nIsRole:         Y\\nLastName:       Abuse Watch\\nFirstName:      \\nStreet:         PO Box 86272\\nCity:           Tucson\\nState/Prov:     AZ\\nCountry:        US\\nPostalCode:     85754\\nRegDate:        2012-01-30\\nUpdated:        2021-11-27\\nOfficePhone:    +1-520-379-7500\\nMailbox:        noc@simeonnetworks.com\\nMailbox:        abuse@simeonnetworks.com\\nSource:         ARIN\\n\n\nPOCHandle:      NOC32177-ARIN\\nIsRole:         Y\\nLastName:       NOC\\nFirstName:      \\nStreet:         PO Box 86272\\nCity:           Tucson\\nState/Prov:     AZ\\nCountry:        US\\nPostalCode:     85754\\nRegDate:        2015-01-13\\nUpdated:        2021-11-27\\nOfficePhone:    +1-520-379-7500\\nMailbox:        noc@simeonnetworks.com\\nSource:         ARIN\\n"}
{"id": "SL-2027", "name": "SFG, LLC", "address": "", "street": "111 Corporate Drive", "city": "Big Sandy", "state": "TX", "postalcode": "75755", "country": "US", "admin_id": "SCOTT1272-ARIN", "tech_id": "SCOTT1272-ARIN", "abuse_id": "SCOTT1272-ARIN", "mnt_id": "SCOTT1272-ARIN", "email": "", "domain": "sfgnetwork.com", "created": "2020-04-23", "updated": "2020-04-23", "source": "arin", "raw": "OrgID:          SL-2027\\nOrgName:        SFG, LLC\\nCanAllocate:    \\nStreet:         111 Corporate Drive\\nCity:           Big Sandy\\nState/Prov:     TX\\nCountry:        US\\nPostalCode:     75755\\nRegDate:        2020-04-23\\nUpdated:        2020-04-23\\nOrgAbuseHandle: SCOTT1272-ARIN\\nOrgAdminHandle: SCOTT1272-ARIN\\nOrgDNSHandle:   SCOTT1272-ARIN\\nOrgNOCHandle:   SCOTT1272-ARIN\\nOrgRoutingHandle:   SCOTT1272-ARIN\\nOrgTechHandle:  SCOTT1272-ARIN\\nSource:         ARIN\\n\n\nPOCHandle:      SCOTT1272-ARIN\\nIsRole:         N\\nLastName:       Scott\\nFirstName:      Charles\\nStreet:         111 Corporate Drive\\nCity:           Big Sandy\\nState/Prov:     TX\\nCountry:        US\\nPostalCode:     75755\\nRegDate:        2020-04-22\\nUpdated:        2022-04-22\\nOfficePhone:    +1-903-636-2233\\nMailbox:        sfg_arin@sfgnetwork.com\\nSource:         ARIN\\n"}
{"id": "ECU-2", "name": "East Central University", "address": "", "street": "East Central University", "city": "Ada", "state": "OK", "postalcode": "74820", "country": "US", "admin_id": "WILLI71-ARIN", "tech_id": "WILLI71-ARIN", "abuse_id": "WILLI71-ARIN", "mnt_id": "WILLI71-ARIN", "email": "", "domain": "ecok.edu", "created": "1992-11-18", "updated": "2011-03-25", "source": "arin", "raw": "OrgID:          ECU-2\\nOrgName:        East Central University\\nCanAllocate:    \\nStreet:         East Central University\\nCity:           Ada\\nState/Prov:     OK\\nCountry:        US\\nPostalCode:     74820\\nRegDate:        1992-11-18\\nUpdated:        2011-03-25\\nOrgAbuseHandle: WILLI71-ARIN\\nOrgAdminHandle: WILLI71-ARIN\\nOrgNOCHandle:   WILLI71-ARIN\\nOrgTechHandle:  WILLI71-ARIN\\nSource:         ARIN\\n\n\nPOCHandle:      WILLI71-ARIN\\nIsRole:         N\\nLastName:       Williams\\nFirstName:      Frank\\nStreet:         1100 E. 14th\\nCity:           Ada\\nState/Prov:     OK\\nCountry:        US\\nPostalCode:     74820\\nRegDate:        2011-03-22\\nUpdated:        2011-03-22\\nOfficePhone:    +1-580-559-5256\\nMailbox:        fwilliams@ecok.edu\\nSource:         ARIN\\n"}
{"id": "LL-561-Z", "name": "D20 Hobbies", "address": "", "street": "304 Winterberry Dr", "city": "Winchester", "state": "KY", "postalcode": "40391", "country": "US", "admin_id": "JR100-ARIN", "tech_id": "JR100-ARIN", "abuse_id": "JR100-ARIN", "mnt_id": "JR100-ARIN", "email": "", "domain": "d20hobbies.com", "created": "2017-05-15", "updated": "2017-07-19", "source": "arin", "raw": "OrgID:          LL-561-Z\\nOrgName:        D20 Hobbies\\nCanAllocate:    \\nStreet:         304 Winterberry Dr\\nCity:           Winchester\\nState/Prov:     KY\\nCountry:        US\\nPostalCode:     40391\\nRegDate:        2017-05-15\\nUpdated:        2017-07-19\\nOrgAbuseHandle: JR100-ARIN\\nOrgAdminHandle: JR100-ARIN\\nOrgNOCHandle:   JR100-ARIN\\nOrgTechHandle:  JR100-ARIN\\nSource:         ARIN\\n\n\nPOCHandle:      JR100-ARIN\\nIsRole:         N\\nLastName:       Risner\\nFirstName:      James\\nStreet:         304 Winterberry Dr\\nCity:           Winchester\\nState/Prov:     KY\\nCountry:        US\\nPostalCode:     40391\\nRegDate:        1994-02-24\\nUpdated:        2021-07-27\\nOfficePhone:    +1-859-699-0400\\nMailbox:        arin@d20hobbies.com\\nSource:         ARIN\\n"}
{"id": "RSL-76", "name": "Radius 60 Studios", "address": "", "street": "3539 Motor Ave", "city": "Los Angeles", "state": "CA", "postalcode": "90034", "country": "US", "admin_id": "CHENM5-ARIN", "tech_id": "CHENM5-ARIN", "abuse_id": "CHENM5-ARIN", "mnt_id": "CHENM5-ARIN", "email": "", "domain": "radius60.com", "created": "2014-12-02", "updated": "2014-12-02", "source": "arin", "raw": "OrgID:          RSL-76\\nOrgName:        Radius 60 Studios\\nCanAllocate:    \\nStreet:         3539 Motor Ave\\nCity:           Los Angeles\\nState/Prov:     CA\\nCountry:        US\\nPostalCode:     90034\\nRegDate:        2014-12-02\\nUpdated:        2014-12-02\\nOrgAbuseHandle: CHENM5-ARIN\\nOrgAdminHandle: CHENM5-ARIN\\nOrgNOCHandle:   CHENM5-ARIN\\nOrgTechHandle:  CHENM5-ARIN\\nSource:         ARIN\\n\n\nPOCHandle:      CHENM5-ARIN\\nIsRole:         N\\nLastName:       Chen\\nFirstName:      Michael\\nStreet:         3539 Motor Ave\\nCity:           Los Angeles\\nState/Prov:     CA\\nCountry:        US\\nPostalCode:     90034\\nRegDate:        2014-11-25\\nUpdated:        2014-11-25\\nFaxPhone:       +1-949-732-1341\\nMobilePhone:    +1-949-922-5866\\nOfficePhone:    +1-949-732-1300\\nMailbox:        michael.chen@radius60.com\\nSource:         ARIN\\n"}
{"id": "PDKPL", "name": "Kinetix Networks", "address": "", "street": "121 Hammond Avenue", "city": "Wagga Wagga", "state": "NSW", "postalcode": "2650", "country": "AU", "admin_id": "KNN2-ARIN", "tech_id": "KNN2-ARIN", "abuse_id": "PDKPLA-ARIN", "mnt_id": "KNN2-ARIN", "email": "", "domain": "kinetix.net.au", "created": "2021-06-10", "updated": "2021-06-10", "source": "arin", "raw": "OrgID:          PDKPL\\nOrgName:        Kinetix Networks\\nCanAllocate:    \\nStreet:         121 Hammond Avenue\\nCity:           Wagga Wagga\\nState/Prov:     NSW\\nCountry:        AU\\nPostalCode:     2650\\nRegDate:        2021-06-10\\nUpdated:        2021-06-10\\nOrgAbuseHandle: PDKPLA-ARIN\\nOrgAdminHandle: KNN2-ARIN\\nOrgNOCHandle:   KNN2-ARIN\\nOrgRoutingHandle:   KNN2-ARIN\\nOrgTechHandle:  KNN2-ARIN\\nSource:         ARIN\\n\n\nPOCHandle:      PDKPLA-ARIN\\nIsRole:         Y\\nLastName:       Professional Data Kinetics Pty Ltd Administrator\\nFirstName:      \\nStreet:         121 Hammond Avenue\\nCity:           Wagga Wagga\\nState/Prov:     NSW\\nCountry:        AU\\nPostalCode:     2650\\nRegDate:        2021-05-24\\nUpdated:        2022-07-15\\nOfficePhone:    +61069103444\\nMailbox:        abuse@kinetix.net.au\\nSource:         ARIN\\n\n\nPOCHandle:      KNN2-ARIN\\nIsRole:         Y\\nLastName:       Kinetix Networks NOC\\nFirstName:      \\nStreet:         121 Hammond Avenue\\nCity:           Wagga Wagga\\nState/Prov:     NSW\\nCountry:        AU\\nPostalCode:     2650\\nRegDate:        2021-05-24\\nUpdated:        2022-05-23\\nOfficePhone:    +61269103444\\nMailbox:        noc@kinetix.net.au\\nSource:         ARIN\\n"}
{"id": "ICS-266", "name": "I.T.S. Consulting Services, Inc.", "address": "", "street": "1473 Holman Road", "city": "Strafford", "state": "MO", "postalcode": "65757", "country": "US", "admin_id": "GARDN39-ARIN", "tech_id": "GARDN39-ARIN", "abuse_id": "GARDN39-ARIN", "mnt_id": "GARDN39-ARIN", "email": "", "domain": "itsconsultingservices.com", "created": "2013-02-04", "updated": "2020-04-09", "source": "arin", "raw": "OrgID:          ICS-266\\nOrgName:        I.T.S. Consulting Services, Inc.\\nCanAllocate:    \\nStreet:         1473 Holman Road\\nCity:           Strafford\\nState/Prov:     MO\\nCountry:        US\\nPostalCode:     65757\\nRegDate:        2013-02-04\\nUpdated:        2020-04-09\\nOrgAbuseHandle: GARDN39-ARIN\\nOrgAdminHandle: GARDN39-ARIN\\nOrgNOCHandle:   GARDN39-ARIN\\nOrgTechHandle:  GARDN39-ARIN\\nSource:         ARIN\\n\n\nPOCHandle:      GARDN39-ARIN\\nIsRole:         N\\nLastName:       Gardner\\nFirstName:      Jeremy\\nStreet:         4411 East Sunshine\\nStreet:         Suite B\\nCity:           Springfield\\nState/Prov:     MO\\nCountry:        US\\nPostalCode:     65809\\nRegDate:        2013-02-02\\nUpdated:        2019-05-12\\nOfficePhone:    +1-417-258-0143\\nMobilePhone:    +1-417-258-0143\\nMailbox:        jeremy@itsconsultingservices.com\\nSource:         ARIN\\n"}
{"id": "LVB-7", "name": "Liggett Vector Brands, LLC", "address": "", "street": "3800 Paramount Parkway", "city": "Morrisville", "state": "NC", "postalcode": "27560", "country": "US", "admin_id": "GRAHA356-ARIN", "tech_id": "GRAHA356-ARIN", "abuse_id": "GRAHA356-ARIN", "mnt_id": "GRAHA356-ARIN", "email": "", "domain": "liggettvectorbrands.com", "created": "2018-05-24", "updated": "2018-05-24", "source": "arin", "raw": "OrgID:          LVB-7\\nOrgName:        Liggett Vector Brands, LLC\\nCanAllocate:    \\nStreet:         3800 Paramount Parkway\\nCity:           Morrisville\\nState/Prov:     NC\\nCountry:        US\\nPostalCode:     27560\\nRegDate:        2018-05-24\\nUpdated:        2018-05-24\\nOrgAbuseHandle: GRAHA356-ARIN\\nOrgAdminHandle: GRAHA356-ARIN\\nOrgNOCHandle:   GRAHA356-ARIN\\nOrgTechHandle:  GRAHA356-ARIN\\nSource:         ARIN\\n\n\nPOCHandle:      GRAHA356-ARIN\\nIsRole:         N\\nLastName:       Graham\\nFirstName:      Carey\\nStreet:         3800 Paramount Parkway\\nCity:           Morrisville\\nState/Prov:     NC\\nCountry:        US\\nPostalCode:     27560\\nRegDate:        2018-05-21\\nUpdated:        2022-01-15\\nOfficePhone:    +1-919-990-3636\\nMailbox:        cgraham@lvbrands.com\\nSource:         ARIN\\n"}
{"id": "TGML-1", "name": "Tiger Global Management, LLC", "address": "", "street": "101 park ave fl 48", "city": "new york", "state": "NY", "postalcode": "10178", "country": "US", "admin_id": "FAVAT3-ARIN", "tech_id": "FAVAT3-ARIN", "abuse_id": "FAVAT3-ARIN", "mnt_id": "FAVAT3-ARIN", "email": "", "domain": "tigerglobal.com", "created": "2013-09-23", "updated": "2013-09-23", "source": "arin", "raw": "OrgID:          TGML-1\\nOrgName:        Tiger Global Management, LLC\\nCanAllocate:    \\nStreet:         101 park ave fl 48\\nCity:           new york\\nState/Prov:     NY\\nCountry:        US\\nPostalCode:     10178\\nRegDate:        2013-09-23\\nUpdated:        2013-09-23\\nOrgAbuseHandle: FAVAT3-ARIN\\nOrgAdminHandle: FAVAT3-ARIN\\nOrgNOCHandle:   FAVAT3-ARIN\\nOrgTechHandle:  FAVAT3-ARIN\\nSource:         ARIN\\n\n\nPOCHandle:      FAVAT3-ARIN\\nIsRole:         N\\nLastName:       Favata\\nFirstName:      Len\\nStreet:         9 West 57th St 35th Fl.\\nCity:           NEW YORK\\nState/Prov:     NY\\nCountry:        US\\nPostalCode:     10019\\nRegDate:        2013-09-20\\nUpdated:        2021-09-21\\nMobilePhone:    +1-973-277-6787\\nFaxPhone:       +1-212-500-3809\\nOfficePhone:    +1-212-500-3809\\nFaxPhone:       +1-212-557-1701\\nMobilePhone:    +1-212-500-3809\\nMailbox:        lfavata@tigerglobal.com\\nSource:         ARIN\\n"}
{"id": "GT-119", "name": "Grand Telephone Company, Inc.", "address": "", "street": "PO Box 308\\n226 S 4th Street", "city": "Jay", "state": "OK", "postalcode": "74346", "country": "US", "admin_id": "SLS9-ARIN", "tech_id": "PNN5-ARIN\\NSLS9-ARIN", "abuse_id": "PNN5-ARIN\\NSLS9-ARIN", "mnt_id": "PNN5-ARIN", "email": "", "domain": "grand.net", "created": "2014-05-07", "updated": "2017-01-28", "source": "arin", "raw": "OrgID:          GT-119\\nOrgName:        Grand Telephone Company, Inc.\\nCanAllocate:    \\nStreet:         PO Box 308\\nStreet:         226 S 4th Street\\nCity:           Jay\\nState/Prov:     OK\\nCountry:        US\\nPostalCode:     74346\\nRegDate:        2014-05-07\\nUpdated:        2017-01-28\\nOrgAbuseHandle: PNN5-ARIN\\nOrgAbuseHandle: SLS9-ARIN\\nOrgAdminHandle: SLS9-ARIN\\nOrgNOCHandle:   PNN5-ARIN\\nOrgTechHandle:  PNN5-ARIN\\nOrgTechHandle:  SLS9-ARIN\\nSource:         ARIN\\n\n\nPOCHandle:      PNN5-ARIN\\nIsRole:         Y\\nLastName:       Paradox Networks NOC\\nFirstName:      \\nStreet:         P.O. Box 49\\nCity:           Ringling\\nState/Prov:     OK\\nCountry:        US\\nPostalCode:     73456\\nRegDate:        2014-05-08\\nUpdated:        2021-07-24\\nOfficePhone:    +1-580-665-0766\\nOfficePhone:    +1-580-319-1318\\nMailbox:        jbates@ParadoxNetworks.net\\nMailbox:        jkbates@ParadoxNetworks.net\\nSource:         ARIN\\n\n\nPOCHandle:      SLS9-ARIN\\nIsRole:         N\\nLastName:       Stephens\\nFirstName:      Sherri\\nStreet:         PO Box 308\\nCity:           Jay\\nState/Prov:     OK\\nCountry:        US\\nPostalCode:     74346\\nRegDate:        2014-05-06\\nUpdated:        2021-12-30\\nFaxPhone:       +1-918-253-3400\\nOfficePhone:    +1-918-253-4231\\nMailbox:        stephens@grand.net\\nSource:         ARIN\\n"}
{"id": "CENT-1", "name": "Cutting Edge Network Technologies", "address": "", "street": "445 Canary Island Ct", "city": "Orlando", "state": "FL", "postalcode": "32828", "country": "US", "admin_id": "CENT-ARIN", "tech_id": "CENT-ARIN", "abuse_id": "CENT-ARIN", "mnt_id": "CENT-ARIN", "email": "", "domain": "cuttingedgenet.com", "created": "2004-05-24", "updated": "2011-09-24", "source": "arin", "raw": "OrgID:          CENT-1\\nOrgName:        Cutting Edge Network Technologies\\nCanAllocate:    \\nStreet:         445 Canary Island Ct\\nCity:           Orlando\\nState/Prov:     FL\\nCountry:        US\\nPostalCode:     32828\\nRegDate:        2004-05-24\\nUpdated:        2011-09-24\\nOrgAbuseHandle: CENT-ARIN\\nOrgAdminHandle: CENT-ARIN\\nOrgNOCHandle:   CENT-ARIN\\nOrgTechHandle:  CENT-ARIN\\nSource:         ARIN\\n\n\nPOCHandle:      CENT-ARIN\\nIsRole:         Y\\nLastName:       Cutting Edge Network Technologies\\nFirstName:      \\nStreet:         445 Canary Island Ct\\nCity:           Orlando\\nState/Prov:     FL\\nCountry:        US\\nPostalCode:     32828\\nRegDate:        2004-05-19\\nUpdated:        2004-05-19\\nOfficePhone:    +1-407-658-9009\\nMailbox:        support@cuttingedgenet.com\\nSource:         ARIN\\n"}
{"id": "FIBER-64", "name": "FiberLight, LLC", "address": "", "street": "11700 Great Oaks Way\\nSuit 100", "city": "Alpharetta", "state": "GA", "postalcode": "30022", "country": "US", "admin_id": "NETWO4145-ARIN", "tech_id": "NETWO4145-ARIN", "abuse_id": "NETWO4145-ARIN", "mnt_id": "NETWO4145-ARIN", "email": "", "domain": "fiberlight.com", "created": "2010-06-08", "updated": "2020-11-11", "source": "arin", "raw": "OrgID:          FIBER-64\\nOrgName:        FiberLight, LLC\\nCanAllocate:    \\nStreet:         11700 Great Oaks Way\\nStreet:         Suit 100\\nCity:           Alpharetta\\nState/Prov:     GA\\nCountry:        US\\nPostalCode:     30022\\nRegDate:        2010-06-08\\nUpdated:        2020-11-11\\nOrgAbuseHandle: NETWO4145-ARIN\\nOrgAdminHandle: NETWO4145-ARIN\\nOrgNOCHandle:   NETWO4145-ARIN\\nOrgRoutingHandle:   NETWO4145-ARIN\\nOrgTechHandle:  NETWO4145-ARIN\\nSource:         ARIN\\n\n\nPOCHandle:      NETWO4145-ARIN\\nIsRole:         Y\\nLastName:       Network Engineering\\nFirstName:      \\nStreet:         3000 Summit Place Suite 200\\nCity:           Alpharetta\\nState/Prov:     GA\\nCountry:        US\\nPostalCode:     30009\\nRegDate:        2011-01-24\\nUpdated:        2021-11-17\\nOfficePhone:    +1-678-824-6619\\nMailbox:        it@fiberlight.com\\nMailbox:        voice@fiberlight.com\\nSource:         ARIN\\n"}
{"id": "VIC-19", "name": "Varex Imaging Corporation", "address": "", "street": "1678 South Pioneer Rd", "city": "Salt Lake City", "state": "UT", "postalcode": "84104-4205", "country": "US", "admin_id": "SRA88-ARIN", "tech_id": "KIMHY20-ARIN", "abuse_id": "SRA88-ARIN", "mnt_id": "SRA88-ARIN", "email": "", "domain": "vareximaging.com", "created": "2017-05-25", "updated": "2018-11-07", "source": "arin", "raw": "OrgID:          VIC-19\\nOrgName:        Varex Imaging Corporation\\nCanAllocate:    \\nStreet:         1678 South Pioneer Rd\\nCity:           Salt Lake City\\nState/Prov:     UT\\nCountry:        US\\nPostalCode:     84104-4205\\nRegDate:        2017-05-25\\nUpdated:        2018-11-07\\nOrgAbuseHandle: SRA88-ARIN\\nOrgAdminHandle: SRA88-ARIN\\nOrgNOCHandle:   SRA88-ARIN\\nOrgTechHandle:  KIMHY20-ARIN\\nSource:         ARIN\\n\n\nPOCHandle:      SRA88-ARIN\\nIsRole:         N\\nLastName:       Rawles\\nFirstName:      Shawn\\nStreet:         1678 Pioneer Road\\nCity:           Salt Lake city\\nState/Prov:     UT\\nCountry:        US\\nPostalCode:     84104\\nRegDate:        2007-06-13\\nUpdated:        2021-12-17\\nOfficePhone:    +1-801-384-3527\\nMailbox:        network@vareximaging.com\\nSource:         ARIN\\n\n\nPOCHandle:      KIMHY20-ARIN\\nIsRole:         N\\nLastName:       Kim\\nFirstName:      Hyong\\nStreet:         1678 South Pioneer Road\\nCity:           Salt Lake City\\nState/Prov:     UT\\nCountry:        US\\nPostalCode:     84104\\nRegDate:        2018-07-05\\nUpdated:        2022-07-07\\nOfficePhone:    +1-408-565-0718\\nMailbox:        hyong.kim@vareximaging.com\\nSource:         ARIN\\n"}
{"id": "MASON-22", "name": "Mason Companies, Inc.", "address": "", "street": "1251 1st Avenue", "city": "Chippewa Falls", "state": "WI", "postalcode": "54729", "country": "US", "admin_id": "VRIEZ-ARIN", "tech_id": "DBO177-ARIN\\NVRIEZ-ARIN", "abuse_id": "DBO177-ARIN", "mnt_id": "DBO177-ARIN", "email": "", "domain": "masoncompaniesinc.com", "created": "2009-08-27", "updated": "2022-01-03", "source": "arin", "raw": "OrgID:          MASON-22\\nOrgName:        Mason Companies, Inc.\\nCanAllocate:    \\nStreet:         1251 1st Avenue\\nCity:           Chippewa Falls\\nState/Prov:     WI\\nCountry:        US\\nPostalCode:     54729\\nComment:        http://www.masoncompaniesinc.com/\\nRegDate:        2009-08-27\\nUpdated:        2022-01-03\\nOrgAbuseHandle: DBO177-ARIN\\nOrgAdminHandle: VRIEZ-ARIN\\nOrgNOCHandle:   DBO177-ARIN\\nOrgTechHandle:  DBO177-ARIN\\nOrgTechHandle:  VRIEZ-ARIN\\nSource:         ARIN\\n\n\nPOCHandle:      VRIEZ-ARIN\\nIsRole:         N\\nLastName:       Vrieze\\nFirstName:      Lee\\nStreet:         1251 1st Avenue\\nCity:           Chippewa Falls\\nState/Prov:     WI\\nCountry:        US\\nPostalCode:     54729\\nRegDate:        2020-12-23\\nUpdated:        2021-12-28\\nOfficePhone:    +1-715-861-7506\\nMailbox:        lvrieze@masoncompaniesinc.com\\nSource:         ARIN\\n\n\nPOCHandle:      DBO177-ARIN\\nIsRole:         N\\nLastName:       Bohl\\nFirstName:      Dale\\nStreet:         1251 1st Avenue\\nCity:           Chippewa Falls\\nState/Prov:     WI\\nCountry:        US\\nPostalCode:     54729\\nRegDate:        2009-05-29\\nUpdated:        2021-09-08\\nOfficePhone:    +1-715-720-4382\\nMailbox:        dbohl@masoncompaniesinc.com\\nSource:         ARIN\\n"}
{"id": "SOUND-6", "name": "Soundbite Communications, Inc.", "address": "", "street": "7601 Interactive Way", "city": "Indianapolis", "state": "IN", "postalcode": "46278", "country": "US", "admin_id": "OPERA149-ARIN", "tech_id": "OPERA149-ARIN", "abuse_id": "OPERA149-ARIN", "mnt_id": "OPERA149-ARIN", "email": "", "domain": "soundbite.com", "created": "2008-01-03", "updated": "2021-12-03", "source": "arin", "raw": "OrgID:          SOUND-6\\nOrgName:        Soundbite Communications, Inc.\\nCanAllocate:    \\nStreet:         7601 Interactive Way\\nCity:           Indianapolis\\nState/Prov:     IN\\nCountry:        US\\nPostalCode:     46278\\nRegDate:        2008-01-03\\nUpdated:        2021-12-03\\nOrgAbuseHandle: OPERA149-ARIN\\nOrgAdminHandle: OPERA149-ARIN\\nOrgNOCHandle:   OPERA149-ARIN\\nOrgTechHandle:  OPERA149-ARIN\\nSource:         ARIN\\n\n\nPOCHandle:      OPERA149-ARIN\\nIsRole:         Y\\nLastName:       Operations\\nFirstName:      \\nStreet:         7601 Interactive Way\\nCity:           Indianapolis\\nState/Prov:     IN\\nCountry:        US\\nPostalCode:     46278\\nRegDate:        2007-12-27\\nUpdated:        2021-12-03\\nOfficePhone:    +1-650-466-1100\\nMailbox:        inoc@genesys.com\\nSource:         ARIN\\n"}
{"id": "SHARE-13", "name": "Sharedband Technologies, LLC", "address": "", "street": "113 Cherry St #22527", "city": "Seattle", "state": "WA", "postalcode": "98104", "country": "US", "admin_id": "NOC11730-ARIN", "tech_id": "NOC11730-ARIN", "abuse_id": "SHARE2-ARIN", "mnt_id": "NOC11730-ARIN", "email": "", "domain": "sharedband.net", "created": "2007-10-17", "updated": "2015-12-02", "source": "arin", "raw": "OrgID:          SHARE-13\\nOrgName:        Sharedband Technologies, LLC\\nCanAllocate:    \\nStreet:         113 Cherry St #22527\\nCity:           Seattle\\nState/Prov:     WA\\nCountry:        US\\nPostalCode:     98104\\nComment:        Please send abuse reports to abuse@sharedband.net\\nRegDate:        2007-10-17\\nUpdated:        2015-12-02\\nOrgAbuseHandle: SHARE2-ARIN\\nOrgAdminHandle: NOC11730-ARIN\\nOrgNOCHandle:   NOC11730-ARIN\\nOrgTechHandle:  NOC11730-ARIN\\nSource:         ARIN\\n\n\nPOCHandle:      NOC11730-ARIN\\nIsRole:         Y\\nLastName:       Network Operations Center\\nFirstName:      \\nStreet:         113 Cherry Street #22527\\nCity:           Seattle\\nState/Prov:     WA\\nCountry:        US\\nPostalCode:     98104-2818\\nRegDate:        2010-12-01\\nUpdated:        2020-09-23\\nOfficePhone:    +1-206-420-0240\\nMailbox:        noc@sharedband.net\\nSource:         ARIN\\n\n\nPOCHandle:      SHARE2-ARIN\\nIsRole:         Y\\nLastName:       Sharedband Abuse\\nFirstName:      \\nStreet:         113 Cherry Street #22527\\nCity:           Seattle\\nState/Prov:     WA\\nCountry:        US\\nPostalCode:     98104\\nRegDate:        2013-04-04\\nUpdated:        2020-09-23\\nOfficePhone:    +1-206-420-0240\\nMailbox:        abuse@sharedband.net\\nSource:         ARIN\\n"}
{"id": "ACL-154", "name": "Aien Cap LP", "address": "", "street": "29 west 38th street", "city": "new york", "state": "NY", "postalcode": "10018", "country": "US", "admin_id": "ARSLA-ARIN", "tech_id": "ARSLA-ARIN", "abuse_id": "ARSLA-ARIN", "mnt_id": "ARSLA-ARIN", "email": "", "domain": "aientech.com", "created": "2011-04-01", "updated": "2012-12-13", "source": "arin", "raw": "OrgID:          ACL-154\\nOrgName:        Aien Cap LP\\nCanAllocate:    \\nStreet:         29 west 38th street\\nCity:           new york\\nState/Prov:     NY\\nCountry:        US\\nPostalCode:     10018\\nRegDate:        2011-04-01\\nUpdated:        2012-12-13\\nOrgAbuseHandle: ARSLA-ARIN\\nOrgAdminHandle: ARSLA-ARIN\\nOrgNOCHandle:   ARSLA-ARIN\\nOrgTechHandle:  ARSLA-ARIN\\nSource:         ARIN\\n\n\nPOCHandle:      ARSLA-ARIN\\nIsRole:         N\\nLastName:       ARSLAN\\nFirstName:      UGUR\\nStreet:         29 W38TH Street, Suite 600\\nCity:           New York\\nState/Prov:     NY\\nCountry:        US\\nPostalCode:     10018\\nRegDate:        2012-04-01\\nUpdated:        2015-01-01\\nOfficePhone:    +1-646-873-6608\\nMobilePhone:    +1-904-238-5967\\nMailbox:        uarslan@aientech.com\\nSource:         ARIN\\n"}
{"id": "GCC-182", "name": "Gazelle Communications Corp.", "address": "", "street": "1235 Bay Street\\nSuite 1003", "city": "Toronto", "state": "ON", "postalcode": "M5R 3K4", "country": "CA", "admin_id": "DML26-ARIN", "tech_id": "LEGGA1-ARIN", "abuse_id": "ABUSE4911-ARIN", "mnt_id": "NETWO7212-ARIN", "email": "", "domain": "gazellecorporation.com", "created": "2016-03-02", "updated": "2022-03-31", "source": "arin", "raw": "OrgID:          GCC-182\\nOrgName:        Gazelle Communications Corp.\\nCanAllocate:    \\nStreet:         1235 Bay Street\\nStreet:         Suite 1003\\nCity:           Toronto\\nState/Prov:     ON\\nCountry:        CA\\nPostalCode:     M5R 3K4\\nRegDate:        2016-03-02\\nUpdated:        2022-03-31\\nOrgAbuseHandle: ABUSE4911-ARIN\\nOrgAdminHandle: DML26-ARIN\\nOrgNOCHandle:   NETWO7212-ARIN\\nOrgTechHandle:  LEGGA1-ARIN\\nSource:         ARIN\\n\n\nPOCHandle:      DML26-ARIN\\nIsRole:         N\\nLastName:       Liss\\nFirstName:      David\\nStreet:         1003-1235 Bay Street\\nCity:           Toronto\\nState/Prov:     ON\\nCountry:        CA\\nPostalCode:     M5R 3K4\\nRegDate:        2016-01-12\\nUpdated:        2022-03-31\\nOfficePhone:    +1-416-549-5000\\nFaxPhone:       +1-416-549-5001\\nMailbox:        dliss@gazl.co\\nSource:         ARIN\\n\n\nPOCHandle:      ABUSE4911-ARIN\\nIsRole:         Y\\nLastName:       abuse\\nFirstName:      \\nStreet:         1235 Bay Street, Suite 1003\\nCity:           Toronto\\nState/Prov:     ON\\nCountry:        CA\\nPostalCode:     M5R 3K4\\nRegDate:        2014-11-13\\nUpdated:        2019-12-30\\nOfficePhone:    +1-416-549-5000\\nMailbox:        abuse@iuplink.net\\nSource:         ARIN\\n\n\nPOCHandle:      LEGGA1-ARIN\\nIsRole:         N\\nLastName:       Leggat\\nFirstName:      Kyle\\nStreet:         1003-1235 Bay St\\nCity:           Toronto\\nState/Prov:     ON\\nCountry:        CA\\nPostalCode:     M5R 3K4\\nRegDate:        2022-03-31\\nUpdated:        2022-03-31\\nOfficePhone:    +1-416-549-5032\\nMailbox:        kleggat@gazl.co\\nSource:         ARIN\\n\n\nPOCHandle:      NETWO7212-ARIN\\nIsRole:         Y\\nLastName:       Network Operation\\nFirstName:      \\nStreet:         1235 Bay Street, Suite 1003\\nCity:           Toronto\\nState/Prov:     ON\\nCountry:        CA\\nPostalCode:     M5R 3K4\\nRegDate:        2014-11-13\\nUpdated:        2019-12-10\\nOfficePhone:    +1-416-549-5000\\nMailbox:        noc@iuplink.net\\nSource:         ARIN\\n"}
{"id": "BEAMS", "name": "Beamspeed LLC", "address": "", "street": "2481 E. Palo Verde St", "city": "Yuma", "state": "AZ", "postalcode": "85365", "country": "US", "admin_id": "CHE33-ARIN", "tech_id": "CHE33-ARIN\\NOCHOA37-ARIN", "abuse_id": "ABUSE1649-ARIN", "mnt_id": "NOC2549-ARIN", "email": "", "domain": "beamspeed.com", "created": "2003-08-21", "updated": "2018-07-30", "source": "arin", "raw": "OrgID:          BEAMS\\nOrgName:        Beamspeed LLC\\nCanAllocate:    \\nStreet:         2481 E. Palo Verde St\\nCity:           Yuma\\nState/Prov:     AZ\\nCountry:        US\\nPostalCode:     85365\\nRegDate:        2003-08-21\\nUpdated:        2018-07-30\\nOrgAbuseHandle: ABUSE1649-ARIN\\nOrgAdminHandle: CHE33-ARIN\\nOrgNOCHandle:   NOC2549-ARIN\\nOrgTechHandle:  CHE33-ARIN\\nOrgTechHandle:  OCHOA37-ARIN\\nSource:         ARIN\\n\n\nPOCHandle:      NOC2549-ARIN\\nIsRole:         Y\\nLastName:       Network Operations Center\\nFirstName:      \\nStreet:         2481 E. Palo Verde St.\\nCity:           Yuma\\nState/Prov:     AZ\\nCountry:        US\\nPostalCode:     85365\\nRegDate:        2007-04-27\\nUpdated:        2021-09-28\\nOfficePhone:    +1-928-726-2000\\nMailbox:        noc@beamspeed.net\\nSource:         ARIN\\n\n\nPOCHandle:      CHE33-ARIN\\nIsRole:         N\\nLastName:       Hendrick\\nFirstName:      CARTER\\nStreet:         2481 E. Palo Verde St.\\nCity:           Yuma\\nState/Prov:     AZ\\nCountry:        US\\nPostalCode:     85365\\nRegDate:        2004-11-15\\nUpdated:        2017-06-07\\nOfficePhone:    +1-928-726-0894\\nMailbox:        carter@beamspeed.com\\nSource:         ARIN\\n\n\nPOCHandle:      ABUSE1649-ARIN\\nIsRole:         Y\\nLastName:       Abuse Department\\nFirstName:      \\nStreet:         2481 E. Palo Verde St.\\nCity:           Yuma\\nState/Prov:     AZ\\nCountry:        US\\nPostalCode:     85365\\nRegDate:        2007-04-27\\nUpdated:        2021-09-28\\nOfficePhone:    +1-928-726-2000\\nMailbox:        abuse@beamspeed.net\\nSource:         ARIN\\n\n\nPOCHandle:      OCHOA37-ARIN\\nIsRole:         N\\nLastName:       Ochoa\\nFirstName:      Eddie\\nStreet:         2481 E Palo Verde St\\nCity:           Yuma\\nState/Prov:     AZ\\nCountry:        US\\nPostalCode:     85365\\nRegDate:        2017-07-20\\nUpdated:        2021-05-30\\nOfficePhone:    +1-928-343-0300\\nMailbox:        eochoa@beamspeed.com\\nSource:         ARIN\\n"}
{"id": "LC", "name": "Likwid Communications Inc.", "address": "", "street": "PO Box 1927", "city": "Inverness", "state": "FL", "postalcode": "34451", "country": "US", "admin_id": "CLS11-ARIN", "tech_id": "CLS11-ARIN", "abuse_id": "CLS11-ARIN", "mnt_id": "CLS11-ARIN", "email": "", "domain": "golikwid.com", "created": "2011-01-28", "updated": "2017-02-21", "source": "arin", "raw": "OrgID:          LC\\nOrgName:        Likwid Communications Inc.\\nCanAllocate:    \\nStreet:         PO Box 1927\\nCity:           Inverness\\nState/Prov:     FL\\nCountry:        US\\nPostalCode:     34451\\nRegDate:        2011-01-28\\nUpdated:        2017-02-21\\nOrgAbuseHandle: CLS11-ARIN\\nOrgAdminHandle: CLS11-ARIN\\nOrgNOCHandle:   CLS11-ARIN\\nOrgTechHandle:  CLS11-ARIN\\nSource:         ARIN\\n\n\nPOCHandle:      CLS11-ARIN\\nIsRole:         N\\nLastName:       Smith\\nFirstName:      Christopher\\nStreet:         PO Box 1927\\nCity:           Inverness\\nState/Prov:     FL\\nCountry:        US\\nPostalCode:     34451\\nRegDate:        2011-01-28\\nUpdated:        2021-02-19\\nMobilePhone:    +1-352-613-4420\\nOfficePhone:    +1-352-726-1236\\nMailbox:        chris@golikwid.com\\nSource:         ARIN\\n"}
{"id": "LEIDO-1", "name": "Leidos CBSNSOC (commercial Business Services Network Security Operations Center)", "address": "", "street": "Bank of America Building Loc 1658\\n200 W. Capitol Avenue suite 600\\nLittle Rock, AR 72201\\nUNITED STATES", "city": "Little Rock", "state": "AR", "postalcode": "72201", "country": "US", "admin_id": "LWH67-ARIN", "tech_id": "LEWEL-ARIN\\NYEAGE14-ARIN", "abuse_id": "LEWEL-ARIN\\NYEAGE14-ARIN", "mnt_id": "LEWEL-ARIN", "email": "", "domain": "leidos.com", "created": "2013-11-27", "updated": "2021-08-15", "source": "arin", "raw": "OrgID:          LEIDO-1\\nOrgName:        Leidos CBSNSOC (commercial Business Services Network Security Operations Center)\\nCanAllocate:    \\nStreet:         Bank of America Building Loc 1658 \\nStreet:         200 W. Capitol Avenue suite 600\\nStreet:         Little Rock, AR 72201\\nStreet:         UNITED STATES\\nCity:           Little Rock\\nState/Prov:     AR\\nCountry:        US\\nPostalCode:     72201\\nComment:        OCITOKEN::162.253.82.0/24:4ec6b758bfb50c2ae22d875b639934860ac3b6f3e49351e347fc210da1fe76f4\\nComment:        OCITOKEN::162.253.84.0/24:1961daba30f8a88fa2410b0bd0528d3adb015595289e4392a270f9e6fe98a6a1\\nComment:        OCITOKEN::162.253.80.0/24:dc137fbb0d564e25c6568cfc717ccc30c7fc9e57b5ee6f4f68ea4d021e6f8b25\\nComment:        OCITOKEN::162.253.83.0/24:76131bb8a6597654c50b8d8d64b8ed92199714fc4a3c39adfeb705a283d87801\\nRegDate:        2013-11-27\\nUpdated:        2021-08-15\\nOrgAbuseHandle: LEWEL-ARIN\\nOrgAbuseHandle: YEAGE14-ARIN\\nOrgAdminHandle: LWH67-ARIN\\nOrgNOCHandle:   LEWEL-ARIN\\nOrgTechHandle:  LEWEL-ARIN\\nOrgTechHandle:  YEAGE14-ARIN\\nSource:         ARIN\\n\n\nPOCHandle:      YEAGE14-ARIN\\nIsRole:         N\\nLastName:       Yeager\\nFirstName:      Steve\\nStreet:         200 W. Capitol\\nCity:           Little Rock\\nState/Prov:     AR\\nCountry:        US\\nPostalCode:     72201\\nRegDate:        2013-10-03\\nUpdated:        2022-05-25\\nOfficePhone:    +1-501-301-1067\\nMailbox:        stephen.d.yeager@leidos.com\\nSource:         ARIN\\n\n\nPOCHandle:      LWH67-ARIN\\nIsRole:         N\\nLastName:       Hill\\nFirstName:      Lawrence\\nStreet:         11 Brimm Lane\\nCity:           Williamsburg\\nState/Prov:     KY\\nCountry:        US\\nPostalCode:     40769\\nRegDate:        2021-06-08\\nUpdated:        2022-06-08\\nOfficePhone:    +1-606-401-5406\\nMailbox:        lawrence.w.hill@leidos.com\\nSource:         ARIN\\n\n\nPOCHandle:      LEWEL-ARIN\\nIsRole:         N\\nLastName:       Lewellen\\nFirstName:      Ben\\nStreet:         4011 Millbrook Dr\\nCity:           Bryant\\nState/Prov:     AR\\nCountry:        US\\nPostalCode:     72022\\nRegDate:        2012-12-06\\nUpdated:        2015-04-01\\nOfficePhone:    +1-501-303-6018\\nMailbox:        blewell@gmail.com\\nSource:         ARIN\\n"}
{"id": "SL-1111", "name": "Stalgrid, LLC", "address": "", "street": "6 Liberty Square #2088", "city": "Boston", "state": "MA", "postalcode": "02109", "country": "US", "admin_id": "JNB3-ARIN", "tech_id": "NOC32621-ARIN", "abuse_id": "ABUSE5858-ARIN", "mnt_id": "NOC32621-ARIN", "email": "", "domain": "bogle.se", "created": "2017-01-23", "updated": "2017-04-11", "source": "arin", "raw": "OrgID:          SL-1111\\nOrgName:        Stalgrid, LLC\\nCanAllocate:    \\nStreet:         6 Liberty Square #2088\\nCity:           Boston\\nState/Prov:     MA\\nCountry:        US\\nPostalCode:     02109\\nComment:        https://ionswitch.com\\nRegDate:        2017-01-23\\nUpdated:        2017-04-11\\nOrgAbuseHandle: ABUSE5858-ARIN\\nOrgAdminHandle: JNB3-ARIN\\nOrgNOCHandle:   NOC32621-ARIN\\nOrgTechHandle:  NOC32621-ARIN\\nSource:         ARIN\\n\n\nPOCHandle:      JNB3-ARIN\\nIsRole:         N\\nLastName:       Bogle\\nFirstName:      John\\nStreet:         3462 E Galway Cir\\nCity:           Post Falls\\nState/Prov:     ID\\nCountry:        US\\nPostalCode:     83854\\nRegDate:        2017-02-08\\nUpdated:        2022-07-28\\nOfficePhone:    +1-509-280-0875\\nMailbox:        nick@bogle.se\\nSource:         ARIN\\n\n\nPOCHandle:      ABUSE5858-ARIN\\nIsRole:         Y\\nLastName:       Abuse\\nFirstName:      \\nStreet:         600 W Appleway Ave\\nStreet:         Ste B\\nCity:           Coeur d'Alene\\nState/Prov:     ID\\nCountry:        US\\nPostalCode:     83814\\nRegDate:        2017-02-08\\nUpdated:        2022-07-28\\nOfficePhone:    +1-888-801-4667\\nMailbox:        abuse@ionswitch.com\\nSource:         ARIN\\n\n\nPOCHandle:      NOC32621-ARIN\\nIsRole:         Y\\nLastName:       Network Operations Center\\nFirstName:      \\nStreet:         244 W Main Ave\\nCity:           Spokane\\nState/Prov:     WA\\nCountry:        US\\nPostalCode:     99201\\nRegDate:        2017-02-08\\nUpdated:        2022-07-28\\nOfficePhone:    +1-888-801-4667\\nMailbox:        noc@ionswitch.com\\nSource:         ARIN\\n"}
{"id": "CPU-20", "name": "Lazernet", "address": "", "street": "1100 Commercial Ave\\nPO Box 591", "city": "Cairo", "state": "IL", "postalcode": "62914", "country": "US", "admin_id": "ADMIN1207-ARIN", "tech_id": "ADMIN1207-ARIN\\NPERRY475-ARIN", "abuse_id": "ADMIN1207-ARIN", "mnt_id": "ADMIN1207-ARIN", "email": "", "domain": "wisperisp.com", "created": "2014-10-01", "updated": "2021-03-09", "source": "arin", "raw": "OrgID:          CPU-20\\nOrgName:        Lazernet\\nCanAllocate:    \\nStreet:         1100 Commercial Ave\\nStreet:         PO Box 591\\nCity:           Cairo\\nState/Prov:     IL\\nCountry:        US\\nPostalCode:     62914\\nRegDate:        2014-10-01\\nUpdated:        2021-03-09\\nOrgAbuseHandle: ADMIN1207-ARIN\\nOrgAdminHandle: ADMIN1207-ARIN\\nOrgNOCHandle:   ADMIN1207-ARIN\\nOrgTechHandle:  ADMIN1207-ARIN\\nOrgTechHandle:  PERRY475-ARIN\\nSource:         ARIN\\n\n\nPOCHandle:      PERRY475-ARIN\\nIsRole:         N\\nLastName:       Perry\\nFirstName:      Matthew\\nStreet:         9711 Fuesser Rd\\nCity:           Mascoutah\\nState/Prov:     IL\\nCountry:        US\\nPostalCode:     62258\\nRegDate:        2020-10-20\\nUpdated:        2021-11-11\\nOfficePhone:    +1-618-206-4190\\nMailbox:        mperry@wisperisp.com\\nSource:         ARIN\\n\n\nPOCHandle:      ADMIN1207-ARIN\\nIsRole:         Y\\nLastName:       Administrative\\nFirstName:      \\nStreet:         9711 Fuesser Road\\nCity:           Mascoutah\\nState/Prov:     IL\\nCountry:        US\\nPostalCode:     62258\\nRegDate:        2007-09-07\\nUpdated:        2020-08-27\\nOfficePhone:    +1-618-206-4190\\nMobilePhone:    +1-618-697-7535\\nMailbox:        noc@wisperisp.com\\nMailbox:        sjerrell@wisperisp.com\\nSource:         ARIN\\n"}
{"id": "BEC-233", "name": "Bandera Electric Cooperative Inc.", "address": "", "street": "3172 State HWY 16 North\\nP.O. Box 677", "city": "Bandera", "state": "TX", "postalcode": "78003", "country": "US", "admin_id": "REM29-ARIN", "tech_id": "REM29-ARIN\\NRMC240-ARIN", "abuse_id": "REM29-ARIN", "mnt_id": "REM29-ARIN", "email": "", "domain": "banderaelectric.com", "created": "2016-11-11", "updated": "2018-03-21", "source": "arin", "raw": "OrgID:          BEC-233\\nOrgName:        Bandera Electric Cooperative Inc.\\nCanAllocate:    \\nStreet:         3172 State HWY 16 North\\nStreet:         P.O. Box 677\\nCity:           Bandera\\nState/Prov:     TX\\nCountry:        US\\nPostalCode:     78003\\nRegDate:        2016-11-11\\nUpdated:        2018-03-21\\nOrgAbuseHandle: REM29-ARIN\\nOrgAdminHandle: REM29-ARIN\\nOrgNOCHandle:   REM29-ARIN\\nOrgTechHandle:  REM29-ARIN\\nOrgTechHandle:  RMC240-ARIN\\nSource:         ARIN\\n\n\nPOCHandle:      RMC240-ARIN\\nIsRole:         N\\nLastName:       McDonald\\nFirstName:      Richard\\nStreet:         3172 State Highway 16 N.\\nCity:           Bandera\\nState/Prov:     TX\\nCountry:        US\\nPostalCode:     78003\\nRegDate:        2010-07-29\\nUpdated:        2018-03-19\\nOfficePhone:    +1-830-796-3741\\nMailbox:        r.mcdonald@banderaelectric.com\\nSource:         ARIN\\n\n\nPOCHandle:      REM29-ARIN\\nIsRole:         N\\nLastName:       McDonald\\nFirstName:      Richard\\nStreet:         3172 State HWY 16 N\\nStreet:         PO Box 677\\nCity:           Bandera\\nState/Prov:     TX\\nCountry:        US\\nPostalCode:     78003\\nRegDate:        2015-07-10\\nUpdated:        2016-11-10\\nOfficePhone:    +1-830-796-6019\\nMailbox:        r.mcdonald@banderaelectric.com\\nSource:         ARIN\\n"}
{"id": "BELLNO-1", "name": "Bell-Northern Research", "address": "", "street": "3500 Carling Avenue", "city": "Ottawa", "state": "ON", "postalcode": "K2H 8E9", "country": "CA", "admin_id": "HOSTM383-ARIN", "tech_id": "HOSTM383-ARIN\\NZN1-ARIN", "abuse_id": "HOSTM383-ARIN\\NZN1-ARIN", "mnt_id": "HOSTM383-ARIN\\NZN1-ARIN", "email": "", "domain": "bnr.ca", "created": "1989-10-05", "updated": "2013-12-23", "source": "arin", "raw": "OrgID:          BELLNO-1\\nOrgName:        Bell-Northern Research\\nCanAllocate:    \\nStreet:         3500 Carling Avenue\\nCity:           Ottawa\\nState/Prov:     ON\\nCountry:        CA\\nPostalCode:     K2H 8E9\\nRegDate:        1989-10-05\\nUpdated:        2013-12-23\\nOrgAbuseHandle: HOSTM383-ARIN\\nOrgAbuseHandle: ZN1-ARIN\\nOrgAdminHandle: HOSTM383-ARIN\\nOrgNOCHandle:   HOSTM383-ARIN\\nOrgNOCHandle:   ZN1-ARIN\\nOrgTechHandle:  HOSTM383-ARIN\\nOrgTechHandle:  ZN1-ARIN\\nSource:         ARIN\\n\n\nPOCHandle:      ZN1-ARIN\\nIsRole:         Y\\nLastName:       Hostmaster\\nFirstName:      \\nStreet:         5945 Airport Road, Suite 152\\nCity:           Mississauga\\nState/Prov:     ON\\nCountry:        CA\\nPostalCode:     L4V 1R9\\nRegDate:        1999-10-13\\nUpdated:        2022-03-02\\nMobilePhone:    +1-647-203-4859\\nOfficePhone:    +1-905-863-7120\\nMailbox:        Jasmin.Ahmad@nortel-canada.com\\nSource:         ARIN\\n\n\nPOCHandle:      HOSTM383-ARIN\\nIsRole:         Y\\nLastName:       Hostmaster\\nFirstName:      \\nStreet:         5945 Airport Road\\nCity:           Mississauga\\nState/Prov:     ON\\nCountry:        CA\\nPostalCode:     L4V 1R9\\nRegDate:        2003-11-24\\nUpdated:        2021-12-20\\nOfficePhone:    +1-905-863-7120\\nMobilePhone:    +1-647-203-4859\\nMailbox:        Jasmin.Ahmad@nortel-canada.com\\nSource:         ARIN\\n"}
{"id": "RE-562", "name": "Renaissoft Enterprises", "address": "", "street": "PO Box 2951", "city": "Garibaldi Highlands", "state": "BC", "postalcode": "V0N 1T0", "country": "CA", "admin_id": "RL79-ARIN", "tech_id": "RL79-ARIN", "abuse_id": "RL79-ARIN", "mnt_id": "RL79-ARIN", "email": "", "domain": "renaissoft.com", "created": "2020-05-13", "updated": "2020-05-13", "source": "arin", "raw": "OrgID:          RE-562\\nOrgName:        Renaissoft Enterprises\\nCanAllocate:    \\nStreet:         PO Box 2951\\nCity:           Garibaldi Highlands\\nState/Prov:     BC\\nCountry:        CA\\nPostalCode:     V0N 1T0\\nRegDate:        2020-05-13\\nUpdated:        2020-05-13\\nOrgAbuseHandle: RL79-ARIN\\nOrgAdminHandle: RL79-ARIN\\nOrgDNSHandle:   RL79-ARIN\\nOrgNOCHandle:   RL79-ARIN\\nOrgRoutingHandle:   RL79-ARIN\\nOrgTechHandle:  RL79-ARIN\\nSource:         ARIN\\n\n\nPOCHandle:      RL79-ARIN\\nIsRole:         N\\nLastName:       LeBlanc\\nFirstName:      Robert\\nStreet:         P.O. Box 2951\\nCity:           Garibaldi Highlands\\nState/Prov:     BC\\nCountry:        CA\\nPostalCode:     V0N-1T0\\nRegDate:        1994-04-26\\nUpdated:        2019-12-09\\nOfficePhone:    +1-604-898-8494\\nMailbox:        rjl@renaissoft.com\\nSource:         ARIN\\n"}
{"id": "COUNTY-29", "name": "County of Yolo", "address": "", "street": "120 W. Main Street\\nSuite D", "city": "Woodland", "state": "CA", "postalcode": "95695", "country": "US", "admin_id": "TBA167-ARIN", "tech_id": "TBA167-ARIN", "abuse_id": "TBA167-ARIN", "mnt_id": "TBA167-ARIN", "email": "", "domain": "yolocounty.org", "created": "1995-04-18", "updated": "2013-11-26", "source": "arin", "raw": "OrgID:          COUNTY-29\\nOrgName:        County of Yolo\\nCanAllocate:    \\nStreet:         120 W. Main Street\\nStreet:         Suite D\\nCity:           Woodland\\nState/Prov:     CA\\nCountry:        US\\nPostalCode:     95695\\nRegDate:        1995-04-18\\nUpdated:        2013-11-26\\nOrgAbuseHandle: TBA167-ARIN\\nOrgAdminHandle: TBA167-ARIN\\nOrgNOCHandle:   TBA167-ARIN\\nOrgTechHandle:  TBA167-ARIN\\nSource:         ARIN\\n\n\nPOCHandle:      TBA167-ARIN\\nIsRole:         N\\nLastName:       Bates\\nFirstName:      Tom\\nStreet:         120 W MAIN ST., STE D\\nCity:           WOODLAND\\nState/Prov:     CA\\nCountry:        US\\nPostalCode:     95695\\nRegDate:        2009-08-26\\nUpdated:        2021-12-07\\nOfficePhone:    +1-530-406-5025\\nMailbox:        poc@yolocounty.org\\nSource:         ARIN\\n"}
{"id": "OO-6", "name": "Orcas Online, Inc", "address": "", "street": "254 Northbeach RD\\nPOB 1901", "city": "Eastsound", "state": "WA", "postalcode": "98245", "country": "US", "admin_id": "RAB1272-ARIN", "tech_id": "BAKER995-ARIN\\NKEL47-ARIN\\NRAB1272-ARIN", "abuse_id": "RAB1272-ARIN", "mnt_id": "RAB1272-ARIN", "email": "", "domain": "orcasonline.com", "created": "2011-09-30", "updated": "2020-07-21", "source": "arin", "raw": "OrgID:          OO-6\\nOrgName:        Orcas Online, Inc\\nCanAllocate:    \\nStreet:         254 Northbeach RD\\nStreet:         POB 1901\\nCity:           Eastsound\\nState/Prov:     WA\\nCountry:        US\\nPostalCode:     98245\\nRegDate:        2011-09-30\\nUpdated:        2020-07-21\\nOrgAbuseHandle: RAB1272-ARIN\\nOrgAdminHandle: RAB1272-ARIN\\nOrgDNSHandle:   RAB1272-ARIN\\nOrgNOCHandle:   RAB1272-ARIN\\nOrgRoutingHandle:   RAB1272-ARIN\\nOrgTechHandle:  BAKER995-ARIN\\nOrgTechHandle:  KEL47-ARIN\\nOrgTechHandle:  RAB1272-ARIN\\nSource:         ARIN\\n\n\nPOCHandle:      BAKER995-ARIN\\nIsRole:         N\\nLastName:       Baker\\nFirstName:      Stuart\\nStreet:         PO Box 1901\\nCity:           Eastsound\\nState/Prov:     WA\\nCountry:        US\\nPostalCode:     98245\\nRegDate:        2019-08-20\\nUpdated:        2021-08-20\\nOfficePhone:    +1-360-376-4124\\nMailbox:        gerryb@orcasonline.com\\nMailbox:        stu@orcasonline.com\\nMailbox:        rboucher@orcasonline.com\\nSource:         ARIN\\n\n\nPOCHandle:      KEL47-ARIN\\nIsRole:         N\\nLastName:       Light\\nFirstName:      Keith\\nStreet:         254 North Beach Road\\nCity:           Eastsound\\nState/Prov:     WA\\nCountry:        US\\nPostalCode:     98245\\nRegDate:        2020-06-08\\nUpdated:        2021-06-08\\nMobilePhone:    +1-360-317-4901\\nOfficePhone:    +1-360-376-4124\\nMailbox:        keith@orcasonline.com\\nSource:         ARIN\\n\n\nPOCHandle:      RAB1272-ARIN\\nIsRole:         N\\nLastName:       Boucher\\nFirstName:      Richard\\nStreet:         254 Northbeach Rd\\nStreet:         POB 1901\\nCity:           Eastsound\\nState/Prov:     WA\\nCountry:        US\\nPostalCode:     98245\\nRegDate:        2011-09-29\\nUpdated:        2021-08-27\\nOfficePhone:    +1-360-376-4124\\nMobilePhone:    +1-360-472-0051\\nFaxPhone:       +1-360-376-4124\\nMailbox:        rboucher@orcasonline.com\\nSource:         ARIN\\n"}
{"id": "FZ", "name": "Zsys-Networks", "address": "", "street": "329 Old Route 17", "city": "Livingston Manor", "state": "NY", "postalcode": "12758", "country": "US", "admin_id": "ZWERL-ARIN", "tech_id": "ZWERL-ARIN", "abuse_id": "ZWERL-ARIN", "mnt_id": "ZWERL-ARIN", "email": "", "domain": "zsysnet.com", "created": "2010-11-19", "updated": "2010-11-19", "source": "arin", "raw": "OrgID:          FZ\\nOrgName:        Zsys-Networks\\nCanAllocate:    \\nStreet:         329 Old Route 17\\nCity:           Livingston Manor\\nState/Prov:     NY\\nCountry:        US\\nPostalCode:     12758\\nComment:        NOC Hours 24/7\\nRegDate:        2010-11-19\\nUpdated:        2010-11-19\\nOrgAbuseHandle: ZWERL-ARIN\\nOrgAdminHandle: ZWERL-ARIN\\nOrgNOCHandle:   ZWERL-ARIN\\nOrgTechHandle:  ZWERL-ARIN\\nSource:         ARIN\\n\n\nPOCHandle:      ZWERL-ARIN\\nIsRole:         N\\nLastName:       Zwerlein\\nFirstName:      Frank\\nStreet:         329 Old Route 17\\nCity:           Livingston Manor\\nState/Prov:     NY\\nCountry:        US\\nPostalCode:     12758\\nRegDate:        2010-11-16\\nUpdated:        2014-09-23\\nMobilePhone:    +1-845-283-5388\\nOfficePhone:    +1-845-439-5465\\nMailbox:        zsystech@zsysnet.com\\nMailbox:        zsystara@zsysnet.com\\nSource:         ARIN\\n"}
{"id": "HNG-3", "name": "Highwinds Network Group, Inc.", "address": "", "street": "2021 McKinney Avenue Suite 1100", "city": "Dallas", "state": "TX", "postalcode": "75201", "country": "US", "admin_id": "HIA3-ARIN", "tech_id": "HIA3-ARIN\\NNOC2402-ARIN", "abuse_id": "HAR8-ARIN", "mnt_id": "HNOC5-ARIN", "email": "", "domain": "highwinds.com", "created": "2006-12-21", "updated": "2022-05-07", "source": "arin", "raw": "OrgID:          HNG-3\\nOrgName:        Highwinds Network Group, Inc.\\nCanAllocate:    \\nStreet:         2021 McKinney Avenue Suite 1100\\nCity:           Dallas\\nState/Prov:     TX\\nCountry:        US\\nPostalCode:     75201\\nRegDate:        2006-12-21\\nUpdated:        2022-05-07\\nOrgAbuseHandle: HAR8-ARIN\\nOrgAdminHandle: HIA3-ARIN\\nOrgNOCHandle:   HNOC5-ARIN\\nOrgTechHandle:  HIA3-ARIN\\nOrgTechHandle:  NOC2402-ARIN\\nSource:         ARIN\\n\n\nPOCHandle:      NOC2402-ARIN\\nIsRole:         Y\\nLastName:       Network Operation Center\\nFirstName:      \\nStreet:         2021 McKinney Ave.\\nStreet:         Suite 1100\\nCity:           Dallas\\nState/Prov:     TX\\nCountry:        US\\nPostalCode:     75201\\nRegDate:        2006-12-28\\nUpdated:        2022-06-01\\nOfficePhone:    +1-469-899-5729\\nMailbox:        neteng@stackpath.com\\nSource:         ARIN\\n\n\nPOCHandle:      HNOC5-ARIN\\nIsRole:         Y\\nLastName:       Highwinds Network Operations Center\\nFirstName:      \\nStreet:         2021 McKinney Ave\\nStreet:         Suite #1100\\nCity:           Dallas\\nState/Prov:     TX\\nCountry:        US\\nPostalCode:     75201\\nRegDate:        2007-11-07\\nUpdated:        2021-10-06\\nOfficePhone:    +1-469-899-5729\\nMailbox:        noc@hwng.net\\nSource:         ARIN\\n\n\nPOCHandle:      HIA3-ARIN\\nIsRole:         Y\\nLastName:       Highwinds IP Administrator\\nFirstName:      \\nStreet:         2021 McKinney Ave\\nStreet:         Suite #1100\\nCity:           Dallas\\nState/Prov:     TX\\nCountry:        US\\nPostalCode:     75201\\nRegDate:        2007-11-07\\nUpdated:        2021-10-06\\nOfficePhone:    +1-469-899-5729\\nMailbox:        ip-request@hwng.net\\nSource:         ARIN\\n\n\nPOCHandle:      HAR8-ARIN\\nIsRole:         Y\\nLastName:       Highwinds Abuse Response\\nFirstName:      \\nStreet:         1950 N. Stemmons Freeway\\nStreet:         Suite 1001\\nCity:           Dallas\\nState/Prov:     TX\\nCountry:        US\\nPostalCode:     75207\\nRegDate:        2007-11-07\\nUpdated:        2021-11-30\\nOfficePhone:    +1-469-899-5729\\nMailbox:        abuse@hwng.net\\nSource:         ARIN\\n"}
{"id": "NLNVPSCE", "name": "Napa Learns (The Napa Valley Partnership For 21st Century Education)", "address": "", "street": "2121 Imola Ave", "city": "Napa", "state": "CA", "postalcode": "94559", "country": "US", "admin_id": "TYLER37-ARIN", "tech_id": "TYLER37-ARIN", "abuse_id": "TYLER37-ARIN", "mnt_id": "TYLER37-ARIN", "email": "", "domain": "oneif.net", "created": "2013-11-13", "updated": "2013-11-13", "source": "arin", "raw": "OrgID:          NLNVPSCE\\nOrgName:        Napa Learns (The Napa Valley Partnership For 21st Century Education)\\nCanAllocate:    \\nStreet:         2121 Imola Ave\\nCity:           Napa\\nState/Prov:     CA\\nCountry:        US\\nPostalCode:     94559\\nRegDate:        2013-11-13\\nUpdated:        2013-11-13\\nOrgAbuseHandle: TYLER37-ARIN\\nOrgAdminHandle: TYLER37-ARIN\\nOrgNOCHandle:   TYLER37-ARIN\\nOrgTechHandle:  TYLER37-ARIN\\nSource:         ARIN\\n\n\nPOCHandle:      TYLER37-ARIN\\nIsRole:         N\\nLastName:       Tyler\\nFirstName:      Arrigoni\\nStreet:         2121 Imola Avenue\\nCity:           Napa\\nState/Prov:     CA\\nCountry:        US\\nPostalCode:     94559\\nRegDate:        2013-11-10\\nUpdated:        2013-11-10\\nOfficePhone:    +1-559-344-1924\\nMailbox:        netwk@oneif.net\\nSource:         ARIN\\n"}
{"id": "MSU-9-Z", "name": "Mississippi State University", "address": "", "street": "P. O. Box 9697", "city": "Mississippi State", "state": "MS", "postalcode": "39762", "country": "US", "admin_id": "GML3-ARIN", "tech_id": "HALLT58-ARIN", "abuse_id": "MSUAC-ARIN", "mnt_id": "HALLT58-ARIN", "email": "", "domain": "msstate.edu", "created": "2022-03-07", "updated": "2022-03-07", "source": "arin", "raw": "OrgID:          MSU-9-Z\\nOrgName:        Mississippi State University\\nCanAllocate:    \\nStreet:         P. O. Box 9697\\nCity:           Mississippi State\\nState/Prov:     MS\\nCountry:        US\\nPostalCode:     39762\\nRegDate:        2022-03-07\\nUpdated:        2022-03-07\\nOrgAbuseHandle: MSUAC-ARIN\\nOrgAdminHandle: GML3-ARIN\\nOrgNOCHandle:   HALLT58-ARIN\\nOrgTechHandle:  HALLT58-ARIN\\nSource:         ARIN\\n\n\nPOCHandle:      GML3-ARIN\\nIsRole:         N\\nLastName:       Lehnerer\\nFirstName:      Gerhard\\nStreet:         Box 9697\\nCity:           Mississippi State\\nState/Prov:     MS\\nCountry:        US\\nPostalCode:     39762\\nRegDate:        2010-02-04\\nUpdated:        2022-07-05\\nOfficePhone:    +1-662-325-9153\\nFaxPhone:       +1-662-325-8921\\nMailbox:        gerhard@its.msstate.edu\\nSource:         ARIN\\n\n\nPOCHandle:      MSUAC-ARIN\\nIsRole:         Y\\nLastName:       Mississippi State University Abuse Contact\\nFirstName:      \\nStreet:         Box 9697\\nCity:           Mississippi State\\nState/Prov:     MS\\nCountry:        US\\nPostalCode:     39762\\nRegDate:        2004-02-09\\nUpdated:        2022-02-03\\nOfficePhone:    +1-662-325-9311\\nMailbox:        abuse@msstate.edu\\nSource:         ARIN\\n\n\nPOCHandle:      HALLT58-ARIN\\nIsRole:         N\\nLastName:       Hall\\nFirstName:      Todd\\nStreet:         Box 9697\\nCity:           Mississippi State\\nState/Prov:     MS\\nCountry:        US\\nPostalCode:     39762\\nRegDate:        2017-12-19\\nUpdated:        2022-01-05\\nOfficePhone:    +1-662-325-9311\\nFaxPhone:       +1-662-325-8921\\nMailbox:        tmh9@msstate.edu\\nSource:         ARIN\\n"}
{"id": "ZN-17", "name": "ZONETECH NETWORKS INC.", "address": "", "street": "1-8335 RUE BAILLAIRGE", "city": "MONTREAL", "state": "QC", "postalcode": "H1L 3C2", "country": "CA", "admin_id": "IP1426-ARIN", "tech_id": "IP1426-ARIN", "abuse_id": "IP1426-ARIN", "mnt_id": "IP1426-ARIN", "email": "", "domain": "zone-t.ca", "created": "2021-09-08", "updated": "2021-09-09", "source": "arin", "raw": "OrgID:          ZN-17\\nOrgName:        ZONETECH NETWORKS INC.\\nCanAllocate:    \\nStreet:         1-8335 RUE BAILLAIRGE\\nCity:           MONTREAL\\nState/Prov:     QC\\nCountry:        CA\\nPostalCode:     H1L 3C2\\nRegDate:        2021-09-08\\nUpdated:        2021-09-09\\nOrgAbuseHandle: IP1426-ARIN\\nOrgAdminHandle: IP1426-ARIN\\nOrgDNSHandle:   IP1426-ARIN\\nOrgNOCHandle:   IP1426-ARIN\\nOrgRoutingHandle:   IP1426-ARIN\\nOrgTechHandle:  IP1426-ARIN\\nSource:         ARIN\\n\n\nPOCHandle:      IP1426-ARIN\\nIsRole:         Y\\nLastName:       IP\\nFirstName:      \\nStreet:         9160 Boulevard Leduc\\nStreet:         Suite #410\\nCity:           Brossard\\nState/Prov:     QC\\nCountry:        CA\\nPostalCode:     J4Y 0E3\\nRegDate:        2019-05-03\\nUpdated:        2021-07-29\\nOfficePhone:    +1-438-524-9183\\nMailbox:        info@zone-t.ca\\nSource:         ARIN\\n"}
{"id": "CL-250", "name": "Cloudteria LLC", "address": "", "street": "P.O. Box 1782", "city": "Phoenix", "state": "AZ", "postalcode": "85001", "country": "US", "admin_id": "NOC13295-ARIN", "tech_id": "NOC13295-ARIN", "abuse_id": "NOC13295-ARIN", "mnt_id": "NOC13295-ARIN", "email": "", "domain": "cloudteria.com", "created": "2013-08-22", "updated": "2013-08-22", "source": "arin", "raw": "OrgID:          CL-250\\nOrgName:        Cloudteria LLC\\nCanAllocate:    \\nStreet:         P.O. Box 1782\\nCity:           Phoenix\\nState/Prov:     AZ\\nCountry:        US\\nPostalCode:     85001\\nRegDate:        2013-08-22\\nUpdated:        2013-08-22\\nOrgAbuseHandle: NOC13295-ARIN\\nOrgAdminHandle: NOC13295-ARIN\\nOrgNOCHandle:   NOC13295-ARIN\\nOrgTechHandle:  NOC13295-ARIN\\nSource:         ARIN\\n\n\nPOCHandle:      NOC13295-ARIN\\nIsRole:         Y\\nLastName:       NOC\\nFirstName:      \\nStreet:         P.O. Box 1782\\nCity:           Phoenix\\nState/Prov:     AZ\\nCountry:        US\\nPostalCode:     85001\\nRegDate:        2013-08-20\\nUpdated:        2017-08-03\\nOfficePhone:    +1-888-510-8415\\nMailbox:        support@cloudteria.com\\nSource:         ARIN\\n"}
{"id": "TSC-118", "name": "TCA Services Corp.", "address": "", "street": "100 North Biscayne Blvd. Suite 1408", "city": "Miami", "state": "FL", "postalcode": "33132", "country": "US", "admin_id": "SR607-ARIN", "tech_id": "SR607-ARIN", "abuse_id": "SR607-ARIN", "mnt_id": "SR607-ARIN", "email": "", "domain": "tcascorp.com", "created": "2010-06-25", "updated": "2013-01-02", "source": "arin", "raw": "OrgID:          TSC-118\\nOrgName:        TCA Services Corp.\\nCanAllocate:    \\nStreet:         100 North Biscayne Blvd. Suite 1408\\nCity:           Miami\\nState/Prov:     FL\\nCountry:        US\\nPostalCode:     33132\\nComment:        http://www.tcascorp.com\\nRegDate:        2010-06-25\\nUpdated:        2013-01-02\\nOrgAbuseHandle: SR607-ARIN\\nOrgAdminHandle: SR607-ARIN\\nOrgNOCHandle:   SR607-ARIN\\nOrgTechHandle:  SR607-ARIN\\nSource:         ARIN\\n\n\nPOCHandle:      SR607-ARIN\\nIsRole:         N\\nLastName:       Romay\\nFirstName:      Socrates\\nStreet:         100 North Biscayne Blvd. Suite #1408\\nCity:           Miami\\nState/Prov:     FL\\nCountry:        US\\nPostalCode:     33132\\nRegDate:        2000-11-16\\nUpdated:        2021-04-21\\nFaxPhone:       +1-305-416-9777\\nMobilePhone:    +1-786-306-4115\\nOfficePhone:    +1-305-416-9776\\nMailbox:        socrates_romay@hotmail.com\\nMailbox:        socrates@tcascorp.com\\nSource:         ARIN\\n"}
{"id": "SLASH-1", "name": "CSS Corporation", "address": "", "street": "3031 Tisch Way\\nSuit 505", "city": "San Jose", "state": "CA", "postalcode": "95128", "country": "US", "admin_id": "DIREC64-ARIN", "tech_id": "DIREC64-ARIN", "abuse_id": "DIREC64-ARIN", "mnt_id": "DIREC64-ARIN", "email": "", "domain": "cssc-morocco.com", "created": "2010-11-09", "updated": "2014-04-09", "source": "arin", "raw": "OrgID:          SLASH-1\\nOrgName:        CSS Corporation\\nCanAllocate:    \\nStreet:         3031 Tisch Way\\nStreet:         Suit 505\\nCity:           San Jose\\nState/Prov:     CA\\nCountry:        US\\nPostalCode:     95128\\nRegDate:        2010-11-09\\nUpdated:        2014-04-09\\nOrgAbuseHandle: DIREC64-ARIN\\nOrgAdminHandle: DIREC64-ARIN\\nOrgNOCHandle:   DIREC64-ARIN\\nOrgTechHandle:  DIREC64-ARIN\\nSource:         ARIN\\n\n\nPOCHandle:      DIREC64-ARIN\\nIsRole:         Y\\nLastName:       Director\\nFirstName:      \\nStreet:         3031 Tisch Way STE#300\\nCity:           San Jose\\nState/Prov:     CA\\nCountry:        US\\nPostalCode:     95128\\nRegDate:        2014-03-12\\nUpdated:        2022-03-30\\nOfficePhone:    +1-408-667-7253\\nMobilePhone:    +1-408-667-7253\\nMailbox:        abdul.jeelani@csscorp.com\\nSource:         ARIN\\n"}
{"id": "VG", "name": "VGI", "address": "", "street": "3321 Foster St.", "city": "San Angelo", "state": "TX", "postalcode": "76903", "country": "US", "admin_id": "GIBBS4-ARIN", "tech_id": "BURTO33-ARIN\\NGIBBS4-ARIN", "abuse_id": "BURTO33-ARIN\\NGIBBS4-ARIN", "mnt_id": "BURTO33-ARIN", "email": "", "domain": "vgitechnology.com", "created": "2011-04-22", "updated": "2021-10-29", "source": "arin", "raw": "OrgID:          VG\\nOrgName:        VGI\\nCanAllocate:    \\nStreet:         3321 Foster St.\\nCity:           San Angelo\\nState/Prov:     TX\\nCountry:        US\\nPostalCode:     76903\\nRegDate:        2011-04-22\\nUpdated:        2021-10-29\\nOrgAbuseHandle: BURTO33-ARIN\\nOrgAbuseHandle: GIBBS4-ARIN\\nOrgAdminHandle: GIBBS4-ARIN\\nOrgNOCHandle:   BURTO33-ARIN\\nOrgTechHandle:  BURTO33-ARIN\\nOrgTechHandle:  GIBBS4-ARIN\\nSource:         ARIN\\n\n\nPOCHandle:      BURTO33-ARIN\\nIsRole:         N\\nLastName:       Burton\\nFirstName:      Lee\\nStreet:         3321 Foster St.\\nCity:           San Angelo\\nState/Prov:     TX\\nCountry:        US\\nPostalCode:     76903\\nRegDate:        2014-02-26\\nUpdated:        2022-03-03\\nOfficePhone:    +1-325-223-3050\\nMailbox:        lburton@vgitechnology.com\\nSource:         ARIN\\n\n\nPOCHandle:      GIBBS4-ARIN\\nIsRole:         N\\nLastName:       Gibbs\\nFirstName:      Scott\\nStreet:         3321 Foster St\\nCity:           San Angelo\\nState/Prov:     TX\\nCountry:        US\\nPostalCode:     76903\\nRegDate:        2011-04-21\\nUpdated:        2021-10-12\\nOfficePhone:    +1-325-223-3000\\nMobilePhone:    +1-325-374-2132\\nMailbox:        sgibbs@vgitechnology.com\\nSource:         ARIN\\n"}
{"id": "TUCOWS", "name": "Tucows International", "address": "", "street": "96 Mowat Avenue", "city": "Toronto", "state": "ON", "postalcode": "M6K-3M1", "country": "CA", "admin_id": "OPERA30-ARIN", "tech_id": "DIACO-ARIN\\NGIDOF-ARIN\\NLEHEU-ARIN\\NLEVYR7-ARIN\\NOPERA26-ARIN\\NSCURT4-ARIN\\NVERME5-ARIN", "abuse_id": "AST147-ARIN", "mnt_id": "NOC12422-ARIN", "email": "", "domain": "tucows.com", "created": "2000-04-20", "updated": "2021-03-16", "source": "arin", "raw": "OrgID:          TUCOWS\\nOrgName:        Tucows International\\nCanAllocate:    \\nStreet:         96 Mowat Avenue\\nCity:           Toronto\\nState/Prov:     ON\\nCountry:        CA\\nPostalCode:     M6K-3M1\\nRegDate:        2000-04-20\\nUpdated:        2021-03-16\\nOrgAbuseHandle: AST147-ARIN\\nOrgAdminHandle: OPERA30-ARIN\\nOrgNOCHandle:   NOC12422-ARIN\\nOrgTechHandle:  DIACO-ARIN\\nOrgTechHandle:  GIDOF-ARIN\\nOrgTechHandle:  LEHEU-ARIN\\nOrgTechHandle:  LEVYR7-ARIN\\nOrgTechHandle:  OPERA26-ARIN\\nOrgTechHandle:  SCURT4-ARIN\\nOrgTechHandle:  VERME5-ARIN\\nSource:         ARIN\\n\n\nPOCHandle:      LEHEU-ARIN\\nIsRole:         N\\nLastName:       Le Heux\\nFirstName:      Alex\\nStreet:         96 Mowat Avenue\\nStreet:         Toronto, ON M6K 3M1\\nStreet:         Canada\\nCity:           Toronto\\nState/Prov:     ON\\nCountry:        CA\\nPostalCode:     M6K 3M1\\nRegDate:        2013-08-15\\nUpdated:        2022-04-08\\nOfficePhone:    +1-416-535-0123\\nMailbox:        aleheux@tucowsinc.com\\nSource:         ARIN\\n\n\nPOCHandle:      AST147-ARIN\\nIsRole:         Y\\nLastName:       Abuse Security Team\\nFirstName:      \\nStreet:         96 Mowat Avenue\\nCity:           Toronto\\nState/Prov:     ON\\nCountry:        CA\\nPostalCode:     M6K 3M1\\nRegDate:        2012-01-05\\nUpdated:        2021-09-15\\nOfficePhone:    +1-416-535-0123\\nFaxPhone:       +1-416-531-5584\\nMailbox:        arin-abuse@tucows.com\\nSource:         ARIN\\n\n\nPOCHandle:      SCURT4-ARIN\\nIsRole:         N\\nLastName:       Scurt\\nFirstName:      Matei\\nStreet:         2121 E Williams St #106, Apex, NC 27539\\nCity:           Starkville\\nState/Prov:     MS\\nCountry:        US\\nPostalCode:     39759\\nRegDate:        2021-03-16\\nUpdated:        2022-06-16\\nOfficePhone:    +1-919-753-4126\\nMailbox:        mscurt@tucowsinc.com\\nSource:         ARIN\\n\n\nPOCHandle:      OPERA26-ARIN\\nIsRole:         Y\\nLastName:       Operations Team\\nFirstName:      \\nStreet:         96 Mowat Ave\\nCity:           Toronto\\nState/Prov:     ON\\nCountry:        CA\\nPostalCode:     M6K-3M1\\nRegDate:        2003-09-22\\nUpdated:        2021-09-15\\nFaxPhone:       +1-416-531-5584\\nOfficePhone:    +1-416-535-0123\\nMailbox:        dnstech@tucows.com\\nSource:         ARIN\\n\n\nPOCHandle:      LEVYR7-ARIN\\nIsRole:         N\\nLastName:       Levy\\nFirstName:      Reg\\nStreet:         96 Mowat Avenue\\nCity:           Toronto\\nState/Prov:     ON\\nCountry:        CA\\nPostalCode:     M6K 3M1\\nRegDate:        2020-03-03\\nUpdated:        2021-10-14\\nOfficePhone:    +1-323-880-0831\\nMailbox:        rlevy@tucows.com\\nSource:         ARIN\\n\n\nPOCHandle:      OPERA30-ARIN\\nIsRole:         Y\\nLastName:       Operations Admin\\nFirstName:      \\nStreet:         96 Mowat Avenue\\nCity:           Toronto\\nState/Prov:     ON\\nCountry:        CA\\nPostalCode:     M6K-3M1\\nRegDate:        2003-09-30\\nUpdated:        2021-09-15\\nOfficePhone:    +1-416-535-0123\\nMailbox:        dnsadmin@tucows.com\\nSource:         ARIN\\n\n\nPOCHandle:      GIDOF-ARIN\\nIsRole:         N\\nLastName:       Gidofalvy\\nFirstName:      Gordon\\nStreet:         96 Mowat Avenue\\nCity:           Toronto\\nState/Prov:     ON\\nCountry:        CA\\nPostalCode:     M6K 3M1\\nRegDate:        2021-03-01\\nUpdated:        2022-03-31\\nOfficePhone:    +1-416-535-0123\\nMailbox:        ggidofalvy@tucowsinc.com\\nSource:         ARIN\\n\n\nPOCHandle:      DIACO-ARIN\\nIsRole:         N\\nLastName:       Diaconita\\nFirstName:      Dragos\\nStreet:         96 Mowat Avenue\\nCity:           Toronto\\nState/Prov:     ON\\nCountry:        CA\\nPostalCode:     M6K-3M1\\nRegDate:        2009-10-06\\nUpdated:        2022-01-27\\nOfficePhone:    +1-416-535-0123\\nMailbox:        ddiaconita@tucows.com\\nSource:         ARIN\\n\n\nPOCHandle:      VERME5-ARIN\\nIsRole:         N\\nLastName:       Vermeer\\nFirstName:      Arnoud\\nStreet:         96 Mowat Avenue\\nCity:           Toronto\\nState/Prov:     ON\\nCountry:        CA\\nPostalCode:     M6K 3M1\\nRegDate:        2020-01-07\\nUpdated:        2022-01-05\\nOfficePhone:    +1-416-535-0123\\nMailbox:        avermeer@tucows.com\\nSource:         ARIN\\n\n\nPOCHandle:      NOC12422-ARIN\\nIsRole:         Y\\nLastName:       Network Operations Center\\nFirstName:      \\nStreet:         96 Mowat Avenue\\nCity:           Toronto\\nState/Prov:     ON\\nCountry:        CA\\nPostalCode:     M6K-3M1\\nRegDate:        2012-01-06\\nUpdated:        2021-09-15\\nOfficePhone:    +1-416-535-0123\\nFaxPhone:       +1-416-531-5584\\nMailbox:        arin-noc@tucows.com\\nSource:         ARIN\\n"}
{"id": "SHL-1141", "name": "Sullivan's Hosting LLC", "address": "", "street": "100 Canterbury Street\\n#120", "city": "Worcester", "state": "MA", "postalcode": "01603", "country": "US", "admin_id": "ADMIN7979-ARIN", "tech_id": "TECHN1799-ARIN", "abuse_id": "ABUSE8318-ARIN", "mnt_id": "SHNS-ARIN", "email": "", "domain": "sullivanshosting.com", "created": "2021-12-16", "updated": "2022-04-05", "source": "arin", "raw": "OrgID:          SHL-1141\\nOrgName:        Sullivan's Hosting LLC\\nCanAllocate:    \\nStreet:         100 Canterbury Street\\nStreet:         #120\\nCity:           Worcester\\nState/Prov:     MA\\nCountry:        US\\nPostalCode:     01603\\nComment:        For abuse inquiries, please contact administration@sullivanshosting.com\\nComment:        For support inquiries, please contact support@sullivanshosting.com\\nComment:        For network inquiries, please contact noc@sullivanshosting.com https://sullivanshosting.com\\nRegDate:        2021-12-16\\nUpdated:        2022-04-05\\nOrgAbuseHandle: ABUSE8318-ARIN\\nOrgAdminHandle: ADMIN7979-ARIN\\nOrgNOCHandle:   SHNS-ARIN\\nOrgTechHandle:  TECHN1799-ARIN\\nSource:         ARIN\\n\n\nPOCHandle:      ADMIN7979-ARIN\\nIsRole:         Y\\nLastName:       Administration Department\\nFirstName:      \\nStreet:         482 Southbridge Street\\nStreet:         #335\\nCity:           Auburn\\nState/Prov:     MA\\nCountry:        US\\nPostalCode:     01501\\nRegDate:        2021-12-09\\nUpdated:        2021-12-09\\nOfficePhone:    +1-800-784-6177\\nMailbox:        administration@sullivanshosting.com\\nSource:         ARIN\\n\n\nPOCHandle:      TECHN1799-ARIN\\nIsRole:         Y\\nLastName:       Technical Support\\nFirstName:      \\nStreet:         482 Southbridge Street\\nStreet:         #335\\nCity:           Auburn\\nState/Prov:     MA\\nCountry:        US\\nPostalCode:     01501\\nRegDate:        2021-12-09\\nUpdated:        2021-12-09\\nOfficePhone:    +1-800-784-6177\\nMailbox:        support@sullivanshosting.com\\nSource:         ARIN\\n\n\nPOCHandle:      SHNS-ARIN\\nIsRole:         Y\\nLastName:       Sullivan's Hosting Network Services\\nFirstName:      \\nStreet:         482 Southbridge Street\\nStreet:         #335\\nCity:           Auburn\\nState/Prov:     MA\\nCountry:        US\\nPostalCode:     01501\\nRegDate:        2021-12-09\\nUpdated:        2021-12-09\\nOfficePhone:    +1-800-784-6177\\nMailbox:        noc@sullivanshosting.com\\nSource:         ARIN\\n\n\nPOCHandle:      ABUSE8318-ARIN\\nIsRole:         Y\\nLastName:       Abuse Department\\nFirstName:      \\nStreet:         482 Southbridge Street\\nStreet:         #335\\nCity:           Auburn\\nState/Prov:     MA\\nCountry:        US\\nPostalCode:     01501\\nRegDate:        2021-12-09\\nUpdated:        2022-01-07\\nOfficePhone:    +1-800-784-6177\\nMailbox:        abuse@sullivanshosting.com\\nSource:         ARIN\\n"}
{"id": "RIGST-1", "name": "Rigstar Communications Inc.", "address": "", "street": "227 Exploration Ave SE", "city": "Calgary", "state": "AB", "postalcode": "T3S 0B6", "country": "CA", "admin_id": "ADMIN669-ARIN", "tech_id": "ADMIN669-ARIN", "abuse_id": "HOLBR57-ARIN", "mnt_id": "TECHN306-ARIN", "email": "", "domain": "rigstar.ca", "created": "2010-01-08", "updated": "2021-01-08", "source": "arin", "raw": "OrgID:          RIGST-1\\nOrgName:        Rigstar Communications Inc.\\nCanAllocate:    \\nStreet:         227 Exploration Ave SE\\nCity:           Calgary\\nState/Prov:     AB\\nCountry:        CA\\nPostalCode:     T3S 0B6\\nComment:        www.rigstar.ca\\nRegDate:        2010-01-08\\nUpdated:        2021-01-08\\nOrgAbuseHandle: HOLBR57-ARIN\\nOrgAdminHandle: ADMIN669-ARIN\\nOrgNOCHandle:   TECHN306-ARIN\\nOrgTechHandle:  ADMIN669-ARIN\\nSource:         ARIN\\n\n\nPOCHandle:      ADMIN669-ARIN\\nIsRole:         Y\\nLastName:       Administrative\\nFirstName:      \\nStreet:         3567-52ST SE\\nCity:           Calgary\\nState/Prov:     AB\\nCountry:        CA\\nPostalCode:     T2B-3R3\\nRegDate:        2005-10-24\\nUpdated:        2022-06-02\\nOfficePhone:    +1-403-243-0600\\nMobilePhone:    +1-403-312-1582\\nMailbox:        larry.holbrook@rigstar.ca\\nSource:         ARIN\\n\n\nPOCHandle:      TECHN306-ARIN\\nIsRole:         Y\\nLastName:       Technical\\nFirstName:      \\nStreet:         3567-52ST SE\\nCity:           Calgary\\nState/Prov:     AB\\nCountry:        CA\\nPostalCode:     T2B-3R3\\nRegDate:        2005-10-24\\nUpdated:        2022-06-02\\nOfficePhone:    +1-403-312-1582\\nOfficePhone:    +1-403-243-0600\\nMailbox:        larry.holbrook@rigstar.ca\\nSource:         ARIN\\n\n\nPOCHandle:      HOLBR57-ARIN\\nIsRole:         N\\nLastName:       Holbrook\\nFirstName:      Larry\\nStreet:         227 Exploration Avenue SE\\nCity:           Calgary\\nState/Prov:     AB\\nCountry:        CA\\nPostalCode:     T3S 0B6\\nRegDate:        2019-05-16\\nUpdated:        2022-01-10\\nOfficePhone:    +1-403-243-0600\\nMailbox:        larry.holbrook@rigstar.ca\\nSource:         ARIN\\n"}
{"id": "VOJN", "name": "CEDAR CREEK IT SOLUTIONS", "address": "", "street": "#14 - 1700 MacKay Cres.", "city": "AGASSIZ", "state": "BC", "postalcode": "V0M 1A3", "country": "CA", "admin_id": "CCN11-ARIN", "tech_id": "CCN11-ARIN", "abuse_id": "CCN11-ARIN", "mnt_id": "CCN11-ARIN", "email": "", "domain": "cedarcreek.co", "created": "2021-08-17", "updated": "2021-08-18", "source": "arin", "raw": "OrgID:          VOJN\\nOrgName:        CEDAR CREEK IT SOLUTIONS\\nCanAllocate:    \\nStreet:         #14 - 1700 MacKay Cres.\\nCity:           AGASSIZ\\nState/Prov:     BC\\nCountry:        CA\\nPostalCode:     V0M 1A3\\nRegDate:        2021-08-17\\nUpdated:        2021-08-18\\nOrgAbuseHandle: CCN11-ARIN\\nOrgAdminHandle: CCN11-ARIN\\nOrgDNSHandle:   CCN11-ARIN\\nOrgNOCHandle:   CCN11-ARIN\\nOrgRoutingHandle:   CCN11-ARIN\\nOrgTechHandle:  CCN11-ARIN\\nSource:         ARIN\\n\n\nPOCHandle:      CCN11-ARIN\\nIsRole:         Y\\nLastName:       Cedar Creek NOC\\nFirstName:      \\nStreet:         #14 - 1700 MacKay Cres.\\nCity:           Agassiz\\nState/Prov:     BC\\nCountry:        CA\\nPostalCode:     V0M 1A3\\nRegDate:        2021-08-09\\nUpdated:        2022-08-09\\nOfficePhone:    +1-604-799-7898\\nMailbox:        josh@cedarcreek.co\\nSource:         ARIN\\n"}
{"id": "TSRSOL-1", "name": "TSR Solutions, Inc.", "address": "", "street": "13131 Bradley Way\\nSuite 600", "city": "Germantown", "state": "WI", "postalcode": "53022", "country": "US", "admin_id": "TSRNO1-ARIN", "tech_id": "TSRNO1-ARIN", "abuse_id": "TSRNO1-ARIN", "mnt_id": "TSRNO1-ARIN", "email": "", "domain": "tsrnet.com", "created": "2000-10-03", "updated": "2020-03-11", "source": "arin", "raw": "OrgID:          TSRSOL-1\\nOrgName:        TSR Solutions, Inc.\\nCanAllocate:    \\nStreet:         13131 Bradley Way\\nStreet:         Suite 600\\nCity:           Germantown\\nState/Prov:     WI\\nCountry:        US\\nPostalCode:     53022\\nRegDate:        2000-10-03\\nUpdated:        2020-03-11\\nOrgAbuseHandle: TSRNO1-ARIN\\nOrgAdminHandle: TSRNO1-ARIN\\nOrgNOCHandle:   TSRNO1-ARIN\\nOrgTechHandle:  TSRNO1-ARIN\\nSource:         ARIN\\n\n\nPOCHandle:      TSRNO1-ARIN\\nIsRole:         Y\\nLastName:       TSR NOC\\nFirstName:      \\nStreet:         324 E Wisconsin Ave #825, Milwaukee, WI 53202\\nCity:           Milwaukee\\nState/Prov:     WI\\nCountry:        US\\nPostalCode:     53202\\nRegDate:        2020-03-11\\nUpdated:        2022-08-03\\nOfficePhone:    +1-262-292-2000\\nMailbox:        noc@tsrsolutions.com\\nSource:         ARIN\\n"}
{"id": "ONELO-8", "name": "Onelogin, Inc.", "address": "", "street": "848 Battery St", "city": "San Francisco", "state": "CA", "postalcode": "94111", "country": "US", "admin_id": "HOGUE879-ARIN", "tech_id": "TECHO45-ARIN", "abuse_id": "ABUSE8199-ARIN", "mnt_id": "TECHO45-ARIN", "email": "", "domain": "onelogin.com", "created": "2021-06-02", "updated": "2021-07-07", "source": "arin", "raw": "OrgID:          ONELO-8\\nOrgName:        Onelogin, Inc.\\nCanAllocate:    \\nStreet:         848 Battery St\\nCity:           San Francisco\\nState/Prov:     CA\\nCountry:        US\\nPostalCode:     94111\\nComment:        Abuse complaint please contact abuse@onelogin.com\\nRegDate:        2021-06-02\\nUpdated:        2021-07-07\\nOrgAbuseHandle: ABUSE8199-ARIN\\nOrgAdminHandle: HOGUE879-ARIN\\nOrgNOCHandle:   TECHO45-ARIN\\nOrgTechHandle:  TECHO45-ARIN\\nSource:         ARIN\\n\n\nPOCHandle:      ABUSE8199-ARIN\\nIsRole:         Y\\nLastName:       abuse\\nFirstName:      \\nStreet:         848 Battery St\\nCity:           San Francisco\\nState/Prov:     CA\\nCountry:        US\\nPostalCode:     94111\\nRegDate:        2021-07-07\\nUpdated:        2022-08-05\\nOfficePhone:    +1-877-979-0411\\nMailbox:        abuse@onelogin.com\\nSource:         ARIN\\n\n\nPOCHandle:      TECHO45-ARIN\\nIsRole:         Y\\nLastName:       Techops\\nFirstName:      \\nStreet:         848 Battery St\\nCity:           San Francisco\\nState/Prov:     CA\\nCountry:        US\\nPostalCode:     94111\\nRegDate:        2021-07-07\\nUpdated:        2022-08-05\\nOfficePhone:    +1-855-426-7227\\nMailbox:        techops@onelogin.com\\nSource:         ARIN\\n\n\nPOCHandle:      HOGUE879-ARIN\\nIsRole:         N\\nLastName:       Hogue\\nFirstName:      James\\nStreet:         848 Battery St\\nCity:           San Francisco\\nState/Prov:     CA\\nCountry:        US\\nPostalCode:     94111\\nRegDate:        2021-04-23\\nUpdated:        2022-08-05\\nOfficePhone:    +1-855-426-7227\\nMailbox:        techops@onelogin.com\\nSource:         ARIN\\n"}
{"id": "UCUIS-Z", "name": "ECS-Infrastructure", "address": "", "street": "1800 Grant St.", "city": "Denver", "state": "CO", "postalcode": "80203", "country": "US", "admin_id": "ECSIN-ARIN", "tech_id": "ECSIN-ARIN", "abuse_id": "ECSIN-ARIN", "mnt_id": "ECSIN-ARIN", "email": "", "domain": "cu.edu", "created": "2018-08-20", "updated": "2018-08-20", "source": "arin", "raw": "OrgID:          UCUIS-Z\\nOrgName:        ECS-Infrastructure\\nCanAllocate:    \\nStreet:         1800 Grant St.\\nCity:           Denver\\nState/Prov:     CO\\nCountry:        US\\nPostalCode:     80203\\nRegDate:        2018-08-20\\nUpdated:        2018-08-20\\nOrgAbuseHandle: ECSIN-ARIN\\nOrgAdminHandle: ECSIN-ARIN\\nOrgNOCHandle:   ECSIN-ARIN\\nOrgTechHandle:  ECSIN-ARIN\\nSource:         ARIN\\n\n\nPOCHandle:      ECSIN-ARIN\\nIsRole:         Y\\nLastName:       ECS-Infra \\nFirstName:      \\nStreet:         1800 Grant St.\\nCity:           Denver\\nState/Prov:     CO\\nCountry:        US\\nPostalCode:     80203\\nRegDate:        2018-07-12\\nUpdated:        2022-08-15\\nOfficePhone:    +1-303-860-4300\\nMailbox:        ecs-infrastructure@cu.edu\\nMailbox:        lonnie.maynard@cu.edu\\nMailbox:        kevin.masteller@cu.edu\\nMailbox:        adam.newby@cu.edu\\nSource:         ARIN\\n"}
{"id": "DDD-40", "name": "Dirigo Design & Development, Inc.", "address": "", "street": "57 Exchange Street\\nSuite 302", "city": "Portland", "state": "ME", "postalcode": "04101", "country": "US", "admin_id": "ADMIN6110-ARIN", "tech_id": "TECHA55-ARIN", "abuse_id": "ADMIN6110-ARIN", "mnt_id": "TECHA55-ARIN", "email": "", "domain": "dirigodev.com", "created": "2016-02-05", "updated": "2016-02-05", "source": "arin", "raw": "OrgID:          DDD-40\\nOrgName:        Dirigo Design & Development, Inc.\\nCanAllocate:    \\nStreet:         57 Exchange Street\\nStreet:         Suite 302\\nCity:           Portland\\nState/Prov:     ME\\nCountry:        US\\nPostalCode:     04101\\nRegDate:        2016-02-05\\nUpdated:        2016-02-05\\nOrgAbuseHandle: ADMIN6110-ARIN\\nOrgAdminHandle: ADMIN6110-ARIN\\nOrgNOCHandle:   TECHA55-ARIN\\nOrgTechHandle:  TECHA55-ARIN\\nSource:         ARIN\\n\n\nPOCHandle:      TECHA55-ARIN\\nIsRole:         N\\nLastName:       Tech\\nFirstName:      ARIN\\nStreet:         57 Exchange Street\\nStreet:         Suite 302\\nCity:           Portland\\nState/Prov:     ME\\nCountry:        US\\nPostalCode:     04101\\nRegDate:        2016-02-04\\nUpdated:        2016-02-04\\nOfficePhone:    +1-207-347-7360\\nMailbox:        arin-tech@dirigodev.com\\nSource:         ARIN\\n\n\nPOCHandle:      ADMIN6110-ARIN\\nIsRole:         N\\nLastName:       Admin\\nFirstName:      ARIN\\nStreet:         57 Exchange Street\\nStreet:         Suite 302\\nCity:           Portland\\nState/Prov:     ME\\nCountry:        US\\nPostalCode:     04101\\nRegDate:        2016-02-04\\nUpdated:        2016-02-04\\nOfficePhone:    +1-207-347-7360\\nMailbox:        arin-admin@dirigodev.com\\nSource:         ARIN\\n"}
{"id": "PETED-3", "name": "PetEdge, INC", "address": "", "street": "100 Cummings Center, Suite 307B", "city": "Beverly", "state": "MA", "postalcode": "01915", "country": "US", "admin_id": "ATA87-ARIN", "tech_id": "ATA87-ARIN", "abuse_id": "ATA87-ARIN", "mnt_id": "ATA87-ARIN", "email": "", "domain": "petedge.com", "created": "2015-05-08", "updated": "2015-05-08", "source": "arin", "raw": "OrgID:          PETED-3\\nOrgName:        PetEdge, INC\\nCanAllocate:    \\nStreet:         100 Cummings Center, Suite 307B\\nCity:           Beverly\\nState/Prov:     MA\\nCountry:        US\\nPostalCode:     01915\\nRegDate:        2015-05-08\\nUpdated:        2015-05-08\\nOrgAbuseHandle: ATA87-ARIN\\nOrgAdminHandle: ATA87-ARIN\\nOrgNOCHandle:   ATA87-ARIN\\nOrgTechHandle:  ATA87-ARIN\\nSource:         ARIN\\n\n\nPOCHandle:      ATA87-ARIN\\nIsRole:         N\\nLastName:       Anthony\\nFirstName:      Adam\\nStreet:         100 Cummings Center, Suite 307B\\nCity:           Beverly\\nState/Prov:     MA\\nCountry:        US\\nPostalCode:     01915\\nRegDate:        2015-04-28\\nUpdated:        2016-04-28\\nOfficePhone:    +1-978-998-8550\\nMailbox:        aanthony@petedge.com\\nSource:         ARIN\\n"}
{"id": "STRAT-10", "name": "Stratacom Communications, Inc.", "address": "", "street": "1480 Terrell Mill Road\\nSuite I", "city": "Marietta", "state": "GA", "postalcode": "30067", "country": "US", "admin_id": "BJR16-ARIN", "tech_id": "HOSTM275-ARIN", "abuse_id": "HOSTM275-ARIN", "mnt_id": "HOSTM275-ARIN", "email": "", "domain": "strata-com.com", "created": "2003-07-29", "updated": "2003-07-29", "source": "arin", "raw": "OrgID:          STRAT-10\\nOrgName:        Stratacom Communications, Inc.\\nCanAllocate:    \\nStreet:         1480 Terrell Mill Road\\nStreet:         Suite I\\nCity:           Marietta\\nState/Prov:     GA\\nCountry:        US\\nPostalCode:     30067\\nRegDate:        2003-07-29\\nUpdated:        2003-07-29\\nOrgAbuseHandle: HOSTM275-ARIN\\nOrgAdminHandle: BJR16-ARIN\\nOrgNOCHandle:   HOSTM275-ARIN\\nOrgTechHandle:  HOSTM275-ARIN\\nSource:         ARIN\\n\n\nPOCHandle:      HOSTM275-ARIN\\nIsRole:         Y\\nLastName:       Hostmaster\\nFirstName:      \\nStreet:         1480 Terrell Mill Road\\nStreet:         Suite I\\nCity:           Marietta\\nState/Prov:     GA\\nCountry:        US\\nPostalCode:     30067\\nRegDate:        2003-07-22\\nUpdated:        2013-10-28\\nOfficePhone:    +1-770-818-5302\\nMailbox:        hostmaster@strata-com.com\\nSource:         ARIN\\n\n\nPOCHandle:      BJR16-ARIN\\nIsRole:         N\\nLastName:       Rathman\\nFirstName:      Brian\\nStreet:         512 Adams Lake Blvd.\\nCity:           Atlanta\\nState/Prov:     GA\\nCountry:        US\\nPostalCode:     30339\\nRegDate:        2003-07-22\\nUpdated:        2019-11-12\\nMobilePhone:    +1-678-358-9933\\nMailbox:        brian@ilk.com\\nSource:         ARIN\\n"}
{"id": "EC-585", "name": "Excentus Corporation", "address": "", "street": "12421 Dallas Parkway\\nSuite 400", "city": "Dallas", "state": "TX", "postalcode": "75254", "country": "US", "admin_id": "INFOS17-ARIN", "tech_id": "INFOS17-ARIN\\NMELSO8-ARIN", "abuse_id": "INFOS17-ARIN\\NMELSO8-ARIN", "mnt_id": "INFOS17-ARIN\\NMELSO8-ARIN", "email": "", "domain": "excentus.com", "created": "2016-11-10", "updated": "2016-11-10", "source": "arin", "raw": "OrgID:          EC-585\\nOrgName:        Excentus Corporation\\nCanAllocate:    \\nStreet:         12421 Dallas Parkway\\nStreet:         Suite 400\\nCity:           Dallas\\nState/Prov:     TX\\nCountry:        US\\nPostalCode:     75254\\nComment:        http://www.excentus.com\\nRegDate:        2016-11-10\\nUpdated:        2016-11-10\\nOrgAbuseHandle: INFOS17-ARIN\\nOrgAbuseHandle: MELSO8-ARIN\\nOrgAdminHandle: INFOS17-ARIN\\nOrgNOCHandle:   INFOS17-ARIN\\nOrgNOCHandle:   MELSO8-ARIN\\nOrgTechHandle:  INFOS17-ARIN\\nOrgTechHandle:  MELSO8-ARIN\\nSource:         ARIN\\n\n\nPOCHandle:      INFOS17-ARIN\\nIsRole:         Y\\nLastName:       InfoSystems\\nFirstName:      \\nStreet:         14241 Dallas Pkwy\\nStreet:         Suite 400\\nCity:           Dallas\\nState/Prov:     TX\\nCountry:        US\\nPostalCode:     75254\\nRegDate:        2016-10-05\\nUpdated:        2018-10-05\\nOfficePhone:    +1-972-793-6747\\nMailbox:        infosystems@excentus.com\\nSource:         ARIN\\n\n\nPOCHandle:      MELSO8-ARIN\\nIsRole:         N\\nLastName:       Melson\\nFirstName:      Mike\\nStreet:         14241 Dallas Pkwy\\nStreet:         Suite 400\\nCity:           Dallas\\nState/Prov:     TX\\nCountry:        US\\nPostalCode:     75254\\nRegDate:        2016-10-05\\nUpdated:        2016-10-05\\nOfficePhone:    +1-972-793-6771\\nMailbox:        mmelson@excentus.com\\nSource:         ARIN\\n"}
{"id": "NJEDGE", "name": "NJEDge.Net, Inc.", "address": "", "street": "625 Broad Street, Suite 260", "city": "Newark", "state": "NJ", "postalcode": "07102", "country": "US", "admin_id": "NNOC10-ARIN", "tech_id": "NNOC10-ARIN", "abuse_id": "NAR24-ARIN", "mnt_id": "NNOC10-ARIN", "email": "", "domain": "njedge.net", "created": "2001-07-19", "updated": "2021-06-15", "source": "arin", "raw": "OrgID:          NJEDGE\\nOrgName:        NJEDge.Net, Inc.\\nCanAllocate:    \\nStreet:         625 Broad Street, Suite 260\\nCity:           Newark\\nState/Prov:     NJ\\nCountry:        US\\nPostalCode:     07102\\nRegDate:        2001-07-19\\nUpdated:        2021-06-15\\nOrgAbuseHandle: NAR24-ARIN\\nOrgAdminHandle: NNOC10-ARIN\\nOrgNOCHandle:   NNOC10-ARIN\\nOrgTechHandle:  NNOC10-ARIN\\nSource:         ARIN\\n\n\nPOCHandle:      NNOC10-ARIN\\nIsRole:         Y\\nLastName:       NJEDge Network Operations Center\\nFirstName:      \\nStreet:         625 Broad Street, Suite 260\\nCity:           Newark\\nState/Prov:     NJ\\nCountry:        US\\nPostalCode:     07102\\nRegDate:        2010-03-08\\nUpdated:        2022-06-11\\nOfficePhone:    +1-855-832-3343\\nMailbox:        noc@njedge.net\\nSource:         ARIN\\n\n\nPOCHandle:      NAR24-ARIN\\nIsRole:         Y\\nLastName:       NJEDge Abuse Reporting\\nFirstName:      \\nStreet:         218 Central Avenue, Suite 3902\\nCity:           Newark\\nState/Prov:     NJ\\nCountry:        US\\nPostalCode:     07102\\nRegDate:        2010-03-06\\nUpdated:        2021-09-30\\nOfficePhone:    +1-973-596-5490\\nMailbox:        net-abuse@njedge.net\\nSource:         ARIN\\n"}
{"id": "BN-5", "name": "BSO NETWORK INC", "address": "", "street": "One Commerce Center 1201 Orange ST. #600", "city": "WILMINGTON", "state": "DE", "postalcode": "19899", "country": "US", "admin_id": "BNSS-ARIN", "tech_id": "BNSS-ARIN", "abuse_id": "ABUSE2901-ARIN", "mnt_id": "BNSS-ARIN", "email": "", "domain": "bso.co", "created": "2011-06-02", "updated": "2019-10-16", "source": "arin", "raw": "OrgID:          BN-5\\nOrgName:        BSO NETWORK INC\\nCanAllocate:    \\nStreet:         One Commerce Center 1201 Orange ST. #600\\nCity:           WILMINGTON\\nState/Prov:     DE\\nCountry:        US\\nPostalCode:     19899\\nRegDate:        2011-06-02\\nUpdated:        2019-10-16\\nOrgAbuseHandle: ABUSE2901-ARIN\\nOrgAdminHandle: BNSS-ARIN\\nOrgNOCHandle:   BNSS-ARIN\\nOrgTechHandle:  BNSS-ARIN\\nSource:         ARIN\\n\n\nPOCHandle:      BNSS-ARIN\\nIsRole:         Y\\nLastName:       BSO NETWORK SOLUTIONS SUPPORT\\nFirstName:      \\nStreet:         4 avenue Pablo Picasso\\nCity:           Nanterre\\nState/Prov:     \\nCountry:        FR\\nPostalCode:     92000\\nRegDate:        2011-01-31\\nUpdated:        2022-05-26\\nOfficePhone:    +44 20 3608 9893 \\nOfficePhone:    +33 1 77 36 11 00\\nMailbox:        eusupport@bso.co\\nSource:         ARIN\\n\n\nPOCHandle:      ABUSE2901-ARIN\\nIsRole:         Y\\nLastName:       Abuse\\nFirstName:      \\nStreet:         81 Avenue Francois Arago\\nCity:           Nanterre\\nState/Prov:     \\nCountry:        FR\\nPostalCode:     92000\\nRegDate:        2011-01-31\\nUpdated:        2018-12-20\\nOfficePhone:    +33 1 45 06 34 26\\nMailbox:        abuse@bsocom.com\\nSource:         ARIN\\n"}
{"id": "CCS-1268", "name": "Cloud Compliance Solutions", "address": "", "street": "7777 Glades Road\\nSuite 100", "city": "Boca Raton", "state": "FL", "postalcode": "33434", "country": "US", "admin_id": "ALLEN1261-ARIN", "tech_id": "ALLEN1261-ARIN", "abuse_id": "ALLEN1261-ARIN", "mnt_id": "ALLEN1261-ARIN", "email": "", "domain": "ccsius.com", "created": "2019-01-03", "updated": "2019-01-03", "source": "arin", "raw": "OrgID:          CCS-1268\\nOrgName:        Cloud Compliance Solutions\\nCanAllocate:    \\nStreet:         7777 Glades Road\\nStreet:         Suite 100\\nCity:           Boca Raton\\nState/Prov:     FL\\nCountry:        US\\nPostalCode:     33434\\nRegDate:        2019-01-03\\nUpdated:        2019-01-03\\nOrgAbuseHandle: ALLEN1261-ARIN\\nOrgAdminHandle: ALLEN1261-ARIN\\nOrgNOCHandle:   ALLEN1261-ARIN\\nOrgTechHandle:  ALLEN1261-ARIN\\nSource:         ARIN\\n\n\nPOCHandle:      ALLEN1261-ARIN\\nIsRole:         N\\nLastName:       Allen\\nFirstName:      Kelley\\nStreet:         7551 Wiles Road\\nStreet:         Suite 106\\nCity:           Coral Springs\\nState/Prov:     FL\\nCountry:        US\\nPostalCode:     33067\\nRegDate:        2019-01-02\\nUpdated:        2022-02-09\\nOfficePhone:    +1-561-990-3820\\nMailbox:        kallen@ccsius.com\\nSource:         ARIN\\n"}
{"id": "PORTOF-2", "name": "Port of Seattle", "address": "", "street": "P.O. Box 68727", "city": "Seattle", "state": "WA", "postalcode": "98168", "country": "US", "admin_id": "BILLI8-ARIN", "tech_id": "DRK8-ARIN\\NMOB6-ARIN", "abuse_id": "ABUSE529-ARIN", "mnt_id": "NOC33396-ARIN", "email": "", "domain": "portseattle.org", "created": "1993-04-01", "updated": "2022-01-13", "source": "arin", "raw": "OrgID:          PORTOF-2\\nOrgName:        Port of Seattle\\nCanAllocate:    \\nStreet:         P.O. Box 68727\\nCity:           Seattle\\nState/Prov:     WA\\nCountry:        US\\nPostalCode:     98168\\nRegDate:        1993-04-01\\nUpdated:        2022-01-13\\nOrgAbuseHandle: ABUSE529-ARIN\\nOrgAdminHandle: BILLI8-ARIN\\nOrgNOCHandle:   NOC33396-ARIN\\nOrgTechHandle:  DRK8-ARIN\\nOrgTechHandle:  MOB6-ARIN\\nSource:         ARIN\\n\n\nPOCHandle:      NOC33396-ARIN\\nIsRole:         Y\\nLastName:       NOC\\nFirstName:      \\nStreet:         PO Box 1209\\nCity:           Seattle\\nState/Prov:     WA\\nCountry:        US\\nPostalCode:     98111\\nRegDate:        2022-01-13\\nUpdated:        2022-01-13\\nOfficePhone:    +1-206-787-3537\\nMailbox:        noc@portseattle.org\\nSource:         ARIN\\n\n\nPOCHandle:      ABUSE529-ARIN\\nIsRole:         Y\\nLastName:       Abuse\\nFirstName:      \\nStreet:         PO Box 1209\\nCity:           Seattle\\nState/Prov:     WA\\nCountry:        US\\nPostalCode:     98111\\nRegDate:        2004-01-15\\nUpdated:        2004-01-15\\nOfficePhone:    +1-206-735-3537\\nMailbox:        abuse@portseattle.org\\nSource:         ARIN\\n\n\nPOCHandle:      DRK8-ARIN\\nIsRole:         N\\nLastName:       Knowles\\nFirstName:      Devron\\nStreet:         PO Box 1209\\nCity:           Seattle\\nState/Prov:     WA\\nCountry:        US\\nPostalCode:     98111\\nRegDate:        2004-01-12\\nUpdated:        2022-03-16\\nOfficePhone:    +1-206-787-4917\\nMailbox:        knowles.d.arin@portseattle.org\\nSource:         ARIN\\n\n\nPOCHandle:      MOB6-ARIN\\nIsRole:         N\\nLastName:       Breed\\nFirstName:      Matthew\\nStreet:         PO Box 1209\\nCity:           Seattle\\nState/Prov:     WA\\nCountry:        US\\nPostalCode:     98111\\nRegDate:        2004-01-12\\nUpdated:        2022-01-13\\nOfficePhone:    +1-206-787-7555\\nMailbox:        breed.m.arin@portseattle.org\\nSource:         ARIN\\n\n\nPOCHandle:      BILLI8-ARIN\\nIsRole:         Y\\nLastName:       Billing\\nFirstName:      \\nStreet:         PO Box 1209\\nCity:           Seattle\\nState/Prov:     WA\\nCountry:        US\\nPostalCode:     98111\\nRegDate:        2004-01-16\\nUpdated:        2015-12-21\\nOfficePhone:    +1-206-728-3000\\nMailbox:        billing@portseattle.org\\nSource:         ARIN\\n"}
{"id": "NL-514", "name": "Nuvodia, LLC", "address": "", "street": "2818 N Sullivan Rd Ste 120", "city": "Spokane Valley", "state": "WA", "postalcode": "99216", "country": "US", "admin_id": "ENGIN199-ARIN", "tech_id": "ENGIN199-ARIN", "abuse_id": "ENGIN199-ARIN", "mnt_id": "ENGIN199-ARIN", "email": "", "domain": "nuvodia.com", "created": "2017-11-09", "updated": "2020-12-17", "source": "arin", "raw": "OrgID:          NL-514\\nOrgName:        Nuvodia, LLC\\nCanAllocate:    \\nStreet:         2818 N Sullivan Rd Ste 120\\nCity:           Spokane Valley\\nState/Prov:     WA\\nCountry:        US\\nPostalCode:     99216\\nRegDate:        2017-11-09\\nUpdated:        2020-12-17\\nOrgAbuseHandle: ENGIN199-ARIN\\nOrgAdminHandle: ENGIN199-ARIN\\nOrgNOCHandle:   ENGIN199-ARIN\\nOrgTechHandle:  ENGIN199-ARIN\\nSource:         ARIN\\n\n\nPOCHandle:      ENGIN199-ARIN\\nIsRole:         Y\\nLastName:       Engineering\\nFirstName:      \\nStreet:         2818 N Sullivan Rd Ste 120\\nCity:           Spokane Valley\\nState/Prov:     WA\\nCountry:        US\\nPostalCode:     99216\\nRegDate:        2017-11-06\\nUpdated:        2021-12-17\\nOfficePhone:    +1-509-838-8764\\nMailbox:        engineering-support@nuvodia.com\\nSource:         ARIN\\n"}
{"id": "VCS-48", "name": "Valero Corporate Services", "address": "", "street": "One Valero Way", "city": "San Antonio", "state": "TX", "postalcode": "78249", "country": "US", "admin_id": "FENNE2-ARIN", "tech_id": "FENNE2-ARIN", "abuse_id": "ARINC36-ARIN", "mnt_id": "ARINC36-ARIN", "email": "", "domain": "valero.com", "created": "2001-04-20", "updated": "2012-11-08", "source": "arin", "raw": "OrgID:          VCS-48\\nOrgName:        Valero Corporate Services\\nCanAllocate:    \\nStreet:         One Valero Way\\nCity:           San Antonio\\nState/Prov:     TX\\nCountry:        US\\nPostalCode:     78249\\nRegDate:        2001-04-20\\nUpdated:        2012-11-08\\nOrgAbuseHandle: ARINC36-ARIN\\nOrgAdminHandle: FENNE2-ARIN\\nOrgNOCHandle:   ARINC36-ARIN\\nOrgTechHandle:  FENNE2-ARIN\\nSource:         ARIN\\n\n\nPOCHandle:      ARINC36-ARIN\\nIsRole:         Y\\nLastName:       arin-contact\\nFirstName:      \\nStreet:         One Valero Way\\nCity:           San Antonio\\nState/Prov:     TX\\nCountry:        US\\nPostalCode:     78249\\nRegDate:        2012-11-08\\nUpdated:        2021-12-01\\nOfficePhone:    +1-210-345-2000\\nMailbox:        arin-contact@valero.com\\nSource:         ARIN\\n\n\nPOCHandle:      FENNE2-ARIN\\nIsRole:         N\\nLastName:       Fenner\\nFirstName:      Jeremy\\nStreet:         One Valero Way\\nCity:           San Antonio\\nState/Prov:     TX\\nCountry:        US\\nPostalCode:     78249\\nRegDate:        2011-07-15\\nUpdated:        2021-12-01\\nOfficePhone:    +1-210-345-4750\\nMailbox:        jeremy.fenner@valero.com\\nSource:         ARIN\\n"}
{"id": "NSL-35", "name": "Network Specialists, LTD", "address": "", "street": "200 Market Ave. N.\\nSuite 75", "city": "Canton", "state": "OH", "postalcode": "44702", "country": "US", "admin_id": "JWK21-ARIN", "tech_id": "JWK21-ARIN", "abuse_id": "JWK21-ARIN", "mnt_id": "JWK21-ARIN", "email": "", "domain": "net-spec.com", "created": "2005-07-21", "updated": "2011-03-21", "source": "arin", "raw": "OrgID:          NSL-35\\nOrgName:        Network Specialists, LTD\\nCanAllocate:    \\nStreet:         200 Market Ave. N.\\nStreet:         Suite 75\\nCity:           Canton\\nState/Prov:     OH\\nCountry:        US\\nPostalCode:     44702\\nRegDate:        2005-07-21\\nUpdated:        2011-03-21\\nOrgAbuseHandle: JWK21-ARIN\\nOrgAdminHandle: JWK21-ARIN\\nOrgNOCHandle:   JWK21-ARIN\\nOrgTechHandle:  JWK21-ARIN\\nSource:         ARIN\\n\n\nPOCHandle:      JWK21-ARIN\\nIsRole:         N\\nLastName:       Kalafice\\nFirstName:      John\\nStreet:         200 Market Ave. N.\\nStreet:         Suite 75\\nCity:           Canton\\nState/Prov:     OH\\nCountry:        US\\nPostalCode:     44702\\nRegDate:        2011-03-20\\nUpdated:        2011-03-20\\nFaxPhone:       +1-330-455-4019\\nOfficePhone:    +1-330-454-1111\\nMailbox:        john@net-spec.com\\nSource:         ARIN\\n"}
{"id": "BTC-107", "name": "BH Telecom Corp.", "address": "", "street": "CIBC Square\\n81 Bay Street, Suite 4510", "city": "Toronto", "state": "ON", "postalcode": "M5J 0E7", "country": "CA", "admin_id": "ADMIN6968-ARIN", "tech_id": "TECH1134-ARIN", "abuse_id": "ABUSE7356-ARIN", "mnt_id": "NOC32917-ARIN", "email": "", "domain": "bhtelecom.ca", "created": "2017-04-13", "updated": "2021-05-19", "source": "arin", "raw": "OrgID:          BTC-107\\nOrgName:        BH Telecom Corp.\\nCanAllocate:    \\nStreet:         CIBC Square\\nStreet:         81 Bay Street, Suite 4510\\nCity:           Toronto\\nState/Prov:     ON\\nCountry:        CA\\nPostalCode:     M5J 0E7\\nRegDate:        2017-04-13\\nUpdated:        2021-05-19\\nOrgAbuseHandle: ABUSE7356-ARIN\\nOrgAdminHandle: ADMIN6968-ARIN\\nOrgNOCHandle:   NOC32917-ARIN\\nOrgTechHandle:  TECH1134-ARIN\\nSource:         ARIN\\n\n\nPOCHandle:      NOC32917-ARIN\\nIsRole:         Y\\nLastName:       NOC\\nFirstName:      \\nStreet:         81 Bay Street, Suite 4510\\nCity:           Toronto\\nState/Prov:     ON\\nCountry:        CA\\nPostalCode:     M5J 0E7\\nRegDate:        2019-01-03\\nUpdated:        2022-05-19\\nOfficePhone:    +1-800-724-8353\\nMailbox:        support@flexnetworks.ca\\nSource:         ARIN\\n\n\nPOCHandle:      TECH1134-ARIN\\nIsRole:         Y\\nLastName:       Tech\\nFirstName:      \\nStreet:         81 Bay Street, Suite 4510\\nCity:           Toronto\\nState/Prov:     ON\\nCountry:        CA\\nPostalCode:     M5J 0E7\\nRegDate:        2019-01-03\\nUpdated:        2022-05-19\\nOfficePhone:    +1-800-724-8353\\nMailbox:        ipadmin@bhtelecom.ca\\nSource:         ARIN\\n\n\nPOCHandle:      ABUSE7356-ARIN\\nIsRole:         Y\\nLastName:       Abuse\\nFirstName:      \\nStreet:         81 Bay Street, Suite 4510\\nCity:           Toronto\\nState/Prov:     ON\\nCountry:        CA\\nPostalCode:     M5J 0E7\\nRegDate:        2019-01-03\\nUpdated:        2022-05-19\\nOfficePhone:    +1-800-724-8353\\nMailbox:        ipadmin@bhtelecom.ca\\nSource:         ARIN\\n\n\nPOCHandle:      ADMIN6968-ARIN\\nIsRole:         Y\\nLastName:       Admin\\nFirstName:      \\nStreet:         81 Bay Street, Suite 4510\\nCity:           Toronto\\nState/Prov:     ON\\nCountry:        CA\\nPostalCode:     M5J 0E7\\nRegDate:        2019-01-03\\nUpdated:        2022-05-19\\nOfficePhone:    +1-800-724-8353\\nMailbox:        ipadmin@bhtelecom.ca\\nSource:         ARIN\\n"}
{"id": "SIH-16", "name": "SECURA INSURANCE HOLDINGS, INC.", "address": "", "street": "1500 Mutual Way", "city": "Neenah", "state": "WI", "postalcode": "54956", "country": "US", "admin_id": "BAVIN-ARIN", "tech_id": "INFOR189-ARIN", "abuse_id": "INFOR189-ARIN", "mnt_id": "INFOR189-ARIN", "email": "", "domain": "secura.net", "created": "2017-04-20", "updated": "2020-03-30", "source": "arin", "raw": "OrgID:          SIH-16\\nOrgName:        SECURA INSURANCE HOLDINGS, INC.\\nCanAllocate:    \\nStreet:         1500 Mutual Way\\nCity:           Neenah\\nState/Prov:     WI\\nCountry:        US\\nPostalCode:     54956\\nRegDate:        2017-04-20\\nUpdated:        2020-03-30\\nOrgAbuseHandle: INFOR189-ARIN\\nOrgAdminHandle: BAVIN-ARIN\\nOrgNOCHandle:   INFOR189-ARIN\\nOrgTechHandle:  INFOR189-ARIN\\nSource:         ARIN\\n\n\nPOCHandle:      BAVIN-ARIN\\nIsRole:         N\\nLastName:       Bavinck\\nFirstName:      Chad\\nStreet:         1500 Mutual Way\\nCity:           Neenah\\nState/Prov:     WI\\nCountry:        US\\nPostalCode:     54956\\nRegDate:        2017-03-20\\nUpdated:        2021-03-31\\nOfficePhone:    +1-920-224-7226\\nMailbox:        chad_bavinck@secura.net\\nSource:         ARIN\\n\n\nPOCHandle:      INFOR189-ARIN\\nIsRole:         Y\\nLastName:       Information Technology\\nFirstName:      \\nStreet:         1500 Mutual Way\\nCity:           Neenah\\nState/Prov:     WI\\nCountry:        US\\nPostalCode:     54956\\nRegDate:        2019-03-29\\nUpdated:        2021-03-31\\nOfficePhone:    +1-920-830-4700\\nMailbox:        itpcservices@secura.net\\nSource:         ARIN\\n"}
{"id": "UK-8", "name": "University of Kentucky Research Computing", "address": "", "street": "117 Hardymon Building", "city": "Lexington", "state": "KY", "postalcode": "40506", "country": "US", "admin_id": "BUMGA7-ARIN", "tech_id": "BUMGA7-ARIN\\NMBM60-ARIN", "abuse_id": "BUMGA7-ARIN\\NMBM60-ARIN", "mnt_id": "BUMGA7-ARIN\\NMBM60-ARIN", "email": "", "domain": "uky.edu", "created": "2017-03-20", "updated": "2017-04-18", "source": "arin", "raw": "OrgID:          UK-8\\nOrgName:        University of Kentucky Research Computing\\nCanAllocate:    \\nStreet:         117 Hardymon Building\\nCity:           Lexington\\nState/Prov:     KY\\nCountry:        US\\nPostalCode:     40506\\nComment:        University of Kentucky Research Computing\\nRegDate:        2017-03-20\\nUpdated:        2017-04-18\\nOrgAbuseHandle: BUMGA7-ARIN\\nOrgAbuseHandle: MBM60-ARIN\\nOrgAdminHandle: BUMGA7-ARIN\\nOrgNOCHandle:   BUMGA7-ARIN\\nOrgNOCHandle:   MBM60-ARIN\\nOrgTechHandle:  BUMGA7-ARIN\\nOrgTechHandle:  MBM60-ARIN\\nSource:         ARIN\\n\n\nPOCHandle:      MBM60-ARIN\\nIsRole:         N\\nLastName:       Moseley\\nFirstName:      Matthew\\nStreet:         301 Rose Street, Hardymon Building\\nCity:           Lexington\\nState/Prov:     KY\\nCountry:        US\\nPostalCode:     40506\\nRegDate:        2017-04-18\\nUpdated:        2022-04-18\\nOfficePhone:    +1-859-218-5217\\nMailbox:        matthew.blaze@uky.edu\\nSource:         ARIN\\n\n\nPOCHandle:      BUMGA7-ARIN\\nIsRole:         N\\nLastName:       Bumgardner\\nFirstName:      Cody\\nStreet:         117 James F. Hardymon\\nCity:           Lexington\\nState/Prov:     KY\\nCountry:        US\\nPostalCode:     40506-0495\\nRegDate:        2016-12-23\\nUpdated:        2018-12-23\\nOfficePhone:    +1-859-257-4049\\nFaxPhone:       +1-859-257-4049\\nMobilePhone:    +1-859-257-4049\\nMailbox:        cody@uky.edu\\nSource:         ARIN\\n"}
{"id": "SUREL-1", "name": "Sureline Telecom", "address": "", "street": "596 SW 4th Street", "city": "MADRAS", "state": "OR", "postalcode": "97741", "country": "US", "admin_id": "JLR58-ARIN", "tech_id": "JLR58-ARIN", "abuse_id": "JLR58-ARIN", "mnt_id": "JLR58-ARIN", "email": "", "domain": "surelinebroadband.com", "created": "2014-05-05", "updated": "2017-01-28", "source": "arin", "raw": "OrgID:          SUREL-1\\nOrgName:        Sureline Telecom\\nCanAllocate:    \\nStreet:         596 SW 4th Street\\nCity:           MADRAS\\nState/Prov:     OR\\nCountry:        US\\nPostalCode:     97741\\nRegDate:        2014-05-05\\nUpdated:        2017-01-28\\nOrgAbuseHandle: JLR58-ARIN\\nOrgAdminHandle: JLR58-ARIN\\nOrgNOCHandle:   JLR58-ARIN\\nOrgTechHandle:  JLR58-ARIN\\nSource:         ARIN\\n\n\nPOCHandle:      JLR58-ARIN\\nIsRole:         N\\nLastName:       Richesin\\nFirstName:      Josh\\nStreet:         596 SW 4th Street\\nCity:           MADRAS\\nState/Prov:     OR\\nCountry:        US\\nPostalCode:     97741\\nRegDate:        2014-05-01\\nUpdated:        2020-11-02\\nOfficePhone:    +1-541-460-2758\\nOfficePhone:    +1-541-699-0030\\nMobilePhone:    +1-541-460-2758\\nFaxPhone:       +1-541-460-2758\\nMailbox:        josh@surelinebroadband.com\\nSource:         ARIN\\n"}
{"id": "TA-64", "name": "TRIPOS ASSOCIATES INC", "address": "", "street": "210 N TUCKER BLVD", "city": "ST LOUIS", "state": "MO", "postalcode": "63101", "country": "US", "admin_id": "LISTE25-ARIN", "tech_id": "FULLE435-ARIN\\NJWE209-ARIN\\NLISTE25-ARIN", "abuse_id": "JWE209-ARIN", "mnt_id": "JWE209-ARIN", "email": "", "domain": "certara.com", "created": "2012-12-06", "updated": "2021-10-22", "source": "arin", "raw": "OrgID:          TA-64\\nOrgName:        TRIPOS ASSOCIATES INC\\nCanAllocate:    \\nStreet:         210 N TUCKER BLVD\\nCity:           ST LOUIS\\nState/Prov:     MO\\nCountry:        US\\nPostalCode:     63101\\nRegDate:        2012-12-06\\nUpdated:        2021-10-22\\nOrgAbuseHandle: JWE209-ARIN\\nOrgAdminHandle: LISTE25-ARIN\\nOrgNOCHandle:   JWE209-ARIN\\nOrgTechHandle:  FULLE435-ARIN\\nOrgTechHandle:  JWE209-ARIN\\nOrgTechHandle:  LISTE25-ARIN\\nSource:         ARIN\\n\n\nPOCHandle:      JWE209-ARIN\\nIsRole:         N\\nLastName:       Webster\\nFirstName:      John\\nStreet:         222 S. Central Ave\\nStreet:         Suite 1008\\nCity:           St. Louis\\nState/Prov:     MO\\nCountry:        US\\nPostalCode:     63105\\nRegDate:        2009-08-13\\nUpdated:        2021-11-30\\nOfficePhone:    +1-314-951-3235\\nMailbox:        john.webster@certara.com\\nSource:         ARIN\\n\n\nPOCHandle:      FULLE435-ARIN\\nIsRole:         N\\nLastName:       FULLER\\nFirstName:      CHRIS\\nStreet:         210 N TUCKER BLVD\\nCity:           SAINT LOUIS\\nState/Prov:     MO\\nCountry:        US\\nPostalCode:     63101\\nRegDate:        2018-07-12\\nUpdated:        2021-07-13\\nOfficePhone:    +1-314-951-3120\\nMailbox:        chris.fuller@certara.com\\nSource:         ARIN\\n\n\nPOCHandle:      LISTE25-ARIN\\nIsRole:         N\\nLastName:       Lister\\nFirstName:      Bill\\nStreet:         222 S Central Ave\\nStreet:         Suite 1008\\nCity:           Clayton\\nState/Prov:     MO\\nCountry:        US\\nPostalCode:     63105\\nRegDate:        2018-11-28\\nUpdated:        2022-04-13\\nOfficePhone:    +1-314-951-3118\\nMailbox:        Bill.Lister@certara.com\\nSource:         ARIN\\n"}
{"id": "MUC-33", "name": "Manchitas USA Corp", "address": "", "street": "2200 NE 123 ST", "city": "North Miami", "state": "FL", "postalcode": "33181", "country": "US", "admin_id": "NETWO9231-ARIN", "tech_id": "NETWO9231-ARIN", "abuse_id": "NETWO9231-ARIN", "mnt_id": "NETWO9231-ARIN", "email": "", "domain": "machost.co", "created": "2022-01-26", "updated": "2022-01-28", "source": "arin", "raw": "OrgID:          MUC-33\\nOrgName:        Manchitas USA Corp\\nCanAllocate:    \\nStreet:         2200 NE 123 ST\\nCity:           North Miami\\nState/Prov:     FL\\nCountry:        US\\nPostalCode:     33181\\nComment:        Abuse reports should be sent to abuse@machost.co\\nRegDate:        2022-01-26\\nUpdated:        2022-01-28\\nOrgAbuseHandle: NETWO9231-ARIN\\nOrgAdminHandle: NETWO9231-ARIN\\nOrgDNSHandle:   NETWO9231-ARIN\\nOrgNOCHandle:   NETWO9231-ARIN\\nOrgRoutingHandle:   NETWO9231-ARIN\\nOrgTechHandle:  NETWO9231-ARIN\\nSource:         ARIN\\n\n\nPOCHandle:      NETWO9231-ARIN\\nIsRole:         Y\\nLastName:       Network\\nFirstName:      \\nStreet:         25 Broadway\\nCity:           New York\\nState/Prov:     NY\\nCountry:        US\\nPostalCode:     10005\\nRegDate:        2020-05-22\\nUpdated:        2022-05-12\\nOfficePhone:    +1-312-818-3949\\nMailbox:        info@machost.co\\nSource:         ARIN\\n"}
{"id": "JRE-14", "name": "J AND R ELECTRONICS, INC.", "address": "", "street": "14817 W Hwy 53", "city": "Rathdrum", "state": "ID", "postalcode": "83858", "country": "US", "admin_id": "LEMMJ9-ARIN", "tech_id": "MCNAB35-ARIN", "abuse_id": "MCNAB35-ARIN", "mnt_id": "MCNAB35-ARIN", "email": "", "domain": "jrcda.com", "created": "2019-05-22", "updated": "2021-04-14", "source": "arin", "raw": "OrgID:          JRE-14\\nOrgName:        J AND R ELECTRONICS, INC.\\nCanAllocate:    \\nStreet:         14817 W Hwy 53\\nCity:           Rathdrum\\nState/Prov:     ID\\nCountry:        US\\nPostalCode:     83858\\nComment:        http://www.jrcda.com\\nComment:        Office Hours 9:00 AM to 5:00 PM PST w. 24/7 Answering Service\\nComment:        North Idaho WISP\\nRegDate:        2019-05-22\\nUpdated:        2021-04-14\\nOrgAbuseHandle: MCNAB35-ARIN\\nOrgAdminHandle: LEMMJ9-ARIN\\nOrgNOCHandle:   MCNAB35-ARIN\\nOrgTechHandle:  MCNAB35-ARIN\\nSource:         ARIN\\n\n\nPOCHandle:      MCNAB35-ARIN\\nIsRole:         N\\nLastName:       McNabb\\nFirstName:      Kelly\\nStreet:         14817 W Hwy 53\\nCity:           Rathdrum\\nState/Prov:     ID\\nCountry:        US\\nPostalCode:     83858\\nRegDate:        2019-05-15\\nUpdated:        2021-08-19\\nMobilePhone:    +1-208-964-3651\\nOfficePhone:    +1-208-687-0700\\nMailbox:        kelly@jrcda.com\\nSource:         ARIN\\n\n\nPOCHandle:      LEMMJ9-ARIN\\nIsRole:         N\\nLastName:       Lemm\\nFirstName:      Jim\\nStreet:         14817 W Hwy 53\\nCity:           Rathdrum\\nState/Prov:     ID\\nCountry:        US\\nPostalCode:     83858\\nRegDate:        2019-05-17\\nUpdated:        2019-05-17\\nOfficePhone:    +1-208-687-0700\\nMailbox:        jim@jrcda.com\\nSource:         ARIN\\n"}
{"id": "NETRI-13", "name": "Netriplex Corporation", "address": "", "street": "PO Box 113805", "city": "North Providence", "state": "RI", "postalcode": "02911", "country": "US", "admin_id": "DCA77-ARIN", "tech_id": "NETWO2766-ARIN", "abuse_id": "ABUSE2086-ARIN", "mnt_id": "NETWO2766-ARIN", "email": "", "domain": "netriplexboston.com", "created": "2008-10-27", "updated": "2013-07-25", "source": "arin", "raw": "OrgID:          NETRI-13\\nOrgName:        Netriplex Corporation\\nCanAllocate:    \\nStreet:         PO Box 113805\\nCity:           North Providence\\nState/Prov:     RI\\nCountry:        US\\nPostalCode:     02911\\nComment:        Abuse complaints to abuse@bos.netriplex.com\\nRegDate:        2008-10-27\\nUpdated:        2013-07-25\\nReferralServer: rwhois://rwhois.lightspeednetworks.com:4321\\nOrgAbuseHandle: ABUSE2086-ARIN\\nOrgAdminHandle: DCA77-ARIN\\nOrgNOCHandle:   NETWO2766-ARIN\\nOrgTechHandle:  NETWO2766-ARIN\\nSource:         ARIN\\n\n\nPOCHandle:      ABUSE2086-ARIN\\nIsRole:         Y\\nLastName:       Abuse\\nFirstName:      \\nStreet:         622 George Washington Hwy\\nStreet:         Suite 603-395\\nCity:           Lincoln\\nState/Prov:     RI\\nCountry:        US\\nPostalCode:     02865\\nRegDate:        2008-10-25\\nUpdated:        2021-05-25\\nOfficePhone:    +1-401-724-5580\\nMailbox:        abuse@netriplexboston.com\\nSource:         ARIN\\n\n\nPOCHandle:      NETWO2766-ARIN\\nIsRole:         Y\\nLastName:       Network Operations\\nFirstName:      \\nStreet:         622 George Washington Hwy\\nStreet:         Suite 603-395\\nCity:           Lincoln\\nState/Prov:     RI\\nCountry:        US\\nPostalCode:     02865\\nRegDate:        2008-10-25\\nUpdated:        2021-05-25\\nOfficePhone:    +1-401-724-5580\\nMailbox:        itmanager@netriplexboston.com\\nSource:         ARIN\\n\n\nPOCHandle:      DCA77-ARIN\\nIsRole:         N\\nLastName:       Capone\\nFirstName:      David\\nStreet:         622 George Washington Hwy\\nStreet:         Suite 603-395\\nCity:           Lincoln\\nState/Prov:     RI\\nCountry:        US\\nPostalCode:     02865\\nRegDate:        2005-02-25\\nUpdated:        2021-05-25\\nOfficePhone:    +1-401-724-5580\\nMailbox:        abuse@netriplexboston.com\\nSource:         ARIN\\n"}
{"id": "TCL158", "name": "Totelcom Communications LLC", "address": "", "street": "6100 Hwy 16 South", "city": "DeLeon", "state": "TX", "postalcode": "76444", "country": "US", "admin_id": "NOC11352-ARIN", "tech_id": "NOC11352-ARIN", "abuse_id": "NOC11352-ARIN", "mnt_id": "NOC11352-ARIN", "email": "", "domain": "totelcom.net", "created": "2010-07-29", "updated": "2011-10-25", "source": "arin", "raw": "OrgID:          TCL158\\nOrgName:        Totelcom Communications LLC\\nCanAllocate:    \\nStreet:         6100 Hwy 16 South\\nCity:           DeLeon\\nState/Prov:     TX\\nCountry:        US\\nPostalCode:     76444\\nComment:        http://www.totelcom.net\\nRegDate:        2010-07-29\\nUpdated:        2011-10-25\\nOrgAbuseHandle: NOC11352-ARIN\\nOrgAdminHandle: NOC11352-ARIN\\nOrgNOCHandle:   NOC11352-ARIN\\nOrgTechHandle:  NOC11352-ARIN\\nSource:         ARIN\\n\n\nPOCHandle:      NOC11352-ARIN\\nIsRole:         Y\\nLastName:       NOC\\nFirstName:      \\nStreet:         6100 Hwy 16 South\\nCity:           Deleon\\nState/Prov:     TX\\nCountry:        US\\nPostalCode:     76444\\nRegDate:        2010-02-25\\nUpdated:        2016-03-18\\nOfficePhone:    +1-254-893-3634\\nMailbox:        sysadmin@totelcom.net\\nSource:         ARIN\\n"}
{"id": "LAT-4", "name": "Little Apple Technologies", "address": "", "street": "112 South Broadway\\nSuite B", "city": "Manhattan", "state": "MT", "postalcode": "59741", "country": "US", "admin_id": "COO3-ARIN", "tech_id": "COO3-ARIN", "abuse_id": "ABUSE5188-ARIN", "mnt_id": "COO3-ARIN", "email": "", "domain": "littleappletech.com", "created": "2004-08-18", "updated": "2021-08-31", "source": "arin", "raw": "OrgID:          LAT-4\\nOrgName:        Little Apple Technologies\\nCanAllocate:    \\nStreet:         112 South Broadway\\nStreet:         Suite B\\nCity:           Manhattan\\nState/Prov:     MT\\nCountry:        US\\nPostalCode:     59741\\nRegDate:        2004-08-18\\nUpdated:        2021-08-31\\nOrgAbuseHandle: ABUSE5188-ARIN\\nOrgAdminHandle: COO3-ARIN\\nOrgDNSHandle:   COO3-ARIN\\nOrgNOCHandle:   COO3-ARIN\\nOrgRoutingHandle:   COO3-ARIN\\nOrgTechHandle:  COO3-ARIN\\nSource:         ARIN\\n\n\nPOCHandle:      ABUSE5188-ARIN\\nIsRole:         Y\\nLastName:       Abuse\\nFirstName:      \\nStreet:         112 South Broadway\\nCity:           Manhattan\\nState/Prov:     MT\\nCountry:        US\\nPostalCode:     59741\\nRegDate:        2015-07-30\\nUpdated:        2020-11-13\\nOfficePhone:    +1-406-284-3174\\nMailbox:        abuse@littleappletech.com\\nSource:         ARIN\\n\n\nPOCHandle:      COO3-ARIN\\nIsRole:         Y\\nLastName:       CHEIF OPERATIONAL OFFICER\\nFirstName:      \\nStreet:         112 South Broadway\\nStreet:         Suite B\\nCity:           Manhattan\\nState/Prov:     MT\\nCountry:        US\\nPostalCode:     59741\\nRegDate:        2005-08-18\\nUpdated:        2020-11-13\\nOfficePhone:    +1-406-284-3174\\nMailbox:        myke.sonar@littleappletech.com\\nSource:         ARIN\\n"}
{"id": "SPECT-83", "name": "Spectra Laboratories", "address": "", "street": "525 Sycamore Drive", "city": "Milpitas", "state": "CA", "postalcode": "95035", "country": "US", "admin_id": "INGRA275-ARIN", "tech_id": "INGRA275-ARIN\\NRRI115-ARIN", "abuse_id": "INGRA275-ARIN", "mnt_id": "INGRA275-ARIN", "email": "", "domain": "spectra-labs.com", "created": "2008-12-22", "updated": "2020-11-05", "source": "arin", "raw": "OrgID:          SPECT-83\\nOrgName:        Spectra Laboratories\\nCanAllocate:    \\nStreet:         525 Sycamore Drive\\nCity:           Milpitas\\nState/Prov:     CA\\nCountry:        US\\nPostalCode:     95035\\nRegDate:        2008-12-22\\nUpdated:        2020-11-05\\nOrgAbuseHandle: INGRA275-ARIN\\nOrgAdminHandle: INGRA275-ARIN\\nOrgNOCHandle:   INGRA275-ARIN\\nOrgTechHandle:  INGRA275-ARIN\\nOrgTechHandle:  RRI115-ARIN\\nSource:         ARIN\\n\n\nPOCHandle:      INGRA275-ARIN\\nIsRole:         N\\nLastName:       INGRASSIA\\nFirstName:      MICHAEL\\nStreet:         8 KING ROAD\\nCity:           ROCKLEIGH\\nState/Prov:     NJ\\nCountry:        US\\nPostalCode:     07647\\nRegDate:        2019-07-11\\nUpdated:        2021-07-13\\nOfficePhone:    +1-201-767-7070\\nMailbox:        michael.ingrassia@fmc-na.com\\nSource:         ARIN\\n\n\nPOCHandle:      RRI115-ARIN\\nIsRole:         N\\nLastName:       Ritzer\\nFirstName:      Randy\\nStreet:         8 King Road\\nCity:           Rockleigh\\nState/Prov:     NJ\\nCountry:        US\\nPostalCode:     07647\\nRegDate:        2009-02-18\\nUpdated:        2020-11-05\\nOfficePhone:    +1-201-767-7070\\nMailbox:        randy.ritzer@fmc-na.com\\nSource:         ARIN\\n"}
{"id": "CM-77", "name": "The City of Miramar", "address": "", "street": "2300 Civic Center Place", "city": "Miramar", "state": "FL", "postalcode": "33025", "country": "US", "admin_id": "ADMIN3090-ARIN", "tech_id": "TECH653-ARIN", "abuse_id": "ABUSE3452-ARIN", "mnt_id": "NOC12666-ARIN", "email": "", "domain": "miramar-fl.gov", "created": "2012-06-26", "updated": "2012-06-26", "source": "arin", "raw": "OrgID:          CM-77\\nOrgName:        The City of Miramar\\nCanAllocate:    \\nStreet:         2300 Civic Center Place\\nCity:           Miramar\\nState/Prov:     FL\\nCountry:        US\\nPostalCode:     33025\\nRegDate:        2012-06-26\\nUpdated:        2012-06-26\\nOrgAbuseHandle: ABUSE3452-ARIN\\nOrgAdminHandle: ADMIN3090-ARIN\\nOrgNOCHandle:   NOC12666-ARIN\\nOrgTechHandle:  TECH653-ARIN\\nSource:         ARIN\\n\n\nPOCHandle:      TECH653-ARIN\\nIsRole:         Y\\nLastName:       Tech\\nFirstName:      \\nStreet:         2300 Civic Center Place\\nStreet:         Attention MIS Department\\nCity:           Miramar\\nState/Prov:     FL\\nCountry:        US\\nPostalCode:     33025\\nRegDate:        2012-06-25\\nUpdated:        2012-06-25\\nFaxPhone:       +1-954-602-3589\\nOfficePhone:    +1-954-602-3000\\nMailbox:        Tech@miramar-fl.gov\\nSource:         ARIN\\n\n\nPOCHandle:      NOC12666-ARIN\\nIsRole:         Y\\nLastName:       NOC\\nFirstName:      \\nStreet:         2300 Civic Center Place\\nStreet:         Attention MIS Department\\nCity:           Miramar\\nState/Prov:     FL\\nCountry:        US\\nPostalCode:     33449\\nRegDate:        2012-06-25\\nUpdated:        2012-06-25\\nFaxPhone:       +1-954-602-3589\\nOfficePhone:    +1-954-602-3000\\nMailbox:        NOC@miramar-fl.gov\\nSource:         ARIN\\n\n\nPOCHandle:      ABUSE3452-ARIN\\nIsRole:         Y\\nLastName:       Abuse\\nFirstName:      \\nStreet:         2300 Civic Center Place\\nStreet:         Att MIS Department\\nCity:           Miramar\\nState/Prov:     FL\\nCountry:        US\\nPostalCode:     33449\\nRegDate:        2012-06-25\\nUpdated:        2012-06-25\\nFaxPhone:       +1-954-602-3589\\nOfficePhone:    +1-954-602-3000\\nMailbox:        Abuse@miramar-fl.gov\\nSource:         ARIN\\n\n\nPOCHandle:      ADMIN3090-ARIN\\nIsRole:         Y\\nLastName:       Admin\\nFirstName:      \\nStreet:         2300 Civic Center Place\\nCity:           Miramar\\nState/Prov:     FL\\nCountry:        US\\nPostalCode:     33025\\nRegDate:        2012-05-23\\nUpdated:        2012-06-25\\nFaxPhone:       +1-954-602-3589\\nOfficePhone:    +1-954-602-3000\\nMailbox:        Admin@miramar-fl.gov\\nSource:         ARIN\\n"}
{"id": "FHCRC-Z", "name": "The Fred Hutchinson Cancer Research Center", "address": "", "street": "1100 Fairview Ave. N., J4-300\\nPOB 10924", "city": "Seattle", "state": "WA", "postalcode": "98109-1024", "country": "US", "admin_id": "JIMAR-ARIN", "tech_id": "JIMAR-ARIN", "abuse_id": "NETWO7548-ARIN", "mnt_id": "NETWO7548-ARIN", "email": "", "domain": "fhcrc.org", "created": "2008-05-02", "updated": "2015-09-02", "source": "arin", "raw": "OrgID:          FHCRC-Z\\nOrgName:        The Fred Hutchinson Cancer Research Center\\nCanAllocate:    \\nStreet:         1100 Fairview Ave. N., J4-300\\nStreet:         POB 10924\\nCity:           Seattle\\nState/Prov:     WA\\nCountry:        US\\nPostalCode:     98109-1024\\nComment:        http://www.fhcrc.org\\nRegDate:        2008-05-02\\nUpdated:        2015-09-02\\nOrgAbuseHandle: NETWO7548-ARIN\\nOrgAdminHandle: JIMAR-ARIN\\nOrgNOCHandle:   NETWO7548-ARIN\\nOrgTechHandle:  JIMAR-ARIN\\nSource:         ARIN\\n\n\nPOCHandle:      NETWO7548-ARIN\\nIsRole:         Y\\nLastName:       Network Operations\\nFirstName:      \\nStreet:         823 Yale AVE N\\nCity:           Seattle\\nState/Prov:     WA\\nCountry:        US\\nPostalCode:     98109\\nRegDate:        2015-09-02\\nUpdated:        2021-09-15\\nOfficePhone:    +1-206-667-5000\\nMailbox:        netops@fredhutch.org\\nSource:         ARIN\\n\n\nPOCHandle:      JIMAR-ARIN\\nIsRole:         N\\nLastName:       Rudd\\nFirstName:      Jim\\nStreet:         1100 Fairview AVE N\\nCity:           Seattle\\nState/Prov:     WA\\nCountry:        US\\nPostalCode:     98109\\nRegDate:        2014-12-31\\nUpdated:        2022-01-04\\nMobilePhone:    +1-206-369-2397\\nOfficePhone:    +1-206-667-3675\\nMailbox:        jrudd@fredhutch.org\\nSource:         ARIN\\n"}
{"id": "QAZON-1", "name": "qazonline", "address": "", "street": "Dubai PO Box 3321", "city": "Dubai", "state": "DUBAI", "postalcode": "8562459883", "country": "AE", "admin_id": "RBAB-ARIN", "tech_id": "RBAB-ARIN", "abuse_id": "RBAB-ARIN", "mnt_id": "RBAB-ARIN", "email": "", "domain": "qazonline.com", "created": "2017-08-04", "updated": "2017-08-04", "source": "arin", "raw": "OrgID:          QAZON-1\\nOrgName:        qazonline\\nCanAllocate:    \\nStreet:         Dubai PO Box 3321\\nCity:           Dubai\\nState/Prov:     DUBAI\\nCountry:        AE\\nPostalCode:     8562459883\\nRegDate:        2017-08-04\\nUpdated:        2017-08-04\\nOrgAbuseHandle: RBAB-ARIN\\nOrgAdminHandle: RBAB-ARIN\\nOrgNOCHandle:   RBAB-ARIN\\nOrgTechHandle:  RBAB-ARIN\\nSource:         ARIN\\n\n\nPOCHandle:      RBAB-ARIN\\nIsRole:         N\\nLastName:       Bakar\\nFirstName:      Rusdi\\nStreet:         Lenoir\\nCity:           Lenoir\\nState/Prov:     NC\\nCountry:        US\\nPostalCode:     28633\\nRegDate:        2013-06-03\\nUpdated:        2022-04-10\\nOfficePhone:    +1-792-452-1779\\nMailbox:        rusdi@qazonline.com\\nSource:         ARIN\\n"}
{"id": "USEDP", "name": "UsedPrice.com, LLC", "address": "", "street": "14555 N. Scottsdale Rd.\\nSuite 330", "city": "Scottsdale", "state": "AZ", "postalcode": "85254", "country": "US", "admin_id": "USEDP2-ARIN", "tech_id": "USEDP-ARIN", "abuse_id": "USEDP1-ARIN", "mnt_id": "USEDP-ARIN", "email": "", "domain": "usedprice.com", "created": "2009-07-16", "updated": "2009-07-16", "source": "arin", "raw": "OrgID:          USEDP\\nOrgName:        UsedPrice.com, LLC\\nCanAllocate:    \\nStreet:         14555 N. Scottsdale Rd.\\nStreet:         Suite 330\\nCity:           Scottsdale\\nState/Prov:     AZ\\nCountry:        US\\nPostalCode:     85254\\nRegDate:        2009-07-16\\nUpdated:        2009-07-16\\nOrgAbuseHandle: USEDP1-ARIN\\nOrgAdminHandle: USEDP2-ARIN\\nOrgNOCHandle:   USEDP-ARIN\\nOrgTechHandle:  USEDP-ARIN\\nSource:         ARIN\\n\n\nPOCHandle:      USEDP-ARIN\\nIsRole:         Y\\nLastName:       UsedPrice NOC\\nFirstName:      \\nStreet:         14555 N. Scottsdale Rd.\\nStreet:         Suite 330\\nCity:           Scottsdale\\nState/Prov:     AZ\\nCountry:        US\\nPostalCode:     85254\\nRegDate:        2009-07-15\\nUpdated:        2010-12-08\\nFaxPhone:       +1-480-951-1117\\nOfficePhone:    +1-480-951-1240\\nMailbox:        noc@usedprice.com\\nSource:         ARIN\\n\n\nPOCHandle:      USEDP1-ARIN\\nIsRole:         Y\\nLastName:       UsedPrice Abuse\\nFirstName:      \\nStreet:         14555 N. Scottsdale Rd.\\nStreet:         Suite 330\\nCity:           Scottsdale\\nState/Prov:     AZ\\nCountry:        US\\nPostalCode:     85254\\nRegDate:        2009-07-15\\nUpdated:        2014-09-03\\nOfficePhone:    +1-480-951-1240\\nFaxPhone:       +1-480-951-1117\\nMailbox:        abuse@usedprice.com\\nSource:         ARIN\\n\n\nPOCHandle:      USEDP2-ARIN\\nIsRole:         Y\\nLastName:       UsedPrice Admin\\nFirstName:      \\nStreet:         14555 N. Scottsdale Rd.\\nStreet:         Suite 330\\nCity:           Scottsdale\\nState/Prov:     AZ\\nCountry:        US\\nPostalCode:     85254\\nRegDate:        2009-07-15\\nUpdated:        2011-12-08\\nOfficePhone:    +1-480-951-1240\\nFaxPhone:       +1-480-951-1117\\nMailbox:        admin@usedprice.com\\nSource:         ARIN\\n"}
{"id": "FRANKR-10", "name": "Frank Russell", "address": "", "street": "1301 2nd Avenue", "city": "Seattle", "state": "WA", "postalcode": "98101", "country": "US", "admin_id": "RUSSE399-ARIN", "tech_id": "RUSSE399-ARIN", "abuse_id": "RUSSE399-ARIN", "mnt_id": "RUSSE399-ARIN", "email": "", "domain": "russell.com", "created": "1996-10-16", "updated": "2017-05-02", "source": "arin", "raw": "OrgID:          FRANKR-10\\nOrgName:        Frank Russell\\nCanAllocate:    \\nStreet:         1301 2nd Avenue\\nCity:           Seattle\\nState/Prov:     WA\\nCountry:        US\\nPostalCode:     98101\\nRegDate:        1996-10-16\\nUpdated:        2017-05-02\\nOrgAbuseHandle: RUSSE399-ARIN\\nOrgAdminHandle: RUSSE399-ARIN\\nOrgNOCHandle:   RUSSE399-ARIN\\nOrgTechHandle:  RUSSE399-ARIN\\nSource:         ARIN\\n\n\nPOCHandle:      RUSSE399-ARIN\\nIsRole:         Y\\nLastName:       Russell Network\\nFirstName:      \\nStreet:         1301 2nd Ave\\nCity:           Seattle\\nState/Prov:     WA\\nCountry:        US\\nPostalCode:     98101\\nRegDate:        2017-04-26\\nUpdated:        2022-04-01\\nOfficePhone:    +1-800-426-7969\\nMailbox:        infra-network@russellinvestments.com\\nSource:         ARIN\\n"}
{"id": "FH-129", "name": "FASTVPS HOSTING COMPANY", "address": "", "street": "1603 Capitol Ave.\\nSuite 310 A433", "city": "Cheyenne", "state": "WY", "postalcode": "82001", "country": "US", "admin_id": "GAVRI5-ARIN", "tech_id": "GAVRI5-ARIN\\NTECH1219-ARIN", "abuse_id": "ABUSE5678-ARIN", "mnt_id": "NOC32564-ARIN\\NTECH1219-ARIN", "email": "", "domain": "fastvps.us", "created": "2016-10-10", "updated": "2020-10-01", "source": "arin", "raw": "OrgID:          FH-129\\nOrgName:        FASTVPS HOSTING COMPANY\\nCanAllocate:    \\nStreet:         1603 Capitol Ave.\\nStreet:         Suite 310 A433\\nCity:           Cheyenne\\nState/Prov:     WY\\nCountry:        US\\nPostalCode:     82001\\nRegDate:        2016-10-10\\nUpdated:        2020-10-01\\nOrgAbuseHandle: ABUSE5678-ARIN\\nOrgAdminHandle: GAVRI5-ARIN\\nOrgNOCHandle:   NOC32564-ARIN\\nOrgNOCHandle:   TECH1219-ARIN\\nOrgTechHandle:  GAVRI5-ARIN\\nOrgTechHandle:  TECH1219-ARIN\\nSource:         ARIN\\n\n\nPOCHandle:      ABUSE5678-ARIN\\nIsRole:         Y\\nLastName:       Abuse\\nFirstName:      \\nStreet:         1603 Capitol Ave.\\nStreet:         Suite 310 A433\\nCity:           Cheyenne\\nState/Prov:     WY\\nCountry:        US\\nPostalCode:     82001\\nRegDate:        2016-10-07\\nUpdated:        2021-11-03\\nOfficePhone:    +1-888-802-3630\\nMailbox:        abuse@fastvps.us\\nSource:         ARIN\\n\n\nPOCHandle:      NOC32564-ARIN\\nIsRole:         Y\\nLastName:       noc\\nFirstName:      \\nStreet:         1603 Capitol Ave.\\nStreet:         Suite 310 A433\\nCity:           Cheyenne\\nState/Prov:     WY\\nCountry:        US\\nPostalCode:     82001\\nRegDate:        2016-10-07\\nUpdated:        2021-11-03\\nOfficePhone:    +1-888-802-3630\\nMailbox:        noc@fastvps.us\\nSource:         ARIN\\n\n\nPOCHandle:      TECH1219-ARIN\\nIsRole:         Y\\nLastName:       tech\\nFirstName:      \\nStreet:         1603 Capitol Ave.\\nStreet:         Suite 310 A433\\nCity:           Cheyenne\\nState/Prov:     WY\\nCountry:        US\\nPostalCode:     82001\\nRegDate:        2020-10-01\\nUpdated:        2021-09-30\\nOfficePhone:    +1-888-802-3630\\nMailbox:        az@fastvps.us\\nSource:         ARIN\\n\n\nPOCHandle:      GAVRI5-ARIN\\nIsRole:         N\\nLastName:       Gavrilin\\nFirstName:      Pavel\\nStreet:         1603 Capitol Ave.\\nStreet:         Suite 310 A433\\nCity:           Cheyenne\\nState/Prov:     WY\\nCountry:        US\\nPostalCode:     82001\\nRegDate:        2016-10-07\\nUpdated:        2021-11-03\\nOfficePhone:    +1-888-802-3630\\nMailbox:        pg@fastvps.us\\nSource:         ARIN\\n"}
{"id": "MH-302", "name": "MCCS H0313-D-0007", "address": "", "street": "8209 VALLEY PIKE", "city": "MIDDLETOWN", "state": "VA", "postalcode": "22645", "country": "US", "admin_id": "GRESH3-ARIN", "tech_id": "GRESH3-ARIN\\NYUISA-ARIN", "abuse_id": "GRESH3-ARIN\\NYUISA-ARIN", "mnt_id": "GRESH3-ARIN", "email": "", "domain": "usmc-mccs.org", "created": "2014-03-11", "updated": "2019-04-03", "source": "arin", "raw": "OrgID:          MH-302\\nOrgName:        MCCS H0313-D-0007\\nCanAllocate:    \\nStreet:         8209 VALLEY PIKE\\nCity:           MIDDLETOWN\\nState/Prov:     VA\\nCountry:        US\\nPostalCode:     22645\\nRegDate:        2014-03-11\\nUpdated:        2019-04-03\\nOrgAbuseHandle: GRESH3-ARIN\\nOrgAbuseHandle: YUISA-ARIN\\nOrgAdminHandle: GRESH3-ARIN\\nOrgNOCHandle:   GRESH3-ARIN\\nOrgTechHandle:  GRESH3-ARIN\\nOrgTechHandle:  YUISA-ARIN\\nSource:         ARIN\\n\n\nPOCHandle:      GRESH3-ARIN\\nIsRole:         N\\nLastName:       GRESHAM\\nFirstName:      GARY\\nStreet:         3800 BELLEAU WOOD\\nStreet:         BLDG 15\\nCity:           SAN DIEGO\\nState/Prov:     CA\\nCountry:        US\\nPostalCode:     92140\\nRegDate:        2014-03-10\\nUpdated:        2022-04-04\\nOfficePhone:    +1-612-663-1067\\nMailbox:        gary.d.gresham@usmc-mccs.org\\nSource:         ARIN\\n\n\nPOCHandle:      YUISA-ARIN\\nIsRole:         N\\nLastName:       YU\\nFirstName:      ISAAC\\nStreet:         8209 VALLEY PIKE\\nCity:           MIDDLETOWN\\nState/Prov:     VA\\nCountry:        US\\nPostalCode:     22645\\nRegDate:        2014-03-11\\nUpdated:        2019-04-03\\nOfficePhone:    +1-540-999-8525\\nMailbox:        isaac.yu@usmc-mccs.org\\nMailbox:        dealinice@gmail.com\\nSource:         ARIN\\n"}
{"id": "TTSL-15", "name": "TALLEY TECHNICAL SERVICES LLC", "address": "", "street": "19125 N DAILY RD", "city": "Princeville", "state": "IL", "postalcode": "61559", "country": "US", "admin_id": "JWT12-ARIN", "tech_id": "JWT12-ARIN", "abuse_id": "JWT12-ARIN", "mnt_id": "JWT12-ARIN", "email": "", "domain": "talleytech.net", "created": "2020-04-14", "updated": "2020-05-05", "source": "arin", "raw": "OrgID:          TTSL-15\\nOrgName:        TALLEY TECHNICAL SERVICES LLC\\nCanAllocate:    \\nStreet:         19125 N DAILY RD\\nCity:           Princeville\\nState/Prov:     IL\\nCountry:        US\\nPostalCode:     61559\\nRegDate:        2020-04-14\\nUpdated:        2020-05-05\\nOrgAbuseHandle: JWT12-ARIN\\nOrgAdminHandle: JWT12-ARIN\\nOrgDNSHandle:   JWT12-ARIN\\nOrgNOCHandle:   JWT12-ARIN\\nOrgRoutingHandle:   JWT12-ARIN\\nOrgTechHandle:  JWT12-ARIN\\nSource:         ARIN\\n\n\nPOCHandle:      JWT12-ARIN\\nIsRole:         N\\nLastName:       Talley\\nFirstName:      Jason\\nStreet:         19125 N DAILY RD\\nCity:           Princeville\\nState/Prov:     IL\\nCountry:        US\\nPostalCode:     61559\\nRegDate:        2020-04-14\\nUpdated:        2021-04-21\\nMobilePhone:    +1-309-219-1128\\nOfficePhone:    +1-331-212-8174\\nMailbox:        jason@talleytech.net\\nSource:         ARIN\\n"}
{"id": "702COM", "name": "702 Communications", "address": "", "street": "702 Main Ave", "city": "Moorhead", "state": "MN", "postalcode": "56560", "country": "US", "admin_id": "IPADM330-ARIN", "tech_id": "IPADM330-ARIN", "abuse_id": "ABUSE422-ARIN", "mnt_id": "IPADM330-ARIN", "email": "", "domain": "702communications.com", "created": "2000-04-12", "updated": "2017-01-28", "source": "arin", "raw": "OrgID:          702COM\\nOrgName:        702 Communications\\nCanAllocate:    \\nStreet:         702 Main Ave\\nCity:           Moorhead\\nState/Prov:     MN\\nCountry:        US\\nPostalCode:     56560\\nRegDate:        2000-04-12\\nUpdated:        2017-01-28\\nOrgAbuseHandle: ABUSE422-ARIN\\nOrgAdminHandle: IPADM330-ARIN\\nOrgNOCHandle:   IPADM330-ARIN\\nOrgTechHandle:  IPADM330-ARIN\\nSource:         ARIN\\n\n\nPOCHandle:      ABUSE422-ARIN\\nIsRole:         Y\\nLastName:       Abuse Contact\\nFirstName:      \\nStreet:         702 Main Ave\\nCity:           Moorhead\\nState/Prov:     MN\\nCountry:        US\\nPostalCode:     56560\\nRegDate:        2003-10-14\\nUpdated:        2022-04-12\\nOfficePhone:    +1-218-284-5702\\nMailbox:        abuse@702com.net\\nSource:         ARIN\\n\n\nPOCHandle:      IPADM330-ARIN\\nIsRole:         Y\\nLastName:       IP Administrator\\nFirstName:      \\nStreet:         702 Main Avenue\\nCity:           Moorhead\\nState/Prov:     MN\\nCountry:        US\\nPostalCode:     56560\\nRegDate:        2006-10-26\\nUpdated:        2022-05-04\\nOfficePhone:    +1-218-284-5702\\nFaxPhone:       +1-218-477-0502\\nMailbox:        ipadmin@702netops.net\\nSource:         ARIN\\n"}
{"id": "CF-1196", "name": "CANTIGNY FOUNDATION", "address": "", "street": "1s151 Winfield Rd", "city": "Wheaton", "state": "IL", "postalcode": "60189", "country": "US", "admin_id": "KACHI3-ARIN", "tech_id": "KACHI3-ARIN", "abuse_id": "KACHI3-ARIN", "mnt_id": "KACHI3-ARIN", "email": "", "domain": "cantigny.org", "created": "2017-03-27", "updated": "2018-03-05", "source": "arin", "raw": "OrgID:          CF-1196\\nOrgName:        CANTIGNY FOUNDATION\\nCanAllocate:    \\nStreet:         1s151 Winfield Rd\\nCity:           Wheaton\\nState/Prov:     IL\\nCountry:        US\\nPostalCode:     60189\\nRegDate:        2017-03-27\\nUpdated:        2018-03-05\\nOrgAbuseHandle: KACHI3-ARIN\\nOrgAdminHandle: KACHI3-ARIN\\nOrgNOCHandle:   KACHI3-ARIN\\nOrgTechHandle:  KACHI3-ARIN\\nSource:         ARIN\\n\n\nPOCHandle:      KACHI3-ARIN\\nIsRole:         N\\nLastName:       Kachikwu\\nFirstName:      Richard\\nStreet:         1S151 Winfield Road\\nCity:           Wheaton\\nState/Prov:     IL\\nCountry:        US\\nPostalCode:     60189\\nRegDate:        2018-03-05\\nUpdated:        2020-06-29\\nOfficePhone:    +1-630-260-8213\\nMailbox:        rkachikwu@mccormickfoundation.org\\nSource:         ARIN\\n"}
{"id": "GLA-166", "name": "GERMAN LUFTHANSA AIRLINES", "address": "", "street": "2600 MAYNARD H JACKSON JR BLVD", "city": "ATL", "state": "GA", "postalcode": "30337", "country": "US", "admin_id": "HOGGE2-ARIN", "tech_id": "HOGGE2-ARIN", "abuse_id": "HOGGE2-ARIN", "mnt_id": "HOGGE2-ARIN", "email": "", "domain": "lufthansa.com", "created": "2017-08-29", "updated": "2020-06-18", "source": "arin", "raw": "OrgID:          GLA-166\\nOrgName:        GERMAN LUFTHANSA AIRLINES\\nCanAllocate:    \\nStreet:         2600 MAYNARD H JACKSON JR BLVD\\nCity:           ATL\\nState/Prov:     GA\\nCountry:        US\\nPostalCode:     30337\\nRegDate:        2017-08-29\\nUpdated:        2020-06-18\\nOrgAbuseHandle: HOGGE2-ARIN\\nOrgAdminHandle: HOGGE2-ARIN\\nOrgDNSHandle:   HOGGE2-ARIN\\nOrgNOCHandle:   HOGGE2-ARIN\\nOrgRoutingHandle:   HOGGE2-ARIN\\nOrgTechHandle:  HOGGE2-ARIN\\nSource:         ARIN\\n\n\nPOCHandle:      HOGGE2-ARIN\\nIsRole:         N\\nLastName:       Hogger\\nFirstName:      Peter\\nStreet:         1400 RXR Plaza West Tower\\nCity:           Uniondale\\nState/Prov:     NY\\nCountry:        US\\nPostalCode:     11556\\nRegDate:        2017-04-28\\nUpdated:        2022-04-29\\nOfficePhone:    +1-516-296-9270\\nMailbox:        peter.hogger@dlh.de\\nSource:         ARIN\\n"}
{"id": "AIRFI-2", "name": "AirFi, Inc.", "address": "", "street": "PO BOX 12", "city": "Zebulon", "state": "GA", "postalcode": "30295", "country": "US", "admin_id": "ADMIN6128-ARIN", "tech_id": "ADMIN6128-ARIN\\NTURNE128-ARIN", "abuse_id": "ADMIN6128-ARIN\\NTURNE128-ARIN", "mnt_id": "ADMIN6128-ARIN\\NTURNE128-ARIN", "email": "", "domain": "airfi.us", "created": "2016-05-09", "updated": "2016-05-09", "source": "arin", "raw": "OrgID:          AIRFI-2\\nOrgName:        AirFi, Inc.\\nCanAllocate:    \\nStreet:         PO BOX 12\\nCity:           Zebulon\\nState/Prov:     GA\\nCountry:        US\\nPostalCode:     30295\\nRegDate:        2016-05-09\\nUpdated:        2016-05-09\\nOrgAbuseHandle: ADMIN6128-ARIN\\nOrgAbuseHandle: TURNE128-ARIN\\nOrgAdminHandle: ADMIN6128-ARIN\\nOrgNOCHandle:   ADMIN6128-ARIN\\nOrgNOCHandle:   TURNE128-ARIN\\nOrgTechHandle:  ADMIN6128-ARIN\\nOrgTechHandle:  TURNE128-ARIN\\nSource:         ARIN\\n\n\nPOCHandle:      TURNE128-ARIN\\nIsRole:         N\\nLastName:       Turner\\nFirstName:      Britain\\nStreet:         PO BOX 12\\nCity:           Zebulon\\nState/Prov:     GA\\nCountry:        US\\nPostalCode:     30295\\nRegDate:        2013-11-13\\nUpdated:        2016-05-09\\nOfficePhone:    +1-855-684-8324\\nOfficePhone:    +1-888-588-2024\\nMailbox:        bturner@airfi.us\\nMailbox:        bturner@turnertech.co\\nSource:         ARIN\\n\n\nPOCHandle:      ADMIN6128-ARIN\\nIsRole:         N\\nLastName:       Admin\\nFirstName:      AirFi\\nStreet:         PO BOX 12\\nCity:           ZEBULON\\nState/Prov:     GA\\nCountry:        US\\nPostalCode:     30295\\nRegDate:        2016-03-16\\nUpdated:        2016-03-16\\nOfficePhone:    +1-678-439-7453\\nMailbox:        info@airfi.us\\nSource:         ARIN\\n"}
{"id": "CITYO-394", "name": "CITY OF CERRITOS", "address": "", "street": "18125 BLOOMFIELD AVE", "city": "CERRITOS", "state": "CA", "postalcode": "90703", "country": "US", "admin_id": "ARRAY-ARIN", "tech_id": "ARRAY-ARIN", "abuse_id": "ARRAY-ARIN", "mnt_id": "ARRAY-ARIN", "email": "", "domain": "cerritos.us", "created": "2010-07-21", "updated": "2019-09-13", "source": "arin", "raw": "OrgID:          CITYO-394\\nOrgName:        CITY OF CERRITOS\\nCanAllocate:    \\nStreet:         18125 BLOOMFIELD AVE\\nCity:           CERRITOS\\nState/Prov:     CA\\nCountry:        US\\nPostalCode:     90703\\nRegDate:        2010-07-21\\nUpdated:        2019-09-13\\nOrgAbuseHandle: ARRAY-ARIN\\nOrgAdminHandle: ARRAY-ARIN\\nOrgDNSHandle:   ARRAY-ARIN\\nOrgNOCHandle:   ARRAY-ARIN\\nOrgRoutingHandle:   ARRAY-ARIN\\nOrgTechHandle:  ARRAY-ARIN\\nSource:         ARIN\\n\n\nPOCHandle:      ARRAY-ARIN\\nIsRole:         N\\nLastName:       Arrayga\\nFirstName:      Ismael\\nStreet:         18125 Bloomfield Ave.\\nCity:           Cerritos\\nState/Prov:     CA\\nCountry:        US\\nPostalCode:     90703\\nRegDate:        2019-09-13\\nUpdated:        2021-10-05\\nOfficePhone:    +1-562-468-1002\\nMailbox:        iarrayga@cerritos.us\\nSource:         ARIN\\n"}
{"id": "SDL-157", "name": "Server Destroyers LLC", "address": "", "street": "30 N Gould St Ste R", "city": "Sheridan", "state": "WY", "postalcode": "82801", "country": "US", "admin_id": "JTC25-ARIN", "tech_id": "JTC25-ARIN", "abuse_id": "JTC25-ARIN", "mnt_id": "JTC25-ARIN", "email": "", "domain": "serverdestroyers.com", "created": "2020-05-05", "updated": "2020-09-30", "source": "arin", "raw": "OrgID:          SDL-157\\nOrgName:        Server Destroyers LLC\\nCanAllocate:    \\nStreet:         30 N Gould St Ste R\\nCity:           Sheridan\\nState/Prov:     WY\\nCountry:        US\\nPostalCode:     82801\\nComment:        https://serverdestroyers.com/\\nRegDate:        2020-05-05\\nUpdated:        2020-09-30\\nOrgAbuseHandle: JTC25-ARIN\\nOrgAdminHandle: JTC25-ARIN\\nOrgDNSHandle:   JTC25-ARIN\\nOrgNOCHandle:   JTC25-ARIN\\nOrgRoutingHandle:   JTC25-ARIN\\nOrgTechHandle:  JTC25-ARIN\\nSource:         ARIN\\n\n\nPOCHandle:      JTC25-ARIN\\nIsRole:         N\\nLastName:       Cho\\nFirstName:      Jonathan\\nStreet:         24 aster ct\\nCity:           brooklyn\\nState/Prov:     NY\\nCountry:        US\\nPostalCode:     11229\\nRegDate:        2020-05-03\\nUpdated:        2022-05-03\\nOfficePhone:    +1-347-575-9113\\nMailbox:        serverdestroyers@gmail.com\\nSource:         ARIN\\n"}
{"id": "XINLI", "name": "Xin Li", "address": "", "street": "1600 Amphitheater Parkway", "city": "Mountain View", "state": "CA", "postalcode": "94043", "country": "US", "admin_id": "LIXIN-ARIN", "tech_id": "LIXIN-ARIN", "abuse_id": "LIXIN-ARIN", "mnt_id": "LIXIN-ARIN", "email": "", "domain": "freebsd.org", "created": "2010-12-01", "updated": "2016-02-01", "source": "arin", "raw": "OrgID:          XINLI\\nOrgName:        Xin Li\\nCanAllocate:    \\nStreet:         1600 Amphitheater Parkway\\nCity:           Mountain View\\nState/Prov:     CA\\nCountry:        US\\nPostalCode:     94043\\nRegDate:        2010-12-01\\nUpdated:        2016-02-01\\nOrgAbuseHandle: LIXIN-ARIN\\nOrgAdminHandle: LIXIN-ARIN\\nOrgNOCHandle:   LIXIN-ARIN\\nOrgTechHandle:  LIXIN-ARIN\\nSource:         ARIN\\n\n\nPOCHandle:      LIXIN-ARIN\\nIsRole:         N\\nLastName:       LI\\nFirstName:      Xin\\nStreet:         1600 Amphitheater Parkway\\nCity:           Mountain View\\nState/Prov:     CA\\nCountry:        US\\nPostalCode:     94043\\nRegDate:        2010-06-24\\nUpdated:        2021-02-26\\nOfficePhone:    +1-650-214-8541\\nMobilePhone:    +1-650-450-8302\\nMailbox:        delphij@FreeBSD.org\\nSource:         ARIN\\n"}
{"id": "INNER-7", "name": "InnerWorkings, Inc.", "address": "", "street": "600 West Chicago Ave\\nSuite 850", "city": "Chicago", "state": "IL", "postalcode": "60654", "country": "US", "admin_id": "SYSTE226-ARIN", "tech_id": "SYSTE226-ARIN", "abuse_id": "HELPD42-ARIN", "mnt_id": "SYSTE226-ARIN", "email": "", "domain": "inwk.com", "created": "2006-06-20", "updated": "2008-09-08", "source": "arin", "raw": "OrgID:          INNER-7\\nOrgName:        InnerWorkings, Inc.\\nCanAllocate:    \\nStreet:         600 West Chicago Ave\\nStreet:         Suite 850\\nCity:           Chicago\\nState/Prov:     IL\\nCountry:        US\\nPostalCode:     60654\\nComment:        Website: http://www.inwk.com\\nRegDate:        2006-06-20\\nUpdated:        2008-09-08\\nOrgAbuseHandle: HELPD42-ARIN\\nOrgAdminHandle: SYSTE226-ARIN\\nOrgNOCHandle:   SYSTE226-ARIN\\nOrgTechHandle:  SYSTE226-ARIN\\nSource:         ARIN\\n\n\nPOCHandle:      HELPD42-ARIN\\nIsRole:         Y\\nLastName:       Helpdesk\\nFirstName:      \\nStreet:         600 W Chicago\\nStreet:         Ste 850\\nCity:           Chicago\\nState/Prov:     IL\\nCountry:        US\\nPostalCode:     60613\\nRegDate:        2006-06-16\\nUpdated:        2016-11-10\\nOfficePhone:    +1-312-602-3700\\nMailbox:        helpdesk@iwprint.com\\nSource:         ARIN\\n\n\nPOCHandle:      SYSTE226-ARIN\\nIsRole:         Y\\nLastName:       Systems Administrator\\nFirstName:      \\nStreet:         600 West Chicago\\nStreet:         Suite 850\\nCity:           Chicago\\nState/Prov:     IL\\nCountry:        US\\nPostalCode:     60654\\nRegDate:        2008-09-05\\nUpdated:        2013-11-04\\nFaxPhone:       +1-312-642-3704\\nOfficePhone:    +1-312-642-3700\\nMailbox:        sysadmin@inwk.com\\nSource:         ARIN\\n"}
{"id": "NOKIA-9", "name": "Nokia", "address": "", "street": "Nokia Corporation\\n200 South Mathilda Avenue", "city": "Sunnyvale", "state": "CA", "postalcode": "94086", "country": "US", "admin_id": "JPV6-ARIN", "tech_id": "ARUMU5-ARIN\\NJPV6-ARIN\\NKASSA6-ARIN\\NRAJPA7-ARIN\\NSINGH520-ARIN\\NVITAL55-ARIN", "abuse_id": "JPV6-ARIN\\NNIRMAC-ARIN", "mnt_id": "JPV6-ARIN", "email": "", "domain": "nokia.com", "created": "2001-02-08", "updated": "2021-06-29", "source": "arin", "raw": "OrgID:          NOKIA-9\\nOrgName:        Nokia\\nCanAllocate:    \\nStreet:         Nokia Corporation\\nStreet:         200 South Mathilda Avenue\\nCity:           Sunnyvale\\nState/Prov:     CA\\nCountry:        US\\nPostalCode:     94086\\nComment:        http://www.nokia.com\\nRegDate:        2001-02-08\\nUpdated:        2021-06-29\\nOrgAbuseHandle: JPV6-ARIN\\nOrgAbuseHandle: NIRMAC-ARIN\\nOrgAdminHandle: JPV6-ARIN\\nOrgNOCHandle:   JPV6-ARIN\\nOrgTechHandle:  ARUMU5-ARIN\\nOrgTechHandle:  JPV6-ARIN\\nOrgTechHandle:  KASSA6-ARIN\\nOrgTechHandle:  RAJPA7-ARIN\\nOrgTechHandle:  SINGH520-ARIN\\nOrgTechHandle:  VITAL55-ARIN\\nSource:         ARIN\\n\n\nPOCHandle:      KASSA6-ARIN\\nIsRole:         N\\nLastName:       KASSAB\\nFirstName:      Mostefa\\nStreet:         20 place des Halles\\nCity:           Strasbourg\\nState/Prov:     \\nCountry:        FR\\nPostalCode:     67000\\nRegDate:        2014-07-21\\nUpdated:        2019-07-18\\nOfficePhone:    +33 6 11306755\\nMailbox:        mostefa.kassab@nokia.com\\nMailbox:        mostefa.kassab@alcatel-lucent.com\\nSource:         ARIN\\n\n\nPOCHandle:      VITAL55-ARIN\\nIsRole:         Y\\nLastName:       VitalQIP\\nFirstName:      \\nStreet:         600 Mountain Ave\\nCity:           New Providence\\nState/Prov:     NJ\\nCountry:        US\\nPostalCode:     07974\\nRegDate:        2020-01-15\\nUpdated:        2021-07-01\\nOfficePhone:    +1-908-830-0139\\nMailbox:        blaine.elzey@nokia.com\\nMailbox:        cindy.latch@nokia.com\\nSource:         ARIN\\n\n\nPOCHandle:      NIRMAC-ARIN\\nIsRole:         Y\\nLastName:       Nokia Internet Registry Management Abuse Contact\\nFirstName:      \\nStreet:         Karakaari 7\\nCity:           Espoo\\nState/Prov:     \\nCountry:        FI\\nPostalCode:     02610\\nRegDate:        2020-02-19\\nUpdated:        2022-02-24\\nOfficePhone:    +1 1010101010101010101010\\nMailbox:        abuse@nokia.com\\nSource:         ARIN\\n\n\nPOCHandle:      ARUMU5-ARIN\\nIsRole:         N\\nLastName:       Arumugam\\nFirstName:      Jayavel\\nStreet:         No.23, Pacifica Tech Park 5th Floor, Rajiv Gandhi Salai, Navallur\\nCity:           Chennai\\nState/Prov:     \\nCountry:        IN\\nPostalCode:     603103\\nRegDate:        2018-10-25\\nUpdated:        2018-10-25\\nOfficePhone:    +1-443-994-1414\\nMailbox:        jayavel.arumugam@nokia.com\\nSource:         ARIN\\n\n\nPOCHandle:      JPV6-ARIN\\nIsRole:         N\\nLastName:       Vayrynen\\nFirstName:      Jari\\nStreet:         Karakaari 7\\nCity:           Espoo\\nState/Prov:     \\nCountry:        FI\\nPostalCode:     02610\\nRegDate:        2018-10-24\\nUpdated:        2022-02-28\\nMobilePhone:    +358504830793\\nOfficePhone:    +358504830793\\nMailbox:        jari.vayrynen@nokia.com\\nSource:         ARIN\\n\n\nPOCHandle:      RAJPA7-ARIN\\nIsRole:         N\\nLastName:       Raj\\nFirstName:      Pankaj\\nStreet:         Green Boulevard Building, Tower-A, Sector-62\\nCity:           Noida\\nState/Prov:     \\nCountry:        IN\\nPostalCode:     201301\\nRegDate:        2020-04-20\\nUpdated:        2022-04-19\\nOfficePhone:    +919999803524\\nMailbox:        pankaj.raj@nokia.com\\nSource:         ARIN\\n\n\nPOCHandle:      SINGH520-ARIN\\nIsRole:         N\\nLastName:       Singh\\nFirstName:      Diwakar\\nStreet:         Nokia Networks, \\nStreet:         GDC-Noida,3rd Floor\\nStreet:         Tower A, B 9/4, \\nStreet:         Sector 62\\nCity:           Noida\\nState/Prov:     Uttar Pradesh\\nCountry:        IN\\nPostalCode:     201309\\nRegDate:        2018-12-21\\nUpdated:        2018-12-21\\nOfficePhone:    +911244504000 \\nMobilePhone:    +919560294202\\nMailbox:        diwakar.singh@nokia.com\\nSource:         ARIN\\n"}
{"id": "DIGITA-123", "name": "Digital River, Inc.", "address": "", "street": "10380 Bren Road West", "city": "Minnetonka", "state": "MN", "postalcode": "55343", "country": "US", "admin_id": "ADMIN660-ARIN", "tech_id": "ORGTE1-ARIN", "abuse_id": "ABUSE358-ARIN", "mnt_id": "NOC1937-ARIN", "email": "", "domain": "digitalriver.com", "created": "1999-09-08", "updated": "2017-01-28", "source": "arin", "raw": "OrgID:          DIGITA-123\\nOrgName:        Digital River, Inc.\\nCanAllocate:    \\nStreet:         10380 Bren Road West\\nCity:           Minnetonka\\nState/Prov:     MN\\nCountry:        US\\nPostalCode:     55343\\nRegDate:        1999-09-08\\nUpdated:        2017-01-28\\nOrgAbuseHandle: ABUSE358-ARIN\\nOrgAdminHandle: ADMIN660-ARIN\\nOrgNOCHandle:   NOC1937-ARIN\\nOrgTechHandle:  ORGTE1-ARIN\\nSource:         ARIN\\n\n\nPOCHandle:      NOC1937-ARIN\\nIsRole:         Y\\nLastName:       Network Operations Center\\nFirstName:      \\nStreet:         10380 Bren Road West\\nCity:           Minnetonka\\nState/Prov:     MN\\nCountry:        US\\nPostalCode:     55343\\nRegDate:        2005-10-10\\nUpdated:        2021-11-29\\nOfficePhone:    +1-952-253-1234\\nMailbox:        hostmaster@digitalriver.com\\nMailbox:        networkteam@digitalriver.com\\nSource:         ARIN\\n\n\nPOCHandle:      ADMIN660-ARIN\\nIsRole:         Y\\nLastName:       ADMIN\\nFirstName:      \\nStreet:         10380 Bren Road West\\nCity:           Minnetonka\\nState/Prov:     MN\\nCountry:        US\\nPostalCode:     55343\\nRegDate:        2005-10-10\\nUpdated:        2021-11-29\\nOfficePhone:    +1-952-540-3023\\nMailbox:        hostmaster@digitalriver.com\\nMailbox:        networkteam@digitalriver.com\\nSource:         ARIN\\n\n\nPOCHandle:      ABUSE358-ARIN\\nIsRole:         Y\\nLastName:       ABUSE\\nFirstName:      \\nStreet:         9625 West 76th Street\\nStreet:         Suite 150\\nStreet:         IT Department\\nCity:           Eden Prairie\\nState/Prov:     MN\\nCountry:        US\\nPostalCode:     55344\\nRegDate:        2003-07-24\\nUpdated:        2010-06-17\\nOfficePhone:    +1-952-540-3023\\nMailbox:        abuse@digitalriver.com\\nSource:         ARIN\\n\n\nPOCHandle:      ORGTE1-ARIN\\nIsRole:         Y\\nLastName:       Org Tech\\nFirstName:      \\nStreet:         10380 Bren Road West\\nCity:           Minnetonka\\nState/Prov:     MN\\nCountry:        US\\nPostalCode:     55343\\nRegDate:        2005-10-10\\nUpdated:        2021-10-15\\nOfficePhone:    +1-952-540-3023\\nMailbox:        hostmaster@digitalriver.com\\nMailbox:        networkteam@digitalriver.com\\nSource:         ARIN\\n"}
{"id": "EX3IN", "name": "Ex3", "address": "", "street": "1380 W. Auto Dr", "city": "Tempe", "state": "AZ", "postalcode": "85284", "country": "US", "admin_id": "OGI-ARIN", "tech_id": "ZRG-ARIN", "abuse_id": "OGI-ARIN", "mnt_id": "OGI-ARIN", "email": "", "domain": "ex3.com", "created": "2003-07-25", "updated": "2009-02-19", "source": "arin", "raw": "OrgID:          EX3IN\\nOrgName:        Ex3\\nCanAllocate:    \\nStreet:         1380 W. Auto Dr\\nCity:           Tempe\\nState/Prov:     AZ\\nCountry:        US\\nPostalCode:     85284\\nRegDate:        2003-07-25\\nUpdated:        2009-02-19\\nOrgAbuseHandle: OGI-ARIN\\nOrgAdminHandle: OGI-ARIN\\nOrgNOCHandle:   OGI-ARIN\\nOrgTechHandle:  ZRG-ARIN\\nSource:         ARIN\\n\n\nPOCHandle:      ZRG-ARIN\\nIsRole:         N\\nLastName:       Giles\\nFirstName:      Zachary\\nStreet:         1380 W. Auto Drive\\nCity:           Tempe\\nState/Prov:     AZ\\nCountry:        US\\nPostalCode:     85284\\nRegDate:        2009-02-11\\nUpdated:        2013-11-06\\nOfficePhone:    +1-480-756-9393\\nMailbox:        zachary.giles@ex3.com\\nSource:         ARIN\\n\n\nPOCHandle:      OGI-ARIN\\nIsRole:         N\\nLastName:       Giles\\nFirstName:      Obed\\nStreet:         1380 W. Auto Drive\\nCity:           Tempe\\nState/Prov:     AZ\\nCountry:        US\\nPostalCode:     85284\\nRegDate:        2003-07-25\\nUpdated:        2016-11-29\\nOfficePhone:    +1-480-756-9393\\nMailbox:        obed.giles@ex3.com\\nSource:         ARIN\\n"}
{"id": "OISL-12", "name": "ONENECK IT SOLUTIONS LLC", "address": "", "street": "5515 NOBEL DR", "city": "FITCHBURG", "state": "WI", "postalcode": "53711", "country": "US", "admin_id": "IRAA1-ARIN", "tech_id": "OISN-ARIN", "abuse_id": "NAPO5-ARIN", "mnt_id": "OISN-ARIN", "email": "", "domain": "oneneck.com", "created": "2017-04-10", "updated": "2020-08-17", "source": "arin", "raw": "OrgID:          OISL-12\\nOrgName:        ONENECK IT SOLUTIONS LLC\\nCanAllocate:    \\nStreet:         5515 NOBEL DR\\nCity:           FITCHBURG\\nState/Prov:     WI\\nCountry:        US\\nPostalCode:     53711\\nRegDate:        2017-04-10\\nUpdated:        2020-08-17\\nOrgAbuseHandle: NAPO5-ARIN\\nOrgAdminHandle: IRAA1-ARIN\\nOrgNOCHandle:   OISN-ARIN\\nOrgTechHandle:  OISN-ARIN\\nSource:         ARIN\\n\n\nPOCHandle:      IRAA1-ARIN\\nIsRole:         Y\\nLastName:       IP Resource Allocation Admin\\nFirstName:      \\nStreet:         5301 N Pima Rd, Suite 100\\nCity:           Scottsdale\\nState/Prov:     AZ\\nCountry:        US\\nPostalCode:     85250\\nRegDate:        2016-03-07\\nUpdated:        2022-03-28\\nOfficePhone:    +1-800-272-3077\\nMailbox:        oneadmin001aaa@oneneck.com\\nSource:         ARIN\\n\n\nPOCHandle:      NAPO5-ARIN\\nIsRole:         Y\\nLastName:       Network Abuse and Policy Observance\\nFirstName:      \\nStreet:         5301 N Pima Rd, Suite 100\\nCity:           Scottsdale\\nState/Prov:     AZ\\nCountry:        US\\nPostalCode:     85250\\nRegDate:        2016-03-07\\nUpdated:        2022-03-28\\nOfficePhone:    +1-800-272-3077\\nMailbox:        oneabuse001aab@oneneck.com\\nSource:         ARIN\\n\n\nPOCHandle:      OISN-ARIN\\nIsRole:         Y\\nLastName:       OneNeck IT Solutions NOC\\nFirstName:      \\nStreet:         5301 N Pima Rd, Suite 100\\nCity:           Scottsdale\\nState/Prov:     AZ\\nCountry:        US\\nPostalCode:     85250\\nRegDate:        2016-03-07\\nUpdated:        2022-03-28\\nOfficePhone:    +1-800-272-3077\\nMailbox:        onetech001aaa@oneneck.com\\nSource:         ARIN\\n"}
{"id": "UNWIR-5", "name": "XS Media", "address": "", "street": "1702 W 2nd Ave\\nSuite A", "city": "Eugene", "state": "OR", "postalcode": "97402", "country": "US", "admin_id": "MWN-ARIN", "tech_id": "MATSO18-ARIN\\NMWN-ARIN", "abuse_id": "MWN-ARIN", "mnt_id": "MWN-ARIN", "email": "", "domain": "xsmedia.com", "created": "2009-11-13", "updated": "2017-12-05", "source": "arin", "raw": "OrgID:          UNWIR-5\\nOrgName:        XS Media\\nCanAllocate:    \\nStreet:         1702 W 2nd Ave\\nStreet:         Suite A\\nCity:           Eugene\\nState/Prov:     OR\\nCountry:        US\\nPostalCode:     97402\\nRegDate:        2009-11-13\\nUpdated:        2017-12-05\\nOrgAbuseHandle: MWN-ARIN\\nOrgAdminHandle: MWN-ARIN\\nOrgNOCHandle:   MWN-ARIN\\nOrgTechHandle:  MATSO18-ARIN\\nOrgTechHandle:  MWN-ARIN\\nSource:         ARIN\\n\n\nPOCHandle:      MWN-ARIN\\nIsRole:         N\\nLastName:       Nash\\nFirstName:      Mark\\nStreet:         1702 W 2nd Ave\\nStreet:         Suite A\\nCity:           Eugene\\nState/Prov:     OR\\nCountry:        US\\nPostalCode:     97402\\nRegDate:        2009-11-13\\nUpdated:        2017-03-03\\nFaxPhone:       +1-541-255-0229\\nOfficePhone:    +1-541-338-9000\\nMobilePhone:    +1-541-228-0314\\nMailbox:        mark@xsmedia.com\\nSource:         ARIN\\n\n\nPOCHandle:      MATSO18-ARIN\\nIsRole:         N\\nLastName:       Matson\\nFirstName:      Ben\\nStreet:         1702 W 2nd Ave Suite A\\nCity:           Eugene\\nState/Prov:     OR\\nCountry:        US\\nPostalCode:     97401\\nRegDate:        2017-07-20\\nUpdated:        2017-07-20\\nOfficePhone:    +1-541-338-9000\\nMailbox:        ben@xsmedia.com\\nSource:         ARIN\\n"}
{"id": "CPU-11", "name": "Cool Piranha USA Inc", "address": "", "street": "344 Ive Center\\n7954 Transit Road", "city": "Williamsville", "state": "NY", "postalcode": "14221", "country": "US", "admin_id": "COOLP-ARIN", "tech_id": "COOLP-ARIN", "abuse_id": "COOLP-ARIN", "mnt_id": "COOLP-ARIN", "email": "", "domain": "coolpiranha-hosting.com", "created": "2004-10-22", "updated": "2011-09-24", "source": "arin", "raw": "OrgID:          CPU-11\\nOrgName:        Cool Piranha USA Inc\\nCanAllocate:    \\nStreet:         344 Ive Center\\nStreet:         7954 Transit Road\\nCity:           Williamsville\\nState/Prov:     NY\\nCountry:        US\\nPostalCode:     14221\\nRegDate:        2004-10-22\\nUpdated:        2011-09-24\\nOrgAbuseHandle: COOLP-ARIN\\nOrgAdminHandle: COOLP-ARIN\\nOrgNOCHandle:   COOLP-ARIN\\nOrgTechHandle:  COOLP-ARIN\\nSource:         ARIN\\n\n\nPOCHandle:      COOLP-ARIN\\nIsRole:         Y\\nLastName:       Coolpiranha Hostmaster\\nFirstName:      \\nStreet:         344 Ive Centre\\nStreet:         7954 Transit Road\\nCity:           Williamsville\\nState/Prov:     NY\\nCountry:        US\\nPostalCode:     14221\\nRegDate:        2004-09-27\\nUpdated:        2011-01-18\\nOfficePhone:    +1-716-568-8137\\nMailbox:        hostmaster@coolpiranha-hosting.com\\nSource:         ARIN\\n"}
{"id": "RWL-20", "name": "Ranch WiFi LLC", "address": "", "street": "PO BOX 1869", "city": "Morro Bay", "state": "CA", "postalcode": "93442", "country": "US", "admin_id": "KORMA2-ARIN", "tech_id": "KORMA2-ARIN", "abuse_id": "KORMA2-ARIN", "mnt_id": "KORMA2-ARIN", "email": "", "domain": "ranchwifi.com", "created": "2014-03-18", "updated": "2022-05-02", "source": "arin", "raw": "OrgID:          RWL-20\\nOrgName:        Ranch WiFi LLC\\nCanAllocate:    \\nStreet:         PO BOX 1869\\nCity:           Morro Bay\\nState/Prov:     CA\\nCountry:        US\\nPostalCode:     93442\\nRegDate:        2014-03-18\\nUpdated:        2022-05-02\\nOrgAbuseHandle: KORMA2-ARIN\\nOrgAdminHandle: KORMA2-ARIN\\nOrgDNSHandle:   KORMA2-ARIN\\nOrgNOCHandle:   KORMA2-ARIN\\nOrgRoutingHandle:   KORMA2-ARIN\\nOrgTechHandle:  KORMA2-ARIN\\nSource:         ARIN\\n\n\nPOCHandle:      KORMA2-ARIN\\nIsRole:         N\\nLastName:       Korman\\nFirstName:      Ben\\nStreet:         P.O. Box 1869\\nCity:           Morro Bay\\nState/Prov:     CA\\nCountry:        US\\nPostalCode:     93433\\nRegDate:        2014-03-21\\nUpdated:        2021-10-27\\nOfficePhone:    +1-805-995-4181\\nFaxPhone:       +1-805-995-4181\\nMailbox:        info@ranchwifi.com\\nMailbox:        nick@ranchwifi.com\\nMailbox:        ben@ranchwifi.com\\nMailbox:        kyle@ranchwifi.com\\nSource:         ARIN\\n"}
{"id": "CASTL-58", "name": "Castlegem Inc.", "address": "", "street": "30 Wall Street", "city": "New York City", "state": "NY", "postalcode": "10005", "country": "US", "admin_id": "TRNKI1-ARIN", "tech_id": "TRNKI1-ARIN", "abuse_id": "TRNKI1-ARIN", "mnt_id": "TRNKI1-ARIN", "email": "", "domain": "castlegem.co.uk", "created": "2014-01-16", "updated": "2017-11-28", "source": "arin", "raw": "OrgID:          CASTL-58\\nOrgName:        Castlegem Inc.\\nCanAllocate:    \\nStreet:         30 Wall Street\\nCity:           New York City\\nState/Prov:     NY\\nCountry:        US\\nPostalCode:     10005\\nRegDate:        2014-01-16\\nUpdated:        2017-11-28\\nOrgAbuseHandle: TRNKI1-ARIN\\nOrgAdminHandle: TRNKI1-ARIN\\nOrgNOCHandle:   TRNKI1-ARIN\\nOrgTechHandle:  TRNKI1-ARIN\\nSource:         ARIN\\n\n\nPOCHandle:      TRNKI1-ARIN\\nIsRole:         N\\nLastName:       Trnkic\\nFirstName:      Marko\\nStreet:         30 Wall Street\\nCity:           New York City\\nState/Prov:     NY\\nCountry:        US\\nPostalCode:     10005\\nRegDate:        2017-11-28\\nUpdated:        2021-10-26\\nOfficePhone:    +1-646-374-2404\\nMailbox:        marko.trnkic@castlegem.co.uk\\nSource:         ARIN\\n"}
{"id": "GQVL", "name": "Gwaii Communications", "address": "", "street": "101 Causeway St\\nBox 880", "city": "Queen Charlotte", "state": "BC", "postalcode": "V0T 1S0", "country": "CA", "admin_id": "LAVOI9-ARIN", "tech_id": "LAVOI10-ARIN\\NPAZAR-ARIN", "abuse_id": "LAVOI10-ARIN", "mnt_id": "LAVOI10-ARIN", "email": "", "domain": "gwaiicomm.com", "created": "2017-11-08", "updated": "2020-02-06", "source": "arin", "raw": "OrgID:          GQVL\\nOrgName:        Gwaii Communications\\nCanAllocate:    \\nStreet:         101 Causeway St\\nStreet:         Box 880\\nCity:           Queen Charlotte\\nState/Prov:     BC\\nCountry:        CA\\nPostalCode:     V0T 1S0\\nComment:        www.gwaiicomm.com\\nRegDate:        2017-11-08\\nUpdated:        2020-02-06\\nOrgAbuseHandle: LAVOI10-ARIN\\nOrgAdminHandle: LAVOI9-ARIN\\nOrgNOCHandle:   LAVOI10-ARIN\\nOrgTechHandle:  LAVOI10-ARIN\\nOrgTechHandle:  PAZAR-ARIN\\nSource:         ARIN\\n\n\nPOCHandle:      PAZAR-ARIN\\nIsRole:         N\\nLastName:       Pazarena\\nFirstName:      Jim\\nStreet:         Box 655\\nStreet:         405 2nd Avenue\\nCity:           Queen Charlotte\\nState/Prov:     BC\\nCountry:        CA\\nPostalCode:     V0T 1S0\\nRegDate:        2013-10-09\\nUpdated:        2021-09-14\\nOfficePhone:    +1-778-786-0182\\nMailbox:        jim.pazarena@haidagwaii.net\\nSource:         ARIN\\n\n\nPOCHandle:      LAVOI10-ARIN\\nIsRole:         N\\nLastName:       Lavoie\\nFirstName:      Jeff\\nStreet:         101 Causeway St, Box 501\\nCity:           Queen Charlotte\\nState/Prov:     BC\\nCountry:        CA\\nPostalCode:     V0T 1S0\\nRegDate:        2017-09-05\\nUpdated:        2017-09-05\\nOfficePhone:    +1-250-559-7777\\nMailbox:        Jefflavoie@gwaiicomm.com\\nSource:         ARIN\\n\n\nPOCHandle:      LAVOI9-ARIN\\nIsRole:         N\\nLastName:       Lavoie\\nFirstName:      Joseph\\nStreet:         101 Causeway St, Box 501\\nCity:           Queen Charlotte\\nState/Prov:     BC\\nCountry:        CA\\nPostalCode:     V0T 1S0\\nRegDate:        2017-09-05\\nUpdated:        2019-10-25\\nOfficePhone:    +1-250-559-7777\\nMailbox:        josephlavoie@gwaiicomm.com\\nSource:         ARIN\\n"}
{"id": "LC-124", "name": "Lake Connections", "address": "", "street": "409 17th Ave\\nP.O. Box 517", "city": "Two Harbors", "state": "MN", "postalcode": "55616", "country": "US", "admin_id": "PTS7-ARIN", "tech_id": "MJH49-ARIN\\NPTS7-ARIN", "abuse_id": "PTS7-ARIN", "mnt_id": "PTS7-ARIN", "email": "", "domain": "smithblakeconnections.com", "created": "2013-02-19", "updated": "2020-07-23", "source": "arin", "raw": "OrgID:          LC-124\\nOrgName:        Lake Connections\\nCanAllocate:    \\nStreet:         409 17th Ave\\nStreet:         P.O. Box 517\\nCity:           Two Harbors\\nState/Prov:     MN\\nCountry:        US\\nPostalCode:     55616\\nRegDate:        2013-02-19\\nUpdated:        2020-07-23\\nOrgAbuseHandle: PTS7-ARIN\\nOrgAdminHandle: PTS7-ARIN\\nOrgNOCHandle:   PTS7-ARIN\\nOrgTechHandle:  MJH49-ARIN\\nOrgTechHandle:  PTS7-ARIN\\nSource:         ARIN\\n\n\nPOCHandle:      PTS7-ARIN\\nIsRole:         N\\nLastName:       Sampson\\nFirstName:      Phil\\nStreet:         15478 Mckay Road\\nCity:           Brainerd\\nState/Prov:     MN\\nCountry:        US\\nPostalCode:     56425\\nRegDate:        2010-09-01\\nUpdated:        2021-08-04\\nOfficePhone:    +1-218-831-2828\\nMailbox:        psampson@7sigma.com\\nMailbox:        psampson@7sigma.net\\nSource:         ARIN\\n\n\nPOCHandle:      MJH49-ARIN\\nIsRole:         N\\nLastName:       Hagerty\\nFirstName:      Mike\\nStreet:         3806 NW 2nd PL\\nCity:           Ankeny\\nState/Prov:     IA\\nCountry:        US\\nPostalCode:     50023\\nRegDate:        2013-01-09\\nUpdated:        2021-09-09\\nOfficePhone:    +1-515-650-0273\\nMailbox:        mhagerty@7sigma.com\\nSource:         ARIN\\n"}
{"id": "DMS-104", "name": "DMS", "address": "", "street": "841 Prudential Drive\\n12th Floor", "city": "Jacksonville", "state": "FL", "postalcode": "32207", "country": "US", "admin_id": "DCH251-ARIN", "tech_id": "DCH251-ARIN", "abuse_id": "DCA351-ARIN", "mnt_id": "DCH251-ARIN", "email": "", "domain": "dmsgs.com", "created": "2010-08-31", "updated": "2021-06-21", "source": "arin", "raw": "OrgID:          DMS-104\\nOrgName:        DMS\\nCanAllocate:    \\nStreet:         841 Prudential Drive\\nStreet:         12th Floor\\nCity:           Jacksonville\\nState/Prov:     FL\\nCountry:        US\\nPostalCode:     32207\\nRegDate:        2010-08-31\\nUpdated:        2021-06-21\\nOrgAbuseHandle: DCA351-ARIN\\nOrgAdminHandle: DCH251-ARIN\\nOrgNOCHandle:   DCH251-ARIN\\nOrgTechHandle:  DCH251-ARIN\\nSource:         ARIN\\n\n\nPOCHandle:      DCH251-ARIN\\nIsRole:         Y\\nLastName:       Data Canopy Hostmaster\\nFirstName:      \\nStreet:         10500 Little Patuxent Parkway\\nStreet:         Suite 303\\nCity:           Columbia\\nState/Prov:     MD\\nCountry:        US\\nPostalCode:     21044\\nRegDate:        2020-10-12\\nUpdated:        2021-11-01\\nOfficePhone:    +1-703-594-5200\\nMailbox:        dc_hostmaster@datacanopy.com\\nSource:         ARIN\\n\n\nPOCHandle:      DCA351-ARIN\\nIsRole:         Y\\nLastName:       Data Canopy Abuse\\nFirstName:      \\nStreet:         10500 Little Patuxent Parkway\\nStreet:         Suite 303\\nCity:           Columbia\\nState/Prov:     MD\\nCountry:        US\\nPostalCode:     21044\\nRegDate:        2020-10-12\\nUpdated:        2021-11-01\\nOfficePhone:    +1-703-594-5200\\nMailbox:        abuse@datacanopy.com\\nSource:         ARIN\\n"}
{"id": "CMG-115", "name": "Comnet Marketing Group, Inc.", "address": "", "street": "1214 Stowe Ave", "city": "Medford", "state": "OR", "postalcode": "97501", "country": "US", "admin_id": "HOUGH43-ARIN", "tech_id": "BOUGH6-ARIN\\NHOUGH43-ARIN", "abuse_id": "BOUGH6-ARIN", "mnt_id": "BOUGH6-ARIN", "email": "", "domain": "comnetmarketing.com", "created": "2013-11-12", "updated": "2017-02-23", "source": "arin", "raw": "OrgID:          CMG-115\\nOrgName:        Comnet Marketing Group, Inc.\\nCanAllocate:    \\nStreet:         1214 Stowe Ave\\nCity:           Medford\\nState/Prov:     OR\\nCountry:        US\\nPostalCode:     97501\\nComment:        http://comnetmarketing.com\\nRegDate:        2013-11-12\\nUpdated:        2017-02-23\\nOrgAbuseHandle: BOUGH6-ARIN\\nOrgAdminHandle: HOUGH43-ARIN\\nOrgNOCHandle:   BOUGH6-ARIN\\nOrgTechHandle:  BOUGH6-ARIN\\nOrgTechHandle:  HOUGH43-ARIN\\nSource:         ARIN\\n\n\nPOCHandle:      BOUGH6-ARIN\\nIsRole:         N\\nLastName:       Boughton\\nFirstName:      Matt\\nStreet:         PO Box 2690\\nCity:           White City\\nState/Prov:     OR\\nCountry:        US\\nPostalCode:     97503\\nRegDate:        2017-02-23\\nUpdated:        2019-04-17\\nOfficePhone:    +1-541-210-9906\\nMailbox:        mboughton@outernebula.com\\nSource:         ARIN\\n\n\nPOCHandle:      HOUGH43-ARIN\\nIsRole:         N\\nLastName:       Hough\\nFirstName:      Nancy\\nStreet:         1214 Stowe Ave\\nCity:           Medford\\nState/Prov:     OR\\nCountry:        US\\nPostalCode:     97501\\nRegDate:        2016-12-22\\nUpdated:        2016-12-22\\nOfficePhone:    +1-541-840-8824\\nMobilePhone:    +1-541-840-8824\\nMailbox:        nancy.hough@comnetmarketing.com\\nSource:         ARIN\\n"}
{"id": "WG-229", "name": "WEYCO GROUP, INC", "address": "", "street": "333 W ESTABROOK BLVD", "city": "GLENDALE", "state": "WI", "postalcode": "53212", "country": "US", "admin_id": "WILKE207-ARIN", "tech_id": "WILKE207-ARIN", "abuse_id": "WILKE207-ARIN", "mnt_id": "WILKE207-ARIN", "email": "", "domain": "weycogroup.com", "created": "2017-10-11", "updated": "2017-10-11", "source": "arin", "raw": "OrgID:          WG-229\\nOrgName:        WEYCO GROUP, INC\\nCanAllocate:    \\nStreet:         333 W ESTABROOK BLVD\\nCity:           GLENDALE\\nState/Prov:     WI\\nCountry:        US\\nPostalCode:     53212\\nRegDate:        2017-10-11\\nUpdated:        2017-10-11\\nOrgAbuseHandle: WILKE207-ARIN\\nOrgAdminHandle: WILKE207-ARIN\\nOrgNOCHandle:   WILKE207-ARIN\\nOrgTechHandle:  WILKE207-ARIN\\nSource:         ARIN\\n\n\nPOCHandle:      WILKE207-ARIN\\nIsRole:         N\\nLastName:       Wilke\\nFirstName:      Robert\\nStreet:         333 W Estabrook Blvd\\nCity:           Glendale\\nState/Prov:     WI\\nCountry:        US\\nPostalCode:     53212\\nRegDate:        2017-08-10\\nUpdated:        2022-06-01\\nOfficePhone:    +1-414-908-1600\\nMailbox:        sysadmin@weycogroup.com\\nSource:         ARIN\\n"}
{"id": "TC-1423", "name": "TelWare Corporation", "address": "", "street": "1824 Industrial Center Circle", "city": "Charlotte", "state": "NC", "postalcode": "28213", "country": "US", "admin_id": "CLONT11-ARIN", "tech_id": "CLONT11-ARIN\\NROBIN897-ARIN", "abuse_id": "CLONT11-ARIN\\NROBIN897-ARIN", "mnt_id": "CLONT11-ARIN\\NROBIN897-ARIN", "email": "", "domain": "telware.com", "created": "2017-10-05", "updated": "2018-09-13", "source": "arin", "raw": "OrgID:          TC-1423\\nOrgName:        TelWare Corporation\\nCanAllocate:    \\nStreet:         1824 Industrial Center Circle\\nCity:           Charlotte\\nState/Prov:     NC\\nCountry:        US\\nPostalCode:     28213\\nRegDate:        2017-10-05\\nUpdated:        2018-09-13\\nOrgAbuseHandle: CLONT11-ARIN\\nOrgAbuseHandle: ROBIN897-ARIN\\nOrgAdminHandle: CLONT11-ARIN\\nOrgNOCHandle:   CLONT11-ARIN\\nOrgNOCHandle:   ROBIN897-ARIN\\nOrgTechHandle:  CLONT11-ARIN\\nOrgTechHandle:  ROBIN897-ARIN\\nSource:         ARIN\\n\n\nPOCHandle:      CLONT11-ARIN\\nIsRole:         N\\nLastName:       Clontz\\nFirstName:      Scott\\nStreet:         1824 Industrial Center Circle\\nCity:           Charlotte\\nState/Prov:     NC\\nCountry:        US\\nPostalCode:     28213\\nRegDate:        2017-10-04\\nUpdated:        2020-10-06\\nOfficePhone:    +1-704-409-3112\\nMailbox:        sclontz@telware.com\\nSource:         ARIN\\n\n\nPOCHandle:      ROBIN897-ARIN\\nIsRole:         N\\nLastName:       Robinson\\nFirstName:      Sumner\\nStreet:         1824 Industrial Center Circle\\nCity:           Charlotte\\nState/Prov:     NC\\nCountry:        US\\nPostalCode:     28213\\nRegDate:        2018-09-13\\nUpdated:        2021-09-30\\nOfficePhone:    +1-704-409-3138\\nMailbox:        srobinson@telware.com\\nSource:         ARIN\\n"}
{"id": "MVCS-4", "name": "Mountain View Cold Storage, Inc.", "address": "", "street": "4275 Avenue 416", "city": "Reedley", "state": "CA", "postalcode": "93654", "country": "US", "admin_id": "COTTO7-ARIN", "tech_id": "ITJUS-ARIN", "abuse_id": "ITJUS-ARIN", "mnt_id": "ITJUS-ARIN", "email": "", "domain": "mountainviewfruit.com", "created": "2012-03-01", "updated": "2012-03-01", "source": "arin", "raw": "OrgID:          MVCS-4\\nOrgName:        Mountain View Cold Storage, Inc.\\nCanAllocate:    \\nStreet:         4275 Avenue 416\\nCity:           Reedley\\nState/Prov:     CA\\nCountry:        US\\nPostalCode:     93654\\nComment:        http://www.mountainviewfruit.com\\nComment:        p: 559-637-9933\\nComment:        M-F 8a-5p\\nRegDate:        2012-03-01\\nUpdated:        2012-03-01\\nOrgAbuseHandle: ITJUS-ARIN\\nOrgAdminHandle: COTTO7-ARIN\\nOrgNOCHandle:   ITJUS-ARIN\\nOrgTechHandle:  ITJUS-ARIN\\nSource:         ARIN\\n\n\nPOCHandle:      COTTO7-ARIN\\nIsRole:         N\\nLastName:       Cotton\\nFirstName:      Chad\\nStreet:         4275 Avenue 416\\nCity:           Reedley\\nState/Prov:     CA\\nCountry:        US\\nPostalCode:     93654\\nRegDate:        2012-02-29\\nUpdated:        2018-04-20\\nOfficePhone:    +1-559-637-9933\\nMailbox:        ccotton@summeripe.com\\nSource:         ARIN\\n\n\nPOCHandle:      ITJUS-ARIN\\nIsRole:         N\\nLastName:       IT\\nFirstName:      Justin\\nStreet:         4275 Avenue 416\\nCity:           Reedley\\nState/Prov:     CA\\nCountry:        US\\nPostalCode:     93654\\nRegDate:        2012-02-29\\nUpdated:        2014-03-18\\nOfficePhone:    +1-559-637-9933\\nMailbox:        jweems@mountainviewfruit.com\\nSource:         ARIN\\n"}
{"id": "DW-16", "name": "3dB Wireless, Inc", "address": "", "street": "5 Ravenscroft", "city": "Asheville", "state": "NC", "postalcode": "28801", "country": "US", "admin_id": "ADMIN5219-ARIN", "tech_id": "NOC31858-ARIN", "abuse_id": "DWAD-ARIN", "mnt_id": "NOC31858-ARIN", "email": "", "domain": "3dbwireless.com", "created": "2012-12-10", "updated": "2022-03-19", "source": "arin", "raw": "OrgID:          DW-16\\nOrgName:        3dB Wireless, Inc\\nCanAllocate:    \\nStreet:         5 Ravenscroft\\nCity:           Asheville\\nState/Prov:     NC\\nCountry:        US\\nPostalCode:     28801\\nRegDate:        2012-12-10\\nUpdated:        2022-03-19\\nOrgAbuseHandle: DWAD-ARIN\\nOrgAdminHandle: ADMIN5219-ARIN\\nOrgNOCHandle:   NOC31858-ARIN\\nOrgTechHandle:  NOC31858-ARIN\\nSource:         ARIN\\n\n\nPOCHandle:      DWAD-ARIN\\nIsRole:         Y\\nLastName:       3dB Wireless Abuse Dept\\nFirstName:      \\nStreet:         5 Ravenscroft\\nCity:           Asheville\\nState/Prov:     NC\\nCountry:        US\\nPostalCode:     28801\\nRegDate:        2014-04-29\\nUpdated:        2021-04-07\\nFaxPhone:       +1-888-788-4059\\nOfficePhone:    +1-828-258-8562\\nMailbox:        network@skyrunner.net\\nSource:         ARIN\\n\n\nPOCHandle:      ADMIN5219-ARIN\\nIsRole:         Y\\nLastName:       Admin\\nFirstName:      \\nStreet:         5 Ravenscroft\\nCity:           Asheville\\nState/Prov:     NC\\nCountry:        US\\nPostalCode:     28801\\nRegDate:        2014-04-30\\nUpdated:        2021-04-07\\nOfficePhone:    +1-828-258-8562\\nFaxPhone:       +1-888-788-4059\\nMailbox:        network@skyrunner.net\\nSource:         ARIN\\n\n\nPOCHandle:      NOC31858-ARIN\\nIsRole:         Y\\nLastName:       NOC\\nFirstName:      \\nStreet:         5 Ravenscroft\\nCity:           Asheville\\nState/Prov:     NC\\nCountry:        US\\nPostalCode:     28801\\nRegDate:        2014-04-29\\nUpdated:        2022-03-18\\nOfficePhone:    +1-828-258-8562\\nMailbox:        noc@skyrunner.net\\nSource:         ARIN\\n"}
{"id": "JWTCL", "name": "teknet", "address": "", "street": "2600 n central ave\\n1100", "city": "phoenix", "state": "AZ", "postalcode": "85004", "country": "US", "admin_id": "JMW102-ARIN", "tech_id": "JMW102-ARIN", "abuse_id": "JMW102-ARIN", "mnt_id": "JMW102-ARIN", "email": "", "domain": "teknetix.com", "created": "2019-11-04", "updated": "2020-01-29", "source": "arin", "raw": "OrgID:          JWTCL\\nOrgName:        teknet\\nCanAllocate:    \\nStreet:         2600 n central ave\\nStreet:         1100\\nCity:           phoenix\\nState/Prov:     AZ\\nCountry:        US\\nPostalCode:     85004\\nComment:        Teknet WISP\\nRegDate:        2019-11-04\\nUpdated:        2020-01-29\\nOrgAbuseHandle: JMW102-ARIN\\nOrgAdminHandle: JMW102-ARIN\\nOrgDNSHandle:   JMW102-ARIN\\nOrgNOCHandle:   JMW102-ARIN\\nOrgRoutingHandle:   JMW102-ARIN\\nOrgTechHandle:  JMW102-ARIN\\nSource:         ARIN\\n\n\nPOCHandle:      JMW102-ARIN\\nIsRole:         N\\nLastName:       Weidman\\nFirstName:      Joshua \\nStreet:         2600 N Central Suite 1100\\nCity:           Phoenix\\nState/Prov:     AZ\\nCountry:        US\\nPostalCode:     85004\\nRegDate:        2019-11-01\\nUpdated:        2021-03-02\\nOfficePhone:    +1-602-300-1741\\nMailbox:        josh@mytekcompass.com\\nSource:         ARIN\\n"}
{"id": "MARKE-84", "name": "MARKETAXESS HOLDINGS, INC.", "address": "", "street": "299 Park Avenue, 10th Floor", "city": "NEW YORK", "state": "NY", "postalcode": "10171", "country": "US", "admin_id": "COK7-ARIN", "tech_id": "NEMH-ARIN", "abuse_id": "NEMH-ARIN", "mnt_id": "NEMH-ARIN", "email": "", "domain": "marketaxess.com", "created": "2008-04-15", "updated": "2010-06-17", "source": "arin", "raw": "OrgID:          MARKE-84\\nOrgName:        MARKETAXESS HOLDINGS, INC.\\nCanAllocate:    \\nStreet:         299 Park Avenue, 10th Floor\\nCity:           NEW YORK\\nState/Prov:     NY\\nCountry:        US\\nPostalCode:     10171\\nRegDate:        2008-04-15\\nUpdated:        2010-06-17\\nOrgAbuseHandle: NEMH-ARIN\\nOrgAdminHandle: COK7-ARIN\\nOrgNOCHandle:   NEMH-ARIN\\nOrgTechHandle:  NEMH-ARIN\\nSource:         ARIN\\n\n\nPOCHandle:      COK7-ARIN\\nIsRole:         N\\nLastName:       OKOCHU\\nFirstName:      CHARLES\\nStreet:         299 Park Avenue, 10th Floor\\nCity:           NEW YORK\\nState/Prov:     NY\\nCountry:        US\\nPostalCode:     10171\\nRegDate:        2008-03-13\\nUpdated:        2017-12-22\\nOfficePhone:    +1-212-813-6111\\nOfficePhone:    +1-212-813-6210\\nFaxPhone:       +1-212-813-6390\\nMobilePhone:    +1-212-655-3100\\nMailbox:        COKOCHU@marketaxess.com\\nSource:         ARIN\\n\n\nPOCHandle:      NEMH-ARIN\\nIsRole:         Y\\nLastName:       Network Engineering - MarketAxess Holdings inc\\nFirstName:      \\nStreet:         55 Hudson Yards\\nCity:           NEW YORK\\nState/Prov:     NY\\nCountry:        US\\nPostalCode:     10001\\nRegDate:        2008-03-13\\nUpdated:        2022-03-14\\nOfficePhone:    +1-212-813-6111\\nFaxPhone:       +1-212-813-6390\\nMailbox:        NETWORK@marketaxess.com\\nSource:         ARIN\\n"}
{"id": "PL-613", "name": "PeerTap LLC", "address": "", "street": "4339 Hartley Bridge Rd\\n8", "city": "Macon", "state": "GA", "postalcode": "31216", "country": "US", "admin_id": "PREST51-ARIN", "tech_id": "PREST51-ARIN", "abuse_id": "PREST51-ARIN", "mnt_id": "PREST51-ARIN", "email": "", "domain": "tucker.pw", "created": "2016-08-31", "updated": "2016-08-31", "source": "arin", "raw": "OrgID:          PL-613\\nOrgName:        PeerTap LLC\\nCanAllocate:    \\nStreet:         4339 Hartley Bridge Rd\\nStreet:         8\\nCity:           Macon\\nState/Prov:     GA\\nCountry:        US\\nPostalCode:     31216\\nComment:        PeerTap Anycast\\nRegDate:        2016-08-31\\nUpdated:        2016-08-31\\nOrgAbuseHandle: PREST51-ARIN\\nOrgAdminHandle: PREST51-ARIN\\nOrgNOCHandle:   PREST51-ARIN\\nOrgTechHandle:  PREST51-ARIN\\nSource:         ARIN\\n\n\nPOCHandle:      PREST51-ARIN\\nIsRole:         N\\nLastName:       Preston\\nFirstName:      Tucker\\nStreet:         4339 Hartley Bridge Rd\\nStreet:         Suite #161\\nCity:           Macon\\nState/Prov:     GA\\nCountry:        US\\nPostalCode:     31216\\nRegDate:        2015-04-06\\nUpdated:        2020-02-19\\nOfficePhone:    +1-331-444-2656\\nMailbox:        tucker@tucker.pw\\nSource:         ARIN\\n"}
{"id": "QFL-5", "name": "Query Foundry, LLC", "address": "", "street": "1821 Logan Avenue", "city": "Cheyenne", "state": "WY", "postalcode": "82001", "country": "US", "admin_id": "QFMAN-ARIN", "tech_id": "QFNOC-ARIN", "abuse_id": "QAT1-ARIN", "mnt_id": "QFNOC-ARIN", "email": "", "domain": "queryfoundry.com", "created": "2013-07-19", "updated": "2015-01-11", "source": "arin", "raw": "OrgID:          QFL-5\\nOrgName:        Query Foundry, LLC\\nCanAllocate:    \\nStreet:         1821 Logan Avenue\\nCity:           Cheyenne\\nState/Prov:     WY\\nCountry:        US\\nPostalCode:     82001\\nComment:        https://queryfoundry.com/\\nRegDate:        2013-07-19\\nUpdated:        2015-01-11\\nOrgAbuseHandle: QAT1-ARIN\\nOrgAdminHandle: QFMAN-ARIN\\nOrgNOCHandle:   QFNOC-ARIN\\nOrgTechHandle:  QFNOC-ARIN\\nSource:         ARIN\\n\n\nPOCHandle:      QAT1-ARIN\\nIsRole:         Y\\nLastName:       QF Abuse Team\\nFirstName:      \\nStreet:         1950 North Stemmons Freeway\\nCity:           Dallas\\nState/Prov:     TX\\nCountry:        US\\nPostalCode:     75207\\nRegDate:        2015-01-11\\nUpdated:        2017-07-02\\nOfficePhone:    +1-720-230-7000\\nMailbox:        ipabuse@queryfoundry.com\\nSource:         ARIN\\n\n\nPOCHandle:      QFNOC-ARIN\\nIsRole:         Y\\nLastName:       QF NOC\\nFirstName:      \\nStreet:         1950 North Stemmons Freeway\\nCity:           Dallas\\nState/Prov:     TX\\nCountry:        US\\nPostalCode:     75207\\nRegDate:        2015-01-11\\nUpdated:        2017-01-10\\nOfficePhone:    +1-720-230-7000\\nMailbox:        noc@queryfoundry.com\\nSource:         ARIN\\n\n\nPOCHandle:      QFMAN-ARIN\\nIsRole:         Y\\nLastName:       QF Management\\nFirstName:      \\nStreet:         1950 North Stemmons Freeway\\nCity:           Dallas\\nState/Prov:     TX\\nCountry:        US\\nPostalCode:     75207\\nRegDate:        2015-01-11\\nUpdated:        2017-01-10\\nOfficePhone:    +1-720-230-7000\\nMailbox:        admin@queryfoundry.com\\nSource:         ARIN\\n"}
{"id": "AIUL", "name": "AusRegistry International (U.S.A.) LLC", "address": "", "street": "5267 Warner Avenue, Suite 176", "city": "Huntington Beach", "state": "CA", "postalcode": "92649", "country": "US", "admin_id": "NETWO9051-ARIN", "tech_id": "NETWO9051-ARIN", "abuse_id": "NETWO9051-ARIN", "mnt_id": "NETWO9051-ARIN", "email": "", "domain": "neustar.biz", "created": "2011-02-07", "updated": "2019-10-03", "source": "arin", "raw": "OrgID:          AIUL\\nOrgName:        AusRegistry International (U.S.A.) LLC\\nCanAllocate:    \\nStreet:         5267 Warner Avenue, Suite 176\\nCity:           Huntington Beach\\nState/Prov:     CA\\nCountry:        US\\nPostalCode:     92649\\nRegDate:        2011-02-07\\nUpdated:        2019-10-03\\nOrgAbuseHandle: NETWO9051-ARIN\\nOrgAdminHandle: NETWO9051-ARIN\\nOrgNOCHandle:   NETWO9051-ARIN\\nOrgTechHandle:  NETWO9051-ARIN\\nSource:         ARIN\\n\n\nPOCHandle:      NETWO9051-ARIN\\nIsRole:         Y\\nLastName:       Network Engineer\\nFirstName:      \\nStreet:         10 Queens Rd\\nCity:           Melbourne\\nState/Prov:     \\nCountry:        AU\\nPostalCode:     \\nRegDate:        2019-10-03\\nUpdated:        2019-10-03\\nOfficePhone:    +61398663710\\nMailbox:        aunetworkoperators@neustar.biz\\nSource:         ARIN\\n"}
{"id": "NIS-89", "name": "Network Integration Services, Inc.", "address": "", "street": "17795 W. 106th St.\\nSte. 200", "city": "Olathe", "state": "KS", "postalcode": "66061", "country": "US", "admin_id": "CLOUD44-ARIN", "tech_id": "CLOUD44-ARIN", "abuse_id": "CLOUD44-ARIN", "mnt_id": "NOC2264-ARIN", "email": "", "domain": "nis1.com", "created": "2000-08-22", "updated": "2015-08-13", "source": "arin", "raw": "OrgID:          NIS-89\\nOrgName:        Network Integration Services, Inc.\\nCanAllocate:    \\nStreet:         17795 W. 106th St.\\nStreet:         Ste. 200\\nCity:           Olathe\\nState/Prov:     KS\\nCountry:        US\\nPostalCode:     66061\\nRegDate:        2000-08-22\\nUpdated:        2015-08-13\\nOrgAbuseHandle: CLOUD44-ARIN\\nOrgAdminHandle: CLOUD44-ARIN\\nOrgNOCHandle:   NOC2264-ARIN\\nOrgTechHandle:  CLOUD44-ARIN\\nSource:         ARIN\\n\n\nPOCHandle:      NOC2264-ARIN\\nIsRole:         Y\\nLastName:       Network Operations Center\\nFirstName:      \\nStreet:         17795 W 106th Street\\nStreet:         Suite 200\\nCity:           Olathe\\nState/Prov:     KS\\nCountry:        US\\nPostalCode:     66061\\nRegDate:        2006-09-20\\nUpdated:        2016-08-15\\nOfficePhone:    +1-913-339-2300\\nMobilePhone:    +1-913-339-2301\\nMailbox:        nocnotify@aos5.com\\nMailbox:        dl-cloud-network-team@aos5.com\\nMailbox:        noc@aos5.com\\nSource:         ARIN\\n\n\nPOCHandle:      CLOUD44-ARIN\\nIsRole:         Y\\nLastName:       Cloud Engineer\\nFirstName:      \\nStreet:         17795 106th Street\\nCity:           Olathe\\nState/Prov:     KS\\nCountry:        US\\nPostalCode:     64081\\nRegDate:        2015-08-12\\nUpdated:        2016-08-15\\nOfficePhone:    +1-913-339-2300\\nMailbox:        dl-cloud-network-team@aos5.com\\nSource:         ARIN\\n"}
{"id": "BAMA", "name": "Build America Mutual Assurance Company", "address": "", "street": "1 World Financial Center\\n21st floor", "city": "New York", "state": "NY", "postalcode": "10281", "country": "US", "admin_id": "MCINT22-ARIN", "tech_id": "MCINT22-ARIN", "abuse_id": "MCINT22-ARIN", "mnt_id": "MCINT22-ARIN", "email": "", "domain": "buildamerica.com", "created": "2012-08-13", "updated": "2012-08-13", "source": "arin", "raw": "OrgID:          BAMA\\nOrgName:        Build America Mutual Assurance Company\\nCanAllocate:    \\nStreet:         1 World Financial Center\\nStreet:         21st floor\\nCity:           New York\\nState/Prov:     NY\\nCountry:        US\\nPostalCode:     10281\\nRegDate:        2012-08-13\\nUpdated:        2012-08-13\\nOrgAbuseHandle: MCINT22-ARIN\\nOrgAdminHandle: MCINT22-ARIN\\nOrgNOCHandle:   MCINT22-ARIN\\nOrgTechHandle:  MCINT22-ARIN\\nSource:         ARIN\\n\n\nPOCHandle:      MCINT22-ARIN\\nIsRole:         N\\nLastName:       McIntyre\\nFirstName:      David\\nStreet:         200 Liberty Street\\nCity:           New York\\nState/Prov:     NY\\nCountry:        US\\nPostalCode:     10281\\nRegDate:        2011-12-01\\nUpdated:        2017-12-01\\nOfficePhone:    +1-212-365-7553\\nFaxPhone:       +1-212-365-7553\\nMobilePhone:    +1-908-451-0650\\nMailbox:        dmcintyre@buildamerica.com\\nSource:         ARIN\\n"}
{"id": "SH-903", "name": "Skyscanner Holdings Inc.", "address": "", "street": "Corporation Trust Center,\\n1209 Orange Street,\\nWilmington", "city": "New Castle County", "state": "DE", "postalcode": "19801", "country": "US", "admin_id": "NOC32947-ARIN", "tech_id": "NOC32947-ARIN", "abuse_id": "NOC32947-ARIN", "mnt_id": "NOC32947-ARIN", "email": "", "domain": "skyscanner.net", "created": "2019-05-28", "updated": "2019-05-28", "source": "arin", "raw": "OrgID:          SH-903\\nOrgName:        Skyscanner Holdings Inc.\\nCanAllocate:    \\nStreet:         Corporation Trust Center,\\nStreet:         1209 Orange Street,\\nStreet:         Wilmington\\nCity:           New Castle County\\nState/Prov:     DE\\nCountry:        US\\nPostalCode:     19801\\nRegDate:        2019-05-28\\nUpdated:        2019-05-28\\nOrgAbuseHandle: NOC32947-ARIN\\nOrgAdminHandle: NOC32947-ARIN\\nOrgNOCHandle:   NOC32947-ARIN\\nOrgTechHandle:  NOC32947-ARIN\\nSource:         ARIN\\n\n\nPOCHandle:      NOC32947-ARIN\\nIsRole:         Y\\nLastName:       NOC\\nFirstName:      \\nStreet:         Floor 6\\nStreet:         The Avenue\\nStreet:         1 Bedford Avenue\\nCity:           London\\nState/Prov:     London\\nCountry:        GB\\nPostalCode:     WC1B 3AU\\nRegDate:        2019-02-18\\nUpdated:        2021-08-30\\nOfficePhone:    +44131 252 5353.\\nMailbox:        arin-management@skyscanner.net\\nSource:         ARIN\\n"}
{"id": "NMSL-6", "name": "Nu-Age Managed Services, LLC", "address": "", "street": "PO Box", "city": "Palisades", "state": "NY", "postalcode": "10964", "country": "US", "admin_id": "NOC11611-ARIN", "tech_id": "NOC11611-ARIN", "abuse_id": "NOC11611-ARIN", "mnt_id": "NOC11611-ARIN", "email": "", "domain": "nuageindustries.com", "created": "2010-11-19", "updated": "2010-11-19", "source": "arin", "raw": "OrgID:          NMSL-6\\nOrgName:        Nu-Age Managed Services, LLC\\nCanAllocate:    \\nStreet:         PO Box\\nCity:           Palisades\\nState/Prov:     NY\\nCountry:        US\\nPostalCode:     10964\\nRegDate:        2010-11-19\\nUpdated:        2010-11-19\\nOrgAbuseHandle: NOC11611-ARIN\\nOrgAdminHandle: NOC11611-ARIN\\nOrgNOCHandle:   NOC11611-ARIN\\nOrgTechHandle:  NOC11611-ARIN\\nSource:         ARIN\\n\n\nPOCHandle:      NOC11611-ARIN\\nIsRole:         Y\\nLastName:       NOC\\nFirstName:      \\nStreet:         2 Blue Hill Plaza\\nStreet:         PO Box 1543\\nCity:           Pearl River\\nState/Prov:     NY\\nCountry:        US\\nPostalCode:     10965\\nRegDate:        2010-09-02\\nUpdated:        2022-02-21\\nMobilePhone:    +1-845-825-7559\\nFaxPhone:       +1-845-735-4213\\nOfficePhone:    +1-845-680-0700\\nMailbox:        achillino@nuageindustries.com\\nSource:         ARIN\\n"}
{"id": "MTI-31", "name": "Medical Teams International", "address": "", "street": "14150 SW Milton Ct", "city": "Tigard", "state": "OR", "postalcode": "97224", "country": "US", "admin_id": "TUCKR-ARIN", "tech_id": "TUCKR-ARIN", "abuse_id": "TUCKR-ARIN", "mnt_id": "TUCKR-ARIN", "email": "", "domain": "medicalteams.org", "created": "2012-12-21", "updated": "2014-12-23", "source": "arin", "raw": "OrgID:          MTI-31\\nOrgName:        Medical Teams International\\nCanAllocate:    \\nStreet:         14150 SW Milton Ct\\nCity:           Tigard\\nState/Prov:     OR\\nCountry:        US\\nPostalCode:     97224\\nRegDate:        2012-12-21\\nUpdated:        2014-12-23\\nOrgAbuseHandle: TUCKR-ARIN\\nOrgAdminHandle: TUCKR-ARIN\\nOrgNOCHandle:   TUCKR-ARIN\\nOrgTechHandle:  TUCKR-ARIN\\nSource:         ARIN\\n\n\nPOCHandle:      TUCKR-ARIN\\nIsRole:         N\\nLastName:       Tuck\\nFirstName:      Robert\\nStreet:         14150 SW Milton Ct\\nCity:           Tigard\\nState/Prov:     OR\\nCountry:        US\\nPostalCode:     97224\\nRegDate:        2014-12-23\\nUpdated:        2015-12-23\\nMobilePhone:    +1-503-624-1000\\nOfficePhone:    +1-503-624-1000\\nFaxPhone:       +1-503-624-1000\\nMailbox:        rtuck@medicalteams.org\\nSource:         ARIN\\n"}
{"id": "NS", "name": "Need Servers Inc", "address": "", "street": "Suite 105,\\n501 Silver side Road", "city": "Wilmington", "state": "DE", "postalcode": "19809", "country": "US", "admin_id": "NETWO4135-ARIN", "tech_id": "NETWO4135-ARIN", "abuse_id": "NETWO4135-ARIN", "mnt_id": "NETWO4135-ARIN", "email": "", "domain": "directi.com", "created": "2011-01-25", "updated": "2011-01-26", "source": "arin", "raw": "OrgID:          NS\\nOrgName:        Need Servers Inc\\nCanAllocate:    \\nStreet:         Suite 105, \\nStreet:         501 Silver side Road\\nCity:           Wilmington\\nState/Prov:     DE\\nCountry:        US\\nPostalCode:     19809\\nRegDate:        2011-01-25\\nUpdated:        2011-01-26\\nOrgAbuseHandle: NETWO4135-ARIN\\nOrgAdminHandle: NETWO4135-ARIN\\nOrgNOCHandle:   NETWO4135-ARIN\\nOrgTechHandle:  NETWO4135-ARIN\\nSource:         ARIN\\n\n\nPOCHandle:      NETWO4135-ARIN\\nIsRole:         N\\nLastName:       Network\\nFirstName:      Admin\\nStreet:         Suite 105, 501 Silverside Road\\nCity:           Wilmington\\nState/Prov:     DE\\nCountry:        US\\nPostalCode:     19809\\nRegDate:        2011-01-19\\nUpdated:        2011-01-24\\nOfficePhone:    +1-512-797-0839\\nMailbox:        it.purchase@directi.com\\nSource:         ARIN\\n"}
{"id": "ASA-127", "name": "American Speech-Language-Hearing Association", "address": "", "street": "2200 Research Blvd", "city": "Rockville", "state": "MD", "postalcode": "20850", "country": "US", "admin_id": "EKL10-ARIN", "tech_id": "EKL10-ARIN", "abuse_id": "EKL10-ARIN", "mnt_id": "EKL10-ARIN", "email": "", "domain": "asha.org", "created": "2015-03-20", "updated": "2015-03-20", "source": "arin", "raw": "OrgID:          ASA-127\\nOrgName:        American Speech-Language-Hearing Association\\nCanAllocate:    \\nStreet:         2200 Research Blvd\\nCity:           Rockville\\nState/Prov:     MD\\nCountry:        US\\nPostalCode:     20850\\nRegDate:        2015-03-20\\nUpdated:        2015-03-20\\nReferralServer: rwhois://www.asha.org:80\\nOrgAbuseHandle: EKL10-ARIN\\nOrgAdminHandle: EKL10-ARIN\\nOrgNOCHandle:   EKL10-ARIN\\nOrgTechHandle:  EKL10-ARIN\\nSource:         ARIN\\n\n\nPOCHandle:      EKL10-ARIN\\nIsRole:         N\\nLastName:       Lewis\\nFirstName:      Eileen\\nStreet:         2200 Research Blvd\\nCity:           Rockville\\nState/Prov:     MD\\nCountry:        US\\nPostalCode:     20850\\nRegDate:        2015-03-09\\nUpdated:        2022-03-30\\nOfficePhone:    +1-301-296-8661\\nMobilePhone:    +1-240-351-8437\\nMailbox:        elewis@asha.org\\nSource:         ARIN\\n"}
{"id": "BSC-204", "name": "Borough of State College", "address": "", "street": "243 South Allen Street", "city": "State College", "state": "PA", "postalcode": "16801", "country": "US", "admin_id": "BOWSE76-ARIN", "tech_id": "BOWSE76-ARIN", "abuse_id": "BOWSE76-ARIN", "mnt_id": "BOWSE76-ARIN", "email": "", "domain": "statecollegepa.us", "created": "2019-02-12", "updated": "2019-02-12", "source": "arin", "raw": "OrgID:          BSC-204\\nOrgName:        Borough of State College\\nCanAllocate:    \\nStreet:         243 South Allen Street\\nCity:           State College\\nState/Prov:     PA\\nCountry:        US\\nPostalCode:     16801\\nRegDate:        2019-02-12\\nUpdated:        2019-02-12\\nOrgAbuseHandle: BOWSE76-ARIN\\nOrgAdminHandle: BOWSE76-ARIN\\nOrgNOCHandle:   BOWSE76-ARIN\\nOrgTechHandle:  BOWSE76-ARIN\\nSource:         ARIN\\n\n\nPOCHandle:      BOWSE76-ARIN\\nIsRole:         N\\nLastName:       Bowser\\nFirstName:      Craig\\nStreet:         243 South Allen Street\\nCity:           State College\\nState/Prov:     PA\\nCountry:        US\\nPostalCode:     16801\\nRegDate:        2018-07-09\\nUpdated:        2021-12-28\\nOfficePhone:    +1-814-278-4759\\nMailbox:        cbowser@statecollegepa.us\\nSource:         ARIN\\n"}
{"id": "MWSC", "name": "Missouri Western State University", "address": "", "street": "4525 Downs Drive", "city": "St. Joseph", "state": "MO", "postalcode": "64507", "country": "US", "admin_id": "NCF-ARIN", "tech_id": "NCF-ARIN", "abuse_id": "NCF-ARIN", "mnt_id": "NCF-ARIN", "email": "", "domain": "missouriwestern.edu", "created": "1991-06-07", "updated": "2020-06-17", "source": "arin", "raw": "OrgID:          MWSC\\nOrgName:        Missouri Western State University\\nCanAllocate:    \\nStreet:         4525 Downs Drive\\nCity:           St. Joseph\\nState/Prov:     MO\\nCountry:        US\\nPostalCode:     64507\\nRegDate:        1991-06-07\\nUpdated:        2020-06-17\\nOrgAbuseHandle: NCF-ARIN\\nOrgAdminHandle: NCF-ARIN\\nOrgNOCHandle:   NCF-ARIN\\nOrgTechHandle:  NCF-ARIN\\nSource:         ARIN\\n\n\nPOCHandle:      NCF-ARIN\\nIsRole:         N\\nLastName:       Nesslage\\nFirstName:      Frederick\\nStreet:         4525 Downs Drive\\nCity:           Saint Joseph\\nState/Prov:     MO\\nCountry:        US\\nPostalCode:     64507\\nRegDate:        2002-09-03\\nUpdated:        2022-03-04\\nOfficePhone:    +1-816-271-4564\\nMailbox:        nesslage@missouriwestern.edu\\nSource:         ARIN\\n"}
{"id": "NPU-4", "name": "North Park University", "address": "", "street": "3225 W. Foster Ave", "city": "Chicago", "state": "IL", "postalcode": "60625", "country": "US", "admin_id": "LUNDB9-ARIN", "tech_id": "CLARK404-ARIN", "abuse_id": "CLARK404-ARIN", "mnt_id": "CLARK404-ARIN", "email": "", "domain": "northpark.edu", "created": "2014-09-03", "updated": "2018-01-22", "source": "arin", "raw": "OrgID:          NPU-4\\nOrgName:        North Park University\\nCanAllocate:    \\nStreet:         3225 W. Foster Ave\\nCity:           Chicago\\nState/Prov:     IL\\nCountry:        US\\nPostalCode:     60625\\nRegDate:        2014-09-03\\nUpdated:        2018-01-22\\nOrgAbuseHandle: CLARK404-ARIN\\nOrgAdminHandle: LUNDB9-ARIN\\nOrgNOCHandle:   CLARK404-ARIN\\nOrgTechHandle:  CLARK404-ARIN\\nSource:         ARIN\\n\n\nPOCHandle:      LUNDB9-ARIN\\nIsRole:         N\\nLastName:       Lundblad\\nFirstName:      Jeff\\nStreet:         3225 W. Foster Ave\\nCity:           Chicago\\nState/Prov:     IL\\nCountry:        US\\nPostalCode:     60625\\nRegDate:        2014-09-02\\nUpdated:        2017-01-24\\nOfficePhone:    +1-773-244-5542\\nMailbox:        jlundblad@northpark.edu\\nSource:         ARIN\\n\n\nPOCHandle:      CLARK404-ARIN\\nIsRole:         N\\nLastName:       Clark\\nFirstName:      Steven\\nStreet:         3225 W. Foster Ave\\nCity:           Chicago\\nState/Prov:     IL\\nCountry:        US\\nPostalCode:     60625\\nRegDate:        2014-08-19\\nUpdated:        2016-09-02\\nOfficePhone:    +1-773-244-5773\\nMailbox:        sclark@northpark.edu\\nSource:         ARIN\\n"}
{"id": "RL-272", "name": "RhythmOne, LLC", "address": "", "street": "3600 136th Pl SE\\nSuite 400", "city": "Bellevue", "state": "WA", "postalcode": "98058", "country": "US", "admin_id": "NETWO9521-ARIN", "tech_id": "NETWO9521-ARIN", "abuse_id": "NETWO9521-ARIN", "mnt_id": "NETWO9521-ARIN", "email": "", "domain": "rhythmone.com", "created": "2015-03-20", "updated": "2021-08-02", "source": "arin", "raw": "OrgID:          RL-272\\nOrgName:        RhythmOne, LLC\\nCanAllocate:    \\nStreet:         3600 136th Pl SE\\nStreet:         Suite 400\\nCity:           Bellevue\\nState/Prov:     WA\\nCountry:        US\\nPostalCode:     98058\\nComment:        Standard NOC hours are 8am to 11pm EST\\nRegDate:        2015-03-20\\nUpdated:        2021-08-02\\nOrgAbuseHandle: NETWO9521-ARIN\\nOrgAdminHandle: NETWO9521-ARIN\\nOrgDNSHandle:   NETWO9521-ARIN\\nOrgNOCHandle:   NETWO9521-ARIN\\nOrgRoutingHandle:   NETWO9521-ARIN\\nOrgTechHandle:  NETWO9521-ARIN\\nSource:         ARIN\\n\n\nPOCHandle:      NETWO9521-ARIN\\nIsRole:         Y\\nLastName:       Network Engineering\\nFirstName:      \\nStreet:         1177 AVENUE OF THE AMERICAS, 9TH FL\\nCity:           New York\\nState/Prov:     NY\\nCountry:        US\\nPostalCode:     10036\\nRegDate:        2021-08-02\\nUpdated:        2022-08-03\\nOfficePhone:    +1-425-279-1200\\nMailbox:        neteng@tremorvideo.com\\nSource:         ARIN\\n"}
{"id": "BNA-39", "name": "BUREAU OF NATIONAL AFFAIRS, INC.", "address": "", "street": "1801 S. Bell St.", "city": "Arlington", "state": "VA", "postalcode": "22202", "country": "US", "admin_id": "KIMSE42-ARIN", "tech_id": "CURRI81-ARIN\\NKIMSE38-ARIN\\NKIMSE42-ARIN", "abuse_id": "CURRI81-ARIN\\NKIMSE38-ARIN", "mnt_id": "CURRI81-ARIN\\NKIMSE38-ARIN", "email": "", "domain": "bna.com", "created": "1997-10-16", "updated": "2021-01-28", "source": "arin", "raw": "OrgID:          BNA-39\\nOrgName:        BUREAU OF NATIONAL AFFAIRS, INC.\\nCanAllocate:    \\nStreet:         1801 S. Bell St.\\nCity:           Arlington\\nState/Prov:     VA\\nCountry:        US\\nPostalCode:     22202\\nRegDate:        1997-10-16\\nUpdated:        2021-01-28\\nOrgAbuseHandle: CURRI81-ARIN\\nOrgAbuseHandle: KIMSE38-ARIN\\nOrgAdminHandle: KIMSE42-ARIN\\nOrgNOCHandle:   CURRI81-ARIN\\nOrgNOCHandle:   KIMSE38-ARIN\\nOrgTechHandle:  CURRI81-ARIN\\nOrgTechHandle:  KIMSE38-ARIN\\nOrgTechHandle:  KIMSE42-ARIN\\nSource:         ARIN\\n\n\nPOCHandle:      KIMSE42-ARIN\\nIsRole:         N\\nLastName:       Kim\\nFirstName:      Seung\\nStreet:         1801 S. Bell Street\\nCity:           Crystal City\\nState/Prov:     VA\\nCountry:        US\\nPostalCode:     22202\\nRegDate:        2021-01-27\\nUpdated:        2021-01-27\\nOfficePhone:    +1-703-341-2936\\nMailbox:        skim@bloombergindustry.com\\nSource:         ARIN\\n\n\nPOCHandle:      CURRI81-ARIN\\nIsRole:         N\\nLastName:       Currie\\nFirstName:      Adam\\nStreet:         1801 South Bell Street\\nCity:           Arlington\\nState/Prov:     VA\\nCountry:        US\\nPostalCode:     22202\\nRegDate:        2019-01-10\\nUpdated:        2021-01-27\\nOfficePhone:    +1-703-341-3241\\nMailbox:        acurrie@bna.com\\nSource:         ARIN\\n\n\nPOCHandle:      KIMSE38-ARIN\\nIsRole:         N\\nLastName:       Kim\\nFirstName:      Seung\\nStreet:         1801 S Bell St.\\nCity:           Arlington\\nState/Prov:     VA\\nCountry:        US\\nPostalCode:     22202\\nRegDate:        2018-12-12\\nUpdated:        2021-12-13\\nOfficePhone:    +1-703-341-2936\\nMailbox:        skim@bloomberglaw.com\\nSource:         ARIN\\n"}
{"id": "LINOD", "name": "Linode", "address": "", "street": "249 Arch St", "city": "Philadelphia", "state": "PA", "postalcode": "19106", "country": "US", "admin_id": "LNO21-ARIN", "tech_id": "LNO21-ARIN", "abuse_id": "LAS12-ARIN", "mnt_id": "LNO21-ARIN", "email": "", "domain": "linode.com", "created": "2008-04-24", "updated": "2019-06-28", "source": "arin", "raw": "OrgID:          LINOD\\nOrgName:        Linode\\nCanAllocate:    \\nStreet:         249 Arch St\\nCity:           Philadelphia\\nState/Prov:     PA\\nCountry:        US\\nPostalCode:     19106\\nComment:        http://www.linode.com\\nRegDate:        2008-04-24\\nUpdated:        2019-06-28\\nOrgAbuseHandle: LAS12-ARIN\\nOrgAdminHandle: LNO21-ARIN\\nOrgNOCHandle:   LNO21-ARIN\\nOrgTechHandle:  LNO21-ARIN\\nSource:         ARIN\\n\n\nPOCHandle:      LAS12-ARIN\\nIsRole:         Y\\nLastName:       Linode Abuse Support\\nFirstName:      \\nStreet:         249 Arch St\\nCity:           Philadelphia\\nState/Prov:     PA\\nCountry:        US\\nPostalCode:     19106\\nRegDate:        2008-04-23\\nUpdated:        2022-07-07\\nOfficePhone:    +1-609-380-7100\\nMailbox:        abuse@linode.com\\nSource:         ARIN\\n\n\nPOCHandle:      LNO21-ARIN\\nIsRole:         Y\\nLastName:       Linode Network Operations\\nFirstName:      \\nStreet:         249 Arch Street\\nCity:           Philadelphia\\nState/Prov:     PA\\nCountry:        US\\nPostalCode:     19106\\nRegDate:        2008-04-23\\nUpdated:        2022-01-06\\nOfficePhone:    +1-609-380-7304\\nMailbox:        support@linode.com\\nSource:         ARIN\\n"}
{"id": "CSB-17", "name": "The Citizens Savings Bank", "address": "", "street": "201 S. Fourth Street\\nP.O. Box 10", "city": "Martins Ferry", "state": "OH", "postalcode": "43935", "country": "US", "admin_id": "ITC1-ARIN", "tech_id": "ITC1-ARIN", "abuse_id": "ITC1-ARIN", "mnt_id": "ITC1-ARIN", "email": "", "domain": "thecitizensbank.com", "created": "2000-10-27", "updated": "2017-11-01", "source": "arin", "raw": "OrgID:          CSB-17\\nOrgName:        The Citizens Savings Bank\\nCanAllocate:    \\nStreet:         201 S. Fourth Street\\nStreet:         P.O. Box 10\\nCity:           Martins Ferry\\nState/Prov:     OH\\nCountry:        US\\nPostalCode:     43935\\nRegDate:        2000-10-27\\nUpdated:        2017-11-01\\nOrgAbuseHandle: ITC1-ARIN\\nOrgAdminHandle: ITC1-ARIN\\nOrgNOCHandle:   ITC1-ARIN\\nOrgTechHandle:  ITC1-ARIN\\nSource:         ARIN\\n\n\nPOCHandle:      ITC1-ARIN\\nIsRole:         Y\\nLastName:       Information Technology Center\\nFirstName:      \\nStreet:         201 S. 4th Street\\nCity:           Martins Ferry\\nState/Prov:     OH\\nCountry:        US\\nPostalCode:     43935\\nRegDate:        2007-07-03\\nUpdated:        2017-11-01\\nOfficePhone:    +1-740-633-0445\\nMailbox:        mis@thecitizensbank.com\\nSource:         ARIN\\n"}
{"id": "BISUDC", "name": "BIS", "address": "", "street": "1401 Constitution Avenue, NW, Room 6712", "city": "Washington", "state": "DC", "postalcode": "20230", "country": "US", "admin_id": "WARDJ2-ARIN", "tech_id": "WARDJ2-ARIN", "abuse_id": "WARDJ2-ARIN", "mnt_id": "WARDJ2-ARIN", "email": "", "domain": "askbis.com", "created": "2011-08-26", "updated": "2015-10-05", "source": "arin", "raw": "OrgID:          BISUDC\\nOrgName:        BIS\\nCanAllocate:    \\nStreet:         1401 Constitution Avenue, NW, Room 6712\\nCity:           Washington\\nState/Prov:     DC\\nCountry:        US\\nPostalCode:     20230\\nComment:        http://www.bis.doc.gov/\\nRegDate:        2011-08-26\\nUpdated:        2015-10-05\\nOrgAbuseHandle: WARDJ2-ARIN\\nOrgAdminHandle: WARDJ2-ARIN\\nOrgNOCHandle:   WARDJ2-ARIN\\nOrgTechHandle:  WARDJ2-ARIN\\nSource:         ARIN\\n\n\nPOCHandle:      WARDJ2-ARIN\\nIsRole:         N\\nLastName:       Ward\\nFirstName:      Jack\\nStreet:         1401 Constitution Avenue NW, Room 6712\\nCity:           Washington\\nState/Prov:     DC\\nCountry:        US\\nPostalCode:     20230\\nRegDate:        2011-08-25\\nUpdated:        2022-02-28\\nOfficePhone:    +1-202-482-1377\\nMobilePhone:    +1-202-657-3768\\nMailbox:        Jack.Ward@BIS.DoC.Gov\\nSource:         ARIN\\n"}
{"id": "KC-1663", "name": "Kinwapt", "address": "", "street": "3 Mitchuap Center Rd\\nP o Box 420", "city": "Chisasibi", "state": "QC", "postalcode": "J0M 1E0", "country": "CA", "admin_id": "HRH24-ARIN", "tech_id": "HRH24-ARIN", "abuse_id": "HRH24-ARIN", "mnt_id": "HRH24-ARIN", "email": "", "domain": "kinwapt.ca", "created": "2017-10-13", "updated": "2019-10-19", "source": "arin", "raw": "OrgID:          KC-1663\\nOrgName:        Kinwapt\\nCanAllocate:    \\nStreet:         3 Mitchuap Center Rd\\nStreet:         P o Box 420\\nCity:           Chisasibi\\nState/Prov:     QC\\nCountry:        CA\\nPostalCode:     J0M 1E0\\nRegDate:        2017-10-13\\nUpdated:        2019-10-19\\nOrgAbuseHandle: HRH24-ARIN\\nOrgAdminHandle: HRH24-ARIN\\nOrgNOCHandle:   HRH24-ARIN\\nOrgTechHandle:  HRH24-ARIN\\nSource:         ARIN\\n\n\nPOCHandle:      HRH24-ARIN\\nIsRole:         N\\nLastName:       House\\nFirstName:      Hank\\nStreet:         3 Mitchuap Rd\\nCity:           Chisasibi\\nState/Prov:     QC\\nCountry:        CA\\nPostalCode:     J0M-1E0\\nRegDate:        2017-10-12\\nUpdated:        2021-10-12\\nOfficePhone:    +1-819-855-2191\\nMailbox:        hhouse4@hotmail.com\\nSource:         ARIN\\n"}
{"id": "PDC-213", "name": "Pechanga Resort & Casino", "address": "", "street": "45000 Pechanga Parkway", "city": "Temecula", "state": "CA", "postalcode": "92592", "country": "US", "admin_id": "ITDEP241-ARIN", "tech_id": "ITDEP241-ARIN", "abuse_id": "ITDEP241-ARIN", "mnt_id": "ITDEP241-ARIN", "email": "", "domain": "pechanga.com", "created": "2020-01-06", "updated": "2020-01-06", "source": "arin", "raw": "OrgID:          PDC-213\\nOrgName:        Pechanga Resort & Casino\\nCanAllocate:    \\nStreet:         45000 Pechanga Parkway\\nCity:           Temecula\\nState/Prov:     CA\\nCountry:        US\\nPostalCode:     92592\\nRegDate:        2020-01-06\\nUpdated:        2020-01-06\\nOrgAbuseHandle: ITDEP241-ARIN\\nOrgAdminHandle: ITDEP241-ARIN\\nOrgDNSHandle:   ITDEP241-ARIN\\nOrgNOCHandle:   ITDEP241-ARIN\\nOrgRoutingHandle:   ITDEP241-ARIN\\nOrgTechHandle:  ITDEP241-ARIN\\nSource:         ARIN\\n\n\nPOCHandle:      ITDEP241-ARIN\\nIsRole:         Y\\nLastName:       IT Department\\nFirstName:      \\nStreet:         45000 Pechanga Parkway\\nCity:           Temecula\\nState/Prov:     CA\\nCountry:        US\\nPostalCode:     92592\\nRegDate:        2019-11-14\\nUpdated:        2022-01-03\\nOfficePhone:    +1-951-770-2437\\nMailbox:        networkoperations@pechanga.com\\nSource:         ARIN\\n"}
{"id": "UAMS-Z", "name": "University of Arkansas for Medical Sciences", "address": "", "street": "4301 W. Markham St.\\nMail Slot 757", "city": "Little Rock", "state": "AR", "postalcode": "72205", "country": "US", "admin_id": "HOOVE80-ARIN", "tech_id": "BYNUM44-ARIN\\NHOOVE80-ARIN", "abuse_id": "BYNUM44-ARIN\\NHOOVE80-ARIN", "mnt_id": "BYNUM44-ARIN\\NHOOVE80-ARIN", "email": "", "domain": "uams.edu", "created": "2008-03-24", "updated": "2019-10-30", "source": "arin", "raw": "OrgID:          UAMS-Z\\nOrgName:        University of Arkansas for Medical Sciences\\nCanAllocate:    \\nStreet:         4301 W. Markham St.\\nStreet:         Mail Slot 757\\nCity:           Little Rock\\nState/Prov:     AR\\nCountry:        US\\nPostalCode:     72205\\nRegDate:        2008-03-24\\nUpdated:        2019-10-30\\nOrgAbuseHandle: BYNUM44-ARIN\\nOrgAbuseHandle: HOOVE80-ARIN\\nOrgAdminHandle: HOOVE80-ARIN\\nOrgNOCHandle:   BYNUM44-ARIN\\nOrgNOCHandle:   HOOVE80-ARIN\\nOrgTechHandle:  BYNUM44-ARIN\\nOrgTechHandle:  HOOVE80-ARIN\\nSource:         ARIN\\n\n\nPOCHandle:      BYNUM44-ARIN\\nIsRole:         N\\nLastName:       Bynum\\nFirstName:      Shawn\\nStreet:         4301 W Markham\\nCity:           Little Rock\\nState/Prov:     AR\\nCountry:        US\\nPostalCode:     72205\\nRegDate:        2019-10-30\\nUpdated:        2019-10-30\\nOfficePhone:    +1-501-526-3131\\nMailbox:        sbynum@uams.edu\\nSource:         ARIN\\n\n\nPOCHandle:      HOOVE80-ARIN\\nIsRole:         N\\nLastName:       Hoover\\nFirstName:      Guy\\nStreet:         4301 W Markham\\nCity:           LITTLE ROCK\\nState/Prov:     AR\\nCountry:        US\\nPostalCode:     72205\\nRegDate:        2015-12-04\\nUpdated:        2022-03-31\\nOfficePhone:    +1-501-554-3131\\nMailbox:        sbynum@uams.edu\\nSource:         ARIN\\n"}
{"id": "TGILI", "name": "A5.COM", "address": "", "street": "1803 W Detweiller Dr", "city": "Peoria", "state": "IL", "postalcode": "61615", "country": "US", "admin_id": "ANO18-ARIN", "tech_id": "ANO18-ARIN", "abuse_id": "NOC12182-ARIN", "mnt_id": "ANO18-ARIN", "email": "", "domain": "a5.com", "created": "2008-07-08", "updated": "2017-01-28", "source": "arin", "raw": "OrgID:          TGILI\\nOrgName:        A5.COM\\nCanAllocate:    \\nStreet:         1803 W Detweiller Dr\\nCity:           Peoria\\nState/Prov:     IL\\nCountry:        US\\nPostalCode:     61615\\nRegDate:        2008-07-08\\nUpdated:        2017-01-28\\nOrgAbuseHandle: NOC12182-ARIN\\nOrgAdminHandle: ANO18-ARIN\\nOrgNOCHandle:   ANO18-ARIN\\nOrgTechHandle:  ANO18-ARIN\\nSource:         ARIN\\n\n\nPOCHandle:      ANO18-ARIN\\nIsRole:         Y\\nLastName:       A5 Network Operations\\nFirstName:      \\nStreet:         1803 W Detweiller Dr\\nCity:           Peoria\\nState/Prov:     IL\\nCountry:        US\\nPostalCode:     61615\\nRegDate:        2004-06-30\\nUpdated:        2021-11-12\\nOfficePhone:    +1-309-999-2700\\nMailbox:        noc@a5.com\\nSource:         ARIN\\n\n\nPOCHandle:      NOC12182-ARIN\\nIsRole:         Y\\nLastName:       Network Operations Center\\nFirstName:      \\nStreet:         1803 W Detweiller Dr\\nCity:           Peoria\\nState/Prov:     IL\\nCountry:        US\\nPostalCode:     61615\\nRegDate:        2011-07-29\\nUpdated:        2021-11-12\\nFaxPhone:       +1-309-691-3007\\nOfficePhone:    +1-309-999-2700\\nMailbox:        abuse@a5.com\\nSource:         ARIN\\n"}
{"id": "CAMBR-32", "name": "Cambridge Public Schools", "address": "", "street": "459 Broadway", "city": "Cambridge", "state": "MA", "postalcode": "02138", "country": "US", "admin_id": "KKE94-ARIN", "tech_id": "KKE94-ARIN", "abuse_id": "KKE94-ARIN", "mnt_id": "KKE94-ARIN", "email": "", "domain": "cpsd.us", "created": "2009-07-28", "updated": "2009-07-28", "source": "arin", "raw": "OrgID:          CAMBR-32\\nOrgName:        Cambridge Public Schools\\nCanAllocate:    \\nStreet:         459 Broadway\\nCity:           Cambridge\\nState/Prov:     MA\\nCountry:        US\\nPostalCode:     02138\\nComment:        http://www.cpsd.us\\nComment:        Standard Hours 8am - 4pm EST\\nRegDate:        2009-07-28\\nUpdated:        2009-07-28\\nOrgAbuseHandle: KKE94-ARIN\\nOrgAdminHandle: KKE94-ARIN\\nOrgNOCHandle:   KKE94-ARIN\\nOrgTechHandle:  KKE94-ARIN\\nSource:         ARIN\\n\n\nPOCHandle:      KKE94-ARIN\\nIsRole:         N\\nLastName:       Keegan\\nFirstName:      Kevin\\nStreet:         459 Broadway\\nCity:           Cambridge\\nState/Prov:     MA\\nCountry:        US\\nPostalCode:     02138\\nRegDate:        2009-07-13\\nUpdated:        2022-06-27\\nFaxPhone:       +1-617-349-6800\\nMobilePhone:    +1-617-201-4843\\nOfficePhone:    +1-617-349-6830\\nMailbox:        kkeegan@cpsd.us\\nSource:         ARIN\\n"}
{"id": "INS-77", "name": "Infinity Network Services, Inc.", "address": "", "street": "1106A Kingold Blvd", "city": "Snow Hill", "state": "NC", "postalcode": "28580", "country": "US", "admin_id": "JLR56-ARIN", "tech_id": "JLR56-ARIN", "abuse_id": "JLR56-ARIN", "mnt_id": "JLR56-ARIN", "email": "", "domain": "infinitynetservices.net", "created": "2013-10-31", "updated": "2017-01-28", "source": "arin", "raw": "OrgID:          INS-77\\nOrgName:        Infinity Network Services, Inc.\\nCanAllocate:    \\nStreet:         1106A Kingold Blvd\\nCity:           Snow Hill\\nState/Prov:     NC\\nCountry:        US\\nPostalCode:     28580\\nRegDate:        2013-10-31\\nUpdated:        2017-01-28\\nOrgAbuseHandle: JLR56-ARIN\\nOrgAdminHandle: JLR56-ARIN\\nOrgNOCHandle:   JLR56-ARIN\\nOrgTechHandle:  JLR56-ARIN\\nSource:         ARIN\\n\n\nPOCHandle:      JLR56-ARIN\\nIsRole:         N\\nLastName:       Rich\\nFirstName:      Jeremy\\nStreet:         1106A Kingold Blvd\\nCity:           Snow Hill\\nState/Prov:     NC\\nCountry:        US\\nPostalCode:     28580\\nRegDate:        2013-10-30\\nUpdated:        2021-05-22\\nFaxPhone:       +1-252-208-9705\\nOfficePhone:    +1-800-889-7101\\nMobilePhone:    +1-252-361-7090\\nMailbox:        jrich@infinitynetservices.net\\nSource:         ARIN\\n"}
{"id": "NCS-147", "name": "IPtrading.com", "address": "", "street": "PO Box 551149", "city": "Davie", "state": "FL", "postalcode": "33355", "country": "US", "admin_id": "BURNS14-ARIN", "tech_id": "BURNS14-ARIN", "abuse_id": "BURNS14-ARIN", "mnt_id": "BURNS14-ARIN", "email": "", "domain": "sum.net", "created": "2011-07-08", "updated": "2011-09-28", "source": "arin", "raw": "OrgID:          NCS-147\\nOrgName:        IPtrading.com\\nCanAllocate:    \\nStreet:         PO Box 551149\\nCity:           Davie\\nState/Prov:     FL\\nCountry:        US\\nPostalCode:     33355\\nRegDate:        2011-07-08\\nUpdated:        2011-09-28\\nOrgAbuseHandle: BURNS14-ARIN\\nOrgAdminHandle: BURNS14-ARIN\\nOrgNOCHandle:   BURNS14-ARIN\\nOrgTechHandle:  BURNS14-ARIN\\nSource:         ARIN\\n\n\nPOCHandle:      BURNS14-ARIN\\nIsRole:         N\\nLastName:       Burns\\nFirstName:      Mike\\nStreet:         PO Box 551149\\nCity:           Davie\\nState/Prov:     FL\\nCountry:        US\\nPostalCode:     33355\\nRegDate:        2011-04-21\\nUpdated:        2020-01-08\\nOfficePhone:    +1-954-321-2111\\nFaxPhone:       +1-954-327-2108\\nMobilePhone:    +1-954-817-8324\\nMailbox:        mike@sum.net\\nSource:         ARIN\\n"}
{"id": "ORBGL", "name": "Orbglobal", "address": "", "street": "PO Box 2971", "city": "Titusville", "state": "FL", "postalcode": "32781", "country": "US", "admin_id": "ORBGL-ARIN", "tech_id": "ORBGL-ARIN", "abuse_id": "ORBGL1-ARIN", "mnt_id": "ORBGL-ARIN", "email": "", "domain": "orbglobal.com", "created": "2015-07-07", "updated": "2019-08-21", "source": "arin", "raw": "OrgID:          ORBGL\\nOrgName:        Orbglobal\\nCanAllocate:    \\nStreet:         PO Box 2971\\nCity:           Titusville\\nState/Prov:     FL\\nCountry:        US\\nPostalCode:     32781\\nRegDate:        2015-07-07\\nUpdated:        2019-08-21\\nOrgAbuseHandle: ORBGL1-ARIN\\nOrgAdminHandle: ORBGL-ARIN\\nOrgNOCHandle:   ORBGL-ARIN\\nOrgTechHandle:  ORBGL-ARIN\\nSource:         ARIN\\n\n\nPOCHandle:      ORBGL-ARIN\\nIsRole:         Y\\nLastName:       Orbglobal\\nFirstName:      \\nStreet:         PO Box 2971\\nCity:           Titusville\\nState/Prov:     FL\\nCountry:        US\\nPostalCode:     32781\\nRegDate:        2015-07-07\\nUpdated:        2022-04-25\\nOfficePhone:    +1-352-658-1756\\nMailbox:        hostmaster@orbglobal.com\\nSource:         ARIN\\n\n\nPOCHandle:      ORBGL1-ARIN\\nIsRole:         Y\\nLastName:       Orbglobal\\nFirstName:      \\nStreet:         PO Box 2971\\nCity:           Titusville\\nState/Prov:     FL\\nCountry:        US\\nPostalCode:     32781\\nRegDate:        2015-07-07\\nUpdated:        2022-04-25\\nOfficePhone:    +1-352-658-1756\\nMailbox:        abuse@orbglobal.com\\nSource:         ARIN\\n"}
{"id": "THECOM-22", "name": "The Computer Classroom, Inc.", "address": "", "street": "629 Rinpoche Lane", "city": "Oregon", "state": "WI", "postalcode": "53575", "country": "US", "admin_id": "MT16-ARIN", "tech_id": "LASHD-ARIN", "abuse_id": "MT16-ARIN", "mnt_id": "LASHD-ARIN", "email": "", "domain": "travelteam-kc.com", "created": "1993-07-12", "updated": "2020-12-28", "source": "arin", "raw": "OrgID:          THECOM-22\\nOrgName:        The Computer Classroom, Inc.\\nCanAllocate:    \\nStreet:         629 Rinpoche Lane\\nCity:           Oregon\\nState/Prov:     WI\\nCountry:        US\\nPostalCode:     53575\\nComment:        http://www.compclass.com\\nRegDate:        1993-07-12\\nUpdated:        2020-12-28\\nOrgAbuseHandle: MT16-ARIN\\nOrgAdminHandle: MT16-ARIN\\nOrgNOCHandle:   LASHD-ARIN\\nOrgTechHandle:  LASHD-ARIN\\nSource:         ARIN\\n\n\nPOCHandle:      LASHD-ARIN\\nIsRole:         N\\nLastName:       Lash\\nFirstName:      David\\nStreet:         4517 N Baltimore Drive\\nCity:           Kansas City\\nState/Prov:     MO\\nCountry:        US\\nPostalCode:     64116\\nRegDate:        2012-03-05\\nUpdated:        2021-12-08\\nOfficePhone:    +1-816-305-4553\\nMailbox:        dlash@travelteam-kc.com\\nSource:         ARIN\\n\n\nPOCHandle:      MT16-ARIN\\nIsRole:         N\\nLastName:       Thurmaier\\nFirstName:      Matthew\\nStreet:         629 Rinpoche Lane\\nCity:           Oregon\\nState/Prov:     WI\\nCountry:        US\\nPostalCode:     53575\\nRegDate:        1993-07-12\\nUpdated:        2022-01-04\\nOfficePhone:    +1-386-679-2963\\nMailbox:        matt@compclass.com\\nSource:         ARIN\\n"}
{"id": "IC2HO", "name": "IC2NET", "address": "", "street": "14351 Myford Road Suite C", "city": "Tustin", "state": "CA", "postalcode": "92780", "country": "US", "admin_id": "HELMA-ARIN", "tech_id": "HELMA-ARIN", "abuse_id": "HELMA-ARIN", "mnt_id": "HELMA-ARIN", "email": "", "domain": "ic2net.net", "created": "2010-06-22", "updated": "2017-01-28", "source": "arin", "raw": "OrgID:          IC2HO\\nOrgName:        IC2NET\\nCanAllocate:    \\nStreet:         14351 Myford Road Suite C\\nCity:           Tustin\\nState/Prov:     CA\\nCountry:        US\\nPostalCode:     92780\\nRegDate:        2010-06-22\\nUpdated:        2017-01-28\\nOrgAbuseHandle: HELMA-ARIN\\nOrgAdminHandle: HELMA-ARIN\\nOrgNOCHandle:   HELMA-ARIN\\nOrgTechHandle:  HELMA-ARIN\\nSource:         ARIN\\n\n\nPOCHandle:      HELMA-ARIN\\nIsRole:         N\\nLastName:       Helman\\nFirstName:      Jon\\nStreet:         14351 Myford Road Suite 120-C\\nCity:           Tustin\\nState/Prov:     CA\\nCountry:        US\\nPostalCode:     92780\\nRegDate:        2010-06-21\\nUpdated:        2022-06-25\\nMobilePhone:    +1-714-970-5011\\nOfficePhone:    +1-949-519-4620\\nFaxPhone:       +1-714-970-5449\\nMailbox:        jon@ic2net.net\\nSource:         ARIN\\n"}
{"id": "RELYNE", "name": "RelyNet Inc.", "address": "", "street": "11230 Gold Express Dr. #310-192", "city": "Gold River", "state": "CA", "postalcode": "95670", "country": "US", "admin_id": "MLA32-ARIN", "tech_id": "IPADM520-ARIN", "abuse_id": "IPABU12-ARIN", "mnt_id": "NOC11422-ARIN", "email": "", "domain": "webion.net", "created": "1999-06-28", "updated": "2014-06-30", "source": "arin", "raw": "OrgID:          RELYNE\\nOrgName:        RelyNet Inc.\\nCanAllocate:    \\nStreet:         11230 Gold Express Dr. #310-192\\nCity:           Gold River\\nState/Prov:     CA\\nCountry:        US\\nPostalCode:     95670\\nRegDate:        1999-06-28\\nUpdated:        2014-06-30\\nOrgAbuseHandle: IPABU12-ARIN\\nOrgAdminHandle: MLA32-ARIN\\nOrgNOCHandle:   NOC11422-ARIN\\nOrgTechHandle:  IPADM520-ARIN\\nSource:         ARIN\\n\n\nPOCHandle:      IPABU12-ARIN\\nIsRole:         Y\\nLastName:       IP Abuse\\nFirstName:      \\nStreet:         11230 Gold Express Dr. #310-192\\nCity:           Gold River\\nState/Prov:     CA\\nCountry:        US\\nPostalCode:     95670\\nRegDate:        2010-04-15\\nUpdated:        2018-02-15\\nOfficePhone:    +1-916-212-4271\\nMailbox:        ip.abuse@webion.net\\nSource:         ARIN\\n\n\nPOCHandle:      MLA32-ARIN\\nIsRole:         N\\nLastName:       Lamb\\nFirstName:      Michael\\nStreet:         11230 Gold Express Dr. #310-192\\nCity:           Gold River\\nState/Prov:     CA\\nCountry:        US\\nPostalCode:     95670\\nRegDate:        2003-09-24\\nUpdated:        2018-02-15\\nOfficePhone:    +1-916-212-4271\\nMailbox:        michael.lamb@webion.net\\nSource:         ARIN\\n\n\nPOCHandle:      IPADM520-ARIN\\nIsRole:         Y\\nLastName:       IP Admin\\nFirstName:      \\nStreet:         11230 Gold Express Dr. #310-192\\nCity:           Gold River\\nState/Prov:     CA\\nCountry:        US\\nPostalCode:     95670\\nRegDate:        2010-04-15\\nUpdated:        2018-02-15\\nOfficePhone:    +1-916-212-4271\\nMailbox:        ip.admin@webion.net\\nSource:         ARIN\\n\n\nPOCHandle:      NOC11422-ARIN\\nIsRole:         Y\\nLastName:       Network Operations Center\\nFirstName:      \\nStreet:         11230 Gold Express Dr. #310-192\\nCity:           Gold River\\nState/Prov:     CA\\nCountry:        US\\nPostalCode:     95670\\nRegDate:        2010-04-15\\nUpdated:        2018-02-15\\nOfficePhone:    +1-916-212-4271\\nMailbox:        noc@webion.net\\nSource:         ARIN\\n"}
{"id": "HM-312", "name": "HarborTech Mobility, Inc.", "address": "", "street": "22030 20th Ave SE, Suite 101", "city": "BOTHELL", "state": "WA", "postalcode": "98021", "country": "US", "admin_id": "COLLI8-ARIN", "tech_id": "COLLI8-ARIN", "abuse_id": "COLLI8-ARIN", "mnt_id": "COLLI8-ARIN", "email": "", "domain": "htmobility.com", "created": "2016-02-23", "updated": "2022-02-21", "source": "arin", "raw": "OrgID:          HM-312\\nOrgName:        HarborTech Mobility, Inc.\\nCanAllocate:    \\nStreet:         22030 20th Ave SE, Suite 101\\nCity:           BOTHELL\\nState/Prov:     WA\\nCountry:        US\\nPostalCode:     98021\\nRegDate:        2016-02-23\\nUpdated:        2022-02-21\\nOrgAbuseHandle: COLLI8-ARIN\\nOrgAdminHandle: COLLI8-ARIN\\nOrgDNSHandle:   COLLI8-ARIN\\nOrgNOCHandle:   COLLI8-ARIN\\nOrgRoutingHandle:   COLLI8-ARIN\\nOrgTechHandle:  COLLI8-ARIN\\nSource:         ARIN\\n\n\nPOCHandle:      COLLI8-ARIN\\nIsRole:         N\\nLastName:       Collier\\nFirstName:      Adrian\\nStreet:         22030 20th Ave SE, Suite 101\\nCity:           Bothell\\nState/Prov:     WA\\nCountry:        US\\nPostalCode:     98021\\nRegDate:        2010-03-08\\nUpdated:        2021-09-22\\nOfficePhone:    +1-425-424-0444\\nMailbox:        adriancollier@mac.com\\nSource:         ARIN\\n"}
{"id": "KRMCL", "name": "Kearney Regional Medical Center LLC", "address": "", "street": "804 22nd Avenue", "city": "Kearney", "state": "NE", "postalcode": "68845", "country": "US", "admin_id": "ITADM166-ARIN", "tech_id": "CHILD291-ARIN\\NITADM166-ARIN\\NOBERG6-ARIN", "abuse_id": "ITADM166-ARIN\\NCHILD291-ARIN\\NOBERG6-ARIN", "mnt_id": "CHILD291-ARIN\\NITADM166-ARIN\\NOBERG6-ARIN", "email": "", "domain": "kearneyregional.com", "created": "2019-03-20", "updated": "2021-04-26", "source": "arin", "raw": "OrgID:          KRMCL\\nOrgName:        Kearney Regional Medical Center LLC\\nCanAllocate:    \\nStreet:         804 22nd Avenue\\nCity:           Kearney\\nState/Prov:     NE\\nCountry:        US\\nPostalCode:     68845\\nRegDate:        2019-03-20\\nUpdated:        2021-04-26\\nOrgAbuseHandle: ITADM166-ARIN\\nOrgAbuseHandle: CHILD291-ARIN\\nOrgAbuseHandle: OBERG6-ARIN\\nOrgAdminHandle: ITADM166-ARIN\\nOrgDNSHandle:   CHILD291-ARIN\\nOrgRoutingHandle:   ITADM166-ARIN\\nOrgTechHandle:  CHILD291-ARIN\\nOrgDNSHandle:   ITADM166-ARIN\\nOrgDNSHandle:   OBERG6-ARIN\\nOrgNOCHandle:   CHILD291-ARIN\\nOrgNOCHandle:   ITADM166-ARIN\\nOrgTechHandle:  ITADM166-ARIN\\nOrgTechHandle:  OBERG6-ARIN\\nOrgNOCHandle:   OBERG6-ARIN\\nOrgRoutingHandle:   CHILD291-ARIN\\nOrgRoutingHandle:   OBERG6-ARIN\\nSource:         ARIN\\n\n\nPOCHandle:      ITADM166-ARIN\\nIsRole:         Y\\nLastName:       IT Admin\\nFirstName:      \\nStreet:         804 22nd Avenue\\nCity:           Kearney\\nState/Prov:     NE\\nCountry:        US\\nPostalCode:     68845\\nRegDate:        2019-03-19\\nUpdated:        2021-05-19\\nOfficePhone:    +1-308-455-3651\\nMailbox:        itadmin@kearneyregional.com\\nSource:         ARIN\\n\n\nPOCHandle:      OBERG6-ARIN\\nIsRole:         N\\nLastName:       Oberg\\nFirstName:      Grant\\nStreet:         804 22nd Avenue\\nCity:           Kearney\\nState/Prov:     NE\\nCountry:        US\\nPostalCode:     68845\\nRegDate:        2020-06-09\\nUpdated:        2022-02-17\\nOfficePhone:    +1-308-455-8150\\nMailbox:        goberg@kearneyregional.com\\nSource:         ARIN\\n\n\nPOCHandle:      CHILD291-ARIN\\nIsRole:         N\\nLastName:       Childress\\nFirstName:      Jeremy\\nStreet:         804 22nd Ave\\nCity:           Kearney\\nState/Prov:     NE\\nCountry:        US\\nPostalCode:     68845\\nRegDate:        2020-06-08\\nUpdated:        2022-06-08\\nOfficePhone:    +1-308-455-8110\\nMailbox:        jchildress@kearneyregional.com\\nSource:         ARIN\\n"}
{"id": "BCL-440", "name": "BGP CONSULTING LLC", "address": "", "street": "57 North Turtle Rock Court", "city": "The Woodlands", "state": "TX", "postalcode": "77381", "country": "US", "admin_id": "OWNER65-ARIN", "tech_id": "OWNER65-ARIN", "abuse_id": "OWNER65-ARIN", "mnt_id": "OWNER65-ARIN", "email": "", "domain": "bgp.consulting", "created": "2021-10-18", "updated": "2021-10-18", "source": "arin", "raw": "OrgID:          BCL-440\\nOrgName:        BGP CONSULTING LLC\\nCanAllocate:    \\nStreet:         57 North Turtle Rock Court\\nCity:           The Woodlands\\nState/Prov:     TX\\nCountry:        US\\nPostalCode:     77381\\nRegDate:        2021-10-18\\nUpdated:        2021-10-18\\nOrgAbuseHandle: OWNER65-ARIN\\nOrgAdminHandle: OWNER65-ARIN\\nOrgDNSHandle:   OWNER65-ARIN\\nOrgNOCHandle:   OWNER65-ARIN\\nOrgRoutingHandle:   OWNER65-ARIN\\nOrgTechHandle:  OWNER65-ARIN\\nSource:         ARIN\\n\n\nPOCHandle:      OWNER65-ARIN\\nIsRole:         Y\\nLastName:       OWNER\\nFirstName:      \\nStreet:         57 N TURTLE ROCK CT\\nCity:           THE WOODLANDS\\nState/Prov:     TX\\nCountry:        US\\nPostalCode:     77381\\nRegDate:        2021-04-27\\nUpdated:        2021-04-27\\nOfficePhone:    +1-832-934-4454\\nMailbox:        andrew@bgp.consulting\\nSource:         ARIN\\n"}
{"id": "WIZARD", "name": "Wizardry Inc.", "address": "", "street": "m.s. arin\\n1130 Meadowlark Circle", "city": "Gardnerville", "state": "NV", "postalcode": "89460", "country": "US", "admin_id": "JB29-ARIN", "tech_id": "JB29-ARIN", "abuse_id": "JB29-ARIN", "mnt_id": "JB29-ARIN", "email": "", "domain": "wizardry.com", "created": "1993-06-30", "updated": "2009-08-04", "source": "arin", "raw": "OrgID:          WIZARD\\nOrgName:        Wizardry Inc.\\nCanAllocate:    \\nStreet:         m.s. arin\\nStreet:         1130 Meadowlark Circle\\nCity:           Gardnerville\\nState/Prov:     NV\\nCountry:        US\\nPostalCode:     89460\\nRegDate:        1993-06-30\\nUpdated:        2009-08-04\\nOrgAbuseHandle: JB29-ARIN\\nOrgAdminHandle: JB29-ARIN\\nOrgNOCHandle:   JB29-ARIN\\nOrgTechHandle:  JB29-ARIN\\nSource:         ARIN\\n\n\nPOCHandle:      JB29-ARIN\\nIsRole:         N\\nLastName:       Belew\\nFirstName:      John\\nStreet:         Wizardy Inc.\\nStreet:         1130 Meadowlark Circle\\nCity:           Gardnerville\\nState/Prov:     NV\\nCountry:        US\\nPostalCode:     89460\\nRegDate:        1993-06-30\\nUpdated:        2021-12-03\\nOfficePhone:    +1-775-265-2100\\nFaxPhone:       +1-775-265-2050\\nMailbox:        john-arin20201130@belew.com\\nSource:         ARIN\\n"}
{"id": "SETE", "name": "Government of Saskatchewan", "address": "", "street": "c/o Ministry of Central Services\\nInformation Technology Division\\nGovernment of Saskatchewan\\n10th Floor - 1945 Hamilton Street", "city": "Regina", "state": "SK", "postalcode": "S4P 2C8", "country": "CA", "admin_id": "GOVER5-ARIN", "tech_id": "ADMIN1756-ARIN\\NGOVER5-ARIN", "abuse_id": "ADMIN1756-ARIN\\NGOVER5-ARIN", "mnt_id": "ADMIN1756-ARIN\\NGOVER5-ARIN", "email": "", "domain": "saskatchewan.ca", "created": "1994-04-19", "updated": "2017-12-20", "source": "arin", "raw": "OrgID:          SETE\\nOrgName:        Government of Saskatchewan\\nCanAllocate:    \\nStreet:         c/o Ministry of Central Services \\nStreet:         Information Technology Division\\nStreet:         Government of Saskatchewan\\nStreet:         10th Floor - 1945 Hamilton Street\\nCity:           Regina\\nState/Prov:     SK\\nCountry:        CA\\nPostalCode:     S4P 2C8\\nRegDate:        1994-04-19\\nUpdated:        2017-12-20\\nOrgAbuseHandle: ADMIN1756-ARIN\\nOrgAbuseHandle: GOVER5-ARIN\\nOrgAdminHandle: GOVER5-ARIN\\nOrgNOCHandle:   ADMIN1756-ARIN\\nOrgNOCHandle:   GOVER5-ARIN\\nOrgTechHandle:  ADMIN1756-ARIN\\nOrgTechHandle:  GOVER5-ARIN\\nSource:         ARIN\\n\n\nPOCHandle:      ADMIN1756-ARIN\\nIsRole:         Y\\nLastName:       ADMIN\\nFirstName:      \\nStreet:         4-2045 Broad Street\\nCity:           REGINA\\nState/Prov:     SK\\nCountry:        CA\\nPostalCode:     S4P 1Y3\\nRegDate:        2009-09-03\\nUpdated:        2021-09-22\\nOfficePhone:    +1-306-787-2131\\nMailbox:        bill.macdonald@gov.sk.ca\\nMailbox:        itonetops@gov.sk.ca\\nSource:         ARIN\\n\n\nPOCHandle:      GOVER5-ARIN\\nIsRole:         N\\nLastName:       Saskatchewan\\nFirstName:      Government\\nStreet:         4th Floor, 2045 Broad St.\\nCity:           Regina\\nState/Prov:     SK\\nCountry:        CA\\nPostalCode:     S4P 3T7\\nRegDate:        2017-12-20\\nUpdated:        2021-08-19\\nOfficePhone:    +1-306-787-2131\\nMailbox:        ito.software@gov.sk.ca\\nSource:         ARIN\\n"}
{"id": "UHC-32", "name": "UMPQUA HOLDINGS CORPORATION", "address": "", "street": "20085 NW TANASBOURNE DR", "city": "HILLSBORO", "state": "OR", "postalcode": "97124", "country": "US", "admin_id": "ARINN23-ARIN", "tech_id": "ARINN23-ARIN", "abuse_id": "ARINN23-ARIN", "mnt_id": "ARINN23-ARIN", "email": "", "domain": "umpquabank.com", "created": "2012-07-04", "updated": "2016-12-19", "source": "arin", "raw": "OrgID:          UHC-32\\nOrgName:        UMPQUA HOLDINGS CORPORATION\\nCanAllocate:    \\nStreet:         20085 NW TANASBOURNE DR\\nCity:           HILLSBORO\\nState/Prov:     OR\\nCountry:        US\\nPostalCode:     97124\\nRegDate:        2012-07-04\\nUpdated:        2016-12-19\\nOrgAbuseHandle: ARINN23-ARIN\\nOrgAdminHandle: ARINN23-ARIN\\nOrgNOCHandle:   ARINN23-ARIN\\nOrgTechHandle:  ARINN23-ARIN\\nSource:         ARIN\\n\n\nPOCHandle:      ARINN23-ARIN\\nIsRole:         Y\\nLastName:       ARIN-Notification\\nFirstName:      \\nStreet:         20085 NW Tanasbourne Drive\\nCity:           Hillsboro\\nState/Prov:     OR\\nCountry:        US\\nPostalCode:     97124\\nRegDate:        2016-12-16\\nUpdated:        2022-04-26\\nOfficePhone:    +1-503-268-6860\\nMailbox:        ARIN-Notification@UmpquaBank.com\\nSource:         ARIN\\n"}
{"id": "CM-1716", "name": "City of Mishawaka", "address": "", "street": "600 East 3rd Street", "city": "Mishawaka", "state": "IN", "postalcode": "46544", "country": "US", "admin_id": "STOKE216-ARIN", "tech_id": "STOKE216-ARIN", "abuse_id": "STOKE216-ARIN", "mnt_id": "STOKE216-ARIN", "email": "", "domain": "mishawakacity.com", "created": "2022-03-02", "updated": "2022-03-28", "source": "arin", "raw": "OrgID:          CM-1716\\nOrgName:        City of Mishawaka\\nCanAllocate:    \\nStreet:         600 East 3rd Street\\nCity:           Mishawaka\\nState/Prov:     IN\\nCountry:        US\\nPostalCode:     46544\\nRegDate:        2022-03-02\\nUpdated:        2022-03-28\\nOrgAbuseHandle: STOKE216-ARIN\\nOrgAdminHandle: STOKE216-ARIN\\nOrgNOCHandle:   STOKE216-ARIN\\nOrgTechHandle:  STOKE216-ARIN\\nSource:         ARIN\\n\n\nPOCHandle:      STOKE216-ARIN\\nIsRole:         N\\nLastName:       Stokes\\nFirstName:      Patrick\\nStreet:         200 N Church St\\nCity:           Mishawaka\\nState/Prov:     IN\\nCountry:        US\\nPostalCode:     46544\\nRegDate:        2022-03-02\\nUpdated:        2022-03-02\\nOfficePhone:    +1-574-258-1783\\nMailbox:        pstokes@mishawaka.in.gov\\nSource:         ARIN\\n"}
{"id": "CB-1527", "name": "CamTech Broadband", "address": "", "street": "1039 D Street\\nSuite 8", "city": "Ramona", "state": "CA", "postalcode": "92065", "country": "US", "admin_id": "NNC7-ARIN", "tech_id": "NNC7-ARIN", "abuse_id": "NNC7-ARIN", "mnt_id": "NNC7-ARIN", "email": "", "domain": "camtechbroadband.com", "created": "2021-05-19", "updated": "2021-05-19", "source": "arin", "raw": "OrgID:          CB-1527\\nOrgName:        CamTech Broadband\\nCanAllocate:    \\nStreet:         1039 D Street\\nStreet:         Suite 8\\nCity:           Ramona\\nState/Prov:     CA\\nCountry:        US\\nPostalCode:     92065\\nComment:        CamTech Broadband\\nComment:        Full Service ISP\\nComment:        www.camtechbroadband.com\\nRegDate:        2021-05-19\\nUpdated:        2021-05-19\\nOrgAbuseHandle: NNC7-ARIN\\nOrgAdminHandle: NNC7-ARIN\\nOrgDNSHandle:   NNC7-ARIN\\nOrgNOCHandle:   NNC7-ARIN\\nOrgRoutingHandle:   NNC7-ARIN\\nOrgTechHandle:  NNC7-ARIN\\nSource:         ARIN\\n\n\nPOCHandle:      NNC7-ARIN\\nIsRole:         N\\nLastName:       Campos\\nFirstName:      Normando\\nStreet:         1039 D Street\\nStreet:         Suite 8\\nCity:           Ramona\\nState/Prov:     CA\\nCountry:        US\\nPostalCode:     92065\\nRegDate:        2021-04-25\\nUpdated:        2021-04-25\\nOfficePhone:    +1-760-654-5212\\nMailbox:        ncampos@camtechbroadband.com\\nSource:         ARIN\\n"}
{"id": "EL-1128", "name": "e-planning", "address": "", "street": "2600 S Douglas Rd Suite 900", "city": "Coral Gables", "state": "FL", "postalcode": "33134-6149", "country": "US", "admin_id": "EPLAN28-ARIN", "tech_id": "EPLAN29-ARIN", "abuse_id": "EPLAN29-ARIN", "mnt_id": "EPLAN29-ARIN", "email": "", "domain": "e-planning.net", "created": "2021-05-10", "updated": "2021-10-03", "source": "arin", "raw": "OrgID:          EL-1128\\nOrgName:        e-planning\\nCanAllocate:    \\nStreet:         2600 S Douglas Rd Suite 900\\nCity:           Coral Gables\\nState/Prov:     FL\\nCountry:        US\\nPostalCode:     33134-6149\\nRegDate:        2021-05-10\\nUpdated:        2021-10-03\\nOrgAbuseHandle: EPLAN29-ARIN\\nOrgAdminHandle: EPLAN28-ARIN\\nOrgNOCHandle:   EPLAN29-ARIN\\nOrgTechHandle:  EPLAN29-ARIN\\nSource:         ARIN\\n\n\nPOCHandle:      EPLAN28-ARIN\\nIsRole:         Y\\nLastName:       e-planning Finance\\nFirstName:      \\nStreet:         2600 S Douglas Rd, Suite 900\\nCity:           Coral Gables\\nState/Prov:     FL\\nCountry:        US\\nPostalCode:     33134-6149\\nRegDate:        2021-05-01\\nUpdated:        2021-10-03\\nOfficePhone:    +1-213-408-7104\\nMailbox:        finance@e-planning.net\\nSource:         ARIN\\n\n\nPOCHandle:      EPLAN29-ARIN\\nIsRole:         Y\\nLastName:       e-planning NOC\\nFirstName:      \\nStreet:         2600 S Douglas Rd, Suite 900\\nCity:           Coral Gables\\nState/Prov:     FL\\nCountry:        US\\nPostalCode:     33134-6149\\nRegDate:        2021-05-01\\nUpdated:        2021-10-03\\nOfficePhone:    +1-213-408-7100\\nMailbox:        noc@e-planning.net\\nSource:         ARIN\\n"}
{"id": "BPNL-1", "name": "Battele Pacific Northwest Laboratory", "address": "", "street": "3320 Q Avenue", "city": "Richland", "state": "WA", "postalcode": "99352", "country": "US", "admin_id": "JRB12-ARIN", "tech_id": "SCT2-ARIN", "abuse_id": "SCT2-ARIN", "mnt_id": "NOC1625-ARIN", "email": "", "domain": "pnl.gov", "created": "1988-04-26", "updated": "2011-09-24", "source": "arin", "raw": "OrgID:          BPNL-1\\nOrgName:        Battele Pacific Northwest Laboratory\\nCanAllocate:    \\nStreet:         3320 Q Avenue\\nCity:           Richland\\nState/Prov:     WA\\nCountry:        US\\nPostalCode:     99352\\nRegDate:        1988-04-26\\nUpdated:        2011-09-24\\nOrgAbuseHandle: SCT2-ARIN\\nOrgAdminHandle: JRB12-ARIN\\nOrgNOCHandle:   NOC1625-ARIN\\nOrgTechHandle:  SCT2-ARIN\\nSource:         ARIN\\n\n\nPOCHandle:      SCT2-ARIN\\nIsRole:         N\\nLastName:       Tollbom\\nFirstName:      Cullen\\nStreet:         Battelle Pacific Northwest Laboratory\\nStreet:         3320 Q Avenue\\nCity:           Richland\\nState/Prov:     WA\\nCountry:        US\\nPostalCode:     99352\\nRegDate:        1970-01-01\\nUpdated:        2016-12-14\\nOfficePhone:    +1-509-375-2896\\nFaxPhone:       +1-509-375-6703\\nMailbox:        cullen.tollbom@pnl.gov\\nSource:         ARIN\\n\n\nPOCHandle:      JRB12-ARIN\\nIsRole:         N\\nLastName:       Burnette\\nFirstName:      John\\nStreet:         Battelle Pacific Northwest Laboratory\\nStreet:         3320 Q Avenue\\nCity:           Richland\\nState/Prov:     WA\\nCountry:        US\\nPostalCode:     99352\\nRegDate:        2004-09-09\\nUpdated:        2004-09-09\\nOfficePhone:    +1-509-375-2198\\nMailbox:        john.burnette@pnl.gov\\nSource:         ARIN\\n\n\nPOCHandle:      NOC1625-ARIN\\nIsRole:         Y\\nLastName:       Network Operations Center\\nFirstName:      \\nStreet:         3320 Q Avenue\\nCity:           Richland\\nState/Prov:     WA\\nCountry:        US\\nPostalCode:     99352\\nRegDate:        2004-07-14\\nUpdated:        2011-11-04\\nOfficePhone:    +1-509-372-6377\\nMailbox:        hostmaster@pnl.gov\\nSource:         ARIN\\n"}
{"id": "SL-194", "name": "ShoreWaves LLC", "address": "", "street": "PO Box 293", "city": "Houghton", "state": "MI", "postalcode": "49931", "country": "US", "admin_id": "SCF4-ARIN", "tech_id": "SCF4-ARIN\\NZDS2-ARIN", "abuse_id": "SCF4-ARIN", "mnt_id": "ZDS2-ARIN", "email": "", "domain": "shorewaves.net", "created": "2012-11-05", "updated": "2012-11-13", "source": "arin", "raw": "OrgID:          SL-194\\nOrgName:        ShoreWaves LLC\\nCanAllocate:    \\nStreet:         PO Box 293\\nCity:           Houghton\\nState/Prov:     MI\\nCountry:        US\\nPostalCode:     49931\\nRegDate:        2012-11-05\\nUpdated:        2012-11-13\\nOrgAbuseHandle: SCF4-ARIN\\nOrgAdminHandle: SCF4-ARIN\\nOrgNOCHandle:   ZDS2-ARIN\\nOrgTechHandle:  SCF4-ARIN\\nOrgTechHandle:  ZDS2-ARIN\\nSource:         ARIN\\n\n\nPOCHandle:      SCF4-ARIN\\nIsRole:         N\\nLastName:       Fitzgerald\\nFirstName:      Steven\\nStreet:         PO Box 293\\nCity:           Houghton\\nState/Prov:     MI\\nCountry:        US\\nPostalCode:     49931\\nRegDate:        2012-11-03\\nUpdated:        2012-11-03\\nOfficePhone:    +1-906-483-0949\\nMailbox:        scfitzge@kpbiznet.com\\nSource:         ARIN\\n\n\nPOCHandle:      ZDS2-ARIN\\nIsRole:         N\\nLastName:       Simpson\\nFirstName:      Zachary\\nStreet:         47420 State Highway M26\\nStreet:         Suite 27\\nCity:           Houghton\\nState/Prov:     MI\\nCountry:        US\\nPostalCode:     49931\\nRegDate:        2012-11-13\\nUpdated:        2018-08-16\\nOfficePhone:    +1-906-483-2656\\nMailbox:        zdsimpso@shorewaves.net\\nSource:         ARIN\\n"}
{"id": "KCSL", "name": "Kirk Computer Systems Ltd.", "address": "", "street": "Box 1976", "city": "Yellowknife", "state": "NT", "postalcode": "X1A-2P5", "country": "CA", "admin_id": "BJ48-ARIN", "tech_id": "BJ48-ARIN", "abuse_id": "BJ48-ARIN", "mnt_id": "BJ48-ARIN", "email": "", "domain": "kirk.ca", "created": "1994-03-22", "updated": "2011-09-24", "source": "arin", "raw": "OrgID:          KCSL\\nOrgName:        Kirk Computer Systems Ltd.\\nCanAllocate:    \\nStreet:         Box 1976\\nCity:           Yellowknife\\nState/Prov:     NT\\nCountry:        CA\\nPostalCode:     X1A-2P5\\nRegDate:        1994-03-22\\nUpdated:        2011-09-24\\nOrgAbuseHandle: BJ48-ARIN\\nOrgAdminHandle: BJ48-ARIN\\nOrgNOCHandle:   BJ48-ARIN\\nOrgTechHandle:  BJ48-ARIN\\nSource:         ARIN\\n\n\nPOCHandle:      BJ48-ARIN\\nIsRole:         N\\nLastName:       Johnson\\nFirstName:      Bob\\nStreet:         4901 Matonabee Street\\nCity:           Yellowknife\\nState/Prov:     NT\\nCountry:        CA\\nPostalCode:     X1A 1X7\\nRegDate:        1998-08-10\\nUpdated:        2021-07-26\\nOfficePhone:    +1-867-873-6310\\nMailbox:        bobj@kirk.ca\\nSource:         ARIN\\n"}
{"id": "DCL-689", "name": "DQE Communications LLC", "address": "", "street": "424 South 27th Street\\nSuite 220", "city": "Pittsburgh", "state": "PA", "postalcode": "15203", "country": "US", "admin_id": "ADMIN421-ARIN", "tech_id": "MCGIN182-ARIN\\NTECH139-ARIN", "abuse_id": "ABUSE686-ARIN", "mnt_id": "NETWO635-ARIN", "email": "", "domain": "dqecom.com", "created": "2018-12-12", "updated": "2022-06-27", "source": "arin", "raw": "OrgID:          DCL-689\\nOrgName:        DQE Communications LLC\\nCanAllocate:    \\nStreet:         424 South 27th Street\\nStreet:         Suite 220\\nCity:           Pittsburgh\\nState/Prov:     PA\\nCountry:        US\\nPostalCode:     15203\\nRegDate:        2018-12-12\\nUpdated:        2022-06-27\\nOrgAbuseHandle: ABUSE686-ARIN\\nOrgAdminHandle: ADMIN421-ARIN\\nOrgNOCHandle:   NETWO635-ARIN\\nOrgTechHandle:  MCGIN182-ARIN\\nOrgTechHandle:  TECH139-ARIN\\nSource:         ARIN\\n\n\nPOCHandle:      MCGIN182-ARIN\\nIsRole:         N\\nLastName:       McGinn\\nFirstName:      Paul\\nStreet:         45 S. 23rd St.\\nCity:           Pittsburgh\\nState/Prov:     PA\\nCountry:        US\\nPostalCode:     15203\\nRegDate:        2022-04-12\\nUpdated:        2022-04-12\\nOfficePhone:    +1-412-393-1175\\nMailbox:        pmcginn@dqe.com\\nSource:         ARIN\\n\n\nPOCHandle:      NETWO635-ARIN\\nIsRole:         Y\\nLastName:       Network Operations Center\\nFirstName:      \\nStreet:         424 South 27th Street\\nCity:           Pittsburgh\\nState/Prov:     PA\\nCountry:        US\\nPostalCode:     15203\\nRegDate:        2004-08-16\\nUpdated:        2021-12-09\\nOfficePhone:    +1-877-263-8638\\nMailbox:        noc@met-net.com\\nMailbox:        noc@dqecom.com\\nSource:         ARIN\\n\n\nPOCHandle:      ADMIN421-ARIN\\nIsRole:         Y\\nLastName:       Admin\\nFirstName:      \\nStreet:         424 South 27th Street\\nStreet:         Suite 220\\nCity:           Pittsburgh\\nState/Prov:     PA\\nCountry:        US\\nPostalCode:     15203\\nRegDate:        2004-08-16\\nUpdated:        2022-04-12\\nOfficePhone:    +1-877-263-8638\\nMailbox:        hostmaster@dqecom.com\\nSource:         ARIN\\n\n\nPOCHandle:      ABUSE686-ARIN\\nIsRole:         Y\\nLastName:       Abuse\\nFirstName:      \\nStreet:         424 South 27th Street\\nCity:           Pittsburgh\\nState/Prov:     PA\\nCountry:        US\\nPostalCode:     15203\\nRegDate:        2004-08-16\\nUpdated:        2019-12-04\\nOfficePhone:    +1-877-263-8638\\nMailbox:        abuse@dqecom.com\\nSource:         ARIN\\n\n\nPOCHandle:      TECH139-ARIN\\nIsRole:         Y\\nLastName:       Tech\\nFirstName:      \\nStreet:         424 South 27th Street\\nCity:           Pittsburgh\\nState/Prov:     PA\\nCountry:        US\\nPostalCode:     15203\\nRegDate:        2004-08-16\\nUpdated:        2019-12-04\\nOfficePhone:    +1-877-263-8638\\nMailbox:        hostmaster@dqecom.com\\nSource:         ARIN\\n"}
{"id": "NIWCA", "name": "Naval Information Warfare Center Atlantic", "address": "", "street": "1 Innovation Dr.", "city": "Hanahan", "state": "SC", "postalcode": "29410", "country": "US", "admin_id": "DCHSC-ARIN", "tech_id": "DCHSC-ARIN\\NNAP11-ARIN", "abuse_id": "DCHSC-ARIN", "mnt_id": "DCHSC-ARIN", "email": "", "domain": "mail.mil", "created": "2019-03-18", "updated": "2020-07-27", "source": "arin", "raw": "OrgID:          NIWCA\\nOrgName:        Naval Information Warfare Center Atlantic\\nCanAllocate:    \\nStreet:         1 Innovation Dr.\\nCity:           Hanahan\\nState/Prov:     SC\\nCountry:        US\\nPostalCode:     29410\\nRegDate:        2019-03-18\\nUpdated:        2020-07-27\\nOrgAbuseHandle: DCHSC-ARIN\\nOrgAdminHandle: DCHSC-ARIN\\nOrgNOCHandle:   DCHSC-ARIN\\nOrgTechHandle:  DCHSC-ARIN\\nOrgTechHandle:  NAP11-ARIN\\nSource:         ARIN\\n\n\nPOCHandle:      DCHSC-ARIN\\nIsRole:         Y\\nLastName:       DC2HS CAP\\nFirstName:      \\nStreet:         1 Innovation Dr.\\nCity:           Hanahan\\nState/Prov:     SC\\nCountry:        US\\nPostalCode:     29410\\nRegDate:        2019-03-15\\nUpdated:        2021-03-15\\nOfficePhone:    +1-843-670-9066\\nMailbox:        louis.s.mondello.ctr@mail.mil\\nSource:         ARIN\\n\n\nPOCHandle:      NAP11-ARIN\\nIsRole:         Y\\nLastName:       NGDS Account Payable\\nFirstName:      \\nStreet:         Suite L PMB 310\\nStreet:         431 St James Ave\\nCity:           Goose Creek\\nState/Prov:     SC\\nCountry:        US\\nPostalCode:     29445\\nRegDate:        2020-05-29\\nUpdated:        2020-05-29\\nOfficePhone:    +1-843-408-4363\\nMailbox:        ap@ngds.com\\nSource:         ARIN\\n"}
{"id": "ASSIST-11", "name": "ASSIST", "address": "", "street": "2807 Monties", "city": "Arlington", "state": "TX", "postalcode": "76015", "country": "US", "admin_id": "DRH42-ARIN", "tech_id": "DRH42-ARIN", "abuse_id": "DRH42-ARIN", "mnt_id": "DRH42-ARIN", "email": "", "domain": "ct-assist.com", "created": "2020-05-22", "updated": "2020-05-22", "source": "arin", "raw": "OrgID:          ASSIST-11\\nOrgName:        ASSIST\\nCanAllocate:    \\nStreet:         2807 Monties\\nCity:           Arlington\\nState/Prov:     TX\\nCountry:        US\\nPostalCode:     76015\\nComment:        http://assist-inc.com\\nComment:        24 hours\\nRegDate:        2020-05-22\\nUpdated:        2020-05-22\\nOrgAbuseHandle: DRH42-ARIN\\nOrgAdminHandle: DRH42-ARIN\\nOrgDNSHandle:   DRH42-ARIN\\nOrgNOCHandle:   DRH42-ARIN\\nOrgRoutingHandle:   DRH42-ARIN\\nOrgTechHandle:  DRH42-ARIN\\nSource:         ARIN\\n\n\nPOCHandle:      DRH42-ARIN\\nIsRole:         N\\nLastName:       Rhea\\nFirstName:      Doug\\nStreet:         2807 Monties\\nCity:           Arlington\\nState/Prov:     TX\\nCountry:        US\\nPostalCode:     76015\\nRegDate:        2004-08-10\\nUpdated:        2021-08-15\\nOfficePhone:    +1-817-461-5233\\nMailbox:        support@assist-inc.com\\nSource:         ARIN\\n"}
{"id": "CIAL-2", "name": "Capstone Investment Advisors LLC", "address": "", "street": "250 Greenwich Street", "city": "New York", "state": "NY", "postalcode": "10007", "country": "US", "admin_id": "GROUP64-ARIN", "tech_id": "GROUP64-ARIN", "abuse_id": "GROUP64-ARIN", "mnt_id": "GROUP64-ARIN", "email": "", "domain": "capstoneco.com", "created": "2017-11-20", "updated": "2017-11-20", "source": "arin", "raw": "OrgID:          CIAL-2\\nOrgName:        Capstone Investment Advisors LLC\\nCanAllocate:    \\nStreet:         250 Greenwich Street\\nCity:           New York\\nState/Prov:     NY\\nCountry:        US\\nPostalCode:     10007\\nRegDate:        2017-11-20\\nUpdated:        2017-11-20\\nOrgAbuseHandle: GROUP64-ARIN\\nOrgAdminHandle: GROUP64-ARIN\\nOrgNOCHandle:   GROUP64-ARIN\\nOrgTechHandle:  GROUP64-ARIN\\nSource:         ARIN\\n\n\nPOCHandle:      GROUP64-ARIN\\nIsRole:         N\\nLastName:       Group\\nFirstName:      Technology\\nStreet:         250 Greenwich Street\\nCity:           New York\\nState/Prov:     NY\\nCountry:        US\\nPostalCode:     10007\\nRegDate:        2017-10-13\\nUpdated:        2021-04-07\\nOfficePhone:    +1-212-232-1420\\nMailbox:        infra2@capstoneco.com\\nSource:         ARIN\\n"}
{"id": "DPL-75", "name": "Day Pitney LLP", "address": "", "street": "242 Trumbull St", "city": "Hartford", "state": "CT", "postalcode": "06103", "country": "US", "admin_id": "DZIOP-ARIN", "tech_id": "DZIOP-ARIN", "abuse_id": "DZIOP-ARIN", "mnt_id": "DZIOP-ARIN", "email": "", "domain": "daypitney.com", "created": "2012-06-20", "updated": "2018-01-18", "source": "arin", "raw": "OrgID:          DPL-75\\nOrgName:        Day Pitney LLP\\nCanAllocate:    \\nStreet:         242 Trumbull St\\nCity:           Hartford\\nState/Prov:     CT\\nCountry:        US\\nPostalCode:     06103\\nComment:        http://www.daypitney.com\\nComment:        Standard NOC hours are 9am to 5pm EST\\nRegDate:        2012-06-20\\nUpdated:        2018-01-18\\nOrgAbuseHandle: DZIOP-ARIN\\nOrgAdminHandle: DZIOP-ARIN\\nOrgNOCHandle:   DZIOP-ARIN\\nOrgTechHandle:  DZIOP-ARIN\\nSource:         ARIN\\n\n\nPOCHandle:      DZIOP-ARIN\\nIsRole:         N\\nLastName:       Dziopa\\nFirstName:      Maciej\\nStreet:         242 Trumbull Street\\nCity:           Hartford\\nState/Prov:     CT\\nCountry:        US\\nPostalCode:     06103\\nRegDate:        2018-01-18\\nUpdated:        2019-01-18\\nOfficePhone:    +1-860-275-0386\\nMailbox:        mdziopa@daypitney.com\\nSource:         ARIN\\n"}
{"id": "MLTCA", "name": "Mud Lake Telephone Cooperative Association, Inc.", "address": "", "street": "59 West Main Street\\nPO Box 235", "city": "Dubois", "state": "ID", "postalcode": "83423", "country": "US", "admin_id": "MEADR4-ARIN", "tech_id": "MEADR4-ARIN", "abuse_id": "MEADR4-ARIN", "mnt_id": "MEADR4-ARIN", "email": "", "domain": "mudlake.net", "created": "2015-07-15", "updated": "2015-07-15", "source": "arin", "raw": "OrgID:          MLTCA\\nOrgName:        Mud Lake Telephone Cooperative Association, Inc.\\nCanAllocate:    \\nStreet:         59 West Main Street\\nStreet:         PO Box 235\\nCity:           Dubois\\nState/Prov:     ID\\nCountry:        US\\nPostalCode:     83423\\nRegDate:        2015-07-15\\nUpdated:        2015-07-15\\nOrgAbuseHandle: MEADR4-ARIN\\nOrgAdminHandle: MEADR4-ARIN\\nOrgNOCHandle:   MEADR4-ARIN\\nOrgTechHandle:  MEADR4-ARIN\\nSource:         ARIN\\n\n\nPOCHandle:      MEADR4-ARIN\\nIsRole:         N\\nLastName:       Mead\\nFirstName:      Randy\\nStreet:         59 West Main Street\\nStreet:         PO Box 235\\nCity:           Dubois\\nState/Prov:     ID\\nCountry:        US\\nPostalCode:     83423\\nRegDate:        2015-07-14\\nUpdated:        2015-07-14\\nOfficePhone:    +1-208-374-5401\\nFaxPhone:       +1-208-374-5688\\nMobilePhone:    +1-208-390-5784\\nMailbox:        rmead@mudlake.net\\nSource:         ARIN\\n"}
{"id": "L3SER", "name": "Enterprise IT Solutions Div.", "address": "", "street": "11955 Freedom Drive\\n3rd Floor", "city": "Reston", "state": "VA", "postalcode": "20190", "country": "US", "admin_id": "NGUYE479-ARIN", "tech_id": "NGUYE479-ARIN", "abuse_id": "NGUYE479-ARIN", "mnt_id": "LNSSN-ARIN\\NNGUYE479-ARIN", "email": "", "domain": "caci.com", "created": "2009-10-28", "updated": "2017-02-15", "source": "arin", "raw": "OrgID:          L3SER\\nOrgName:        Enterprise IT Solutions Div.\\nCanAllocate:    \\nStreet:         11955 Freedom Drive\\nStreet:         3rd Floor\\nCity:           Reston\\nState/Prov:     VA\\nCountry:        US\\nPostalCode:     20190\\nComment:        Now known as L-3 National Security Solutions (NSS)\\nRegDate:        2009-10-28\\nUpdated:        2017-02-15\\nOrgAbuseHandle: NGUYE479-ARIN\\nOrgAdminHandle: NGUYE479-ARIN\\nOrgNOCHandle:   LNSSN-ARIN\\nOrgNOCHandle:   NGUYE479-ARIN\\nOrgTechHandle:  NGUYE479-ARIN\\nSource:         ARIN\\n\n\nPOCHandle:      NGUYE479-ARIN\\nIsRole:         N\\nLastName:       Nguyen\\nFirstName:      Ho\\nStreet:         11955 Freedom Drive\\nCity:           Reston\\nState/Prov:     VA\\nCountry:        US\\nPostalCode:     20190\\nRegDate:        2014-06-19\\nUpdated:        2017-02-14\\nOfficePhone:    +1-703-434-4142\\nMobilePhone:    +1-571-425-3059\\nMailbox:        ho.nguyen@caci.com\\nMailbox:        ho.nguyen@l-3com.com\\nSource:         ARIN\\n\n\nPOCHandle:      LNSSN-ARIN\\nIsRole:         Y\\nLastName:       L3NSS NetTelco\\nFirstName:      \\nStreet:         11955 Freedom Drive\\nCity:           Reston\\nState/Prov:     VA\\nCountry:        US\\nPostalCode:     20190\\nRegDate:        2014-06-19\\nUpdated:        2014-06-19\\nOfficePhone:    +1-703-434-4000\\nMailbox:        dlits-ocionettelco@l-3com.com\\nSource:         ARIN\\n"}
{"id": "BL-741", "name": "CENTRAL COAST INTERNET", "address": "", "street": "5961 FAIRVIEW RD", "city": "HOLLISTER", "state": "CA", "postalcode": "95023-9334", "country": "US", "admin_id": "BROCK212-ARIN", "tech_id": "BROCK212-ARIN", "abuse_id": "BROCK212-ARIN", "mnt_id": "BROCK212-ARIN", "email": "", "domain": "centralcoastinternet.com", "created": "2018-08-15", "updated": "2021-09-26", "source": "arin", "raw": "OrgID:          BL-741\\nOrgName:        CENTRAL COAST INTERNET\\nCanAllocate:    \\nStreet:         5961 FAIRVIEW RD\\nCity:           HOLLISTER\\nState/Prov:     CA\\nCountry:        US\\nPostalCode:     95023-9334\\nComment:        http://www.centralcoastinternet.comoast\\nComment:        Hours 8am-7pm Pacific Time 831-630-9361\\nComment:        info@centralcoastinternet.com 24/7\\nRegDate:        2018-08-15\\nUpdated:        2021-09-26\\nOrgAbuseHandle: BROCK212-ARIN\\nOrgAdminHandle: BROCK212-ARIN\\nOrgDNSHandle:   BROCK212-ARIN\\nOrgNOCHandle:   BROCK212-ARIN\\nOrgRoutingHandle:   BROCK212-ARIN\\nOrgTechHandle:  BROCK212-ARIN\\nSource:         ARIN\\n\n\nPOCHandle:      BROCK212-ARIN\\nIsRole:         N\\nLastName:       Brock\\nFirstName:      Patricia\\nStreet:         5961 Fairview Road\\nCity:           Hollister\\nState/Prov:     CA\\nCountry:        US\\nPostalCode:     95023-9334\\nRegDate:        2018-07-17\\nUpdated:        2022-07-31\\nOfficePhone:    +1-866-670-5969\\nMobilePhone:    +1-831-313-3686\\nMobilePhone:    +1-831-998-4438\\nOfficePhone:    +1-831-630-9361\\nMailbox:        scott@centralcoastinternet.com\\nMailbox:        trish@centralcoastinternet.com\\nMailbox:        cci@centralcoastinternet.com\\nSource:         ARIN\\n"}
{"id": "EHL-71", "name": "Lee Edward Enterprises", "address": "", "street": "1442 Cosens Rd - PO BOX 633", "city": "Iroquois Falls", "state": "ON", "postalcode": "P0K 1E0", "country": "CA", "admin_id": "EDWAR742-ARIN", "tech_id": "EDWAR742-ARIN", "abuse_id": "EDWAR742-ARIN", "mnt_id": "EDWAR742-ARIN", "email": "", "domain": "leeedward.enterprises", "created": "2020-02-04", "updated": "2020-10-02", "source": "arin", "raw": "OrgID:          EHL-71\\nOrgName:        Lee Edward Enterprises\\nCanAllocate:    \\nStreet:         1442 Cosens Rd - PO BOX 633\\nCity:           Iroquois Falls\\nState/Prov:     ON\\nCountry:        CA\\nPostalCode:     P0K 1E0\\nComment:        http://networks.leeedward.enterprises\\nComment:        Standard hours are 8:00 AM to 10:00 PM EST\\nRegDate:        2020-02-04\\nUpdated:        2020-10-02\\nOrgAbuseHandle: EDWAR742-ARIN\\nOrgAdminHandle: EDWAR742-ARIN\\nOrgDNSHandle:   EDWAR742-ARIN\\nOrgNOCHandle:   EDWAR742-ARIN\\nOrgRoutingHandle:   EDWAR742-ARIN\\nOrgTechHandle:  EDWAR742-ARIN\\nSource:         ARIN\\n\n\nPOCHandle:      EDWAR742-ARIN\\nIsRole:         N\\nLastName:       Edward\\nFirstName:      Lee\\nStreet:         1442 Cosens Rd, PO BOX 633\\nStreet:         PO BOX 633\\nCity:           Iroquois Falls\\nState/Prov:     ON\\nCountry:        CA\\nPostalCode:     P0K 1E0\\nRegDate:        2019-04-30\\nUpdated:        2021-09-21\\nOfficePhone:    +1-705-831-1517\\nMailbox:        lee@edwardhomestead.com\\nSource:         ARIN\\n"}
{"id": "NMC-118", "name": "Newmont Mining Corporation", "address": "", "street": "6900 Layton Street - Suite 600", "city": "Denver", "state": "CO", "postalcode": "80237", "country": "US", "admin_id": "FILLM3-ARIN", "tech_id": "DNSAD325-ARIN", "abuse_id": "DNSAD325-ARIN", "mnt_id": "DNSAD325-ARIN", "email": "", "domain": "newmont.com", "created": "2017-10-10", "updated": "2021-09-17", "source": "arin", "raw": "OrgID:          NMC-118\\nOrgName:        Newmont Mining Corporation\\nCanAllocate:    \\nStreet:         6900 Layton Street - Suite 600\\nCity:           Denver\\nState/Prov:     CO\\nCountry:        US\\nPostalCode:     80237\\nRegDate:        2017-10-10\\nUpdated:        2021-09-17\\nOrgAbuseHandle: DNSAD325-ARIN\\nOrgAdminHandle: FILLM3-ARIN\\nOrgNOCHandle:   DNSAD325-ARIN\\nOrgTechHandle:  DNSAD325-ARIN\\nSource:         ARIN\\n\n\nPOCHandle:      DNSAD325-ARIN\\nIsRole:         Y\\nLastName:       DNS Admin\\nFirstName:      \\nStreet:         6900 Layton Street - Suite 600\\nCity:           Denver\\nState/Prov:     CO\\nCountry:        US\\nPostalCode:     80237\\nRegDate:        2017-09-19\\nUpdated:        2021-09-17\\nOfficePhone:    +1-303-837-7414\\nMailbox:        noc@newmont.com\\nMailbox:        dnsadmin@newmont.com\\nSource:         ARIN\\n\n\nPOCHandle:      FILLM3-ARIN\\nIsRole:         N\\nLastName:       Fillmore\\nFirstName:      Mitchell\\nStreet:         6900 Layton Street - Suite 600\\nCity:           Denver\\nState/Prov:     CO\\nCountry:        US\\nPostalCode:     80237\\nRegDate:        2017-09-17\\nUpdated:        2021-09-17\\nMobilePhone:    +1-303-881-0392\\nOfficePhone:    +1-303-837-5245\\nMailbox:        mitch.fillmore@newmont.com\\nSource:         ARIN\\n"}
{"id": "FNF-4", "name": "Fidelity National Financial Inc.", "address": "", "street": "601 Riverside Avenue", "city": "Jacksonville", "state": "FL", "postalcode": "32204", "country": "US", "admin_id": "FMA3-ARIN", "tech_id": "FMA3-ARIN\\NIRAVA7-ARIN\\NWHITI17-ARIN", "abuse_id": "FMA3-ARIN", "mnt_id": "FMA3-ARIN", "email": "", "domain": "fnf.com", "created": "2004-05-12", "updated": "2022-01-21", "source": "arin", "raw": "OrgID:          FNF-4\\nOrgName:        Fidelity National Financial Inc.\\nCanAllocate:    \\nStreet:         601 Riverside Avenue\\nCity:           Jacksonville\\nState/Prov:     FL\\nCountry:        US\\nPostalCode:     32204\\nRegDate:        2004-05-12\\nUpdated:        2022-01-21\\nOrgAbuseHandle: FMA3-ARIN\\nOrgAdminHandle: FMA3-ARIN\\nOrgDNSHandle:   FMA3-ARIN\\nOrgNOCHandle:   FMA3-ARIN\\nOrgRoutingHandle:   FMA3-ARIN\\nOrgRoutingHandle:   IRAVA7-ARIN\\nOrgTechHandle:  FMA3-ARIN\\nOrgTechHandle:  IRAVA7-ARIN\\nOrgTechHandle:  WHITI17-ARIN\\nSource:         ARIN\\n\n\nPOCHandle:      WHITI17-ARIN\\nIsRole:         N\\nLastName:       Whiting\\nFirstName:      Will\\nStreet:         601 Riverside Ave, bldg 5\\nCity:           Jacksonville\\nState/Prov:     FL\\nCountry:        US\\nPostalCode:     32204\\nRegDate:        2022-01-21\\nUpdated:        2022-01-21\\nOfficePhone:    +1-412-802-5806\\nMailbox:        william.whiting@fnf.com\\nSource:         ARIN\\n\n\nPOCHandle:      FMA3-ARIN\\nIsRole:         N\\nLastName:       Matin\\nFirstName:      Freidoon\\nStreet:         601 Riverside Ave\\nCity:           Jacksonville\\nState/Prov:     FL\\nCountry:        US\\nPostalCode:     32204\\nRegDate:        2002-10-29\\nUpdated:        2022-02-14\\nOfficePhone:    +1-888-934-3354\\nMailbox:        ipadmin@fnf.com\\nSource:         ARIN\\n\n\nPOCHandle:      IRAVA7-ARIN\\nIsRole:         N\\nLastName:       Iravani\\nFirstName:      Shahram\\nStreet:         601 RIVERSIDE AVENUE\\nCity:           JACKSONVILLE\\nState/Prov:     FL\\nCountry:        US\\nPostalCode:     32204\\nRegDate:        2020-04-07\\nUpdated:        2022-05-31\\nOfficePhone:    +1-714-665-3700\\nMailbox:        shahram.iravani@fnf.com\\nSource:         ARIN\\n"}
{"id": "IMPER-62", "name": "IMPERVA INC", "address": "", "street": "3400 bridge parkway suite 200", "city": "Redwood City", "state": "CA", "postalcode": "94065", "country": "US", "admin_id": "MEIDA-ARIN", "tech_id": "MEIDA-ARIN", "abuse_id": "MEIDA-ARIN", "mnt_id": "MEIDA-ARIN", "email": "", "domain": "imperva.com", "created": "2013-06-06", "updated": "2018-08-09", "source": "arin", "raw": "OrgID:          IMPER-62\\nOrgName:        IMPERVA INC\\nCanAllocate:    \\nStreet:         3400 bridge parkway suite 200\\nCity:           Redwood City\\nState/Prov:     CA\\nCountry:        US\\nPostalCode:     94065\\nComment:        https://www.imperva.com\\nRegDate:        2013-06-06\\nUpdated:        2018-08-09\\nOrgAbuseHandle: MEIDA-ARIN\\nOrgAdminHandle: MEIDA-ARIN\\nOrgNOCHandle:   MEIDA-ARIN\\nOrgTechHandle:  MEIDA-ARIN\\nSource:         ARIN\\n\n\nPOCHandle:      MEIDA-ARIN\\nIsRole:         N\\nLastName:       Meidan\\nFirstName:      Adir\\nStreet:         1 Curiosity Way\\nCity:           San Mateo\\nState/Prov:     CA\\nCountry:        US\\nPostalCode:     94403\\nRegDate:        2017-06-04\\nUpdated:        2022-08-09\\nMobilePhone:    +1-669-304-7920\\nOfficePhone:    +1-650-832-6050\\nMailbox:        it-networking@imperva.com\\nMailbox:        adir.meidan@imperva.com\\nSource:         ARIN\\n"}
{"id": "PPSL-13", "name": "Pizza Phone", "address": "", "street": "4915 Contec Dr", "city": "Lansing", "state": "MI", "postalcode": "48910", "country": "US", "admin_id": "ROWEJ8-ARIN", "tech_id": "ROWEJ8-ARIN", "abuse_id": "ROWEJ8-ARIN", "mnt_id": "ROWEJ8-ARIN", "email": "", "domain": "pizzaphonesystem.com", "created": "2013-09-20", "updated": "2016-02-02", "source": "arin", "raw": "OrgID:          PPSL-13\\nOrgName:        Pizza Phone\\nCanAllocate:    \\nStreet:         4915 Contec Dr\\nCity:           Lansing\\nState/Prov:     MI\\nCountry:        US\\nPostalCode:     48910\\nRegDate:        2013-09-20\\nUpdated:        2016-02-02\\nOrgAbuseHandle: ROWEJ8-ARIN\\nOrgAdminHandle: ROWEJ8-ARIN\\nOrgNOCHandle:   ROWEJ8-ARIN\\nOrgTechHandle:  ROWEJ8-ARIN\\nSource:         ARIN\\n\n\nPOCHandle:      ROWEJ8-ARIN\\nIsRole:         N\\nLastName:       Rowe\\nFirstName:      Josh\\nStreet:         4915 Contec Dr\\nCity:           Lansing\\nState/Prov:     MI\\nCountry:        US\\nPostalCode:     48910\\nRegDate:        2013-09-18\\nUpdated:        2016-02-27\\nFaxPhone:       +1-517-913-5932\\nOfficePhone:    +1-517-222-0345\\nMailbox:        jrowe@pizzaphonesystem.com\\nSource:         ARIN\\n"}
{"id": "SCL-520", "name": "Sumo Capital LLC", "address": "", "street": "190 South LaSalle Street\\nSuite 1620", "city": "Chicago", "state": "IL", "postalcode": "60603", "country": "US", "admin_id": "LINGF3-ARIN", "tech_id": "LINGF3-ARIN", "abuse_id": "LINGF3-ARIN", "mnt_id": "LINGF3-ARIN", "email": "", "domain": "sumocap.com", "created": "2020-12-22", "updated": "2020-12-22", "source": "arin", "raw": "OrgID:          SCL-520\\nOrgName:        Sumo Capital LLC\\nCanAllocate:    \\nStreet:         190 South LaSalle Street\\nStreet:         Suite 1620\\nCity:           Chicago\\nState/Prov:     IL\\nCountry:        US\\nPostalCode:     60603\\nRegDate:        2020-12-22\\nUpdated:        2020-12-22\\nOrgAbuseHandle: LINGF3-ARIN\\nOrgAdminHandle: LINGF3-ARIN\\nOrgDNSHandle:   LINGF3-ARIN\\nOrgNOCHandle:   LINGF3-ARIN\\nOrgRoutingHandle:   LINGF3-ARIN\\nOrgTechHandle:  LINGF3-ARIN\\nSource:         ARIN\\n\n\nPOCHandle:      LINGF3-ARIN\\nIsRole:         N\\nLastName:       Ling\\nFirstName:      Fred\\nStreet:         190 South LaSalle Street\\nStreet:         Suite 1620\\nCity:           Chicago\\nState/Prov:     IL\\nCountry:        US\\nPostalCode:     60603\\nRegDate:        2020-12-21\\nUpdated:        2020-12-21\\nOfficePhone:    +1-631-443-3413\\nMailbox:        fred@sumocap.com\\nSource:         ARIN\\n"}
{"id": "CB-494", "name": "County of Boone", "address": "", "street": "801 E Walnut\\nRoom 220", "city": "Columbia", "state": "MO", "postalcode": "65201", "country": "US", "admin_id": "IRISH6-ARIN", "tech_id": "IRISH6-ARIN", "abuse_id": "IRISH6-ARIN", "mnt_id": "IRISH6-ARIN", "email": "", "domain": "boonecountymo.org", "created": "2015-09-09", "updated": "2015-09-09", "source": "arin", "raw": "OrgID:          CB-494\\nOrgName:        County of Boone\\nCanAllocate:    \\nStreet:         801 E Walnut\\nStreet:         Room 220\\nCity:           Columbia\\nState/Prov:     MO\\nCountry:        US\\nPostalCode:     65201\\nRegDate:        2015-09-09\\nUpdated:        2015-09-09\\nOrgAbuseHandle: IRISH6-ARIN\\nOrgAdminHandle: IRISH6-ARIN\\nOrgNOCHandle:   IRISH6-ARIN\\nOrgTechHandle:  IRISH6-ARIN\\nSource:         ARIN\\n\n\nPOCHandle:      IRISH6-ARIN\\nIsRole:         N\\nLastName:       Irish\\nFirstName:      Ryan\\nStreet:         801 E Walnut\\nStreet:         Room 220\\nCity:           Columbia\\nState/Prov:     MO\\nCountry:        US\\nPostalCode:     65201\\nRegDate:        2015-09-03\\nUpdated:        2018-04-11\\nOfficePhone:    +1-573-886-4445\\nMailbox:        rirish@boonecountymo.org\\nSource:         ARIN\\n"}
{"id": "WSTL", "name": "Westel, Inc.", "address": "", "street": "12015 Park 35 Circle\\nBuilding F Suite 1208", "city": "Austin", "state": "TX", "postalcode": "78753", "country": "US", "admin_id": "PHO50-ARIN", "tech_id": "PHO50-ARIN", "abuse_id": "WAC21-ARIN", "mnt_id": "WESTE82-ARIN", "email": "", "domain": "westel.net", "created": "1997-09-15", "updated": "2017-01-28", "source": "arin", "raw": "OrgID:          WSTL\\nOrgName:        Westel, Inc.\\nCanAllocate:    \\nStreet:         12015 Park 35 Circle\\nStreet:         Building F Suite 1208\\nCity:           Austin\\nState/Prov:     TX\\nCountry:        US\\nPostalCode:     78753\\nRegDate:        1997-09-15\\nUpdated:        2017-01-28\\nOrgAbuseHandle: WAC21-ARIN\\nOrgAdminHandle: PHO50-ARIN\\nOrgNOCHandle:   WESTE82-ARIN\\nOrgTechHandle:  PHO50-ARIN\\nSource:         ARIN\\n\n\nPOCHandle:      WAC21-ARIN\\nIsRole:         Y\\nLastName:       Westel Abuse Contact\\nFirstName:      \\nStreet:         12015 Park 35 Circle\\nStreet:         Building F Suite 1208\\nCity:           Austin\\nState/Prov:     TX\\nCountry:        US\\nPostalCode:     78753\\nRegDate:        2010-12-01\\nUpdated:        2021-11-30\\nOfficePhone:    +1-512-480-5500\\nMailbox:        abuse@westel.net\\nSource:         ARIN\\n\n\nPOCHandle:      WESTE82-ARIN\\nIsRole:         Y\\nLastName:       Westel NOC\\nFirstName:      \\nStreet:         12015 Park 35 Circle \\nStreet:         Building F Suite 1208\\nCity:           Austin\\nState/Prov:     TX\\nCountry:        US\\nPostalCode:     78753\\nRegDate:        2012-11-30\\nUpdated:        2021-12-02\\nOfficePhone:    +1-800-580-5519\\nMailbox:        network-support@westel.net\\nSource:         ARIN\\n\n\nPOCHandle:      PHO50-ARIN\\nIsRole:         N\\nLastName:       Oestreich\\nFirstName:      Philip\\nStreet:         12015 Park 35 Circle\\nStreet:         Building F Suite 1208\\nCity:           Austin\\nState/Prov:     TX\\nCountry:        US\\nPostalCode:     78753\\nRegDate:        2007-12-10\\nUpdated:        2021-12-03\\nOfficePhone:    +1-512-480-5500\\nMailbox:        philo@westel.net\\nSource:         ARIN\\n"}
{"id": "GONZAG", "name": "Gonzaga University", "address": "", "street": "IT / Network Support", "city": "Spokane", "state": "WA", "postalcode": "99258-0092", "country": "US", "admin_id": "LPE27-ARIN", "tech_id": "LPE27-ARIN", "abuse_id": "LPE27-ARIN", "mnt_id": "NOC2217-ARIN", "email": "", "domain": "gonzaga.edu", "created": "1991-03-26", "updated": "2012-04-25", "source": "arin", "raw": "OrgID:          GONZAG\\nOrgName:        Gonzaga University\\nCanAllocate:    \\nStreet:         IT / Network Support\\nCity:           Spokane\\nState/Prov:     WA\\nCountry:        US\\nPostalCode:     99258-0092\\nRegDate:        1991-03-26\\nUpdated:        2012-04-25\\nOrgAbuseHandle: LPE27-ARIN\\nOrgAdminHandle: LPE27-ARIN\\nOrgNOCHandle:   NOC2217-ARIN\\nOrgTechHandle:  LPE27-ARIN\\nSource:         ARIN\\n\n\nPOCHandle:      NOC2217-ARIN\\nIsRole:         Y\\nLastName:       Network Operations Center\\nFirstName:      \\nStreet:         IT/Network Support / Ad Box 92\\nStreet:         502 East Boone Avenue\\nCity:           Spokane\\nState/Prov:     WA\\nCountry:        US\\nPostalCode:     99258-0092\\nRegDate:        2006-08-04\\nUpdated:        2012-04-25\\nOfficePhone:    +1-509-328-4220\\nMailbox:        noc@gonzaga.edu\\nSource:         ARIN\\n\n\nPOCHandle:      LPE27-ARIN\\nIsRole:         N\\nLastName:       Perkins\\nFirstName:      Laurence\\nStreet:         IT/Network Support / Ad Box 92\\nStreet:         502 East Boone Avenue\\nCity:           Spokane\\nState/Prov:     WA\\nCountry:        US\\nPostalCode:     99258-0092\\nRegDate:        2006-07-31\\nUpdated:        2012-04-25\\nOfficePhone:    +1-509-328-4220\\nMailbox:        perkins@its.gonzaga.edu\\nSource:         ARIN\\n"}
{"id": "XTC-5", "name": "XBASE Technologies Corp.", "address": "", "street": "60 Prince Andrew Place, Unit B", "city": "Toronto ON", "state": "ON", "postalcode": "M3C 2H4", "country": "CA", "admin_id": "RE-ORG-ARIN", "tech_id": "RE-ORG-ARIN", "abuse_id": "RE-ORG-ARIN", "mnt_id": "RE-ORG-ARIN", "email": "", "domain": "xbase.com", "created": "1993-12-14", "updated": "2017-05-01", "source": "arin", "raw": "OrgID:          XTC-5\\nOrgName:        XBASE Technologies Corp.\\nCanAllocate:    \\nStreet:         60 Prince Andrew Place, Unit B\\nCity:           Toronto ON\\nState/Prov:     ON\\nCountry:        CA\\nPostalCode:     M3C 2H4\\nRegDate:        1993-12-14\\nUpdated:        2017-05-01\\nOrgAbuseHandle: RE-ORG-ARIN\\nOrgAdminHandle: RE-ORG-ARIN\\nOrgNOCHandle:   RE-ORG-ARIN\\nOrgTechHandle:  RE-ORG-ARIN\\nSource:         ARIN\\n\n\nPOCHandle:      RE-ORG-ARIN\\nIsRole:         Y\\nLastName:       Registrar,\\nFirstName:      \\nStreet:         60 Prince Andrew Place, Unit B\\nCity:           Toronto\\nState/Prov:     ON\\nCountry:        CA\\nPostalCode:     M3C 2H4\\nRegDate:        1999-09-13\\nUpdated:        2022-05-04\\nOfficePhone:    +1-416-340-1020\\nMailbox:        registrar@xbase.com\\nSource:         ARIN\\n"}
{"id": "STG-122", "name": "SALT", "address": "", "street": "The Pavilion, Cricket Square\\n171A Elgin Ave.", "city": "Georgetown", "state": "Grand Cayman", "postalcode": "KY1-9006", "country": "KY", "admin_id": "ADMIN7001-ARIN", "tech_id": "ADMIN7001-ARIN", "abuse_id": "ADMIN7001-ARIN", "mnt_id": "ADMIN7001-ARIN", "email": "", "domain": "salt.ky", "created": "2019-02-13", "updated": "2020-10-06", "source": "arin", "raw": "OrgID:          STG-122\\nOrgName:        SALT\\nCanAllocate:    \\nStreet:         The Pavilion, Cricket Square\\nStreet:         171A Elgin Ave.\\nCity:           Georgetown\\nState/Prov:     Grand Cayman\\nCountry:        KY\\nPostalCode:     KY1-9006\\nComment:        Cloud & Technology Solution Provider\\nRegDate:        2019-02-13\\nUpdated:        2020-10-06\\nOrgAbuseHandle: ADMIN7001-ARIN\\nOrgAdminHandle: ADMIN7001-ARIN\\nOrgNOCHandle:   ADMIN7001-ARIN\\nOrgTechHandle:  ADMIN7001-ARIN\\nSource:         ARIN\\n\n\nPOCHandle:      ADMIN7001-ARIN\\nIsRole:         Y\\nLastName:       Administrator\\nFirstName:      \\nStreet:         The Pavilion, Cricket Square\\nStreet:         171A Elgin Ave\\nCity:           Georgetown\\nState/Prov:     Grand Cayman\\nCountry:        KY\\nPostalCode:     KY1-9006\\nRegDate:        2019-02-12\\nUpdated:        2022-03-29\\nOfficePhone:    +1-345-749-7272\\nMailbox:        support@salt.ky\\nSource:         ARIN\\n"}
{"id": "JS-3", "name": "JMF Solutions, Inc", "address": "", "street": "1008 Randall Ave", "city": "Daphne", "state": "AL", "postalcode": "36526", "country": "US", "admin_id": "JMMF-ARIN", "tech_id": "IPADM582-ARIN\\NJMMF-ARIN\\NPAVEL35-ARIN", "abuse_id": "IPABU15-ARIN", "mnt_id": "IPADM582-ARIN", "email": "", "domain": "jmfsolutions.net", "created": "2011-05-06", "updated": "2021-09-24", "source": "arin", "raw": "OrgID:          JS-3\\nOrgName:        JMF Solutions, Inc\\nCanAllocate:    \\nStreet:         1008 Randall Ave\\nCity:           Daphne\\nState/Prov:     AL\\nCountry:        US\\nPostalCode:     36526\\nRegDate:        2011-05-06\\nUpdated:        2021-09-24\\nOrgAbuseHandle: IPABU15-ARIN\\nOrgAdminHandle: JMMF-ARIN\\nOrgNOCHandle:   IPADM582-ARIN\\nOrgTechHandle:  IPADM582-ARIN\\nOrgTechHandle:  JMMF-ARIN\\nOrgTechHandle:  PAVEL35-ARIN\\nSource:         ARIN\\n\n\nPOCHandle:      IPADM582-ARIN\\nIsRole:         Y\\nLastName:       IP Admin\\nFirstName:      \\nStreet:         1008 Randall Ave\\nCity:           Daphne\\nState/Prov:     AL\\nCountry:        US\\nPostalCode:     36526\\nRegDate:        2011-09-03\\nUpdated:        2022-08-09\\nOfficePhone:    +1-251-517-5070\\nMailbox:        ip-admin@jmfsolutions.net\\nSource:         ARIN\\n\n\nPOCHandle:      PAVEL35-ARIN\\nIsRole:         N\\nLastName:       Pavel\\nFirstName:      Lucian\\nStreet:         156 North County Highway 393, Suite 4\\nCity:           Santa Rosa Beach\\nState/Prov:     FL\\nCountry:        US\\nPostalCode:     32459\\nRegDate:        2020-09-24\\nUpdated:        2021-09-24\\nOfficePhone:    +1-850-502-2332\\nMailbox:        lpavel@wavefly.com\\nSource:         ARIN\\n\n\nPOCHandle:      JMMF-ARIN\\nIsRole:         N\\nLastName:       Mike Francis\\nFirstName:      John\\nStreet:         1008 Randall Ave\\nCity:           Daphne\\nState/Prov:     AL\\nCountry:        US\\nPostalCode:     36532\\nRegDate:        2013-01-07\\nUpdated:        2022-02-28\\nMobilePhone:    +1-251-716-9776\\nOfficePhone:    +1-251-517-5069\\nFaxPhone:       +1-251-272-3871\\nMailbox:        mfrancis@jmfsolutions.net\\nSource:         ARIN\\n\n\nPOCHandle:      IPABU15-ARIN\\nIsRole:         Y\\nLastName:       IP Abuse\\nFirstName:      \\nStreet:         1203 US Hwy 98\\nStreet:         Suite 2-H\\nCity:           Daphne\\nState/Prov:     AL\\nCountry:        US\\nPostalCode:     36526\\nRegDate:        2011-09-03\\nUpdated:        2018-11-30\\nOfficePhone:    +1-251-517-5070\\nMailbox:        ip-abuse@jmfsolutions.net\\nSource:         ARIN\\n"}
{"id": "ZC-35", "name": "ZONA COMMUNICATIONS", "address": "", "street": "14273 W. Grand Ave\\nSuite 102", "city": "Surprise", "state": "AZ", "postalcode": "85374", "country": "US", "admin_id": "ZONAA-ARIN", "tech_id": "ZONAT-ARIN", "abuse_id": "ZONAA1-ARIN", "mnt_id": "ZONAN-ARIN", "email": "", "domain": "zonacommunications.com", "created": "2013-09-25", "updated": "2021-05-11", "source": "arin", "raw": "OrgID:          ZC-35\\nOrgName:        ZONA COMMUNICATIONS\\nCanAllocate:    \\nStreet:         14273 W. Grand Ave\\nStreet:         Suite 102\\nCity:           Surprise\\nState/Prov:     AZ\\nCountry:        US\\nPostalCode:     85374\\nRegDate:        2013-09-25\\nUpdated:        2021-05-11\\nOrgAbuseHandle: ZONAA1-ARIN\\nOrgAdminHandle: ZONAA-ARIN\\nOrgNOCHandle:   ZONAN-ARIN\\nOrgTechHandle:  ZONAT-ARIN\\nSource:         ARIN\\n\n\nPOCHandle:      ZONAT-ARIN\\nIsRole:         Y\\nLastName:       ZonaTech\\nFirstName:      \\nStreet:         14273 W. Grand Ave\\nStreet:         Suite #102\\nCity:           Surprise \\nState/Prov:     AZ\\nCountry:        US\\nPostalCode:     85374\\nRegDate:        2021-05-03\\nUpdated:        2022-05-11\\nOfficePhone:    +1-623-455-4500\\nMailbox:        iptech@zonawyyerd.com\\nSource:         ARIN\\n\n\nPOCHandle:      ZONAA1-ARIN\\nIsRole:         Y\\nLastName:       ZonaAbuse\\nFirstName:      \\nStreet:         14273 W. Grand Ave\\nStreet:         Suite #102\\nCity:           Surprise \\nState/Prov:     AZ\\nCountry:        US\\nPostalCode:     85374\\nRegDate:        2021-05-03\\nUpdated:        2022-05-11\\nOfficePhone:    +1-623-455-4500\\nMailbox:        ipabuse@zonawyyerd.com\\nSource:         ARIN\\n\n\nPOCHandle:      ZONAA-ARIN\\nIsRole:         Y\\nLastName:       ZonaAdmin\\nFirstName:      \\nStreet:         14273 W. Grand Ave\\nStreet:         Suite #102\\nCity:           Surprise\\nState/Prov:     AZ\\nCountry:        US\\nPostalCode:     85374\\nRegDate:        2021-05-03\\nUpdated:        2022-05-11\\nOfficePhone:    +1-623-455-4500\\nMailbox:        ipadmin@zonawyyerd.com\\nSource:         ARIN\\n\n\nPOCHandle:      ZONAN-ARIN\\nIsRole:         Y\\nLastName:       ZonaNOC\\nFirstName:      \\nStreet:         14273 W. Grand Ave\\nStreet:         Suite #102\\nCity:           Surprise\\nState/Prov:     AZ\\nCountry:        US\\nPostalCode:     85374\\nRegDate:        2021-05-03\\nUpdated:        2022-05-11\\nOfficePhone:    +1-623-455-4500\\nMailbox:        ipnoc@zonawyyerd.com\\nSource:         ARIN\\n"}
{"id": "PC-819", "name": "PCL Constructors INC", "address": "", "street": "9915 - 56 Avenue", "city": "Edmonton", "state": "AB", "postalcode": "T6E 5L7", "country": "CA", "admin_id": "PNT5-ARIN", "tech_id": "PNT5-ARIN", "abuse_id": "PNT5-ARIN", "mnt_id": "PNT5-ARIN", "email": "", "domain": "pcl.com", "created": "2015-09-10", "updated": "2015-09-10", "source": "arin", "raw": "OrgID:          PC-819\\nOrgName:        PCL Constructors INC\\nCanAllocate:    \\nStreet:         9915 - 56 Avenue\\nCity:           Edmonton\\nState/Prov:     AB\\nCountry:        CA\\nPostalCode:     T6E 5L7\\nComment:        PCL Network Team\\nComment:         routermgmt@pcl.com\\nComment:        http://www.pcl.com\\nRegDate:        2015-09-10\\nUpdated:        2015-09-10\\nOrgAbuseHandle: PNT5-ARIN\\nOrgAdminHandle: PNT5-ARIN\\nOrgNOCHandle:   PNT5-ARIN\\nOrgTechHandle:  PNT5-ARIN\\nSource:         ARIN\\n\n\nPOCHandle:      PNT5-ARIN\\nIsRole:         Y\\nLastName:       PCL Network Team\\nFirstName:      \\nStreet:         9915-56 Avenue\\nCity:           Edmonton\\nState/Prov:     AB\\nCountry:        CA\\nPostalCode:     T6E 5L7\\nRegDate:        2015-09-09\\nUpdated:        2021-09-21\\nMobilePhone:    +1-780-733-5000\\nOfficePhone:    +1-780-733-5000\\nMailbox:        routermgmt@pcl.com\\nSource:         ARIN\\n"}
{"id": "EBLUL", "name": "Weelax", "address": "", "street": "128 RUE DE LA BOETIE", "city": "PARIS", "state": "FRANCE", "postalcode": "75008", "country": "FR", "admin_id": "NOCWE-ARIN", "tech_id": "NOCWE-ARIN", "abuse_id": "AWB9-ARIN", "mnt_id": "NOCWE-ARIN", "email": "", "domain": "weelax.fr", "created": "2012-11-26", "updated": "2022-08-07", "source": "arin", "raw": "OrgID:          EBLUL\\nOrgName:        Weelax\\nCanAllocate:    \\nStreet:         128 RUE DE LA BOETIE\\nCity:           PARIS\\nState/Prov:     FRANCE\\nCountry:        FR\\nPostalCode:     75008\\nComment:        https://www.weelax.fr\\nRegDate:        2012-11-26\\nUpdated:        2022-08-07\\nOrgAbuseHandle: AWB9-ARIN\\nOrgAdminHandle: NOCWE-ARIN\\nOrgNOCHandle:   NOCWE-ARIN\\nOrgTechHandle:  NOCWE-ARIN\\nSource:         ARIN\\n\n\nPOCHandle:      NOCWE-ARIN\\nIsRole:         Y\\nLastName:       NOC WEELAX-BOX\\nFirstName:      \\nStreet:         128 RUE LA BOETIE\\nCity:           FRANCE\\nState/Prov:     US\\nCountry:        FR\\nPostalCode:     75008\\nRegDate:        2015-11-08\\nUpdated:        2022-02-06\\nOfficePhone:    +33972316531\\nMailbox:        noc@weelax.fr\\nSource:         ARIN\\n\n\nPOCHandle:      AWB9-ARIN\\nIsRole:         Y\\nLastName:       ABUSE WEELAX BOX\\nFirstName:      \\nStreet:         128 RUE DE LA BOETIE\\nCity:           FRANCE\\nState/Prov:     US\\nCountry:        FR\\nPostalCode:     75008\\nRegDate:        2015-11-08\\nUpdated:        2022-02-06\\nOfficePhone:    +33972316531\\nMailbox:        abuse@weelax.fr\\nSource:         ARIN\\n"}
{"id": "OATI-6", "name": "OPEN ACCESS TECHNOLOGY INTERNA", "address": "", "street": "3660 TECHNOLOGY DR", "city": "MINNEAPOLIS", "state": "MN", "postalcode": "55418", "country": "US", "admin_id": "EAA11-ARIN", "tech_id": "CJR41-ARIN\\NEAA11-ARIN\\NNETWO675-ARIN\\NSVENS12-ARIN", "abuse_id": "NETWO675-ARIN", "mnt_id": "NETWO675-ARIN", "email": "", "domain": "oati.net", "created": "2016-10-22", "updated": "2021-01-26", "source": "arin", "raw": "OrgID:          OATI-6\\nOrgName:        OPEN ACCESS TECHNOLOGY INTERNA\\nCanAllocate:    \\nStreet:         3660 TECHNOLOGY DR\\nCity:           MINNEAPOLIS\\nState/Prov:     MN\\nCountry:        US\\nPostalCode:     55418\\nRegDate:        2016-10-22\\nUpdated:        2021-01-26\\nOrgDNSHandle:   CJR41-ARIN\\nOrgAbuseHandle: NETWO675-ARIN\\nOrgAdminHandle: EAA11-ARIN\\nOrgDNSHandle:   NETWO675-ARIN\\nOrgDNSHandle:   SVENS12-ARIN\\nOrgNOCHandle:   NETWO675-ARIN\\nOrgRoutingHandle:   NETWO675-ARIN\\nOrgTechHandle:  CJR41-ARIN\\nOrgTechHandle:  EAA11-ARIN\\nOrgTechHandle:  NETWO675-ARIN\\nOrgTechHandle:  SVENS12-ARIN\\nSource:         ARIN\\n\n\nPOCHandle:      SVENS12-ARIN\\nIsRole:         N\\nLastName:       Svensson\\nFirstName:      Tim\\nStreet:         3660 Technology Drive NE\\nCity:           Minneapolis\\nState/Prov:     MN\\nCountry:        US\\nPostalCode:     55418\\nRegDate:        2021-01-26\\nUpdated:        2021-01-26\\nOfficePhone:    +1-763-201-2000\\nMailbox:        tim.svensson@oati.net\\nSource:         ARIN\\n\n\nPOCHandle:      CJR41-ARIN\\nIsRole:         N\\nLastName:       Rasmussen\\nFirstName:      Corey\\nStreet:         3660 Technology Drive NE\\nCity:           Minneapolis\\nState/Prov:     MN\\nCountry:        US\\nPostalCode:     55418\\nRegDate:        2020-08-04\\nUpdated:        2020-08-04\\nOfficePhone:    +1-612-201-2036\\nMailbox:        corey.rasmussen@oati.net\\nSource:         ARIN\\n\n\nPOCHandle:      NETWO675-ARIN\\nIsRole:         Y\\nLastName:       Network Support\\nFirstName:      \\nStreet:         3660 Technology Drive NE\\nCity:           Minneapolis\\nState/Prov:     MN\\nCountry:        US\\nPostalCode:     55418\\nRegDate:        2004-10-22\\nUpdated:        2022-01-04\\nOfficePhone:    +1-763-201-2000\\nMailbox:        networknotify@oati.net\\nSource:         ARIN\\n\n\nPOCHandle:      EAA11-ARIN\\nIsRole:         N\\nLastName:       Amundson\\nFirstName:      Erik\\nStreet:         3660 Technology Drive NE\\nCity:           Minneapolis\\nState/Prov:     MN\\nCountry:        US\\nPostalCode:     55418\\nRegDate:        2004-10-22\\nUpdated:        2021-12-16\\nOfficePhone:    +1-763-201-2000\\nMailbox:        erik.amundson@oati.net\\nSource:         ARIN\\n"}
{"id": "BFREB", "name": "Briggs Freeman Sotheby's International Realty", "address": "", "street": "5600 W Lovers Ln. Ste. 224", "city": "Dallas", "state": "TX", "postalcode": "75209", "country": "US", "admin_id": "RDM90-ARIN", "tech_id": "RDM90-ARIN", "abuse_id": "RDM90-ARIN", "mnt_id": "RDM90-ARIN", "email": "", "domain": "briggsfreeman.com", "created": "2014-05-29", "updated": "2014-05-29", "source": "arin", "raw": "OrgID:          BFREB\\nOrgName:        Briggs Freeman Sotheby's International Realty\\nCanAllocate:    \\nStreet:         5600 W Lovers Ln. Ste. 224\\nCity:           Dallas\\nState/Prov:     TX\\nCountry:        US\\nPostalCode:     75209\\nRegDate:        2014-05-29\\nUpdated:        2014-05-29\\nOrgAbuseHandle: RDM90-ARIN\\nOrgAdminHandle: RDM90-ARIN\\nOrgNOCHandle:   RDM90-ARIN\\nOrgTechHandle:  RDM90-ARIN\\nSource:         ARIN\\n\n\nPOCHandle:      RDM90-ARIN\\nIsRole:         N\\nLastName:       Massey\\nFirstName:      Rocky\\nStreet:         5600 W Lovers Ln. Ste 224\\nCity:           Dallas\\nState/Prov:     TX\\nCountry:        US\\nPostalCode:     75209\\nRegDate:        2014-05-27\\nUpdated:        2016-06-15\\nOfficePhone:    +1-214-353-6650\\nMailbox:        rmassey@briggsfreeman.com\\nSource:         ARIN\\n"}
{"id": "SFG-48", "name": "SECURIAN FINANCIAL GROUP", "address": "", "street": "2960 RIVERSIDE DR", "city": "MACON", "state": "GA", "postalcode": "31204", "country": "US", "admin_id": "SHD2-ARIN", "tech_id": "SHD2-ARIN", "abuse_id": "SECUR162-ARIN\\NSHD2-ARIN", "mnt_id": "SHD2-ARIN", "email": "", "domain": "securian.com", "created": "2013-01-10", "updated": "2021-08-26", "source": "arin", "raw": "OrgID:          SFG-48\\nOrgName:        SECURIAN FINANCIAL GROUP\\nCanAllocate:    \\nStreet:         2960 RIVERSIDE DR\\nCity:           MACON\\nState/Prov:     GA\\nCountry:        US\\nPostalCode:     31204\\nRegDate:        2013-01-10\\nUpdated:        2021-08-26\\nOrgAbuseHandle: SECUR162-ARIN\\nOrgAbuseHandle: SHD2-ARIN\\nOrgAdminHandle: SHD2-ARIN\\nOrgDNSHandle:   SHD2-ARIN\\nOrgNOCHandle:   SHD2-ARIN\\nOrgRoutingHandle:   SHD2-ARIN\\nOrgTechHandle:  SHD2-ARIN\\nSource:         ARIN\\n\n\nPOCHandle:      SHD2-ARIN\\nIsRole:         Y\\nLastName:       Securian Help Desk\\nFirstName:      \\nStreet:         400 Robert Street North\\nCity:           St. Paul\\nState/Prov:     MN\\nCountry:        US\\nPostalCode:     55101-2098\\nRegDate:        2005-08-26\\nUpdated:        2021-08-17\\nOfficePhone:    +1-651-665-5000\\nMailbox:        nirequest@securian.com\\nSource:         ARIN\\n\n\nPOCHandle:      SECUR162-ARIN\\nIsRole:         Y\\nLastName:       Securian IMF\\nFirstName:      \\nStreet:         400 Robert Street North\\nCity:           St. Paul\\nState/Prov:     MN\\nCountry:        US\\nPostalCode:     55101-2098\\nRegDate:        2021-08-19\\nUpdated:        2021-08-19\\nOfficePhone:    +1-651-665-5000\\nMailbox:        ecsincidentmanagementforensics@securian.com\\nSource:         ARIN\\n"}